职位, 工资, 经验要求, 职位一级分类, 职位二级分类, 公司名称, 城市, 学历, 公司规模, 公司阶段, 公司业务领域
内容运营, 7, 1, 运营, 运营, 诚信贷, 北京, 大专, 15, 初创型, 移动互联网 · 金融
内容运营, 1, 不, 运营, 运营, 小肚皮App, 北京, 本科, 15, 成长型, 移动互联网
内容运营, 19, 1, 运营, 运营, 人人行, 北京, 本科, 500, 成熟型, 移动互联网 · 金融
内容运营, 11, 1, 运营, 运营, twinkle, 上海, 本科, 15, 初创型, 移动互联网 · 社交网络
内容运营, 5, 1, 运营, 运营, 挖豆app, 厦门, 大专, 15, 成长型, 移动互联网
内容运营, 6, 3, 运营, 运营, 灵犀金融, 杭州, 大专, 150, 上市公, 移动互联网 · 金融
内容运营, 2, 不, 运营, 运营, 棒呆Bon Day！, 上海, 学历不限, 15, 初创型, 教育 · 移动互联网
内容运营, 5, 应届毕业, 运营, 运营, 炫体, 上海, 大专, 15, 初创型, 移动互联网 · 社交网络
内容运营, 6, 1年以, 运营, 运营, 好实再商贸（深圳）有限公司, 深圳, 大专, 150, 成长型, 电子商务 · O2O
内容运营, 9, 1, 运营, 运营, 墨齐, 深圳, 本科, 15, 成长型, 移动互联网 · 教育
内容运营, 11, 1, 运营, 运营, 易保利, 深圳, 本科, 50, 成长型, 金融
内容运营, 6, 1, 运营, 运营, 充电网, 北京, 本科, 150, 成长型, 移动互联网 · O2O
内容运营, 6, 不, 运营, 运营, 搜道网, 杭州, 大专, 50, 成长型, 电子商务 · 社交网络
内容运营(实习生), 2, 不, 运营, 运营, 挖豆app, 厦门, 学历不限, 15, 成长型, 移动互联网
内容运营, 3, 应届毕业, 运营, 运营, 365日历, 北京, 本科, 50, 成长型, 移动互联网  · 社交网络
内容运营, 11, 3, 运营, 运营, 小圈, 上海, 本科, 50, 初创型, 移动互联网 · 社交网络
内容运营, 7, 1, 运营, 运营, 易加医, 杭州, 本科, 50, 成长型, 移动互联网 · O2O
内容运营, 5, 1, 运营, 运营, 掌驭科技(小白用车), 深圳, 大专, 15, 初创型, O2O · 数据服务
内容运营, 5, 1, 运营, 运营, 美妆心得, 杭州, 大专, 50, 成长型, 移动互联网
内容运营, 15, 3, 运营, 运营, 八点半网络, 上海, 本科, 50, 成长型, 移动互联网 · 数据服务
内容运营, 5, 应届毕业, 运营, 运营, 东方财富, 上海, 本科, 500, 上市公, 金融
内容运营, 6, 1, 运营, 运营, 悟空找房, 上海, 本科, 500, 成长型, 移动互联网 · O2O
内容运营, 6, 1, 运营, 运营, 大搜车, 杭州, 本科, 500, 成熟型, 移动互联网 · O2O
内容运营, 10, 3, 运营, 运营, 畅捷通, 北京, 本科, 500, 上市公, 移动互联网 · 企业服务
内容运营（社区）, 11, 1, 运营, 运营, 空空狐, 北京, 本科, 15, 成长型, 移动互联网
内容运营, 7, 1, 运营, 运营, ARC, 北京, 本科, 15, 上市公, 移动互联网 · 广告营销
内容运营, 7, 不, 运营, 运营, 元因信息科技, 广州, 本科, 15, 初创型, 移动互联网 · 企业服务
内容运营, 9, 1, 运营, 运营, 人言, 杭州, 学历不限, 15, 初创型, 移动互联网 · 社交网络
内容运营, 2, 不, 运营, 运营, 云家政, 上海, 学历不限, 50, 成长型, O2O
内容运营（杭州）, 9, 1, 运营, 运营, 天天投, 杭州, 本科, 15, 成长型, 移动互联网 · 金融
内容运营, 3, 1, 运营, 运营, 点通智库, 宁波, 本科, 15, 初创型, O2O · 企业服务
内容运营, 7, 1, 运营, 运营, 众有科技, 上海, 学历不限, 50, 初创型, 移动互联网 · O2O
内容运营, 4, 1, 运营, 编辑, 度假派, 广州, 本科, 15, 初创型, 旅游
内容运营, 10, 1, 运营, 运营, REnexTop, 上海, 学历不限, 15, 初创型, 社交网络 · 文化娱乐
内容运营, 5, 1, 运营, 运营, 盛成网络（妈妈网）, 广州, 本科, 150, 成长型, 移动互联网 · 社交网络
内容运营, 5, 1, 运营, 运营, 百星文化, 广州, 大专, 50, 初创型, 电子商务 · 文化娱乐
内容运营, 10, 3, 运营, 运营, 华邦股份, 深圳, 大专, 150, 初创型, 移动互联网 · 数据服务
内容运营, 3, 不, 运营, 运营, 朔雨, 上海, 学历不限, 15, 初创型, 移动互联网 · O2O
内容运营, 7, 1, 运营, 运营, 快抢车, 杭州, 大专, 50, 成长型, 移动互联网
内容运营, 1, 不, 运营, 运营, 度假派, 广州, 本科, 15, 初创型, 旅游
内容运营, 7, 1, 运营, 运营, 盛成网络（妈妈网）, 广州, 学历不限, 150, 成长型, 移动互联网 · 社交网络
内容运营, 9, 不, 产品, 产品经理, 开卷, 北京, 本科, 50, 初创型, 移动互联网
内容运营, 11, 1, 运营, 运营, 乐心微动, 广州, 大专, 500, 成熟型, 移动互联网 · 硬件
内容运营, 10, 不, 运营, 运营, 深圳市珠宝狮文化科技有限公司, 深圳, 大专, 15, 成长型, 分类信息 · 其他
内容运营, 9, 1, 运营, 运营, doyoudo, 北京, 本科, 15, 初创型, 教育 · 文化娱乐
内容运营, 10, 1, 运营, 运营, 金工场, 深圳, 本科, 15, 初创型, 移动互联网 · 电子商务
内容运营, 1, 不, 运营, 运营, 书趴, 哈尔滨, 学历不限, 15, 初创型, 移动互联网 · 社交网络
内容运营, 10, 1, 运营, 运营, 美妮萱, 杭州, 本科, 50, 初创型, 电子商务
内容运营, 8, 1, 运营, 运营, 梧桐创客, 深圳, 本科, 15, 初创型, 企业服务 · 金融
内容运营, 6, 不, 运营, 运营, 派时尚科技, 北京, 大专, 50, 成长型, 移动互联网
内容运营, 5, 不, 运营, 运营, 同创, 杭州, 本科, 50, 成长型, 移动互联网 · O2O
内容运营, 9, 1, 运营, 运营, 一财金融, 杭州, 本科, 15, 初创型, 金融
内容运营, 4, 1年以, 运营, 运营, 美柚, 厦门, 大专, 150, 成熟型, 移动互联网
内容运营, 4, 应届毕业, 运营, 运营, 八点半网络, 上海, 大专, 50, 成长型, 移动互联网 · 数据服务
内容运营, 11, 3, 运营, 运营, 正邦创意, 北京, 本科, 500, 成熟型, 移动互联网 · 广告营销
内容运营, 9, 1, 运营, 运营, 六帝网络, 北京, 本科, 15, 初创型, 电子商务 · O2O
内容运营, 1, 应届毕业, 运营, 运营, EMIE亿觅, 深圳, 本科, 50, 成长型, 生活服务  · 硬件
内容运营, 4, 1, 运营, 运营, 天下网商, 杭州, 大专, 150, 成长型, 移动互联网 · 广告营销
内容运营, 6, 1年以, 运营, 运营, 图述七十二, 北京, 本科, 15, 初创型, 移动互联网
内容运营, 5, 不, 运营, 运营, 文创国际, 北京, 本科, 50, 成长型, 移动互联网 · 电子商务
内容运营, 20, 5, 运营, 运营, 学乐, 杭州, 本科, 150, 成熟型, 教育
内容运营, 8, 1, 运营, 运营, 大焱科技, 深圳, 本科, 15, 初创型, 移动互联网 · O2O
内容运营, 6, 1, 运营, 运营, 三只狐狸, 无锡, 大专, 15, 初创型, 电子商务
内容运营, 9, 不, 运营, 运营, 三只狐狸, 无锡, 大专, 15, 初创型, 电子商务
内容运营, 10, 1, 运营, 运营, 正邦创意, 北京, 本科, 500, 成熟型, 移动互联网 · 广告营销
内容运营, 4, 1, 运营, 运营, 蹴鞠世界, 西安, 大专, 15, 初创型, 电子商务 · 文化娱乐
内容运营, 2, 不, 运营, 运营, 丸子地球, 杭州, 本科, 15, 成长型, 旅游
内容运营, 1, 不, 运营, 运营, ViewsTap, 宁波, 学历不限, 15, 初创型, 数据服务
内容运营, 6, 1, 运营, 运营, 好慷在线, 厦门, 学历不限, 150, 成长型, 生活服务
内容运营, 7, 3, 运营, 运营, 8868交易平台, 广州, 大专, 150, 成长型, 移动互联网 · 电子商务
内容运营, 6, 1, 运营, 运营, 资邦, 上海, 大专, 2000, 成熟型, 金融
内容运营, 2, 不, 运营, 运营, 易瘦跑步, 珠海, 学历不限, 15, 初创型, 移动互联网 · 硬件
内容运营, 4, 1, 运营, 运营, 蹴鞠世界, 西安, 大专, 15, 初创型, 电子商务 · 文化娱乐
内容运营, 6, 不, 运营, 运营, 火球科技, 杭州, 学历不限, 15, 初创型, 移动互联网 · 电子商务
内容运营, 7, 不, 运营, 运营, 知玩, 北京, 本科, 15, 初创型, 广告营销
内容运营, 6, 不, 运营, 运营, 55海淘, 上海, 本科, 150, 成长型, 电子商务
内容运营, 4, 1, 运营, 运营, 有测网, 南京, 大专, 15, 初创型, 电子商务 · 企业服务
内容运营, 14, 3, 运营, 运营, 买衣爽, 上海, 本科, 50, 成长型, 电子商务 · O2O
内容运营（实习生岗）, 2, 不, 运营, 运营, 火球科技, 杭州, 学历不限, 15, 初创型, 移动互联网 · 电子商务
内容运营, 9, 1, 运营, 运营, 优悦科技, 上海, 学历不限, 15, 成长型, 移动互联网 · 硬件
内容运营, 5, 不, 运营, 运营, 飞博共创, 厦门, 学历不限, 150, 初创型, 广告营销 · 文化娱乐
内容运营, 6, 1, 运营, 运营, 同尘世纪, 北京, 本科, 15, 初创型, 移动互联网
内容运营, 8, 1, 运营, 运营, 365日历, 北京, 本科, 50, 成长型, 移动互联网  · 社交网络
内容运营, 4, 1, 运营, 运营, 奢易购, 南昌, 大专, 15, 初创型, 移动互联网 · 电子商务
内容运营, 4, 不, 运营, 运营, 华创央广, 北京, 大专, 15, 成长型, 移动互联网 · 文化娱乐
内容运营, 9, 1, 运营, 运营, 谈成, 北京, 大专, 15, 初创型, 移动互联网 · 文化娱乐
内容运营, 7, 1, 运营, 运营, 长沙聚丰, 长沙, 大专, 150, 初创型, 移动互联网
内容运营, 5, 1年以, 运营, 运营, 58赶集集团, 北京, 本科, 2000, 上市公, 移动互联网
内容运营, 6, 3, 运营, 运营, 猪八戒网, 重庆, 学历不限, 500, 成熟型, 电子商务 · 生活服务
内容运营, 4, 1, 运营, 运营, 万年历, 重庆, 本科, 50, 成长型, 移动互联网
内容运营, 7, 1, 运营, 运营, 大通资本, 厦门, 大专, 500, 成熟型, 金融
内容运营, 9, 1, 运营, 运营, 跟投网络, 深圳, 大专, 15, 成长型, 移动互联网
内容运营, 4, 不, 运营, 运营, 有测网, 南京, 大专, 15, 初创型, 电子商务 · 企业服务
内容运营, 9, 3, 运营, 运营, 健康微能量, 北京, 本科, 50, 成长型, 移动互联网 · 医疗健康
内容运营, 10, 3, 运营, 运营, 逸创云客服, 北京, 大专, 50, 成长型, 移动互联网 · 企业服务
内容运营, 15, 3, 运营, 运营, 爱上旅游, 上海, 本科, 50, 成长型, 移动互联网 · 旅游
内容运营, 10, 3, 运营, 运营, 两把刷子, 北京, 大专, 150, 成长型, O2O
内容运营, 7, 1, 运营, 运营, 小宝家, 北京, 大专, 15, 初创型, 移动互联网 · 教育
内容运营, 4, 1, 运营, 运营, 聚份子, 苏州, 学历不限, 15, 初创型, 电子商务 · 数据服务
内容运营, 7, 1, 运营, 运营, 群队科技, 杭州, 学历不限, 15, 初创型, 移动互联网
内容运营, 4, 1, 运营, 运营, 诗诺软件, 武汉, 大专, 50, 成长型, 电子商务 · 企业服务
内容运营, 5, 1, 运营, 运营, 诚医APP, 北京, 本科, 15, 初创型, 移动互联网 · 医疗健康
内容运营, 9, 1, 运营, 运营, 鲜肉科技, 北京, 本科, 15, 初创型, 移动互联网 · O2O
内容运营, 5, 不, 运营, 编辑, 吧点科技, 杭州, 大专, 15, 初创型, 移动互联网
内容运营, 12, 1, 运营, 运营, 好德软件, 杭州, 本科, 50, 成长型, 移动互联网 · 电子商务
内容运营, 5, 不, 运营, 运营, 一九二四文化传播有限公司, 广州, 本科, 15, 初创型, 移动互联网 · 企业服务
内容运营, 7, 1, 运营, 运营, 百锐学堂, 杭州, 学历不限, 50, 成长型, 企业服务 · 教育
内容运营（美食相关）, 6, 不, 运营, 运营, 领耀东方, 深圳, 本科, 150, 上市公, 硬件
内容运营, 5, 不, 运营, 运营, 金数据, 西安, 本科, 15, 初创型, 企业服务
内容运营, 8, 3, 运营, 运营, 上海早点到餐饮管理有限公司, 上海, 本科, 50, 成长型, O2O
内容运营, 7, 不, 运营, 运营, 东家, 杭州, 学历不限, 50, 成长型, 移动互联网
内容运营, 4, 1, 运营, 运营, 趣住啊, 上海, 学历不限, 15, 初创型, 移动互联网 · 旅游
内容运营, 3, 不, 运营, 运营, 财鲸, 北京, 本科, 15, 初创型, 移动互联网 · 金融
内容运营, 9, 1, 运营, 运营, 健康微能量, 北京, 本科, 50, 成长型, 移动互联网 · 医疗健康
内容运营, 4, 1, 运营, 运营, 汇美HOOME, 广州, 大专, 150, 成长型, 电子商务 · O2O
内容运营, 15, 1, 运营, 运营, 房多多, 上海, 本科, 2000, 成熟型, 移动互联网 · O2O
内容运营, 4, 不, 运营, 运营, 装吧, 北京, 学历不限, 15, 初创型, 移动互联网
内容运营, 6, 1, 运营, 运营, 重庆时报, 重庆, 大专, 2000, 上市公, 文化娱乐
内容运营, 6, 不, 运营, 运营, 今日头条, 北京, 本科, 500, 成熟型, 移动互联网 · 数据服务
内容运营, 7, 1, 运营, 运营, 相约, 上海, 大专, 50, 成长型, 移动互联网 · 生活服务
内容运营, 6, 不, 运营, 运营, 创点客, 北京, 学历不限, 15, 初创型, 移动互联网
内容运营, 6, 3, 运营, 运营, Earth2113, 北京, 大专, 15, 成长型, 移动互联网 · 硬件
内容运营, 4, 1, 运营, 运营, 软通动力, 新乡, 本科, 2000, 上市公, 移动互联网 · 数据服务
内容运营, 3, 不, 运营, 运营, 学而思, 武汉, 大专, 500, 上市公, 移动互联网 · 教育
内容运营/文案策划, 9, 1, 运营, 运营, 奇趴停车, 北京, 本科, 15, 初创型, 移动互联网 · O2O
内容运营, 5, 1, 运营, 运营, 婚礼时光, 杭州, 本科, 15, 初创型, O2O · 社交网络
内容运营, 4, 1, 运营, 运营, 四维空间, 深圳, 本科, 15, 初创型, 移动互联网 · 电子商务
内容运营, 2, 不, 运营, 运营, 青驿, 深圳, 大专, 15, 初创型, 移动互联网 · 旅游
内容运营, 16, 5, 金融, 投融资, 36氪, 北京, 本科, 150, 成熟型, 移动互联网 · 电子商务
内容运营, 7, 1, 运营, 运营, 微漫网络, 上海, 学历不限, 15, 成长型, 移动互联网 · 社交网络
内容运营, 7, 1, 运营, 运营, 亿车科技, 深圳, 本科, 50, 成长型, 移动互联网 · 数据服务
内容运营, 4, 不, 运营, 运营, 树袋熊网络, 上海, 学历不限, 15, 初创型, 移动互联网 · 电子商务
内容运营, 7, 1, 运营, 运营, 玩范, 杭州, 本科, 15, 初创型, O2O · 文化娱乐
内容运营, 7, 不, 运营, 运营, 青春科技, 南京, 大专, 50, 初创型, 移动互联网
内容运营（互联网金融）, 7, 1, 运营, 运营, 海汇众筹, 广州, 本科, 15, 初创型, 移动互联网 · 金融
内容运营（二次元项目）, 5, 1年以, 运营, 运营, 呆呆阿卜, 苏州, 本科, 15, 初创型, 移动互联网 · O2O
内容运营, 3, 不, 运营, 运营, 率特教育, 北京, 学历不限, 15, 初创型, 教育 · 旅游
内容运营, 6, 不, 运营, 运营, 玩自驾，玩遍全世界！, 北京, 本科, 15, 初创型, 旅游 · 社交网络
内容运营, 4, 1, 运营, 运营, 链家地产, 上海, 本科, 2000, 初创型, O2O · 其他
内容运营, 9, 1, 运营, 运营, 传太医, 北京, 本科, 50, 成长型, O2O · 医疗健康
内容运营, 2, 不, 运营, 运营, 爱合伙, 上海, 本科, 15, 初创型, 移动互联网 · 社交网络
内容运营, 6, 不, 运营, 运营, 派对网络, 杭州, 本科, 15, 初创型, 社交网络 · O2O
内容运营, 5, 1, 运营, 运营, 巷陌, 北京, 大专, 15, 初创型, 移动互联网
内容运营, 5, 1, 运营, 运营, 熙浪信息, 杭州, 大专, 150, 上市公, 电子商务
内容运营, 5, 不, 运营, 运营, 中国保税网, 深圳, 大专, 15, 初创型, 电子商务 · O2O
内容运营, 5, 1, 运营, 运营, 捷瑞嘉, 北京, 本科, 15, 初创型, 医疗健康 · 企业服务
内容运营, 6, 1, 运营, 运营, 孩子通－－通向未来、通向梦想, 上海, 本科, 15, 初创型, 移动互联网 · 教育
内容运营, 6, 1, 运营, 运营, 乾和晟云, 北京, 本科, 500, 成长型, 电子商务
(实习)内容运营, 3, 不, 运营, 运营, 葱课, 杭州, 学历不限, 15, 成长型, 移动互联网 · 教育
内容运营, 6, 1, 运营, 运营, 天下钓鱼, 上海, 学历不限, 15, 初创型, 移动互联网 · 社交网络
内容运营, 5, 不, 运营, 运营, 托福Easy姐, 北京, 大专, 15, 成长型, 移动互联网
内容运营, 9, 1, 运营, 运营, 斗图神器, 北京, 本科, 15, 成长型, 移动互联网 · 社交网络
内容运营, 7, 1, 运营, 运营, 天云, 上海, 学历不限, 150, 成长型, 移动互联网 · 数据服务
内容运营, 1, 不, 运营, 运营, 房小宝, 广州, 学历不限, 15, 初创型, 移动互联网 · 生活服务
内容运营, 5, 不, 运营, 运营, 食货, 杭州, 学历不限, 15, 初创型, 移动互联网 · 社交网络
内容运营, 1, 不, 运营, 运营, 学投网, 深圳, 大专, 15, 初创型, 企业服务 · 金融
内容运营, 3, 不, 运营, 运营, 匠物|ArtiWares, 杭州, 学历不限, 15, 初创型, 移动互联网 · O2O
内容运营, 4, 不, 运营, 运营, 化妆师联盟, 上海, 大专, 15, 初创型, 移动互联网 · O2O
内容运营, 7, 1, 运营, 运营, 西瓜头, 北京, 本科, 50, 成长型, O2O
内容运营, 9, 3, 运营, 运营, 蓝帕科技, 北京, 本科, 150, 成长型, 移动互联网 · 教育
内容运营, 7, 1, 运营, 运营, 卷皮, 深圳, 本科, 500, 成长型, 电子商务
内容运营, 2, 不, 运营, 运营, 实现, 北京, 学历不限, 15, 初创型, 移动互联网 · 社交网络
内容运营, 5, 不, 运营, 运营, 美秒科技, 北京, 学历不限, 15, 成长型, 移动互联网 · 电子商务
内容运营, 9, 不, 运营, 运营, 嗅嗅, 杭州, 本科, 15, 初创型, 移动互联网 · 企业服务
内容运营, 6, 应届毕业, 运营, 运营, 爱合伙, 上海, 本科, 15, 初创型, 移动互联网 · 社交网络
内容运营, 4, 不, 运营, 运营, 智乐活, 北京, 本科, 15, 初创型, 移动互联网
内容运营, 7, 1, 运营, 运营, 途走家, 北京, 大专, 15, 初创型, 电子商务 · 金融
内容运营, 3, 不, 运营, 运营, 实现, 北京, 学历不限, 15, 初创型, 移动互联网 · 社交网络
内容运营, 6, 不, 运营, 运营, 广州珍优软件科技有限公司, 广州, 本科, 15, 初创型, 移动互联网 · 电子商务
内容运营, 7, 1, 运营, 运营, 车轮互联, 上海, 大专, 150, 成长型, 移动互联网
内容运营, 9, 1, 运营, 运营, 趣乐科技（百万琴友家园）, 北京, 本科, 15, 成长型, 移动互联网 · 硬件
内容运营, 10, 1, 运营, 运营, 车艺师, 广州, 本科, 15, 初创型, O2O
内容运营, 5, 不, 运营, 运营, 第一风景, 北京, 大专, 15, 初创型, 电子商务 · 文化娱乐
内容运营, 6, 1, 运营, 运营, 艾佳生活, 南京, 本科, 50, 初创型, 电子商务
内容运营, 5, 1, 运营, 运营, 珍岛集团, 上海, 本科, 500, 初创型, 数据服务 · 广告营销
内容运营, 7, 1, 运营, 运营, 优分期, 北京, 本科, 500, 成长型, 电子商务 · 金融
内容运营, 5, 1年以, 运营, 运营, 萌小芽, 广州, 本科, 15, 初创型, 移动互联网
内容运营, 7, 1, 运营, 运营, 飞客茶馆, 上海, 本科, 15, 成长型, 社交网络 · 旅游
内容运营, 6, 不, 运营, 运营, 世纪良品, 青岛, 大专, 50, 上市公, 电子商务 · 广告营销
内容运营, 4, 1, 运营, 运营, 联创科技, 武汉, 大专, 15, 初创型, 移动互联网 · 教育
内容运营, 2, 不, 运营, 运营, 寻牛, 北京, 本科, 15, 成长型, 金融
内容运营, 6, 1, 运营, 运营, Chargerlink, 北京, 本科, 150, 成长型, 移动互联网 · 数据服务
内容运营, 5, 1, 运营, 运营, 巨鼎, 深圳, 大专, 500, 成长型, 医疗健康
内容运营, 6, 1, 运营, 运营, 壤歌, 上海, 学历不限, 15, 初创型, 移动互联网 · 企业服务
内容运营, 6, 1, 运营, 运营, 世纪良品, 青岛, 大专, 50, 上市公, 电子商务 · 广告营销
内容运营, 5, 不, 运营, 运营, 光环国际, 北京, 大专, 150, 成长型, 教育
内容运营, 2, 1, 运营, 运营, 杭州帮实投资管理有限公司, 杭州, 本科, 15, 成长型, 金融
内容运营, 6, 不, 运营, 运营, 扎根儿教育, 北京, 学历不限, 15, 初创型, 移动互联网 · 教育
内容运营, 9, 1, 运营, 运营, 亚厦蘑菇+, 杭州, 本科, 150, 成长型, 移动互联网
内容运营, 7, 1, 运营, 运营, 合晟网络, 上海, 本科, 15, 初创型, 社交网络 · 旅游
内容运营, 8, 1, 运营, 运营, 盛川康健, 北京, 大专, 150, 成长型, 移动互联网
内容运营, 6, 1, 运营, 运营, 美宝, 北京, 学历不限, 15, 初创型, 移动互联网 · 电子商务
内容运营, 4, 1, 运营, 运营, 星梦汇, 厦门, 学历不限, 15, 初创型, 移动互联网 · 文化娱乐
内容运营, 4, 不, 运营, 运营, 每天读点故事, 北京, 本科, 15, 成长型, 移动互联网
内容运营, 9, 不, 运营, 运营, 团建宝, 北京, 大专, 50, 成长型, 移动互联网 · 企业服务
内容运营, 6, 1, 运营, 运营, 斑马骑士, 北京, 本科, 15, 初创型, 移动互联网 · 教育
内容运营, 4, 不, 运营, 运营, 美秒科技, 北京, 大专, 15, 成长型, 移动互联网 · 电子商务
内容运营, 4, 不, 运营, 运营, 装吧, 北京, 学历不限, 15, 初创型, 移动互联网
内容运营, 5, 1, 运营, 运营, 一彩票, 广州, 大专, 50, 初创型, 移动互联网 · 电子商务
内容运营, 8, 1, 运营, 运营, 自如网, 北京, 本科, 2000, 成熟型, 移动互联网 · O2O
内容运营, 15, 不, 运营, 运营, 蚁国科技, 杭州, 本科, 50, 成长型, 移动互联网
内容运营, 8, 不, 运营, 运营, 卡惠, 北京, 大专, 15, 初创型, 移动互联网 · 金融
内容运营, 4, 不, 运营, 编辑, 滴答网, 深圳, 大专, 15, 初创型, 移动互联网 · 教育
内容运营, 10, 不, 运营, 运营, 寻美客公司, 北京, 学历不限, 15, 初创型, 文化娱乐 · 其他
内容运营, 6, 1, 运营, 运营, 倍爱, 深圳, 学历不限, 15, 成长型, 电子商务 · 生活服务
内容运营, 7, 1, 运营, 运营, 青春科技, 南京, 大专, 50, 初创型, 移动互联网
内容运营, 4, 不, 运营, 运营, ZUO设计, 上海, 本科, 15, 初创型, 移动互联网 · 文化娱乐
内容运营, 9, 1, 运营, 运营, 味库, 北京, 本科, 50, 成长型, 生活服务
内容运营, 8, 1, 运营, 运营, 72变, 北京, 本科, 15, 成长型, 硬件
内容运营, 9, 1, 运营, 运营, 盛川康健, 北京, 大专, 150, 成长型, 移动互联网
内容运营, 1, 不, 运营, 运营, 西部动力, 北京, 大专, 15, 成长型, 移动互联网
内容运营, 4, 1, 运营, 运营, 漫娱, 广州, 学历不限, 15, 初创型, 移动互联网 · 金融
内容运营, 6, 不, 运营, 运营, 吃不胖, 北京, 大专, 15, 初创型, O2O
内容运营, 4, 应届毕业, 运营, 运营, 悦众筹, 杭州, 本科, 15, 初创型, 移动互联网 · 广告营销
内容运营, 6, 1, 运营, 运营, 贝格畅斯, 成都, 大专, 50, 成长型, 移动互联网
内容运营, 3, 不, 运营, 运营, 时刻互动, 南昌, 学历不限, 15, 初创型, 移动互联网 · 广告营销
内容运营, 4, 1, 运营, 运营, 创源技术, 石家庄, 本科, 15, 初创型, 移动互联网 · 电子商务
内容运营, 3, 不, 运营, 运营, 暴风影音, 北京, 本科, 500, 上市公, 文化娱乐
内容运营（文案）, 7, 1, 运营, 运营, 归墟电子, 上海, 本科, 15, 初创型, 移动互联网 · 其他
内容运营, 6, 1, 运营, 运营, 舍品, 杭州, 本科, 15, 初创型, 移动互联网
内容运营, 4, 不, 运营, 运营, 云信科技, 北京, 大专, 15, 成长型, 移动互联网
内容运营, 5, 1, 运营, 运营, 青墨科技, 上海, 大专, 50, 成长型, 移动互联网
内容运营, 8, 1, 运营, 运营, 掌门1对1在线教育, 上海, 本科, 50, 成长型, 移动互联网 · 教育
内容运营, 1, 应届毕业, 运营, 运营, 小黑裙, 杭州, 学历不限, 15, 初创型, 移动互联网 · O2O
内容运营, 4, 1, 运营, 运营, 广旭广告, 广州, 大专, 150, 上市公, 企业服务 · 文化娱乐
内容运营, 4, 不, 运营, 运营, 趣吧, 杭州, 学历不限, 15, 初创型, 移动互联网 · 文化娱乐
内容运营, 4, 1, 运营, 运营, 传客是一款选择性轻社交软件, 上海, 大专, 15, 初创型, 移动互联网
内容运营, 12, 3, 运营, 运营, 全利网, 北京, 大专, 15, 初创型, 移动互联网 · 金融
内容运营助理, 2, 不, 运营, 运营, 棒呆Bon Day！, 上海, 本科, 15, 初创型, 教育 · 移动互联网
内容运营, 7, 1, 运营, 运营, 奇葩团网络科技, 上海, 本科, 15, 初创型, 社交网络 · 企业服务
内容运营, 7, 1, 运营, 运营, 易聚科技, 北京, 本科, 50, 成长型, 社交网络 · 金融
内容运营(金融), 8, 3, 运营, 运营, 思果网络, 上海, 本科, 15, 初创型, 移动互联网 · 社交网络
内容运营, 9, 不, 运营, 运营, 足球魔方, 上海, 本科, 50, 成长型, 移动互联网 · 电子商务
内容运营, 6, 1, 运营, 运营, 酒咔嚓, 广州, 本科, 15, 初创型, 移动互联网 · 生活服务
内容运营, 3, 1, 运营, 运营, 睿智教育, 杭州, 大专, 50, 初创型, 电子商务 · 教育
内容运营, 7, 不, 运营, 运营, 青年电影志, 北京, 本科, 15, 初创型, 社交网络 · 文化娱乐
内容运营, 7, 1, 运营, 运营, 电鳗互动传媒, 上海, 大专, 15, 初创型, 移动互联网 · 广告营销
内容运营, 8, 1, 运营, 运营, 易聚科技, 北京, 本科, 150, 成长型, 金融
内容运营/编辑, 6, 不, 运营, 运营, 同花顺, 杭州, 本科, 2000, 上市公, 金融
内容运营, 4, 不, 运营, 运营, 疯火科技, 北京, 学历不限, 15, 初创型, 硬件
内容运营, 7, 1, 运营, 运营, 帮定网, 上海, 大专, 50, 初创型, 移动互联网 · 电子商务
