内容运营, 7, 1, 运营, 运营, 从泰, 杭州, 大专, 15, 初创型, 金融
内容运营, 4, 1, 运营, 运营, 敏沁, 上海, 本科, 15, 初创型, O2O
内容运营, 6, 1, 运营, 运营, ARC, 北京, 大专, 15, 上市公, 移动互联网 · 广告营销
内容运营, 6, 1, 运营, 编辑, 快乐麻花, 北京, 本科, 50, 成长型, 移动互联网
内容运营, 6, 1, 运营, 运营, 淘乐创想, 北京, 大专, 15, 初创型, 移动互联网
内容运营, 6, 不, 运营, 运营, 西柚, 北京, 学历不限, 50, 成长型, 移动互联网 · 教育
内容运营（任务规则型运营）, 6, 1, 运营, 运营, 优分期, 北京, 本科, 500, 成长型, 电子商务 · 金融
内容运营, 7, 1, 运营, 运营, 小白财税, 上海, 本科, 15, 初创型, 移动互联网 · 企业服务
内容运营, 6, 不, 运营, 运营, 桔子空间, 上海, 本科, 15, 初创型, 企业服务 · 其他
内容运营, 7, 3, 运营, 运营, 鑫家园移民, 北京, 本科, 15, 初创型, 其他
内容运营, 4, 1, 运营, 运营, 链家地产, 上海, 本科, 2000, 初创型, O2O · 其他
内容运营, 5, 1, 运营, 运营, U家工场, 成都, 本科, 50, 初创型, 生活服务 · 其他
内容运营, 4, 1, 运营, 运营, 云聚互动, 成都, 大专, 15, 成长型, 移动互联网 · 广告营销
内容运营, 3, 不, 运营, 运营, 至爱旅行, 北京, 学历不限, 15, 初创型, 移动互联网 · 旅游
内容运营, 7, 不, 运营, 运营, 新媒体，创业服务，技术创新型, 无锡, 学历不限, 15, 初创型, 移动互联网 · 教育
内容运营, 4, 1, 运营, 运营, 淘老外, 苏州, 大专, 15, 初创型, 移动互联网 · 教育
内容运营, 3, 不, 运营, 运营, 爱唱, 北京, 学历不限, 15, 成长型, 移动互联网
内容运营, 5, 不, 运营, 运营, 中国保税网, 深圳, 大专, 15, 初创型, 电子商务 · O2O
内容运营, 11, 1, 运营, 运营, 美院帮, 北京, 本科, 15, 初创型, 移动互联网 · 教育
内容运营, 7, 不, 运营, 运营, 当代金融, 北京, 本科, 500, 上市公, 移动互联网 · 金融
内容运营, 3, 不, 运营, 运营, 昂腾科技, 北京, 学历不限, 15, 成长型, 移动互联网
内容运营, 6, 不, 运营, 运营, 极互动, 北京, 学历不限, 15, 初创型, 移动互联网 · 广告营销
内容运营, 7, 1, 运营, 编辑, Uli优礼, 北京, 本科, 15, 成长型, 移动互联网 · 电子商务
内容运营, 7, 1, 运营, 运营, 蓝麦电商, 杭州, 大专, 50, 上市公, 移动互联网 · 电子商务
内容运营, 6, 1, 运营, 运营, 万特珠宝, 北京, 本科, 15, 初创型, 电子商务 · 其他
内容运营, 14, 3, 运营, 运营, 易跃移动, 上海, 本科, 150, 成长型, 移动互联网 · 游戏
内容运营, 9, 不, 运营, 运营, 住百家, 北京, 学历不限, 150, 成熟型, O2O · 旅游
内容运营, 16, 5, 运营, 运营, 猎豹移动, 北京, 本科, 500, 上市公, 移动互联网 · 信息安全
内容运营, 7, 1年以, 运营, 运营, 在这儿, 东莞, 大专, 15, 成长型, 移动互联网 · 企业服务
内容运营, 6, 不, 运营, 编辑, 博朗科技, 广州, 学历不限, 15, 初创型, O2O · 生活服务
内容运营, 10, 3, 运营, 运营, 欢旅网, 北京, 学历不限, 15, 初创型, 旅游
内容运营, 15, 3, 运营, 运营, 九维网络科技, 深圳, 大专, 150, 成长型, 移动互联网 · 社交网络
内容运营, 14, 3, 运营, 运营, 买衣爽, 上海, 本科, 50, 成长型, 电子商务 · O2O
内容运营, 3, 不, 运营, 运营, 男闺蜜, 厦门, 大专, 15, 初创型, 移动互联网 · 社交网络
内容运营, 6, 1, 运营, 运营, 神灯财富, 武汉, 大专, 500, 成熟型, 移动互联网 · 金融
内容运营, 2, 1年以, 运营, 运营, 车与轮, 北京, 本科, 15, 初创型, 广告营销
内容运营, 5, 1, 运营, 运营, 大牛金服, 北京, 大专, 15, 初创型, 移动互联网
内容运营, 8, 1, 运营, 运营, “燃”o2o健身 【森融网络】, 上海, 本科, 150, 成长型, 移动互联网
内容运营, 8, 1, 运营, 运营, 易聚科技, 北京, 本科, 150, 成长型, O2O · 金融
内容运营, 6, 1, 运营, 运营, 葡萄互动, 北京, 本科, 15, 初创型, 移动互联网 · 社交网络
内容运营, 8, 1, 运营, 运营, 云联科技, 广州, 学历不限, 15, 初创型, 移动互联网 · 企业服务
内容运营, 2, 不, 运营, 运营, 广州风传网络科技有限公司, 广州, 本科, 15, 初创型, 移动互联网 · 生活服务
内容运营, 6, 不, 运营, 运营, 葱课, 杭州, 学历不限, 15, 成长型, 移动互联网 · 教育
内容运营（资深）, 11, 3, 运营, 运营, 磨房网, 深圳, 本科, 50, 成长型, 移动互联网 · 旅游
内容运营, 6, 1年以, 运营, 运营, 易联互动, 北京, 大专, 50, 成长型, 移动互联网
内容运营, 5, 不, 运营, 运营, 美景听听App, 北京, 本科, 15, 初创型, 移动互联网 · 旅游
内容运营, 6, 不, 运营, 运营, 村村乐, 杭州, 本科, 50, 成熟型, 移动互联网 · 社交网络
内容运营, 5, 1, 运营, 运营, 鹰尚文化, 深圳, 学历不限, 15, 初创型, 文化娱乐 · 企业服务
内容运营, 5, 不, 运营, 运营, 育琛信息, 上海, 本科, 15, 初创型, 移动互联网 · O2O
内容运营, 7, 不, 运营, 运营, 小店宝, 北京, 学历不限, 15, 成长型, O2O · 移动互联网
内容运营, 7, 1, 运营, 运营, 近吧科技, 北京, 本科, 15, 初创型, 移动互联网 · 社交网络
内容运营, 6, 1, 运营, 运营, 葡萄集, 深圳, 大专, 15, 成长型, 移动互联网
内容运营, 5, 1, 运营, 运营, 发现周末, 北京, 本科, 15, 成长型, 移动互联网 · 生活服务
内容运营, 10, 1, 运营, 运营, 青驿, 深圳, 大专, 15, 初创型, 移动互联网 · 旅游
内容运营, 3, 不, 运营, 运营, 惠生活, 南京, 本科, 150, 初创型, 电子商务
内容运营, 1, 不, 运营, 运营, PencilPR, 上海, 学历不限, 15, 初创型, 广告营销 · 社交网络
内容运营, 15, 1, 运营, 运营, 实现, 北京, 本科, 15, 初创型, 移动互联网 · 社交网络
内容运营, 2, 不, 运营, 运营, 搜狐媒体, 北京, 学历不限, 2000, 上市公, 移动互联网 · 广告营销
内容运营, 8, 不, 运营, 运营, 声牙科技, 深圳, 学历不限, 15, 成长型, 移动互联网 · O2O
内容运营, 1, 不, 运营, 运营, 小岚燕, 广州, 本科, 15, 初创型, O2O
内容运营, 11, 1, 运营, 运营, 捷开科技, 北京, 本科, 2000, 成熟型, 移动互联网
内容运营, 5, 不, 运营, 运营, 托福Easy姐, 北京, 学历不限, 15, 成长型, 移动互联网
内容运营, 6, 不, 运营, 运营, 苏河汇, 上海, 大专, 50, 成长型, 金融
内容运营, 6, 1, 运营, 运营, 竞彩258, 北京, 大专, 50, 初创型, 电子商务 · 文化娱乐
内容运营, 8, 1, 运营, 运营, 易聚科技, 北京, 本科, 150, 成长型, 金融
内容运营, 4, 1, 运营, 运营, 链家地产, 上海, 大专, 2000, 初创型, O2O · 其他
内容运营, 4, 不, 运营, 运营, 蜻蜓fm, 北京, 学历不限, 150, 成熟型, 移动互联网 · 文化娱乐
内容运营/金融社区, 22, 不, 运营, 运营, 微投-高富帅级互联网金融项目, 上海, 本科, 50, 成长型, 移动互联网 · 金融
内容运营, 6, 1, 运营, 运营, 爱车阵, 北京, 本科, 15, 初创型, 移动互联网
内容运营, 7, 1, 运营, 运营, 微明星, 深圳, 学历不限, 15, 初创型, 移动互联网 · 电子商务
内容运营, 12, 3, 市场与销售, 市场/营销, 销售易, 北京, 本科, 150, 成熟型, 移动互联网 · 数据服务
内容运营, 1, 不, 运营, 运营, FITTING, 北京, 学历不限, 15, 初创型, 移动互联网 · 社交网络
内容运营, 10, 1, 运营, 运营, 中嘉和信, 北京, 大专, 50, 初创型, 数据服务
内容运营, 3, 不, 运营, 运营, 丁丁租房, 北京, 本科, 2000, 成熟型, 移动互联网 · 电子商务
内容运营, 10, 1, 运营, 运营, 南牛科技, 上海, 大专, 15, 初创型, 移动互联网 · 金融
内容运营, 7, 1, 运营, 运营, YY Inc, 广州, 本科, 2000, 上市公, 移动互联网
内容运营, 6, 3, 运营, 运营, 马邦车宝, 广州, 大专, 50, 成长型, 移动互联网
内容运营, 6, 1, 运营, 运营, 追梦网, 北京, 本科, 50, 成长型, 旅游 · 生活服务
内容运营, 4, 不, 运营, 运营, FITTING, 北京, 学历不限, 15, 初创型, 移动互联网 · 社交网络
内容运营, 4, 不, 运营, 运营, 杭州烘培, 杭州, 本科, 15, 成长型, 电子商务
内容运营, 7, 1年以, 运营, 运营, 合众天成, 北京, 本科, 150, 初创型, 移动互联网 · 数据服务
内容运营, 2, 不, 运营, 运营, 搜狐媒体, 北京, 本科, 2000, 上市公, 移动互联网 · 广告营销
内容运营, 6, 1, 运营, 运营, 疯兔盒子, 北京, 本科, 15, 初创型, 电子商务 · O2O
内容运营, 6, 不, 运营, 运营, 金榕网络, 杭州, 本科, 15, 初创型, 移动互联网 · 数据服务
内容运营, 3, 不, 运营, 运营, 途伴, 北京, 学历不限, 15, 初创型, 移动互联网 · O2O
内容运营, 7, 1, 运营, 运营, Oracleen, 北京, 本科, 15, 初创型, 移动互联网 · 硬件
内容运营（网娱）, 6, 1, 运营, 运营, 杭州米趣, 杭州, 大专, 150, 成长型, 移动互联网
内容运营, 6, 1, 运营, 运营, 优众传播, 北京, 本科, 15, 初创型, 广告营销 · 文化娱乐
内容运营（实习生）, 2, 不, 运营, 运营, 移民帮, 北京, 本科, 15, 初创型, 金融
内容运营, 5, 1, 运营, 运营, 嘉杰集团, 长沙, 大专, 150, 成长型, 移动互联网
内容运营, 7, 1年以, 运营, 运营, 北京搜房科技发展有限公司, 北京, 本科, 2000, 上市公, 移动互联网 · 金融
内容运营, 7, 不, 运营, 运营, 云力, 北京, 本科, 15, 初创型, 移动互联网 · 社交网络
内容运营专员, 7, 1, 运营, 运营, 中科金石, 长沙, 本科, 15, 初创型, 移动互联网 · O2O
内容运营, 4, 1, 运营, 运营, 小闲在线, 重庆, 大专, 50, 初创型, 移动互联网 · 游戏
内容运营（联想控股）, 10, 1, 运营, 运营, 神州智联, 北京, 本科, 50, 成长型, 移动互联网 · 教育
内容运营, 5, 不, 运营, 运营, 谷武科技, 北京, 本科, 50, 成长型, 移动互联网 · 电子商务
内容运营, 1, 不, 运营, 运营, 快捷键, 深圳, 大专, 15, 初创型, 移动互联网 · 教育
内容运营, 9, 3, 运营, 运营, 全通教育, 杭州, 大专, 500, 上市公, 移动互联网 · 教育
内容运营, 12, 不, 运营, 运营, 猿题库, 北京, 本科, 50, 成熟型, 移动互联网 · 教育
内容运营, 4, 不, 运营, 运营, 石头兄弟网络科技, 北京, 学历不限, 15, 初创型, 移动互联网 · 社交网络
内容运营, 4, 不, 运营, 运营, 动脉互联, 济南, 本科, 15, 初创型, 移动互联网 · 文化娱乐
内容运营, 9, 1, 运营, 运营, 快医网, 北京, 本科, 50, 成长型, 移动互联网 · 医疗健康
内容运营, 7, 1, 运营, 编辑, 直订网, 北京, 大专, 50, 初创型, 移动互联网 · 生活服务
内容运营/文案, 7, 1, 运营, 运营, 阿里通科技, 深圳, 大专, 150, 初创型, 移动互联网 · 电子商务
内容运营, 5, 不, 运营, 运营, 兼职宝, 北京, 学历不限, 15, 成长型, 企业服务
内容运营, 9, 1, 运营, 运营, 来人到家, 北京, 大专, 500, 初创型, O2O
内容运营, 10, 1, 运营, 运营, 上海亲冒号信息科技有限公司, 上海, 本科, 50, 成长型, 移动互联网 · 医疗健康
内容运营, 11, 不, 运营, 运营, Anker, 长沙, 大专, 150, 初创型, 电子商务
内容运营, 5, 不, 运营, 运营, 醒客科技, 北京, 学历不限, 15, 初创型, 移动互联网
内容运营, 1, 不, 运营, 运营, 派络特, 杭州, 学历不限, 50, 初创型, 移动互联网 · 社交网络
内容运营, 7, 1, 运营, 运营, MCAKE, 北京, 本科, 150, 成长型, 移动互联网 · 电子商务
内容运营, 6, 1, 运营, 运营, 窝+社区, 上海, 本科, 50, 初创型, 移动互联网 · O2O
内容运营（实习生）, 2, 不, 运营, 运营, 智乐活, 北京, 本科, 15, 初创型, 移动互联网
内容运营, 6, 1, 运营, 运营, 深圳油菜花科技有限公司, 深圳, 大专, 15, 初创型, 移动互联网 · 招聘
内容运营, 11, 不, 运营, 运营, 快剪星客多, 北京, 学历不限, 50, 成长型, O2O · 生活服务
内容运营, 6, 1, 运营, 运营, Klook 客路旅行, 深圳, 本科, 15, 成长型, 移动互联网 · 旅游
内容运营, 3, 不, 运营, 运营, 星宿工坊, 上海, 学历不限, 15, 初创型, 社交网络 · 文化娱乐
内容运营, 10, 1, 运营, 运营, 呱呱学车, 北京, 大专, 15, 成长型, 移动互联网 · O2O
内容运营（可实习）, 5, 不, 运营, 运营, 尘埃, 杭州, 学历不限, 15, 初创型, 移动互联网 · 数据服务
内容运营, 10, 1, 运营, 运营, 中嘉和信, 北京, 本科, 50, 初创型, 数据服务
内容运营, 4, 不, 运营, 运营, 文思海辉, 北京, 学历不限, 2000, 成熟型, 移动互联网 · 企业服务
内容运营, 6, 3, 运营, 运营, 奋斗者, 厦门, 本科, 15, 初创型, 金融 · 移动互联网
内容运营, 4, 1, 运营, 运营, 樱桃优品, 深圳, 本科, 50, 初创型, 电子商务
内容运营, 6, 1, 运营, 运营, 乐行科技, 西安, 大专, 15, 初创型, 移动互联网
内容运营, 6, 1, 运营, 运营, 时光轨记, 北京, 本科, 15, 初创型, 移动互联网 · 社交网络
内容运营, 4, 不, 运营, 运营, 创享者, 杭州, 学历不限, 50, 成长型, 移动互联网 · O2O
内容运营, 4, 1, 运营, 运营, 悠圈网络, 上海, 大专, 15, 初创型, 移动互联网 · 广告营销
内容运营, 4, 不, 运营, 运营, 北纬56, 上海, 学历不限, 15, 成长型, 电子商务 · O2O
内容运营, 8, 3, 运营, 运营, 博雅汇聚, 北京, 大专, 15, 初创型, 移动互联网 · 教育
内容运营, 6, 1, 运营, 运营, 家家送火锅, 北京, 本科, 50, 初创型, 移动互联网 · 其他
内容运营, 4, 应届毕业, 运营, 运营, 浙江核新同花顺网络信息股份有限公司, 杭州, 本科, 500, 上市公, 金融
内容运营, 8, 1, 运营, 运营, 成嘉科技, 北京, 本科, 50, 成长型, 移动互联网
内容运营, 9, 1, 运营, 运营, 醒客科技, 北京, 学历不限, 15, 初创型, 移动互联网
内容运营, 14, 1, 运营, 运营, 美壹律, 上海, 大专, 50, 成长型, 移动互联网
内容运营（文案）, 9, 1, 运营, 运营, 伯乔, 上海, 本科, 50, 初创型, 金融
内容运营, 5, 不, 运营, 运营, 借客, 杭州, 学历不限, 15, 初创型, 移动互联网 · 金融
内容运营, 8, 1, 运营, 运营, 优幼母婴, 上海, 大专, 150, 初创型, O2O · 生活服务
内容运营, 6, 1, 运营, 运营, 智慧盒子, 厦门, 学历不限, 15, 初创型, 移动互联网 · 文化娱乐
内容运营, 5, 不, 运营, 运营, 北京范加科技, 北京, 本科, 15, 初创型, 电子商务 · 社交网络
内容运营, 4, 不, 运营, 运营, 星宿工坊, 上海, 学历不限, 15, 初创型, 社交网络 · 文化娱乐
内容运营, 7, 1, 运营, 运营, 摇篮网, 北京, 大专, 150, 成长型, 移动互联网
内容运营, 4, 应届毕业, 运营, 运营, 云信科技, 北京, 学历不限, 15, 成长型, 移动互联网
内容运营/网站编辑, 4, 1, 运营, 运营, 天津小猫, 天津, 大专, 15, 初创型, 移动互联网 · 数据服务
内容运营, 6, 1, 运营, 运营, 九十度生活, 北京, 大专, 15, 初创型, 移动互联网
内容运营, 7, 1, 运营, 运营, 数据公园, 北京, 本科, 15, 初创型, 移动互联网 · 数据服务
内容运营, 4, 不, 运营, 运营, 美食天下, 北京, 大专, 50, 初创型, 移动互联网
内容运营, 6, 1, 运营, 运营, 奕报告, 广州, 大专, 15, 初创型, 移动互联网 · 教育
内容运营, 6, 3, 运营, 运营, 全升时代, 北京, 本科, 15, 初创型, O2O
内容运营, 6, 1, 运营, 运营, 北斗海聊, 广州, 大专, 15, 成长型, 移动互联网
内容运营, 11, 3, 运营, 运营, 保众网, 北京, 本科, 15, 初创型, 移动互联网 · 金融
内容运营, 6, 不, 运营, 运营, 卓品实业, 上海, 大专, 15, 初创型, 医疗健康
内容运营, 3, 不, 运营, 运营, Uber Beijing, 北京, 本科, 15, 成熟型, 移动互联网 · O2O
内容运营, 8, 1, 运营, 运营, PowerVision, 北京, 本科, 150, 成长型, 数据服务
内容运营, 6, 不, 运营, 运营, 帕拉网络科技, 北京, 本科, 15, 初创型, 移动互联网 · 旅游
内容运营, 7, 3, 运营, 编辑, 梧桐树网络, 深圳, 大专, 15, 初创型, 金融
内容运营, 11, 3, 运营, 运营, VIVA畅读, 北京, 本科, 150, 成熟型, 移动互联网 · 广告营销
内容运营, 7, 1, , 市场推广, 多宝时代, 北京, 大专, 15, 成长型, 移动互联网 · O2O
内容运营, 5, 1, 运营, 运营, 杭州周到, 杭州, 本科, 15, 初创型, 电子商务
内容运营, 1, 不, 运营, 运营, 蜂背, 广州, 学历不限, 15, 初创型, 移动互联网 · 教育
内容运营, 12, 3, 运营, 运营, 阿京妈, 上海, 本科, 15, 初创型, O2O
内容运营, 8, 1, 运营, 运营, 蛟龙出海, 深圳, 本科, 15, 初创型, 金融 · 数据服务
内容运营, 10, 1, 运营, 运营, 抓马, 北京, 本科, 15, 初创型, 移动互联网 · 社交网络
内容运营, 6, 1, 运营, 运营, 游戏陀螺, 深圳, 大专, 50, 成长型, 移动互联网 · 游戏
内容运营, 6, 不, 运营, 运营, 艺考就过, 北京, 本科, 15, 初创型, 教育
内容运营, 4, 1, 运营, 运营, 影人圈, 北京, 本科, 15, 初创型, 移动互联网 · O2O
内容运营, 5, 不, 运营, 运营, 西岱岛, 北京, 大专, 15, 初创型, O2O · 文化娱乐
内容运营, 6, 1, 运营, 运营, 扑克表情, 上海, 学历不限, 15, 初创型, 移动互联网 · 社交网络
内容运营, 6, 1, 运营, 运营, 新云和创, 北京, 本科, 500, 成熟型, 移动互联网
内容运营(实习生), 3, 不, 运营, 运营, 水木云风, 北京, 学历不限, 15, 初创型, 移动互联网
内容运营, 9, 3, 运营, 运营, 传世嘉业, 深圳, 本科, 50, 成长型, 企业服务 · 教育
内容运营, 7, 3, 运营, 运营, 今目标, 北京, 本科, 150, 成长型, 移动互联网 · 企业服务
内容运营, 9, 3, 运营, 运营, 翼迅科技, 深圳, 本科, 15, 初创型, 移动互联网 · O2O
内容运营, 5, 不, 运营, 运营, 正量网, 北京, 大专, 15, 初创型, 移动互联网 · 企业服务
内容运营, 6, 1, 运营, 运营, 眼缘儿科技, 北京, 大专, 15, 初创型, 移动互联网 · O2O
内容运营, 7, 1, 运营, 运营, 广州英杰仕教育科技, 广州, 大专, 15, 初创型, 教育 · 医疗健康
内容运营, 6, 1年以, 运营, 运营, 蓝色时代, 北京, 大专, 15, 初创型, 广告营销
内容运营, 4, 1, 运营, 运营, 影人圈, 北京, 本科, 15, 初创型, 移动互联网 · O2O
内容运营, 6, 1, 运营, 运营, 美术宝, 北京, 大专, 150, 成长型, 移动互联网 · 教育
内容运营, 8, 不, 运营, 运营, 甭纠结, 上海, 学历不限, 15, 成长型, 移动互联网 · 社交网络
内容运营, 5, 不, 运营, 编辑, 真道科技, 天津, 本科, 50, 初创型, 移动互联网
内容运营, 7, 1, 运营, 运营, 恒生芸泰, 杭州, 本科, 150, 成长型, 移动互联网 · 医疗健康
内容运营, 6, 1, 运营, 运营, 卓萌科技, 北京, 学历不限, 15, 初创型, 移动互联网
内容运营, 3, 应届毕业, 运营, 运营, 星宿工坊, 上海, 学历不限, 15, 初创型, 社交网络 · 文化娱乐
内容运营, 5, 不, 运营, 运营, 艺高高Artgogo, 上海, 学历不限, 15, 初创型, 电子商务 · 文化娱乐
内容运营, 5, 不, 运营, 运营, 微兔兔微信编辑器, 北京, 大专, 15, 成长型, 移动互联网 · 社交网络
内容运营, 11, 3, 运营, 运营, 移动互联网 广告 SDK, 北京, 大专, 15, 初创型, 移动互联网
内容运营, 11, 1, 运营, 运营, 信用宝-我爱卡, 深圳, 大专, 500, 成长型, 移动互联网 · 金融
内容运营, 4, 不, 运营, 运营, 铃声多多, 北京, 学历不限, 15, 初创型, 移动互联网
内容运营, 7, 1, 运营, 运营, 宇辉智传广告, 北京, 学历不限, 15, 初创型, 广告营销
内容运营, 8, 1, 运营, 运营, 易起趣, 杭州, 大专, 15, 初创型, 移动互联网
内容运营, 9, 1, 运营, 运营, 图知, 杭州, 大专, 15, 初创型, 教育
内容运营, 6, 不, 运营, 运营, 机锋, 北京, 大专, 150, 成长型, 文化娱乐
内容运营, 5, 不, 运营, 运营, 基因猫, 上海, 学历不限, 15, 成长型, 医疗健康
内容运营, 6, 不, 运营, 运营, 中国航空器拥有者及驾驶员协会, 北京, 学历不限, 50, 成长型, 移动互联网 · 其他
内容运营, 5, 1, 运营, 运营, 一刻talks, 北京, 本科, 15, 成长型, 电子商务
内容运营, 7, 1, 运营, 运营, 深圳市伯骐科技有限公司, 深圳, 大专, 15, 初创型, 移动互联网 · 电子商务
内容运营, 7, 1, 运营, 运营, 北京清清易科技有限公司, 北京, 学历不限, 50, 初创型, 移动互联网 · 社交网络
内容运营, 5, 不, 运营, 运营, 唐品, 上海, 学历不限, 15, 初创型, 电子商务 · 文化娱乐
内容运营, 6, 不, 运营, 运营, 酷传科技, 杭州, 本科, 50, 成长型, 移动互联网
内容运营, 5, 不, 运营, 运营, 卓萌科技, 北京, 学历不限, 15, 初创型, 移动互联网
内容运营, 8, 1, 运营, 运营, 云校, 北京, 学历不限, 150, 成长型, 教育 · 数据服务
内容运营, 4, 1, 运营, 运营, 飞天经纬, 北京, 大专, 150, 成长型, 移动互联网 · 其他
内容运营（实习生）, 3, 不, 运营, 运营, 远思科技, 北京, 学历不限, 15, 初创型, 移动互联网 · 教育
内容运营, 5, 1, 运营, 运营, Wonderland-双城科技, 杭州, 本科, 15, 初创型, 移动互联网 · 企业服务
内容运营, 15, 1, 运营, 运营, 第六空间, 杭州, 大专, 500, 成长型, 企业服务
内容运营, 10, 1, 运营, 运营, 亿信金融, 北京, 大专, 50, 初创型, 金融
内容运营, 10, 1, 运营, 运营, 睿立, 杭州, 学历不限, 50, 初创型, 电子商务 · 教育
内容运营, 7, 1, 运营, 运营, 熊猫拿拿, 杭州, 大专, 500, 成长型, 移动互联网 · O2O
内容运营, 5, 不, 运营, 运营, 铭软云视, 北京, 学历不限, 50, 初创型, 移动互联网
内容运营, 10, 3, 运营, 运营, 天下财富（天涯社区子公司）, 深圳, 本科, 500, 上市公, 移动互联网 · 金融
内容运营, 20, 3, 运营, 运营, 小麦公社, 北京, 本科, 500, 成长型, 移动互联网 · 电子商务
内容运营, 9, 不, 运营, 运营, e路吃, 杭州, 学历不限, 15, 初创型, 移动互联网 · 旅游
内容运营专员, 8, 1, 运营, 运营, 易易, 北京, 大专, 15, 初创型, 移动互联网 · O2O
内容运营, 4, 1年以, 运营, 运营, 老玩童, 苏州, 本科, 15, 成长型, 移动互联网 · 社交网络
内容运营, 6, 1, 运营, 运营, 清大益讯, 上海, 本科, 50, 成长型, 移动互联网 · 金融
内容运营, 6, 1, 运营, 运营, 求攻略, 杭州, 本科, 15, 初创型, 移动互联网 · 旅游
内容运营, 4, 1年以, 运营, 运营, 同花顺, 杭州, 本科, 2000, 上市公, 金融
内容运营, 2, 应届毕业, 运营, 运营, 光音网络, 北京, 大专, 150, 成长型, 广告营销 · 数据服务
内容运营, 7, 不, 运营, 运营, 网易, 北京, 本科, 2000, 上市公, 数据服务 · 文化娱乐
内容运营, 7, 不, 运营, 运营, 圈子科技, 北京, 大专, 15, 初创型, 移动互联网 · 社交网络
内容运营, 8, 1, 运营, 运营, 有序, 北京, 本科, 15, 初创型, 金融
内容运营, 5, 1, 运营, 运营, 澎湃电商孵化器, 深圳, 大专, 15, 初创型, 电子商务 · 金融
内容运营, 2, 应届毕业, 运营, 运营, 北纬56, 上海, 大专, 15, 成长型, 电子商务 · O2O
内容运营, 10, 1, 运营, 运营, 恒聚点, 北京, 本科, 15, 成长型, 移动互联网
内容运营, 2, 应届毕业, 运营, 运营, 美柠家, 上海, 本科, 15, 初创型, 电子商务 · O2O
内容运营, 6, 1, 运营, 运营, 玩聚北京, 北京, 大专, 15, 成长型, 移动互联网 · O2O
内容运营, 4, 不, 运营, 运营, 橙群网络科技（本地头条）, 杭州, 本科, 15, 初创型, 移动互联网 · 文化娱乐
内容运营, 3, 不, 运营, 运营, 觅游科技, 北京, 大专, 15, 初创型, 移动互联网 · 旅游
内容运营, 9, 1, 运营, 运营, Xtecher, 北京, 本科, 15, 初创型, 移动互联网 · 企业服务
内容运营, 5, 不, 运营, 运营, 真道科技, 天津, 本科, 50, 初创型, 移动互联网
内容运营, 7, 不, 运营, 运营, ONPS, 北京, 本科, 15, 初创型, 教育
内容运营, 7, 1, 运营, 运营, 思无疆, 北京, 学历不限, 15, 初创型, 电子商务
内容运营, 9, 1, 运营, 运营, 衣川文化, 北京, 本科, 15, 初创型, 移动互联网
内容运营, 10, 1, 运营, 运营, 宜人贷, 北京, 本科, 500, 成熟型, 移动互联网 · 金融
内容运营, 5, 1, 运营, 运营, 彩虹音乐, 北京, 本科, 150, 初创型, 移动互联网 · 硬件
内容运营, 5, 1, 运营, 运营, 链家地产, 上海, 大专, 2000, 初创型, O2O · 其他
内容运营, 6, 1, 运营, 运营, 软通动力, 北京, 本科, 2000, 上市公, 移动互联网 · 企业服务
内容运营, 15, 1, 运营, 运营, 财来啊（至前网络）, 上海, 大专, 50, 初创型, 移动互联网 · 金融
内容运营, 5, 1年以, 运营, 运营, 蜂蚁创盟, 杭州, 大专, 15, 初创型, 移动互联网 · 电子商务
内容运营, 6, 1, 运营, 运营, 天珍谷, 杭州, 大专, 15, 初创型, O2O · 电子商务
