内容运营, 6, 1, 运营, 运营, 翼行科技, 北京, 学历不限, 15, 初创型, 移动互联网 · O2O
内容运营, 1, 应届毕业, 运营, 运营, 小麦公社, 北京, 本科, 500, 成长型, 移动互联网 · 电子商务
内容运营, 5, 1, 运营, 运营, 四川健力生科技有限公司, 成都, 大专, 15, 成长型, 医疗健康
内容运营, 4, 1, 运营, 运营, 魔颜, 北京, 大专, 150, 初创型, 移动互联网 · O2O
内容运营, 4, 不, 运营, 运营, 外设天下, 北京, 大专, 15, 初创型, 移动互联网 · 文化娱乐
内容运营, 3, 不, 运营, 运营, 好易装, 长沙, 大专, 15, 初创型, 移动互联网 · 电子商务
内容运营, 7, 1, 运营, 运营, 北京龙必驰科技有限公司, 北京, 本科, 50, 成长型, 社交网络
内容运营, 5, 1, 运营, 运营, 淘拍拍O2O摄影平台杭州分公司, 杭州, 大专, 50, 成长型, 移动互联网 · O2O
内容运营, 5, 不, 运营, 运营, 漫动亚青, 北京, 大专, 15, 初创型, 文化娱乐
内容运营, 4, 不, 运营, 运营, 投友圈, 北京, 学历不限, 50, 成长型, 金融 · 数据服务
内容运营, 6, 1, 运营, 运营, 建亿通, 北京, 本科, 150, 成长型, 移动互联网 · 金融
内容运营, 5, 1, 运营, 运营, 鸟哥笔记, 上海, 大专, 50, 成长型, 移动互联网
内容运营, 25, 5, 运营, 运营, 乾和晟云, 北京, 本科, 500, 成长型, 电子商务
内容运营, 7, 1, 运营, 运营, E保管家, 北京, 学历不限, 15, 初创型, 移动互联网 · 金融
内容运营, 7, 1, 运营, 运营, 一本正经科技, 北京, 本科, 15, 初创型, 移动互联网 · 文化娱乐
内容运营, 6, 不, 运营, 运营, 51Talk无忧英语, 北京, 本科, 500, 成熟型, 移动互联网 · 教育
内容运营, 12, 1, 运营, 运营, 也瘦网, 上海, 大专, 50, 成长型, 移动互联网
内容运营（医学方向）, 15, 不, 运营, 运营, YY Inc, 广州, 本科, 2000, 上市公, 移动互联网
内容运营（媒体类）, 10, 1, 运营, 运营, 美柠家, 上海, 大专, 15, 初创型, 电子商务 · O2O
内容运营, 6, 1, 运营, 运营, 帅游旅游, 杭州, 本科, 15, 初创型, 移动互联网 · 旅游
内容运营, 1, 应届毕业, 运营, 运营, 跟谁学, 合肥, 本科, 500, 成长型, 移动互联网 · 教育
内容运营, 25, 1, 运营, 运营, 西狗国际, 上海, 本科, 50, 初创型, 电子商务 · O2O
内容运营, 10, 1, 运营, 运营, 酷传, 北京, 本科, 15, 成长型, 移动互联网
内容运营, 5, 不, 运营, 运营, 微信电影票, 北京, 大专, 500, 成熟型, 移动互联网 · 广告营销
内容运营, 2, 不, 运营, 运营, 午木阳光, 北京, 本科, 15, 初创型, 移动互联网 · 医疗健康
内容运营, 5, 不, 运营, 运营, 中投新视野, 北京, 大专, 15, 初创型, 移动互联网 · 文化娱乐
内容运营, 6, 不, 运营, 运营, 浙江新通留学, 北京, 本科, 500, 成熟型, 教育
内容运营, 4, 不, 运营, 运营, 浙江正泰网络技术有限公司, 杭州, 本科, 150, 初创型, 电子商务 · 数据服务
内容运营, 2, 不, 运营, 运营, 蛋壳, 上海, 学历不限, 15, 初创型, 移动互联网
内容运营, 4, 1, 运营, 运营, 谷恒-大地物源, 上海, 大专, 15, 初创型, 电子商务 · 生活服务
内容运营, 9, 1, 运营, 运营, 甘草医生, 杭州, 大专, 50, 初创型, 移动互联网 · 医疗健康
内容运营, 10, 1, 运营, 运营, 爱宝宝, 苏州, 本科, 50, 成长型, 移动互联网
内容运营, 7, 1, 运营, 运营, 广州市珀顿化妆品有限公司, 广州, 大专, 15, 初创型, 移动互联网 · 生活服务
内容运营, 9, 不, 运营, 运营, 午木阳光, 北京, 学历不限, 15, 初创型, 移动互联网 · 医疗健康
内容运营, 8, 3, 运营, 运营, 卓尔电商集团, 武汉, 本科, 500, 上市公, 电子商务 · 金融
内容运营, 9, 1, 运营, 运营, 易三板, 北京, 本科, 15, 初创型, 社交网络 · 金融
内容运营, 6, 1, 运营, 运营, 宜信公司, 北京, 本科, 2000, 成熟型, 移动互联网 · 金融
内容运营, 4, 3, 运营, 运营, 途途旅游网, 西安, 本科, 50, 成长型, 电子商务 · 旅游
内容运营, 7, 不, 运营, 运营, 上海链家(原德佑), 上海, 本科, 2000, 成长型, 企业服务
内容运营专员（编辑方向）, 10, 1, 运营, 运营, 真融宝, 北京, 本科, 50, 成长型, 金融
内容运营, 7, 1, 运营, 运营, 上海微展, 上海, 大专, 50, 成长型, 教育 · 医疗健康
内容运营, 4, 不, 运营, 运营, 思齐思才e平台, 长沙, 大专, 500, 初创型, 教育 · 其他
内容运营, 10, 1, 运营, 运营, leezee 栗子, 北京, 本科, 15, 初创型, 移动互联网 · 社交网络
内容运营, 5, 1, 运营, 运营, 腾泰翼, 深圳, 大专, 150, 成长型, 移动互联网
内容运营, 7, 1, 运营, 运营, 欢否, 北京, 学历不限, 15, 成长型, 社交网络 · O2O
内容运营, 9, 1, 运营, 运营, 创投圈, 北京, 本科, 15, 成长型, 金融
内容运营专员, 8, 1, 运营, 运营, 恺英网络, 上海, 本科, 500, 上市公, 移动互联网 · 游戏
内容运营（实习生）, 3, 不, 运营, 运营, 午木阳光, 北京, 学历不限, 15, 初创型, 移动互联网 · 医疗健康
内容运营（广告方向）, 4, 1, 运营, 运营, 博彦科技, 北京, 大专, 2000, 上市公, 企业服务 · 数据服务
内容运营, 30, 3, 运营, 运营, 新知百略, 北京, 大专, 50, 初创型, 移动互联网 · 社交网络
内容运营, 12, 3, 运营, 运营, 构家网, 杭州, 大专, 50, 初创型, 移动互联网
内容运营, 15, 3, 运营, 运营, 1001art, 北京, 大专, 50, 成长型, 移动互联网 · 电子商务
内容运营, 22, 3, 运营, 运营, 叫练－让运动更简单, 北京, 本科, 15, 成长型, 移动互联网 · 文化娱乐
内容运营, 8, 1, 运营, 运营, 喏喏科技, 深圳, 大专, 15, 初创型, 社交网络 · 教育
内容运营, 9, 3, 运营, 运营, 飞碟说, 北京, 学历不限, 50, 成长型, 移动互联网
内容运营专员, 3, 应届毕业, 运营, 运营, 淘粉吧, 杭州, 本科, 150, 成长型, 移动互联网 · 电子商务
内容运营, 7, 不, 运营, 运营, 云农场, 北京, 本科, 500, 成长型, 电子商务
内容运营, 9, 不, 运营, 运营, 佳学, 广州, 本科, 50, 初创型, 移动互联网 · 教育
内容运营, 4, 1年以, 运营, 运营, 股票雷达, 北京, 学历不限, 50, 成长型, 金融 · 数据服务
内容运营, 5, 不, 运营, 运营, 医时空, 深圳, 学历不限, 15, 初创型, 移动互联网 · 医疗健康
内容运营, 3, 不, 运营, 运营, 若饭, 杭州, 大专, 15, 初创型, 移动互联网 · 电子商务
内容运营, 7, 1, 运营, 运营, 新窝, 北京, 大专, 50, 成长型, 电子商务
内容运营, 15, 3, 运营, 运营, 微明星, 深圳, 大专, 15, 初创型, 移动互联网 · 电子商务
内容运营, 4, 不, 运营, 运营, 寻球, 北京, 学历不限, 15, 初创型, 移动互联网 · 文化娱乐
内容运营, 2, 不, 运营, 运营, 运营会, 上海, 学历不限, 15, 初创型, 移动互联网 · 广告营销
内容运营, 6, 1, 运营, 运营, 超控, 重庆, 大专, 50, 初创型, 移动互联网 · O2O
内容运营, 6, 3, 运营, 运营, MIGO, 杭州, 大专, 15, 初创型, 移动互联网 · 生活服务
内容运营, 3, 不, 运营, 运营, 同窗说, 广州, 学历不限, 15, 初创型, 移动互联网 · 生活服务
内容运营, 8, 1, 运营, 运营, 冠新软件, 北京, 大专, 500, 初创型, 移动互联网 · 医疗健康
内容运营, 9, 1, 运营, 运营, 趣互联, 北京, 学历不限, 15, 初创型, 移动互联网 · 社交网络
内容运营, 5, 应届毕业, 运营, 运营, 同花顺, 杭州, 本科, 2000, 上市公, 金融
内容运营, 3, 不, 运营, 运营, 风旗网络, 重庆, 学历不限, 15, 初创型, 移动互联网
内容运营, 7, 3, 运营, 运营, 第一出行, 北京, 本科, 50, 初创型, 电子商务
内容运营, 4, 不, 运营, 运营, 印思文化, 上海, 学历不限, 15, 初创型, 移动互联网 · 招聘
内容运营, 12, 1, 运营, 运营, 杭州龙席网络科技发展有限公司, 杭州, 大专, 500, 初创型, 电子商务
内容运营 (偏文案), 5, 1, 运营, 运营, 饿了么, 上海, 大专, 2000, 成熟型, 移动互联网
内容运营, 10, 5, 运营, 运营, 易迅网, 上海, 大专, 500, 成熟型, 电子商务
内容运营, 9, 1, 运营, 运营, 实创装饰, 北京, 本科, 2000, 成长型, 生活服务
内容运营, 7, 1, 运营, 运营, 逗播, 南京, 学历不限, 15, 初创型, 移动互联网 · 社交网络
内容运营, 7, 1, 运营, 运营, 露施国际, 广州, 大专, 50, 成长型, 移动互联网 · 其他
内容运营, 7, 不, 运营, 运营, 家范儿, 北京, 学历不限, 50, 初创型, 移动互联网 · O2O
内容运营, 10, 1, 运营, 运营, 有邻, 杭州, 大专, 50, 初创型, 社交网络 · O2O
内容运营, 12, 1, 运营, 运营, 有赞, 杭州, 学历不限, 150, 成长型, 移动互联网 · 电子商务
内容运营, 8, 1, 运营, 运营, 帮5买, 上海, 大专, 150, 成长型, 移动互联网 · 电子商务
内容运营, 6, 3, 运营, 运营, 巨途, 广州, 本科, 15, 初创型, 移动互联网 · 广告营销
内容运营, 6, 1, 运营, 运营, 北京天融信公司, 北京, 本科, 2000, 上市公, 信息安全
内容运营, 8, 1年以, 运营, 运营, 星柚, 上海, 学历不限, 15, 初创型, 移动互联网 · 社交网络
内容运营, 8, 1, 运营, 运营, 冠新软件, 北京, 本科, 500, 初创型, 移动互联网 · 医疗健康
内容运营, 7, 1, 运营, 运营, 天殇科技, 广州, 学历不限, 15, 成长型, 移动互联网 · 社交网络
内容运营（传统文化-易学）, 12, 5, 运营, 运营, 灵机文化, 广州, 本科, 50, 初创型, 移动互联网 · 电子商务
内容运营, 8, 3, 运营, 运营, 软通动力, 北京, 本科, 2000, 上市公, 移动互联网 · 企业服务
内容运营, 5, 不, 运营, 运营, 益起来, 北京, 本科, 15, 初创型, 企业服务 · 文化娱乐
内容运营, 5, 不, 运营, 运营, 拍卡, 上海, 大专, 15, 初创型, 移动互联网
内容运营, 6, 1, 运营, 运营, 鸣月科技, 深圳, 学历不限, 15, 成长型, 移动互联网 · O2O
内容运营, 6, 1, 运营, 运营, 章鱼网, 北京, 大专, 50, 成长型, 移动互联网 · O2O
内容运营, 12, 1, 运营, 运营, 我爱卡, 北京, 大专, 150, 成长型, 金融
内容运营, 7, 1, 运营, 运营, 中国供应商, 北京, 学历不限, 50, 初创型, 移动互联网 · 电子商务
内容运营, 8, 1, 运营, 运营, 多贝网, 北京, 本科, 50, 成长型, 教育
内容运营, 6, 1, 运营, 运营, 若朗生物, 杭州, 本科, 50, 初创型, 企业服务 · 医疗健康
内容运营 (偏设计), 5, 1, 运营, 运营, 饿了么, 上海, 大专, 2000, 成熟型, 移动互联网
内容运营, 5, 不, 运营, 运营, 卓萌科技, 北京, 学历不限, 15, 初创型, 移动互联网
内容运营, 7, 不, 运营, 运营, e路吃, 杭州, 学历不限, 15, 初创型, 移动互联网 · 旅游
内容运营助理, 2, 不, 运营, 运营, 梧桐创客, 深圳, 本科, 15, 初创型, 企业服务 · 金融
内容运营, 10, 1, 运营, 运营, 大猫电商, 北京, 本科, 50, 成长型, 电子商务
内容运营, 3, 应届毕业, 运营, 运营, 南京中竣, 南京, 本科, 15, 初创型, 电子商务 · O2O
内容运营, 5, 1年以, 运营, 运营, 天兔珠宝, 北京, 大专, 15, 初创型, 移动互联网 · 电子商务
内容运营, 4, 不, 运营, 运营, 良品优选, 北京, 学历不限, 15, 初创型, 移动互联网 · 电子商务
内容运营（信用卡行业）, 10, 1, 运营, 运营, 约惠么, 北京, 大专, 15, 初创型, 移动互联网 · 金融
内容运营, 12, 1, 运营, 运营, 网笑公司, 北京, 大专, 50, 成长型, 移动互联网 · 教育
内容运营, 5, 1, 运营, 运营, 战略网, 北京, 大专, 50, 初创型, 文化娱乐
内容运营, 11, 1, 运营, 运营, 铭万, 北京, 大专, 500, 初创型, 移动互联网
内容运营/编辑, 8, 不, 运营, 运营, 58同城, 北京, 学历不限, 2000, 上市公, O2O · 分类信息
内容运营, 12, 1, 运营, 运营, 佳学, 广州, 本科, 50, 初创型, 移动互联网 · 教育
内容运营, 7, 1, 运营, 运营, 你我互联, 深圳, 学历不限, 15, 初创型, 移动互联网
内容运营, 4, 应届毕业, 运营, 运营, 泛华企业集团, 广州, 本科, 150, 上市公, 金融
内容运营, 8, 3, 运营, 运营, 文轩全媒, 北京, 本科, 15, 初创型, 分类信息 · 文化娱乐
内容运营（新媒体）, 9, 1, 运营, 运营, 尚德机构, 北京, 本科, 2000, 成长型, 电子商务 · 教育
内容运营, 9, 1, 运营, 运营, 彩球网, 北京, 本科, 15, 成长型, 移动互联网 · 数据服务
内容运营+（毕业于985211学校）, 4, 1年以, 运营, 运营, 链家地产, 上海, 本科, 2000, 初创型, O2O · 其他
内容运营, 8, 1, 运营, 运营, crazybaby, 深圳, 本科, 15, 初创型, 硬件
内容运营, 4, 1, 运营, 编辑, 法本信息, 深圳, 大专, 2000, 成熟型, 企业服务 · 招聘
内容运营（健身专业内容方向）, 8, 不, 运营, 运营, Keep, 北京, 本科, 50, 成长型, 社交网络 · 文化娱乐
内容运营, 3, 应届毕业, 运营, 运营, 紫红科技, 北京, 本科, 15, 初创型, 硬件 · 其他
内容运营, 6, 不, 运营, 运营, 阿莫比Amoby, 上海, 大专, 50, 成长型, 移动互联网
内容运营, 5, 1, 运营, 运营, 不凡布道, 成都, 本科, 15, 成长型, 移动互联网 · 教育
内容运营, 7, 1, 运营, 运营, 中国首家建筑互联网综合交易平台, 重庆, 本科, 15, 初创型, 数据服务 · 移动互联网
内容运营, 8, 1, 运营, 运营, 软通动力, 北京, 学历不限, 2000, 上市公, 移动互联网 · 企业服务
内容运营, 15, 1, 运营, 运营, SKG, 广州, 大专, 150, 成长型, 电子商务 · O2O
内容运营, 3, 不, 运营, 运营, 爱培训, 武汉, 大专, 15, 初创型, 移动互联网 · O2O
内容运营, 9, 1, 运营, 运营, 若水彤云文化传媒集团, 北京, 大专, 50, 成长型, 文化娱乐
内容运营, 10, 1, 运营, 运营, 美味不用等, 上海, 本科, 500, 成熟型, 移动互联网 · O2O
内容运营专员, 5, 不, 运营, 运营, 北京云拓锐联科技有限公司, 北京, 学历不限, 15, 初创型, 移动互联网 · 文化娱乐
内容运营（宏观经济分析师）, 6, 不, 运营, 运营, 汇通财经, 上海, 学历不限, 150, 成熟型, 电子商务 · 文化娱乐
内容运营, 5, 1年以, 运营, 运营, 网智天元, 北京, 本科, 50, 初创型, 金融 · 数据服务
内容运营, 6, 1, 运营, 运营, 土著游, 上海, 本科, 50, 成长型, 旅游
内容运营, 12, 1, 运营, 运营, 猿题库, 北京, 本科, 50, 成熟型, 移动互联网 · 教育
内容运营, 11, 3, 运营, 运营, 杭州视界, 杭州, 本科, 50, 成长型, 移动互联网
内容运营, 12, 3, 运营, 运营, 米尔网, 北京, 大专, 50, 初创型, 移动互联网 · 电子商务
内容运营, 7, 不, 运营, 运营, e飞蚁, 北京, 本科, 150, 初创型, 电子商务 · O2O
内容运营, 7, 1, 运营, 运营, 起点学院, 深圳, 学历不限, 15, 初创型, 企业服务 · 教育
内容运营, 6, 1, 运营, 运营, 维思维尔, 深圳, 学历不限, 15, 初创型, 移动互联网 · 文化娱乐
内容运营, 5, 1, 运营, 运营, 乐可得科技, 深圳, 大专, 15, 初创型, 移动互联网 · 社交网络
内容运营, 4, 1, 运营, 运营, 来福乐, 成都, 大专, 15, 初创型, 移动互联网
内容运营, 6, 1, 运营, 运营, 睿本科技, 广州, 大专, 15, 初创型, 移动互联网 · O2O
内容运营, 9, 1, 运营, 运营, 易途科技, 北京, 本科, 15, 初创型, 移动互联网
内容运营, 5, 1, 运营, 运营, 中诚信征信, 北京, 本科, 150, 初创型, 金融
内容运营, 7, 1, 运营, 运营, 久邦数码, 广州, 本科, 500, 上市公, 移动互联网
内容运营, 11, 1, 运营, 运营, 乐秀, 北京, 大专, 15, 初创型, O2O · 文化娱乐
内容运营, 7, 1, 运营, 运营, 美团网, 北京, 本科, 2000, 成熟型, 移动互联网 · O2O
内容运营, 4, 不, 运营, 运营, Believe 全渠道营销专家, 上海, 学历不限, 50, 初创型, 移动互联网 · 电子商务
内容运营, 9, 1, 运营, 运营, 婴萌, 北京, 大专, 15, 成长型, 移动互联网 · 硬件
内容运营, 3, 不, 运营, 运营, 旅咖科技, 武汉, 本科, 15, 初创型, 移动互联网 · 旅游
内容运营, 7, 1年以, 运营, 运营, 辉科金融（召宝贷）, 上海, 本科, 15, 初创型, 移动互联网 · 金融
内容运营, 12, 1, 运营, 运营, 上海微盟, 上海, 大专, 500, 成熟型, 移动互联网 · 电子商务
内容运营, 6, 1, 运营, 运营, CONGRA, 广州, 学历不限, 15, 初创型, 移动互联网 · 教育
内容运营, 4, 1年以, 运营, 运营, 予财网, 广州, 本科, 50, 初创型, 金融
内容运营, 10, 5, 运营, 运营, 有用分期, 深圳, 本科, 150, 成长型, 移动互联网 · 金融
内容运营, 10, 不, 运营, 运营, 深圳通电商, 深圳, 本科, 15, 初创型, 移动互联网
内容运营（实习）, 3, 应届毕业, 运营, 运营, DoNews, 北京, 本科, 150, 成长型, 文化娱乐
内容运营, 10, 3, 运营, 运营, 同方鼎欣, 杭州, 大专, 500, 上市公, 移动互联网
内容运营助理（兼职）, 3, 不, 运营, 运营, 人言, 杭州, 本科, 15, 初创型, 移动互联网 · 社交网络
内容运营, 8, 1, 运营, 运营, 共做室GatherUp, 广州, 本科, 15, 初创型, 移动互联网 · 社交网络
内容运营, 5, 不, 运营, 运营, 掌赢科技, 南京, 本科, 50, 初创型, 移动互联网 · 社交网络
内容运营, 8, 1, 运营, 运营, 蚂蚁互联, 北京, 学历不限, 2000, 成熟型, 移动互联网 · 电子商务
内容运营, 11, 1, 运营, 运营, GirlUp美女创业工场, 北京, 本科, 15, 成长型, 企业服务 · 金融
内容运营, 5, 1, 运营, 运营, 小孩子, 北京, 大专, 15, 初创型, 移动互联网 · 教育
内容运营, 4, 不, 运营, 运营, 宜配, 成都, 大专, 15, 初创型, 移动互联网 · 其他
内容运营/策划, 6, 1, 运营, 运营, 蛋篮科技, 成都, 大专, 15, 初创型, 移动互联网 · 金融
内容运营, 10, 1, 运营, 运营, 慕课网, 北京, 本科, 50, 成长型, 移动互联网 · 教育
内容运营, 9, 1, 运营, 运营, 魔秀桌面, 北京, 本科, 50, 成长型, 移动互联网
内容运营, 4, 应届毕业, 运营, 运营, 水木云风, 北京, 本科, 15, 初创型, 移动互联网
内容运营, 8, 1, 运营, 运营, 么么嗖, 深圳, 本科, 150, 成长型, 移动互联网 · 电子商务
内容运营, 9, 1, 运营, 运营, 上海恺达广告有限公司, 北京, 学历不限, 150, 上市公, 广告营销
内容运营, 9, 不, 运营, 运营, 三代人, 深圳, 本科, 50, 初创型, 移动互联网
内容运营, 3, 不, 运营, 运营, 图解电影, 深圳, 大专, 15, 成长型, 移动互联网
内容运营, 5, 不, 运营, 运营, 178游戏网, 北京, 大专, 50, 成长型, 移动互联网 · 游戏
内容运营, 2, 不, 运营, 运营, 老友科技, 杭州, 本科, 15, 成长型, 移动互联网 · 社交网络
内容运营, 3, 不, 运营, 运营, 快发助手, 成都, 大专, 50, 成长型, 游戏 · 数据服务
内容运营, 2, 不, 运营, 运营, 豆瓣网, 北京, 本科, 150, 成熟型, 移动互联网
内容运营(网站编辑), 5, 不, 运营, 编辑, 真道科技, 天津, 本科, 50, 初创型, 移动互联网
内容运营, 10, 1, 运营, 运营, 也买酒, 上海, 大专, 150, 成熟型, 电子商务
内容运营, 10, 1, 运营, 运营, 也买酒, 上海, 大专, 150, 成熟型, 电子商务
内容运营, 8, 1, 运营, 运营, 同事app, 深圳, 本科, 15, 初创型, 移动互联网
内容运营, 8, 1, 运营, 运营, 天玑财富, 深圳, 本科, 50, 初创型, 移动互联网 · 金融
内容运营, 6, 1年以, 运营, 运营, 微在 Wezeit.com, 北京, 本科, 50, 成长型, 移动互联网 · 文化娱乐
内容运营, 3, 不, 运营, 运营, 博彦科技, 北京, 大专, 2000, 上市公, 企业服务 · 数据服务
内容运营, 12, 3, 运营, 运营, 网易, 杭州, 本科, 2000, 上市公, 移动互联网 · 游戏
内容运营, 11, 1, 运营, 运营, 爱奇艺, 北京, 本科, 2000, 成熟型, 广告营销 · 文化娱乐
内容运营, 10, 1, 运营, 运营, 有邻, 北京, 大专, 50, 初创型, 社交网络 · O2O
内容运营, 7, 1, 运营, 运营, 华视传媒, 深圳, 本科, 150, 上市公, 移动互联网 · 广告营销
内容运营, 9, 3, 运营, 运营, 大领结, 上海, 本科, 15, 初创型, 移动互联网
内容运营, 9, 1, 运营, 运营, 嗨音Highing, 杭州, 大专, 15, 成长型, 移动互联网 · 社交网络
内容运营, 6, 不, 运营, 运营, 深圳市恩孚电子科技有限公司, 深圳, 本科, 15, 初创型, 电子商务 · 硬件
内容运营, 6, 应届毕业, 运营, 运营, 上海秉钧网络科技有限公司, 上海, 大专, 50, 初创型, 移动互联网
内容运营, 2, 应届毕业, 运营, 运营, 赢基财富, 宁波, 本科, 50, 初创型, 教育
内容运营, 6, 1, 运营, 运营, 结伴游, 广州, 本科, 15, 初创型, 移动互联网 · 旅游
内容运营, 3, 1, 运营, 运营, 图解电影, 深圳, 大专, 15, 成长型, 移动互联网
内容运营, 6, 不, 运营, 运营, 皮影客, 北京, 学历不限, 15, 成长型, 移动互联网 · 文化娱乐
内容运营, 12, 1, 运营, 运营, 把把脉网络科技(北京)有限公司, 北京, 本科, 15, 初创型, 移动互联网 · 医疗健康
内容运营, 6, 应届毕业, 运营, 运营, 赵涌在线, 上海, 大专, 150, 成长型, 电子商务
内容运营, 2, 不, 运营, 运营, 叮叮导游, 深圳, 学历不限, 15, 初创型, 移动互联网 · 旅游
内容运营/网站编辑, 6, 3, 运营, 编辑, 视界环球, 北京, 学历不限, 50, 初创型, 广告营销
内容运营, 6, 应届毕业, 运营, 运营, 新氧整形, 北京, 大专, 50, 成长型, 移动互联网 · O2O
高级内容运营, 15, 3, 运营, 运营, 爱拍原创, 广州, 本科, 150, 成熟型, 文化娱乐
内容运营, 9, 不, 运营, 运营, 佳学, 广州, 本科, 50, 初创型, 移动互联网 · 教育
内容运营, 12, 1, 运营, 运营, 网笑公司, 北京, 大专, 50, 成长型, 移动互联网 · 教育
内容运营, 10, 不, 运营, 运营, 约惠么, 北京, 大专, 15, 初创型, 移动互联网 · 金融
内容运营, 2, 应届毕业, 运营, 运营, KEYS, 上海, 学历不限, 15, 成长型, 移动互联网 · 生活服务
内容运营, 22, 3, 运营, 运营, 腾讯, 北京, 本科, 2000, 上市公, 移动互联网  · 游戏
内容运营专员, 7, 1, 运营, 运营, 优分期, 北京, 大专, 500, 成长型, 电子商务 · 金融
内容运营（应届毕业生）, 4, 应届毕业, 运营, 运营, 北京云漾, 北京, 本科, 15, 初创型, 移动互联网 · 社交网络
内容运营, 12, 5, 运营, 运营, 51Talk无忧英语, 北京, 本科, 500, 成熟型, 移动互联网 · 教育
内容运营, 8, 1, 运营, 运营, 网易, 北京, 本科, 2000, 上市公, 移动互联网 · 文化娱乐
高级内容运营, 10, 1, 运营, 运营, 上海亲冒号信息科技有限公司, 上海, 本科, 50, 成长型, 移动互联网 · 医疗健康
内容运营, 5, 1, 运营, 运营, 渔民旅行社, 广州, 大专, 50, 初创型, 旅游
内容运营（营销策划）, 4, 1, 运营, 运营, 构家网, 杭州, 大专, 50, 初创型, 移动互联网
内容运营/编辑, 3, 应届毕业, 运营, 运营, 猎学网, 福州, 大专, 150, 初创型, 教育 · 生活服务
内容运营（移动互联网）, 8, 1, 运营, 运营, 文都教育, 北京, 本科, 500, 上市公, 移动互联网 · 教育
内容运营, 15, 3, 运营, 运营, 小麻包, 北京, 大专, 15, 初创型, 移动互联网 · 电子商务
内容运营, 2, 不, 运营, 运营, 百度, 北京, 本科, 2000, 上市公, 移动互联网
内容运营专员, 6, 不, 运营, 运营, 美轮科技, 北京, 本科, 15, 初创型, 移动互联网 · 电子商务
内容运营, 9, 3, 运营, 运营, 唯品会, 广州, 大专, 2000, 上市公, 电子商务
内容运营, 5, 1, 运营, 运营, 唯品会, 广州, 大专, 2000, 上市公, 电子商务
内容运营, 12, 1, 运营, 运营, EEGSmart, 深圳, 本科, 15, 初创型, 移动互联网 · 硬件
内容运营, 6, 1, 运营, 运营, 一点资讯, 北京, 学历不限, 150, 成熟型, 移动互联网
内容运营（内容审核方向）, 9, 1, 运营, 编辑, 万达电商, 上海, 本科, 2000, 成长型, 电子商务
内容运营, 1, 不, 运营, 运营, Getfun, 武汉, 学历不限, 50, 初创型, 移动互联网 · 社交网络
内容运营, 2, 不, 运营, 运营, 柒弥工作室, 北京, 本科, 15, 初创型, 文化娱乐 · 移动互联网
内容运营, 11, 1, 运营, 运营, Tinylogics, 深圳, 本科, 15, 初创型, 移动互联网 · 硬件
内容运营, 7, 1, 运营, 运营, 南威软件股份有限公司, 北京, 大专, 500, 上市公, 企业服务 · 移动互联网
内容运营专员, 4, 1, 运营, 运营, 时光互通, 北京, 大专, 15, 初创型, 移动互联网 · O2O
内容运营专员, 8, 1, 运营, 运营, 易聚科技, 北京, 本科, 150, 成长型, 金融
内容运营专员, 4, 1, 运营, 运营, 云信科技, 北京, 本科, 15, 成长型, 移动互联网
内容运营专员, 7, 不, 运营, 运营, CVTE, 广州, 本科, 500, 成熟型, 数据服务 · 硬件
内容运营, 3, 应届毕业, 运营, 运营, 影人圈, 北京, 本科, 15, 初创型, 移动互联网 · O2O
内容运营, 5, 1年以, 运营, 运营, 快捷键, 深圳, 学历不限, 15, 初创型, 移动互联网 · 教育
