职位, 工资, 经验要求, 职位一级分类, 职位二级分类, 公司名称, 城市, 学历, 公司规模, 公司阶段, 公司业务领域
数据运营, 3, 1, 运营, 运营, 最鲜到, 长沙, 大专, 150, 成长型, O2O
数据运营, 6, 3, 运营, 运营, 灵犀金融, 杭州, 本科, 150, 上市公, 移动互联网 · 金融
数据运营, 4, 1, 运营, 运营, DMC 迪姆云, 广州, 大专, 15, 初创型, 移动互联网 · 电子商务
数据运营, 5, 1, 运营, 运营, 美菜网, 北京, 大专, 2000, 成熟型, 电子商务 · O2O
数据运营, 7, 1, 运营, 运营, 聚工厂, 杭州, 本科, 50, 初创型, 移动互联网
数据运营, 5, 1, 运营, 运营, 掌驭科技(小白用车), 深圳, 大专, 15, 初创型, O2O · 数据服务
数据运营, 10, 1, 运营, 运营, 360, 北京, 本科, 2000, 上市公, 移动互联网 · 游戏
数据运营, 2, 不, 运营, 运营, Uber Beijing, 青岛, 本科, 15, 成熟型, 移动互联网 · O2O
数据运营, 5, 不, 运营, 运营, 金卖网, 厦门, 大专, 50, 成长型, 移动互联网 · 电子商务
数据运营, 15, 5, 运营, 运营, 汽车之家, 北京, 本科, 2000, 上市公, 移动互联网 · 文化娱乐
数据运营, 3, 不, 运营, 运营, 易加医, 杭州, 本科, 50, 成长型, 移动互联网 · O2O
数据运营, 10, 1, 运营, 运营, 一种生活, 深圳, 本科, 15, 初创型, 移动互联网 · 电子商务
数据运营, 6, 1, 运营, 运营, 途牛旅游网, 南京, 本科, 2000, 上市公, 电子商务 · 旅游
数据运营, 6, 1, 运营, 运营, 58赶集集团（斗米兼职）, 深圳, 大专, 150, 成长型, O2O
数据运营, 6, 1, 运营, 运营, 途牛旅游网, 南京, 本科, 2000, 上市公, 电子商务 · 旅游
数据运营, 6, 1, 运营, 运营, 途牛旅游网, 南京, 本科, 2000, 上市公, 电子商务 · 旅游
数据运营, 10, 1, 运营, 运营, 黄金岛, 深圳, 大专, 50, 成长型, 移动互联网 · 游戏
数据运营, 6, 1, 运营, 运营, 天舟, 北京, 本科, 500, 成熟型, 移动互联网
数据运营, 5, 1, 运营, 运营, 易直供, 南京, 大专, 150, 成长型, 移动互联网 · 电子商务
数据运营, 20, 3, 运营, 运营, 闻都集团, 上海, 本科, 50, 成长型, 金融 · 移动互联网
数据运营, 8, 1, 运营, 运营, 58同城, 天津, 本科, 2000, 上市公, O2O · 分类信息
数据运营, 8, 1, 运营, 运营, 北京搜房科技发展有限公司, 北京, 本科, 2000, 上市公, 移动互联网 · 金融
数据运营, 9, 1, 运营, 运营, 天梯卓越, 苏州, 大专, 15, 成长型, 其他
数据运营, 5, 不, 运营, 运营, 云声信息, 南京, 大专, 50, 初创型, 移动互联网 · 社交网络
数据运营, 8, 1, 运营, 运营, 58同城, 天津, 本科, 2000, 上市公, O2O · 分类信息
数据运营, 4, 1, 运营, 运营, 快狗速运 (GoGoVan), 武汉, 大专, 150, 成长型, 移动互联网 · O2O
数据运营, 6, 1, 运营, 运营, 多快好省, 厦门, 本科, 15, 初创型, 金融
数据运营, 3, 1, 运营, 运营, e袋洗, 武汉, 本科, 500, 成长型, O2O
数据运营, 22, 3, 运营, 运营, 快的打车, 杭州, 本科, 2000, 成熟型, 移动互联网
数据运营, 11, 1, 运营, 运营, 网易, 杭州, 本科, 2000, 上市公, 移动互联网 · 游戏
数据运营, 16, 3, 运营, 运营, 买衣爽, 上海, 硕士, 50, 成长型, 电子商务 · O2O
数据运营, 5, 1, 运营, 运营, TT快车, 深圳, 大专, 150, 成长型, 移动互联网 · O2O
数据运营, 5, 1, 运营, 运营, 合众力道, 北京, 本科, 15, 初创型, 移动互联网
数据运营, 8, 1, 运营, 运营, 随手科技, 深圳, 本科, 150, 成长型, 移动互联网 · 金融
数据运营, 11, 3, 运营, 运营, 正邦创意, 北京, 本科, 500, 成熟型, 移动互联网 · 广告营销
数据运营, 5, 1年以, 运营, 运营, 众感传媒, 无锡, 本科, 15, 初创型, 移动互联网 · 文化娱乐
数据运营, 6, 1, 运营, 运营, 美天科技, 重庆, 大专, 50, 初创型, 移动互联网
数据运营, 8, 1, 运营, 运营, 新浪乐居, 北京, 本科, 2000, 上市公, 电子商务  · 文化娱乐
数据运营, 45, 5, 运营, 运营, 好利58, 北京, 本科, 50, 成长型, 金融
数据运营, 7, 1, 运营, 运营, 资邦, 上海, 大专, 2000, 成熟型, 金融
数据运营, 6, 1, 运营, 运营, e袋洗, 上海, 大专, 500, 成长型, O2O
数据运营, 2, 不, 运营, 运营, 作业盒子, 北京, 本科, 50, 成长型, 移动互联网 · 教育
数据运营, 6, 1, 运营, 运营, 北京搜房科技发展有限公司, 北京, 本科, 2000, 上市公, 移动互联网 · 金融
数据运营, 3, 不, 运营, 运营, 海南水果岛, 三亚, 大专, 50, 成长型, 移动互联网 · O2O
数据运营, 5, 1, 运营, 运营, 欣芙科技, 上海, 大专, 15, 初创型, 移动互联网 · O2O
数据运营, 25, 3, 运营, 运营, 唯为, 上海, 本科, 500, 成熟型, 电子商务 · O2O
数据运营, 6, 1, 运营, 运营, 复华资产, 北京, 本科, 500, 成熟型, 金融
数据运营, 6, 1, 运营, 运营, 2345.com, 上海, 本科, 500, 上市公, 数据服务 · 移动互联网
数据运营（投资人用户运营、订单交易转化）, 22, 3, 运营, 运营, 以太资本, 北京, 本科, 150, 成长型, 金融
数据运营, 4, 不, 运营, 运营, 伍德伯恩（北京）科技公司, 石家庄, 学历不限, 15, 初创型, 移动互联网
数据运营, 8, 1, 运营, 运营, 北京无双科技, 北京, 本科, 150, 成长型, 数据服务
数据运营, 13, 3, 运营, 运营, 远传技术, 杭州, 本科, 150, 成熟型, 金融 · 数据服务
数据运营, 6, 1, 运营, 运营, 声屏汇, 中山, 学历不限, 50, 成长型, 移动互联网
数据运营, 8, 3, 运营, 运营, 时空电动汽车, 杭州, 大专, 150, 成长型, 移动互联网 · 硬件
数据运营, 9, 1, 运营, 运营, 得客互动, 厦门, 学历不限, 15, 初创型, 移动互联网 · O2O
数据运营, 4, 不, 运营, 运营, 前嗅网络, 天津, 大专, 15, 初创型, 企业服务 · 数据服务
数据运营, 6, 1, 运营, 运营, 优品财富管理有限公司, 武汉, 本科, 500, 初创型, 金融
数据运营, 17, 3, 运营, 运营, 趣豆理财, 上海, 大专, 50, 初创型, 金融
数据运营, 9, 不, 运营, 运营, 深圳链家网, 深圳, 本科, 2000, 成熟型, O2O
数据运营, 8, 1, 运营, 运营, 来定网络, 深圳, 大专, 150, 初创型, 移动互联网 · 生活服务
数据运营专员, 7, 1, 运营, 运营, 瑞恩传媒, 北京, 大专, 50, 成长型, 数据服务
数据运营, 3, 不, 运营, 运营, 前嗅网络, 天津, 大专, 15, 初创型, 企业服务 · 数据服务
数据运营, 4, 1, 运营, 运营, 彩易天地, 北京, 大专, 15, 初创型, 移动互联网
数据运营, 4, 不, 运营, 运营, 上海善林金融信息服务有限公司, 上海, 大专, 2000, 初创型, 金融
数据运营, 7, 5, 运营, 运营, 一拓通信集团, 合肥, 本科, 50, 上市公, 移动互联网
数据运营, 7, 1, 运营, 运营, 瑞翼, 苏州, 大专, 150, 上市公, 移动互联网
数据运营, 9, 1, 运营, 运营, 高顿教育, 上海, 本科, 500, 成长型, 教育
数据运营, 3, 不, 运营, 运营, 领客网, 上海, 大专, 50, 成长型, 移动互联网 · 电子商务
数据运营, 18, 1, 运营, 运营, 找理财网, 北京, 本科, 50, 初创型, 移动互联网
数据运营, 4, 1, 运营, 运营, 武汉达此网络科技有限公司, 武汉, 本科, 150, 成长型, 移动互联网 · O2O
数据运营, 7, 1年以, 运营, 运营, 同程旅游, 苏州, 大专, 2000, 成熟型, 移动互联网 · 旅游
数据运营, 5, 1, 运营, 运营, 电商宝, 杭州, 大专, 50, 成长型, 移动互联网 · 电子商务
数据运营专员, 7, 1, 运营, 运营, 脸脸, 杭州, 本科, 50, 成长型, 移动互联网 · O2O
数据运营, 5, 1, 运营, 运营, 电商宝, 杭州, 大专, 50, 成长型, 移动互联网 · 电子商务
数据运营, 9, 1, 运营, 运营, 杭州度假客国际旅行社有限公司, 杭州, 本科, 50, 成长型, 移动互联网 · 生活服务
数据运营, 11, 3, 运营, 运营, 减约, 北京, 本科, 15, 成长型, 移动互联网 · 医疗健康
数据运营, 7, 1, 运营, 运营, 领结管家, 北京, 本科, 50, 成长型, 移动互联网 · 数据服务
数据运营, 9, 1, 运营, 运营, 盒子鱼英语, 北京, 本科, 50, 成长型, 移动互联网 · 教育
数据运营, 4, 1, 运营, 运营, 趣住啊, 上海, 学历不限, 15, 初创型, 移动互联网 · 旅游
数据运营, 13, 3, 运营, 运营, 易跃移动, 上海, 本科, 150, 成长型, 移动互联网 · 游戏
数据运营, 27, 3, 运营, 运营, 互联网效果整合营销的领航者, 北京, 本科, 500, 成熟型, 移动互联网 · 电子商务
数据运营, 4, 1, 运营, 运营, 恒昌惠诚信息咨询有限公司, 南京, 大专, 2000, 初创型, 金融
数据运营, 4, 不, 运营, 运营, 魔格, 南京, 大专, 50, 上市公, 移动互联网
数据运营, 10, 3, 运营, 运营, 58同城, 深圳, 本科, 2000, 上市公, 生活服务 · 分类信息
数据运营, 15, 3, 运营, 运营, 买衣爽, 上海, 本科, 50, 成长型, 电子商务 · O2O
数据运营, 5, 1, 运营, 运营, 硅易科技, 杭州, 本科, 150, 成长型, 移动互联网 · 教育
数据运营, 2, 不, 运营, 运营, 光逸, 深圳, 本科, 15, 初创型, 电子商务
数据运营（实习）, 4, 应届毕业, 运营, 编辑, 天天投, 北京, 本科, 15, 成长型, 移动互联网 · 金融
数据运营, 5, 1, 运营, 运营, 枫车, 广州, 大专, 150, 成长型, 电子商务 · O2O
数据运营, 6, 1, 运营, 运营, 中国先锋金融集团, 北京, 本科, 500, 成长型, 金融
数据运营, 10, 3, 运营, 运营, 好车伯乐, 上海, 大专, 15, 初创型, O2O · 生活服务
数据运营, 12, 1, 运营, 运营, 同方联合, 杭州, 本科, 500, 成熟型, 其他
数据运营, 1, 不, 运营, 运营, 云活科技, 珠海, 学历不限, 50, 成长型, 移动互联网 · 企业服务
数据运营, 12, 1年以, 运营, 运营, 乐约科技, 北京, 学历不限, 150, 成长型, 移动互联网 · 医疗健康
数据运营, 5, 1, 运营, 运营, 58同城, 南宁, 本科, 2000, 上市公, 分类信息
数据运营, 27, 3, 运营, 运营, 海尔, 北京, 本科, 2000, 上市公, 广告营销 · 硬件
数据运营, 22, 3, 运营, 运营, 北京加双筷子科技有限公司, 北京, 本科, 150, 成长型, 移动互联网 · O2O
数据运营, 12, 1, 运营, 运营, 宝宝树, 北京, 本科, 500, 成熟型, 社交网络
数据运营, 4, 不, 运营, 运营, Apsoto, 上海, 学历不限, 15, 初创型, 电子商务
数据运营, 11, 1, 运营, 运营, 医统天下, 北京, 学历不限, 50, 成长型, 电子商务
数据运营, 11, 3, 运营, 运营, 联络互动, 北京, 本科, 2000, 上市公, 移动互联网 · 游戏
数据运营, 3, 不, 运营, 运营, 泰格斯信息, 北京, 学历不限, 15, 初创型, 电子商务 · 数据服务
数据运营, 5, 1年以, 运营, 运营, 58同城, 深圳, 大专, 2000, 上市公, 生活服务 · 分类信息
数据运营, 3, 1, 运营, 运营, 58到家, 南京, 大专, 2000, 成长型, O2O · 生活服务
数据运营, 6, 1, 运营, 运营, 拓天速贷, 北京, 本科, 150, 成长型, 金融
数据运营, 5, 不, 运营, 运营, 海底捞集团蜀海公司, 上海, 大专, 2000, 成熟型, 电子商务 · O2O
数据运营, 4, 1, 运营, 运营, 微易销, 广州, 大专, 50, 初创型, 移动互联网 · 广告营销
数据运营, 15, 3, 运营, 运营, 联创兄弟, 北京, 大专, 150, 初创型, 移动互联网 · 医疗健康
数据运营, 9, 1, 运营, 运营, 多盟, 北京, 大专, 150, 成长型, 移动互联网 · 广告营销
数据运营, 7, 1, 运营, 运营, 纽贝滋, 上海, 大专, 500, 初创型, 电子商务
数据运营, 6, 1, 运营, 运营, 帮定网, 上海, 大专, 50, 初创型, 移动互联网 · 电子商务
数据运营, 15, 5, 运营, 运营, 蓝莓会, 广州, 大专, 15, 初创型, 移动互联网 · 广告营销
数据运营, 7, 1, 运营, 运营, 看车科技, 北京, 大专, 150, 成熟型, 企业服务
数据运营, 7, 1, 运营, 运营, 吃饭儿, 北京, 本科, 150, 成长型, 电子商务 · 企业服务
数据运营, 6, 1, 运营, 运营, 创青春, 重庆, 本科, 50, 初创型, 移动互联网 · 金融
数据运营, 5, 1, 运营, 运营, GP, 成都, 大专, 15, 初创型, 移动互联网 · O2O
数据运营, 8, 3, 运营, 运营, 大致生活, 北京, 本科, 50, 成长型, 移动互联网
数据运营, 25, 3, 运营, 运营, 北京都仕林科技有限公司, 上海, 本科, 50, 成熟型, 移动互联网 · 医疗健康
数据运营, 15, 3, 运营, 运营, 掌众金融, 北京, 本科, 150, 成长型, 移动互联网 · 金融
数据运营（实习生可）, 4, 不, 运营, 运营, 云租客, 上海, 学历不限, 15, 初创型, 企业服务 · O2O
数据运营, 4, 1, 运营, 运营, 云脉三六五, 天津, 本科, 15, 初创型, 移动互联网
数据运营, 12, 1, 运营, 运营, 宜信公司, 北京, 本科, 2000, 成熟型, 移动互联网 · 金融
数据运营, 6, 1, 运营, 运营, 联合金融, 北京, 本科, 15, 初创型, 金融 · 数据服务
数据运营, 7, 1, 运营, 运营, 好贷网, 北京, 本科, 150, 成长型, O2O · 金融
数据运营, 9, 1, 运营, 编辑, Soul－基于心灵的交友神器, 上海, 大专, 15, 成长型, 移动互联网 · 社交网络
数据运营, 7, 1, 运营, 运营, 在家点点, 上海, 大专, 500, 成长型, O2O
数据运营, 12, 1, 运营, 运营, 龙席, 杭州, 大专, 150, 成长型, 电子商务
数据运营, 10, 1, 运营, 运营, 橙群网络科技（本地头条）, 杭州, 本科, 15, 初创型, 移动互联网 · 文化娱乐
数据运营, 7, 1, 运营, 运营, CAAD中估联行数据中心, 上海, 本科, 50, 成长型, 移动互联网 · 数据服务
数据运营, 8, 1年以, 运营, 运营, 九斗, 北京, 本科, 15, 初创型, 金融
数据运营专员, 5, 应届毕业, 运营, 运营, 蜜蜂银行, 北京, 本科, 150, 成长型, 金融
数据运营, 7, 1, 运营, 运营, 博雅科诺, 北京, 本科, 15, 成长型, 游戏
数据运营, 17, 3, 运营, 运营, 图超市, 上海, 本科, 150, 成长型, 电子商务
数据运营, 9, 不, 运营, 运营, 优啦金服, 上海, 硕士, 50, 初创型, 移动互联网 · 金融
数据运营, 15, 1, 运营, 运营, 邦利德, 北京, 大专, 50, 成长型, 移动互联网
数据运营, 7, 不, 运营, 运营, 在家点点, 上海, 本科, 500, 成长型, O2O
数据运营, 7, 1年以, 运营, 运营, 吃饭儿, 北京, 本科, 150, 成长型, 电子商务 · 企业服务
数据运营, 6, 1, 运营, 运营, 爱丁猫, 杭州, 学历不限, 15, 初创型, 移动互联网 · 电子商务
数据运营, 10, 3, 运营, 运营, 轻松家电, 深圳, 本科, 500, 成长型, O2O
数据运营, 3, 不, 运营, 运营, 丁丁租房, 北京, 大专, 2000, 成熟型, 移动互联网 · 电子商务
数据运营, 3, 不, 运营, 运营, 丁丁租房, 北京, 本科, 2000, 成熟型, 移动互联网 · 电子商务
数据运营, 15, 1, 运营, 运营, 网贷之家, 北京, 大专, 150, 成长型, 金融
数据运营, 4, 1, 运营, 运营, 58同城, 苏州, 本科, 2000, 上市公, 移动互联网
数据运营, 22, 3, 运营, 运营, 金手指矿产上海分公司, 上海, 本科, 500, 成熟型, 移动互联网 · 金融
数据运营, 7, 3, 运营, 运营, 北京微赢互动科技有限公司, 重庆, 本科, 150, 成长型, 移动互联网 · 广告营销
数据运营, 5, 1, 运营, 运营, 简途旅行, 成都, 本科, 50, 成长型, 移动互联网 · 旅游
数据运营, 15, 3, 运营, 运营, 京东金融, 北京, 本科, 2000, 上市公, 金融
数据运营, 8, 3, 运营, 运营, 1号车险, 北京, 大专, 15, 成长型, 移动互联网
数据运营, 1, 应届毕业, 运营, 运营, 北京中科三方, 北京, 大专, 150, 成熟型, 移动互联网
数据运营, 5, 不, 运营, 运营, 卡惠, 北京, 学历不限, 15, 初创型, 移动互联网 · 金融
数据运营, 11, 5, 运营, 运营, 闽南网商报道, 上海, 本科, 15, 初创型, 电子商务
数据运营, 30, 3, 运营, 运营, 宜信公司, 北京, 本科, 2000, 成熟型, 移动互联网 · 金融
数据运营, 25, 3, 运营, 运营, e代驾, 北京, 本科, 500, 成熟型, 移动互联网 · O2O
数据运营, 15, 3, 运营, 运营, 掌众金融, 北京, 本科, 150, 成长型, 移动互联网 · 金融
数据运营, 16, 1, 运营, 运营, MAKA, 北京, 本科, 50, 成长型, 移动互联网 · 社交网络
数据运营, 5, 不, 运营, 运营, 文思海辉, 北京, 学历不限, 2000, 成熟型, 移动互联网 · 企业服务
数据运营, 9, 1, 运营, 运营, 有车么, 上海, 本科, 150, 初创型, 电子商务
数据运营, 8, 1, 运营, 运营, 水世界, 上海, 大专, 50, 上市公, 电子商务
数据运营, 30, 不, 运营, 运营, 宜信公司, 北京, 本科, 2000, 成熟型, 移动互联网 · 金融
数据运营, 11, 1, 运营, 运营, 时年信息, 上海, 本科, 15, 初创型, 移动互联网 · 游戏
数据运营, 7, 1, 运营, 运营, 美味不用等, 上海, 大专, 500, 成熟型, 移动互联网 · O2O
数据运营, 8, 1, 运营, 运营, 家家送火锅, 北京, 本科, 50, 初创型, 移动互联网 · 其他
数据运营, 15, 1, 运营, 运营, 优酷土豆, 北京, 本科, 2000, 上市公, 数据服务 · 文化娱乐
数据运营, 7, 1, 运营, 运营, 成都里森纳科技有限公司, 成都, 大专, 15, 初创型, 移动互联网 · O2O
数据运营, 5, 1, 运营, 运营, 慧聪网, 北京, 大专, 2000, 上市公, 移动互联网 · 电子商务
数据运营, 7, 1年以, 运营, 运营, 中国先锋金融集团, 北京, 本科, 500, 成长型, 金融
数据运营, 22, 3, 运营, 运营, 腾讯, 北京, 本科, 2000, 上市公, 移动互联网  · 游戏
数据运营, 6, 1, 运营, 运营, 百传中云, 北京, 本科, 15, 初创型, 移动互联网
数据运营, 11, 3, 运营, 运营, 爱钱帮, 北京, 本科, 50, 初创型, 金融
数据运营, 5, 不, 运营, 运营, 百利天下教育, 北京, 本科, 500, 成熟型, 教育
【多看阅读】数据运营, 12, 1, 运营, 运营, 小米, 北京, 本科, 2000, 成熟型, 移动互联网
数据运营, 12, 不, 运营, 运营, 深圳前海力泽金融控股有限公司, 深圳, 大专, 50, 成长型, 金融
数据运营, 7, 1, 运营, 运营, POP时尚网络机构, 上海, 大专, 500, 成长型, 移动互联网 · 电子商务
数据运营, 6, 1, 运营, 运营, 58赶集集团, 上海, 大专, 2000, 上市公, 移动互联网
数据运营, 9, 1, 运营, 运营, 新沃金融, 北京, 本科, 500, 成熟型, 金融
数据运营, 10, 3, 运营, 运营, 嗒嗒巴士, 深圳, 本科, 150, 成长型, O2O
数据运营, 5, 1, 运营, 运营, 大投科技, 太原, 本科, 15, 初创型, 移动互联网 · O2O
数据运营, 10, 3, 运营, 运营, 邻客科技, 上海, 大专, 50, 初创型, 移动互联网
数据运营, 3, 不, 运营, 运营, Uber Beijing, 北京, 本科, 15, 成熟型, 移动互联网 · O2O
数据运营, 15, 3, 运营, 运营, 小美科技, 北京, 本科, 15, 成长型, 移动互联网
数据运营, 4, 不, 运营, 运营, 米粒科技, 南京, 学历不限, 15, 初创型, 企业服务 · 数据服务
数据运营, 5, 1, 运营, 运营, 卡保科技, 北京, 本科, 150, 成长型, 移动互联网 · O2O
数据运营, 8, 不, 运营, 运营, 瑞狮网络，实时竞价广告，RTB, 上海, 本科, 15, 成长型, 移动互联网 · 广告营销
数据运营, 4, 应届毕业, 运营, 运营, 上海微盟, 上海, 大专, 500, 成熟型, 移动互联网 · 电子商务
数据运营, 6, 1, 运营, 运营, 秒针系统, 北京, 本科, 150, 成熟型, 数据服务 · 广告营销
数据运营, 4, 1, 运营, 运营, 人人车, 北京, 本科, 500, 成熟型, O2O
数据运营, 4, 不, 运营, 运营, 软通技术服务有限公司, 北京, 大专, 2000, 上市公, 移动互联网 · 招聘
数据运营, 6, 1, 运营, 运营, 58到家, 杭州, 大专, 2000, 成长型, O2O · 生活服务
数据运营, 27, 3, 运营, 运营, 阿里巴巴, 杭州, 本科, 2000, 上市公, 移动互联网
数据运营, 5, 1, 运营, 运营, 钦联金融信息, 上海, 本科, 500, 成熟型, 金融
数据运营, 1, 不, 运营, 运营, 宾谷网络, 上海, 大专, 50, 成长型, 移动互联网
数据运营专员/主管, 7, 1, 运营, 运营, 18, 深圳, 大专, 150, 成长型, 移动互联网
数据运营, 10, 3, 运营, 运营, PowerVision, 北京, 本科, 150, 成长型, 数据服务
数据运营, 4, 1年以, 运营, 运营, 英迈思, 深圳, 大专, 500, 成长型, 电子商务 · 金融
数据运营, 9, 3, 运营, 运营, 浙江禾连, 杭州, 大专, 50, 成长型, 移动互联网
数据运营, 4, 1, 运营, 运营, 司顺设备, 上海, 本科, 50, 成长型, 电子商务
数据运营, 5, 1, 运营, 运营, ETCP, 广州, 本科, 500, 成长型, 移动互联网
数据运营, 19, 3, 运营, 运营, 青木科技, 深圳, 学历不限, 50, 成长型, 移动互联网 · O2O
数据运营, 4, 不, 运营, 运营, 玛雅蓝, 大连, 大专, 50, 成长型, 电子商务
数据运营, 15, 3, 运营, 运营, 亚投科技, 北京, 大专, 15, 成长型, 移动互联网 · 金融
数据运营, 25, 3, 运营, 运营, 途家网, 北京, 本科, 2000, 成熟型, 移动互联网 · O2O
数据运营, 14, 3, 运营, 运营, 艾德思奇adSage, 北京, 本科, 500, 成长型, 移动互联网 · 广告营销
数据运营, 9, 1, 运营, 运营, 手套游戏, 上海, 本科, 150, 上市公, 移动互联网
数据运营, 20, 3, 运营, 运营, 一起作业网, 北京, 本科, 150, 成熟型, 移动互联网 · 教育
数据运营, 17, 3, 运营, 运营, 易语文化, 上海, 学历不限, 15, 初创型, 文化娱乐 · 招聘
数据运营, 5, 不, 运营, 运营, 亿达信息深圳分公司, 深圳, 大专, 500, 上市公, 移动互联网
数据运营, 12, 3, 运营, 运营, 昼夜互娱, 北京, 学历不限, 150, 初创型, 移动互联网
数据运营, 5, 1, 运营, 运营, 上品爱, 北京, 大专, 15, 初创型, 电子商务 · 数据服务
数据运营, 4, 不, 运营, 运营, 云鸽在线, 北京, 大专, 15, 初创型, 数据服务
数据运营, 7, 1, 运营, 运营, 华誉维诚, 北京, 大专, 2000, 成熟型, O2O
数据运营（移动端APP）, 20, 3, 运营, 运营, 题谷教育, 北京, 大专, 150, 初创型, 移动互联网 · 教育
数据运营, 15, 1, 运营, 运营, 财神爷爷, 北京, 本科, 150, 成长型, 移动互联网 · 金融
数据运营, 9, 3, 设计, 用户研究, Opera欧朋, 北京, 本科, 150, 成熟型, 移动互联网
数据运营, 16, 3, 运营, 运营, 招商银行信用卡中心, 上海, 本科, 2000, 上市公, 移动互联网
数据运营专员, 3, 不, 运营, 运营, 好巧, 武汉, 大专, 50, 成长型, 数据服务
数据运营, 10, 1, 运营, 运营, 两只老虎, 北京, 大专, 15, 初创型, 移动互联网 · 电子商务
数据运营, 2, 不, 运营, 运营, 亚信, 北京, 本科, 2000, 上市公, 移动互联网 · 数据服务
数据运营, 7, 1, 运营, 运营, Maxent, 上海, 本科, 15, 成长型, 移动互联网 · 数据服务
数据运营, 2, 不, 运营, 运营, 海航集团-新华旅行, 北京, 本科, 150, 成长型, 移动互联网 · 电子商务
数据运营, 6, 不, 运营, 运营, 茄子快传, 北京, 本科, 50, 成长型, 移动互联网
数据运营, 8, 不, 运营, 运营, 祥岚餐饮, 上海, 大专, 15, 成长型, 其他
数据运营, 13, 3, 运营, 运营, 艾德思奇adSage, 北京, 大专, 500, 成长型, 移动互联网 · 广告营销
数据运营, 11, 1, 运营, 运营, 招手科技, 北京, 学历不限, 15, 初创型, 移动互联网 · 招聘
数据运营, 4, 1, 运营, 运营, 达唯科技, 北京, 大专, 50, 初创型, 游戏
数据运营, 5, 不, 运营, 运营, 亿达信息深圳分公司, 深圳, 大专, 500, 上市公, 移动互联网
数据运营, 15, 1, 运营, 运营, 阿凡题, 北京, 本科, 50, 成长型, 移动互联网 · 教育
数据运营, 5, 3, 运营, 运营, 好教练网, 上海, 本科, 15, 成长型, 生活服务
数据运营, 4, 1年以, 运营, 运营, 上海鼎有信息技术有限公司, 上海, 大专, 15, 初创型, 移动互联网 · 电子商务
数据运营, 15, 1, 运营, 运营, 滴滴出行（小桔科技）, 北京, 本科, 2000, 成熟型, 移动互联网 · 电子商务
数据运营, 10, 1, 运营, 运营, 优点互动, 北京, 本科, 50, 上市公, 文化娱乐
数据运营, 7, 不, 运营, 运营, 本来生活网, 上海, 本科, 2000, 成长型, 电子商务
数据运营, 6, 1, 运营, 运营, 首创置业-乐惠家社区O2O, 北京, 本科, 50, 成长型, 移动互联网 · O2O
数据运营, 15, 1, 运营, 运营, 天津五八到家生活服务有限公司, 北京, 本科, 150, 成长型, 移动互联网 · O2O
数据运营, 12, 1, 运营, 运营, 美丫妈妈, 北京, 本科, 50, 初创型, O2O
数据运营, 6, 1, 运营, 运营, 探鹿, 北京, 大专, 150, 成长型, 移动互联网 · 招聘
数据运营, 11, 1, 运营, 运营, 希望金融, 北京, 本科, 50, 上市公, 金融
数据运营, 6, 3, 运营, 运营, 侠客行网络科技, 长沙, 本科, 50, 初创型, 电子商务
数据运营, 11, 1, 运营, 运营, 平安 WiFi, 深圳, 本科, 2000, 成熟型, 移动互联网
数据运营, 12, 1, 运营, 运营, 天津五八到家生活服务有限公司, 北京, 本科, 150, 成长型, 移动互联网 · O2O
数据运营, 10, 1, 运营, 运营, 遇见网络, 广州, 大专, 50, 成长型, 移动互联网 · 社交网络
数据运营, 4, 1, 运营, 运营, 经典946, 成都, 大专, 15, 初创型, 广告营销
数据运营, 9, 应届毕业, 运营, 运营, 美团网, 北京, 本科, 2000, 成熟型, 移动互联网 · O2O
