UE/UX用户体现, 12, 3, 设计, 用户研究, 家睿, 广州, 本科, 15, 初创型, 教育 · 数据服务
高级产品经理-旅游用户方向, 25, 1, 产品, 产品经理, 美团网, 北京, 本科, 2000, 成熟型, 移动互联网 · O2O
运营实习生（电商、用户、内容运营）, 1, 不, 运营, 运营, 天涯社区, 广州, 本科, 500, 上市公, 移动互联网 · 社交网络
用户交互设计师 UE, 12, 1, 设计, 交互设计, 深圳市雨滴网络有限公司, 深圳, 本科, 50, 初创型, 移动互联网 · 电子商务
【百度实习】用户行为研究实习生, 4, 不, 技术, dba, 百度, 北京, 硕士, 2000, 上市公, 移动互联网
运营专员（用户、数据）, 5, 不, 运营, 运营, 折800, 北京, 本科, 500, 成熟型, 电子商务 · O2O
产品经理(亿级用户互联网), 22, 3, 产品, 产品经理, 新媒传信, 北京, 学历不限, 2000, 上市公, 移动互联网 · 数据服务
高级产品经理（搜索、推荐、广告方向）日千万级用户，你懂的, 22, 不, 产品, 产品经理, 1号店, 上海, 本科, 2000, 成熟型, 移动互联网
运营--产品/用户/数据类, 6, 1, 运营, 运营, 传化物流, 杭州, 本科, 500, 上市公, 移动互联网 · O2O
策略产品经理-用户画像方向, 25, 1, 产品, 产品经理, 美图公司, 北京, 本科, 500, 成熟型, 移动互联网 · 硬件
互联网运营总监（偏用户和内容运营）, 25, 5, 运营, 运营, 锐捷网络, 北京, 本科, 2000, 上市公, 硬件
移动产品经理（用户增长方向）, 20, 3, 产品, 产品经理, 陌陌, 北京, 本科, 150, 上市公, 社交网络
java架构师（要求大批量用户）, 25, 5, 技术, 后端开发, 计普企, 北京, 大专, 15, 初创型, 企业服务 · 数据服务
互联网产品经理（用户方向）, 27, 3, 产品, 产品经理, 国美电器, 北京, 本科, 2000, 上市公, O2O
（高级）数据分析/数据挖掘/算法工程（偏互联网用户行为分析）, 28, 3, 技术, 后端开发, 众安在线, 上海, 本科, 150, 成长型, 金融
高级数据分析师/数据挖掘/算法工程师(偏互联网用户行为分析方向), 25, 3, 技术, 高端技术职位, 众安在线, 上海, 本科, 150, 成长型, 金融
Java工程师（用户，计费 核心平台）, 17, 1, 技术, 后端开发, 掌趣科技, 北京, 大专, 2000, 上市公, 游戏
