艺人营销宣传总监, 17, 3, 市场与销售, 公关, 大神圈, 北京, 本科, 50, 成长型, 游戏 · 文化娱乐
销售经理/ 销售总监, 11, 1, 市场与销售, 销售, 金信网银, 北京, 本科, 15, 初创型, 金融 · 数据服务
销 售总监, 20, 5, 市场与销售, 销售, 捷通华声, 北京, 本科, 150, 成熟型, 移动互联网 · 数据服务
高级互联网金融 产品总监, 16, 5, 产品, 产品经理, 设计院, 广州, 本科, 2000, 上市公, 移动互联网 · 金融
融资总监, 17, 5, 职能, 高端职能职位, 北京华财会计股份有限公司, 北京, 本科, 500, 上市公, 移动互联网
产品总监, 25, 3, 产品, 高端产品职位, 壹江财智, 北京, 硕士, 15, 初创型, 企业服务 · 金融
客服主管, 8, 3, 运营, 客服, 360商城, 北京, 本科, 2000, 上市公, 移动互联网 · 电子商务
产品总监, 3, 1, 产品, 高端产品职位, 信和财富, 北京, 本科, 50, 上市公, 金融 · 其他
技术总监/经理, 40, 3, 技术, 高端技术职位, 淘淘族, 北京, 本科, 150, 成长型, 电子商务
行政总监/经理, 17, 5, 职能, 高端职能职位, 飞马国际, 深圳, 本科, 2000, 上市公, 其他
买家运营主管, 9, 3, 运营, 运营, 易直供, 南京, 本科, 150, 成长型, 移动互联网 · 电子商务
UED总监, 30, 3, 设计, 高端设计职位, 卷皮, 深圳, 本科, 500, 成长型, 电子商务
Android开发主管, 22, 3, 技术, 移动开发, 甭纠结, 上海, 本科, 15, 成长型, 移动互联网 · 社交网络
融资总监, 15, 1, 金融, 高端金融职位, 龙门, 北京, 本科, 15, 成长型, 移动互联网 · 金融
运营主管/经理（商家培训方向）, 10, 1, 运营, 运营, 典典养车&amp;典典车险, 杭州, 大专, 150, 成熟型, 移动互联网 · O2O
法务专业/主管, 15, 3, 职能, 法务, 华游, 上海, 本科, 15, 初创型, 移动互联网 · 游戏
金融产品项目总监, 18, 不, 产品, 高端产品职位, 小金所, 南京, 本科, 15, 初创型, 金融
高级客诉主管, 20, 3, 市场与销售, 高端市场职位, DJI大疆创新, 深圳, 本科, 2000, 初创型, 移动互联网 · 硬件
网络推广专员/主管, 6, 不, 运营, 运营, 深圳巨全网络, 深圳, 大专, 50, 初创型, 游戏
融资总监, 12, 1, 金融, 高端金融职位, 妈咪堂, 北京, 本科, 15, 初创型, 移动互联网 · 其他
招聘经理 Recruiting Manager, 6, 1, 职能, 人力资源, 增信通, 深圳, 本科, 15, 成长型, 金融 · 数据服务
UI主管, 20, 3, 设计, 视觉设计, 糖果金融, 北京, 本科, 150, 初创型, 金融
招聘主管, 7, 1, 职能, 人力资源, 住两天, 杭州, 本科, 50, 成长型, O2O · 旅游
PHP主管/经理, 20, 5, 技术, 后端开发, 鼎然信息科技, 深圳, 大专, 50, 成长型, 移动互联网
设计总监/高级经理, 27, 5, 设计, 高端设计职位, 丁盯, 北京, 本科, 15, 成长型, 硬件
产品总监, 22, 5, 产品, 高端产品职位, 黑马LIVE, 北京, 本科, 15, 成长型, 移动互联网
运营经理/主管, 15, 3, 运营, 运营, 农商1号, 北京, 本科, 150, 上市公, 移动互联网 · 电子商务
产品总监, 37, 5, 产品, 高端产品职位, 苏宁, 北京, 本科, 2000, 上市公, 电子商务
产品总监/产品经理, 45, 5, 产品, 产品经理, 360, 北京, 本科, 2000, 上市公, 移动互联网 · 游戏
产品总监, 37, 5, 产品, 高端产品职位, 苏宁, 上海, 本科, 2000, 上市公, 电子商务
高薪诚聘桂林商务主管/经理, 15, 不, 市场与销售, 销售, 酷配网, 桂林, 学历不限, 50, 初创型, 电子商务
APP运营主管, 7, 3, 运营, 运营, 优兑科技, 无锡, 大专, 150, 初创型, 移动互联网 · 电子商务
开发主管Java, 25, 3, 技术, 后端开发, 55海淘, 上海, 本科, 150, 成长型, 电子商务
移动云-产品总监, 32, 5, 产品, 高端产品职位, 迅雷, 深圳, 本科, 500, 上市公, 移动互联网
百科运营主管, 9, 不, 运营, 运营, 什么值得买, 北京, 学历不限, 150, 成长型, 电子商务 · 文化娱乐
BD总监, 37, 3, 市场与销售, 高端市场职位, 汇积分, 北京, 本科, 15, 初创型, O2O · 数据服务
投资者关系经理, 20, 3, 金融, 投融资, 艾亿新融, 北京, 本科, 50, 成长型, 金融
研究总监, 35, 5, 金融, 投融资, 研客, 北京, 硕士, 15, 成长型, 移动互联网 · 金融
售后服务主管, 8, 3, 运营, 客服, 人人车, 北京, 大专, 500, 成熟型, O2O
渠道经理（移民投资行业高薪急聘）, 9, 3, 市场与销售, 市场/营销, 鑫家园移民, 北京, 大专, 15, 初创型, 其他
运营主管/运营经理, 11, 1, 运营, 运营, 趣运动, 上海, 大专, 150, 成长型, 移动互联网  · O2O
百科运营主管（活动）, 9, 不, 运营, 运营, 什么值得买, 北京, 学历不限, 150, 成长型, 电子商务 · 文化娱乐
SEO主管, 7, 1, 市场与销售, 市场/营销, 客来乐, 北京, 大专, 50, 成长型, O2O
售前咨询总监, 15, 5, 技术, 企业软件, 捷通华声, 北京, 本科, 150, 成熟型, 移动互联网 · 数据服务
运营主管, 7, 3, 产品, 产品经理, 比如世界, 北京, 本科, 150, 成长型, 教育 · 文化娱乐
MRO采购主管, 15, 3, 市场与销售, 采购, DJI大疆创新, 深圳, 本科, 2000, 初创型, 移动互联网 · 硬件
市场 主管, 10, 1, 市场与销售, 市场/营销, 捷通华声, 北京, 本科, 150, 成熟型, 移动互联网 · 数据服务
市场主管, 8, 1, 市场与销售, 市场/营销, 爱康国宾, 北京, 本科, 2000, 上市公, 医疗健康
BD经理/总监, 20, 3, 市场与销售, 销售, 久诺金融, 北京, 大专, 50, 成长型, 广告营销
融资总监, 30, 5, 金融, 投融资, 酷米客公交, 深圳, 本科, 50, 成长型, 移动互联网
PR总监, 22, 5, 市场与销售, 公关, 白鹭时代, 北京, 学历不限, 150, 成长型, 游戏
运维主管, 19, 3, 技术, 运维, CBSI-爱卡汽车网, 北京, 大专, 500, 上市公, 文化娱乐
市场企划经理/总监, 11, 3, 市场与销售, 市场/营销, 又樂, 上海, 大专, 50, 成长型, 其他
售前咨询总监(厦门), 12, 5, 技术, 高端技术职位, 北京捷通华声语音技术有限公司, 厦门, 本科, 150, 初创型, 移动互联网 · 数据服务
市场主管/经理 营销策划, 7, 1, 市场与销售, 市场/营销, 中国服装网, 杭州, 大专, 50, 初创型, 电子商务
法务总监职位, 30, 不, 职能, 法务, 趣分期, 北京, 学历不限, 2000, 成熟型, 金融
招聘主管/经理, 7, 1, 职能, 人力资源, 游禧科技, 深圳, 学历不限, 150, 成长型, 游戏
市场主管, 12, 1, 市场与销售, 市场/营销, 捷通华声, 北京, 本科, 150, 成熟型, 移动互联网 · 数据服务
项目总监, 30, 10年以, 技术, 高端技术职位, 金恪集团, 上海, 本科, 500, 成熟型, 金融
客服经理/客服主管/资深客服, 5, 3, 运营, 客服, 速溶360, 上海, 大专, 15, 成长型, 移动互联网 · 社交网络
广点通投放主管, 12, 3, 市场与销售, 市场/营销, 唯品会, 广州, 本科, 2000, 上市公, 电子商务
成人用品事业部总监, 25, 5, 运营, 高端运营职位, 买卖宝, 北京, 本科, 500, 成熟型, 移动互联网 · 电子商务
融资总监, 17, 3, 金融, 高端金融职位, 普汇大通-海淀分公司, 北京, 本科, 500, 初创型, 金融
客服主管/商城客服主管, 5, 1, 运营, 客服, 有宠科技, 广州, 本科, 500, 成熟型, 移动互联网 · 社交网络
客服/商服总监, 12, 3, 运营, 高端运营职位, 吉沃, 广州, 本科, 15, 初创型, 移动互联网 · O2O
新媒体运营主管, 8, 3, 运营, 运营, 之间网（远景投资集团旗下）, 北京, 本科, 150, 成长型, 移动互联网 · 数据服务
IOS媒介总监, 18, 3, 运营, 运营, 深圳市海数互联科技有限公司, 深圳, 大专, 50, 初创型, 移动互联网
SEO主管, 6, 1, 市场与销售, 市场/营销, 汪星人, 广州, 大专, 15, 初创型, O2O · 生活服务
电商主管, 7, 1, 市场与销售, 销售, 龙象, 广州, 大专, 50, 成长型, 教育 · 分类信息
法务主管/经理（综合业务）, 14, 3, 职能, 法务, 亿谱汇, 北京, 本科, 500, 成熟型, 移动互联网 · 金融
市场商务主管, 10, 1, 市场与销售, 市场/营销, 恺英网络, 上海, 大专, 500, 上市公, 移动互联网 · 游戏
iOS主管, 21, 3, 技术, 移动开发, 货拉拉手机软件公司, 深圳, 本科, 150, 成长型, 移动互联网 · O2O
金融产品项目总监, 25, 3, 市场与销售, 投资, 金斧子, 深圳, 本科, 150, 成长型, 电子商务 · 金融
市场运营主管/总监, 15, 3, 市场与销售, 市场/营销, 云智信息, 南京, 本科, 50, 成长型, 移动互联网 · O2O
运维主管, 22, 5, 技术, 运维, 米学网, 北京, 本科, 150, 成长型, 移动互联网 · 教育
法务总监, 35, 10年以, 职能, 法务, 博彦科技, 北京, 本科, 2000, 上市公, 移动互联网
营销策划主管/经理, 11, 3, 市场与销售, 市场/营销, 虎扑体育, 上海, 大专, 150, 成熟型, 移动互联网 · 文化娱乐
招聘主管/经理, 11, 3, 职能, 人力资源, 小说阅读网, 北京, 本科, 50, 成长型, 移动互联网
市场推广总监, 20, 5, 市场与销售, 市场/营销, 乐舞, 北京, 大专, 15, 成长型, 移动互联网
活动策划执行主管/经理, 11, 1, 市场与销售, 市场/营销, 我要运动, 上海, 大专, 50, 成长型, 移动互联网 · O2O
Ebay店铺销售主管/经理（外贸）, 11, 3, 运营, 运营, 踏浪者国际, 北京, 本科, 500, 成长型, 电子商务
媒介运营主管/经理, 13, 3, 运营, 运营, MCAKE, 北京, 本科, 150, 成长型, 移动互联网 · 电子商务
互联网广告销售经理/总监（医药企业方向）, 9, 1, 市场与销售, 销售, 药店理货宝（广州小明科技）, 广州, 大专, 15, 初创型, 电子商务 · 医疗健康
售前咨询总监, 8, 不, 技术, 企业软件, 捷通华声, 北京, 硕士, 150, 成熟型, 移动互联网 · 数据服务
PHP主管, 22, 3, 技术, 后端开发, 艺术网, 上海, 大专, 150, 初创型, 移动互联网
融资总监, 25, 5, 金融, 投融资, 云赢网络科技有限公司, 北京, 本科, 2000, 成熟型, 电子商务
市场主管, 12, 3, 市场与销售, 市场/营销, 捷通华声, 北京, 本科, 150, 成熟型, 移动互联网 · 数据服务
融资经理, 11, 5, 金融, 投融资, 智融会, 深圳, 本科, 150, 成长型, 金融
市场推广总监, 7, 1, 市场与销售, 市场/营销, 蓝湾创想科技, 深圳, 大专, 15, 初创型, 移动互联网 · O2O
招聘主管, 7, 3, 职能, 人力资源, 网通社, 北京, 学历不限, 150, 成长型, 文化娱乐
行政总监/经理, 10, 1, 职能, 高端职能职位, 我来科技, 上海, 本科, 50, 上市公, 移动互联网 · O2O
电商运营主管/专员, 8, 3, 运营, 运营, 琅琅, 广州, 大专, 15, 成长型, 移动互联网 · 教育
人资主管, 6, 1, 职能, 人力资源, 小笨蛋, 广州, 本科, 15, 初创型, 电子商务 · 生活服务
SEM主管, 8, 3, 运营, 运营, keyrun, 珠海, 大专, 50, 成长型, 移动互联网 · 游戏
商务拓展主管, 4, 1, 市场与销售, 销售, 久彩科技, 广州, 大专, 15, 初创型, 移动互联网
品牌传播经理/主管（云净网）, 11, 3, 市场与销售, 市场/营销, 新媒传信, 北京, 本科, 2000, 上市公, 移动互联网 · 数据服务
品类营销策划主管/经理（美妆/母婴）, 16, 5, 市场与销售, 市场/营销, 唯品会, 广州, 本科, 2000, 上市公, 电子商务
网站运营主管, 6, 1, 运营, 运营, 出国留学网, 长沙, 大专, 50, 成长型, 移动互联网
连锁运营经理/总监, 11, 3, 运营, 运营, 超群高科, 深圳, 本科, 50, 成长型, 移动互联网 · O2O
UED总监, 40, 5, 设计, 高端设计职位, 1号店, 上海, 本科, 2000, 成熟型, 移动互联网
SEM主管, 15, 3, 市场与销售, 市场/营销, 盛阳咨询, 上海, 本科, 500, 上市公, 移动互联网 · 金融
运营主管, 25, 5, 运营, 运营, 碧园网, 北京, 本科, 15, 成长型, 电子商务 · O2O
投资者关系经理, 13, 1, 市场与销售, 投资, 蝌蚪众筹, 北京, 本科, 15, 初创型, 金融
活动企划主管, 12, 3, 市场与销售, 市场/营销, 宣爱智能, 北京, 本科, 150, 上市公, 移动互联网 · 教育
项目经理/主管, 26, 5, 技术, 项目管理, 中海微银, 北京, 大专, 2000, 成熟型, 金融
法务主管/经理, 8, 1, 职能, 法务, 亿航智能无人机Ehang, 广州, 本科, 150, 成长型, 移动互联网 · 硬件
Android开发主管, 22, 3, 技术, 移动开发, I WANT大学生兴趣活动平台, 杭州, 本科, 50, 成长型, 社交网络 · 广告营销
研发总监/技术总监/技术经理/PHP/, 22, 不, 技术, 高端技术职位, 兑兑碰-中鼎博华, 北京, 本科, 50, 成熟型, 电子商务
SEO主管, 6, 3, 市场与销售, 市场/营销, 万家热线, 合肥, 学历不限, 500, 成熟型, 移动互联网 · O2O
售前咨询总监, 13, 3, 技术, 企业软件, 捷通华声, 北京, 硕士, 150, 成熟型, 移动互联网 · 数据服务
网络推广主管, 16, 1, 运营, 运营, 云掌财经, 上海, 本科, 500, 成熟型, 移动互联网 · 金融
移动研发主管, 35, 5, 技术, 高端技术职位, 链家地产, 北京, 本科, 2000, 成熟型, 移动互联网 · O2O
网络推广主管, 10, 3, 运营, 运营, 能动英语, 北京, 本科, 500, 成长型, 教育
渠道总监, 22, 3, 市场与销售, 销售, 咸鱼游戏, 北京, 大专, 50, 成长型, 游戏
BD经理/总监, 12, 3, 市场与销售, 高端市场职位, 悦然心动, 武汉, 本科, 15, 成长型, 移动互联网 · 社交网络
移动产品总监, 40, 5, 产品, 产品经理, 美院帮, 北京, 本科, 15, 初创型, 移动互联网 · 教育
市场营销主管, 12, 5, 市场与销售, 市场/营销, 京东, 上海, 大专, 2000, 上市公, 移动互联网 · 电子商务
Java技术主管, 25, 5, 技术, 后端开发, 汽车之家, 北京, 学历不限, 2000, 上市公, 移动互联网 · 文化娱乐
Java主管, 15, 3, 技术, 后端开发, 南华智闻, 广州, 大专, 50, 成长型, 移动互联网
高级需求分析师/主管(000432), 15, 不, 技术, 项目管理, 北京捷越联合, 北京, 大专, 2000, 成熟型, 金融
社区运营经理/主管, 11, 1, 运营, 运营, 到喜啦, 上海, 大专, 500, 成长型, 移动互联网 · 电子商务
新媒体运营主管, 18, 1, 运营, 运营, 贝贝网, 杭州, 本科, 500, 成熟型, 电子商务
电商总监, 25, 5, 产品, 高端产品职位, 咕噜科技, 杭州, 本科, 15, 初创型, O2O
电商平台运营总监/经理, 22, 3, 运营, 高端运营职位, 么么嗖, 深圳, 本科, 150, 成长型, 移动互联网 · 电子商务
设计经理/主管, 22, 3, 设计, 高端设计职位, 59store, 杭州, 本科, 500, 成长型, 电子商务
BD主管, 12, 1, 市场与销售, 销售, 普惠融通, 北京, 本科, 2000, 成熟型, 金融
APP项目总监/经理, 40, 3, 技术, 项目管理, 新邦物流, 广州, 本科, 2000, 成熟型, 企业服务
运营经理/总监, 9, 3, 运营, 运营, 海客科技, 苏州, 大专, 50, 初创型, 移动互联网
地推经理/主管/专员, 6, 1, 市场与销售, 销售, 医小护, 北京, 大专, 50, 成长型, 移动互联网 · O2O
运营总监/经理, 22, 3, 运营, 运营, 志晟信息, 北京, 本科, 150, 上市公, 企业服务
招聘主管/经理, 13, 3, 职能, 人力资源, 博雅立方, 北京, 大专, 150, 成熟型, 数据服务
设计经理/主管, 10, 不, 设计, 高端设计职位, 启之发信息科技, 杭州, 学历不限, 15, 初创型, O2O
设计经理/主管, 10, 不, 设计, 高端设计职位, 启之发信息科技, 杭州, 学历不限, 15, 初创型, O2O
竞价运营主管, 7, 不, 运营, 运营, 广联先锋, 北京, 大专, 500, 初创型, 企业服务 · 数据服务
设计经理/主管, 6, 1, 设计, 高端设计职位, 优纳文创, 杭州, 大专, 15, 初创型, 广告营销
法务总监/高级法务经理, 14, 3, 金融, 审计税务, 胜诉360, 北京, 本科, 15, 初创型, 企业服务
BD总监, 25, 3, 市场与销售, 销售, 华游, 上海, 大专, 15, 初创型, 移动互联网 · 游戏
交互设计经理/主管, 20, 5, 设计, 高端设计职位, 汽车之家, 北京, 本科, 2000, 上市公, 移动互联网 · 文化娱乐
市场 总监, 20, 5, 市场与销售, 市场/营销, 捷通华声, 北京, 本科, 150, 成熟型, 移动互联网 · 数据服务
设计经理/主管, 10, 不, 设计, 高端设计职位, 启之发信息科技, 杭州, 学历不限, 15, 初创型, O2O
售前咨询总监, 13, 5, 运营, 客服, 捷通华声, 北京, 本科, 150, 成熟型, 移动互联网 · 数据服务
网络借贷风控总监, 27, 5, 金融, 风控, 小牛在线, 深圳, 本科, 2000, 成长型, 金融
投资者关系主管/经理/高级经理, 20, 5, 金融, 投融资, 星河互联集团, 北京, 大专, 500, 成熟型, 移动互联网
风险副总监, 40, 5, 金融, 风控, 上海融兴通达金融信息服务有限公司, 上海, 本科, 50, 成长型, 金融
媒介主管-JCMJ, 12, 1, , 媒介经理, 意念文化, 深圳, 大专, 15, 初创型, 移动互联网 · 文化娱乐
海外运营经理/总监, 22, 不, 运营, 运营, Avazu, 上海, 学历不限, 150, 上市公, 移动互联网 · 广告营销
招聘主管, 22, 1, 职能, 人力资源, 快手, 北京, 本科, 15, 成长型, 移动互联网
SEO主管, 8, 不, 运营, 运营, 康冠-KTC, 深圳, 大专, 2000, 成熟型, 移动互联网 · 硬件
供应链专员/主管, 9, 1, 市场与销售, 供应链, 必要商城, 上海, 本科, 50, 成长型, 电子商务
财务分析主管, 12, 3, 职能, 财务, 一起作业网, 北京, 大专, 150, 成熟型, 移动互联网 · 教育
战略并购总监, 80, 5, 金融, 高端金融职位, SEASTAR, 深圳, 本科, 150, 上市公, 移动互联网 · 电子商务
融资总监, 42, 5, 金融, 高端金融职位, 爱上旅游, 上海, 本科, 50, 成长型, 移动互联网 · 旅游
媒介总监, 21, 5, 市场与销售, 市场/营销, 比酷科技, 北京, 本科, 15, 上市公, 社交网络
融资主管, 22, 不, 金融, 投融资, 海航-前海航交所, 深圳, 本科, 50, 成长型, 移动互联网 · 金融
运营主管/经理, 5, 1, 运营, 运营, 居高科技, 天津, 大专, 50, 成长型, 移动互联网 · 广告营销
电商总监, 10, 3, 运营, 运营, 儿童地盘, 金华, 大专, 50, 初创型, 电子商务 · O2O
媒介运营主管, 9, 1, 运营, 运营, 易直供, 南京, 大专, 150, 成长型, 移动互联网 · 电子商务
渠道拓展总监, 19, 5, 市场与销售, 销售, 泰金所, 上海, 本科, 50, 成长型, 移动互联网 · 金融
新媒体运营主管, 11, 3, 运营, 运营, 蓝色行星, 上海, 学历不限, 15, 成长型, 旅游 · 移动互联网
网络运营经理/主管, 17, 5, 运营, 运营, 金鹏, 广州, 本科, 2000, 初创型, 信息安全 · 硬件
公共关系（PR）总监, 12, 3, 市场与销售, 公关, 艾道, 广州, 本科, 15, 初创型, 移动互联网 · 数据服务
设计经理/主管, 12, 3, 设计, 高端设计职位, 先手科技, 杭州, 本科, 50, 成长型, 移动互联网 · 电子商务
高级产品经理/产品总监, 22, 5, 产品, 产品经理, 聚贸, 杭州, 大专, 150, 成长型, 金融 · 电子商务
防损总监, 25, 10年以, 金融, 风控, 爱鲜蜂, 北京, 大专, 500, 成熟型, O2O
公关主管, 12, 1, 市场与销售, 公关, 寻医问药网, 北京, 本科, 500, 成长型, 移动互联网
海外产品总监, 22, 5, 产品, 产品经理, 美图公司, 厦门, 本科, 500, 成熟型, 移动互联网 · 硬件
市场总监/经理, 15, 3, 市场与销售, 高端市场职位, 海带旅行, 深圳, 本科, 15, 初创型, 旅游
校园推广（区域主管）, 10, 3, 市场与销售, 高端市场职位, 兼职猫, 广州, 大专, 150, 成长型, 移动互联网  · O2O
商务主管/专员, 8, 不, 市场与销售, 高端市场职位, 凯斯美, 北京, 学历不限, 15, 初创型, 移动互联网 · O2O
融资经理, 15, 5, 职能, 财务, 仙歌公司, 深圳, 本科, 15, 初创型, 电子商务
招聘主管, 11, 3, 职能, 人力资源, 闪银奇异, 北京, 本科, 150, 成长型, 移动互联网 · 金融
新媒体运营主管, 10, 3, 运营, 运营, 渡鸦科技, 北京, 本科, 50, 成长型, 移动互联网 · 数据服务
网络推广主管, 8, 1, 运营, 运营, 乐信付, 杭州, 大专, 150, 成长型, 移动互联网 · 金融
前端主管, 30, 3, 技术, 前端开发, 海风教育, 上海, 学历不限, 50, 成长型, 教育
商务拓展主管, 9, 不, 市场与销售, 市场/营销, PPmoney互联网金融平台, 广州, 大专, 150, 成长型, 金融
渠道总监, 12, 3, 市场与销售, 销售, 东信时代, 北京, 大专, 500, 成熟型, 移动互联网
融资总监, 30, 3, 金融, 高端金融职位, 网信集团, 北京, 大专, 2000, 成长型, 金融
网销部总监, 12, 不, 市场与销售, 市场/营销, 巨景金太阳投顾中心, 成都, 学历不限, 500, 成熟型, 金融
UED负责人（总监/经理）, 22, 3, 设计, 交互设计, 当当网, 北京, 本科, 2000, 上市公, 移动互联网 · 电子商务
财务分析主管/经理, 20, 5, 职能, 财务, 洋码头, 上海, 本科, 150, 成长型, 移动互联网 · 电子商务
天猫运营经理/主管, 11, 3, 运营, 运营, 熙浪信息, 杭州, 大专, 150, 上市公, 电子商务
高级需求分析师/主管(000432), 17, 5, 技术, 项目管理, 北京捷越联合, 北京, 本科, 2000, 成熟型, 金融
设计经理/主管, 9, 不, 设计, 高端设计职位, 启之发信息科技, 杭州, 学历不限, 15, 初创型, O2O
设计经理/主管, 11, 3, 设计, 高端设计职位, 九仓再生, 杭州, 本科, 500, 成熟型, 其他
UED总监, 17, 5, 设计, 高端设计职位, 大华股份, 杭州, 本科, 2000, 上市公, 信息安全
融资总监, 12, 不, 金融, 高端金融职位, 弈业国际, 北京, 学历不限, 50, 成长型, 金融
融资总监, 17, 5, 金融, 投融资, 聚达人, 北京, 本科, 50, 初创型, 移动互联网 · 生活服务
线上推广总监, 29, 5, 运营, 运营, 趣医网, 上海, 本科, 500, 成长型, 移动互联网 · 医疗健康
风控总监, 42, 5, 金融, 风控, 易点租, 北京, 本科, 150, 成长型, 电子商务
电商运营主管, 11, 1, 运营, 运营, 味库, 北京, 本科, 50, 成长型, 生活服务
物流总监, 12, 1, 市场与销售, 供应链, 一起火, 杭州, 大专, 50, 成长型, 移动互联网 · 电子商务
客服总监, 8, 3, 运营, 客服, 魔幻蓝天, 北京, 大专, 50, 初创型, 企业服务 · 广告营销
天猫运营专员/主管, 7, 1, 市场与销售, 销售, 宝贝全计划, 上海, 大专, 15, 成长型, 移动互联网
人力资源主管, 6, 3, 职能, 人力资源, 安天, 哈尔滨, 本科, 150, 成长型, 信息安全
财务总监/经理, 10, 5, 职能, 高端职能职位, 东软集团西南大区, 拉萨, 本科, 2000, 上市公, 移动互联网
集团私募事业部产品总监, 12, 10年以, 产品, 高端产品职位, 红岭创投, 深圳, 本科, 2000, 上市公, 移动互联网 · 金融
前端主管, 16, 3, 技术, 前端开发, 三一重工股份有限公司, 北京, 大专, 2000, 上市公, 移动互联网 · 电子商务
产品经理/总监, 30, 3, 产品, 产品经理, 山东瀚讯, 青岛, 本科, 50, 成长型, 教育
财务总监/经理, 15, 5, 职能, 高端职能职位, 云厨, 长沙, 本科, 150, 初创型, 移动互联网 · O2O
省业务总监, 10, 3, 市场与销售, 高端市场职位, 上海阿特门计算机技术有限公司, 石家庄, 学历不限, 50, 成长型, 移动互联网 · 电子商务
总裁助理/总监助理, 12, 3, 市场与销售, 市场/营销, 一猫汽车网, 北京, 本科, 150, 成长型, 电子商务 · O2O
iOS主管, 12, 3, 技术, 移动开发, camelot, 广州, 学历不限, 2000, 上市公, 企业服务 · 其他
招聘经理/主管, 12, 5, 职能, 人力资源, 国人, 深圳, 本科, 2000, 上市公, 硬件 · 其他
品类运营主管, 6, 3, 运营, 运营, 抹茶美妆, 成都, 学历不限, 50, 成长型, 移动互联网 · 电子商务
运营总监/经理, 30, 3, 运营, 运营, 中青宝, 深圳, 本科, 500, 上市公, 移动互联网 · 游戏
U3D开发主管, 16, 1, 技术, 前端开发, 它它, 上海, 本科, 15, 初创型, 移动互联网 · 文化娱乐
品牌策划总监, 16, 5, 市场与销售, 高端市场职位, 钱进家, 上海, 本科, 500, 成熟型, 移动互联网 · 金融
网站运营主管（番禺）, 15, 1, 运营, 运营, 伊的家, 广州, 大专, 150, 初创型, 电子商务
设计经理/主管, 9, 3, 设计, 高端设计职位, 浙江粮油, 杭州, 本科, 150, 成长型, 移动互联网 · 其他
招聘经理 Recruting Manager, 20, 5, 职能, 人力资源, Funplus Game 趣加游戏, 北京, 本科, 150, 成长型, 游戏
BD总监, 20, 5, 市场与销售, 高端市场职位, 天谷, 杭州, 大专, 50, 成长型, 移动互联网 · 信息安全
品牌总监, 23, 3, 市场与销售, 高端市场职位, 畅游, 北京, 大专, 2000, 上市公, 移动互联网 · 游戏
微信运营主管, 7, 1, 运营, 运营, 驴徒网, 上海, 大专, 50, 成长型, 电子商务 · 社交网络
网站运营经理/主管, 15, 3, 运营, 运营, 到喜啦, 上海, 本科, 500, 成长型, 移动互联网 · 电子商务
html5主管, 30, 3, 技术, 前端开发, 棠棣科技, 上海, 本科, 150, 上市公, 金融
SEO主管, 8, 3, 运营, 运营, Moonbasa梦芭莎, 广州, 大专, 500, 成熟型, 移动互联网 · 电子商务
SEO主管, 9, 1, 市场与销售, 市场/营销, 紫鲸互联, 广州, 大专, 50, 成长型, 移动互联网
运营推广总监, 7, 3, 运营, 运营, 在街上, 厦门, 本科, 50, 成长型, O2O · 硬件
