产品总监, 45, 5, 产品, 高端产品职位, 寻牛, 北京, 本科, 50, 成长型, 移动互联网 · 金融
营销运营主管, 12, 1, 市场与销售, 市场/营销, 网贷之家, 上海, 大专, 150, 成长型, 金融
业务需求主管1, 30, 1, 产品, 产品经理, 路路由, 上海, 本科, 150, 成长型, 移动互联网 · O2O
市场策划主管, 6, 1, 市场与销售, 市场/营销, FOTILE方太, 宁波, 本科, 2000, 成熟型, 移动互联网 · 电子商务
薪酬绩效经理/主管/专员, 6, 1, 职能, 人力资源, 汇车科技, 南京, 大专, 50, 成长型, 移动互联网 · O2O
直销车高级策划总监/经理, 15, 3, 市场与销售, 高端市场职位, 车团网, 上海, 大专, 150, 成熟型, 移动互联网 · 电子商务
渠道主管, 6, 1, 市场与销售, 市场/营销, 时尚德源, 深圳, 大专, 50, 初创型, 电子商务 · 游戏
市场主管, 12, 1, 市场与销售, 市场/营销, 时代互联科技有限公司, 珠海, 本科, 50, 成熟型, 移动互联网
渠道总监, 9, 3, 市场与销售, 市场/营销, 美业邦, 北京, 本科, 50, 成长型, 移动互联网
渠道总监 （北京）, 20, 3, 市场与销售, 销售, 舜飞科技, 北京, 本科, 50, 成长型, 移动互联网
企划总监, 12, 5, 市场与销售, 市场/营销, 云赢网络科技有限公司, 北京, 本科, 2000, 成熟型, 电子商务
PHP技术经理/技术主管, 22, 3, 技术, 高端技术职位, 哪拍网, 北京, 大专, 50, 初创型, 电子商务 · O2O
运营部总监, 20, 3, 运营, 高端运营职位, 秀水街电商, 北京, 本科, 15, 初创型, 电子商务
新媒体总监, 8, 不, 运营, 高端运营职位, 多利宝, 北京, 本科, 15, 初创型, 移动互联网 · 金融
APP产品总监, 25, 5, 产品, 高端产品职位, 微星星, 深圳, 本科, 15, 初创型, 移动互联网
理财顾问、理财经理，投资顾问, 12, 不, 市场与销售, 投资, 财鱼管家, 北京, 学历不限, 15, 成长型, 移动互联网 · 金融
市场经理/总监, 12, 不, 市场与销售, 高端市场职位, NAMULIFE, 北京, 大专, 15, 成长型, 移动互联网 · 广告营销
客户总监, 21, 5, 市场与销售, 市场/营销, 比酷科技, 北京, 本科, 15, 上市公, 社交网络
产品总监, 30, 5, 产品, 高端产品职位, 中房研协, 北京, 本科, 150, 成长型, 企业服务
活动策划主管/经理, 15, 1, 市场与销售, 市场/营销, 唯品会, 上海, 本科, 2000, 上市公, 电子商务
商务拓展经理/总监, 9, 1, 市场与销售, 销售, 优图智像 Ufoto, 深圳, 大专, 15, 初创型, 移动互联网
招聘主管/经理, 7, 3, 职能, 人力资源, 青木科技, 广州, 本科, 150, 初创型, 电子商务
风控总监, 9, 1, 金融, 高端金融职位, 链农, 北京, 大专, 150, 成长型, 移动互联网
融资经理, 9, 3, 金融, 投融资, 陕西美阳, 西安, 学历不限, 150, 初创型, O2O · 其他
风控总监, 22, 5, 金融, 风控, 沐金农, 北京, 本科, 15, 初创型, 金融
BD经理, 14, 3, 市场与销售, 销售, 生意专家, 上海, 本科, 15, 成长型, 移动互联网 · O2O
医学总监, 30, 不, 运营, 高端运营职位, 北京斯利安药业, 北京, 博士, 500, 初创型, 医疗健康
合肥招商专员/主管/经理, 15, 不, 市场与销售, 销售, 酷配网, 合肥, 学历不限, 50, 初创型, 电子商务
项目总监, 25, 3, 技术, 高端技术职位, 杭州唛客网络科技有限公司, 上海, 本科, 150, 上市公, 移动互联网 · 电子商务
产品总监, 12, 5, 产品, 高端产品职位, 武汉亿房网, 武汉, 本科, 150, 上市公, 移动互联网
会计主管, 6, 3, 职能, 财务, 美院帮, 北京, 本科, 15, 初创型, 移动互联网 · 教育
审计经理/主管, 8, 3, 金融, 审计税务, 居分期网络科技, 北京, 本科, 50, 初创型, 生活服务 · O2O
产品总监, 50, 5, 产品, 高端产品职位, 四达时代集团, 北京, 本科, 2000, 成熟型, 文化娱乐 · 硬件
总监助理（经理级）, 17, 3, 职能, 行政, 百分点, 北京, 本科, 500, 成熟型, 数据服务
市场主管, 9, 3, 市场与销售, 市场/营销, 看车科技, 北京, 学历不限, 150, 成熟型, 企业服务
90后市场主管, 9, 应届毕业, 市场与销售, 市场/营销, 朔雨, 上海, 学历不限, 15, 初创型, 移动互联网 · O2O
CRM运营主管, 12, 3, 运营, 运营, 卖客疯APP（宝尊电商旗下，纳斯达克上市公司）, 上海, 本科, 500, 上市公, 移动互联网 · 电子商务
房产经纪人主管, 8, 3, 市场与销售, 市场/营销, 乔迁之喜, 北京, 本科, 50, 初创型, O2O · 生活服务
工程实施主管, 8, 3, 技术, 企业软件, 网融, 广州, 本科, 15, 初创型, 移动互联网
PHP技术经理/主管, 11, 3, 技术, 后端开发, 免签精选游, 广州, 本科, 50, 成长型, 电子商务 · 旅游
业务员/客户主管, 5, 1, 市场与销售, 市场/营销, 深圳市标驰信息技术有限公司, 深圳, 学历不限, 15, 初创型, 数据服务
招聘主管/经理, 11, 3, 职能, 人力资源, 北京金瑞龙集团, 北京, 本科, 2000, 成熟型, 金融
项目管理主管（经理）-北京-知春里, 15, 3, 技术, 项目管理, Gridsum 国双, 北京, 本科, 500, 成熟型, 数据服务
招聘主管, 10, 3, 职能, 人力资源, 深圳雅活荟网络科技有限公司, 深圳, 大专, 150, 上市公, 移动互联网 · O2O
视觉设计创意经理/主管, 12, 5, 设计, 高端设计职位, 骆驼服饰, 广州, 本科, 2000, 初创型, 电子商务
电商运营主管, 6, 1, 运营, 运营, 中配电商, 广州, 本科, 50, 成长型, 电子商务 · O2O
招聘主管/经理, 6, 1, 职能, 人力资源, 穿衣助手, 上海, 大专, 50, 成长型, 移动互联网 · 电子商务
运营推广经理/城市经理, 18, 3, 运营, 运营, 网鱼网咖.鱼泡泡, 深圳, 大专, 15, 成长型, 生活服务
数据运营主管, 4, 1, 运营, 运营, 盘石网盟, 杭州, 本科, 500, 成长型, 电子商务  · 企业服务
商务拓展副总监, 22, 5, 市场与销售, 市场/营销, 平安科技, 上海, 本科, 2000, 成熟型, 金融
产品总监, 30, 5, 产品, 高端产品职位, 米络科技（KK直播）-中国梦之声等直播合作平台, 杭州, 本科, 150, 成长型, 移动互联网
行政总监/经理, 4, 不, 职能, 高端职能职位, 禧德上海, 上海, 大专, 15, 初创型, 教育 · 旅游
测试主管, 15, 5, 技术, 测试, 广交会电商, 广州, 本科, 50, 成长型, 电子商务
产品总监, 37, 5, 产品, 高端产品职位, 天天用车, 北京, 本科, 150, 成熟型, 移动互联网
QC审核主管, 6, 1, 运营, 客服, 51offer, 上海, 大专, 150, 成长型, 移动互联网
商务主管, 15, 3, 市场与销售, 市场/营销, 2144游戏网, 上海, 大专, 150, 初创型, 移动互联网 · 游戏
IT项目总监, 12, 3, 技术, 高端技术职位, 易煤网, 郑州, 本科, 150, 上市公, 电子商务
媒介总监, 11, 1, 市场与销售, 公关, 天天发发, 北京, 本科, 15, 成长型, 移动互联网 · 广告营销
市场推广总监, 12, 5, 市场与销售, 市场/营销, 河南华侨, 郑州, 大专, 50, 初创型, 移动互联网
投资者关系经理, 17, 3, 金融, 投融资, 康泽药业, 广州, 硕士, 500, 上市公, 电子商务 · 其他
高级战略总监, 25, 5, 市场与销售, 市场/营销, 同盾科技, 杭州, 硕士, 150, 成长型, 信息安全 · 数据服务
营销策划总监, 27, 5, 市场与销售, 市场/营销, 微讯联盟, 北京, 本科, 150, 成长型, 移动互联网 · 电子商务
FM主管, 7, 5, 职能, 行政, 文思海辉, 深圳, 本科, 2000, 成熟型, 移动互联网 · 企业服务
投资人开发经理, 12, 5, 市场与销售, 投资, 三人贷, 成都, 大专, 15, 成长型, 金融
BD经理/主管, 15, 不, 市场与销售, 销售, 艺讯, 北京, 学历不限, 15, 成长型, 移动互联网 · O2O
产品总监, 10, 5, 产品, 高端产品职位, 联合创想, 合肥, 本科, 15, 成长型, 移动互联网 · 电子商务
HR总监, 15, 3, 职能, 人力资源, 幻世网络, 厦门, 本科, 50, 成长型, 移动互联网
媒介总监, 11, 3, 市场与销售, 公关, 天天发发, 北京, 本科, 15, 成长型, 移动互联网 · 广告营销
媒介总监, 8, 5, 市场与销售, 公关, 天天发发, 北京, 本科, 15, 成长型, 移动互联网 · 广告营销
终端开发总监, 35, 5, 技术, 高端技术职位, 象翌微链, 深圳, 本科, 50, 初创型, 移动互联网 · 电子商务
资产管理总监, 25, 1, 金融, 投融资, 斑马王国, 北京, 本科, 50, 成长型, 金融 · 数据服务
媒介专员/主管, 8, 1, 市场与销售, 公关, 南方银谷, 上海, 大专, 150, 成熟型, 移动互联网 · 数据服务
风控总监, 11, 3, 金融, 高端金融职位, 融吧, 北京, 大专, 50, 初创型, 移动互联网 · 金融
OD主管, 9, 1, 职能, 人力资源, 京东金融, 北京, 本科, 2000, 上市公, 金融
融资经理, 8, 1, 金融, 投融资, 康创投资, 深圳, 本科, 50, 成长型, 移动互联网
仓储总监, 30, 10年以, 市场与销售, 供应链, 美菜网, 北京, 大专, 2000, 成熟型, 电子商务 · O2O
商务经理/主管, 7, 3, 市场与销售, 市场/营销, 中辉世纪传媒, 北京, 本科, 50, 初创型, 游戏 · 文化娱乐
销售经理/主管, 12, 3, 市场与销售, 销售, 醉品春秋, 深圳, 大专, 150, 成长型, 电子商务
大连招商专员/主管/经理, 15, 1年以, 市场与销售, 销售, 酷配网, 大连, 学历不限, 50, 初创型, 电子商务
产品总监, 20, 5, 产品, 高端产品职位, 壹财税, 广州, 大专, 50, 初创型, O2O
审计经理/主管, 12, 5, 职能, 财务, 苏州金螳螂建筑装饰股份有限公司, 苏州, 本科, 2000, 上市公, O2O
高级薪酬福利经理/总监, 17, 5, 职能, 人力资源, 一点资讯, 北京, 本科, 150, 成熟型, 移动互联网
风控经理/总监, 30, 5, 金融, 风控, 亿谱汇, 北京, 本科, 500, 成熟型, 移动互联网 · 金融
产品总监, 30, 5, 产品, 产品经理, 掌合天下, 北京, 本科, 150, 成长型, 电子商务
产品总监, 20, 3, 产品, 高端产品职位, 云智数据, 深圳, 本科, 15, 初创型, O2O
产品总监, 30, 5, 产品, 高端产品职位, 必要商城, 北京, 本科, 50, 成长型, 电子商务
医美顾主管, 7, 1, 市场与销售, 销售, 优呗, 杭州, 大专, 15, 初创型, 移动互联网
融资总监, 22, 3, 职能, 高端职能职位, 企印宝, 广州, 本科, 15, 初创型, O2O
纠纷处理主管, 7, 1, 金融, 风控, 乾途金融, 北京, 学历不限, 50, 成长型, 金融
APP媒介总监, 18, 3, 运营, 运营, 深圳市海数互联科技有限公司, 深圳, 大专, 50, 初创型, 移动互联网
企业文化主管, 10, 3, 职能, 人力资源, 优品财富管理有限公司, 武汉, 本科, 500, 初创型, 金融
总监秘书, 4, 1, 职能, 行政, 对接通, 上海, 大专, 15, 初创型, 移动互联网 · 招聘
市场推广总监, 22, 5, 市场与销售, 市场/营销, 时代际客, 深圳, 本科, 50, 成长型, 移动互联网 · 社交网络
融资经理, 15, 3, 金融, 投融资, 乐牛网络, 深圳, 大专, 15, 初创型, 移动互联网
平台研发总监, 30, 5, 技术, 高端技术职位, 马上金融, 北京, 本科, 150, 成长型, 金融
策划总监, 15, 5, 市场与销售, 市场/营销, 卡芙广告, 广州, 本科, 15, 初创型, 移动互联网
银行合作总监, 25, 3, 市场与销售, 销售, 网利宝, 北京, 本科, 150, 成长型, 移动互联网 · 金融
产品总监, 24, 5, 产品, 高端产品职位, 广州新一代信息科技有限公司, 广州, 本科, 150, 初创型, 移动互联网 · 电子商务
市场推广经理/主管, 12, 3, 市场与销售, 市场/营销, 如云科技, 北京, 大专, 15, 初创型, 移动互联网 · 电子商务
地推经理 / 主管, 17, 3, 市场与销售, 市场/营销, 再生活, 北京, 本科, 150, 成长型, 移动互联网 · 生活服务
品类运营主管/经理, 15, 3, 运营, 运营, 小红书, 上海, 本科, 150, 成熟型, 生活服务 · 电子商务
.Net研发总监, 22, 5, 技术, 高端技术职位, 上海久歌, 上海, 本科, 15, 初创型, O2O · 数据服务
媒介策划总监, 17, 3, 市场与销售, 高端市场职位, 时趣social-touch, 北京, 本科, 500, 成熟型, 移动互联网
俄罗斯市场主管, 15, 1, 市场与销售, 市场/营销, 恺英网络, 上海, 大专, 500, 上市公, 移动互联网 · 游戏
运营经理/主管, 17, 3, 运营, 运营, 中嘉和信, 北京, 本科, 50, 初创型, 数据服务
纠纷处理主管, 7, 1, 金融, 风控, 乾途金融, 北京, 大专, 50, 成长型, 金融
市场推广主管, 12, 3, 市场与销售, 市场/营销, 传化物流集团, 杭州, 本科, 500, 上市公, 移动互联网 · 电子商务
产品总监/产品合伙人, 19, 不, 产品, 产品经理, 假面科技, 上海, 本科, 15, 成长型, 移动互联网 · 社交网络
实施总监（交付总监）, 25, 5, 技术, 高端技术职位, 软通动力, 深圳, 本科, 2000, 上市公, 移动互联网
运营主管, 4, 1, 运营, 运营, 武汉快玩, 武汉, 大专, 15, 初创型, 移动互联网 · 游戏
运营主管, 10, 3, 运营, 运营, 优曼家纺, 北京, 大专, 150, 成长型, 电子商务
客服总监, 15, 5, 运营, 高端运营职位, 中铭智, 深圳, 大专, 500, 初创型, 金融
品牌主管, 7, 3, 市场与销售, 公关, 讯鸟软件, 北京, 本科, 150, 成长型, 数据服务
采购总监, 12, 3, 市场与销售, 高端市场职位, 货通天下, 上海, 大专, 50, 成长型, 电子商务 · 其他
法务主管/经理, 15, 3, 职能, 法务, 首都金控, 北京, 本科, 150, 上市公, 金融 · 其他
培训主管, 11, 1, 职能, 人力资源, 堆糖, 上海, 大专, 50, 成长型, 移动互联网 · 生活服务
产品总监, 25, 5, 产品, 高端产品职位, 中南先锋, 武汉, 大专, 15, 初创型, 移动互联网 · 金融
产品总监, 32, 5, 产品, 高端产品职位, 旺财宝, 成都, 大专, 150, 成长型, 移动互联网 · O2O
产品总监, 16, 5, 产品, 高端产品职位, 摩博（北京）科技有限公司, 北京, 本科, 50, 成长型, 移动互联网
PR（品牌总监）, 11, 1, 市场与销售, 公关, I WANT大学生兴趣活动平台, 杭州, 本科, 50, 成长型, 社交网络 · 广告营销
售后技术支持主管, 8, 不, 运营, 客服, 捷通华声, 北京, 本科, 150, 成熟型, 移动互联网 · 数据服务
商务拓展总监, 22, 1, 市场与销售, 高端市场职位, 新创板, 广州, 本科, 50, 成长型, 移动互联网 · 金融
运营经理/主管, 17, 3, 运营, 运营, 中嘉和信, 北京, 本科, 50, 初创型, 数据服务
网站推广主管, 7, 3, 市场与销售, 市场/营销, 博华展览, 上海, 大专, 150, 初创型, 电子商务 · 文化娱乐
运营主管, 10, 1, 运营, 运营, 次元仓, 广州, 本科, 50, 成长型, 电子商务
网络推广主管, 8, 3, 运营, 运营, 微娱科技, 深圳, 大专, 50, 初创型, 数据服务
招商加盟总监, 11, 1, 运营, 运营, 永伦金融, 上海, 本科, 150, 初创型, 移动互联网 · 金融
HR 总监, 14, 5, 职能, 人力资源, CATCH, 杭州, 本科, 15, 成长型, 移动互联网
信贷总监, 11, 3, 金融, 风控, 融吧, 北京, 大专, 50, 初创型, 移动互联网 · 金融
宣传策划总监, 15, 3, 市场与销售, 市场/营销, 清睿教育, 北京, 本科, 150, 成熟型, 移动互联网
支付产品总监, 32, 5, 产品, 产品经理, 蚂蜂窝, 北京, 本科, 150, 成熟型, 移动互联网 · 旅游
风控总监, 35, 5, 金融, 风控, 网利宝, 北京, 本科, 150, 成长型, 移动互联网 · 金融
技术 总监（大数据方向）, 20, 5, 技术, 高端技术职位, 捷通华声, 北京, 本科, 150, 成熟型, 移动互联网 · 数据服务
市场经理, 18, 5, 运营, 运营, 环球易购, 深圳, 大专, 500, 上市公, 电子商务
公关总监/经理, 25, 3, 市场与销售, 公关, 麦子金服, 上海, 本科, 150, 成长型, 移动互联网 · 金融
测试总监/经理, 30, 5, 技术, 测试, 麦子金服, 上海, 本科, 150, 成长型, 移动互联网 · 金融
资深招聘专员/主管, 6, 1, 职能, 人力资源, 亿方云科技, 杭州, 大专, 50, 成长型, 移动互联网 · 数据服务
医护管理总监, 14, 5, 职能, 高端职能职位, 趣医网, 北京, 大专, 500, 成长型, 移动互联网 · 医疗健康
SEM主管, 9, 1, 市场与销售, 市场/营销, 珍岛集团, 上海, 大专, 500, 成长型, 移动互联网 · 广告营销
运营主管, 6, 1, 运营, 运营, 跨鲜, 广州, 大专, 50, 初创型, 电子商务 · O2O
APP推广主管/专员, 4, 不, 运营, 运营, 有米科技, 广州, 学历不限, 150, 上市公, 移动互联网 · 广告营销
市场部总监, 37, 3, 市场与销售, 高端市场职位, 云来网络, 深圳, 大专, 150, 成长型, 移动互联网
销售经理/总监, 15, 1, 市场与销售, 市场/营销, kick9 手游平台, 上海, 大专, 15, 成长型, 移动互联网 · 游戏
运维主管/经理, 16, 3, 技术, 运维, 花生科技有限公司, 上海, 大专, 50, 成熟型, 移动互联网
运营经理/主管, 6, 1, 运营, 运营, 和租吧, 南京, 大专, 50, 成长型, O2O
海外招商主管/经理, 15, 3, 市场与销售, 市场/营销, 么么嗖, 深圳, 本科, 150, 成长型, 移动互联网 · 电子商务
客服总监, 30, 5, 运营, 客服, 蘑菇街, 杭州, 本科, 500, 成熟型, 电子商务
客户总监, 11, 5, 市场与销售, 高端市场职位, LKK洛可可设计, 北京, 本科, 150, 初创型, 文化娱乐
产品总监, 30, 3, 产品, 高端产品职位, 叫练－让运动更简单, 北京, 本科, 15, 成长型, 移动互联网 · 文化娱乐
培训主管, 8, 1, 职能, 人力资源, 人人车, 北京, 大专, 500, 成熟型, O2O
招商部总监, 11, 3, 市场与销售, 高端市场职位, 素剪, 杭州, 本科, 15, 初创型, O2O
Java开发主管, 31, 3, 技术, 后端开发, 上海斯迈康生物科技有限公司, 上海, 本科, 150, 成长型, 移动互联网
运营活动主管, 11, 不, 运营, 运营, 龙图游戏, 北京, 学历不限, 500, 成熟型, 游戏
电商教学产品总监/经理, 16, 5, 产品, 产品经理, 派代网, 广州, 本科, 50, 成长型, 移动互联网 · 电子商务
事件营销主管, 12, 5, 市场与销售, 市场/营销, 唯品会, 广州, 学历不限, 2000, 上市公, 电子商务
PR总监, 17, 5, 市场与销售, 公关, 大华股份, 杭州, 本科, 2000, 上市公, 信息安全
运营主管, 22, 3, 运营, 运营, 51信用卡管家, 杭州, 本科, 150, 成长型, 金融 · 数据服务
APP地面推广主管, 15, 1, 运营, 运营, 萨摩耶金服, 上海, 大专, 50, 初创型, 金融
运营主管, 15, 1, 运营, 高端运营职位, 摩天体育, 深圳, 大专, 15, 初创型, 移动互联网
市场推广主管, 16, 3, 市场与销售, 市场/营销, 东方财富, 上海, 本科, 500, 上市公, 金融
产品运营主管, 15, 3, 运营, 运营, 壹药网, 上海, 学历不限, 500, 成熟型, 移动互联网 · 电子商务
风控总监, 32, 5, 金融, 高端金融职位, 知名互联网金融公司, 北京, 本科, 500, 成熟型, 移动互联网
产品总监, 17, 5, 产品, 高端产品职位, 吃喝玩乐, 天津, 本科, 150, 初创型, 电子商务 · O2O
产品总监, 25, 5, 产品, 高端产品职位, 君融贷, 北京, 本科, 50, 成长型, 金融
产品总监, 25, 3, 产品, 高端产品职位, 天使育苗, 北京, 本科, 15, 初创型, 移动互联网 · 医疗健康
产品总监, 37, 5, 产品, 高端产品职位, 北京智能管家科技有限公司, 北京, 本科, 150, 成长型, 硬件
商务拓展主管, 8, 1, 市场与销售, 市场/营销, 北京捷越联合, 上海, 本科, 2000, 成熟型, 金融
团购运营主管/经理, 9, 3, 运营, 运营, 典典养车&amp;典典车险, 杭州, 大专, 150, 成熟型, 移动互联网 · O2O
法务总监, 22, 3, 职能, 法务, 聚财猫, 上海, 本科, 50, 成长型, 金融
绩效考核主管, 7, 3, 职能, 人力资源, 满艺网, 北京, 大专, 50, 成长型, 电子商务 · 文化娱乐
网络数据分析主管, 7, 1, 运营, 运营, 心蕊网络, 上海, 大专, 150, 初创型, 移动互联网 · 电子商务
运维主管, 10, 5, 技术, 运维, 申迪计算机, 广州, 本科, 150, 成长型, 企业服务 · 信息安全
网销主管, 6, 5, 运营, 运营, 美哒网络（空格）, 杭州, 本科, 150, 成长型, 移动互联网 · 生活服务
绩效主管, 12, 3, 职能, 人力资源, 京东金融, 北京, 本科, 2000, 上市公, 金融
采购主管, 11, 1, 市场与销售, 采购, 云助, 上海, 大专, 15, 初创型, 移动互联网 · 广告营销
创意总监, 30, 5, 设计, 高端设计职位, 云来网络, 深圳, 本科, 150, 成长型, 移动互联网
测试主管, 12, 5, 技术, 测试, 和佳汇智, 北京, 本科, 50, 成长型, 企业服务 · 金融
销售经理/主管, 8, 1, 市场与销售, 销售, 酷配网, 成都, 大专, 50, 初创型, 电子商务
产品总监, 30, 5, 产品, 高端产品职位, 返利网, 上海, 本科, 500, 成熟型, 电子商务
法务副总监, 32, 5, 职能, 法务, 沪江, 上海, 本科, 500, 成熟型, 移动互联网 · 教育
渠道总监, 7, 3, 市场与销售, 销售, 云晫, 广州, 大专, 15, 初创型, 教育 · 数据服务
数据开发工程师/主管, 30, 5, 技术, 后端开发, 车轮互联, 深圳, 本科, 150, 成长型, 移动互联网
电销主管, 6, 1, 市场与销售, 销售, 尚课无忧, 杭州, 学历不限, 50, 初创型, 电子商务
SEM主管, 11, 1, 市场与销售, 市场/营销, 珍岛集团, 上海, 大专, 500, 成长型, 移动互联网 · 广告营销
机构业务总监, 45, 5, 金融, 高端金融职位, 海投金融, 北京, 本科, 15, 初创型, 移动互联网 · 金融
商务主管, 6, 3, 职能, 法务, 云智信息, 南京, 本科, 50, 成长型, 移动互联网 · O2O
品牌总监助理, 5, 1, 市场与销售, 公关, 拍鞋网, 厦门, 大专, 150, 成长型, 电子商务
设计经理/主管, 20, 5, 设计, 高端设计职位, 明源软件, 武汉, 大专, 500, 上市公, 移动互联网 · 企业服务
电商经理/总监, 12, 5, 市场与销售, 高端市场职位, 卡儿酷, 深圳, 大专, 150, 成长型, 招聘
内容总监, 12, 5, 运营, 编辑, 青山老农, 广州, 本科, 50, 成长型, 电子商务 · 社交网络
人事主管/经理, 10, 3, 职能, 人力资源, 找珠宝网, 深圳, 大专, 50, 成长型, 电子商务 · 企业服务
产品总监, 30, 5, 产品, 高端产品职位, 鑫茂荣信, 北京, 本科, 500, 成熟型, 移动互联网 · 金融
产品总监（技术）, 7, 3, 产品, 高端产品职位, 智慧星光, 北京, 本科, 150, 初创型, 数据服务
产品总监, 27, 5, 产品, 产品经理, 卡木科技, 上海, 本科, 50, 成长型, 移动互联网 · 企业服务
产品总监, 42, 5, 产品, 高端产品职位, 知名互联网金融公司, 北京, 本科, 500, 成熟型, 移动互联网
产品总监, 30, 5, 产品, 高端产品职位, 鸿坤控股集团-亿润投资集团, 北京, 本科, 500, 成熟型, 金融
新媒体营销策划主管（双休）, 15, 1, 运营, 运营, 猛联科技, 广州, 本科, 15, 初创型, 移动互联网
运营主管, 9, 3, 运营, 运营, 票量科技, 杭州, 大专, 50, 初创型, 电子商务
UED总监, 30, 3, 设计, 高端设计职位, 卷皮, 深圳, 本科, 500, 成长型, 电子商务
自媒体文案策划主管, 9, 1, 市场与销售, 公关, 北京布雷恩科技有限公司, 北京, 本科, 15, 初创型, 企业服务
网络营销主管, 6, 1, 市场与销售, 市场/营销, 长沙乐恩教育咨询有限公司, 长沙, 大专, 15, 成长型, 电子商务
BD经理总监, 12, 1, 市场与销售, 销售, 布拉旅行, 上海, 学历不限, 15, 成长型, 移动互联网 · 旅游
人力资源总监／经理, 16, 不, 职能, 人力资源, OUTMAN淘汰郎, 北京, 学历不限, 50, 初创型, 移动互联网 · O2O
产品总监, 32, 5, 产品, 高端产品职位, 大安生物, 北京, 本科, 50, 初创型, 移动互联网 · 医疗健康
招聘主管/经理, 9, 3, 职能, 人力资源, 艾亿新融, 北京, 本科, 50, 成长型, 金融
招商经理/主管/专员, 9, 1, 市场与销售, 销售, 当地在线, 成都, 大专, 15, 初创型, 电子商务 · O2O
产品总监, 27, 1, 产品, 高端产品职位, 斑马王国, 北京, 本科, 50, 成长型, 金融 · 数据服务
软件实施项目总监, 17, 5, 技术, 高端技术职位, 上上签, 杭州, 本科, 50, 成长型, 移动互联网 · 企业服务
招聘主管, 6, 3, 职能, 人力资源, 满堂红链家&amp;商业地产部, 广州, 本科, 500, 上市公, 生活服务  · 广告营销
硬件开发主管, 64, 3, 技术, 硬件开发, 归墟电子, 上海, 本科, 15, 初创型, 移动互联网 · 其他
销售 总监, 13, 5, 市场与销售, 销售, 捷通华声, 北京, 本科, 150, 成熟型, 移动互联网 · 数据服务
金融、保险类产品经理/总监（多位）, 19, 不, 产品, 产品经理, 深圳惠卡世纪有限公司, 深圳, 学历不限, 500, 上市公, 移动互联网
招聘主管/经理-00751, 13, 5, 职能, 人力资源, 奔步, 广州, 本科, 150, 成熟型, 移动互联网 · 电子商务
风控总监, 37, 3, 金融, 高端金融职位, 时趣social-touch, 北京, 本科, 500, 成熟型, 移动互联网
投资者关系经理/总监, 25, 3, 金融, 投融资, 合金所, 上海, 本科, 15, 初创型, 金融
招聘管理主管/经理, 13, 5, 职能, 人力资源, 汇信银通, 上海, 本科, 15, 成熟型, 金融
媒介总监, 12, 1, 运营, 运营, 云时空, 深圳, 大专, 50, 成长型, 移动互联网
风控总监（信贷、小微贷背景优先）, 25, 3, 金融, 风控, 趣分期, 北京, 本科, 2000, 成熟型, 电子商务 · 金融
