研发经理（电子发票方向）, 18, 5, 技术, 高端技术职位, 中润四方, 深圳, 本科, 500, 成长型, 金融
技术总监/技术负责人, 37, 5, 技术, 高端技术职位, 国泰安, 北京, 本科, 2000, 成熟型, 教育 · 金融
微信开发, 12, 1, 技术, 移动开发, 摇摇空间, 北京, 大专, 15, 初创型, 移动互联网 · 广告营销
技术经理, 27, 5, 技术, 高端技术职位, 全民贷, 上海, 本科, 15, 成长型, 移动互联网 · 金融
市场合伙人, 15, 1, 市场与销售, 市场/营销, 西岸科技, 深圳, 学历不限, 15, 初创型, 电子商务 · 其他
客户服务工程师（会技术）, 5, 1, 运营, 客服, 泛微, 上海, 大专, 500, 成熟型, 移动互联网 · 企业服务
Windows Hello开发高级工程师, 16, 3, 技术, 后端开发, 释码大华, 北京, 本科, 50, 成熟型, 移动互联网
资深java开发, 18, 3, 技术, 后端开发, 米折网, 杭州, 本科, 500, 成熟型, 移动互联网 · 电子商务
技术工程部-java高级/资深开发工程师, 30, 5, 技术, 后端开发, 搜狗, 北京, 本科, 2000, 成熟型, 移动互联网 · 数据服务
广告反作弊开发Lead, 15, 3, 技术, 高端技术职位, 晶赞科技Zamplus, 上海, 本科, 150, 成熟型, 数据服务 · 文化娱乐
移动互联网技术负责人（安卓苹果）, 30, 3, 技术, 移动开发, 打工圈, 上海, 本科, 15, 成长型, 移动互联网 · O2O
SCORM课件开发/多媒体课件开发, 7, 不, 技术, 前端开发, 储吉信息技术, 上海, 大专, 150, 初创型, 移动互联网 · 其他
Android开发, 11, 1, 技术, 移动开发, 搜办, 杭州, 学历不限, 150, 初创型, O2O · 企业服务
PHP技术主管, 25, 3, 技术, 后端开发, 考拉FM, 北京, 本科, 500, 成长型, 移动互联网
技术经理, 17, 3, 技术, 高端技术职位, 纵横天下, 福州, 本科, 50, 成长型, 移动互联网 · 电子商务
Technical Consultant 技术咨询顾问, 22, 3, 技术, 项目管理, MISYS, 北京, 本科, 2000, 成熟型, 企业服务 · 数据服务
技术工具开发工程师（Java）, 15, 不, 技术, 后端开发, 京东金融, 北京, 本科, 2000, 上市公, 金融
高级研发经理, 25, 5, 技术, 高端技术职位, 中国网库, 北京, 本科, 500, 上市公, 电子商务 · 企业服务
Java研发/开发工程师, 6, 3, 技术, 后端开发, 安徽网川信息科技有限公司, 合肥, 本科, 15, 初创型, 企业服务 · 金融
html5开发, 15, 3, 技术, 前端开发, 达飞金融, 深圳, 本科, 2000, 成长型, 金融
.NET开发, 20, 3, 技术, 后端开发, 新锐国际, 上海, 本科, 500, 上市公, 移动互联网 · 电子商务
.NET开发, 16, 1, 技术, 后端开发, 通联集团, 北京, 本科, 150, 成长型, 移动互联网 · O2O
存储系统研发架构师, 22, 5, 技术, 高端技术职位, UCloud, 上海, 本科, 500, 成熟型, 数据服务
平台开发高级工程师, 19, 3, 技术, 移动开发, 中国电信北京研究院, 北京, 本科, 2000, 成熟型, 移动互联网
.NET高级开发攻城狮, 12, 1, 技术, 后端开发, 易正, 上海, 大专, 50, 成长型, 移动互联网 · 企业服务
技术经理iOS, 25, 5, 技术, 移动开发, 全程电子商务, 上海, 本科, 150, 成长型, 企业服务 · O2O
河南区域技术销售主管（郑州）, 8, 3, 市场与销售, 销售, 米学网, 郑州, 大专, 150, 成长型, 移动互联网 · 教育
html5开发（休闲游戏）, 7, 1, 技术, 前端开发, 奥点科技, 杭州, 大专, 50, 初创型, 社交网络
开发项目经理, 16, 3, 技术, 后端开发, 金域检验, 广州, 本科, 500, 成熟型, 医疗健康
技术经理, 9, 5, 技术, 高端技术职位, 联合创想, 合肥, 本科, 15, 成长型, 移动互联网 · 电子商务
技术经理, 21, 5, 技术, 高端技术职位, 威视, 南京, 本科, 2000, 成熟型, 信息安全 · 数据服务
PHP开发, 15, 1, 技术, 后端开发, 嗨美极, 杭州, 大专, 15, 成长型, 电子商务
PHP开发, 15, 1, 技术, 后端开发, 嗨美极, 杭州, 大专, 15, 成长型, 电子商务
技术运维工程师, 4, 不, 技术, 运维, 天高智慧, 青岛, 大专, 50, 成长型, 移动互联网 · 教育
Android开发, 12, 1, 技术, 移动开发, 易保互联, 杭州, 大专, 50, 初创型, 移动互联网
技术研发主管（JAVA方向）, 25, 5, 技术, 后端开发, 恒昌利通, 北京, 大专, 2000, 成熟型, 金融
技术经理, 18, 3, 技术, 高端技术职位, 深圳市保利物业管理集团有限公司, 深圳, 本科, 2000, 成熟型, 电子商务 · 生活服务
COO合伙人, 12, 不, 运营, 高端运营职位, 深圳市骑行运动科技有限公司, 深圳, 本科, 15, 初创型, 移动互联网
运营合伙人, 10, 3, 运营, 运营, IPLUS, 深圳, 学历不限, 15, 初创型, 移动互联网
技术经理, 30, 5, 技术, 高端技术职位, 易居中国-易居营销集团, 上海, 本科, 2000, 上市公, 企业服务
Java开发, 20, 不, 技术, 后端开发, 永洪科技, 北京, 本科, 150, 成长型, 移动互联网
DBA/大数据开发, 30, 5, 技术, dba, 卓伯信息, 珠海, 本科, 150, 成长型, 移动互联网 · 游戏
技术经理, 17, 5, 技术, 高端技术职位, 好孩子电商事业部, 上海, 大专, 2000, 成熟型, 电子商务
高级Java开发, 12, 3, 技术, 后端开发, 紫川软件, 深圳, 大专, 150, 成长型, 电子商务 · 金融
软件研发经理（.NET）, 11, 3, 技术, 后端开发, 理德物联网, 广州, 本科, 50, 初创型, 企业服务 · 硬件
HTML5开发, 15, 1, 技术, 移动开发, 广州移动, 广州, 本科, 2000, 上市公, 移动互联网
技术经理, 13, 1, 产品, 高端产品职位, 凯闻思, 重庆, 本科, 15, 初创型, 移动互联网 · 医疗健康
JAVA开发, 19, 3, 技术, 后端开发, 创想华凯科技, 上海, 本科, 150, 成长型, 电子商务 · 硬件
研发总监, 17, 不, 技术, 高端技术职位, 掌柜攻略, 北京, 本科, 15, 初创型, 移动互联网 · O2O
.NET中级研发, 6, 1, 技术, 后端开发, 软云, 南昌, 大专, 50, 成长型, 数据服务
ARM开发, 9, 3, 技术, 硬件开发, 唯创知音, 深圳, 大专, 50, 初创型, 移动互联网 · 其他
软件开发/研发, 7, 1, 技术, 后端开发, 开始软件, 上海, 大专, 15, 初创型, 企业服务
技术经理, 30, 5, 技术, 高端技术职位, 神工, 北京, 本科, 150, 成长型, 移动互联网 · 电子商务
招聘专员（互联网研发IT方向）, 5, 1, 职能, 人力资源, 永利宝, 上海, 大专, 150, 成长型, 金融
Java服务器开发（急聘）, 18, 3, 技术, 后端开发, 坏男孩, 深圳, 本科, 150, 成长型, 移动互联网
自动化测试工具开发（中科院芯片与软件研发中心）, 24, 5, 技术, 测试, 上海沪方, 上海, 本科, 150, 成长型, 移动互联网
前端技术专家, 15, 3, 技术, 前端开发, 一加手机, 深圳, 本科, 500, 初创型, 电子商务
技术经理（博客、论坛类）, 22, 3, 技术, 高端技术职位, 美试网, 北京, 大专, 50, 成长型, 电子商务
技术运营/编辑, 7, 不, 运营, 运营, SegmentFault, 杭州, 学历不限, 15, 成长型, 移动互联网 · 社交网络
首席产品官/副总裁/合伙人, 18, 不, 产品, 高端产品职位, 伊视可眼镜, 上海, 学历不限, 50, 初创型, O2O · 生活服务
技术经理 （PHP/.net+Oracle+Linux）, 20, 5, 技术, 高端技术职位, 骆驼服饰, 广州, 大专, 2000, 初创型, 电子商务
PHP开发, 10, 1, 技术, 后端开发, 友融传媒, 上海, 大专, 50, 初创型, 金融 · 文化娱乐
技术经理, 17, 3, 技术, 高端技术职位, 欧立方, 北京, 本科, 15, 初创型, 移动互联网 · 金融
研发经理, 17, 3, 技术, 后端开发, 趣互联, 北京, 本科, 15, 初创型, 移动互联网 · 社交网络
APP开发, 12, 1, 技术, 移动开发, 汉义生物科技, 北京, 本科, 500, 成熟型, 医疗健康 · 生活服务
后端开发, 15, 不, 技术, 后端开发, 坚果云, 上海, 本科, 50, 成长型, 企业服务 · 数据服务
PHP开发程序猿, 12, 不, 技术, 后端开发, 玖旭, 杭州, 学历不限, 15, 初创型, 电子商务 · 广告营销
高级测试技术工程师, 6, 1, 技术, 测试, 文思海辉, 无锡, 学历不限, 2000, 成熟型, 移动互联网 · 企业服务
高级PHP开发 （组长）, 22, 3, 技术, 后端开发, 爱上租, 杭州, 大专, 500, 初创型, 移动互联网 · O2O
技术总 监（云计算方向）, 20, 5, 技术, 高端技术职位, 捷通华声, 北京, 本科, 150, 成熟型, 移动互联网 · 数据服务
Java中高级开发, 22, 3, 技术, 后端开发, 轻易贷, 北京, 本科, 2000, 上市公, 金融
工具平台开发主管, 15, 3, 技术, 运维, 卷皮, 深圳, 本科, 500, 成长型, 电子商务
手机服务端开发经理, 25, 不, 技术, 后端开发, 小牛在线, 深圳, 本科, 2000, 成长型, 金融
高级Java开发, 15, 3, 技术, 后端开发, 好买基金网（联想腾讯注资企业）, 上海, 本科, 500, 成熟型, 电子商务 · 金融
高级技术经理, 17, 3, 技术, 高端技术职位, 谷武科技, 北京, 本科, 50, 成长型, 移动互联网 · 电子商务
Java 后台研发, 10, 1, 技术, 后端开发, 联程科技, 北京, 大专, 15, 初创型, 信息安全 · 企业服务
PHP研发经理, 15, 3, 技术, 后端开发, 哪拍网, 北京, 大专, 50, 初创型, 电子商务 · O2O
技术总监CTO（合伙人）, 11, 3, 技术, 高端技术职位, 烹烹科技, 合肥, 本科, 15, 初创型, 移动互联网
.NET开发（联想控股), 12, 1, 技术, 后端开发, 神州智联, 北京, 大专, 50, 成长型, 移动互联网 · 教育
后端开发其它, 20, 3, 技术, 后端开发, 珠海筑巢, 珠海, 本科, 15, 初创型, 移动互联网 · 电子商务
技术经理, 22, 3, 技术, 高端技术职位, 健康微能量, 北京, 大专, 50, 成长型, 移动互联网 · 医疗健康
技术专家, 30, 10年以, 技术, 高端技术职位, 嘉琪科技, 北京, 本科, 50, 成长型, 移动互联网 · 电子商务
技术经理, 17, 5, 技术, 高端技术职位, 步传云, 厦门, 大专, 15, 初创型, 移动互联网 · O2O
技术经理, 30, 5, 技术, 高端技术职位, 透云科技, 上海, 本科, 150, 成长型, 移动互联网 · 数据服务
数据库开发, 12, 3, 技术, dba, 文思海辉, 深圳, 大专, 2000, 上市公, 移动互联网
硬件研发, 9, 1, 技术, 硬件开发, 氦氪, 杭州, 学历不限, 50, 成长型, 移动互联网 · 硬件
研发实习生, 3, 不, 技术, 前端开发, Datartisan 数据工匠, 厦门, 学历不限, 15, 初创型, 企业服务 · 数据服务
分布式JAVA开发, 20, 3, 技术, 后端开发, 畅捷通, 北京, 本科, 500, 上市公, 移动互联网 · 企业服务
Java中级开发, 17, 3, 技术, 后端开发, 乐士网络, 深圳, 大专, 50, 成长型, 电子商务 · 社交网络
PHP开发攻城狮, 11, 1, 技术, 后端开发, 冰吉网络, 广州, 大专, 15, 初创型, 移动互联网 · 电子商务
大数据库研发, 10, 3, 技术, 高端技术职位, 日日顺, 北京, 大专, 500, 上市公, 其他
深圳研发总监　, 30, 3, 技术, 高端技术职位, 云丛科技, 深圳, 大专, 15, 成长型, 移动互联网
开发技术总监, 20, 3, 技术, 高端技术职位, 睿陟网络, 上海, 本科, 15, 初创型, 移动互联网 · O2O
技术经理, 9, 3, 技术, 高端技术职位, 大华股份, 杭州, 本科, 2000, 上市公, 信息安全
中级iOS开发, 15, 3, 技术, 移动开发, 网鱼网咖.鱼泡泡, 上海, 学历不限, 15, 成长型, 生活服务
.NET技术主管, 11, 3, 技术, 后端开发, 康泽药业, 广州, 大专, 500, 上市公, 电子商务 · 其他
java开发北京, 12, 1, 技术, 后端开发, 百航信息, 北京, 本科, 50, 成长型, 移动互联网 · 金融
技术经理, 20, 5, 技术, 高端技术职位, 趣互联, 北京, 本科, 15, 初创型, 移动互联网 · 社交网络
Java开发攻城狮, 15, 1, 技术, 后端开发, 车果网, 杭州, 本科, 50, 成长型, 移动互联网 · O2O
Java服务器开发（急聘）, 18, 3, 技术, 移动开发, 坏男孩, 深圳, 本科, 150, 成长型, 移动互联网
深圳研发经理, 30, 3, 技术, 高端技术职位, 深圳大爆炸, 深圳, 学历不限, 150, 成长型, 移动互联网
产品经理-上海研发中心, 20, 1, 产品, 产品经理, e代驾, 上海, 本科, 500, 成熟型, 移动互联网 · O2O
微信商城PHP开发, 15, 不, 技术, 后端开发, 麦圈互动, 深圳, 本科, 15, 初创型, 移动互联网 · 广告营销
PHP工程师-技术, 18, 3, 技术, 后端开发, 火传媒, 上海, 本科, 500, 成熟型, 文化娱乐 · 移动互联网
Java后端开发, 22, 1, 技术, 后端开发, 联永智能, 上海, 大专, 15, 初创型, 移动互联网 · 数据服务
多媒体互动开发, 15, 3, 设计, 交互设计, 北京飞凡互动顾问有限公司, 北京, 本科, 15, 初创型, 广告营销
资深Android开发, 18, 3, 技术, 移动开发, 微盟, 上海, 大专, 500, 成熟型, 移动互联网 · 电子商务
研发经理, 12, 3, 技术, 企业软件, 倍亚得, 上海, 本科, 50, 上市公, 移动互联网
通信平台开发, 17, 3, 技术, 后端开发, 中国电信北京研究院, 北京, 本科, 2000, 成熟型, 移动互联网
研发经理/技术经理, 11, 5, 技术, 高端技术职位, 中华商务贸易公司, 广州, 本科, 50, 成长型, 电子商务 · 移动互联网
音乐教育产品研发, 8, 3, 产品, 产品经理, 赭石教育, 北京, 本科, 15, 初创型, 移动互联网 · 教育
Java开发, 22, 3, 技术, 后端开发, 创想华凯科技, 上海, 本科, 150, 成长型, 电子商务 · 硬件
技术经理, 25, 5, 技术, 高端技术职位, 他趣, 厦门, 大专, 50, 成长型, 移动互联网 · 电子商务
iOS高级开发, 20, 5, 技术, 移动开发, 用友深圳创新中心, 深圳, 学历不限, 2000, 上市公, 移动互联网 · 企业服务
技术经理, 21, 5, 技术, 高端技术职位, 狄邦教育, 上海, 本科, 500, 成熟型, O2O · 教育
AS3开发工程, 11, 1, 技术, 前端开发, 杭州牧游网络, 杭州, 大专, 50, 初创型, 游戏
Java开发实习生, 3, 不, 技术, 后端开发, 杭州道顺, 杭州, 大专, 15, 初创型, 移动互联网 · 其他
html5开发, 9, 1, 技术, 前端开发, 拍鞋网, 厦门, 大专, 150, 成长型, 电子商务
移动研发主管, 6, 1, 技术, 移动开发, 七木, 烟台, 本科, 15, 初创型, 移动互联网 · 社交网络
高级后端开发/服务器开发工程师, 22, 3, 技术, 后端开发, 触宝科技, 上海, 本科, 150, 成熟型, 移动互联网 · 数据服务
高级Java开发, 20, 5, 技术, 后端开发, 车果网, 杭州, 本科, 50, 成长型, 移动互联网 · O2O
iOS架构师/高级研发经理, 32, 5, 技术, 移动开发, 滴滴打车, 北京, 本科, 500, 成熟型, 移动互联网
开发经理, 12, 1, 技术, 后端开发, 创筹网络, 惠州, 本科, 15, 初创型, 电子商务
Java 研发, 13, 3, 技术, 后端开发, 点旺无限, 北京, 本科, 15, 初创型, 移动互联网
技术经理, 9, 3, 技术, 高端技术职位, 学信贷官网, 南宁, 本科, 15, 初创型, 金融 · 其他
后端开发其它, 14, 1, 技术, 后端开发, 宏企在线, 南京, 大专, 15, 初创型, 移动互联网 · 企业服务
Java研发, 7, 1, 技术, 后端开发, 东东科技, 珠海, 学历不限, 50, 初创型, 移动互联网 · 电子商务
PHP研发实习生, 3, 不, 技术, 后端开发, 企家有道, 北京, 本科, 15, 初创型, 企业服务
技术经理, 10, 1, 技术, 高端技术职位, 慧银科创, 重庆, 本科, 150, 初创型, 移动互联网 · 医疗健康
技术经理（智慧城市/电子政务）, 22, 5, 技术, 高端技术职位, 慧点科技, 北京, 本科, 500, 上市公, 企业服务
技术经理, 25, 3, 技术, 高端技术职位, 厦门市云客网络科技有限公司, 上海, 大专, 50, 初创型, 移动互联网 · 电子商务
技术经理, 31, 5, 技术, 高端技术职位, DerbySoft, 上海, 本科, 150, 成熟型, 旅游
Android开发, 18, 1, 技术, 移动开发, Dingtone, 杭州, 本科, 50, 成熟型, 移动互联网 · 社交网络
HR合伙人, 45, 3, 职能, 人力资源, 协创, 上海, 学历不限, 15, 上市公, 企业服务
测试工程师（技术研发部）, 7, 1, 技术, 测试, 远传技术, 杭州, 学历不限, 150, 成熟型, 金融 · 数据服务
安卓技术经理, 30, 3, 技术, 移动开发, CVTE, 广州, 本科, 500, 成熟型, 数据服务 · 硬件
Java开发经理, 15, 5, 技术, 后端开发, 银信网银, 深圳, 大专, 150, 成熟型, 金融
Java应用开发, 22, 1, 技术, 移动开发, 联永智能, 上海, 大专, 15, 初创型, 移动互联网 · 数据服务
开发实习生-北京-00004, 5, 不, 技术, 移动开发, Jide Remix, 北京, 本科, 50, 成长型, 移动互联网
微信商城PHP开发, 15, 不, 技术, 后端开发, 麦圈互动, 广州, 本科, 15, 初创型, 移动互联网 · 广告营销
基础平台技术经理, 27, 5, 技术, 高端技术职位, 马上金融, 北京, 本科, 150, 成长型, 金融
技术转移中心主任, 22, 3, 技术, 项目管理, 新一代, 深圳, 大专, 50, 初创型, 企业服务 · 教育
系统开发工程师（后端开发）, 15, 1, 技术, 高端技术职位, SenseTime, 深圳, 本科, 150, 成长型, 移动互联网
C++研发, 10, 3, 技术, 后端开发, 联程科技, 北京, 大专, 15, 初创型, 信息安全 · 企业服务
.net研发经理, 24, 5, 技术, 高端技术职位, 微创, 上海, 本科, 2000, 初创型, 移动互联网 · 数据服务
研发经理, 17, 3, 技术, 后端开发, 投资网, 上海, 大专, 15, 初创型, 金融
技术经理, 15, 3, 技术, 高端技术职位, 网创, 杭州, 学历不限, 50, 初创型, 电子商务
移动研发经理, 30, 5, 技术, 高端技术职位, 链家地产, 北京, 本科, 2000, 成熟型, 移动互联网 · O2O
研发采购工程师, 6, 3, 市场与销售, 采购, 华诺星空, 长沙, 本科, 150, 成长型, 硬件 · 其他
研发主管, 15, 5, 技术, 高端技术职位, 万创聚力, 北京, 本科, 50, 初创型, O2O
高级Android开发【深圳】, 22, 3, 技术, 移动开发, 纷享销客, 深圳, 本科, 500, 成熟型, 移动互联网
技术经理, 10, 5, 技术, 高端技术职位, 天芒云信息技术, 武汉, 大专, 15, 初创型, 移动互联网
技术经理, 22, 3, 技术, 高端技术职位, 互动体育, 济南, 本科, 15, 初创型, 移动互联网 · 文化娱乐
研发经理（Java方向）, 21, 5, 技术, 后端开发, 瑞泰鸿信, 北京, 大专, 50, 初创型, 电子商务 · 其他
技术经理, 35, 3, 技术, 高端技术职位, 油厚科技, 北京, 学历不限, 15, 初创型, 移动互联网 · 社交网络
研发总监, 50, 5, 技术, 高端技术职位, 北京立方网信息技术有限公司, 深圳, 本科, 150, 成长型, 移动互联网 · 电子商务
开发实习, 4, 不, 技术, 后端开发, 金山企业安全, 广州, 本科, 150, 成长型, 企业服务 · 信息安全
开发实习, 4, 不, 技术, 后端开发, 金山企业安全, 广州, 本科, 150, 成长型, 企业服务 · 信息安全
PHP高级研发师, 25, 3, 技术, 后端开发, 粮人网, 北京, 学历不限, 50, 初创型, 移动互联网 · 电子商务
售前技术工程师, 6, 1, 技术, 企业软件, 塔兰智能科技, 武汉, 大专, 15, 初创型, 移动互联网 · 硬件
渠道开发, 4, 1, 市场与销售, 市场/营销, 飞猪科技, 北京, 大专, 150, 成长型, 移动互联网
Java服务器端开发, 15, 1, 技术, 后端开发, 美差招聘, 上海, 大专, 50, 成长型, 移动互联网 · 招聘
北京 Linux内核开发, 30, 3, 技术, 后端开发, 深圳大爆炸, 北京, 大专, 150, 成长型, 移动互联网
PHP互联网研发实习生（南京屈指可数的大并发在等你挑战）, 2, 应届毕业, 技术, 后端开发, 南京点尚, 南京, 本科, 150, 成长型, 移动互联网 · 电子商务
云加速-WindowsC++客户端开发, 20, 3, 技术, 后端开发, 迅雷, 深圳, 本科, 500, 上市公, 移动互联网
开发DBA, 11, 1, 技术, dba, 亚信, 杭州, 学历不限, 2000, 上市公, 移动互联网 · 数据服务
.net技术主管, 12, 3, 技术, 高端技术职位, 蜜淘科技, 广州, 大专, 15, 成长型, 移动互联网
技术经理, 24, 5, 技术, 高端技术职位, OK无忧, 杭州, 本科, 150, 成长型, 电子商务 · O2O
开发实习, 4, 不, 技术, 前端开发, 金山企业安全, 广州, 本科, 150, 成长型, 企业服务 · 信息安全
研发经理, 22, 3, 技术, 后端开发, 北京鸿润嘉诚, 北京, 本科, 15, 初创型, 移动互联网 · 文化娱乐
后端开发其它, 6, 不, 技术, 后端开发, 北京林克艾普科技有限公司, 北京, 学历不限, 15, 初创型, 移动互联网 · 数据服务
技术经理（PHP方向）, 25, 3, 技术, 高端技术职位, 印象博观网络科技, 北京, 本科, 50, 成长型, 移动互联网
技术经理, 11, 1, 技术, 高端技术职位, 東秀科技, 郑州, 大专, 15, 成长型, 移动互联网
技术经理/技术主管, 20, 3, 技术, 高端技术职位, 环球网, 北京, 本科, 150, 成长型, 文化娱乐
高端技术职位, 32, 5, 技术, 高端技术职位, 链家地产, 北京, 本科, 2000, 成熟型, 移动互联网 · O2O
Java技术经理, 25, 5, 技术, 后端开发, POP时尚网络机构, 上海, 本科, 500, 成长型, 移动互联网 · 电子商务
Java-开发主任工程师, 30, 5, 技术, 后端开发, 美的, 佛山, 本科, 2000, 上市公, 移动互联网 · 其他
技术运维开发工程师, 11, 3, 技术, 运维, 交通银行信用卡中心, 上海, 本科, 2000, 上市公, 金融
PHP开发程序员, 9, 1, 技术, 后端开发, 日月同行, 北京, 大专, 15, 初创型, 移动互联网
Android研发, 16, 3, 技术, 移动开发, 偶尔科技, 杭州, 学历不限, 150, 成长型, 移动互联网 · 电子商务
【创新工场】-会会-H5开发, 17, 1, 技术, 前端开发, 创新工场, 北京, 本科, 500, 成熟型, 移动互联网
研发经理, 12, 1, 技术, 高端技术职位, 海仓科技, 杭州, 本科, 150, 初创型, 电子商务
安卓高级开发, 22, 3, 技术, 移动开发, 爸妈旅游, 合肥, 本科, 500, 成长型, 旅游
服务端研发经理, 25, 3, 技术, 后端开发, 安邦保险集团, 北京, 本科, 2000, 成熟型, 移动互联网 · 金融
技术副总监, 32, 5, 技术, 高端技术职位, 兼职猫, 广州, 大专, 150, 成长型, 移动互联网  · O2O
技术经理, 18, 3, 技术, 高端技术职位, 趣乐科技（百万琴友家园）, 北京, 本科, 15, 成长型, 移动互联网 · 硬件
技术经理, 22, 5, 技术, 高端技术职位, 科技谷, 厦门, 本科, 15, 初创型, 数据服务
.net开发, 15, 3, 技术, 前端开发, 新元素医疗技术开发, 深圳, 本科, 500, 成长型, 医疗健康  · 数据服务
研发平台产品经理, 15, 3, 产品, 产品经理, 车挣, 上海, 本科, 50, 初创型, 移动互联网 · 数据服务
饮料 乳业 大区经理 合伙人 创客, 25, 5, 市场与销售, 销售, 利伊享, 杭州, 大专, 50, 成长型, 移动互联网
数据平台开发高级工程师, 12, 3, 技术, 后端开发, 海视云, 青岛, 本科, 50, 初创型, 企业服务 · 文化娱乐
Java中级开发, 10, 1, 技术, 后端开发, 上海耸智科技, 上海, 大专, 150, 初创型, 移动互联网 · 电子商务
微信开发技术员/工程师, 5, 不, 技术, 前端开发, 广州演绎信息科技有限公司, 广州, 本科, 15, 初创型, 移动互联网 · 电子商务
技术行销工程师, 10, 3, 技术, 项目管理, 惟新科技, 深圳, 本科, 50, 成长型, 企业服务 · 数据服务
高级Java开发, 20, 3, 技术, 后端开发, 欧电云, 上海, 大专, 50, 初创型, 电子商务 · 企业服务
APP开发组长, 17, 3, 技术, 移动开发, 云创, 深圳, 本科, 15, 成长型, 移动互联网
C++技术工程师, 16, 1, 技术, 后端开发, 海腾时代, 北京, 学历不限, 15, 初创型, 移动互联网 · 生活服务
高级技术经理, 27, 5, 技术, 高端技术职位, 虚拟院线, 北京, 本科, 15, 成长型, 移动互联网 · 文化娱乐
C++服务器开发, 16, 1, 技术, 后端开发, 心动网络, 上海, 本科, 150, 成长型, 移动互联网 · 游戏
云加速-LinuxC++服务器开发, 22, 3, 技术, 后端开发, 迅雷, 深圳, 本科, 500, 上市公, 移动互联网
程序-技术美术, 17, 1, 设计, 视觉设计, 北京飞流九天科技有限公司, 北京, 大专, 150, 成熟型, 移动互联网 · 游戏
服务器开发维护, 11, 3, 技术, 运维, 么么嗖, 深圳, 本科, 150, 成长型, 移动互联网 · 电子商务
资深iOS开发, 18, 3, 技术, 移动开发, 微盟, 上海, 大专, 500, 成熟型, 移动互联网 · 电子商务
技术经理, 11, 5, 技术, 移动开发, 优度科技, 天津, 大专, 15, 初创型, 移动互联网 · 企业服务
高级数据开发/架构工程师, 22, 3, 技术, 后端开发, 第三石科技, 北京, 本科, 50, 成长型, 移动互联网 · 电子商务
产品技术工程师, 3, 不, 技术, 企业软件, 艾迪艾思（北京）科技, 北京, 本科, 50, 成长型, 移动互联网 · 电子商务
Ruby技术研发工程师, 15, 1, 技术, 后端开发, RCC上海分公司, 上海, 本科, 500, 初创型, 企业服务
JS开发, 13, 1, 技术, 移动开发, 上海易宝软件有限公司深圳分公司, 深圳, 本科, 150, 上市公, 移动互联网
WMS高级开发-Java, 30, 5, 技术, 后端开发, 美的集团总部流程IT, 深圳, 本科, 2000, 上市公, 硬件
.net研发/高级研发工程师（移动端）, 19, 3, 技术, 后端开发, 华住酒店集团, 上海, 大专, 2000, 上市公, 旅游 · 生活服务
web前端研发架构师, 30, 3, 技术, 前端开发, 滴滴打车, 北京, 本科, 500, 成熟型, 移动互联网
