技术总监, 32, 5, 技术, 高端技术职位, 未时网络, 杭州, 学历不限, 15, 初创型, 移动互联网 · 金融
技术总监, 32, 5, 技术, 高端技术职位, 花嫁丽舍, 上海, 本科, 150, 初创型, 生活服务
技术总监, 25, 10年以, 技术, 高端技术职位, 极鲜网, 上海, 本科, 50, 成长型, 移动互联网 · 电子商务
技术总监, 22, 3, 技术, 高端技术职位, 蜜友, 北京, 本科, 15, 初创型, 移动互联网 · 医疗健康
技术总监, 20, 5, 技术, 高端技术职位, 拉钩去旅行, 北京, 大专, 15, 初创型, 移动互联网 · 生活服务
技术总监助理, 11, 1, 技术, 项目管理, 聚贸, 杭州, 大专, 150, 成长型, 金融 · 电子商务
技术总监, 35, 5, 技术, 高端技术职位, 南华智闻, 广州, 大专, 50, 成长型, 移动互联网
技术总监, 21, 5, 技术, 高端技术职位, 英特力, 广州, 大专, 50, 成长型, 移动互联网 · 电子商务
技术总监, 25, 5, 技术, 高端技术职位, 新赛季, 上海, 本科, 15, 初创型, 移动互联网 · 社交网络
技术总监, 30, 3, 技术, 高端技术职位, 亿手, 北京, 本科, 15, 初创型, 移动互联网
技术总监, 17, 5, 技术, 高端技术职位, 成长之家, 南昌, 本科, 15, 初创型, O2O · 教育
技术总监, 25, 3, 技术, 高端技术职位, 湛亚科技, 杭州, 本科, 15, 初创型, 移动互联网
技术总监, 27, 5, 技术, 高端技术职位, 吃喝玩乐, 天津, 本科, 150, 初创型, 电子商务 · O2O
技术总监, 25, 3, 技术, 高端技术职位, 互动作业, 北京, 大专, 15, 成长型, 移动互联网 · 教育
技术总监, 22, 5, 技术, 高端技术职位, 蜜友, 北京, 本科, 15, 初创型, 移动互联网 · 医疗健康
技术总监, 42, 5, 技术, 高端技术职位, 易跃移动, 上海, 本科, 150, 成长型, 移动互联网 · 游戏
技术总监, 22, 5, 技术, 高端技术职位, 卡塔科技, 杭州, 大专, 15, 初创型, 企业服务
技术总监/CTO, 22, 3, 技术, 高端技术职位, 唯时代westyle, 北京, 本科, 15, 初创型, 电子商务 · O2O
技术总监, 22, 5, 技术, 高端技术职位, 巴颜喀拉, 上海, 本科, 150, 初创型, 移动互联网 · 医疗健康
技术总监, 31, 3, 技术, 高端技术职位, 你有药, 上海, 本科, 15, 成长型, 移动互联网 · 医疗健康
技术总监, 30, 5, 技术, 高端技术职位, 17TRACK 全球物流查询平台, 深圳, 本科, 15, 成长型, 移动互联网 · 电子商务
技术总监, 22, 5, 技术, 高端技术职位, 华卓科技, 杭州, 本科, 50, 成长型, 企业服务 · 数据服务
技术总监, 25, 5, 技术, 高端技术职位, 新赛季, 上海, 本科, 15, 初创型, 移动互联网 · 社交网络
技术总监, 25, 3, 技术, 高端技术职位, 木鸟短租, 北京, 大专, 15, 成长型, 电子商务 · 生活服务
技术总监, 25, 3, 技术, 高端技术职位, 一起火, 杭州, 学历不限, 50, 成长型, 移动互联网 · 电子商务
技术总监, 12, 3, 技术, 高端技术职位, 木薯公司, 厦门, 大专, 15, 初创型, 移动互联网 · 硬件
技术总监, 22, 5, 技术, 高端技术职位, 阳光耐特, 广州, 本科, 150, 成长型, 信息安全 · 数据服务
技术总监, 27, 3, 技术, 移动开发, 中百, 北京, 本科, 50, 成长型, 移动互联网 · 电子商务
技术总监, 35, 10年以, 技术, 高端技术职位, 雨人, 上海, 本科, 150, 成长型, 移动互联网
技术总监（偏php方向）, 30, 5, 技术, 高端技术职位, 领客网, 上海, 大专, 50, 成长型, 移动互联网 · 电子商务
技术总监, 25, 5, 技术, 高端技术职位, 互动作业, 北京, 大专, 15, 成长型, 移动互联网 · 教育
技术总监, 12, 3, 技术, 高端技术职位, 星服信息, 福州, 大专, 15, 初创型, 移动互联网 · O2O
技术总监, 24, 3, 技术, 高端技术职位, 乐电网, 杭州, 大专, 15, 成长型, 移动互联网 · 电子商务
技术总监（合伙人）, 40, 5, 技术, 高端技术职位, 上海煜钱, 上海, 本科, 15, 初创型, 移动互联网
技术总监, 37, 5, 技术, 高端技术职位, 创维, 天津, 本科, 150, 初创型, 移动互联网 · O2O
技术总监, 25, 3, 技术, 高端技术职位, 北京麒麟心通, 北京, 本科, 15, 成长型, 移动互联网
技术总监, 27, 5, 技术, 高端技术职位, 泛亚投资, 北京, 本科, 15, 初创型, 电子商务 · 金融
技术总监, 40, 5, 技术, 高端技术职位, 美的集团总部流程IT, 深圳, 本科, 2000, 上市公, 硬件
技术总监, 9, 1, 技术, 高端技术职位, 云端创意, 佛山, 学历不限, 15, 初创型, 移动互联网 · 企业服务
技术总监, 20, 5, 技术, 高端技术职位, 金塔山集团, 东莞, 本科, 150, 初创型, 移动互联网 · 教育
技术总监 （Engineering Director）, 60, 1, 技术, 项目管理, 厦门市云客网络科技有限公司, 厦门, 大专, 50, 初创型, 移动互联网 · 电子商务
技术总监, 12, 3, 技术, 高端技术职位, 零图, 厦门, 大专, 15, 成长型, 移动互联网 · 硬件
技术总监, 25, 5, 技术, 高端技术职位, 拉钩去旅行, 北京, 大专, 15, 初创型, 移动互联网 · 旅游
技术总监, 43, 5, 技术, 高端技术职位, 爱上旅游, 上海, 本科, 50, 成长型, 移动互联网 · 旅游
技术总监（云计算方向）, 20, 5, 技术, 后端开发, 捷通华声, 北京, 本科, 150, 成熟型, 移动互联网 · 数据服务
技术总监, 16, 3, 技术, 高端技术职位, 杭州周到, 杭州, 本科, 15, 初创型, 电子商务
技术总监, 12, 3, 技术, 高端技术职位, 倍亚得, 上海, 本科, 50, 上市公, 移动互联网
技术总监, 25, 5, 技术, 高端技术职位, 新华三通, 北京, 本科, 15, 初创型, 移动互联网 · 电子商务
技术总监, 12, 不, 技术, 高端技术职位, 乐久科技, 郑州, 学历不限, 15, 初创型, 移动互联网 · 社交网络
技术总监, 25, 5, 技术, 高端技术职位, 易药软件, 北京, 学历不限, 15, 初创型, 移动互联网 · 医疗健康
技术总监, 12, 3, 技术, 高端技术职位, 悦享互联, 北京, 学历不限, 15, 初创型, 移动互联网
技术总监, 30, 5, 技术, 高端技术职位, 星云颜值！, 北京, 本科, 15, 成长型, 移动互联网 · 社交网络
技术总监, 25, 3, 技术, 高端技术职位, e兼职, 北京, 本科, 15, 初创型, 移动互联网 · O2O
技术总监, 20, 5, 技术, 高端技术职位, 钻汇珠宝, 广州, 大专, 500, 初创型, 电子商务
技术总监, 25, 5, 技术, 高端技术职位, 思源科技-房通网, 北京, 本科, 2000, 成熟型, 社交网络
技术总监, 22, 5, 技术, 高端技术职位, 第五大道奢侈品网, 北京, 本科, 50, 成长型, 电子商务
技术总监, 27, 3, 技术, 高端技术职位, 微思敦, 北京, 本科, 50, 初创型, 移动互联网 · 广告营销
技术总监, 10, 3, 技术, 后端开发, 维瓦数字, 南京, 本科, 15, 初创型, 移动互联网 · 企业服务
技术总监, 25, 3, 技术, 高端技术职位, 立诺电商, 杭州, 本科, 50, 成长型, 移动互联网 · 电子商务
技术总监, 30, 5, 技术, 高端技术职位, 派格传媒, 北京, 本科, 150, 上市公, 文化娱乐
技术总监, 22, 5, 技术, 高端技术职位, 触电, 深圳, 本科, 15, 初创型, 移动互联网 · 硬件
技术总监, 27, 5, 技术, 移动开发, 鼎润通达, 北京, 大专, 15, 初创型, 其他
技术总监（泡泡产品技术负责人）, 40, 3, 技术, 高端技术职位, 爱奇艺, 北京, 本科, 2000, 成熟型, 广告营销 · 文化娱乐
技术总监, 40, 5, 技术, 高端技术职位, 乐商云集, 厦门, 本科, 50, 初创型, 电子商务 · O2O
技术总监, 12, 3, 技术, 高端技术职位, 掌控传媒, 青岛, 本科, 150, 成长型, 移动互联网 · 文化娱乐
技术总监, 23, 5, 技术, 高端技术职位, 汇明软件, 上海, 本科, 15, 初创型, 移动互联网
技术总监, 30, 3, 技术, 高端技术职位, SELLON, 北京, 本科, 15, 成长型, 数据服务
技术总监, 45, 不, 技术, 高端技术职位, 海慈金融, 上海, 学历不限, 50, 成长型, 移动互联网 · 金融
技术总监, 17, 5, 技术, 高端技术职位, 百保, 深圳, 大专, 15, 初创型, 金融 · 分类信息
技术总监, 20, 5, 技术, 高端技术职位, 乐活心理, 杭州, 本科, 500, 上市公, 移动互联网 · 医疗健康
技术总监, 12, 1, 技术, 高端技术职位, 工控界“一站式采购”B2B平台, 广州, 大专, 50, 初创型, 电子商务
技术总监, 12, 3, 技术, 高端技术职位, 热源传媒, 北京, 本科, 150, 初创型, 移动互联网 · 数据服务
技术总监 (搜索), 26, 不, 技术, 高端技术职位, MindTurbo 明境, 北京, 本科, 15, 初创型, 企业服务 · 数据服务
技术总监, 45, 5, 技术, 高端技术职位, iPIN.com, 深圳, 本科, 50, 成长型, 数据服务
技术总监, 11, 3, 技术, 高端技术职位, 靠谱保, 深圳, 本科, 15, 初创型, 电子商务 · 金融
技术总监, 18, 3, 技术, 高端技术职位, 欣芙科技, 上海, 本科, 15, 初创型, 移动互联网 · O2O
技术总监, 15, 5, 技术, 高端技术职位, 会搜科技, 杭州, 大专, 150, 成长型, 移动互联网
技术总监, 22, 5, 技术, 后端开发, 天天有余, 北京, 本科, 15, 成长型, 金融
技术总监, 22, 3, 技术, 高端技术职位, 众筹网, 北京, 大专, 150, 成长型, 金融
技术总监, 23, 5, 技术, 高端技术职位, 网创科技, 杭州, 本科, 50, 初创型, 移动互联网 · 社交网络
技术总监, 40, 5, 技术, 高端技术职位, 银生宝, 上海, 本科, 50, 初创型, 移动互联网 · 金融
技术总监, 25, 5, 技术, 高端技术职位, 厚科技术, 深圳, 本科, 15, 初创型, 移动互联网 · 医疗健康
技术总监, 10, 3, 技术, 高端技术职位, 牛牛网络科技, 绍兴, 本科, 15, 初创型, 移动互联网
技术总监, 10, 5, 技术, 高端技术职位, 乐久科技, 郑州, 本科, 15, 初创型, 移动互联网 · 社交网络
技术总监, 7, 5, 技术, 高端技术职位, 云往探索, 厦门, 大专, 15, 初创型, 移动互联网 · 电子商务
技术总监, 32, 3, 技术, 高端技术职位, 汇通金融信息服务, 北京, 本科, 15, 成长型, 移动互联网 · 金融
技术总监, 30, 5, 技术, 高端技术职位, 盛全控股, 杭州, 本科, 500, 上市公, 移动互联网 · 生活服务
技术总监, 15, 5, 技术, 高端技术职位, 艺窝网, 深圳, 本科, 15, 成长型, 移动互联网 · 文化娱乐
技术总监, 32, 5, 技术, 高端技术职位, 中智汇, 杭州, 本科, 50, 成长型, 教育 · 电子商务
技术总监, 20, 5, 技术, 高端技术职位, 北京融智兴华, 北京, 本科, 50, 初创型, 硬件 · 文化娱乐
技术总监, 30, 10年以, 技术, 高端技术职位, 泰金所, 上海, 本科, 50, 成长型, 移动互联网 · 金融
技术总监, 25, 3, 技术, 高端技术职位, 课外喵, 广州, 本科, 50, 成长型, O2O · 教育
技术总监, 17, 5, 技术, 高端技术职位, 大公信软, 北京, 硕士, 150, 成长型, 移动互联网 · 金融
技术总监, 20, 3, 技术, 高端技术职位, 智行时代, 北京, 本科, 50, 成长型, 分类信息
技术总监, 30, 5, 技术, 高端技术职位, 正和天下, 北京, 本科, 15, 成长型, 电子商务 · 金融
技术总监, 30, 5, 技术, 高端技术职位, 金葵花网络, 北京, 本科, 50, 成长型, 金融
技术总监, 20, 3, 技术, 高端技术职位, 中网少儿网球, 北京, 大专, 150, 成长型, 文化娱乐
技术总监/CTO, 27, 5, 技术, 高端技术职位, Dict.cn海词正版词典专家, 上海, 本科, 50, 成长型, 移动互联网
技术总监, 25, 3, 技术, 高端技术职位, 肆客体育, 北京, 本科, 15, 初创型, 移动互联网
技术总监, 25, 5, 技术, 高端技术职位, 橙群网络科技（本地头条）, 杭州, 本科, 15, 初创型, 移动互联网 · 文化娱乐
技术总监, 19, 5, 技术, 高端技术职位, 蜜格, 深圳, 本科, 15, 初创型, 移动互联网
技术总监, 17, 3, 技术, 高端技术职位, 恒信资本, 深圳, 大专, 150, 初创型, 金融
技术总监, 25, 5, 技术, 高端技术职位, 鲜芝荟, 南京, 本科, 15, 初创型, 电子商务 · O2O
技术总监, 22, 3, 技术, 高端技术职位, 志行正, 北京, 大专, 50, 初创型, 移动互联网
技术总监, 25, 5, 技术, 高端技术职位, 豌豆派, 北京, 本科, 15, 初创型, 教育 · 硬件
技术总监, 30, 5, 技术, 高端技术职位, 星策网络, 深圳, 大专, 15, 初创型, 游戏
技术总监, 17, 5, 技术, 高端技术职位, 唛客网络科技, 杭州, 本科, 50, 初创型, 移动互联网 · 电子商务
技术总监, 25, 3, 技术, 高端技术职位, 大师之味, 北京, 大专, 15, 初创型, O2O · 生活服务
（急招）技术总监, 25, 1, 技术, 高端技术职位, 投管家, 深圳, 大专, 50, 初创型, 移动互联网 · 金融
技术总监, 20, 5, 技术, 高端技术职位, 九博科技, 广州, 本科, 150, 成长型, 信息安全 · 硬件
技术总监, 27, 5, 技术, 高端技术职位, 艾芒科技, 北京, 本科, 15, 初创型, 移动互联网 · 电子商务
技术总监, 32, 不, 技术, 高端技术职位, 1号店, 上海, 本科, 2000, 成熟型, 移动互联网
技术总监, 20, 5, 技术, 高端技术职位, 费曼网络, 上海, 本科, 15, 初创型, O2O
技术总监, 15, 3, 技术, 高端技术职位, 华正航空, 深圳, 本科, 150, 初创型, 电子商务
技术总监, 57, 5, 技术, 高端技术职位, 国泰安, 北京, 本科, 2000, 成熟型, 教育 · 金融
技术总监, 34, 5, 技术, 高端技术职位, 什么值得买, 北京, 本科, 150, 成长型, 电子商务 · 文化娱乐
技术总监, 25, 5, 技术, 高端技术职位, 锦绣国创网络, 北京, 本科, 15, 初创型, 移动互联网
技术总监, 32, 5, 技术, 高端技术职位, 创维, 天津, 本科, 50, 初创型, 移动互联网 · 电子商务
技术总监, 22, 5, 技术, 高端技术职位, 武汉亿房网, 武汉, 本科, 150, 上市公, 移动互联网
技术总监, 25, 5, 技术, 高端技术职位, 凯奇谷（北京）信息技术有限公司, 北京, 大专, 150, 成长型, 移动互联网 · 游戏
技术总监（金融理财类）, 30, 3, 技术, 高端技术职位, 华赢集团, 北京, 本科, 15, 初创型, 移动互联网 · 金融
技术总监, 15, 3, 技术, 高端技术职位, 四核微创, 广州, 大专, 50, 初创型, 电子商务
技术总监, 30, 5, 技术, 高端技术职位, 金葵花网络, 北京, 大专, 50, 成长型, 金融
技术总监, 22, 3, 技术, 高端技术职位, 天极传媒, 北京, 本科, 500, 成熟型, 文化娱乐
技术总监, 25, 3, 技术, 高端技术职位, 立诚贷, 北京, 学历不限, 50, 初创型, 金融
技术总监, 15, 3, 技术, 高端技术职位, 现在中国, 北京, 本科, 15, 初创型, 移动互联网 · 社交网络
技术总监, 25, 5, 技术, 高端技术职位, 海格润德, 北京, 学历不限, 15, 初创型, 移动互联网
技术总监, 9, 3, 技术, 高端技术职位, 米腾嘉会, 深圳, 大专, 50, 初创型, 移动互联网 · 信息安全
技术总监, 39, 5, 技术, 高端技术职位, 爱上旅游, 上海, 本科, 50, 成长型, 移动互联网 · 旅游
技术总监（云计算方向）, 20, 5, 技术, 高端技术职位, 捷通华声, 北京, 硕士, 150, 成熟型, 移动互联网 · 数据服务
技术总监, 32, 5, 技术, 高端技术职位, e家洁, 北京, 本科, 500, 成熟型, O2O · 分类信息
技术总监, 25, 5, 技术, 高端技术职位, 索贝数码, 成都, 本科, 500, 初创型, 移动互联网
技术总监, 40, 5, 技术, 高端技术职位, 减约, 北京, 本科, 15, 成长型, 移动互联网 · 医疗健康
技术总监, 17, 3, 技术, 高端技术职位, 烟台市易网通互联网, 烟台, 学历不限, 15, 初创型, 移动互联网
技术总监, 15, 5, 技术, 高端技术职位, 本弘电商, 郑州, 大专, 15, 成长型, 电子商务
技术总监, 10, 3, 技术, 高端技术职位, 一塔湖图众筹, 北京, 学历不限, 15, 初创型, 移动互联网 · 金融
技术总监, 30, 5, 技术, 高端技术职位, 酷米网, 北京, 本科, 15, 成长型, 移动互联网 · 文化娱乐
技术总监, 37, 5, 技术, 高端技术职位, 买衣爽, 上海, 本科, 50, 成长型, 电子商务 · O2O
技术总监, 6, 1, 技术, 高端技术职位, 天趣, 南京, 大专, 15, 初创型, 移动互联网
技术总监, 30, 5, 技术, 高端技术职位, 乐梦起源, 上海, 本科, 150, 上市公, 移动互联网
技术总监, 30, 3, 技术, 高端技术职位, 医讯通, 北京, 本科, 50, 成长型, 移动互联网
技术总监（互联网教育）, 25, 3, 技术, 高端技术职位, 互动作业, 北京, 大专, 15, 成长型, 移动互联网 · 教育
技术总监, 22, 3, 技术, 高端技术职位, 众筹网, 北京, 本科, 150, 成长型, 金融
技术总监, 45, 10年以, 技术, 高端技术职位, 同程旅游, 上海, 大专, 2000, 成熟型, 移动互联网 · 旅游
技术总监, 75, 3, 技术, 高端技术职位, 朗朗时间APP, 深圳, 学历不限, 15, 初创型, 移动互联网 · 其他
技术总监（大数据）, 20, 5, 技术, 高端技术职位, 捷通华声, 北京, 本科, 150, 成熟型, 移动互联网 · 数据服务
技术总监, 30, 5, 技术, 后端开发, 微装, 上海, 大专, 50, 初创型, 移动互联网
技术总监, 40, 5, 技术, 高端技术职位, 帮帮糖, 北京, 学历不限, 15, 成长型, 移动互联网 · 招聘
技术总监, 17, 5, 技术, 高端技术职位, 知投（股权众筹家）, 北京, 本科, 50, 成长型, 移动互联网 · 金融
技术总监（足球APP）, 25, 5, 技术, 高端技术职位, 新赛季, 上海, 本科, 15, 初创型, 移动互联网 · 社交网络
技术总监, 40, 5, 技术, 高端技术职位, 全民贷, 上海, 本科, 15, 成长型, 移动互联网 · 金融
技术总监（大数据方向）, 20, 5, 技术, 高端技术职位, 捷通华声, 北京, 本科, 150, 成熟型, 移动互联网 · 数据服务
技术总监, 32, 5, 技术, 高端技术职位, Lean Work Limited, 上海, 大专, 50, 成长型, 移动互联网 · 金融
技术总监, 32, 5, 技术, 高端技术职位, 爱秀魔方, 北京, 本科, 15, 初创型, 移动互联网 · 社交网络
技术总监, 35, 5, 技术, 高端技术职位, 雷音科技, 广州, 本科, 15, 成长型, 移动互联网 · 游戏
技术总监, 22, 3, 技术, 高端技术职位, 星诺无限, 北京, 学历不限, 15, 成长型, 移动互联网
技术总监, 22, 3, 技术, 高端技术职位, 人马君（Fit Start）, 上海, 本科, 15, 初创型, 移动互联网 · O2O
技术总监, 30, 5, 技术, 高端技术职位, 红方金融, 广州, 本科, 50, 成长型, 移动互联网 · 金融
技术总监, 30, 5, 技术, 高端技术职位, 大合至悦, 北京, 本科, 150, 成长型, 移动互联网 · 数据服务
技术总监, 17, 3, 技术, 后端开发, 华盈, 肇庆, 本科, 150, 成长型, 文化娱乐
技术总监, 25, 3, 技术, 高端技术职位, 明聚力, 北京, 本科, 15, 成长型, 移动互联网
技术总监, 17, 5, 技术, 高端技术职位, 广州微漾, 广州, 本科, 15, 初创型, 电子商务 · O2O
技术总监, 25, 5, 技术, 项目管理, 天玑汇富, 深圳, 大专, 50, 成长型, 移动互联网 · 金融
技术总监, 17, 5, 技术, 高端技术职位, 白吃网, 北京, 本科, 50, 成长型, 电子商务
技术总监, 17, 10年以, 技术, 高端技术职位, 橙红科技, 南京, 本科, 150, 初创型, 移动互联网 · 金融
技术总监, 32, 5, 技术, 高端技术职位, 永润国农, 北京, 大专, 15, 初创型, 电子商务
技术总监, 25, 5, 技术, 高端技术职位, 破浪科技, 杭州, 本科, 15, 初创型, 移动互联网
技术总监, 27, 5, 技术, 高端技术职位, 黑马LIVE, 北京, 本科, 15, 成长型, 移动互联网
技术总监, 30, 不限, 技术, 后端开发, 三点一刻, 北京, 学历不限, 15, 初创型, 移动互联网 · 广告营销
技术总监, 12, 5, 技术, 高端技术职位, 科珀瑞国际定制中心, 上海, 本科, 50, 成长型, 移动互联网 · 其他
技术总监, 14, 5, 技术, 高端技术职位, ZOZOFA智慧服务平台, 广州, 学历不限, 15, 初创型, 移动互联网
技术总监（大数据方向）, 20, 不, 技术, 高端技术职位, 捷通华声, 北京, 本科, 150, 成熟型, 移动互联网 · 数据服务
技术总监（高薪+股权+合伙人待遇）, 22, 5, 技术, 高端技术职位, 春暖医疗, 广州, 本科, 15, 成长型, 移动互联网
技术总监, 35, 10年以, 技术, 高端技术职位, 苏宁云商, 南京, 学历不限, 2000, 上市公, O2O
技术总监, 22, 3, 技术, 高端技术职位, 志行正, 北京, 本科, 50, 初创型, 移动互联网
技术总监, 27, 5, 技术, 高端技术职位, 唯绿网, 上海, 本科, 15, 初创型, 移动互联网 · 电子商务
技术总监, 60, 5, 技术, 高端技术职位, 勃勃科技, 北京, 本科, 50, 成长型, 移动互联网
技术总监, 12, 5, 技术, 高端技术职位, 香传, 常州, 大专, 150, 成熟型, 移动互联网 · 电子商务
技术总监, 15, 3, 技术, 高端技术职位, 运策物流-整车货运O2O平台, 南京, 本科, 50, 成长型, 移动互联网 · O2O
技术总监, 11, 3, 技术, 高端技术职位, 辛巴达旅行网, 广州, 本科, 50, 成长型, 旅游
技术总监, 18, 不, 技术, 高端技术职位, 华永无线, 天津, 学历不限, 150, 成长型, 移动互联网
技术总监, 30, 5, 技术, 高端技术职位, 上海行睿, 上海, 本科, 15, 初创型, 移动互联网 · 电子商务
技术总监, 32, 5, 技术, 高端技术职位, 铭腾奇联, 北京, 本科, 15, 初创型, 企业服务
技术总监, 22, 3, 技术, 高端技术职位, 正鹊网络, 北京, 大专, 150, 成长型, 电子商务
技术总监, 35, 3, 技术, 高端技术职位, 北京融宜宝国际, 北京, 本科, 2000, 初创型, 金融
技术总监, 30, 5, 技术, 后端开发, 英华博译, 北京, 本科, 150, 初创型, 移动互联网 · 企业服务
技术总监, 32, 5, 技术, 高端技术职位, 滴滴出行（小桔科技）, 北京, 本科, 2000, 成熟型, 移动互联网 · 电子商务
技术总监, 25, 5, 技术, 高端技术职位, 爱操盘, 杭州, 本科, 50, 初创型, 金融
技术总监, 27, 5, 技术, 高端技术职位, 快乐妈咪, 北京, 本科, 15, 成长型, 移动互联网 · 医疗健康
技术总监（互联网教育）, 30, 5, 技术, 高端技术职位, 互动作业, 北京, 大专, 15, 成长型, 移动互联网 · 教育
技术总监, 25, 3, 技术, 高端技术职位, 宽途汽车, 北京, 本科, 50, 成长型, 移动互联网 · O2O
技术总监, 37, 3, 技术, 高端技术职位, 睿哲, 广州, 学历不限, 50, 成长型, 电子商务 · 数据服务
技术总监, 14, 5, 技术, 高端技术职位, 钱径数据, 长沙, 本科, 50, 初创型, 移动互联网 · 金融
技术总监, 50, 5, 技术, 高端技术职位, 未来动力科技, 深圳, 本科, 500, 成熟型, 移动互联网 · 数据服务
技术总监, 24, 不, 技术, 高端技术职位, 农仁街, 合肥, 大专, 15, 初创型, 电子商务
技术总监, 22, 5, 技术, 高端技术职位, 联拓金融, 北京, 本科, 150, 成长型, 金融
技术总监, 24, 5, 技术, 高端技术职位, 上海筑网, 南京, 本科, 15, 初创型, 移动互联网 · 电子商务
技术总监, 16, 3, 技术, 高端技术职位, 欧信, 南京, 本科, 15, 成长型, 电子商务
技术总监, 30, 3, 技术, 高端技术职位, 译道, 北京, 本科, 15, 初创型, 移动互联网 · 企业服务
技术总监, 15, 1, 技术, 高端技术职位, wolflink, 北京, 本科, 15, 成长型, 硬件
技术总监（云计算方向）, 20, 3, 技术, 高端技术职位, 捷通华声, 北京, 本科, 150, 成熟型, 移动互联网 · 数据服务
技术总监, 22, 5, 技术, 高端技术职位, 伶猫网, 广州, 本科, 50, 成长型, 移动互联网 · 电子商务
技术总监, 40, 5, 技术, 高端技术职位, 数码视讯, 北京, 博士, 2000, 上市公, 硬件 · 文化娱乐
技术总监（智能人机交互语音方向）, 20, 5, 技术, 高端技术职位, 捷通华声, 北京, 本科, 150, 成熟型, 移动互联网 · 数据服务
技术总监, 15, 5, 技术, 高端技术职位, 博习园, 北京, 大专, 50, 成长型, 教育
技术总监（云计算方向）, 20, 5, 技术, 高端技术职位, 捷通华声, 北京, 本科, 150, 成熟型, 移动互联网 · 数据服务
技术总监, 25, 3, 技术, 前端开发, 投行圈, 深圳, 硕士, 15, 初创型, 金融
技术总监, 30, 3, 技术, 高端技术职位, 互利科技, 北京, 本科, 15, 初创型, 企业服务 · 数据服务
技术总监, 15, 5, 技术, 高端技术职位, 爱到家, 重庆, 本科, 15, 初创型, 社交网络 · 生活服务
技术总监, 15, 5, 技术, 高端技术职位, 启蒙听听, 武汉, 本科, 15, 初创型, 移动互联网 · 硬件
技术总监, 15, 5, 技术, 高端技术职位, 锦云&middot;月光宝盒, 深圳, 大专, 50, 初创型, 移动互联网 · 电子商务
技术总监, 15, 5, 技术, 高端技术职位, 盈搜科技, 杭州, 大专, 150, 成长型, 移动互联网
技术总监, 22, 3, 技术, 高端技术职位, 帕克英科技, 北京, 本科, 15, 初创型, 移动互联网
技术总监, 15, 3, 技术, 高端技术职位, 方橙式, 天津, 本科, 50, 初创型, 金融
技术总监, 42, 5, 技术, 高端技术职位, 图森, 北京, 本科, 15, 成长型, 移动互联网
技术总监, 40, 5, 技术, 高端技术职位, 网信, 北京, 本科, 2000, 上市公, 电子商务 · 金融
技术总监, 20, 5, 技术, 高端技术职位, 白吃网, 北京, 本科, 50, 成长型, 移动互联网 · O2O
