Java开发, 15, 3, 技术, 后端开发, 当代金融, 北京, 大专, 500, 上市公, 移动互联网 · 金融
PHP开发, 11, 1, 技术, 后端开发, 北京康邦科技股份有限公司, 北京, 本科, 500, 上市公, 教育
Node.js后端开发, 15, 1, 技术, 后端开发, 乐士网络, 深圳, 本科, 50, 成长型, 电子商务 · 社交网络
阿里云-前端技术专家-应用开发平台, 35, 3, 技术, 前端开发, 阿里巴巴, 北京, 本科, 2000, 上市公, 移动互联网
支付宝钱包 技术专场（蚂蚁金服 技术部 上海）, 30, 5, 技术, 后端开发, 阿里巴巴, 北京, 本科, 2000, 上市公, 移动互联网
技术经理, 30, 5, 技术, 高端技术职位, 易锐翔, 上海, 本科, 15, 初创型, 移动互联网 · 电子商务
Java开发, 20, 3, 技术, 后端开发, 汽车超人, 杭州, 本科, 500, 成熟型, 移动互联网 · O2O
移动研发经理, 20, 3, 技术, 高端技术职位, 链家网, 北京, 本科, 2000, 成熟型, O2O · 金融
Java开发（微信项目）, 8, 1, 技术, 后端开发, 设计院, 广州, 大专, 2000, 上市公, 移动互联网 · 金融
Android~开发, 12, 3, 技术, 移动开发, 盛川康健, 北京, 大专, 150, 成长型, 移动互联网
技术经理, 30, 3, 技术, 后端开发, 碧桂园集团, 深圳, 本科, 2000, 上市公, O2O · 其他
电话调研员(非营销、技术岗), 4, 应届毕业, 市场与销售, 市场/营销, RCC上海分公司, 上海, 大专, 500, 初创型, 企业服务
PHP开发经理, 25, 3, 技术, 后端开发, 汇通天下, 北京, 本科, 500, 成熟型, 移动互联网 · 数据服务
Java开发经理, 25, 5, 技术, 后端开发, 厚本金融, 上海, 本科, 500, 成长型, 金融
PHP技术经理, 24, 5, 技术, 后端开发, 足球魔方, 上海, 本科, 50, 成长型, 移动互联网 · 电子商务
PHP开发主管, 15, 3, 技术, 后端开发, 高顿教育集团, 上海, 大专, 500, 成长型, 教育
架构创新岗-技术与数据服务部, 19, 5, 技术, 高端技术职位, 京东金融, 北京, 本科, 2000, 上市公, 金融
Android技术主管, 20, 3, 技术, 移动开发, 上海禾未, 上海, 本科, 15, 成长型, 硬件
C++后台开发（急）, 17, 3, 技术, 后端开发, 蜜格, 深圳, 本科, 15, 初创型, 移动互联网
.NET开发主管, 30, 5, 技术, 后端开发, 洋码头, 上海, 学历不限, 150, 成长型, 移动互联网 · 电子商务
PHP开发, 15, 1, 技术, 后端开发, 遥望网络, 杭州, 大专, 150, 上市公, 移动互联网 · 游戏
硬件开发高级工程师, 15, 3, 技术, 硬件开发, 脉思科技, 北京, 本科, 15, 初创型, 移动互联网 · 硬件
Java开发, 6, 3, 技术, 后端开发, 昭大网络, 郑州, 大专, 50, 成长型, 电子商务 · 教育
数字产品Java资深研发, 22, 5, 技术, 后端开发, 阿里巴巴, 北京, 本科, 2000, 上市公, 移动互联网
Android 开发（SDK ）, 12, 1, 技术, 移动开发, 哔哩哔哩, 上海, 大专, 150, 初创型, 移动互联网 · 文化娱乐
开发经理, 20, 3, 技术, 后端开发, 天上来客, 长沙, 大专, 15, 成熟型, 电子商务 · O2O
后台开发（高级）工程师（视频方向）, 30, 3, 技术, 后端开发, 今日头条, 北京, 本科, 500, 成熟型, 移动互联网 · 数据服务
IOS开发, 16, 3, 技术, 后端开发, 华安保险, 深圳, 本科, 2000, 成熟型, 金融
Java开发（实习生）, 6, 不, 技术, 后端开发, 睿一科技, 北京, 大专, 50, 初创型, 移动互联网
Android开发, 13, 1, 技术, 移动开发, 武汉政通, 武汉, 本科, 500, 上市公, 移动互联网
Java Java开发, 18, 3, 技术, 后端开发, 我卖我拍, 北京, 大专, 2000, 成熟型, 移动互联网 · 电子商务
Android开发经理, 13, 1, 技术, 移动开发, 线下广告, 北京, 学历不限, 15, 初创型, 移动互联网 · 医疗健康
JAVA开发主管, 23, 5, 技术, 后端开发, 雷腾软件, 上海, 大专, 50, 成长型, 移动互联网 · 电子商务
Java技术经理（北京、西安）, 17, 5, 技术, 高端技术职位, 慧点科技, 北京, 大专, 500, 上市公, 企业服务
JAVA开发项目经理, 10, 1, 技术, 项目管理, 里外网, 深圳, 本科, 50, 成长型, O2O · 硬件
高级云计算研发架构师, 37, 5, 技术, 高端技术职位, 英富森, 北京, 本科, 2000, 初创型, 移动互联网 · 电子商务
Python开发, 14, 1, 技术, 后端开发, 百分点, 北京, 学历不限, 500, 成熟型, 数据服务
3D产品研发项目经理, 11, 不, 技术, 项目管理, 海芯科技, 北京, 本科, 50, 初创型, 移动互联网
前端后台研发, 22, 1, 技术, 前端开发, 电视家, 北京, 大专, 15, 成长型, 移动互联网
课程研发经理, 9, 1, 运营, 编辑, 创业家, 北京, 本科, 150, 成熟型, 企业服务 · 文化娱乐
技术经理, 17, 3, 技术, 高端技术职位, 红喜, 武汉, 本科, 15, 初创型, 电子商务 · O2O
技术经理, 40, 3, 技术, 高端技术职位, 美团网, 北京, 本科, 2000, 成熟型, 移动互联网 · O2O
O2O餐饮运营合伙人, 22, 不, 运营, 运营, 百年荣记, 北京, 本科, 50, 初创型, 企业服务 · O2O
Java开发, 15, 3, 技术, 后端开发, 国创科视, 北京, 本科, 50, 成长型, 移动互联网 · 数据服务
Android开发（Framework层）, 15, 1, 技术, 移动开发, 中软国际, 北京, 本科, 2000, 上市公, 移动互联网 · 数据服务
Java开发 Java, 18, 3, 技术, 后端开发, 我卖我拍, 北京, 大专, 2000, 成熟型, 移动互联网 · 电子商务
Java 高级研发工程师/技术主管, 22, 5, 技术, 后端开发, 印孚瑟斯, 上海, 本科, 2000, 上市公, 移动互联网
PHP开发程序员, 11, 3, 技术, 后端开发, 青岛二十四搜, 青岛, 学历不限, 500, 成熟型, 移动互联网 · 电子商务
爬虫工程师-技术与数据服务部, 25, 不, 技术, 运维, 京东金融, 北京, 本科, 2000, 上市公, 金融
后端PHP开发程序员, 7, 不, 技术, 后端开发, 百利天下教育, 北京, 大专, 500, 成熟型, 教育
PHP技术经理, 15, 5, 技术, 后端开发, 南京大正知行教育科技有限公司, 南京, 大专, 15, 初创型, 教育
php技术经理, 10, 不, 技术, 后端开发, 咖啡零点吧, 北京, 学历不限, 15, 成长型, 移动互联网 · O2O
数据挖掘（女生）技术要求不高!~~~!, 9, 1, 技术, 后端开发, 博彦科技, 北京, 本科, 2000, 上市公, 企业服务 · 数据服务
音视频技术实施工程师, 6, 1, 技术, 测试, 北京热度文化传媒有限公司, 北京, 大专, 15, 初创型, 文化娱乐
Android开发, 20, 3, 技术, 移动开发, 新锐国际, 上海, 本科, 500, 上市公, 移动互联网 · 电子商务
PHP开发, 11, 1, 技术, 后端开发, 一花科技, 深圳, 大专, 15, 初创型, 游戏
后台开发（Python）工程师, 22, 3, 技术, 后端开发, 唯为, 武汉, 大专, 500, 成熟型, 电子商务 · O2O
Java开发（急聘）, 20, 3, 技术, 后端开发, 清睿教育, 北京, 大专, 150, 成熟型, 移动互联网
Java开发, 12, 1, 技术, 后端开发, 银保联, 北京, 大专, 15, 成长型, O2O · 金融
Android开发, 18, 3, 技术, 移动开发, 优康达, 北京, 本科, 15, 初创型, O2O · 医疗健康
PHP技术经理, 11, 3, 技术, 后端开发, 银承网络, 青岛, 大专, 50, 初创型, 移动互联网 · 金融
C++ 开发工程师（SDK开发）, 12, 1, 技术, 后端开发, 捷通华声, 北京, 本科, 150, 成熟型, 移动互联网 · 数据服务
Java技术经理 （电信项目）, 30, 5, 技术, 后端开发, 上海戌轮信息科技有限公司, 上海, 大专, 50, 初创型, 金融
Android平台架构师/技术经理, 37, 3, 技术, 移动开发, umeng, 北京, 本科, 150, 成熟型, 移动互联网 · 社交网络
Java开发主管（Team Leaer）, 22, 3, 技术, 高端技术职位, 维信理财, 上海, 本科, 2000, 成熟型, 金融
Java开发高级工程师, 15, 3, 技术, 后端开发, TOM互联网集团, 北京, 大专, 500, 上市公, 移动互联网
C++开发高级工程师, 8, 3, 技术, 高端技术职位, 武汉光庭信息技术股份有限公司, 武汉, 本科, 500, 上市公, 企业服务
ios iOS开发, 22, 3, 技术, 移动开发, 我卖我拍, 北京, 大专, 2000, 成熟型, 移动互联网 · 电子商务
前端开发工程师（web）-技术与数据服务部, 22, 1, 技术, 前端开发, 京东金融, 北京, 本科, 2000, 上市公, 金融
PHP开发工程狮, 11, 3, 技术, 后端开发, 渔乐江湖, 成都, 大专, 15, 初创型, 移动互联网 · O2O
Android高级开发, 15, 3, 技术, 移动开发, 艺能科技, 北京, 本科, 15, 初创型, 移动互联网 · 数据服务
15665-国际化手游客户端开发（深圳）, 15, 1, 技术, 前端开发, 腾讯, 深圳, 本科, 2000, 上市公, 移动互联网  · 游戏
15665-国际化手游客户端开发（深圳）, 15, 1, 技术, 移动开发, 腾讯, 深圳, 本科, 2000, 上市公, 移动互联网  · 游戏
JAVA开发, 4, 不, 技术, 后端开发, 优米, 青岛, 大专, 15, 初创型, 移动互联网 · 广告营销
运维技术经理, 30, 5, 技术, 运维, 达闼科技, 北京, 本科, 50, 成长型, 移动互联网
阿里云-技术专家-安全管理, 35, 3, 技术, 后端开发, 阿里巴巴, 北京, 本科, 2000, 上市公, 移动互联网
ruby开发, 22, 1, 技术, 后端开发, 米聘, 深圳, 本科, 15, 初创型, 招聘
技术测试实习生, 3, 不, 技术, 测试, 尚品网, 北京, 本科, 500, 成熟型, 电子商务
信息采集员（非营销技术岗）, 5, 应届毕业, 市场与销售, 市场/营销, RCC上海分公司, 上海, 大专, 500, 初创型, 企业服务
Java开发经理, 17, 3, 技术, 高端技术职位, 禹封科技, 北京, 本科, 15, 初创型, 电子商务 · O2O
产品经理(偏技术）, 15, 5, 产品, 产品经理, 飞云科技, 成都, 学历不限, 15, 初创型, 移动互联网 · 硬件
PHP技术工程师, 12, 1, 技术, 后端开发, 乐康无忧, 北京, 学历不限, 15, 初创型, 移动互联网 · 电子商务
Hybrid App技术负责人, 22, 5, 技术, 前端开发, 今目标, 北京, 本科, 150, 成长型, 移动互联网 · 企业服务
外卖核心业务系统-技术经理, 42, 5, 技术, 高端技术职位, 美团网, 北京, 本科, 2000, 成熟型, 移动互联网 · O2O
Android技术经理, 30, 3, 技术, 移动开发, 优酷土豆, 北京, 本科, 2000, 上市公, 数据服务 · 文化娱乐
Java开发（电商平台）, 15, 5, 技术, 后端开发, 通用供应链技术, 南京, 本科, 50, 成长型, 电子商务 · 数据服务
Java开发, 15, 1, 技术, 后端开发, 邻食, 上海, 大专, 15, 初创型, 移动互联网 · O2O
15760-移动游戏专项技术工程师（上海）, 22, 3, 技术, 后端开发, 腾讯, 上海, 本科, 2000, 上市公, 移动互联网  · 游戏
高薪诚聘PHP开发, 15, 3, 技术, 后端开发, D1美财网, 广州, 大专, 50, 成长型, 电子商务
Java开发, 11, 1, 技术, 后端开发, 开源中国, 深圳, 学历不限, 15, 成长型, 数据服务 · 文化娱乐
技术经理, 20, 5, 技术, 高端技术职位, 啄木鸟医生, 北京, 本科, 15, 初创型, 移动互联网 · 医疗健康
技术经理, 15, 3, 技术, 高端技术职位, 鹏博士集团, 深圳, 本科, 2000, 上市公, 移动互联网 · O2O
Java开发, 12, 3, 技术, 后端开发, 云信软件, 北京, 学历不限, 150, 成长型, 移动互联网
Android开发, 12, 1, 技术, 移动开发, 同花顺, 杭州, 本科, 2000, 上市公, 金融
研发总监, 20, 不, 技术, 高端技术职位, 辛巴达旅行网, 广州, 学历不限, 50, 成长型, 旅游
业务测试技术经理, 40, 3, 技术, 测试, 美团网, 北京, 本科, 2000, 成熟型, 电子商务 · O2O
C++开发, 20, 3, 技术, 后端开发, 神工, 北京, 本科, 150, 成长型, 移动互联网 · 电子商务
手游客户端开发, 22, 3, 技术, 前端开发, 网易, 广州, 本科, 2000, 上市公, 移动互联网 · 游戏
iOS开发, 7, 1, 技术, 移动开发, 南宁一站网, 南宁, 大专, 150, 初创型, 电子商务
PHP/研发工程师/PHP技术, 25, 3, 技术, 后端开发, 东方浩联, 北京, 本科, 15, 初创型, 硬件
残疾大学生阳光培训岗(研发类)2000-3000/月薪, 2, 不, 技术, 移动开发, 天喻通讯, 武汉, 大专, 500, 上市公, 移动互联网
IT数据技术经理, 12, 1, 市场与销售, 市场/营销, 上海克时金融信息服务有限公司, 上海, 学历不限, 15, 初创型, 金融 · 移动互联网
Java技术经理, 10, 3, 技术, 后端开发, 惠卡世纪, 深圳, 大专, 150, 成熟型, 移动互联网 · O2O
Java后台研发资深工程师, 22, 3, 技术, 后端开发, 美团网, 厦门, 本科, 2000, 成熟型, 移动互联网 · O2O
技术经理-PHP, 30, 3, 技术, 高端技术职位, 什么值得买, 北京, 本科, 150, 成长型, 电子商务 · 文化娱乐
PHP高级开发, 22, 5, 技术, 后端开发, Kiwi, 深圳, 本科, 150, 成长型, 移动互联网 · O2O
前端研发实习生, 3, 不, 技术, 前端开发, 企家有道, 北京, 本科, 15, 初创型, 企业服务
高薪聘请高端互联网技术开发人员, 25, 3, 技术, 高端技术职位, 雪时 &amp;雪橙, 北京, 本科, 50, 初创型, 移动互联网 · 电子商务
Android安卓手机开发维护工程师, 6, 1, 技术, 移动开发, 蓝格网络, 芜湖, 本科, 15, 初创型, 移动互联网 · O2O
web/h5开发主管, 20, 3, 技术, 前端开发, 云财经, 深圳, 本科, 15, 成长型, 金融 · 数据服务
前端技术经理, 22, 1, 技术, 前端开发, 车满满, 北京, 本科, 50, 成长型, 移动互联网
高级web前端开发工程师/开发经理, 24, 3, 技术, 前端开发, 一起装修网, 北京, 大专, 150, 成长型, 电子商务 · O2O
高级质量运营 - 研发管理部, 9, 3, 运营, 运营, YY Inc, 广州, 本科, 2000, 上市公, 移动互联网
JAVA高级工程师-技术与数据服务部-供应链业务研发方向, 22, 3, 技术, 后端开发, 京东金融, 北京, 本科, 2000, 上市公, 金融
前端开发工程师（H5）-技术与数据服务部, 22, 1, 技术, 前端开发, 京东金融, 北京, 本科, 2000, 上市公, 金融
技术副总监, 30, 5, 技术, 高端技术职位, 乐麦, 厦门, 本科, 500, 初创型, 电子商务 · 企业服务
Android高级开发, 20, 5, 技术, 移动开发, 君融贷, 北京, 大专, 50, 成长型, 金融
HTML5开发实习生, 3, 不, 技术, 移动开发, 声牙科技, 深圳, 学历不限, 15, 成长型, 移动互联网 · O2O
Java开发, 15, 3, 技术, 后端开发, 正益移动互联科技股份有限公司, 上海, 本科, 150, 成长型, 移动互联网
爬虫技术工程师（实习）, 3, 1年以, 技术, 前端开发, 好房通科技, 成都, 大专, 150, 成长型, 电子商务
U3D开发, 11, 1, 技术, 前端开发, 大家游戏, 北京, 本科, 50, 成长型, 游戏
Java高级工程师/技术专家, 27, 3, 技术, 后端开发, 艺龙旅行网, 北京, 本科, 2000, 上市公, 移动互联网 · 旅游
PHP技术经理, 19, 1, 技术, 高端技术职位, 连盈贷, 北京, 大专, 150, 初创型, 移动互联网 · 金融
Android研发经理, 30, 3, 技术, 移动开发, 英富森, 北京, 本科, 2000, 初创型, 移动互联网 · 电子商务
Java技术经理, 25, 3, 技术, 后端开发, 金融工场, 北京, 本科, 150, 上市公, 金融
软件研发经理-Java, 15, 5, 技术, 项目管理, 物流信息, 成都, 本科, 50, 初创型, 电子商务
Java研发经理（供应链金融）, 30, 5, 技术, 高端技术职位, 宜信公司, 北京, 本科, 2000, 成熟型, 移动互联网 · 金融
PHP—专注社区开发, 15, 3, 技术, 后端开发, 国美在线, 北京, 学历不限, 2000, 上市公, 电子商务
Android开发师, 9, 1年以, 技术, 移动开发, 爱皮皮科技, 佛山, 大专, 15, 初创型, 移动互联网 · 企业服务
Java高级开发、技术专家、架构师, 37, 3, 技术, 后端开发, 阿里巴巴, 杭州, 学历不限, 2000, 上市公, 移动互联网
Java开发实施工程师, 9, 1, 技术, 后端开发, 恒生电子, 成都, 本科, 2000, 上市公, 移动互联网 · 金融
PHP研发经理, 27, 5, 技术, 后端开发, 智慧农村 村村淘, 北京, 本科, 150, 成长型, 移动互联网 · 电子商务
PHP开发经理, 9, 不, 技术, 后端开发, 亿源旭日科技有限公司, 西安, 学历不限, 15, 初创型, 移动互联网 · 电子商务
JavaScript研发经理, 27, 5, 技术, 前端开发, 楚楚街, 北京, 本科, 150, 成熟型, 移动互联网 · 电子商务
Java开发2016届毕业生, 5, 应届毕业, 技术, 后端开发, 广州中软, 广州, 本科, 150, 成长型, 数据服务 · 硬件
Python后台开发, 6, 不, 技术, 后端开发, 广州齐昌, 广州, 学历不限, 15, 初创型, 企业服务
高级Android开发, 20, 3, 技术, 移动开发, 狗民网, 北京, 本科, 50, 成长型, 电子商务 · 社交网络
Java开发（西安）, 11, 3, 技术, 后端开发, 微创, 西安, 大专, 2000, 成熟型, 移动互联网 · 电子商务
.NET开发实习生, 2, 应届毕业, 技术, 后端开发, 丰德科技, 广州, 大专, 150, 成长型, 企业服务 · 医疗健康
技术经理, 12, 3, 技术, 高端技术职位, 神鸟数据, 成都, 本科, 150, 上市公, 企业服务 · 数据服务
通信产品资料研发, 5, 应届毕业, 产品, 产品经理, 联合永道, 北京, 本科, 500, 成熟型, 移动互联网 · 企业服务
后端开发实习生, 2, 应届毕业, 技术, 后端开发, 普德信息, 西安, 大专, 15, 初创型, 移动互联网 · 其他
PHP开发, 11, 1, 技术, 后端开发, 周百通科技, 广州, 本科, 15, 成长型, 移动互联网 · O2O
技术经理, 35, 5, 技术, 高端技术职位, 拼好货, 上海, 本科, 50, 成长型, 电子商务 · 移动互联网
数据库云平台-Java 研发高级工程师, 10, 3, 技术, 后端开发, 亚信数据, 南京, 本科, 2000, 成熟型, 企业服务 · 数据服务
PHP开发项目主管, 12, 1, 技术, 后端开发, 微小店, 厦门, 大专, 150, 初创型, 移动互联网 · 电子商务
项目经理/技术经理(互联网金融背景）, 32, 5, 技术, 项目管理, 鸿坤控股集团-亿润投资集团, 北京, 本科, 500, 成熟型, 金融
前端JAVA开发（高级）工程师, 12, 1, 技术, 前端开发, 公瑾, 广州, 本科, 50, 成长型, 移动互联网
Android开发主管, 22, 不, 技术, 移动开发, 搜狐视频, 北京, 学历不限, 500, 上市公, 文化娱乐
Java开发工程师（中高级）-平台交易研发方向, 22, 3, 技术, 后端开发, 京东金融, 北京, 本科, 2000, 上市公, 金融
数据高级产品经理-技术与数据服务部-供应链业务研发方向, 22, 3, 技术, 后端开发, 京东金融, 北京, 本科, 2000, 上市公, 金融
云平台研发经理, 40, 5, 技术, 项目管理, TCL通讯科技控股有限公司, 深圳, 本科, 2000, 上市公, 移动互联网  · 硬件
Linux后台C++开发, 17, 3, 技术, 后端开发, 边锋, 上海, 本科, 500, 成熟型, 移动互联网 · 游戏
PHP工程师（商城平台开发）, 13, 1, 技术, 后端开发, 海豚村, 深圳, 大专, 150, 成长型, 电子商务
【实习】python后端开发, 4, 不, 技术, 后端开发, 百思易, 南京, 学历不限, 15, 初创型, O2O · 生活服务
测试工程师（上海研发中心）, 10, 1, 技术, 测试, 链家网, 上海, 本科, 150, 成长型, 移动互联网 · O2O
手机研发总监, 37, 10年以, 技术, 高端技术职位, 传音控股, 深圳, 本科, 2000, 成长型, 移动互联网
Android开发高级工程师, 18, 1, 技术, 移动开发, 天衡医疗, 北京, 学历不限, 150, 成长型, O2O · 医疗健康
Android开发, 11, 1, 技术, 移动开发, 小源科技, 深圳, 大专, 50, 成长型, 移动互联网
PHP技术经理, 25, 5, 技术, 高端技术职位, 乐栈科技, 北京, 大专, 150, 成长型, O2O
高级PHP技术经理, 30, 5, 技术, 后端开发, 趣分期, 北京, 大专, 2000, 成熟型, 电子商务 · 金融
C++客户端开发经理, 25, 5, 技术, 后端开发, 帮5买, 上海, 本科, 500, 成熟型, 移动互联网 · 电子商务
iOS开发设计师, 22, 3, 技术, 移动开发, 露懿丝, 上海, 本科, 50, 初创型, 移动互联网 · 教育
软件测试工程师-技术与数据服务部(005041), 21, 3, 技术, 测试, 京东金融, 北京, 本科, 2000, 上市公, 金融
数据仓库工程师-技术与数据服务部, 22, 1, 技术, 后端开发, 京东金融, 北京, 大专, 2000, 上市公, 金融
PHP开发师, 10, 1, 技术, 后端开发, 上元, 苏州, 大专, 150, 初创型, 教育
Linux服务端C++开发, 20, 3, 技术, 后端开发, 边锋, 上海, 大专, 500, 成熟型, 移动互联网 · 游戏
CIO（技术副总）, 20, 10年以, 技术, 高端技术职位, 思迈信通, 成都, 本科, 50, 成长型, 信息安全 · 数据服务
商务合作经理（高端餐饮渠道开发）, 7, 1, 市场与销售, 销售, YHOUSE, 成都, 本科, 150, 成长型, 移动互联网
Java开发, 12, 1, 技术, 后端开发, 上海视畅, 上海, 大专, 50, 成长型, 移动互联网
Java开发, 15, 3, 技术, 后端开发, 荣之联, 北京, 大专, 500, 上市公, 企业服务 · 数据服务
JAVA开发, 11, 1, 技术, 后端开发, 美丽加, 深圳, 大专, 50, 初创型, 移动互联网 · O2O
技术保障-windows高级系统工程师, 30, 3, 技术, 后端开发, 阿里巴巴, 北京, 本科, 2000, 上市公, 移动互联网
支付平台 技术专家, 35, 5, 技术, 高端技术职位, 蘑菇街, 杭州, 本科, 500, 成熟型, 电子商务
Java开发, 12, 3, 技术, 后端开发, 家政帮, 杭州, 大专, 15, 成长型, 移动互联网
技术经理, 15, 3, 技术, 高端技术职位, 雷迈科技, 成都, 大专, 15, 初创型, 移动互联网
技术经理, 25, 3, 技术, 高端技术职位, 硕达, 成都, 本科, 50, 上市公, 移动互联网
Java开发, 12, 1, 技术, 后端开发, 稻田科技, 北京, 本科, 50, 成长型, 移动互联网 · 电子商务
爬虫工程师-技术与数据服务部, 22, 1, 技术, 后端开发, 京东金融, 北京, 大专, 2000, 上市公, 金融
Java开发, 20, 3, 技术, 后端开发, 嘉合盛汇, 北京, 本科, 150, 成长型, 金融
PHP技术经理, 12, 3, 技术, 后端开发, 中防网, 苏州, 大专, 15, 初创型, 电子商务 · 企业服务
web前台开发经理, 15, 1, 技术, 前端开发, 高毅资产, 深圳, 本科, 50, 成长型, 金融 · 其他
大数据开发工程师-运维研发团队, 14, 3, 技术, 后端开发, YY Inc, 广州, 本科, 2000, 上市公, 移动互联网
PHP技术经理, 10, 3, 技术, 后端开发, 万博云信, 广州, 本科, 15, 初创型, 移动互联网 · 教育
研发-秀场产品经理-上海, 19, 3, 产品, 产品经理, 爱奇艺, 上海, 本科, 2000, 成熟型, 广告营销 · 文化娱乐
Hadoop/HBase高级研发攻城师, 16, 不, 技术, 后端开发, 京东商城, 北京, 本科, 2000, 上市公, 电子商务
研发团队新增招人应届生, 5, 应届毕业, 技术, 前端开发, 南京中软, 南京, 大专, 2000, 上市公, 移动互联网 · 企业服务
销售总监/销售总经理（事业合伙人）, 22, 5, 市场与销售, 销售, 金开门, 北京, 大专, 150, 成长型, 移动互联网 · 金融
Java开发（银行）, 7, 不, 技术, 后端开发, 文思海辉, 广州, 学历不限, 2000, 上市公, 电子商务 · 金融
Java开发, 8, 1, 技术, 后端开发, 博彦科技, 北京, 大专, 2000, 上市公, 企业服务 · 数据服务
技术经理, 25, 5, 技术, 高端技术职位, 红岭资本, 深圳, 本科, 50, 成长型, 移动互联网 · 金融
IT技术工程师, 15, 3, 技术, 运维, 红岭资本管理（北京）有限公司, 北京, 大专, 50, 成长型, 移动互联网 · 金融
Java开发实习生, 4, 应届毕业, 技术, 后端开发, 快课网, 上海, 学历不限, 15, 初创型, 移动互联网 · 教育
Java开发, 11, 1, 技术, 后端开发, 天玑科技, 上海, 大专, 50, 上市公, 数据服务
Java web和后端开发, 15, 3, 技术, 后端开发, 屋滴 Wooodi, 上海, 大专, 15, 初创型, O2O
Java技术经理, 25, 5, 技术, 后端开发, 北京极数创联科技有限公司, 北京, 本科, 50, 成长型, 数据服务
高级web前端开发/开发经理, 27, 3, 技术, 前端开发, 一起装修网, 北京, 大专, 150, 成长型, 电子商务 · O2O
java工程师-核心产品研发方向, 10, 1, 技术, 后端开发, 凡科, 广州, 学历不限, 150, 上市公, 企业服务
Java开发——技术部, 22, 3, 技术, 后端开发, 51Talk无忧英语, 北京, 本科, 500, 成熟型, 移动互联网 · 教育
HTML5/CSS 开发实习生, 2, 不, 技术, 前端开发, 优趣工作室, 南宁, 学历不限, 15, 初创型, 移动互联网
PHP技术经理, 20, 3, 技术, 后端开发, 糖护士, 北京, 本科, 50, 成长型, 移动互联网 · 医疗健康
研发中心总经理, 45, 10年以, 技术, 高端技术职位, 恒昌利通, 武汉, 本科, 2000, 成熟型, 金融
Java开发实习生, 3, 不, 技术, 后端开发, 八荒科技, 上海, 学历不限, 15, 初创型, 移动互联网 · 电子商务
Java开发, 11, 5, 技术, 后端开发, 银企云, 深圳, 大专, 15, 初创型, 移动互联网 · 金融
技术经理, 25, 3, 技术, 高端技术职位, 北集, 北京, 本科, 15, 初创型, 移动互联网 · O2O
Java开发, 11, 3, 技术, 后端开发, 百道网, 北京, 学历不限, 50, 初创型, 移动互联网 · 企业服务
ARM开发, 27, 3, 技术, 硬件开发, 华为技术有限公司, 深圳, 本科, 2000, 成熟型, 移动互联网 · 企业服务
PHP开发, 20, 不, 技术, 前端开发, 唯品会, 广州, 本科, 2000, 上市公, 电子商务
Android开发, 15, 1, 技术, 移动开发, 猎豹移动, 北京, 本科, 500, 上市公, 移动互联网 · 信息安全
