职位, 工资, 经验要求, 职位一级分类, 职位二级分类, 公司名称, 城市, 学历, 公司规模, 公司阶段, 公司业务领域
技术合伙人, 15, 3, 技术, 高端技术职位, 芋米, 深圳, 本科, 15, 初创型, 教育 · 旅游
技术合伙人, 37, 3, 技术, 高端技术职位, 油厚科技, 北京, 本科, 15, 初创型, 移动互联网 · 社交网络
技术合伙人, 8, 不, 技术, 高端技术职位, 秋酷科技, 济南, 学历不限, 15, 初创型, 移动互联网 · 社交网络
技术合伙人, 13, 5, 技术, 高端技术职位, 呆呆阿卜, 苏州, 学历不限, 15, 初创型, 移动互联网 · O2O
技术合伙人, 17, 5, 技术, 高端技术职位, 顾问易, 广州, 本科, 15, 初创型, 移动互联网 · 金融
技术合伙人, 37, 5, 技术, 高端技术职位, 买衣爽, 上海, 本科, 50, 成长型, 电子商务 · O2O
技术合伙人, 8, 1, 技术, 高端技术职位, 四达时代集团, 兰州, 本科, 2000, 成熟型, 文化娱乐 · 硬件
技术合伙人, 17, 5, 技术, 高端技术职位, 爱理不理, 广州, 本科, 15, 初创型, 移动互联网 · 金融
技术合伙人, 17, 5, 技术, 高端技术职位, 安泰市集, 广州, 本科, 15, 初创型, 移动互联网 · 金融
技术合伙人（CTO）, 22, 3, 技术, 后端开发, 聚数数据, 深圳, 本科, 15, 初创型, O2O · 数据服务
技术合伙人, 40, 5, 技术, 高端技术职位, 医本健康, 杭州, 本科, 15, 初创型, 医疗健康
技术合伙人, 12, 1, 技术, 高端技术职位, 木头人mootow, 长沙, 大专, 15, 初创型, 移动互联网 · 电子商务
技术合伙人, 16, 3, 技术, 高端技术职位, 爱换购, 广州, 本科, 50, 初创型, 电子商务 · O2O
技术合伙人（广州）, 20, 3, 技术, 高端技术职位, 新创板, 广州, 本科, 50, 成长型, 移动互联网 · 金融
技术合伙人, 1, 不, 技术, 高端技术职位, 书趴, 哈尔滨, 学历不限, 15, 初创型, 移动互联网 · 社交网络
技术合伙人, 30, 不, 技术, 高端技术职位, 蜜客科技Mecare, 上海, 学历不限, 15, 初创型, 移动互联网 · 医疗健康
技术合伙人, 11, 3, 技术, 高端技术职位, 码头科技, 重庆, 学历不限, 15, 初创型, 移动互联网 · 其他
技术合伙人, 25, 5, 技术, 高端技术职位, 蜜淘科技, 广州, 大专, 15, 成长型, 移动互联网
技术合伙人, 24, 5, 技术, 后端开发, 上海品红文化传播有限公司, 上海, 本科, 50, 成长型, 移动互联网
技术合伙人, 37, 3, 技术, 高端技术职位, 油厚科技, 北京, 学历不限, 15, 初创型, 移动互联网 · 社交网络
技术合伙人, 12, 不, 技术, 高端技术职位, 一毛网络, 西安, 学历不限, 15, 初创型, 移动互联网 · 医疗健康
技术合伙人, 11, 不, 技术, 高端技术职位, 任悠扬, 南京, 学历不限, 15, 初创型, 社交网络 · 医疗健康
技术合伙人, 18, 不, 技术, 高端技术职位, 智友网络, 广州, 本科, 15, 成长型, 移动互联网 · 电子商务
技术合伙人, 12, 不, 技术, 高端技术职位, 寰创科技, 杭州, 本科, 15, 初创型, 社交网络 · 旅游
技术合伙人, 20, 3, 技术, 高端技术职位, 图品科技, 北京, 本科, 15, 初创型, 移动互联网
技术合伙人, 15, 不, 技术, 高端技术职位, 动脉网, 重庆, 本科, 15, 初创型, 移动互联网 · 医疗健康
技术合伙人, 20, 3, 技术, 高端技术职位, 知讯通达, 北京, 本科, 15, 初创型, 其他 · 移动互联网
技术合伙人, 15, 5, 技术, 高端技术职位, 靠谱保, 深圳, 本科, 15, 初创型, 电子商务 · 金融
技术合伙人, 11, 3, 技术, 高端技术职位, 知味100, 苏州, 本科, 15, 初创型, 移动互联网
技术合伙人, 30, 5, 技术, 高端技术职位, 青岛礼遇文化传媒有限公司, 青岛, 硕士, 15, 初创型, 文化娱乐 · 电子商务
技术合伙人, 15, 5, 技术, 高端技术职位, 艾果智能, 苏州, 本科, 15, 初创型, 移动互联网 · 硬件
技术合伙人, 30, 不, 技术, 高端技术职位, MindTurbo 明境, 北京, 本科, 15, 初创型, 企业服务 · 数据服务
技术合伙人, 30, 1, 技术, 高端技术职位, 思享空间, 北京, 本科, 15, 初创型, 移动互联网 · 教育
技术合伙人(主程), 17, 5, 技术, 高端技术职位, 若溪科技, 成都, 本科, 15, 初创型, 社交网络 · 游戏
技术合伙人, 29, 5, 技术, 高端技术职位, 买衣爽, 上海, 本科, 50, 成长型, 电子商务 · O2O
技术合伙人, 15, 5, 技术, 高端技术职位, 卫民中国家居网, 杭州, 学历不限, 15, 初创型, 电子商务 · 生活服务
技术合伙人, 20, 3, 技术, 高端技术职位, 行心科技, 广州, 大专, 50, 成熟型, 移动互联网
技术合伙人, 1, 3, 技术, 高端技术职位, 我爱唱, 合肥, 本科, 15, 初创型, 移动互联网 · 游戏
技术合伙人, 12, 10年以, 技术, 高端技术职位, K2, 长沙, 本科, 50, 成长型, 企业服务 · 其他
技术合伙人, 15, 5, 技术, 高端技术职位, 环球货栈, 郑州, 本科, 15, 初创型, 电子商务 · O2O
技术合伙人, 15, 5, 技术, 高端技术职位, 追灿科技, 杭州, 学历不限, 50, 初创型, 移动互联网 · 电子商务
技术合伙人, 11, 5, 技术, 高端技术职位, 滴滴测, 深圳, 本科, 15, 初创型, 医疗健康 · 移动互联网
技术合伙人, 6, 不, 技术, 前端开发, 新媒体，创业服务，技术创新型, 无锡, 学历不限, 15, 初创型, 移动互联网 · 教育
技术合伙人, 8, 5, 技术, 高端技术职位, 中产部落, 青岛, 本科, 15, 初创型, 生活服务 · 广告营销
技术合伙人, 10, 3, 技术, 高端技术职位, 碳六十网络科技, 惠州, 学历不限, 15, 初创型, 移动互联网 · O2O
技术合伙人, 20, 5, 技术, 高端技术职位, 学车大师, 广州, 本科, 15, 初创型, 移动互联网
技术合伙人, 30, 3, 技术, 高端技术职位, 杭州湖泊网络科技有限公司, 杭州, 本科, 15, 初创型, 移动互联网 · O2O
技术合伙人, 35, 3, 技术, 后端开发, 联金邦, 广州, 本科, 15, 初创型, 金融
技术合伙人, 22, 1, 技术, 高端技术职位, 渔网, 广州, 本科, 15, 初创型, 移动互联网 · 旅游
技术合伙人, 22, 3, 技术, 高端技术职位, 搜钱网, 杭州, 本科, 50, 成长型, 金融
技术合伙人, 25, 不, 技术, 高端技术职位, 上海彼可信息科技有限公司, 上海, 本科, 15, 初创型, 移动互联网 · 教育
技术合伙人, 8, 5, 技术, 高端技术职位, 火鹰科技, 广州, 大专, 15, 初创型, 移动互联网
技术合伙人, 12, 5, 技术, 高端技术职位, 山东三米, 济南, 本科, 150, 成长型, 移动互联网 · 企业服务
技术合伙人, 19, 不, 技术, 硬件开发, 外企初创团队, 深圳, 学历不限, 15, 初创型, 移动互联网 · 电子商务
技术合伙人, 35, 3, 技术, 高端技术职位, 保险竞标网, 上海, 本科, 15, 初创型, 金融
技术合伙人, 15, 不, 技术, 高端技术职位, 做客旅行, 北京, 学历不限, 15, 初创型, 移动互联网 · 旅游
技术合伙人, 15, 5, 技术, 高端技术职位, 万国优品, 郑州, 大专, 50, 成长型, 电子商务
技术合伙人, 25, 10年以, 技术, 高端技术职位, 云住, 上海, 本科, 50, 成长型, 移动互联网 · 旅游
技术合伙人, 9, 不, 技术, 高端技术职位, 小富金融, 武汉, 学历不限, 50, 成长型, 电子商务 · 金融
技术合伙人, 22, 5, 技术, 高端技术职位, 吖咪, 广州, 本科, 50, 初创型, 移动互联网 · O2O
技术合伙人, 30, 5, 技术, 高端技术职位, 乐梦起源, 上海, 本科, 150, 上市公, 移动互联网
技术合伙人, 21, 3, 技术, 高端技术职位, 海川科技, 武汉, 本科, 15, 初创型, 电子商务 · 企业服务
技术合伙人, 15, 3, 技术, 高端技术职位, 美鞋网, 广州, 大专, 15, 初创型, 移动互联网 · 电子商务
技术合伙人, 60, 5, 技术, 高端技术职位, 海慈金融, 上海, 学历不限, 50, 成长型, 移动互联网 · 金融
技术合伙人, 12, 3, 技术, 高端技术职位, 易隆软件, 惠州, 本科, 15, 初创型, 移动互联网 · 企业服务
技术合伙人, 20, 3, 技术, 高端技术职位, 金元瑞驰汽车有限公司, 北京, 学历不限, 50, 初创型, O2O · 生活服务
技术合伙人, 30, 5, 技术, 高端技术职位, 美吖, 杭州, 学历不限, 15, 初创型, O2O · 移动互联网
技术合伙人（技术总监）, 30, 5, 技术, 高端技术职位, 引导美, 深圳, 本科, 150, 初创型, 移动互联网 · 电子商务
技术合伙人, 40, 5, 技术, 高端技术职位, 云之行, 北京, 本科, 50, 成长型, 金融 · 数据服务
技术合伙人, 22, 5, 技术, 高端技术职位, 盖亚互动, 成都, 本科, 15, 初创型, 移动互联网 · 社交网络
技术合伙人, 12, 3, 技术, 高端技术职位, 优机易网, 广州, 本科, 15, 初创型, 电子商务
技术合伙人, 20, 5, 技术, 高端技术职位, 甜区体育, 北京, 本科, 15, 初创型, 移动互联网 · 文化娱乐
技术合伙人, 12, 3, 技术, 高端技术职位, 杭州爵妃, 杭州, 本科, 15, 初创型, 电子商务
技术合伙人, 45, 3, 技术, 后端开发, 协创, 上海, 学历不限, 15, 上市公, 企业服务
技术合伙人, 22, 1, 技术, 高端技术职位, 药易宝, 重庆, 学历不限, 15, 初创型, O2O · 企业服务
技术合伙人, 45, 3, 产品, 产品经理, 协创, 上海, 学历不限, 15, 上市公, 企业服务
技术合伙人, 5, 5, 技术, 高端技术职位, 英迈格文化传媒有限公司, 北京, 本科, 15, 初创型, 文化娱乐
技术合伙人, 9, 不, 技术, 高端技术职位, 弈业国际投资管理有限公司, 北京, 学历不限, 50, 成熟型, 教育 · 金融
技术合伙人, 15, 3, 技术, 高端技术职位, 志行正, 北京, 大专, 50, 初创型, 移动互联网
技术合伙人, 25, 5, 技术, 高端技术职位, 豌豆派, 北京, 本科, 15, 初创型, 教育 · 硬件
技术合伙人/CTO, 15, 5, 技术, 高端技术职位, 火火健身, 上海, 学历不限, 15, 初创型, 移动互联网 · 医疗健康
技术合伙人, 30, 5, 技术, 高端技术职位, 极视, 北京, 本科, 15, 初创型, 移动互联网
技术合伙人/CTO, 22, 不, 技术, 高端技术职位, 智果网络, 西安, 学历不限, 15, 初创型, 移动互联网 · 企业服务
技术合伙人, 22, 3, 技术, 高端技术职位, 志行正, 北京, 大专, 50, 初创型, 移动互联网
技术合伙人, 11, 5, 技术, 高端技术职位, 实唯科技, 成都, 本科, 15, 初创型, 企业服务 · 硬件
技术合伙人, 25, 5, 技术, 高端技术职位, 同龄人, 深圳, 本科, 15, 成长型, 社交网络
技术合伙人, 35, 5, 技术, 高端技术职位, 险峰华兴, 北京, 本科, 15, 初创型, 移动互联网 · 电子商务
技术合伙人, 22, 5, 技术, 高端技术职位, 有匠汽车顾问, 深圳, 本科, 15, 成长型, 移动互联网 · O2O
技术合伙人, 9, 不, 技术, 高端技术职位, 弈业国际投资管理有限公司, 北京, 学历不限, 50, 成熟型, 教育 · 金融
技术合伙人, 22, 5, 技术, 高端技术职位, 时尚饰品电商+设计师创业平台, 杭州, 本科, 15, 初创型, 电子商务 · 其他
技术合伙人, 25, 5, 技术, 高端技术职位, 易药软件, 北京, 本科, 15, 初创型, 移动互联网 · 医疗健康
技术合伙人, 25, 5, 技术, 高端技术职位, 颜墨斋, 北京, 本科, 15, 成长型, O2O · 文化娱乐
技术合伙人（10%股权，零工资）, 1, 3, 技术, 高端技术职位, 上海蛮绅信息公司, 上海, 大专, 15, 初创型, 移动互联网 · O2O
技术合伙人, 25, 5, 技术, 高端技术职位, 小庄, 北京, 学历不限, 15, 初创型, 企业服务 · O2O
技术合伙人, 20, 3, 技术, 高端技术职位, 湖北新蓝天, 广州, 大专, 500, 成熟型, 其他
技术合伙人, 45, 5, 技术, 高端技术职位, 金诺创投, 北京, 硕士, 15, 初创型, 移动互联网 · 社交网络
技术合伙人, 15, 3, 技术, 高端技术职位, 北京华商创恒科技有限公司, 北京, 本科, 15, 初创型, 移动互联网 · 数据服务
技术合伙人, 52, 5, 技术, 高端技术职位, 零食小喵, 北京, 大专, 15, 成长型, 移动互联网 · 电子商务
技术合伙人, 13, 3, 技术, 高端技术职位, 霸道总裁餐饮, 成都, 大专, 15, 初创型, 招聘
技术合伙人/技术总监, 30, 1, 技术, 高端技术职位, 校园巴士, 北京, 大专, 15, 初创型, 广告营销
技术合伙人, 15, 1, 技术, 高端技术职位, 娃宝, 北京, 学历不限, 15, 初创型, 移动互联网 · 生活服务
技术合伙人, 22, 5, 技术, 高端技术职位, e驾考, 北京, 学历不限, 15, 初创型, 移动互联网 · O2O
技术合伙人, 37, 5, 技术, 后端开发, 趣玩贝, 北京, 本科, 15, 初创型, 电子商务 · 旅游
技术合伙人（CTO）, 40, 5, 技术, 高端技术职位, 顺风车, 深圳, 本科, 50, 成长型, 移动互联网 · O2O
技术合伙人, 15, 5, 技术, 高端技术职位, 朋友街购物, 深圳, 学历不限, 15, 初创型, 移动互联网 · 电子商务
技术合伙人（总监）, 17, 5, 技术, 高端技术职位, 湖南易车通科技服务开发有限公司, 长沙, 大专, 15, 初创型, 移动互联网 · O2O
技术合伙人, 40, 不, 技术, 高端技术职位, 聚美物联, 上海, 本科, 15, 成长型, 企业服务
技术合伙人, 22, 3, 技术, 高端技术职位, 速嘉科技, 深圳, 本科, 15, 初创型, 电子商务 · O2O
技术合伙人, 15, 5, 技术, 高端技术职位, 深圳九耳智能科技有限公司, 深圳, 本科, 15, 初创型, 移动互联网 · 社交网络
技术合伙人, 30, 5, 技术, 高端技术职位, 云洗衣, 上海, 大专, 50, 初创型, O2O · 生活服务
技术合伙人, 30, 3, 技术, 高端技术职位, 乐梦起源, 上海, 本科, 150, 上市公, 移动互联网
技术合伙人, 17, 3, 技术, 高端技术职位, 乐梦起源, 上海, 本科, 150, 上市公, 移动互联网
技术合伙人, 1, 5, 技术, 高端技术职位, 安全家, 深圳, 学历不限, 50, 初创型, 移动互联网 · 硬件
技术合伙人, 15, 5, 技术, 高端技术职位, 禾力聚创, 北京, 本科, 15, 初创型, 电子商务 · O2O
技术合伙人, 65, 5, 技术, 高端技术职位, 多学多用, 上海, 本科, 15, 初创型, 移动互联网 · 电子商务
技术合伙人, 15, 3, 技术, 后端开发, 如木科技, 深圳, 大专, 15, 初创型, 移动互联网 · O2O
技术合伙人, 32, 5, 技术, 高端技术职位, 铸软网络, 上海, 本科, 15, 初创型, 移动互联网 · 企业服务
技术合伙人, 12, 3, 技术, 高端技术职位, 点点未来教育, 北京, 本科, 50, 成长型, 移动互联网 · 教育
技术合伙人, 22, 3, 技术, 高端技术职位, 婚乐多, 北京, 本科, 15, 初创型, O2O
技术合伙人, 35, 5, 技术, 高端技术职位, 来租我吧, 北京, 本科, 15, 初创型, 社交网络 · O2O
技术合伙人, 22, 5, 技术, 高端技术职位, 医时空, 深圳, 本科, 15, 初创型, 移动互联网 · 医疗健康
技术合伙人, 40, 5, 技术, 高端技术职位, 彩易天地, 北京, 本科, 15, 初创型, 移动互联网
技术合伙人, 5, 1, 技术, 高端技术职位, 美知教育, 上海, 大专, 50, 初创型, 教育
技术合伙人/CTO, 20, 3, 技术, 高端技术职位, 新一科科技, 重庆, 本科, 15, 初创型, 移动互联网 · 医疗健康
技术合伙人, 22, 不, 技术, 高端技术职位, 拉圈, 北京, 学历不限, 15, 初创型, 电子商务 · 社交网络
技术合伙人, 22, 3, 技术, 高端技术职位, 享趣网, 上海, 大专, 50, 初创型, O2O · 旅游
技术合伙人, 22, 1, 技术, 高端技术职位, 仙歌公司, 深圳, 本科, 15, 初创型, 电子商务
技术合伙人, 22, 3, 技术, 高端技术职位, AParty, 北京, 本科, 15, 初创型, O2O · 文化娱乐
技术合伙人, 15, 5, 技术, 高端技术职位, 瑞丰德永, 深圳, 本科, 150, 初创型, 金融 · 其他
技术合伙人, 37, 不, 技术, 高端技术职位, 米范文化, 上海, 学历不限, 15, 初创型, 移动互联网 · 文化娱乐
技术合伙人, 35, 5, 技术, 高端技术职位, 享趣网, 上海, 大专, 50, 初创型, O2O · 旅游
技术合伙人, 45, 3, 技术, 高端技术职位, 就赢, 上海, 本科, 15, 初创型, O2O · 金融
技术合伙人, 7, 3, 技术, 高端技术职位, 杰克冻人, 上海, 学历不限, 50, 初创型, 移动互联网 · 生活服务
技术合伙人, 20, 5, 技术, 高端技术职位, 艺考就过, 北京, 本科, 15, 初创型, 教育
技术合伙人, 15, 不, 技术, 后端开发, 西岸科技, 深圳, 学历不限, 15, 初创型, 电子商务 · 其他
合伙人, 30, 不, 市场与销售, 高端市场职位, 悦送科技, 深圳, 学历不限, 50, 初创型, 电子商务 · O2O
技术合伙人, 17, 3, 技术, 高端技术职位, 马大侠, 北京, 本科, 15, 初创型, 移动互联网 · 企业服务
技术合伙人, 15, 1, 技术, 高端技术职位, 九个工匠, 深圳, 本科, 15, 初创型, O2O · 生活服务
技术合伙人, 35, 5, 技术, 高端技术职位, 车互帮, 北京, 本科, 15, 初创型, 移动互联网
合伙人, 35, 不, 运营, 高端运营职位, 星河互联集团, 北京, 学历不限, 500, 成熟型, 移动互联网
技术合伙人, 25, 5, 技术, 高端技术职位, 壹循环, 北京, 本科, 15, 初创型, 移动互联网 · O2O
技术合伙人, 15, 3, 技术, 高端技术职位, 海外帮, 北京, 本科, 15, 初创型, 移动互联网 · 社交网络
技术合伙人, 30, 5, 技术, 高端技术职位, 百灵汇, 北京, 本科, 15, 初创型, 企业服务 · 招聘
合伙人, 45, 不, 运营, 高端运营职位, 星河互联集团, 北京, 学历不限, 500, 成熟型, 移动互联网
技术合伙人, 25, 不, 技术, 高端技术职位, 维德信通, 北京, 学历不限, 15, 初创型, 企业服务
正畸技术合伙人, 40, 5, 技术, 高端技术职位, 牙套之家, 珠海, 博士, 15, 初创型, O2O · 医疗健康
合伙人（产品方向）, 37, 不, 产品, 高端产品职位, 小荐网络, 上海, 本科, 50, 初创型, 移动互联网 · 社交网络
APP设计开发（合伙人）, 10, 1, 技术, 移动开发, 雷子北斗, 长沙, 学历不限, 15, 初创型, 移动互联网 · 硬件
合伙人, 25, 5, 运营, 高端运营职位, 布拉旅行, 上海, 本科, 15, 成长型, 移动互联网 · 旅游
储备技术合伙人, 9, 应届毕业, 技术, 高端技术职位, 科兴教育, 上海, 本科, 15, 初创型, 教育
技术合伙人 面谈, 15, 1, 技术, 高端技术职位, 牛机网, 深圳, 学历不限, 15, 初创型, 移动互联网 · 电子商务
合伙人, 45, 不, 运营, 高端运营职位, 星河互联集团, 北京, 学历不限, 500, 成熟型, 移动互联网
合伙人, 45, 不, 运营, 高端运营职位, 星河互联集团, 北京, 学历不限, 500, 成熟型, 移动互联网
合伙人, 4, 不限, , coo, e租百应, 上海, 学历不限, 15, 初创型, 移动互联网
技术总监/技术合伙人, 15, 3, 技术, 高端技术职位, 五二科技, 东莞, 大专, 50, 初创型, 电子商务 · 企业服务
（兼职）城市合伙人, 7, 不, 市场与销售, 市场/营销, 素剪, 杭州, 大专, 15, 初创型, O2O
架构师（技术合伙人）, 12, 5, 技术, 高端技术职位, 武汉达此网络科技有限公司, 武汉, 本科, 150, 成长型, 移动互联网 · O2O
产品合伙人, 40, 5, 产品, 高端产品职位, 惠装网, 北京, 学历不限, 150, 成长型, 移动互联网 · O2O
产品合伙人, 40, 5, 产品, 高端产品职位, 惠装网, 北京, 学历不限, 150, 成长型, 移动互联网 · O2O
合伙人, 40, 3, 金融, 高端金融职位, 食乐淘, 北京, 本科, 2000, 成熟型, 电子商务 · O2O
互联网产品合伙人, 12, 5, 产品, 高端产品职位, 顾问易, 广州, 本科, 15, 初创型, 移动互联网 · 金融
合伙人, 35, 不, 运营, 高端运营职位, 食乐淘, 北京, 学历不限, 2000, 成熟型, 电子商务 · O2O
互联网产品合伙人, 12, 5, 产品, 高端产品职位, 爱理不理, 广州, 本科, 15, 初创型, 移动互联网 · 金融
互联网产品合伙人, 12, 5, 产品, 高端产品职位, 小树投, 广州, 本科, 15, 初创型, 移动互联网 · 金融
技术总监（合伙人）, 13, 1, 技术, 后端开发, 琢本网络, 上海, 本科, 15, 初创型, 电子商务 · 企业服务
合伙人, 45, 不, 运营, 高端运营职位, 食乐淘, 北京, 学历不限, 2000, 成熟型, 电子商务 · O2O
事业合伙人, 15, 1, 运营, 运营, 阿波罗卫浴, 广州, 学历不限, 500, 成熟型, O2O
首席合伙人, 45, 5, 金融, 高端金融职位, 星河互联集团, 北京, 本科, 500, 成熟型, 移动互联网
技术研发（老师）, 9, 3, 技术, 后端开发, 不凡布道, 成都, 本科, 15, 成长型, 移动互联网 · 教育
城市合伙人, 12, 5, 运营, 运营, 麦豆科技, 太原, 本科, 50, 成长型, 移动互联网
产品经理/技术合伙人, 8, 3, 产品, 产品经理, Hi Tea, 广州, 大专, 15, 初创型, O2O · 生活服务
合伙人, 45, 不, 运营, 高端运营职位, 食乐淘, 北京, 学历不限, 2000, 成熟型, 电子商务 · O2O
厦门餐饮网技术合伙人, 7, 5, 技术, 高端技术职位, 餐饮网、通吃卡, 厦门, 学历不限, 15, 初创型, O2O · 生活服务
事业合伙人, 8, 不, 市场与销售, 市场/营销, 海卓天瑞, 深圳, 学历不限, 500, 初创型, 移动互联网 · 数据服务
事业合伙人, 4, 1, 技术, 项目管理, 海卓天瑞, 深圳, 大专, 500, 初创型, 移动互联网 · 数据服务
合伙人, 70, 5, 职能, 高端职能职位, 香送, 北京, 本科, 50, 初创型, 电子商务 · O2O
产品合伙人, 22, 3, 技术, 移动开发, 贡嘎, 北京, 本科, 15, 初创型, 移动互联网 · 广告营销
区域合伙人, 9, 不, 市场与销售, 销售, 小农女, 深圳, 学历不限, 150, 成长型, 电子商务 · O2O
【创客孵化器招募】技术工程师合伙人, 8, 不, 职能, 高端职能职位, 北京创客空间, 北京, 学历不限, 15, 成长型, 企业服务 · 硬件
区域合伙人, 37, 3, 市场与销售, 高端市场职位, CFC, 郑州, 大专, 50, 初创型, 电子商务
产品合伙人, 19, 3, 产品, 高端产品职位, Cikers Sports, 北京, 学历不限, 50, 初创型, 移动互联网 · 电子商务
文案策划(合伙人), 7, 3, 运营, 编辑, 希尚科技, 长沙, 学历不限, 15, 初创型, 移动互联网
项目合伙人, 15, 3, 金融, 投融资, 相对音乐, 长沙, 学历不限, 15, 初创型, 移动互联网 · 文化娱乐
电商运营（合伙人）, 7, 3, 运营, 运营, 希尚科技, 长沙, 本科, 15, 初创型, 移动互联网
P2P项目---技术合伙人, 40, 5, 技术, 高端技术职位, 淘金子, 北京, 学历不限, 50, 成长型, 移动互联网
营销合伙人, 10, 不, 市场与销售, 市场/营销, 留彼工坊, 北京, 学历不限, 15, 初创型, 电子商务 · O2O
业务合伙人, 15, 5, 市场与销售, 高端市场职位, 追灿科技, 杭州, 学历不限, 50, 初创型, 移动互联网 · 电子商务
运营经理（合伙人）, 10, 1, 运营, 运营, 球圈, 广州, 本科, 15, 初创型, 移动互联网 · 文化娱乐
销售总监（合伙人）, 15, 3, 市场与销售, 高端市场职位, 惠尔实, 厦门, 学历不限, 15, 初创型, 移动互联网 · 电子商务
产品合伙人, 40, 3, 产品, 高端产品职位, 联金邦, 广州, 本科, 15, 初创型, 金融
技术经理（技术合伙人）, 9, 5, 技术, 高端技术职位, 武汉达此网络科技有限公司, 武汉, 学历不限, 150, 成长型, 移动互联网 · O2O
Rub技术研发, 22, 1, 技术, 后端开发, RCC上海分公司, 上海, 本科, 500, 初创型, 企业服务
APP技术创业合伙人, 7, 1, 技术, 移动开发, 小黄蜂网络科技公司, 苏州, 大专, 15, 初创型, 移动互联网 · 电子商务
APP技术创业合伙人, 6, 1, 技术, 移动开发, 小黄蜂网络科技公司, 苏州, 大专, 15, 初创型, 移动互联网 · 电子商务
技术研发实习生, 3, 不, 技术, 移动开发, 聚益科技, 大连, 学历不限, 15, 初创型, 移动互联网 · 数据服务
客户经理(合伙人), 7, 不, 市场与销售, 销售, 希尚科技, 长沙, 学历不限, 15, 初创型, 移动互联网
iOS技术合伙人, 15, 3, 技术, 移动开发, 心动云, 成都, 本科, 15, 初创型, 移动互联网 · 数据服务
农产品合伙人, 6, 3, 运营, 运营, 天涯社区, 海口, 本科, 500, 上市公, 移动互联网 · 社交网络
校园合伙人, 3, 不, 运营, 运营, 小酱油, 北京, 学历不限, 15, 成长型, 移动互联网
互联网金融合伙人, 10, 3, 市场与销售, 高端市场职位, 财上财, 北京, 大专, 15, 成长型, 移动互联网 · 金融
【创客孵化器】互联网技术合伙人, 11, 不, 技术, 高端技术职位, 北京创客空间, 北京, 学历不限, 15, 成长型, 企业服务 · 硬件
海外市场合伙人, 15, 不, 市场与销售, 高端市场职位, 做客旅行, 北京, 学历不限, 15, 初创型, 移动互联网 · 旅游
Java工程师(技术合伙人）, 4, 不, 技术, 后端开发, 优邮, 广州, 学历不限, 15, 初创型, 电子商务 · 分类信息
合伙人助理, 5, 1, 职能, 行政, 卓越游戏（locojoy）, 北京, 大专, 500, 初创型, 游戏
互联网运营合伙人, 12, 5, 运营, 运营, 顾问易, 广州, 本科, 15, 初创型, 移动互联网 · 金融
运营总监/合伙人, 7, 3, 运营, 运营, 共营集团, 广州, 学历不限, 15, 初创型, 移动互联网 · O2O
投资合伙人, 22, 1, 金融, 高端金融职位, 红缘, 北京, 本科, 15, 初创型, 移动互联网
