C++开发 工程师, 12, 1, 技术, 后端开发, 鼎师科技, 武汉, 大专, 50, 成熟型, 移动互联网 · 分类信息
高级Java开发, 21, 3, 技术, 后端开发, 天骄软件, 杭州, 本科, 15, 初创型, 金融
互联网证券-证券交易软件研发, 16, 3, 技术, 后端开发, Kavout, 北京, 本科, 15, 初创型, 金融 · 数据服务
互联网金融—Java开发架构师, 24, 5, 技术, 后端开发, 迅雷, 深圳, 本科, 500, 上市公, 移动互联网
移动端技术负责人, 30, 3, 技术, 移动开发, 北京快乐学, 北京, 本科, 50, 成长型, 教育
选址拓展/新店开发, 11, 1, 市场与销售, 市场/营销, LOHO 眼镜, 北京, 大专, 500, 成熟型, 移动互联网 · O2O
PHP开发, 20, 3, 技术, 后端开发, 好利58, 北京, 本科, 50, 成长型, 金融
Java 开发（初级）, 7, 1, 技术, 后端开发, 奔步, 广州, 大专, 150, 成熟型, 移动互联网 · 电子商务
Android高级开发, 26, 3, 技术, 移动开发, 京东到家, 上海, 学历不限, 500, 成熟型, O2O
技术经理, 25, 5, 技术, 高端技术职位, 金砖国际, 上海, 本科, 500, 初创型, 金融
成都研发总监　, 30, 3, 技术, 高端技术职位, 摩柚生活技术有限公司, 成都, 学历不限, 50, 成长型, 移动互联网 · 电子商务
测试技术专家, 15, 3, 技术, 测试, 广东佳和通信, 珠海, 本科, 150, 初创型, 移动互联网
Java开发, 15, 1, 技术, 后端开发, 微浪科技, 上海, 大专, 50, 成熟型, 企业服务 · 金融
开发经理, 15, 5, 技术, 后端开发, 思凯普, 上海, 学历不限, 15, 初创型, 企业服务
技术经理, 12, 3, 技术, 高端技术职位, 汉云科技, 深圳, 本科, 15, 初创型, 数据服务
技术经理, 22, 5, 技术, 高端技术职位, 虎鱼网络, 广州, 大专, 15, 初创型, 移动互联网 · 数据服务
Java开发, 15, 1, 技术, 后端开发, 杏园科技, 杭州, 大专, 15, 成长型, 移动互联网 · 医疗健康
java开发, 13, 1, 技术, 前端开发, 武汉政通, 武汉, 本科, 500, 上市公, 移动互联网
新媒体运营合伙人, 8, 应届毕业, 运营, 运营, 舒服家, 成都, 学历不限, 15, 初创型, O2O
技术培训生（软件开发）, 4, 应届毕业, 技术, 后端开发, 携程, 上海, 本科, 2000, 上市公, 移动互联网 · 旅游
微软项目招聘全英技术工程师, 7, 不, 技术, 运维, 文思海辉, 无锡, 学历不限, 2000, 成熟型, 移动互联网 · 企业服务
web前端-技术, 16, 3, 技术, 前端开发, 火传媒, 上海, 本科, 500, 成熟型, 文化娱乐 · 移动互联网
PHP研发经理, 15, 3, 技术, 后端开发, 永信至诚, 北京, 大专, 150, 成长型, 移动互联网
PHP 后端开发, 5, 不, 技术, 后端开发, 百利天下教育, 北京, 大专, 500, 成熟型, 教育
C++高级服务端开发, 20, 3, 技术, 后端开发, 乐遨游戏, 北京, 本科, 15, 成长型, 移动互联网 · 游戏
PHP开发经理, 18, 5, 技术, 后端开发, 有爱, 南京, 大专, 50, 初创型, 医疗健康
游戏逻辑开发, 6, 不, 技术, 后端开发, C2fun, 苏州, 本科, 50, 成长型, 移动互联网 · 游戏
Java初级研发, 10, 1, 技术, 后端开发, 君果, 上海, 本科, 15, 初创型, 教育
JAVA高级开发, 20, 3, 技术, 后端开发, 创新工场-同趣游戏, 北京, 本科, 15, 成长型, 移动互联网 · 游戏
Node.js 软件工程师 开发, 7, 1, 技术, 后端开发, 岚智网络, 上海, 学历不限, 15, 初创型, 移动互联网 · 电子商务
Android开发（集团 ）, 15, 1, 技术, 移动开发, 浙江天搜科技股份有限公司, 杭州, 本科, 500, 成熟型, 移动互联网
高级技术经理（社交交易平台）, 27, 3, 技术, 高端技术职位, 人人操盘, 北京, 本科, 15, 初创型, 金融
供应商开发经理, 3, 1, 市场与销售, 销售, 闪兔网, 长沙, 大专, 15, 初创型, 电子商务 · O2O
开发主管, 15, 5, 技术, 高端技术职位, 美上未来, 深圳, 大专, 50, 成长型, 移动互联网 · O2O
技术经理, 30, 3, 技术, 高端技术职位, SELLON, 北京, 本科, 15, 成长型, 数据服务
IOS研发主管, 20, 5, 技术, 移动开发, 蜜柚旅行, 上海, 大专, 50, 成熟型, 电子商务
技术经理, 15, 5, 技术, 高端技术职位, 北京华商创恒科技有限公司, 北京, 本科, 15, 初创型, 移动互联网 · 数据服务
投资人开发经理, 12, 5, 市场与销售, 投资, 三人贷, 成都, 大专, 15, 成长型, 金融
Android开发, 11, 1, 技术, 移动开发, 杭州联汇数字科技有限公司, 杭州, 大专, 150, 成长型, 移动互联网 · 电子商务
技术经理, 22, 3, 技术, 高端技术职位, 安邦保险集团, 北京, 本科, 2000, 成熟型, 移动互联网 · 金融
技术经理, 27, 5, 技术, 高端技术职位, 拍拍贷, 上海, 大专, 2000, 成熟型, 金融
开发经理, 10, 不, 技术, 高端技术职位, NIOT, 广州, 本科, 50, 成长型, 移动互联网
在线教育产品研发, 8, 3, 产品, 产品经理, 传世嘉业, 深圳, 本科, 50, 成长型, 企业服务 · 教育
平台工具开发 工程师, 21, 1, 技术, 后端开发, 饿了么, 上海, 本科, 2000, 成熟型, 移动互联网 · 招聘
后端开发其它, 18, 3, 技术, 后端开发, 咕咚网, 北京, 本科, 150, 成长型, 移动互联网
研发经理, 12, 5, 技术, 高端技术职位, 兴图新科, 武汉, 本科, 500, 成长型, 移动互联网 · 文化娱乐
Java开发, 8, 1, 技术, 后端开发, 上镜, 南京, 学历不限, 15, 初创型, 移动互联网 · 电子商务
技术经理, 30, 5, 技术, 高端技术职位, 爱上旅游, 上海, 本科, 50, 成长型, 移动互联网 · 旅游
技术经理, 15, 3, 技术, 高端技术职位, 科斯拉, 深圳, 大专, 50, 成长型, 移动互联网
服务器开发实习生, 3, 应届毕业, 技术, 后端开发, 武汉流光时代科技有限公司, 武汉, 本科, 15, 初创型, 移动互联网
Android研发实习生, 3, 不, 技术, 移动开发, 假面科技, 上海, 本科, 15, 成长型, 移动互联网 · 社交网络
开发实习生, 3, 不, 技术, 前端开发, 南瓜车, 上海, 学历不限, 50, 成长型, O2O
模拟器研发（实习生）, 3, 应届毕业, 技术, 前端开发, Memblaze, 北京, 本科, 50, 成熟型, 硬件
C# WINFORM WPF开发高级工程师, 20, 3, 技术, 后端开发, 嬉戏谷科技, 上海, 学历不限, 500, 成长型, 移动互联网 · O2O
Java研发高级工程师, 12, 1, 技术, 后端开发, 北京搜房科技发展有限公司, 北京, 本科, 2000, 上市公, 移动互联网 · 金融
JAVA开发高级工程师, 17, 3, 技术, 前端开发, 嘉银金融上海你我贷金融信息服务有限公司, 上海, 本科, 2000, 初创型, 金融
移动端流媒体开发, 20, 3, 技术, 移动开发, 微吼, 北京, 本科, 50, 成长型, 移动互联网 · 数据服务
PHP开发高级工程师（苏州）, 12, 1, 技术, 后端开发, 掌上药店, 苏州, 学历不限, 15, 成长型, 移动互联网
Android客户端开发, 15, 1, 技术, 移动开发, 旭航网络, 杭州, 学历不限, 50, 成长型, 移动互联网
高级PHP技术工程师, 22, 3, 技术, 后端开发, 多犇金融, 北京, 本科, 50, 成长型, 金融 · 生活服务
Java中级开发, 11, 1, 技术, 后端开发, 美试网, 北京, 大专, 50, 成长型, 电子商务
java开发经理, 27, 3, 技术, 高端技术职位, 链家, 上海, 本科, 2000, 初创型, 移动互联网 · O2O
PHP技术经理, 30, 5, 技术, 后端开发, 狗民网, 北京, 本科, 50, 成长型, 电子商务 · 社交网络
python开发（高级）, 15, 不, 技术, 后端开发, 帝联科技, 北京, 学历不限, 500, 成熟型, 移动互联网
交互设计师-技术中心, 15, 3, 设计, 交互设计, 国广东方网络（北京）有限公司, 北京, 大专, 150, 成长型, 移动互联网 · 文化娱乐
技术经理, 15, 5, 技术, 高端技术职位, 凯捷技术有限公司, 上海, 本科, 500, 成熟型, 移动互联网 · 电子商务
移动端技术经理, 45, 5, 技术, 高端技术职位, 之间网（远景投资集团旗下）, 北京, 本科, 150, 成长型, 移动互联网 · 数据服务
技术经理, 12, 3, 技术, 高端技术职位, 中科同向, 北京, 本科, 50, 初创型, 移动互联网 · 数据服务
技术经理, 17, 3, 技术, 后端开发, 锐安, 北京, 本科, 500, 初创型, 信息安全 · 数据服务
数据研发分析工程师, 24, 1, 技术, 后端开发, 楚楚街, 北京, 本科, 150, 成熟型, 移动互联网 · 电子商务
（集团安全）无线安全研发leader, 40, 5, 技术, 高端技术职位, 阿里巴巴, 杭州, 本科, 2000, 上市公, 移动互联网
iOS开发, 12, 不, 技术, 移动开发, 金卖网, 厦门, 大专, 50, 成长型, 移动互联网 · 电子商务
开发测试, 7, 1, 技术, 测试, 文思海辉, 杭州, 学历不限, 2000, 成熟型, 移动互联网 · 企业服务
研发运营经理, 12, 5, 技术, 高端技术职位, 亿航智能无人机Ehang, 广州, 大专, 150, 成长型, 移动互联网 · 硬件
Java开发, 14, 3, 技术, 后端开发, 联创集团信通科技, 北京, 本科, 150, 成长型, 移动互联网 · 教育
Java开发经理, 27, 3, 技术, 后端开发, 动西网络, 上海, 本科, 150, 成长型, 生活服务
C++ SDK开发, 12, 1, 技术, 后端开发, 捷通华声, 北京, 本科, 150, 成熟型, 移动互联网 · 数据服务
Java服务端开发, 15, 1, 技术, 后端开发, 有乐游戏, 杭州, 学历不限, 50, 初创型, 移动互联网 · 游戏
Android开发攻城狮, 17, 3, 技术, 移动开发, Video++, 上海, 本科, 50, 成长型, 数据服务 · 文化娱乐
前端开发工程师-研发管理部, 14, 不, 技术, 前端开发, YY Inc, 广州, 学历不限, 2000, 上市公, 移动互联网
Java服务端开发（初级）, 15, 1, 技术, 后端开发, 上海九客游戏, 上海, 学历不限, 50, 初创型, 移动互联网 · 游戏
技术经理, 25, 3, 技术, 高端技术职位, 美到生活, 北京, 本科, 150, 成长型, 移动互联网 · O2O
技术经理, 22, 1, 技术, 项目管理, 轻客智能科技, 北京, 本科, 15, 初创型, 数据服务 · 硬件
技术经理, 17, 3, 技术, 高端技术职位, 格伦国际, 北京, 本科, 50, 成熟型, 教育
技术经理, 27, 5, 技术, 高端技术职位, 炎黄新星, 北京, 本科, 500, 成熟型, 电子商务
初级Java开发, 6, 不, 技术, 后端开发, 学而科技, 济南, 学历不限, 15, 初创型, 移动互联网 · 其他
技术经理, 20, 1, 技术, 后端开发, 险峰华兴, 北京, 本科, 15, 初创型, 移动互联网 · 电子商务
产品研发经理, 15, 1, 技术, 高端技术职位, 通赢天下, 天津, 本科, 50, 初创型, 电子商务
PHP技术研发工程师, 20, 1, 技术, 后端开发, 秋叶网, 北京, 大专, 15, 初创型, O2O · 生活服务
java开发经理, 26, 3, 技术, 高端技术职位, 动西网络, 上海, 本科, 150, 成长型, 生活服务
信息采集员（双休+非营销、技术岗）, 5, 1年以, 市场与销售, 采购, RCC上海分公司, 上海, 大专, 500, 初创型, 企业服务
移动端研发-安卓工程师, 16, 3, 技术, 移动开发, 日日顺, 北京, 本科, 500, 上市公, 其他
PHP技术经理, 22, 5, 技术, 高端技术职位, 酷趣, 上海, 本科, 150, 初创型, 移动互联网
移动端开发主管, 16, 3, 技术, 移动开发, 蓝海彤翔, 苏州, 本科, 150, 成长型, 移动互联网 · 文化娱乐
资深java工程师/技术专家, 25, 3, 技术, 后端开发, 兑吧网络, 杭州, 学历不限, 50, 成长型, 移动互联网
Java h5端开发, 14, 3, 技术, 后端开发, 宝驾租车, 北京, 本科, 500, 成长型, 移动互联网 · O2O
高级Android开发, 17, 1, 技术, 移动开发, 美秒科技, 北京, 本科, 15, 成长型, 移动互联网 · 电子商务
会员部PHP开发, 17, 1, 技术, 后端开发, 响巢看看, 深圳, 本科, 150, 成长型, 移动互联网 · 文化娱乐
平台存储研发主管, 30, 5, 技术, 高端技术职位, 全景数字, 上海, 本科, 50, 初创型, 文化娱乐 · 硬件
研发总监/助理研发总监, 35, 5, 技术, 高端技术职位, 快钱, 上海, 本科, 500, 成熟型, 金融
高级3D动画师（技术负责人）, 22, 5, 设计, 视觉设计, 东风日产数据营销公司, 广州, 大专, 150, 初创型, 电子商务
WEB 开发, 11, 3, 技术, 前端开发, 优帕特, 苏州, 本科, 15, 初创型, 教育
Java服务端开发（高级）, 21, 3, 技术, 后端开发, 上海九客游戏, 上海, 学历不限, 50, 初创型, 移动互联网 · 游戏
Java技术专家, 30, 3, 技术, 后端开发, 支付宝（中国）网络技术有限公司, 上海, 本科, 2000, 成熟型, 移动互联网 · 金融
阿里云 - 技术专家 - 网站架构, 37, 3, 技术, 高端技术职位, 阿里巴巴, 杭州, 本科, 2000, 上市公, 移动互联网
成都研发总监　, 30, 3, 技术, 高端技术职位, 深圳大爆炸, 成都, 大专, 150, 成长型, 移动互联网
后台研发经理(Java), 12, 3, 技术, 后端开发, 中掌科技, 广州, 大专, 50, 成熟型, 移动互联网
高级开发经理, 37, 5, 技术, 高端技术职位, 汇通天下, 北京, 本科, 500, 成熟型, 移动互联网 · 数据服务
技术经理, 30, 5, 技术, 高端技术职位, 玖富, 北京, 本科, 2000, 成熟型, 金融
PHP开发, 9, 3, 技术, 后端开发, 华夏创新, 北京, 本科, 50, 成长型, 移动互联网 · 招聘
技术经理, 26, 5, 技术, 高端技术职位, 优酷土豆, 北京, 学历不限, 2000, 上市公, 数据服务 · 文化娱乐
Java开发, 12, 1, 技术, 后端开发, 达西科技, 杭州, 学历不限, 50, 成长型, 电子商务
技术经理, 20, 5, 技术, 高端技术职位, 万古科技, 北京, 本科, 150, 上市公, 移动互联网
技术经理, 20, 3, 技术, 高端技术职位, 广州棒谷网络科技有限公司, 广州, 大专, 150, 成长型, 电子商务
研发总监　　　, 30, 3, 技术, 项目管理, 劲马奥通, 成都, 大专, 15, 成长型, 移动互联网 · 电子商务
Java开发, 22, 3, 技术, 后端开发, 华尔街见闻, 上海, 本科, 50, 成长型, 金融 · 移动互联网
java开发, 20, 3, 技术, 后端开发, 拉勾网, 北京, 本科, 150, 成长型, 企业服务 · 招聘
PHP程序员（研发内部直招）, 9, 不, 技术, 后端开发, 领耀东方, 深圳, 大专, 150, 上市公, 硬件
Java高级开发, 22, 3, 技术, 后端开发, 京东商城, 北京, 本科, 2000, 上市公, 电子商务
APP开发主管, 12, 3, 技术, 移动开发, 丰德科技, 广州, 大专, 150, 成长型, 企业服务 · 医疗健康
C++开发SDK, 12, 1, 技术, 后端开发, 捷通华声, 北京, 本科, 150, 成熟型, 移动互联网 · 数据服务
PHP后端开发, 5, 不, 技术, 后端开发, 百利天下教育, 北京, 大专, 500, 成熟型, 教育
大数据研发主管, 22, 3, 技术, 后端开发, 信码互通, 北京, 本科, 150, 初创型, O2O · 数据服务
Java开发, 11, 1, 技术, 后端开发, 戌时科技, 杭州, 学历不限, 150, 成长型, 移动互联网 · O2O
教学开发与在线教育专员, 4, 1, 职能, 人力资源, 盘石网盟, 杭州, 本科, 500, 成长型, 电子商务  · 企业服务
技术（项目）经理, 17, 5, 技术, 高端技术职位, 狮桥资本, 北京, 本科, 500, 成长型, 金融
Java研发, 22, 3, 技术, 后端开发, 优米网, 北京, 本科, 150, 初创型, 移动互联网 · 教育
APP项目开发组长, 11, 1, 技术, 移动开发, 纬润, 广州, 本科, 50, 初创型, 广告营销 · 文化娱乐
Hadoop 大数据开发, 30, 5, 技术, 后端开发, 欧电云, 上海, 本科, 50, 初创型, 电子商务 · 企业服务
Hadoop大数据开发, 30, 5, 技术, 后端开发, 欧电云, 上海, 本科, 50, 初创型, 电子商务 · 企业服务
.NET高级开发经理, 15, 3, 技术, 后端开发, 深圳市惠卡世纪有限公司, 深圳, 大专, 500, 上市公, 移动互联网 · 电子商务
MySQL技术专家, 45, 5, 技术, dba, 中睿, 深圳, 本科, 50, 初创型, 移动互联网 · 社交网络
PHP项目二次开发技术合伙人, 7, 不, 技术, 后端开发, SEOMENS, 上海, 本科, 15, 初创型, 企业服务 · 广告营销
开发经理-PHP, 20, 3, 技术, 高端技术职位, 什么值得买, 北京, 本科, 150, 成长型, 电子商务 · 文化娱乐
后台开发经理, 22, 5, 技术, 后端开发, 优酷土豆, 北京, 本科, 2000, 上市公, 数据服务 · 文化娱乐
技术经理, 25, 5, 技术, 高端技术职位, PTS Technology Consulting CO, 上海, 本科, 15, 初创型, 企业服务 · 数据服务
技术经理, 30, 3, 技术, 高端技术职位, 医讯通, 北京, 本科, 50, 成长型, 移动互联网
技术经理, 9, 5, 技术, 高端技术职位, 北京优奥创思科技发展有限公司, 石家庄, 大专, 150, 成长型, 广告营销 · 文化娱乐
Java开发, 10, 3, 技术, 后端开发, 亿达信息深圳分公司, 深圳, 本科, 500, 上市公, 移动互联网
成都研发总监　, 30, 3, 技术, 高端技术职位, 劲马奥通, 成都, 大专, 15, 成长型, 移动互联网 · 电子商务
PHP开发, 20, 3, 技术, 后端开发, 优思教育, 上海, 大专, 50, 成长型, 教育
C++服务器开发, 20, 3, 技术, 后端开发, 知临, 上海, 本科, 50, 初创型, 企业服务 · 金融
寻找未来合伙人——从实习生做起, 2, 不, 金融, 投融资, 云联智融, 北京, 硕士, 15, 成长型, 移动互联网 · 金融
PHP开发（云帆世纪）, 10, 1, 技术, 后端开发, 云帆世纪, 深圳, 大专, 50, 成长型, 数据服务
Java开发, 12, 3, 技术, 后端开发, 中科软, 上海, 本科, 2000, 上市公, 金融
大数据平台开发岗, 22, 3, 技术, 后端开发, 微众银行, 深圳, 本科, 500, 初创型, 金融
技术经理, 27, 5, 技术, 高端技术职位, 万芙科技, 北京, 本科, 150, 成长型, 电子商务 · O2O
Java研发, 14, 1, 技术, 后端开发, 华赢凯来, 北京, 本科, 2000, 成熟型, 金融
Android 研发高级工程师, 22, 3, 技术, 移动开发, 兔卡, 北京, 本科, 15, 初创型, 电子商务 · O2O
服务器端技术经理, 20, 3, 技术, 高端技术职位, 东方嘉禾, 北京, 本科, 50, 成长型, 移动互联网 · 文化娱乐
PHP高级开发20K-30K, 25, 3, 技术, 后端开发, 上海互盾科技, 上海, 大专, 50, 初创型, 移动互联网 · 电子商务
Java开发中级工程师, 15, 1, 技术, 后端开发, 宜信公司, 北京, 本科, 2000, 成熟型, 移动互联网 · 金融
Java后端开发（攻城狮）, 12, 3, 技术, 后端开发, 天云, 武汉, 本科, 150, 成长型, 移动互联网 · 数据服务
Java后端开发, 17, 3, 技术, 后端开发, 靠我, 杭州, 本科, 50, 成长型, 移动互联网
PHP开发高级工程师, 22, 3, 技术, 后端开发, 平安好房, 上海, 本科, 500, 上市公, 电子商务
Android移动客户端开发, 25, 不, 技术, 移动开发, 小荐网络, 上海, 学历不限, 50, 初创型, 移动互联网 · 社交网络
Java高级开发经理, 19, 5, 技术, 后端开发, 深圳惠卡世纪有限公司, 深圳, 学历不限, 500, 上市公, 移动互联网
后端开发Java, 12, 3, 技术, 后端开发, 爱换购, 广州, 大专, 50, 初创型, 电子商务 · O2O
Linux C高级开发, 19, 3, 技术, 硬件开发, 唯为, 武汉, 大专, 500, 成熟型, 电子商务 · O2O
PHP开发, 14, 3, 技术, 后端开发, 音智达, 上海, 本科, 150, 成长型, 数据服务 · 其他
java开发, 15, 3, 技术, 后端开发, 深圳中软国际, 深圳, 本科, 2000, 上市公, 移动互联网 · 企业服务
IT技术主管, 5, 不限, 技术, 高端技术职位, 图房网, 北京, 学历不限, 500, 成熟型, 企业服务
高级Java开发, 18, 5, 技术, 后端开发, 呱呱视频演艺社区, 北京, 大专, 150, 成长型, 移动互联网 · 游戏
Android开发, 15, 3, 技术, 移动开发, 联想利泰, 北京, 学历不限, 500, 初创型, 移动互联网 · 招聘
技术经理, 22, 3, 技术, 高端技术职位, 迪信通, 北京, 本科, 2000, 成熟型, 移动互联网
Java开发, 12, 1, 技术, 后端开发, 蜂云网络（51订货网）, 南京, 大专, 500, 成长型, 电子商务 · O2O
技术经理, 20, 3, 技术, 后端开发, 途游, 北京, 本科, 150, 成长型, 移动互联网 · 游戏
开发经理, 15, 3, 技术, 移动开发, 华强集团旗下深电中心, 深圳, 大专, 50, 成长型, 移动互联网 · O2O
PHP开发工程师（研发）, 17, 1, 技术, 后端开发, 上海晨之科, 上海, 本科, 50, 成长型, 移动互联网 · 游戏
Java开发（魔镜理财项目）, 9, 1, 技术, 后端开发, 设计院, 广州, 大专, 2000, 上市公, 移动互联网 · 金融
研发经理, 30, 5, 技术, 后端开发, 小牛资本, 深圳, 本科, 2000, 成长型, 金融
技术经理, 70, 5, 技术, 高端技术职位, 买衣爽, 上海, 本科, 50, 成长型, 电子商务 · O2O
技术经理, 33, 10年以, 技术, 高端技术职位, 未来动力科技, 深圳, 本科, 500, 成熟型, 移动互联网 · 数据服务
后端开发实习生, 3, 不, 技术, 后端开发, 海豚浏览器, 北京, 本科, 150, 成长型, 移动互联网
中高级java开发工程师（技术研发部）, 9, 1, 技术, 后端开发, 远传技术, 杭州, 学历不限, 150, 成熟型, 金融 · 数据服务
Flash flex AS3开发, 10, 1, 技术, 前端开发, 司法云平台, 南京, 大专, 50, 成长型, 移动互联网
高级JavaScript开发, 20, 5, 技术, 前端开发, 商为电商, 上海, 本科, 150, 成长型, 电子商务
Android开发Leader, 30, 3, 技术, 移动开发, 北京新美互通科技有限公司, 北京, 本科, 150, 成长型, 移动互联网
中级JAVA开发, 12, 1, 技术, 后端开发, 联想利泰, 北京, 大专, 500, 初创型, 移动互联网 · 招聘
初级Java开发, 4, 1, 技术, 后端开发, 湘村电商, 长沙, 学历不限, 50, 初创型, 电子商务
java开发经理, 27, 3, 技术, 高端技术职位, 上海链家(原德佑), 上海, 本科, 2000, 成长型, 企业服务
Android技术专家, 27, 不, 技术, 移动开发, 微店杭州研发中心, 杭州, 学历不限, 150, 成熟型, 移动互联网 · 电子商务
开发者技术社区主编（CEO 直招）, 15, 3, 运营, 编辑, SegmentFault, 杭州, 本科, 15, 成长型, 移动互联网 · 社交网络
Java服务端开发实习, 3, 应届毕业, 技术, 后端开发, 边锋, 杭州, 本科, 500, 成熟型, 移动互联网 · 游戏
PHP技术经理, 23, 3, 技术, 后端开发, Juice Up, 北京, 本科, 15, 初创型, 生活服务
移动技术经理, 21, 3, 技术, 高端技术职位, Uli优礼, 北京, 本科, 15, 成长型, 移动互联网 · 电子商务
资深Android开发, 37, 3, 技术, 移动开发, 立天唐人商业集团, 上海, 大专, 500, 成熟型, 移动互联网 · O2O
高级iOS研发, 22, 3, 技术, 移动开发, 趣分期, 北京, 本科, 2000, 成熟型, 金融
JAVA技术经理, 20, 5, 技术, 后端开发, 美滴, 北京, 大专, 15, 初创型, 移动互联网
Android开发工程师-技术与数据服务部-支付研发方向, 22, 3, 技术, 移动开发, 京东金融, 北京, 本科, 2000, 上市公, 金融
APP技术经理, 25, 3, 技术, 高端技术职位, 数创信息, 北京, 本科, 50, 成长型, 移动互联网 · O2O
​客户端开发工程师——技术中心, 10, 1, 技术, 前端开发, Tap4Fun, 成都, 本科, 150, 初创型, 移动互联网 · 游戏
Java开发, 16, 3, 技术, 后端开发, 爱秀科技, 深圳, 大专, 50, 成长型, 电子商务 · 文化娱乐
项目经理（技术背景）, 10, 3, 技术, 项目管理, 云智汇科技, 成都, 本科, 15, 初创型, 移动互联网 · 企业服务
Java服务器研发, 15, 1, 技术, 后端开发, 魔力码头, 北京, 本科, 15, 初创型, 移动互联网 · 游戏
Java开发, 15, 1, 技术, 后端开发, 秒懂网络, 上海, 大专, 150, 成长型, 移动互联网
技术经理, 8, 3, 技术, 高端技术职位, 易名中国, 厦门, 大专, 50, 初创型, 移动互联网 · 企业服务
研发总监, 22, 3, 技术, 高端技术职位, 摩柚生活技术有限公司, 成都, 大专, 50, 成长型, 移动互联网 · 电子商务
研发总监　, 30, 1, 产品, 产品经理, 摩柚生活技术有限公司, 成都, 学历不限, 50, 成长型, 移动互联网 · 电子商务
研发总监, 30, 3, 技术, 后端开发, 劲马奥通, 成都, 大专, 15, 成长型, 移动互联网 · 电子商务
PHP开发, 20, 1, 技术, 后端开发, 考拉先生, 广州, 大专, 150, 成长型, 移动互联网
Android开发师, 15, 1, 技术, 移动开发, 露懿丝, 上海, 本科, 50, 初创型, 移动互联网 · 教育
机构开发经理, 10, 1, 市场与销售, 销售, 企易融(股权众筹), 上海, 本科, 15, 成长型, 移动互联网 · 金融
Java技术经理, 30, 5, 技术, 高端技术职位, 帮5买, 上海, 本科, 500, 成熟型, 移动互联网 · 电子商务
Java后端开发（攻城狮）, 9, 1, 技术, 后端开发, 天云, 武汉, 本科, 150, 成长型, 移动互联网 · 数据服务
移动端开发测试工程师, 12, 1, 技术, 移动开发, Dilato, 北京, 本科, 150, 成长型, 移动互联网 · 数据服务
Java技术经理, 20, 3, 技术, 后端开发, 司法云平台, 南京, 本科, 50, 成长型, 移动互联网
Arduino开源硬件开发, 5, 不, 技术, 硬件开发, 三好在线, 沈阳, 本科, 15, 初创型, 企业服务 · 广告营销
网站技术经理, 25, 3, 技术, 高端技术职位, 追趣游戏, 北京, 大专, 50, 初创型, 移动互联网 · 游戏
Java开发, 11, 3, 技术, 后端开发, 融配达, 佛山, 大专, 15, 初创型, 电子商务 · 金融
项目经理（偏技术方向）, 12, 1, 技术, 项目管理, 哇宝科技, 杭州, 大专, 15, 初创型, 移动互联网 · 电子商务
Java开发, 11, 1, 技术, 后端开发, 无糖运动, 上海, 学历不限, 15, 初创型, 移动互联网
