技术总监, 40, 10年以, 技术, 高端技术职位, 网易公司, 广州, 本科, 2000, 上市公, 移动互联网 · 文化娱乐
技术总监, 15, 5, 技术, 高端技术职位, 山东河马移动, 济南, 本科, 150, 成长型, 移动互联网
技术总监, 15, 5, 技术, 高端技术职位, 互联精英, 深圳, 本科, 15, 初创型, 企业服务
技术总监, 40, 5, 技术, 高端技术职位, 来人到家, 北京, 本科, 500, 初创型, O2O
技术总监, 12, 不, 运营, 编辑, 优安易, 合肥, 本科, 150, 成长型, 移动互联网 · 电子商务
技术总监, 25, 3, 技术, 高端技术职位, 望洲云大数据技术有限公司, 北京, 本科, 500, 成熟型, 教育
技术总监, 15, 10年以, 技术, 高端技术职位, 兴图新科, 武汉, 本科, 500, 成长型, 移动互联网 · 文化娱乐
技术总监, 35, 5, 技术, 后端开发, 天翼时代, 深圳, 本科, 15, 成长型, 文化娱乐
技术总监, 35, 5, 技术, 高端技术职位, 来租我吧, 北京, 本科, 15, 初创型, 社交网络 · O2O
技术总监, 22, 5, 技术, 后端开发, 无界医疗, 北京, 本科, 15, 初创型, 医疗健康 · 移动互联网
技术总监, 27, 5, 技术, 高端技术职位, 麦增, 深圳, 本科, 50, 成长型, 电子商务 · 金融
技术总监, 37, 5, 技术, 高端技术职位, 数海科技, 北京, 本科, 15, 初创型, 数据服务
技术总监, 9, 3, 技术, 高端技术职位, 医疗界, 郑州, 本科, 50, 初创型, 移动互联网 · 电子商务
技术总监, 30, 5, 技术, 高端技术职位, 阿宅订（帝鼠OS）, 杭州, 本科, 50, 初创型, 移动互联网 · O2O
技术总监, 21, 不, 技术, 高端技术职位, 犇牛金服, 北京, 学历不限, 15, 初创型, 金融 · 数据服务
技术总监, 30, 5, 技术, 高端技术职位, ARTALLY, 北京, 本科, 15, 初创型, 移动互联网 · 生活服务
技术总监, 4, 1, 技术, 高端技术职位, 海卓天瑞, 深圳, 本科, 500, 初创型, 移动互联网 · 数据服务
技术总监, 4, 3, 技术, 高端技术职位, 众美, 成都, 本科, 15, 初创型, 移动互联网 · 教育
技术总监, 30, 5, 技术, 高端技术职位, 骑来骑去, 杭州, 本科, 15, 初创型, 移动互联网 · 企业服务
技术总监, 30, 5, 技术, 高端技术职位, 盛全控股, 杭州, 本科, 500, 上市公, 移动互联网 · 生活服务
技术总监, 20, 不, 技术, 高端技术职位, 乐寻, 上海, 大专, 15, 初创型, 移动互联网 · 金融
技术总监, 32, 5, 技术, 高端技术职位, 知藏, 北京, 本科, 15, 初创型, 移动互联网
技术总监, 25, 5, 技术, 高端技术职位, 中康尚德, 北京, 本科, 50, 成长型, 移动互联网 · 医疗健康
技术总监, 11, 5, 技术, 高端技术职位, 北京好脉网络信息技术有限公司, 长沙, 本科, 15, 初创型, 移动互联网
技术总监, 16, 5, 技术, 高端技术职位, 华晨消防, 郑州, 大专, 150, 初创型, 电子商务
技术总监, 22, 5, 技术, 高端技术职位, E能网, 北京, 大专, 15, 初创型, 移动互联网 · 电子商务
技术总监, 17, 5, 技术, 高端技术职位, 智邦国际, 北京, 大专, 50, 成长型, 企业服务
技术总监, 15, 10年以, 技术, 高端技术职位, 水天科技, 石家庄, 本科, 15, 初创型, 旅游 · 数据服务
技术总监, 50, 5, 技术, 高端技术职位, 自游无限, 北京, 硕士, 50, 成长型, 移动互联网
技术总监（智能人机交互c++语音方向）, 20, 3, 技术, 高端技术职位, 捷通华声, 北京, 本科, 150, 成熟型, 移动互联网 · 数据服务
技术总监, 11, 5, 技术, 高端技术职位, 安久云计算, 郑州, 本科, 50, 初创型, 电子商务 · 数据服务
技术总监, 22, 5, 技术, 高端技术职位, 思家餐饮, 北京, 本科, 50, 成长型, 移动互联网 · O2O
技术总监, 40, 5, 技术, 高端技术职位, 国美在线, 北京, 本科, 2000, 上市公, 电子商务
技术总监, 22, 不, 技术, 高端技术职位, 沈阳大数据运营有限公司, 沈阳, 本科, 150, 初创型, 数据服务
技术总监/售前总监, 30, 10年以, 技术, 高端技术职位, 明朝万达, 北京, 本科, 150, 成熟型, 企业服务 · 信息安全
技术总监, 30, 5, 技术, 高端技术职位, 印刷家, 北京, 本科, 15, 初创型, 电子商务
技术总监, 24, 5, 技术, 高端技术职位, 超群高科, 深圳, 本科, 50, 成长型, 移动互联网 · O2O
技术总监/经理, 30, 5, 技术, 后端开发, 极好家, 上海, 学历不限, 15, 初创型, 电子商务
技术总监, 10, 5, 技术, 高端技术职位, 浩海科技, 青岛, 本科, 50, 上市公, 硬件
技术总监, 20, 3, 技术, 高端技术职位, 展欣电商物流, 上海, 本科, 150, 成长型, 其他
技术总监, 25, 5, 技术, 高端技术职位, 景典游, 北京, 本科, 15, 成长型, 移动互联网
技术总监, 30, 5, 技术, 高端技术职位, 互联网金融理财、供应链金融业务, 北京, 本科, 50, 成长型, 金融
技术总监, 21, 5, 技术, 高端技术职位, MAX Digital, 上海, 本科, 50, 成长型, 移动互联网 · 广告营销
技术总监, 37, 3, 技术, 高端技术职位, Camelia山茶花, 北京, 学历不限, 15, 初创型, 移动互联网 · 电子商务
技术总监, 22, 3, 技术, 高端技术职位, 宸瑞科技, 北京, 本科, 50, 成长型, 数据服务
技术总监, 9, 1, 技术, 高端技术职位, 旺年科技, 北京, 大专, 15, 初创型, 移动互联网
技术总监, 30, 5, 技术, 高端技术职位, 立信诺网络, 深圳, 大专, 150, 成长型, 移动互联网
技术总监, 40, 5, 技术, 高端技术职位, 上海链家(原德佑), 上海, 本科, 2000, 成长型, 企业服务
技术总监, 7, 3, 技术, 高端技术职位, 医疗界, 郑州, 大专, 50, 初创型, 移动互联网 · 电子商务
技术总监, 23, 5, 技术, 高端技术职位, 启创资本, 杭州, 本科, 15, 初创型, 移动互联网 · 企业服务
技术总监, 40, 5, 技术, 高端技术职位, 家如何, 杭州, 大专, 50, 初创型, 移动互联网 · 电子商务
技术总监, 30, 5, 技术, 高端技术职位, 卓尔太奇, 北京, 大专, 15, 初创型, 移动互联网
技术总监, 30, 5, 技术, 高端技术职位, 封面新闻, 成都, 本科, 150, 初创型, 移动互联网
技术总监, 30, 5, 技术, 高端技术职位, 泰岳教育, 北京, 本科, 500, 上市公, 移动互联网 · 社交网络
技术总监, 20, 3, 技术, 高端技术职位, 来慕, 上海, 本科, 15, 初创型, 移动互联网 · O2O
技术总监, 28, 3, 技术, 高端技术职位, 维诺德, 贵阳, 本科, 15, 成长型, 移动互联网 · 电子商务
技术总监, 20, 1, 技术, 高端技术职位, 婚乐多, 北京, 本科, 15, 初创型, O2O
技术总监, 20, 5, 技术, 高端技术职位, 早道网校, 大连, 大专, 150, 成长型, 移动互联网 · 教育
技术总监, 24, 不, 产品, 高端产品职位, 美行思远, 北京, 学历不限, 15, 成长型, 教育 · 文化娱乐
技术总监, 22, 3, 技术, 高端技术职位, 乐梦起源, 上海, 本科, 150, 上市公, 移动互联网
技术总监（硬件方向）, 27, 5, 技术, 硬件开发, 野兽科技, 深圳, 本科, 15, 成长型, 移动互联网 · 硬件
技术总监, 25, 5, 技术, 高端技术职位, 互联网医疗健康, 上海, 本科, 15, 初创型, 移动互联网 · 医疗健康
技术总监, 22, 5, 技术, 高端技术职位, 胖豆科技, 成都, 本科, 15, 初创型, 移动互联网 · 数据服务
技术总监, 50, 5, 技术, 高端技术职位, 无忧保姆, 北京, 本科, 150, 成长型, 生活服务
技术总监, 11, 1, 技术, 高端技术职位, 同筹网, 上海, 本科, 50, 初创型, 金融
技术总监, 12, 5, 技术, 高端技术职位, MoPaaS, 上海, 学历不限, 15, 成长型, 移动互联网 · 数据服务
技术总监, 25, 5, 技术, 高端技术职位, 天信博易, 北京, 本科, 50, 成长型, 移动互联网 · 广告营销
技术总监, 27, 3, 技术, 高端技术职位, 订订宝, 广州, 学历不限, 50, 初创型, 移动互联网 · 金融
技术总监, 22, 5, 技术, 高端技术职位, 51卡车, 广州, 学历不限, 15, 初创型, 移动互联网 · O2O
技术总监, 30, 5, 技术, 高端技术职位, 上古彩, 北京, 本科, 50, 成熟型, 移动互联网 · 电子商务
技术总监, 15, 5, 技术, 高端技术职位, 5i课堂, 深圳, 本科, 15, 初创型, 移动互联网
技术总监, 20, 5, 技术, 项目管理, 点赚科技, 北京, 学历不限, 15, 初创型, 移动互联网 · 广告营销
技术总监, 7, 3, 技术, 高端技术职位, 河北七海, 石家庄, 大专, 50, 初创型, 企业服务
技术总监, 15, 5, 技术, 高端技术职位, 武汉远成赛创科技有限公司, 武汉, 本科, 500, 初创型, 电子商务
技术总监, 17, 3, 技术, 高端技术职位, 前海财库, 深圳, 学历不限, 15, 初创型, 金融
技术总监, 22, 5, 技术, 高端技术职位, 蜘蛛蜂, 北京, 本科, 150, 初创型, 电子商务
技术总监, 20, 3, 技术, 高端技术职位, 北京国联兴业技术研究院, 北京, 本科, 50, 初创型, 移动互联网
技术总监, 40, 5, 技术, 高端技术职位, 朗迈网络科技, 上海, 本科, 15, 成长型, 电子商务 · 旅游
技术总监, 15, 3, 技术, 高端技术职位, 淘酒汇, 沈阳, 学历不限, 15, 初创型, 移动互联网 · 电子商务
技术总监, 30, 3, 技术, 高端技术职位, 蟠桃科技, 杭州, 本科, 50, 初创型, 移动互联网 · O2O
技术总监, 23, 3, 技术, 高端技术职位, 全民尚网, 深圳, 大专, 50, 成长型, 移动互联网 · O2O
技术总监, 35, 5, 技术, 高端技术职位, 绿植到家, 北京, 本科, 15, 初创型, 移动互联网 · 其他
技术总监（人力资源方向）, 37, 5, 技术, 后端开发, 云贝控股集团, 上海, 本科, 150, 初创型, 金融
技术总监, 32, 5, 技术, 高端技术职位, 蓝鸥科技, 北京, 本科, 150, 成长型, 移动互联网 · 教育
技术总监, 47, 5, 技术, 后端开发, 金融界.爱投顾, 北京, 本科, 500, 上市公, 社交网络 · 金融
技术总监, 30, 5, 技术, 后端开发, 穗易麦, 北京, 本科, 15, 初创型, 电子商务
技术总监, 25, 5, 技术, 高端技术职位, 百达屋Betterwood, 北京, 本科, 50, 成长型, 移动互联网 · 生活服务
技术总监, 35, 5, 技术, 高端技术职位, 地利集团, 北京, 本科, 150, 成长型, 电子商务
技术总监, 15, 3, 技术, 高端技术职位, 淘酒汇, 沈阳, 学历不限, 15, 初创型, 移动互联网 · 电子商务
技术总监, 27, 5, 技术, 高端技术职位, 筷好味, 北京, 本科, 150, 成长型, 电子商务 · O2O
技术总监, 25, 5, 技术, 高端技术职位, 海航旅游, 北京, 本科, 2000, 成熟型, 移动互联网 · 生活服务
技术总监, 15, 3, 技术, 后端开发, 医保网, 北京, 大专, 15, 初创型, 移动互联网 · 医疗健康
技术总监(h5/android/ios), 37, 3, 技术, 高端技术职位, U26, 上海, 学历不限, 15, 初创型, 移动互联网
技术总监, 22, 5, 技术, 高端技术职位, 海航云科技有限公司, 北京, 本科, 50, 初创型, 移动互联网 · 数据服务
技术总监, 30, 5, 技术, 高端技术职位, 后河网, 深圳, 本科, 50, 初创型, 金融
技术总监, 30, 5, 技术, 高端技术职位, 北极光, 北京, 本科, 50, 成长型, 金融
技术总监, 12, 5, 技术, 高端技术职位, 长吉贷, 长春, 大专, 15, 初创型, 移动互联网 · 金融
技术总监, 15, 不, 技术, 高端技术职位, 五号空间, 广州, 大专, 50, 成长型, 移动互联网
技术总监, 36, 10年以, 技术, 高端技术职位, 环迅支付, 上海, 本科, 500, 上市公, 金融
技术总监, 52, 5, 技术, 高端技术职位, 英富森, 北京, 本科, 2000, 初创型, 移动互联网 · 电子商务
技术总监, 30, 5, 技术, 高端技术职位, 朗天科技, 北京, 本科, 50, 成长型, 移动互联网 · 电子商务
技术总监, 22, 3, 技术, 高端技术职位, 天津合昶, 天津, 本科, 15, 成长型, 移动互联网
技术总监, 30, 5, 技术, 高端技术职位, 安科泰, 北京, 本科, 15, 初创型, 移动互联网
技术总监, 30, 5, 技术, 高端技术职位, 美婚照照, 上海, 本科, 50, 成长型, 移动互联网 · O2O
技术总监助理, 4, 1, 职能, 行政, 九口袋, 上海, 大专, 150, 初创型, 电子商务
技术总监, 22, 1, 技术, 高端技术职位, 恒志软件, 上海, 本科, 50, 成长型, 移动互联网 · 电子商务
技术总监, 15, 3, 技术, 高端技术职位, 杭州丝里伯, 杭州, 本科, 50, 成长型, 电子商务
技术总监, 45, 3, 技术, 高端技术职位, 网信, 北京, 本科, 2000, 上市公, 电子商务 · 金融
技术总监, 19, 5, 技术, 高端技术职位, 延长信息, 南京, 大专, 15, 初创型, 移动互联网 · 数据服务
技术总监, 26, 5, 技术, 高端技术职位, 车互帮, 北京, 本科, 15, 初创型, 移动互联网
技术总监, 25, 5, 技术, 高端技术职位, 融通汇信, 北京, 本科, 2000, 初创型, 金融
技术总监（互联网方向）, 32, 5, 技术, 高端技术职位, 易积分, 北京, 大专, 15, 初创型, 移动互联网 · O2O
技术总监, 25, 5, 技术, 高端技术职位, 利海纳, 深圳, 大专, 150, 成熟型, 移动互联网 · 金融
技术总监, 52, 5, 技术, 高端技术职位, 途牛旅游网, 上海, 本科, 2000, 上市公, 电子商务 · 旅游
技术总监, 25, 5, 技术, 高端技术职位, 极订, 上海, 本科, 50, 初创型, 移动互联网 · O2O
技术总监, 14, 5, 技术, 高端技术职位, 云使科技, 成都, 本科, 15, 初创型, 电子商务 · 硬件
技术总监, 40, 10年以, 技术, 高端技术职位, 千丁互联, 深圳, 学历不限, 150, 成长型, O2O
技术总监, 15, 1, 技术, 高端技术职位, 易钓, 北京, 本科, 15, 初创型, 移动互联网 · O2O
技术总监, 12, 3, 技术, 高端技术职位, 点久信息科技, 上海, 本科, 15, 初创型, 移动互联网 · 旅游
技术总监, 50, 3, 技术, 高端技术职位, 众筹网, 北京, 本科, 150, 成长型, 金融
技术总监, 12, 3, 技术, 前端开发, 众泽鸿联, 广州, 本科, 15, 初创型, 移动互联网 · 电子商务
技术总监, 15, 3, 技术, 高端技术职位, 卡融网, 成都, 大专, 15, 初创型, 移动互联网
技术总监, 30, 1, 技术, 高端技术职位, 北京麦士, 北京, 本科, 15, 初创型, 移动互联网 · O2O
技术总监, 16, 5, 技术, 高端技术职位, 中润无限, 北京, 本科, 150, 初创型, 移动互联网
技术总监, 27, 3, 技术, 高端技术职位, 果品1956, 杭州, 本科, 15, 初创型, O2O · 生活服务
技术总监, 21, 5, 技术, 高端技术职位, 焦点易购, 北京, 大专, 150, 初创型, 移动互联网 · 电子商务
技术总监, 2, 5, 技术, 高端技术职位, 世纪卫星, 西安, 本科, 50, 成长型, 移动互联网 · O2O
技术总监, 27, 5, 技术, 企业软件, 优腹, 北京, 大专, 15, 初创型, 移动互联网 · O2O
技术总监, 55, 1, 技术, 高端技术职位, 众筹网, 北京, 本科, 150, 成长型, 金融
技术总监, 37, 5, 技术, 高端技术职位, 中国影响力, 上海, 本科, 500, 成熟型, 移动互联网 · 教育
技术总监, 35, 5, 技术, 高端技术职位, 橙天嘉禾影城, 北京, 本科, 500, 上市公, 生活服务 · 文化娱乐
技术总监, 99, 5, 技术, 高端技术职位, 金利恒, 北京, 本科, 500, 初创型, 其他
技术总监, 94, 10年以, 技术, 高端技术职位, 金利恒, 北京, 本科, 500, 初创型, 其他
技术总监, 25, 3, 技术, 高端技术职位, 真挚财富管理, 北京, 本科, 15, 初创型, 移动互联网 · 金融
技术总监, 30, 3, 技术, 高端技术职位, 美吖, 杭州, 学历不限, 15, 初创型, O2O · 移动互联网
技术总监, 27, 5, 技术, 高端技术职位, 私人定制, 杭州, 本科, 15, 初创型, 移动互联网 · 电子商务
技术总监, 25, 5, 技术, 高端技术职位, 韩谊信息, 北京, 本科, 50, 成长型, 电子商务 · 生活服务
技术总监, 25, 5, 技术, 高端技术职位, 入围中国网, 西安, 本科, 150, 成长型, 移动互联网 · 电子商务
技术总监, 42, 5, 技术, 高端技术职位, 同心医联, 北京, 本科, 50, 成长型, 移动互联网 · 医疗健康
技术总监, 30, 5, 技术, 高端技术职位, 烈嘉, 北京, 大专, 50, 初创型, 电子商务 · 企业服务
技术总监, 21, 3, 技术, 高端技术职位, 西禾口语, 北京, 硕士, 15, 初创型, 移动互联网 · 教育
技术总监, 15, 3, 技术, 高端技术职位, 朋友贷, 深圳, 本科, 50, 初创型, 移动互联网 · 金融
技术总监, 42, 5, 技术, 高端技术职位, 北京无双科技, 北京, 本科, 150, 成长型, 数据服务
技术总监, 30, 5, 技术, 高端技术职位, 旮旯网络, 北京, 大专, 15, 初创型, 移动互联网 · 生活服务
技术总监, 25, 5, 技术, 高端技术职位, 房金所, 上海, 大专, 150, 上市公, 金融
技术总监, 20, 5, 技术, 高端技术职位, 早道网校, 大连, 本科, 150, 成长型, 移动互联网 · 教育
技术总监（大数据方向）, 20, 5, 技术, 高端技术职位, 捷通华声, 北京, 硕士, 150, 成熟型, 移动互联网 · 数据服务
技术总监, 25, 3, 技术, 高端技术职位, 再保金融, 南京, 本科, 15, 初创型, 金融
技术总监, 15, 5, 技术, 高端技术职位, 武汉远成赛创科技有限公司, 武汉, 本科, 500, 初创型, 电子商务
技术总监, 22, 1, 技术, 高端技术职位, 唐人, 北京, 本科, 15, 初创型, 移动互联网 · 教育
技术总监, 30, 5, 技术, 高端技术职位, 水贝街.com, 深圳, 本科, 50, 成长型, 电子商务
技术总监, 25, 3, 技术, 高端技术职位, 海金所, 北京, 本科, 50, 成长型, 金融
技术总监, 15, 3, 技术, 高端技术职位, 比比网络, 太原, 本科, 150, 初创型, 电子商务 · 企业服务
技术总监, 30, 5, 技术, 高端技术职位, 壹是壹科技, 北京, 本科, 15, 成长型, 移动互联网 · 电子商务
技术总监, 30, 5, 技术, 高端技术职位, AcFun, 北京, 大专, 150, 成长型, 移动互联网 · 文化娱乐
技术总监, 22, 3, 技术, 高端技术职位, 上海为伊, 上海, 本科, 15, 初创型, 电子商务
技术总监, 17, 3, 技术, 高端技术职位, 泽联教育, 北京, 学历不限, 15, 初创型, 移动互联网 · 教育
技术总监, 17, 5, 技术, 前端开发, 网银贷, 深圳, 大专, 50, 初创型, 金融
技术总监, 30, 5, 技术, 高端技术职位, 漫步时光, 北京, 本科, 15, 初创型, O2O
技术总监, 25, 1, 技术, 高端技术职位, 杰仕数据, 北京, 大专, 15, 初创型, 移动互联网 · 电子商务
技术总监, 27, 5, 技术, 高端技术职位, 信用宝-我爱卡, 深圳, 本科, 500, 成长型, 移动互联网 · 金融
技术总监, 52, 5, 技术, 高端技术职位, 宜信, 北京, 本科, 2000, 成熟型, 移动互联网 · 金融
技术总监, 40, 5, 技术, 高端技术职位, 智互联, 深圳, 本科, 50, 上市公, 电子商务
技术总监, 22, 5, 技术, 高端技术职位, CCMTV临床频道, 北京, 本科, 50, 初创型, 医疗健康
技术总监, 20, 3, 技术, 高端技术职位, 北京正鹊网络科技有限公司, 北京, 大专, 150, 成长型, 移动互联网
技术总监, 10, 5, 技术, 高端技术职位, 橙天科技, 杭州, 本科, 50, 成长型, 金融
技术总监, 27, 5, 技术, 后端开发, 穿山甲金服, 上海, 本科, 150, 成长型, 金融 · 其他
技术总监, 25, 3, 技术, 高端技术职位, 盐商集团, 上海, 本科, 150, 成长型, 金融
技术总监, 10, 5, 技术, 高端技术职位, 湖北远成, 武汉, 本科, 500, 初创型, 电子商务 · 广告营销
技术总监, 16, 5, 技术, 高端技术职位, 私人定制, 武汉, 本科, 15, 初创型, 移动互联网 · 电子商务
技术总监, 17, 3, 技术, 高端技术职位, 神州美味, 北京, 本科, 15, 初创型, 移动互联网 · O2O
技术总监, 27, 5, 技术, 高端技术职位, 中酒饮科技发展有限公司, 北京, 本科, 150, 成长型, 电子商务
技术总监, 22, 5, 技术, 高端技术职位, 浙江安普利, 杭州, 本科, 50, 初创型, 移动互联网 · 其他
技术总监, 25, 5, 技术, 高端技术职位, 北京零下科技有限公司, 北京, 本科, 15, 初创型, 移动互联网
技术总监, 32, 5, 技术, 高端技术职位, 晖保智能, 上海, 本科, 50, 成长型, 数据服务 · 硬件
技术总监, 32, 5, 技术, 高端技术职位, codefollow, 北京, 学历不限, 15, 初创型, 社交网络 · 教育
技术总监, 30, 5, 技术, 后端开发, 享趣网, 上海, 大专, 50, 初创型, O2O · 旅游
技术总监, 17, 3, 技术, 高端技术职位, 美沃斯, 北京, 本科, 15, 初创型, 移动互联网 · 医疗健康
技术总监, 25, 5, 技术, 高端技术职位, ACFUN, 北京, 本科, 150, 成长型, 移动互联网
技术总监, 27, 3, 技术, 高端技术职位, 车富88, 深圳, 大专, 150, 初创型, 金融
技术总监, 15, 3, 技术, 高端技术职位, 杭州创辉农业科技有限公司, 杭州, 大专, 15, 初创型, 移动互联网 · 电子商务
技术总监, 15, 5, 技术, 高端技术职位, 浙报传媒, 杭州, 本科, 2000, 上市公, 移动互联网 · 文化娱乐
技术总监, 35, 3, 技术, 移动开发, 快油, 北京, 本科, 15, 初创型, 移动互联网 · 其他
技术总监, 25, 5, 技术, 高端技术职位, 迅银互联网, 上海, 大专, 500, 成长型, 金融
技术总监（智能人机交互c++语音方向）, 20, 5, 技术, 后端开发, 捷通华声, 北京, 本科, 150, 成熟型, 移动互联网 · 数据服务
技术总监, 42, 5, 技术, 高端技术职位, 节操精选, 北京, 学历不限, 15, 成长型, 移动互联网
技术总监, 30, 5, 技术, 高端技术职位, hdtMEDIA, 上海, 本科, 150, 成长型, 移动互联网 · 电子商务
技术总监, 55, 5, 技术, 高端技术职位, 马力国际, 深圳, 本科, 15, 初创型, 企业服务 · 数据服务
技术总监, 45, 5, 技术, 高端技术职位, 启明星辰, 北京, 本科, 2000, 上市公, 移动互联网
技术总监, 37, 3, 技术, 高端技术职位, 点滴理财, 北京, 本科, 50, 成长型, 移动互联网 · 金融
技术总监, 37, 10年以, 技术, 高端技术职位, 量子防务, 深圳, 本科, 15, 成长型, 移动互联网 · O2O
技术总监, 55, 5, 技术, 高端技术职位, 艾诺伊, 深圳, 大专, 150, 成长型, 移动互联网 · 电子商务
技术总监, 30, 5, 技术, 高端技术职位, 银米金融, 杭州, 学历不限, 150, 成长型, O2O · 金融
技术总监, 25, 5, 技术, 高端技术职位, 101远程教育网, 北京, 本科, 150, 上市公, 教育
技术总监, 21, 5, 技术, 高端技术职位, 卓尔电商集团, 武汉, 本科, 500, 上市公, 电子商务 · 金融
技术总监（移动互联网）, 22, 3, 技术, 高端技术职位, 青岛易联天下, 青岛, 本科, 150, 初创型, 移动互联网 · 电子商务
技术总监, 25, 5, 技术, 高端技术职位, 博睿精实, 北京, 本科, 15, 初创型, 医疗健康
技术总监, 15, 3, 技术, 高端技术职位, 沈阳宅急送, 沈阳, 学历不限, 150, 初创型, 生活服务 · 其他
技术总监, 30, 5, 技术, 高端技术职位, 享趣网, 上海, 本科, 50, 初创型, O2O · 旅游
技术总监, 40, 3, 技术, 高端技术职位, 开天创世, 北京, 本科, 15, 成长型, 移动互联网 · 游戏
技术总监（政企服务方向）, 37, 5, 技术, 高端技术职位, 志晟信息, 北京, 本科, 150, 上市公, 企业服务
技术总监, 15, 5, 技术, 高端技术职位, 爱订云, 深圳, 本科, 15, 初创型, 移动互联网 · O2O
技术总监, 25, 5, 技术, 硬件开发, wonsee, 深圳, 本科, 50, 初创型, 移动互联网 · 硬件
技术总监, 65, 5, 技术, 高端技术职位, 华南城网, 深圳, 本科, 150, 成长型, 移动互联网 · 电子商务
技术总监, 30, 5, 技术, 高端技术职位, 讯点三维, 杭州, 硕士, 15, 初创型, 数据服务 · 硬件
技术总监, 15, 5, 技术, 高端技术职位, 云自媒, 广州, 大专, 15, 初创型, 移动互联网
技术总监, 40, 5, 技术, 高端技术职位, 好规划, 北京, 本科, 50, 成长型, 金融
技术总监/架构师, 35, 5, 技术, 高端技术职位, 大家汇教育, 北京, 本科, 15, 成长型, 移动互联网 · 教育
技术总监, 45, 5, 技术, 高端技术职位, 先锋租赁, 北京, 本科, 150, 成长型, 金融
技术总监, 25, 5, 技术, 高端技术职位, 索贝学院, 成都, 本科, 15, 初创型, 教育 · 文化娱乐
技术总监, 22, 5, 技术, 高端技术职位, 一起编, 成都, 本科, 150, 初创型, 社交网络 · 文化娱乐
技术总监, 40, 5, 技术, 高端技术职位, 她理财, 北京, 本科, 50, 成长型, 电子商务 · 金融
技术总监, 30, 3, 技术, 高端技术职位, 蓝熙健康, 杭州, 本科, 50, 成长型, O2O · 医疗健康
技术总监, 15, 5, 技术, 高端技术职位, 快悦信息, 广州, 本科, 50, 初创型, 移动互联网 · 金融
技术总监, 17, 1, 技术, 高端技术职位, 朋趣, 上海, 本科, 15, 初创型, O2O
部门技术总监, 30, 5, 技术, 高端技术职位, 数据堂, 北京, 本科, 50, 成长型, 数据服务 · 分类信息
技术总监, 40, 5, 技术, 高端技术职位, 医诚, 北京, 本科, 50, 初创型, 移动互联网 · 生活服务
技术总监, 37, 10年以, 技术, 高端技术职位, 泰捷软件, 深圳, 本科, 50, 成长型, 文化娱乐 · 硬件
技术总监, 30, 5, 技术, 高端技术职位, 林安集团, 广州, 本科, 500, 初创型, 移动互联网 · 金融
技术总监, 37, 5, 技术, 后端开发, 杭州万淳, 厦门, 学历不限, 150, 初创型, 金融 · 生活服务
