销售经理, 7, 3, 市场与销售, 销售, 百航信息, 杭州, 学历不限, 50, 成长型, 移动互联网 · 金融
大客户经理, 12, 不, 市场与销售, 销售, 微智全景, 北京, 学历不限, 150, 成长型, 移动互联网  · O2O
天猫运营主管/经理, 7, 1, 运营, 运营, 乐邦, 杭州, 大专, 150, 上市公, 移动互联网 · 电子商务
开发主管, 12, 不, 技术, 前端开发, 和讯网, 北京, 学历不限, 150, 成长型, 移动互联网
城市经理, 7, 1, 市场与销售, 市场/营销, 前海P2P, 深圳, 本科, 50, 成长型, 金融
薪酬福利经理, 12, 5, 职能, 人力资源, 蚂蜂窝, 北京, 本科, 150, 成熟型, 移动互联网 · 旅游
产品主管/产品专员, 8, 1, 产品, 产品经理, 千里马招标网, 北京, 大专, 150, 成长型, 电子商务 · 企业服务
技术经理, 23, 5, 技术, 后端开发, 联创集团信通科技, 北京, 本科, 150, 成长型, 移动互联网 · 教育
地推主管, 6, 不, 市场与销售, 市场/营销, 两鲜, 上海, 大专, 150, 成长型, 电子商务
销售主管/经理, 9, 1, 市场与销售, 市场/营销, 艾迪艾思（北京）科技, 北京, 本科, 50, 成长型, 移动互联网 · 电子商务
员工关系主管, 7, 5, 职能, 人力资源, 小旗常州, 常州, 大专, 500, 成熟型, 金融
客服主管, 7, 3, 运营, 客服, 海风教育, 上海, 大专, 50, 成长型, 教育
法务经理, 15, 3, 职能, 法务, 英威诺, 深圳, 本科, 150, 成长型, 移动互联网 · 数据服务
电商运营主管, 12, 不, 运营, 运营, MagicWIFI, 深圳, 学历不限, 50, 成长型, 移动互联网
社会化营销主管, 12, 3, 市场与销售, 公关, 优分期, 北京, 大专, 500, 成长型, 电子商务 · 金融
客服主管（年发16薪）, 5, 1, 运营, 客服, 大树网络金融, 杭州, 大专, 15, 成长型, 移动互联网 · 金融
法务主管, 15, 3, 职能, 法务, 北京智能管家科技有限公司, 北京, 本科, 150, 成长型, 硬件
前端开发经理, 25, 3, 技术, 前端开发, 我享, 上海, 本科, 150, 成长型, 移动互联网 · 旅游
媒体采购经理/总监, 17, 3, 市场与销售, 公关, 要出发, 广州, 本科, 500, 成熟型, 电子商务 · 生活服务
技术经理, 70, 5, 技术, 高端技术职位, 买衣爽, 上海, 本科, 50, 成长型, 电子商务 · O2O
产品定价主管, 12, 不, 市场与销售, 销售, Gridsum 国双, 北京, 本科, 500, 成熟型, 数据服务
进度管控经理, 17, 5, 技术, 项目管理, 大横琴科技, 珠海, 本科, 50, 成长型, 企业服务 · 数据服务
账务主管, 15, 3, 职能, 财务, e代驾, 北京, 本科, 500, 成熟型, 移动互联网 · O2O
风控主管, 12, 5, 金融, 风控, 中杰信德, 北京, 本科, 50, 初创型, 金融
商务拓展经理, 6, 1, 市场与销售, 销售, 5U体育, 广州, 大专, 50, 成长型, 移动互联网 · 文化娱乐
文案策划主管, 15, 1, 运营, 运营, 米么金服, 上海, 本科, 150, 成长型, 移动互联网 · 金融
团队主管（投资/理财端）, 8, 3, 市场与销售, 销售, Formax-福亿财富, 昆明, 大专, 500, 成长型, 金融 · 移动互联网
内审主管, 9, 3, 职能, 财务, 阿姨帮, 北京, 本科, 150, 成长型, 移动互联网 · O2O
网络营销经理, 22, 5, 市场与销售, 市场/营销, 青苔债管家, 北京, 学历不限, 15, 成长型, 移动互联网 · 金融
策划主管, 20, 3, 市场与销售, 市场/营销, 益学, 上海, 大专, 150, 初创型, 教育
客服主管, 6, 1, 运营, 客服, 华燕房盟, 上海, 学历不限, 500, 上市公, 移动互联网 · O2O
产品部经理, 30, 5, 产品, 高端产品职位, 光汇石油, 深圳, 本科, 500, 上市公, 其他
媒介经理, 5, 1, 市场与销售, 公关, 安果, 北京, 本科, 15, 初创型, 移动互联网 · 游戏
大客户经理, 12, 1, 市场与销售, 销售, 微智全景, 上海, 本科, 150, 成长型, 移动互联网  · O2O
商务渠道经理, 6, 1, 市场与销售, 销售, 一路财富, 北京, 本科, 50, 成长型, 金融 · 招聘
渠道经理/分销主管, 19, 3, 市场与销售, 市场/营销, 中呈电美, 广州, 学历不限, 15, 初创型, 电子商务
技术经理, 14, 5, 技术, 高端技术职位, 盟拓软件（苏州）有限公司, 苏州, 大专, 150, 成长型, 移动互联网 · 电子商务
技术经理, 22, 3, 技术, 高端技术职位, 极享科技, 北京, 本科, 50, 成长型, 移动互联网 · O2O
技术经理, 32, 5, 技术, 高端技术职位, 嗨学网, 北京, 本科, 150, 成长型, 移动互联网
技术经理, 25, 5, 技术, 高端技术职位, 仙境乐网, 北京, 本科, 50, 成长型, 移动互联网 · 游戏
城市商务合作经理, 9, 3, 市场与销售, 销售, YHOUSE, 上海, 本科, 150, 成长型, 移动互联网
稽查主管, 4, 不, 金融, 风控, 私享家, 广州, 大专, 500, 成长型, 旅游 · 文化娱乐
招生主管, 15, 3, 市场与销售, 高端市场职位, 1217公司, 杭州, 大专, 15, 初创型, 移动互联网 · 生活服务
市场营销经理, 12, 3, 市场与销售, 市场/营销, 有米科技, 广州, 本科, 150, 上市公, 移动互联网 · 广告营销
市场营销经理, 11, 5, 市场与销售, 市场/营销, 金笛软件, 北京, 本科, 15, 初创型, 移动互联网
媒介经理, 14, 3, 市场与销售, 公关, 51信用卡管家, 杭州, 本科, 150, 成长型, 金融 · 数据服务
增值主管, 7, 1, 市场与销售, 市场/营销, 阿姨帮广州分公司, 广州, 大专, 150, 成长型, 移动互联网 · O2O
市场推广经理, 11, 3, 运营, 运营, 金工场, 深圳, 本科, 15, 初创型, 移动互联网 · 电子商务
数据分析经理, 12, 3, 市场与销售, 市场/营销, Darry Ring, 深圳, 大专, 150, 初创型, 电子商务
市场推广经理/总监, 30, 3, 市场与销售, 市场/营销, 学啊网, 广州, 大专, 50, 成长型, 移动互联网 · 教育
技术主管, 20, 3, 技术, 后端开发, 为新网络, 广州, 大专, 15, 初创型, 移动互联网 · 社交网络
研发经理, 20, 3, 技术, 高端技术职位, 掌视亿通, 北京, 学历不限, 50, 成长型, 移动互联网 · 文化娱乐
网站运营主管/经理, 12, 3, 运营, 运营, 天士力, 天津, 本科, 2000, 成熟型, 其他
网络营销主管（微信）, 10, 1, 市场与销售, 市场/营销, 小河理财, 上海, 大专, 150, 初创型, 金融
硬件测试&nbsp;经理, 11, 3, 技术, 测试, 汇通天下, 北京, 本科, 500, 成熟型, 移动互联网 · 数据服务
销售经理, 3, 不, 市场与销售, 销售, 巴图鲁公司, 福州, 大专, 500, 成长型, 电子商务
高级品牌经理, 17, 3, 市场与销售, 公关, 12308全国汽车票, 深圳, 大专, 50, 成长型, 移动互联网 · 电子商务
公关经理, 15, 5, 市场与销售, 公关, 互众广告, 上海, 本科, 50, 成长型, 广告营销 · 文化娱乐
市场部经理, 11, 3, 市场与销售, 市场/营销, INBUY, 上海, 大专, 15, 成长型, 电子商务 · 企业服务
软件测试主管, 15, 3, 技术, 测试, 村村乐, 杭州, 大专, 50, 成熟型, 移动互联网 · 社交网络
法务主管, 10, 3, 职能, 法务, 中国先锋金融集团, 北京, 本科, 500, 成长型, 金融
公关经理, 10, 3, 技术, 后端开发, 广州邢帅教育科技有限公司, 广州, 本科, 500, 成长型, 电子商务 · 教育
高级产品策划经理/产品策划总监, 22, 3, 产品, 高端产品职位, LEOMASTER, 深圳, 本科, 150, 成长型, 移动互联网
媒介经理, 12, 1, 市场与销售, 公关, 聚份子, 苏州, 大专, 15, 初创型, 电子商务 · 数据服务
编辑主管, 9, 3, 运营, 高端运营职位, 广州际讯数码科技（辉常好波网）, 广州, 本科, 50, 初创型, 移动互联网
商务渠道总监/经理, 12, 3, 市场与销售, 市场/营销, 上海天擎, 上海, 大专, 150, 成长型, 移动互联网
招商经理, 7, 1, 市场与销售, 销售, 约瑟石化, 深圳, 大专, 50, 成长型, 金融
高级市场经理, 30, 3, 市场与销售, 市场/营销, 探探, 北京, 本科, 150, 成长型, 移动互联网 · 文化娱乐
测试主管, 16, 5, 技术, 测试, 鹏海运, 深圳, 本科, 150, 成长型, 企业服务 · 数据服务
采购经理/总监, 17, 不, 市场与销售, 采购, 海吉星商城, 深圳, 大专, 50, 初创型, 电子商务
投资经理, 12, 1, 金融, 投融资, 聚板网络, 上海, 本科, 15, 初创型, 金融
投资经理, 9, 1, 金融, 投融资, 轻松筹, 北京, 本科, 50, 成长型, 移动互联网 · 金融
人力资源主管/经理, 8, 1, 职能, 人力资源, 鹰漠旅行, 广州, 大专, 50, 成长型, 移动互联网 · 旅游
公关主管, 7, 3, 市场与销售, 公关, 永利宝, 上海, 大专, 150, 成长型, 金融
市场营销主管, 12, 1, 市场与销售, 市场/营销, 嘉丰瑞德, 上海, 本科, 50, 成长型, 金融
Asia Office Manager/北京办公室主管, 3, 不, 职能, 行政, Aeras, 北京, 本科, 50, 成长型, 医疗健康
人力资源主管, 8, 3, 职能, 人力资源, 卡咪网络, 杭州, 本科, 50, 成长型, 移动互联网
地推主管, 9, 3, 市场与销售, 销售, 天行家, 深圳, 大专, 15, 初创型, O2O · 生活服务
客服主管, 7, 3, 运营, 客服, 快捷通, 杭州, 大专, 50, 成长型, 金融
培训主管（上海）, 10, 5, 职能, 人力资源, 钱橙金服, 上海, 大专, 150, 初创型, 移动互联网 · 金融
媒介经理, 4, 不, 市场与销售, 公关, 安果, 北京, 大专, 15, 初创型, 移动互联网 · 游戏
财务报告经理, 22, 3, 职能, 财务, Gridsum 国双, 北京, 本科, 500, 成熟型, 数据服务
风控主管, 9, 3, 金融, 风控, 趣医网, 北京, 本科, 500, 成长型, 移动互联网 · 医疗健康
媒介经理, 9, 1, 市场与销售, 公关, 上海头条, 上海, 本科, 15, 初创型, 移动互联网 · 广告营销
校园招聘经理, 14, 不, 职能, 人力资源, 沪江, 上海, 本科, 500, 成熟型, 移动互联网 · 教育
生鲜采购主管, 12, 3, 市场与销售, 采购, 两鲜, 上海, 大专, 150, 成长型, 电子商务
人事行政经理, 10, 5, 职能, 人力资源, 速溶360, 上海, 本科, 15, 成长型, 移动互联网 · 社交网络
融资经理, 12, 1, 金融, 投融资, 华夏一脉, 北京, 大专, 50, 成长型, 移动互联网 · 文化娱乐
风控主管, 10, 1, 金融, 风控, 百财车贷, 上海, 大专, 15, 成长型, 金融
法务主管/专员, 10, 1, 职能, 法务, 谊游, 广州, 本科, 150, 成长型, 游戏
销售经理, 20, 1, 市场与销售, 销售, 亿方云科技, 深圳, 大专, 50, 成长型, 移动互联网 · 数据服务
区域主管/销售主管, 11, 1, 市场与销售, 销售, 达达, 厦门, 大专, 500, 成熟型, O2O
媒介经理, 8, 1, 市场与销售, 公关, 微播易, 北京, 学历不限, 150, 成熟型, 广告营销
商务经理, 14, 3, 市场与销售, 销售, 易橙天下, 上海, 本科, 50, 成长型, 移动互联网 · 文化娱乐
调度主管, 6, 1, , 物流, 云鸟科技, 北京, 中专, 150, 成长型, 移动互联网 · O2O
财务内控经理, 9, 5, 职能, 财务, 红岭创投, 深圳, 本科, 2000, 上市公, 移动互联网 · 金融
产品运营主管, 11, 3, 运营, 运营, 欣芙科技, 上海, 本科, 15, 初创型, 移动互联网 · O2O
移动电商运营主管, 8, 3, 运营, 运营, 卖客疯APP（宝尊电商旗下，纳斯达克上市公司）, 上海, 学历不限, 500, 上市公, 移动互联网 · 电子商务
招聘经理/主管（互联网金融背景优先考虑）, 10, 3, 职能, 人力资源, 短融网, 北京, 大专, 150, 成长型, 金融
活动策划主管, 8, 1, 市场与销售, 市场/营销, 买卖宝, 北京, 本科, 500, 成熟型, 移动互联网 · 电子商务
法务经理, 12, 1, 职能, 法务, 先健金融, 深圳, 本科, 50, 初创型, 金融 · 医疗健康
媒介经理, 7, 3, 市场与销售, 公关, 光汇石油, 深圳, 本科, 500, 上市公, 其他
运营主管, 10, 1, 运营, 运营, 玩票, 上海, 本科, 15, 初创型, 移动互联网 · O2O
大客户经理, 15, 1, 市场与销售, 销售, 蛋壳公寓, 北京, 本科, 50, 成长型, O2O
客服经理/主管, 10, 1, 运营, 客服, MarcPoint, 上海, 本科, 15, 初创型, 电子商务 · 广告营销
合规主管, 17, 5, 金融, 风控, 迈特克科技, 北京, 本科, 15, 初创型, 金融
产品主管/产品专员, 6, 1, 产品, 产品经理, 优云, 广州, 大专, 50, 成长型, 移动互联网
风控经理/总监, 15, 5, 职能, 财务, 优分期, 北京, 本科, 500, 成长型, 电子商务 · 金融
网络营销策划主管/经理, 9, 1, 市场与销售, 市场/营销, 诚琛移民留学, 广州, 本科, 50, 成熟型, 移动互联网 · 教育
销售经理, 15, 5, 市场与销售, 销售, 盟大集团, 东莞, 大专, 150, 成熟型, 移动互联网 · 电子商务
电商平台客服主管, 7, 3, 运营, 客服, 路路由, 上海, 学历不限, 150, 成长型, 移动互联网 · O2O
市场策划主管, 5, 1, 市场与销售, 市场/营销, 万秀科技, 广州, 学历不限, 50, 成长型, 电子商务 · 旅游
电商运营顾问（经理）, 12, 3, 运营, 运营, 搜道网, 杭州, 本科, 50, 成长型, 电子商务 · 社交网络
法务主管, 12, 3, 金融, 审计税务, 国石征信, 北京, 本科, 500, 成熟型, 移动互联网 · 金融
客服主管, 4, 1, 运营, 客服, cleafe, 上海, 学历不限, 150, 初创型, O2O · 硬件
内容主管, 8, 3, 运营, 编辑, 派对薯条, 上海, 本科, 15, 初创型, 电子商务 · 文化娱乐
销售经理, 6, 1, 市场与销售, 销售, 选最好, 深圳, 大专, 50, 成长型, 移动互联网
绩效主管, 6, 1, 职能, 人力资源, 启明星, 深圳, 本科, 150, 成长型, 电子商务
PHP研发主管/经理, 25, 5, 技术, 后端开发, UCAR用车, 北京, 大专, 50, 成长型, 移动互联网 · O2O
政府事务经理, 15, 5, 市场与销售, 公关, 有米科技, 广州, 本科, 150, 上市公, 移动互联网 · 广告营销
数据分析主管, 20, 5, 市场与销售, 市场/营销, 东风日产数据营销公司, 广州, 本科, 150, 初创型, 电子商务
售后技术服务经理, 8, 3, 运营, 客服, 订货宝, 成都, 大专, 50, 成长型, 电子商务
数据平台经理, 21, 1, 技术, 后端开发, 什么值得买, 北京, 学历不限, 150, 成长型, 电子商务 · 文化娱乐
开发主管（项目经理）, 20, 3, 技术, 项目管理, 上海思创华信, 上海, 本科, 500, 成熟型, 其他
绩效薪资主管, 15, 5, 职能, 人力资源, Makeblock, 深圳, 本科, 50, 成长型, 硬件
网站推广主管（企业客户）, 8, 1, 市场与销售, 市场/营销, 广而告之, 北京, 大专, 50, 初创型, 移动互联网 · 文化娱乐
公关经理, 15, 3, 市场与销售, 公关, 车蚂蚁, 杭州, 本科, 150, 成长型, 移动互联网 · O2O
绩效考核经理, 8, 3, 职能, 人力资源, 南极人, 上海, 大专, 150, 上市公, 电子商务 · O2O
法务主管, 12, 3, 职能, 法务, 卷皮, 深圳, 本科, 500, 成长型, 电子商务
销售经理, 9, 1, 市场与销售, 销售, 家墨方, 杭州, 学历不限, 15, 初创型, 移动互联网
PR经理, 15, 3, 运营, 高端运营职位, 利伊享, 杭州, 大专, 50, 成长型, 移动互联网
客服主管, 5, 1, 运营, 客服, 武汉天之和, 武汉, 大专, 50, 初创型, 电子商务
客服流程主管, 6, 3, 运营, 客服, 汽车超人, 杭州, 大专, 500, 成熟型, 电子商务 · 其他
品牌营销经理, 27, 5, 市场与销售, 高端市场职位, 最鲜到, 杭州, 本科, 150, 成长型, O2O
市场部主管, 9, 3, 市场与销售, 市场/营销, 百布, 广州, 学历不限, 150, 成长型, 移动互联网
媒介经理, 9, 1, 市场与销售, 公关, 光汇石油, 深圳, 本科, 500, 上市公, 其他
市场营销经理, 22, 3, 市场与销售, 市场/营销, 汇积分, 北京, 本科, 15, 初创型, O2O · 数据服务
大客户总监/经理, 12, 5, 市场与销售, 销售, 通路快建, 上海, 大专, 500, 成熟型, 移动互联网  · O2O
销售经理, 15, 不, 市场与销售, 销售, 云之讯, 深圳, 学历不限, 150, 成长型, 移动互联网
运营总监/经理, 25, 5, 运营, 运营, 悠先点菜, 杭州, 大专, 150, 成长型, 移动互联网
城市经理, 9, 1, 市场与销售, 市场/营销, 优呗, 北京, 大专, 15, 初创型, 移动互联网
微信运营主管/经理, 8, 1, 运营, 运营, 鹰漠旅行, 广州, 大专, 50, 成长型, 移动互联网 · 旅游
技术经理, 35, 3, 技术, 高端技术职位, 用友IUAP, 北京, 本科, 2000, 上市公, 移动互联网 · 数据服务
城市经理, 7, 3, 市场与销售, 市场/营销, 车来了, 武汉, 大专, 150, 成长型, 移动互联网 · 数据服务
渠道经理, 6, 3, 市场与销售, 销售, 天地在线, 北京, 大专, 500, 成熟型, 移动互联网
招聘经理, 6, 3, 职能, 人力资源, 深圳市起驾护航科技有限公司, 深圳, 本科, 50, 成长型, 移动互联网 · O2O
企划经理, 11, 1, 市场与销售, 市场/营销, 艾佳生活, 南京, 大专, 50, 初创型, 电子商务
法务主管, 10, 3, 职能, 法务, 南方银谷, 深圳, 本科, 150, 成熟型, 移动互联网 · 数据服务
机构合作经理（供应链）, 22, 3, 金融, 投融资, 路路由, 上海, 大专, 150, 成长型, 移动互联网 · O2O
招聘主管, 8, 3, 职能, 人力资源, 淘汽档口, 杭州, 本科, 500, 成长型, 电子商务
客服主管, 7, 1, 运营, 客服, 六六投资, 深圳, 大专, 15, 初创型, 金融
法务经理, 16, 5, 金融, 风控, 随手科技, 深圳, 本科, 150, 成长型, 移动互联网 · 金融
媒介经理, 10, 3, 市场与销售, 公关, 拓维信息, 北京, 本科, 2000, 上市公, 移动互联网 · 教育
渠道销售经理, 8, 1, 市场与销售, 销售, 微智全景, 北京, 大专, 150, 成长型, 移动互联网  · O2O
城市经理, 11, 3, 市场与销售, 销售, YHOUSE, 杭州, 大专, 150, 成长型, 移动互联网
研究经理, 8, 1, 设计, 用户研究, 北京布雷恩科技有限公司, 北京, 本科, 15, 初创型, 企业服务
城市经理, 22, 5, 市场与销售, 市场/营销, 领壹科技, 苏州, 大专, 500, 成熟型, 移动互联网 · 金融
技术经理, 18, 3, 技术, 高端技术职位, 深圳市保利物业管理集团有限公司, 深圳, 本科, 2000, 成熟型, 电子商务 · 生活服务
网络推广主管, 14, 3, 运营, 运营, 网贷之家, 上海, 学历不限, 150, 成长型, 金融
供应链经理, 12, 5, 运营, 高端运营职位, 闪修侠, 杭州, 本科, 50, 成长型, 电子商务 · O2O
分拣主管, 6, 1, 职能, 行政, 北京阿姨帮, 北京, 学历不限, 150, 成长型, O2O · 生活服务
新媒体主管, 9, 1, 运营, 运营, 众信金融, 北京, 本科, 50, 初创型, 移动互联网 · 金融
市场推广经理, 15, 3, 市场与销售, 市场/营销, 掌众金融, 北京, 学历不限, 150, 成长型, 移动互联网 · 金融
软件开发主管, 8, 5, 技术, 项目管理, 亿童文教, 武汉, 本科, 500, 上市公, 移动互联网 · 教育
文案策划主管, 8, 3, 市场与销售, 市场/营销, 讯鸟软件, 北京, 本科, 150, 成长型, 数据服务
薪酬福利主管, 8, 3, 职能, 人力资源, 咸鱼游戏, 深圳, 本科, 50, 成长型, 游戏
网络营销经理, 13, 1, 市场与销售, 市场/营销, 全城逛街, 上海, 本科, 50, 成长型, 移动互联网 · O2O
网络主管, 10, 3, 技术, 高端技术职位, 龙本教育, 北京, 大专, 500, 成熟型, 教育
项目主管, 12, 3, 技术, 项目管理, 上海林果科技, 上海, 本科, 150, 成熟型, 移动互联网
会计主管, 11, 3, 职能, 财务, 优装美家, 北京, 本科, 2000, 上市公, 电子商务
品牌策划经理, 11, 3, 市场与销售, 市场/营销, 3W Coffee, 深圳, 大专, 15, 成长型, 移动互联网 · 招聘
人事行政经理, 10, 5, 职能, 人力资源, 我厨（上海）科技有限公司, 上海, 大专, 150, 成长型, 电子商务 · O2O
产品主管(PC端), 8, 1, 产品, 产品经理, 三滴瑞淇, 北京, 本科, 50, 成长型, 移动互联网
（急招）HR经理/专员, 9, 3, 职能, 人力资源, 雪瓣, 杭州, 大专, 15, 成长型, O2O · 生活服务
高级应用分发经理, 13, 1, 运营, 运营, 创新谷, 深圳, 本科, 150, 初创型, 移动互联网
绩效考核经理, 12, 3, 职能, 人力资源, 要出发, 广州, 本科, 500, 成熟型, 电子商务 · 生活服务
CRM 主管, 11, 1, 运营, 运营, 车蚂蚁, 杭州, 本科, 150, 成长型, 移动互联网 · O2O
招商专员/主管, 6, 1, 市场与销售, 市场/营销, 中海创, 福州, 本科, 2000, 成熟型, 其他
销售经理, 3, 1, 市场与销售, 市场/营销, 巴图鲁公司, 杭州, 大专, 500, 成长型, 电子商务
结算主管, 5, 3, 职能, 财务, 广州百倍科技, 广州, 大专, 50, 成长型, 游戏 · 金融
BD经理, 12, 3, 市场与销售, 销售, 电视淘宝, 杭州, 本科, 50, 成长型, 电子商务
品牌经理, 12, 3, 市场与销售, 公关, 神州佳教, 北京, 本科, 50, 成长型, 移动互联网 · 教育
SEM经理, 20, 1, 运营, 运营, 千里马招标网, 北京, 大专, 150, 成长型, 电子商务 · 企业服务
业务拓展经理, 11, 3, 市场与销售, 市场/营销, 中财金润集团, 北京, 本科, 50, 成长型, 移动互联网 · 医疗健康
内容运营主管, 11, 3, 运营, 运营, 木仓科技, 武汉, 本科, 150, 成熟型, 移动互联网
客服主管, 8, 1, 运营, 客服, 宝尊电商, 上海, 大专, 500, 上市公, 电子商务
研发经理, 25, 5, 技术, 高端技术职位, 三一重工股份有限公司, 北京, 本科, 2000, 上市公, 移动互联网 · 电子商务
商务合作经理, 20, 3, 市场与销售, 销售, 中融金, 北京, 本科, 150, 上市公, 金融
招商经理, 22, 1, 市场与销售, 采购, 深圳雅活荟网络科技有限公司, 深圳, 学历不限, 150, 上市公, 移动互联网 · O2O
技术经理, 28, 5, 技术, 高端技术职位, 爱上旅游, 上海, 本科, 50, 成长型, 移动互联网 · 旅游
技术经理/总监, 20, 5, 技术, 高端技术职位, 优达, 重庆, 大专, 15, 初创型, 招聘
商务经理, 5, 3, 市场与销售, 市场/营销, 赛驰科技, 郑州, 学历不限, 50, 成长型, 数据服务 · 文化娱乐
渠道经理, 6, 1, 市场与销售, 销售, 易正, 上海, 大专, 50, 成长型, 移动互联网 · 企业服务
发行主管, 6, 1, 市场与销售, 公关, 唐颂教育, 杭州, 大专, 15, 初创型, 移动互联网 · 教育
客户主管, 6, 1, 市场与销售, 公关, 隆文互动, 北京, 大专, 50, 初创型, 广告营销 · 文化娱乐
法务经理, 15, 3, 职能, 法务, 金斧子, 深圳, 本科, 150, 成长型, 电子商务 · 金融
运营经理/主管, 4, 1, 运营, 运营, 杭州机智猫网络技术有限公司, 杭州, 本科, 15, 初创型, 移动互联网
客服主管, 6, 3, 运营, 客服, 杭州缇苏, 杭州, 大专, 500, 成长型, 电子商务
理财经理, 6, 1, 市场与销售, 销售, 爱财在线, 广州, 大专, 50, 初创型, 金融
文案经理, 12, 1, 市场与销售, 公关, 一起作业网, 北京, 本科, 150, 成熟型, 移动互联网 · 教育
网页产品主管, 12, 1, 产品, 产品经理, 之间网（远景投资集团旗下）, 北京, 本科, 150, 成长型, 移动互联网 · 数据服务
策划经理, 15, 3, 市场与销售, 市场/营销, 优分期, 北京, 大专, 500, 成长型, 电子商务 · 金融
技术经理, 27, 5, 技术, 高端技术职位, 香港宏安集团, 深圳, 本科, 2000, 上市公, 电子商务 · O2O
数字营销策划经理, 10, 3, 市场与销售, 销售, 数赢云网络科技, 上海, 本科, 150, 成长型, 电子商务 · 广告营销
WMS开发主管（深圳）, 16, 3, 技术, 后端开发, ickey, 深圳, 大专, 150, 成长型, 电子商务
淘宝推广主管, 4, 1, 运营, 运营, 猪哼少, 杭州, 大专, 50, 成长型, 电子商务 · 其他
商务合作主管, 9, 3, 市场与销售, 市场/营销, 叽叽科技, 上海, 本科, 15, 初创型, 移动互联网 · 医疗健康
电商运营主管, 9, 3, 运营, 运营, 魔悦网络, 杭州, 大专, 15, 初创型, 移动互联网 · 电子商务
市场策划经理, 10, 3, 市场与销售, 市场/营销, 中联华水, 北京, 大专, 50, 成长型, 电子商务
仓库主管, 6, 不, 市场与销售, 供应链, 玩具超人, 北京, 大专, 15, 成长型, 移动互联网 · 生活服务
营销活动策划经理, 12, 1, 市场与销售, 市场/营销, 沪江, 上海, 本科, 500, 成熟型, 移动互联网 · 教育
绩效考核经理, 7, 3, 职能, 人力资源, 海康威视, 杭州, 本科, 2000, 上市公, 硬件 · 文化娱乐
设计经理/主管, 15, 3, 设计, 高端设计职位, 名传, 上海, 大专, 50, 成长型, 电子商务 · 数据服务
营销策划高级经理, 16, 3, 市场与销售, 市场/营销, 一猫汽车网, 北京, 本科, 150, 成长型, 电子商务 · O2O
技术主管, 11, 3, 技术, 后端开发, 纽贝滋, 上海, 大专, 500, 初创型, 电子商务
SQE经理, 20, 5, 市场与销售, 采购, DJI大疆创新, 深圳, 本科, 2000, 初创型, 移动互联网 · 硬件
销售经理, 11, 3, 市场与销售, 销售, ickey, 上海, 本科, 150, 成长型, 电子商务
主管会计, 6, 1, 职能, 财务, 凯信控股, 武汉, 本科, 50, 成长型, 移动互联网 · 金融
媒介经理, 9, 1, 市场与销售, 公关, 冉十, 北京, 大专, 50, 上市公, 文化娱乐
技术经理, 22, 3, 技术, 高端技术职位, 众赢数字, 北京, 本科, 15, 初创型, O2O
渠道经理, 7, 1, 市场与销售, 市场/营销, 赛驰科技, 郑州, 大专, 50, 成长型, 数据服务 · 文化娱乐
手游推广经理, 15, 1, 市场与销售, 市场/营销, 2144游戏网, 上海, 大专, 150, 初创型, 移动互联网 · 游戏
产品运营主管, 9, 1, 运营, 运营, 安徒生基金&middot;信麟财富, 上海, 大专, 150, 成长型, 金融
