品牌公关经理, 25, 3, 市场与销售, 公关, 平安行, 上海, 本科, 500, 成熟型, 移动互联网 · 电子商务
城市经理, 20, 5, 市场与销售, 市场/营销, 悠先点菜, 杭州, 大专, 150, 成长型, 移动互联网
城市经理, 9, 1, 市场与销售, 市场/营销, 优呗, 南京, 大专, 15, 初创型, 移动互联网
城市经理, 11, 5, 市场与销售, 销售, 会小二网, 南京, 大专, 50, 成长型, 移动互联网 · O2O
招聘主管, 3, 1, 职能, 高端职能职位, 湖北励盛金融服务有限公司, 武汉, 大专, 15, 初创型, 金融
商务拓展经理, 15, 1, 市场与销售, 销售, 多准大数据, 杭州, 学历不限, 15, 初创型, 数据服务 · 广告营销
成本会计主管, 5, 1, 职能, 财务, 上海青客, 上海, 大专, 500, 成长型, 移动互联网 · O2O
区域销售经理-南京, 7, 3, 市场与销售, 销售, 百航信息, 杭州, 学历不限, 50, 成长型, 移动互联网 · 金融
HRBP主管, 6, 3, 职能, 人力资源, 汇车科技, 南京, 大专, 50, 成长型, 移动互联网 · O2O
绩效考核主管, 7, 3, 职能, 人力资源, 满艺网, 北京, 大专, 50, 成长型, 电子商务 · 文化娱乐
Java 经理, 22, 5, 技术, 后端开发, 乐天创研, 北京, 大专, 2000, 上市公, 电子商务 · 旅游
销售经理, 6, 1, 市场与销售, 销售, 跟谁学, 南昌, 本科, 500, 成长型, 移动互联网 · 教育
销售经理, 12, 3, 市场与销售, 销售, 利伊享, 杭州, 学历不限, 50, 成长型, 移动互联网
市场经理, 10, 1, 市场与销售, 市场/营销, 融360, 北京, 本科, 500, 成熟型, 移动互联网 · 金融
新媒体主管, 8, 不, 市场与销售, 公关, 蚂蚁短租, 北京, 学历不限, 50, 成长型, 移动互联网 · 旅游
销售经理, 9, 不, 市场与销售, 销售, 青苗口腔, 成都, 大专, 50, 成长型, 医疗健康
Java经理, 40, 5, 技术, 后端开发, 拾财贷, 北京, 本科, 150, 成长型, 移动互联网 · 金融
培训专员/主管, 10, 1, 职能, 人力资源, 静遥网络科技, 上海, 大专, 150, 成长型, 移动互联网 · 电子商务
销售经理, 11, 1, 市场与销售, 销售, 泛微, 上海, 大专, 500, 成熟型, 移动互联网 · 企业服务
战略部经理/高级经理, 37, 3, 金融, 高端金融职位, 凤凰金融, 北京, 本科, 150, 成长型, 金融
测试主管, 10, 3, 技术, 测试, 翼集分, 上海, 本科, 150, 上市公, 移动互联网 · 电子商务
移动推广经理（ASO方向）, 11, 1, 市场与销售, 市场/营销, 拉勾网, 北京, 本科, 150, 成长型, 企业服务 · 招聘
教育培训主管, 7, 1, 产品, 产品经理, 一塔湖图众筹, 北京, 本科, 15, 初创型, 移动互联网 · 金融
财务总监/经理, 5, 5, 职能, 高端职能职位, 众夯金融, 上海, 大专, 15, 初创型, 移动互联网 · 金融
PHP开发经理, 22, 3, 技术, 后端开发, DigitalX, 上海, 本科, 15, 成熟型, 移动互联网 · 广告营销
java技术经理, 16, 3, 技术, 高端技术职位, 广而告之, 北京, 本科, 50, 初创型, 移动互联网 · 文化娱乐
品牌推广主管, 12, 1, 市场与销售, 市场/营销, 上海信合添富金融信息服务有限公司, 上海, 大专, 50, 成长型, 金融
人力资源主管, 8, 3, 职能, 人力资源, 三一重工股份有限公司, 北京, 本科, 2000, 上市公, 移动互联网 · 电子商务
网络推广经理, 12, 3, 运营, 运营, 汇桔网, 广州, 大专, 500, 成长型, 企业服务 · O2O
招聘主管, 6, 1, 职能, 人力资源, 云积分, 深圳, 本科, 50, 初创型, 企业服务 · 移动互联网
BD经理, 9, 1, 市场与销售, 销售, 上上签, 杭州, 大专, 50, 成长型, 移动互联网 · 企业服务
线上营销推广经理/总监, 22, 3, 市场与销售, 市场/营销, 亿家网, 北京, 本科, 50, 成长型, 移动互联网 · 电子商务
用户运营主管, 9, 1, 运营, 运营, 智课网, 北京, 本科, 50, 成长型, 移动互联网 · 教育
销售经理, 6, 1, 市场与销售, 销售, 找塑料网, 广州, 学历不限, 150, 成长型, 电子商务
渠道经理, 4, 3, 运营, 运营, 哇沃网络科技有限责任公司, 成都, 本科, 50, 初创型, 电子商务 · O2O
销售经理, 8, 3, 市场与销售, 销售, 哪拍网, 北京, 本科, 50, 初创型, 电子商务 · O2O
APP地面推广主管, 15, 1, 运营, 运营, 萨摩耶金服, 上海, 大专, 50, 初创型, 金融
运营主管, 4, 1, 运营, 运营, 武汉快玩, 武汉, 大专, 15, 初创型, 移动互联网 · 游戏
公关经理, 10, 3, 市场与销售, 公关, e家洁, 北京, 本科, 500, 成熟型, O2O · 分类信息
采购主管（宠物周边产品）, 7, 不, 市场与销售, 采购, 凡跃集团, 广州, 本科, 500, 成熟型, 移动互联网 · 游戏
消防主管, 3, 3, 运营, 运营, 太原华宇百花谷, 太原, 大专, 500, 初创型, 生活服务 · 文化娱乐
商务经理, 8, 1, 市场与销售, 市场/营销, 微车, 北京, 本科, 50, 成长型, 移动互联网 · O2O
招聘经理, 9, 3, 职能, 人力资源, 雄鹰移动-考试吧、万题库, 北京, 本科, 150, 成长型, 移动互联网 · 教育
人事经理/主管（绩效考核经理/主管）, 11, 3, 职能, 人力资源, 短融网, 北京, 本科, 150, 成长型, 金融
新媒体主管, 7, 1, 运营, 运营, 汇融通盛, 天津, 大专, 15, 初创型, 移动互联网 · 金融
运维高级经理/总监, 50, 5, 技术, 运维, 宜人贷, 北京, 本科, 500, 成熟型, 移动互联网 · 金融
客服主管, 6, 1, 运营, 客服, Little Freddie, 深圳, 大专, 15, 成长型, 电子商务 · 广告营销
客服主管, 10, 3, 运营, 客服, 米学网, 北京, 大专, 150, 成长型, 移动互联网 · 教育
采购经理, 8, 3, 市场与销售, 采购, 自造创品, 深圳, 学历不限, 15, 初创型, 电子商务
城市经理, 15, 3, 市场与销售, 销售, 货拉拉手机软件公司, 广州, 学历不限, 150, 成长型, 移动互联网 · O2O
城市经理, 15, 3, 市场与销售, 销售, 货拉拉手机软件公司, 深圳, 学历不限, 150, 成长型, 移动互联网 · O2O
iOS Lead/主管/经理, 30, 5, 技术, 移动开发, 百度, 北京, 大专, 2000, 上市公, 移动互联网 · 数据服务
商务主管, 8, 1, 市场与销售, 市场/营销, 贝德高银, 杭州, 本科, 50, 初创型, 金融 · 文化娱乐
SEO经理, 10, 3, 市场与销售, 市场/营销, 37游戏, 广州, 大专, 500, 上市公, 游戏
用户服务主管, 9, 5, 运营, 运营, 360商城, 北京, 大专, 2000, 上市公, 移动互联网 · 电子商务
BD经理, 6, 1, 市场与销售, 销售, 时光流影, 合肥, 大专, 500, 上市公, 社交网络
硬件开发主管, 64, 3, 技术, 硬件开发, 归墟电子, 上海, 本科, 15, 初创型, 移动互联网 · 其他
销售经理, 6, 不, 市场与销售, 销售, 车艺师, 广州, 学历不限, 15, 初创型, O2O
销售经理, 8, 1, 市场与销售, 销售, 胡杨风, 北京, 大专, 50, 初创型, 移动互联网 · 广告营销
销售经理, 7, 1, 市场与销售, 销售, 周百通科技, 广州, 大专, 15, 成长型, 移动互联网 · O2O
销售经理, 12, 不, 市场与销售, 销售, 广州冠鹏信息技术有限公司, 广州, 学历不限, 50, 成长型, 移动互联网
事件营销主管, 12, 5, 市场与销售, 市场/营销, 唯品会, 广州, 学历不限, 2000, 上市公, 电子商务
安保主管, 3, 3, 运营, 运营, 太原华宇百花谷, 太原, 大专, 500, 初创型, 生活服务 · 文化娱乐
销售经理, 22, 1, 市场与销售, 销售, 酷划在线, 北京, 本科, 50, 成长型, 移动互联网
销售经理, 15, 1, 市场与销售, 销售, 年年卡, 深圳, 大专, 500, 成熟型, 移动互联网 · 金融
系统运维主管, 22, 5, 技术, 运维, 立天唐人商业集团, 深圳, 本科, 500, 成熟型, 移动互联网 · O2O
客服主管, 9, 1年以, 运营, 客服, 乔迁之喜, 北京, 大专, 50, 初创型, O2O · 生活服务
保理风控经理, 15, 1, 金融, 风控, 触通科技, 广州, 本科, 50, 成长型, 移动互联网 · 金融
Java开发主管, 17, 3, 技术, 后端开发, POP时尚网络机构, 上海, 本科, 500, 成长型, 移动互联网 · 电子商务
大客户销售经理, 8, 3, 市场与销售, 销售, 快狗速运 (GoGoVan), 北京, 学历不限, 150, 成长型, 移动互联网 · O2O
招商副主管, 12, 不, 市场与销售, 销售, 双静网络, 杭州, 学历不限, 50, 初创型, 移动互联网 · 电子商务
客户营销主管, 8, 1, 市场与销售, 市场/营销, 中联网仓科技有限公司杭州分公司, 杭州, 本科, 500, 成长型, 电子商务 · 企业服务
BD主管, 7, 1, 市场与销售, 销售, 广州百田, 广州, 大专, 500, 上市公, 移动互联网 · 游戏
市场经理, 12, 1, 市场与销售, 市场/营销, 普林科技, 北京, 本科, 50, 成长型, 数据服务
自媒体文案策划主管, 9, 1, 市场与销售, 公关, 北京布雷恩科技有限公司, 北京, 本科, 15, 初创型, 企业服务
商务经理, 6, 1, 市场与销售, 高端市场职位, 羊驼先森, 厦门, 学历不限, 15, 初创型, 广告营销
用户运营主管, 9, 1, 运营, 运营, 乐居生活, 北京, 大专, 150, 成长型, O2O · 生活服务
BD经理, 6, 1, 市场与销售, 销售, Mobisummer, 广州, 本科, 15, 初创型, 移动互联网 · 广告营销
资深市场推广经理, 20, 3, 市场与销售, 市场/营销, 领投鸟理财, 上海, 本科, 150, 成长型, 移动互联网 · 金融
媒介专员/主管, 8, 1, 市场与销售, 公关, 南方银谷, 上海, 大专, 150, 成熟型, 移动互联网 · 数据服务
品牌策划经理/总监, 7, 3, 市场与销售, 市场/营销, 惟惟网, 武汉, 大专, 150, 成长型, 移动互联网 · 电子商务
风控主管, 16, 3, 金融, 风控, 叮当钱包, 北京, 本科, 2000, 成长型, 移动互联网 · 金融
客服经理(主管), 30, 3, 运营, 客服, 阿里巴巴, 杭州, 本科, 2000, 上市公, 移动互联网
网络推广经理/总监, 13, 1, 运营, 运营, 诚医APP, 北京, 本科, 15, 初创型, 移动互联网 · 医疗健康
产品主管, 11, 3, 产品, 产品经理, 北京捷众, 北京, 大专, 150, 成长型, 金融
招商经理, 7, 1, 市场与销售, 销售, 央视网, 北京, 大专, 2000, 成熟型, 移动互联网 · 电子商务
市场经理/总监, 20, 3, 市场与销售, 高端市场职位, 微吼, 北京, 本科, 50, 成长型, 移动互联网 · 数据服务
市场主管, 9, 3, 市场与销售, 市场/营销, 云顶科技, 张家港, 大专, 50, 成长型, 电子商务
web前端工程师主管, 15, 3, 技术, 前端开发, 两鲜, 上海, 学历不限, 150, 成长型, 电子商务
媒介主营主管, 9, 1, 运营, 运营, 易直供, 南京, 大专, 150, 成长型, 移动互联网 · 电子商务
SEM主管, 7, 1, 市场与销售, 市场/营销, 畅移云工作, 上海, 本科, 50, 成长型, 企业服务
直销车高级策划总监/经理, 15, 3, 市场与销售, 高端市场职位, 车团网, 上海, 大专, 150, 成熟型, 移动互联网 · 电子商务
Android技术主管/资深android开发, 21, 3, 技术, 移动开发, 网鱼网咖.鱼泡泡, 上海, 本科, 15, 成长型, 生活服务
市场经理, 7, 不, 市场与销售, 市场/营销, 康知, 北京, 大专, 15, 成长型, 移动互联网
运营主管, 22, 3, 运营, 运营, 51信用卡管家, 杭州, 本科, 150, 成长型, 金融 · 数据服务
策划主管, 5, 不, 市场与销售, 市场/营销, 东方智立科技（武汉）有限公司, 武汉, 学历不限, 50, 成长型, 移动互联网 · 电子商务
运营主管, 10, 3, 运营, 运营, 优曼家纺, 北京, 大专, 150, 成长型, 电子商务
电商运营主管, 8, 1, 运营, 运营, 海底捞集团蜀海公司, 北京, 大专, 2000, 成熟型, 电子商务 · O2O
招聘主管, 10, 3, 职能, 人力资源, 深圳雅活荟网络科技有限公司, 深圳, 大专, 150, 上市公, 移动互联网 · O2O
渠道经理, 12, 3, 市场与销售, 市场/营销, 小螺趣租, 深圳, 大专, 50, 成长型, 移动互联网
项目主管, 12, 3, 运营, 运营, 盛康互动传媒, 上海, 本科, 500, 成熟型, 移动互联网  · 电子商务
社会化营销经理/专员, 12, 5, 市场与销售, 市场/营销, 果壳网, 北京, 本科, 150, 成熟型, 移动互联网 · 社交网络
BD经理/区域主管/销售主管, 11, 1, 市场与销售, 销售, 达达, 广州, 大专, 500, 成熟型, O2O
KA销售经理, 5, 不, 市场与销售, 销售, 汇通天下, 上海, 大专, 50, 成熟型, 旅游
引入商务经理, 12, 3, 市场与销售, 市场/营销, 上海晨之科, 上海, 大专, 50, 成长型, 移动互联网 · 游戏
财经资讯主管编辑, 12, 3, 运营, 编辑, 上海第一财经新媒体, 上海, 本科, 150, 成熟型, 移动互联网
BD经理, 6, 1, 市场与销售, 销售, 美分期网络科技, 上海, 学历不限, 15, 初创型, 移动互联网 · 金融
PHP开发主管, 20, 3, 技术, 后端开发, POP时尚网络机构, 上海, 学历不限, 500, 成长型, 移动互联网 · 电子商务
储备客服主管, 5, 不, 运营, 客服, 胜券在握, 北京, 大专, 50, 成长型, 金融
内部控制主管, 19, 3, 职能, 财务, Gridsum 国双, 北京, 本科, 500, 成熟型, 数据服务
APP移动端推广商务渠道主管/经理, 15, 1, 市场与销售, 销售, 打工圈, 上海, 大专, 15, 成长型, 移动互联网 · O2O
市场主管, 6, 1, 市场与销售, 市场/营销, 上海金程教育培训有限公司, 上海, 大专, 150, 成长型, 教育
市场主管, 7, 1, 市场与销售, 市场/营销, 柳橙网, 上海, 本科, 150, 成熟型, 移动互联网
BD经理, 7, 不, 市场与销售, 市场/营销, 斗米兼职, 杭州, 大专, 50, 成长型, 移动互联网 · O2O
网站编辑主管, 7, 3, 运营, 编辑, 上海装潢网, 上海, 学历不限, 15, 初创型, O2O · 生活服务
前台研发主管, 17, 3, 技术, 后端开发, 凯美瑞德, 北京, 本科, 150, 成长型, 金融
用户运营主管, 8, 1, 运营, 运营, 满易网络, 济南, 本科, 15, 初创型, 移动互联网
高级APP营销经理, 20, 5, 市场与销售, 市场/营销, 中青旅遨游网, 北京, 本科, 500, 上市公, 旅游
网络数据分析主管, 7, 1, 运营, 运营, 心蕊网络, 上海, 大专, 150, 初创型, 移动互联网 · 电子商务
强电主管, 3, 3, 运营, 运营, 太原华宇百花谷, 太原, 大专, 500, 初创型, 生活服务 · 文化娱乐
空调主管, 3, 3, 运营, 运营, 太原华宇百花谷, 太原, 大专, 500, 初创型, 生活服务 · 文化娱乐
销售经理, 4, 1, 市场与销售, 销售, 七加二, 天津, 本科, 50, 成长型, 电子商务 · 企业服务
新媒体主管, 7, 1, 运营, 运营, Shanghai WOW!, 上海, 大专, 50, 初创型, 移动互联网 · 文化娱乐
销售经理, 9, 1, 市场与销售, 销售, 唯美会, 深圳, 大专, 15, 成长型, 移动互联网 · O2O
FM主管, 7, 5, 职能, 行政, 文思海辉, 深圳, 本科, 2000, 成熟型, 移动互联网 · 企业服务
企业文化经理, 10, 5, 职能, 人力资源, 金蝶医疗 移动互联网医院领航者, 广州, 本科, 150, 成长型, 移动互联网 · 医疗健康
品牌经理, 12, 3, 市场与销售, 公关, Juice Up, 北京, 大专, 15, 初创型, 生活服务
媒介经理, 12, 1, 市场与销售, 公关, 时趣social-touch, 北京, 本科, 500, 成熟型, 移动互联网
投资经理, 10, 不, 金融, 投融资, 天天投, 北京, 本科, 15, 成长型, 移动互联网 · 金融
市场主管（高校渠道）, 6, 1, 市场与销售, 市场/营销, 上海金程教育培训有限公司, 上海, 大专, 150, 成长型, 教育
Java开发经理, 15, 5, 技术, 后端开发, 银信网银, 深圳, 大专, 150, 成熟型, 金融
SEO推广经理, 20, 1, 市场与销售, 市场/营销, 恺英网络, 上海, 本科, 500, 上市公, 移动互联网 · 游戏
流程管理主管, 8, 3, 市场与销售, 销售, 乐无限, 上海, 大专, 50, 成长型, 移动互联网
合规风控主管, 11, 3, 职能, 法务, 一路财富, 北京, 本科, 50, 成长型, 金融 · 招聘
销售经理, 6, 不, 市场与销售, 销售, 广州联瑞数码, 广州, 本科, 50, 成长型, 硬件 · 移动互联网
软件测试主管, 5, 3, 技术, 测试, 广西龙汇科技集团有限公司, 南宁, 大专, 50, 成熟型, 移动互联网 · 电子商务
设计经理/主管, 20, 5, 设计, 高端设计职位, 明源软件, 武汉, 大专, 500, 上市公, 移动互联网 · 企业服务
品牌活动经理, 15, 不, 市场与销售, 公关, 以太资本, 北京, 本科, 150, 成长型, 金融
风控主管/专员, 11, 1, 金融, 风控, 52校园, 北京, 本科, 50, 成长型, 电子商务 · 金融
市场推广经理, 24, 3, 市场与销售, 市场/营销, 派时尚科技, 北京, 大专, 50, 成长型, 移动互联网
市场营销主管, 17, 3, 市场与销售, 市场/营销, 必要商城, 上海, 大专, 50, 成长型, 电子商务
产品运营主管, 16, 3, 运营, 运营, 东方财富, 上海, 本科, 500, 上市公, 金融
产品部经理, 15, 不, 产品, 高端产品职位, 东方网升, 杭州, 学历不限, 150, 初创型, 企业服务 · 招聘
推广经理, 20, 3, 运营, 运营, 普惠金融, 北京, 本科, 2000, 成长型, 金融
投资经理, 22, 5, 金融, 投融资, 汇银集团, 上海, 硕士, 500, 成熟型, 金融 · 其他
政务销售经理, 8, 3, 运营, 高端运营职位, 海都公众, 西宁, 本科, 500, 成熟型, 移动互联网 · O2O
HTML5主管, 25, 3, 技术, 移动开发, 蓝色行星, 上海, 学历不限, 15, 成长型, 旅游 · 移动互联网
Java高级开发主管, 27, 5, 技术, 后端开发, 轻易贷, 北京, 本科, 2000, 上市公, 金融
互联网销售经理, 6, 1, 市场与销售, 销售, 智驾科技ICARFORCE, 杭州, 大专, 15, 成长型, 移动互联网 · 电子商务
网络营销主管, 8, 1, 市场与销售, 市场/营销, 博天国际, 深圳, 大专, 50, 初创型, 教育 · 广告营销
BD经理, 7, 3, 市场与销售, 销售, 盒子鱼英语, 南昌, 大专, 50, 成长型, 移动互联网 · 教育
市场主管, 9, 1, 市场与销售, 市场/营销, 阿姨帮, 北京, 本科, 150, 成长型, 移动互联网 · O2O
政府公关经理, 18, 5, 市场与销售, 公关, 快的打车, 深圳, 本科, 2000, 成熟型, 移动互联网
市场经理/总监（管理岗）, 7, 1, 市场与销售, 高端市场职位, 启蓝控股, 杭州, 大专, 500, 成长型, 移动互联网 · 金融
人力资源主管, 12, 3, 职能, 人力资源, 指旺科技, 上海, 本科, 2000, 成熟型, 金融
App地推主管, 7, 不, 运营, 运营, 挖豆app, 厦门, 学历不限, 15, 成长型, 移动互联网
法务主管, 12, 5, 职能, 法务, 中投融, 上海, 本科, 500, 成熟型, 金融
商务经理, 6, 1年以, 市场与销售, 销售, 跨鲜, 广州, 大专, 50, 初创型, 电子商务 · O2O
销售经理, 9, 3, 市场与销售, 销售, 汇医在线, 北京, 大专, 50, 成长型, 移动互联网
销售经理, 7, 1, 市场与销售, 销售, 荷仙菇生物科技, 上海, 学历不限, 15, 初创型, 医疗健康
BD经理_北京, 15, 3, 市场与销售, 销售, 点乐, 北京, 本科, 150, 成长型, 移动互联网 · 广告营销
网络营销主管, 6, 1, 市场与销售, 市场/营销, 长沙乐恩教育咨询有限公司, 长沙, 大专, 15, 成长型, 电子商务
人事行政经理, 9, 5, 职能, 人力资源, 在街上, 深圳, 本科, 50, 成长型, O2O · 硬件
招聘经理, 12, 3, 职能, 人力资源, 雄鹰移动-考试吧、万题库, 北京, 本科, 150, 成长型, 移动互联网 · 教育
行政主管/经理, 7, 1, 职能, 高端职能职位, Mobvista, 广州, 本科, 150, 成长型, 移动互联网 · 游戏
公关经理, 15, 3, 市场与销售, 公关, 36氪, 北京, 本科, 150, 成熟型, 移动互联网 · 电子商务
技术部经理/PHP技术主管, 15, 1, 技术, 后端开发, 3456玩, 广州, 大专, 50, 初创型, 移动互联网 · 游戏
测试主管, 12, 1, 技术, 测试, 中海天霖, 北京, 大专, 500, 初创型, 移动互联网 · 电子商务
物流主管, 7, 1, 市场与销售, 供应链, 领结管家, 北京, 大专, 50, 成长型, 移动互联网 · 数据服务
BD经理, 4, 1, 市场与销售, 销售, 威尔克姆, 郑州, 大专, 50, 初创型, 移动互联网 · 电子商务
市场主管, 6, 3, 市场与销售, 市场/营销, 上海金程教育培训有限公司, 上海, 大专, 150, 成长型, 教育
公关策划主管, 15, 3, 市场与销售, 市场/营销, 凤凰金融, 北京, 本科, 150, 成长型, 金融
电商经理, 8, 3, 运营, 运营, 烘焙地球村, 广州, 大专, 15, 初创型, 电子商务 · 生活服务
运营主管, 10, 3, 运营, 运营, 途虎养车网, 上海, 本科, 500, 成熟型, 移动互联网
事件营销主管, 15, 不, 市场与销售, 市场/营销, 抓钱猫, 杭州, 学历不限, 15, 成长型, 移动互联网 · 金融
品牌商务经理, 10, 3, 市场与销售, 市场/营销, 诸葛理财, 北京, 本科, 50, 成长型, 金融
销售经理, 7, 不, 市场与销售, 销售, 美团外卖, 成都, 大专, 2000, 成熟型, 移动互联网 · O2O
销售经理, 7, 3, 市场与销售, 销售, feijiu网, 石家庄, 大专, 150, 成熟型, 电子商务
高级媒介经理/媒介总监（ APP推广 ）, 24, 5, 市场与销售, 公关, 久诺金融, 北京, 本科, 50, 成长型, 广告营销
销售经理, 15, 3, 市场与销售, 销售, 银河宇科技, 北京, 本科, 15, 初创型, 移动互联网 · 电子商务
科研主管, 9, 1, 技术, 项目管理, 青梧桐健康基因, 北京, 硕士, 15, 初创型, 移动互联网 · 医疗健康
电商运营主管, 6, 1, 运营, 运营, 中配电商, 广州, 本科, 50, 成长型, 电子商务 · O2O
客服主管, 6, 1, 运营, 客服, 溦风科技, 大连, 大专, 15, 初创型, 电子商务 · 旅游
法务经理, 30, 3, 职能, 法务, 平安行, 北京, 本科, 500, 成熟型, 移动互联网 · 电子商务
品牌公关主管, 7, 1, 市场与销售, 公关, 苏打科技, 北京, 大专, 15, 成长型, 移动互联网 · O2O
销售支持经理, 22, 3, 市场与销售, 销售, 金色家园科技, 北京, 大专, 500, 成熟型, O2O
市场主管, 5, 1, 市场与销售, 市场/营销, 上海金程教育培训有限公司, 上海, 大专, 150, 成长型, 教育
产品流程模块主管, 17, 3, 技术, 后端开发, 凯美瑞德, 北京, 本科, 150, 成长型, 金融
运营主管, 9, 1, 运营, 高端运营职位, 麦港网, 深圳, 本科, 15, 初创型, 移动互联网 · 电子商务
运营主管, 7, 3, 运营, 运营, bts, 南京, 大专, 150, 成长型, 电子商务
BD经理, 7, 1, 市场与销售, 销售, 众投天地, 南京, 本科, 15, 成长型, 移动互联网 · 金融
PHP技术主管, 22, 3, 技术, 高端技术职位, 状元理财, 北京, 大专, 15, 成长型, 移动互联网 · 金融
合规风控主管, 11, 3, 职能, 法务, 一路财富, 北京, 本科, 50, 成长型, 金融 · 招聘
BD经理, 10, 1, 市场与销售, 销售, 众有科技, 上海, 学历不限, 50, 初创型, 移动互联网 · O2O
BD经理, 20, 3, 市场与销售, 销售, 投了吗, 杭州, 大专, 15, 初创型, 移动互联网
运营主管, 8, 3, 运营, 运营, 嘉信福德, 北京, 大专, 15, 初创型, 生活服务
美工主管, 3, 1, 设计, 高端设计职位, 商营达, 广州, 大专, 15, 初创型, 电子商务
市场主管, 15, 3, 市场与销售, 市场/营销, 明源软件广州分公司, 广州, 本科, 2000, 上市公, 移动互联网 · 其他
审计主管, 9, 1, 职能, 财务, 中智, 杭州, 大专, 150, 成长型, 招聘
产品运营主管, 15, 3, 运营, 运营, 智课网, 北京, 本科, 50, 成长型, 移动互联网 · 教育
商务经理, 7, 不, 市场与销售, 市场/营销, 乐约科技, 北京, 学历不限, 150, 成长型, 移动互联网 · 医疗健康
市场营销主管, 9, 1, 市场与销售, 市场/营销, 4399游戏, 广州, 本科, 2000, 初创型, 游戏
销售经理, 8, 3, 市场与销售, 销售, 放心365, 北京, 大专, 15, 初创型, O2O
运维主管, 10, 5, 技术, 运维, 申迪计算机, 广州, 本科, 150, 成长型, 企业服务 · 信息安全
网络技术主管, 7, 3, 技术, 运维, 群蜂网络科技股份有限公司, 成都, 学历不限, 50, 成长型, 移动互联网 · O2O
运营主管, 15, 1, 运营, 高端运营职位, 摩天体育, 深圳, 大专, 15, 初创型, 移动互联网
品牌主管, 7, 3, 市场与销售, 公关, 讯鸟软件, 北京, 本科, 150, 成长型, 数据服务
招聘经理, 20, 3, 职能, 人力资源, 本木医疗, 北京, 学历不限, 50, 成长型, 移动互联网 · O2O
测试主管, 6, 1, 技术, 测试, 圈圈, 天津, 本科, 15, 初创型, 移动互联网 · 社交网络
客服主管, 6, 3, 运营, 客服, 洋葱淘, 北京, 学历不限, 15, 成长型, 移动互联网 · 电子商务
活动策划主管, 8, 1, 市场与销售, 市场/营销, Darry Ring, 深圳, 大专, 150, 初创型, 电子商务
技术主管, 30, 5, 技术, 高端技术职位, 龙胜计算机, 深圳, 本科, 15, 初创型, 金融
商务/BD（总监/经理/主管）, 15, 3, 市场与销售, 销售, 丫米厨房, 上海, 本科, 50, 成长型, 移动互联网
公共事务经理, 11, 1, 市场与销售, 市场/营销, 果壳网, 北京, 本科, 150, 成熟型, 移动互联网 · 社交网络
投资总监/经理, 30, 3, 市场与销售, 投资, 中青宝, 深圳, 本科, 500, 上市公, 移动互联网 · 游戏
品牌公关经理, 20, 3, 市场与销售, 公关, 么啊宝宝, 北京, 本科, 50, 成长型, 教育 · 硬件
区域销售经理-济南, 7, 3, 市场与销售, 销售, 百航信息, 济南, 学历不限, 50, 成长型, 移动互联网 · 金融
市场主管（校园渠道）, 6, 1, 市场与销售, 市场/营销, 上海金程教育培训有限公司, 上海, 大专, 150, 成长型, 教育
