运营主管, 16, 3, 运营, 运营, 音卓钢琴, 杭州, 大专, 150, 初创型, 教育
市场主管, 7, 3, 市场与销售, 市场/营销, 插画行业, 上海, 大专, 15, 成长型, 移动互联网 · 文化娱乐
交互设计经理/主管, 20, 5, 设计, 高端设计职位, 汽车之家, 北京, 本科, 2000, 上市公, 移动互联网 · 文化娱乐
用户运营主管, 12, 3, 运营, 运营, 新华保险, 北京, 本科, 50, 成长型, 金融
运营主管, 7, 3, 产品, 产品经理, 比如世界, 北京, 本科, 150, 成长型, 教育 · 文化娱乐
运营主管（新媒体）, 5, 1, 市场与销售, 公关, 凯信控股, 武汉, 本科, 50, 成长型, 移动互联网 · 金融
业务审计主管, 17, 3, 职能, 财务, 猎豹移动, 北京, 本科, 500, 上市公, 移动互联网 · 信息安全
MRO采购主管, 15, 3, 市场与销售, 采购, DJI大疆创新, 深圳, 本科, 2000, 初创型, 移动互联网 · 硬件
招聘主管, 7, 1, 职能, 人力资源, 星河互联集团, 北京, 本科, 500, 成熟型, 移动互联网
销售经理, 9, 1, 市场与销售, 销售, 58赶集集团（斗米兼职）, 深圳, 学历不限, 150, 成长型, O2O
市场推广经理, 12, 3, 市场与销售, 市场/营销, 铁血网, 北京, 大专, 150, 上市公, 电子商务 · 游戏
推广主管, 10, 1, 市场与销售, 市场/营销, 深圳嘟嘟智能科技有限公司, 深圳, 大专, 15, 初创型, 移动互联网
android高级工程师/经理, 27, 3, 技术, 移动开发, 天天用车, 北京, 本科, 150, 成熟型, 移动互联网
用户设计高级经理, 17, 3, 设计, 高端设计职位, 诺亚易捷, 上海, 本科, 150, 成长型, 移动互联网 · 金融
网络推广主管, 6, 3, 运营, 运营, 广州红餐文化传播有限公司, 广州, 大专, 15, 初创型, 移动互联网 · O2O
高级研发经理（Senior Mobile App Development Manager）, 22, 5, 技术, 高端技术职位, 伙伴, 上海, 本科, 15, 初创型, 电子商务
企业技术工程-系统运维主管, 22, 5, 技术, 运维, 搜狗, 北京, 本科, 2000, 成熟型, 移动互联网 · 数据服务
设计经理/主管, 9, 3, 设计, 高端设计职位, 浙江粮油, 杭州, 本科, 150, 成长型, 移动互联网 · 其他
渠道主管, 10, 3, 市场与销售, 销售, 心目教育, 北京, 大专, 15, 初创型, 移动互联网 · 教育
SEO经理, 20, 5, 运营, 运营, 唯品会, 广州, 本科, 2000, 上市公, 电子商务
绩效考核主管, 11, 3, 职能, 人力资源, 宇信科技, 北京, 本科, 2000, 初创型, 金融
招聘主管, 7, 1, 职能, 人力资源, 住两天, 杭州, 本科, 50, 成长型, O2O · 旅游
运营主管, 15, 3, 运营, 运营, 必要商城, 上海, 大专, 50, 成长型, 电子商务
研究总监, 32, 5, 金融, 投融资, 外滩云财富, 上海, 本科, 50, 初创型, 移动互联网 · 金融
市场经理/总监, 50, 5, 市场与销售, 高端市场职位, 中智汇, 杭州, 本科, 50, 成长型, 教育 · 电子商务
测试经理/主管, 17, 3, 技术, 测试, 1号车网, 北京, 本科, 2000, 上市公, 电子商务 · O2O
市场主管 008, 7, 1, 市场与销售, 市场/营销, 上海金程教育培训有限公司, 上海, 大专, 150, 成长型, 教育
市场拓展主管, 6, 1, 市场与销售, 市场/营销, 拉维斯, 福州, 大专, 50, 成长型, 移动互联网 · 文化娱乐
售前技术支持主管, 10, 3, 技术, 企业软件, 北京捷通华声语音技术有限公司, 上海, 本科, 150, 初创型, 移动互联网 · 数据服务
UI设计部主管（5-10年）, 30, 5, 设计, 视觉设计, 指旺科技, 上海, 本科, 2000, 成熟型, 金融
美术设计师（2D/3D）主管, 14, 1, 设计, 视觉设计, 云视科技, 上海, 大专, 150, 成长型, 数据服务
产品/品牌推广主管, 6, 1, 运营, 运营, 广州市西美信息科技有限公司, 广州, 大专, 50, 成长型, 数据服务
SEO主管, 6, 1, 运营, 运营, 产品100, 成都, 本科, 15, 成长型, 企业服务 · 教育
咨询总监 清科研究中心, 25, 5, , 投资顾问, 清科集团, 北京, 本科, 500, 成熟型, 金融
人力主管, 4, 1, , hrd/hrm, 六帝网络科技, 太原, 大专, 15, 初创型, 移动互联网 · 电子商务
客服团队主管, 6, 3, 运营, 客服, 网达软件, 重庆, 本科, 500, 成熟型, 移动互联网 · 电子商务
设计经理/主管, 22, 3, 设计, 高端设计职位, 59store, 杭州, 本科, 500, 成长型, 电子商务
SEM主管, 15, 3, 市场与销售, 市场/营销, 盛阳咨询, 上海, 本科, 500, 上市公, 移动互联网 · 金融
BD经理, 7, 3, 市场与销售, 销售, 会小二网, 杭州, 大专, 50, 成长型, 移动互联网 · O2O
市场 主管, 10, 1, 市场与销售, 市场/营销, 捷通华声, 北京, 本科, 150, 成熟型, 移动互联网 · 数据服务
BD经理, 11, 1, 市场与销售, 销售, 东家, 杭州, 学历不限, 50, 成长型, 移动互联网
BD经理, 20, 1, 市场与销售, 市场/营销, 车来了, 北京, 本科, 150, 成长型, 移动互联网 · 数据服务
在线客服主管, 10, 1, 运营, 客服, 美联英语, 北京, 大专, 2000, 成熟型, 教育
BD经理, 15, 1, 市场与销售, 销售, 真融宝, 北京, 本科, 50, 成长型, 金融
市场经理, 25, 5, 市场与销售, 高端市场职位, 迅雷, 深圳, 本科, 500, 上市公, 移动互联网
招聘经理, 11, 5, 职能, 人力资源, 世界邮轮网, 北京, 学历不限, 50, 成长型, 旅游
销售经理, 19, 3, 市场与销售, 销售, 一格信息, 深圳, 大专, 15, 初创型, 移动互联网 · O2O
商务经理, 11, 3, 市场与销售, 销售, Yeahmobi, 深圳, 本科, 150, 成长型, 移动互联网
医学经理/高级医学经理, 22, 3, 市场与销售, 市场/营销, 易路, 上海, 本科, 50, 初创型, 移动互联网 · 金融
公关主管/新媒体公关, 12, 1, 市场与销售, 公关, 两鲜, 上海, 大专, 150, 成长型, 电子商务
web前端开发主管, 25, 3, 技术, 前端开发, 蓝色行星, 上海, 学历不限, 15, 成长型, 旅游 · 移动互联网
课程运营主管, 8, 3, 运营, 运营, 洪泰AA加速器, 北京, 本科, 15, 初创型, 企业服务 · 金融
Ebay店铺销售主管/经理（外贸）, 11, 3, 运营, 运营, 踏浪者国际, 北京, 本科, 500, 成长型, 电子商务
网页设计/美工 主管, 10, 3, 设计, 视觉设计, 云服科技, 南京, 大专, 15, 初创型, 移动互联网
前端主管, 16, 3, 技术, 前端开发, 三一重工股份有限公司, 北京, 大专, 2000, 上市公, 移动互联网 · 电子商务
物流调度主管, 6, 1, 市场与销售, 供应链, 云鸟科技, 北京, 学历不限, 150, 成长型, 移动互联网 · O2O
商务主管, 8, 3, 市场与销售, 销售, 纳兰德, 北京, 大专, 15, 初创型, 移动互联网 · 硬件
运营主管, 25, 5, 运营, 运营, 碧园网, 北京, 本科, 15, 成长型, 电子商务 · O2O
BD经理, 16, 3, 市场与销售, 销售, 云鸟科技, 北京, 大专, 150, 成长型, 移动互联网 · O2O
市场主管, 8, 1, 市场与销售, 市场/营销, 爱康国宾, 北京, 本科, 2000, 上市公, 医疗健康
渠道经理, 11, 不, 市场与销售, 市场/营销, 微智全景, 北京, 学历不限, 150, 成长型, 移动互联网  · O2O
员工关系主管, 7, 1, 职能, 人力资源, 更美APP, 北京, 本科, 50, 成长型, 移动互联网 · O2O
内容编辑主管, 12, 不, 运营, 运营, Weego, 北京, 本科, 15, 成长型, 旅游
新媒体运营主管, 9, 3, 运营, 运营, 微助力, 北京, 大专, 15, 初创型, 移动互联网 · 社交网络
微信微博运营主管, 7, 3, 运营, 运营, 隆腾时代, 北京, 本科, 50, 成长型, 移动互联网 · 电子商务
售前技术支持主管, 10, 3, 技术, 企业软件, 捷通华声, 北京, 本科, 150, 成熟型, 移动互联网 · 数据服务
技术研发支持主管（Wince、Android）, 12, 5, 技术, 高端技术职位, 芝柯打印技术, 上海, 本科, 50, 成长型, 硬件
PHP项目主管, 12, 3, 技术, 后端开发, 拍鞋网, 厦门, 大专, 150, 成长型, 电子商务
SEO流量主管/专员, 4, 1, 市场与销售, 市场/营销, 有爱, 南京, 大专, 50, 初创型, 医疗健康
互联网广告销售经理/总监（医药企业方向）, 9, 1, 市场与销售, 销售, 药店理货宝（广州小明科技）, 广州, 大专, 15, 初创型, 电子商务 · 医疗健康
商户运营主管, 7, 1, 运营, 运营, 优装美家, 北京, 本科, 2000, 上市公, 电子商务
招聘专员（主管）, 5, 1, 职能, 人力资源, 草根投资, 杭州, 学历不限, 150, 成长型, 金融
运营主管, 9, 1, 运营, 运营, 美差招聘, 上海, 本科, 50, 成长型, 移动互联网 · 招聘
运营主管（偏数据运营）, 9, 1, 运营, 运营, 数字100, 北京, 本科, 2000, 成长型, 移动互联网
媒介主管-JCMJ, 12, 1, , 媒介经理, 意念文化, 深圳, 大专, 15, 初创型, 移动互联网 · 文化娱乐
BD经理, 7, 3, 市场与销售, 市场/营销, 前海P2P, 深圳, 本科, 50, 成长型, 金融
市场主管, 12, 1, 市场与销售, 市场/营销, 捷通华声, 北京, 本科, 150, 成熟型, 移动互联网 · 数据服务
BD经理, 10, 不, 运营, 运营, 众投天地, 北京, 本科, 15, 成长型, 移动互联网 · 金融
高级销售经理, 18, 1, 市场与销售, 销售, 美洽, 深圳, 大专, 15, 成长型, 企业服务
财务经理/高级经理, 20, 5, 职能, 财务, 点点租, 深圳, 本科, 150, 成长型, O2O
采购主管/经理（酒水饮料乳品）, 12, 3, 市场与销售, 采购, 闪电购, 上海, 大专, 500, 成长型, 移动互联网 · O2O
PHP主管, 11, 3, 技术, 后端开发, 江苏微盛网络科技有限公司, 无锡, 大专, 150, 初创型, 移动互联网 · 电子商务
研发总监/技术总监/技术经理/PHP/, 22, 不, 技术, 高端技术职位, 兑兑碰-中鼎博华, 北京, 本科, 50, 成熟型, 电子商务
生鲜商品运营主管（商城模块）, 7, 3, 运营, 运营, 美菜网, 北京, 大专, 2000, 成熟型, 电子商务 · O2O
高级研究员/研究总监, 22, 5, 市场与销售, 公关, 小牛在线, 深圳, 本科, 2000, 成长型, 金融
SEO主管, 12, 不, 市场与销售, 市场/营销, 伊视可眼镜, 上海, 学历不限, 50, 初创型, O2O · 生活服务
品牌推广主管, 8, 3, 市场与销售, 市场/营销, 双图科技, 深圳, 大专, 15, 成长型, 移动互联网 · 教育
人力资源主管, 5, 1, 职能, 人力资源, 网交所, 郑州, 大专, 15, 成长型, 金融
市场主管, 10, 1, 市场与销售, 市场/营销, 数字天空, 北京, 本科, 15, 初创型, 游戏
招聘主管, 3, 1, 职能, 人力资源, 吃喝玩乐, 天津, 本科, 150, 初创型, 电子商务 · O2O
APP推广主管, 11, 1, 市场与销售, 市场/营销, 上海其冬网络科技, 苏州, 学历不限, 15, 初创型, 移动互联网 · 医疗健康
市场主管, 6, 1, 市场与销售, 市场/营销, 阿姨帮广州分公司, 广州, 大专, 150, 成长型, 移动互联网 · O2O
用户运营主管（偏注册）, 11, 3, 运营, 运营, MDC, 北京, 大专, 150, 成长型, 移动互联网
BD主管, 12, 1, 市场与销售, 销售, 普惠融通, 北京, 本科, 2000, 成熟型, 金融
风控总监（偏技术、研究方向）, 25, 5, 金融, 风控, 随行付支付有限公司, 北京, 本科, 500, 上市公, 金融
运营主管, 19, 1, 运营, 运营, 搜芽, 广州, 本科, 50, 初创型, 移动互联网 · O2O
市场经理, 6, 1, 市场与销售, 市场/营销, 布林顿科技, 成都, 学历不限, 15, 初创型, 移动互联网 · 广告营销
招聘经理, 13, 3, 职能, 人力资源, 万题库, 北京, 本科, 15, 成长型, 移动互联网 · 教育
商务经理, 6, 3, 市场与销售, 销售, 穷游网, 北京, 本科, 150, 成熟型, 移动互联网
京东运营主管, 10, 1, 运营, 运营, 飞雕电器, 上海, 大专, 2000, 成熟型, 电子商务 · 其他
销售支持主管, 5, 1, 市场与销售, 销售, 当代置业, 北京, 大专, 2000, 上市公, 其他
APP渠道推广主管/专员1, 15, 1, 运营, 运营, 路路由, 上海, 学历不限, 150, 成长型, 移动互联网 · O2O
ERP系统主管, 8, 1, 技术, 后端开发, 盘古餐饮, 上海, 大专, 2000, 成熟型, 生活服务
公关媒介主管/专员, 6, 1, 市场与销售, 公关, 奥多科技, 上海, 大专, 50, 成长型, 游戏
数据中心运营主管, 8, 不, 运营, 运营, 什么值得买, 北京, 学历不限, 150, 成长型, 电子商务 · 文化娱乐
集团法务主管, 25, 5, 职能, 法务, 达达, 上海, 本科, 500, 成熟型, O2O
市场主管, 12, 3, 市场与销售, 市场/营销, 捷通华声, 北京, 本科, 150, 成熟型, 移动互联网 · 数据服务
BD经理, 10, 1, 市场与销售, 销售, 海豚驾考, 北京, 本科, 15, 成长型, 电子商务 · O2O
商家运营主管, 10, 1, 运营, 运营, 卡保科技, 北京, 大专, 150, 成长型, 移动互联网 · O2O
市场经理, 12, 3, 市场与销售, 市场/营销, 金贝艺融, 北京, 本科, 15, 初创型, 金融
人力资源主管, 17, 3, 职能, 人力资源, 99分期, 北京, 本科, 150, 成长型, 电子商务
电商运营主管, 7, 1, 运营, 运营, 大麦电商, 广州, 大专, 150, 初创型, 电子商务 · 企业服务
手游运营主管/经理（海外市场）, 8, 1, 运营, 运营, 动游, 成都, 本科, 15, 初创型, 游戏
网盟推广主管, 7, 3, 运营, 运营, 万丈网络, 广州, 大专, 50, 初创型, 移动互联网 · 电子商务
自媒体运营主管, 5, 1, 市场与销售, 市场/营销, 光盒力量, 北京, 学历不限, 15, 初创型, 游戏 · 文化娱乐
Java开发主管, 20, 5, 技术, 后端开发, 健康护航, 北京, 本科, 15, 初创型, 移动互联网 · O2O
运营推广主管, 11, 3, 市场与销售, 市场/营销, 奥克斯--电子商务科技有限公司, 宁波, 本科, 2000, 上市公, 电子商务 · 硬件
运营主管, 15, 1, 运营, 高端运营职位, 深圳市云鹏正曜科技发展有限公司, 深圳, 本科, 50, 成长型, 移动互联网 · 电子商务
运营主管, 6, 1, 运营, 运营, 天上来客, 长沙, 大专, 15, 成熟型, 电子商务 · O2O
BD经理, 5, 不, 市场与销售, 市场/营销, 云数海量, 成都, 学历不限, 50, 成长型, 移动互联网 · 电子商务
电商运营主管, 9, 5, 运营, 运营, 高扬, 深圳, 大专, 15, 初创型, 电子商务 · 其他
PHP主管, 15, 3, 技术, 前端开发, 尚标知识产权企业, 上海, 大专, 50, 初创型, 企业服务
销售核算主管, 9, 1, 市场与销售, 销售, 趣医网, 上海, 本科, 500, 成长型, 移动互联网 · 医疗健康
网络推广主管, 7, 不限, , 市场推广, 金元瑞驰汽车有限公司, 北京, 学历不限, 50, 初创型, O2O · 生活服务
SEM主管, 8, 1, 市场与销售, 市场/营销, 海风教育, 上海, 学历不限, 50, 成长型, 教育
销售经理, 7, 3, 市场与销售, 销售, 金笛软件, 北京, 大专, 15, 初创型, 移动互联网
BD经理, 12, 5, 市场与销售, 销售, 汽车之家, 北京, 本科, 2000, 上市公, 移动互联网 · 文化娱乐
合作招商主管, 12, 5, 市场与销售, 销售, 京东, 上海, 大专, 2000, 上市公, 移动互联网 · 电子商务
活动运营主管, 11, 不, 运营, 运营, 中国网库, 北京, 大专, 500, 上市公, 电子商务 · 企业服务
BD经理/总监, 12, 3, 市场与销售, 高端市场职位, 悦然心动, 武汉, 本科, 15, 成长型, 移动互联网 · 社交网络
广告投放优化经理, 20, 1, 市场与销售, 市场/营销, 今日头条, 北京, 本科, 500, 成熟型, 移动互联网 · 数据服务
商务BD主管（App推广）, 22, 3, 市场与销售, 市场/营销, Rush, 北京, 本科, 15, 成长型, 移动互联网 · 企业服务
新媒体运维主管, 6, 不, 运营, 运营, 木头人mootow, 长沙, 学历不限, 15, 初创型, 移动互联网 · 电子商务
新媒体运营主管, 17, 5, 运营, 编辑, 上海眯客, 上海, 本科, 150, 成长型, 移动互联网 · O2O
BD合作主管, 7, 3, 市场与销售, 市场/营销, 缺钱么, 广州, 大专, 50, 成长型, 移动互联网 · 金融
运营主管-北京-02034, 11, 3, 运营, 运营, 龙图游戏, 北京, 本科, 500, 成熟型, 游戏
设计经理/总监, 10, 3, 设计, 高端设计职位, 宝软科技, 厦门, 大专, 50, 初创型, 移动互联网 · 游戏
网络推广主管, 11, 1, 运营, 运营, 海风教育, 上海, 学历不限, 50, 成长型, 教育
公关主管, 12, 1, 市场与销售, 公关, 寻医问药网, 北京, 本科, 500, 成长型, 移动互联网
SEM经理, 20, 5, 市场与销售, 市场/营销, Gridsum 国双, 北京, 本科, 500, 成熟型, 数据服务
市场品牌经理, 20, 5, 市场与销售, 市场/营销, 惠租车, 上海, 本科, 50, 成长型, 旅游
公关经理, 14, 3, 市场与销售, 公关, 糖果金融, 北京, 大专, 150, 初创型, 金融
媒介主管（北京）, 15, 1, 市场与销售, 公关, UCloud, 北京, 本科, 500, 成熟型, 数据服务
商家运营专员/主管, 8, 1, 运营, 运营, 京东到家, 广州, 大专, 500, 成熟型, O2O
售前技术支持主管, 12, 1, 技术, 企业软件, 捷通华声, 北京, 本科, 150, 成熟型, 移动互联网 · 数据服务
新媒体运营主管, 5, 1, 运营, 运营, 欣欣旅游, 厦门, 大专, 150, 成长型, 旅游
人事经理/主管, 9, 3, 职能, 人力资源, 纳泓财富, 宁波, 大专, 150, 成长型, 金融
运营主管, 6, 1, 运营, 运营, 广州华帝, 广州, 大专, 500, 初创型, 电子商务 · 企业服务
招聘主管, 9, 1, 职能, 人力资源, 咖啡零点吧, 北京, 大专, 15, 成长型, 移动互联网 · O2O
金融工程部主管（证券分析师/研究员）, 20, 3, 金融, 投融资, 云财经, 深圳, 本科, 15, 成长型, 金融 · 数据服务
市场主管, 8, 不, 市场与销售, 市场/营销, 石头人, 北京, 大专, 15, 初创型, 移动互联网 · 文化娱乐
运营主管, 7, 3, 运营, 运营, 翼社区, 成都, 大专, 50, 成长型, 电子商务 · O2O
BD经理, 7, 1, 市场与销售, 销售, 天谷, 北京, 大专, 50, 成长型, 移动互联网 · 信息安全
商务拓展经理, 15, 1, 市场与销售, 市场/营销, 麦子金服, 上海, 本科, 150, 成长型, 移动互联网 · 金融
BD经理, 5, 1, 市场与销售, 销售, 云印技术, 深圳, 本科, 50, 成长型, O2O
仓储主管, 7, 3, 市场与销售, 供应链, 帕拓逊, 深圳, 大专, 150, 成长型, 电子商务
活动策划执行主管/经理, 11, 1, 市场与销售, 市场/营销, 我要运动, 上海, 大专, 50, 成长型, 移动互联网 · O2O
微博微信运营主管, 6, 3, 运营, 运营, 隆腾时代, 北京, 本科, 50, 成长型, 移动互联网 · 电子商务
PHP开发主管, 20, 3, 技术, 后端开发, 健一网, 上海, 本科, 500, 成长型, 电子商务
培训经理/培训主管, 11, 3, 职能, 人力资源, 遥望网络, 杭州, 大专, 150, 上市公, 移动互联网 · 游戏
渠道主管, 9, 3, 市场与销售, 市场/营销, 醉品春秋, 厦门, 大专, 150, 成长型, 电子商务
BD主管, 9, 1, 市场与销售, 销售, 友云互动, 北京, 本科, 150, 成长型, 移动互联网
财务总监/经理, 30, 5, 职能, 高端职能职位, e飞蚁, 北京, 本科, 150, 初创型, 电子商务 · O2O
音乐教研主管, 7, 不, 运营, 运营, 学音悦网, 北京, 大专, 15, 成长型, 移动互联网 · 电子商务
电商运营主管, 11, 1, 运营, 运营, 呀呀语音, 深圳, 大专, 50, 成长型, 社交网络 · 文化娱乐
市场经理, 9, 1, 市场与销售, 高端市场职位, 玩赚世界, 北京, 大专, 15, 初创型, 移动互联网 · 生活服务
媒介主管, 11, 3, 市场与销售, 市场/营销, 时尚集团, 北京, 本科, 500, 成熟型, 文化娱乐
移动平台运营部主管, 11, 1, 运营, 运营, 畅唐网络, 杭州, 学历不限, 500, 成熟型, 游戏
APP渠道推广主管/专员2, 22, 1, 运营, 运营, 路路由, 上海, 大专, 150, 成长型, 移动互联网 · O2O
seo推广主管, 15, 3, 运营, 运营, 之间网（远景投资集团旗下）, 北京, 本科, 150, 成长型, 移动互联网 · 数据服务
架构主管工程师（研究院）, 10, 1, 技术, 后端开发, 康迪电动汽车集团, 杭州, 本科, 500, 成熟型, 其他
内部审计主管, 17, 1, 职能, 财务, Gridsum 国双, 北京, 本科, 500, 成熟型, 数据服务
运营客服主管, 5, 1, 运营, 客服, 凯信控股, 武汉, 大专, 50, 成长型, 移动互联网 · 金融
公关PR主管, 12, 5, 市场与销售, 高端市场职位, 兼职猫, 广州, 大专, 150, 成长型, 移动互联网  · O2O
市场研究经理, 16, 3, 市场与销售, 市场/营销, Juice Up, 北京, 大专, 15, 初创型, 生活服务
网络运营主管, 12, 3, 运营, 运营, 木鸟短租, 北京, 大专, 15, 成长型, 电子商务 · 生活服务
招聘主管, 9, 1, 职能, 人力资源, 鋆石互联网金融, 上海, 学历不限, 15, 成长型, 移动互联网 · 金融
运维主管, 7, 3, 技术, 运维, 韦博教育集团, 上海, 本科, 2000, 成熟型, 教育
设计经理/主管, 15, 5, 设计, 高端设计职位, 药房网商城, 上海, 本科, 15, 初创型, 电子商务 · 医疗健康
运维主管, 7, 1, 技术, 运维, 泰涵策划, 北京, 本科, 15, 初创型, 金融
ASP.NET经理/asp.net程序主管/.net项目经理, 8, 1, 技术, 后端开发, 卓杰科技, 广州, 大专, 15, 初创型, 移动互联网
活动企划主管, 12, 3, 市场与销售, 市场/营销, 宣爱智能, 北京, 本科, 150, 上市公, 移动互联网 · 教育
客服主管, 5, 3, 运营, 客服, 奥睿, 成都, 大专, 15, 初创型, 电子商务
自动化测试主管, 12, 3, 技术, 测试, UTOUU, 成都, 本科, 150, 成长型, 移动互联网 · 广告营销
薪酬主管, 12, 3, 职能, 人力资源, The ONE, 北京, 本科, 50, 成长型, 硬件 · 教育
项目经理/主管, 22, 3, 技术, 项目管理, 淘淘族, 北京, 本科, 150, 成长型, 电子商务
汽车金融渠道主管, 7, 1, 金融, 投融资, 看车科技, 南宁, 大专, 150, 成熟型, 企业服务
PHP研发主管, 17, 1, 技术, 后端开发, 粮人网, 北京, 学历不限, 50, 初创型, 移动互联网 · 电子商务
运营经理/主管-流量变现, 12, 1, 运营, 运营, 帮5买, 上海, 本科, 500, 成熟型, 移动互联网 · 电子商务
SEO主管, 6, 3, 运营, 运营, 宝蓝财富-八条鱼, 天津, 大专, 15, 成长型, 移动互联网 · 电子商务
高级市场经理, 25, 3, 市场与销售, 高端市场职位, 107间, 北京, 本科, 15, 初创型, 移动互联网 · O2O
设计经理/主管, 11, 1, 设计, 视觉设计, 正邦创意, 北京, 本科, 500, 成熟型, 移动互联网 · 广告营销
销售经理, 15, 3, 市场与销售, 销售, 新浪二手房频道, 北京, 大专, 150, 上市公, 移动互联网 · O2O
测试开发主管, 20, 5, 技术, 测试, 中信银行信用卡中心, 深圳, 本科, 2000, 上市公, 移动互联网 · 金融
系统运维主管, 22, 5, 技术, 运维, DJI大疆创新, 深圳, 本科, 2000, 初创型, 移动互联网 · 硬件
采购主管, 10, 1, 市场与销售, 采购, 嘉信康和, 北京, 大专, 50, 成长型, 移动互联网 · 电子商务
产品运营主管, 12, 1, 运营, 运营, 饿了么, 上海, 本科, 2000, 成熟型, 移动互联网 · 招聘
销售技术支持主管（偏软件）, 12, 5, 技术, 高端技术职位, 芝柯打印技术, 上海, 本科, 50, 成长型, 硬件
售前技术支持主管, 8, 不, 运营, 客服, 捷通华声, 北京, 本科, 150, 成熟型, 移动互联网 · 数据服务
大数据主管布道师, 32, 5, 技术, 后端开发, 极客学院, 北京, 本科, 50, 成长型, 移动互联网
销售招聘 销售主管/经理/总监（南京）, 7, 3, 市场与销售, 销售, 酷配网, 南京, 大专, 50, 初创型, 电子商务
招聘主管, 6, 1, 职能, 人力资源, 首汇焦点, 北京, 本科, 50, 成长型, 文化娱乐
外呼主管, 9, 1, 职能, 行政, 挖财, 杭州, 大专, 500, 成长型, 移动互联网 · 金融
Java开发主管, 19, 5, 技术, 后端开发, 货通天下, 上海, 本科, 50, 成长型, 电子商务 · 其他
新媒体运营主管, 9, 1, 运营, 运营, 海琛国际, 上海, 本科, 150, 成长型, 电子商务 · 生活服务
电商运营专员（或主管）, 6, 1, 运营, 运营, 厦门市云客网络科技有限公司, 厦门, 大专, 50, 初创型, 移动互联网 · 电子商务
业务运营经理/主管, 7, 1, 职能, 人力资源, 安个家, 上海, 大专, 50, 初创型, 移动互联网
招聘经理 Recruiting Manager, 6, 1, 职能, 人力资源, 增信通, 深圳, 本科, 15, 成长型, 金融 · 数据服务
BD经理, 9, 3, 市场与销售, 市场/营销, 乔迁之喜, 北京, 本科, 50, 初创型, O2O · 生活服务
运维主管, 22, 5, 技术, 运维, 米学网, 北京, 本科, 150, 成长型, 移动互联网 · 教育
活动策划主管, 9, 1, 运营, 运营, 海航会信息科技, 北京, 本科, 50, 初创型, 移动互联网 · 电子商务
数据分析主管, 9, 1, 运营, 运营, 海航会信息科技, 北京, 本科, 50, 初创型, 移动互联网 · 电子商务
PHP资深主管, 17, 3, 技术, 后端开发, 梦享网络, 广州, 学历不限, 15, 成长型, 移动互联网 · 广告营销
渠道运营主管/经理（SEO/SEM), 15, 3, 运营, 运营, 海豚村, 深圳, 大专, 150, 成长型, 电子商务
SEO主管, 7, 1, 市场与销售, 市场/营销, 美好学院, 成都, 本科, 15, 成长型, 企业服务 · 教育
用户运营经理/主管, 14, 3, 运营, 运营, 轻松家电, 深圳, 大专, 500, 成长型, O2O
新媒体内容主管, 5, 1, 运营, 运营, 数字楼兰, 西安, 本科, 50, 初创型, 移动互联网 · 电子商务
政务销售经理, 8, 3, 运营, 高端运营职位, 海都公众, 西安, 本科, 500, 成熟型, 移动互联网 · O2O
iOS主管, 12, 3, 技术, 移动开发, camelot, 广州, 学历不限, 2000, 上市公, 企业服务 · 其他
