职位, 工资, 经验要求, 职位一级分类, 职位二级分类, 公司名称, 城市, 学历, 公司规模, 公司阶段, 公司业务领域
网络安全, 22, 3, 技术, 运维, 人人行, 北京, 学历不限, 500, 成熟型, 移动互联网 · 金融
网络安全, 6, 1, 技术, 运维, 谋乐科技, 上海, 大专, 50, 成长型, 信息安全 · 电子商务
网络安全, 6, 1, 技术, 运维, 维他购, 长沙, 学历不限, 15, 初创型, 移动互联网 · 电子商务
网络安全, 7, 1, 技术, 运维, 傲磐国科, 南京, 学历不限, 50, 成长型, 移动互联网 · 信息安全
网络安全工程师, 22, 3, 技术, 高端技术职位, 大横琴科技, 珠海, 本科, 50, 成长型, 企业服务 · 数据服务
网络安全, 20, 5, 技术, 运维, 光汇石油, 深圳, 本科, 500, 上市公, 其他
网络安全, 11, 不, 技术, 运维, CSC, 上海, 本科, 500, 上市公, 电子商务
网络安全, 3, 1年以, 技术, 运维, 盛世财富, 武汉, 大专, 500, 成熟型, O2O · 金融
网络安全, 11, 5, 技术, 运维, 冠群驰骋, 北京, 本科, 2000, 成熟型, 移动互联网 · 金融
网络安全, 5, 1年以, 技术, 运维, 通动力成立于2001年，现已发展成为领先的、全方位IT服务及行业解决方案提供商, 廊坊, 大专, 2000, 上市公, 企业服务
网络安全, 1, 不, 技术, 运维, 广州玛氏信息技术服务有限公司, 广州, 本科, 150, 成长型, 信息安全
网络安全, 10, 1, 技术, 运维, 拉钩去旅行, 北京, 大专, 15, 初创型, 移动互联网 · 旅游
网络安全, 9, 不, 技术, 运维, 上海共创, 上海, 大专, 150, 上市公, 移动互联网
网络安全, 30, 3, 技术, 运维, 海航-前海航交所, 深圳, 大专, 50, 成长型, 移动互联网 · 金融
网络安全, 9, 3, 技术, 运维, 中联合力, 青岛, 大专, 50, 初创型, 移动互联网 · 企业服务
网络安全, 8, 1, 技术, 运维, 欧浦钢网, 佛山, 大专, 500, 上市公, 电子商务
网络安全工程师, 15, 不, 技术, 运维, 轻松筹, 北京, 学历不限, 50, 成长型, 移动互联网 · 金融
网络安全, 14, 1, 技术, 运维, 大北农集团, 北京, 本科, 2000, 上市公, 金融 · 移动互联网
网络安全, 10, 3, 技术, 运维, 金证股份, 上海, 大专, 2000, 上市公, 金融
网络安全, 5, 1, 技术, 运维, 昆山华信, 武汉, 大专, 500, 初创型, 企业服务
网络安全, 4, 1, 技术, 运维, 入围中国网, 西安, 大专, 150, 成长型, 移动互联网 · 电子商务
网络安全, 11, 1, 技术, 运维, 中林木业, 青岛, 学历不限, 150, 成长型, 电子商务 · 其他
网络安全, 6, 3, 技术, 运维, 成都德呈科技有限公司, 成都, 本科, 15, 初创型, 移动互联网 · 企业服务
网络安全, 20, 3, 技术, 运维, 首汽约车, 北京, 本科, 50, 成长型, 移动互联网 · O2O
网络安全, 5, 1, 技术, 运维, 华正航空, 深圳, 大专, 150, 初创型, 电子商务
网络安全, 10, 1, 技术, 运维, 帝纯, 上海, 大专, 150, 成长型, 移动互联网 · 金融
网络安全, 8, 1, 技术, 运维, 看榜科技, 成都, 本科, 50, 成长型, 数据服务
网络安全, 6, 1, 技术, 运维, 苏州金银富, 苏州, 本科, 50, 初创型, 移动互联网 · 金融
网络安全, 16, 3, 技术, 运维, Nesun, 深圳, 大专, 150, 成长型, 电子商务 · 信息安全
网络安全, 13, 3, 技术, 运维, Nesun, 深圳, 大专, 150, 成长型, 电子商务 · 信息安全
网络安全, 11, 3, 技术, 运维, 普华和诚, 北京, 大专, 150, 初创型, 医疗健康
网络安全, 6, 3, 技术, 运维, 河北天翼, 石家庄, 学历不限, 50, 成长型, 移动互联网 · 数据服务
网络安全, 13, 3, 技术, 运维, 中彩在线, 北京, 本科, 150, 成长型, 电子商务 · 金融
网络安全, 6, 不, 技术, 运维, 国百公司, 合肥, 大专, 15, 初创型, 电子商务
网络安全, 7, 3, 技术, 运维, 前海蝴蝶效应, 深圳, 本科, 500, 初创型, 金融
网络安全, 6, 不, 技术, 运维, 杭州蒙特, 杭州, 学历不限, 50, 初创型, 移动互联网 · 企业服务
网络安全, 6, 不, 技术, 运维, 国百公司, 淮南, 大专, 15, 初创型, 电子商务
网络安全, 4, 1, 技术, 运维, 伊飒尔, 北京, 大专, 50, 成长型, 移动互联网
网络安全, 17, 5, 技术, 运维, 威联科技, 上海, 本科, 15, 初创型, 信息安全
网络安全工程师, 17, 3, 技术, 运维, 轻易贷, 北京, 本科, 2000, 上市公, 金融
网络安全, 12, 1, 技术, 运维, CSC, 上海, 本科, 500, 上市公, 电子商务
网络安全, 7, 1, 技术, 运维, 南方信息, 广州, 大专, 50, 成长型, 移动互联网
网络安全, 6, 1, 技术, 运维, 安创, 广州, 学历不限, 15, 初创型, 信息安全 · 硬件
网络安全, 7, 1, 技术, 运维, 品质365, 北京, 大专, 50, 初创型, 电子商务
网络安全工程师, 6, 不, 技术, 高端技术职位, 安天, 哈尔滨, 本科, 150, 成长型, 信息安全
网络安全实习生, 3, 不, 技术, 运维, 银客网, 北京, 本科, 150, 成长型, 移动互联网 · 金融
网络安全工程师, 10, 1, 技术, 运维, 理想迈斯林, 成都, 大专, 50, 初创型, 教育
网络安全, 9, 不, 技术, 运维, 北京天融信公司, 北京, 本科, 2000, 上市公, 信息安全
网络安全, 30, 5, 技术, 运维, PPTV聚力, 上海, 本科, 500, 成熟型, 文化娱乐
网络安全, 22, 不, 技术, 运维, 找钢网, 上海, 学历不限, 500, 成熟型, 移动互联网 · 电子商务
网络安全, 12, 1, 技术, 运维, 优医在线, 北京, 大专, 15, 初创型, 移动互联网 · 医疗健康
网络安全, 32, 1, 技术, 运维, 南电科技, 北京, 大专, 2000, 成熟型, 电子商务 · 数据服务
网络安全, 22, 3, 技术, 运维, 众筹网, 北京, 大专, 150, 成长型, 金融
网络安全专员, 5, 不, 运营, 运营, 搜狐焦点, 北京, 本科, 2000, 成熟型, 生活服务
网络安全, 12, 1, 技术, 运维, 中汇, 北京, 大专, 500, 成熟型, 移动互联网 · 金融
网络安全工程师, 18, 1, 技术, 运维, 平安好房, 上海, 本科, 500, 上市公, 电子商务
网络安全, 15, 5, 技术, 运维, 正泰科技, 北京, 本科, 15, 初创型, 移动互联网
网络安全, 6, 1, 技术, 运维, 长安通信, 北京, 本科, 150, 初创型, 信息安全 · 数据服务
网络安全工程师, 9, 不, 技术, 运维, 永信至诚, 北京, 学历不限, 150, 成长型, 移动互联网
网络安全, 24, 5, 技术, 运维, 汇中财富, 北京, 本科, 2000, 成熟型, 金融
网络安全工程师, 6, 不, 技术, 运维, 无为广域, 武汉, 大专, 50, 成长型, 硬件 · 数据服务
网络安全工程师, 16, 3, 技术, 运维, 北龙中网, 北京, 大专, 500, 成熟型, 移动互联网 · 企业服务
网络安全, 20, 3, 技术, 运维, 冠群驰骋, 北京, 本科, 2000, 成熟型, 移动互联网 · 金融
网络安全工程师, 20, 3, 技术, 运维, 欧冶云商, 上海, 本科, 150, 初创型, 电子商务 · 数据服务
网络安全工程师, 9, 3, 技术, 运维, 恒学科技, 厦门, 大专, 15, 初创型, 电子商务 · 金融
网络安全, 6, 1, 技术, 运维, 畅卓, 北京, 大专, 50, 初创型, 移动互联网 · 企业服务
网络安全, 15, 5, 技术, 运维, 北京蜂向科技, 北京, 本科, 50, 成长型, 移动互联网 · 金融
网络安全, 15, 5, 技术, 运维, 安邦保险集团, 北京, 本科, 2000, 成熟型, 移动互联网 · 金融
网络安全工程师, 17, 1, 技术, 运维, 上海眯客, 上海, 本科, 150, 成长型, 移动互联网 · O2O
网络安全（网管）, 4, 1, 技术, 运维, 聚超科技, 广州, 学历不限, 15, 初创型, 企业服务
网络安全, 6, 1, 技术, 运维, 百度外卖, 上海, 本科, 500, 初创型, 移动互联网 · O2O
网络安全, 6, 1, 技术, 运维, 思高特, 北京, 本科, 50, 初创型, 移动互联网 · 教育
网络安全工程师, 13, 3, 技术, 运维, 孩子王, 南京, 本科, 2000, 成长型, 生活服务
网络安全工程师, 11, 1, 技术, 运维, 柚美, 上海, 大专, 15, 初创型, 金融
网络安全, 8, 1, 技术, 运维, 北京若森数字科技有限公司, 北京, 学历不限, 150, 成长型, 移动互联网 · 游戏
网络安全, 27, 3, 技术, 运维, 金葵花网络, 北京, 本科, 50, 成长型, 金融
网络安全, 20, 3, 技术, 运维, 携程网, 北京, 本科, 2000, 上市公, 移动互联网 · 旅游
网络安全工程师, 22, 3, 技术, 运维, 车车, 北京, 本科, 150, 成长型, 电子商务 · O2O
网络安全工程师（NSE）, 9, 3, 技术, 运维, 天尧信息, 北京, 本科, 150, 上市公, 电子商务
网络安全, 30, 5, 技术, 运维, 华为技术有限公司, 深圳, 本科, 2000, 成熟型, 移动互联网 · 企业服务
网络安全工程师, 8, 3, 技术, 运维, 央广新媒体, 北京, 本科, 150, 成长型, 移动互联网 · 文化娱乐
网络安全工程师, 12, 3, 技术, 运维, 东方合信, 北京, 本科, 50, 初创型, 金融 · 信息安全
网络安全工程师(001513), 14, 3, 技术, 运维, 神州租车, 北京, 本科, 2000, 上市公, 移动互联网 · 电子商务
网络安全, 6, 1, 技术, 运维, 畅卓, 北京, 学历不限, 50, 初创型, 移动互联网 · 企业服务
网络安全工程师, 13, 3, 技术, 高端技术职位, 阿拉丁云计算, 杭州, 本科, 500, 上市公, 信息安全 · 数据服务
网络安全工程师, 10, 3, 技术, 前端开发, 阿拉丁云计算, 杭州, 本科, 500, 上市公, 信息安全 · 数据服务
网络安全工程师, 9, 1, 技术, 运维, 大北农集团, 北京, 本科, 2000, 上市公, 金融 · 移动互联网
网络安全工程师, 12, 1, 技术, 运维, 狮桥资本, 北京, 本科, 500, 成长型, 金融
网络安全工程师, 13, 3, 技术, 运维, 君融贷, 北京, 本科, 50, 成长型, 金融
网络安全工程师, 12, 3, 技术, 运维, 北京中视广信, 北京, 大专, 150, 初创型, 数据服务 · 分类信息
网络安全工程师, 12, 3, 技术, 运维, 交通银行信用卡中心, 上海, 本科, 2000, 上市公, 金融
网络安全工程师, 12, 3, 技术, 运维, 影谱科技, 北京, 学历不限, 50, 成长型, 文化娱乐 · 广告营销
网络安全工程师, 8, 1, 技术, 运维, 欧浦智网, 佛山, 大专, 500, 上市公, 移动互联网 · 电子商务
网络安全工程师, 10, 1, 技术, 运维, 庸恳资产, 上海, 大专, 15, 初创型, 金融
网络安全工程师, 20, 3, 技术, 运维, 量子云, 北京, 本科, 15, 成长型, 移动互联网
网络安全工程师, 15, 3, 技术, 高端技术职位, 深圳妈妈资本, 深圳, 本科, 50, 成长型, 金融
初级网络安全工程师, 5, 1, 技术, 运维, 鹏信科技, 杭州, 本科, 50, 初创型, 移动互联网
中级网络安全工程师, 7, 3, 技术, 运维, 鹏信科技, 杭州, 本科, 50, 初创型, 移动互联网
网络安全工程师, 14, 1, 技术, 运维, 拍拍贷, 上海, 大专, 2000, 成熟型, 金融
网络安全工程师, 5, 1, 技术, 运维, 深圳市标驰信息技术有限公司, 深圳, 学历不限, 15, 初创型, 数据服务
网络安全工程师, 22, 3, 技术, 运维, 英富森, 北京, 本科, 2000, 初创型, 移动互联网 · 电子商务
网络安全工程师, 8, 3, 技术, 运维, 重庆昕泓, 重庆, 大专, 15, 初创型, 金融
高级网络安全工程师, 15, 5, 技术, 运维, camelot, 上海, 学历不限, 2000, 上市公, 企业服务 · 其他
网络安全工程师, 15, 1, 技术, 运维, 众安在线, 上海, 本科, 150, 成长型, 金融
网络安全工程师, 12, 1, 技术, 运维, 易视腾, 北京, 大专, 150, 初创型, 硬件
高级网络安全工程师, 8, 5, 技术, 运维, 云舞网络, 上海, 大专, 150, 成长型, 移动互联网 · 旅游
网络安全工程师/主管, 15, 5, 技术, 运维, 望洲云大数据技术有限公司, 北京, 本科, 500, 成熟型, 教育
网络安全工程师, 7, 不, 技术, 运维, 东安检测, 杭州, 学历不限, 50, 成长型, 信息安全
网络安全工程师（TSC）, 16, 3, 技术, 运维, 竞技世界, 北京, 本科, 500, 成熟型, 移动互联网 · 游戏
网络安全工程师, 7, 1, 技术, 运维, 耐耐网, 北京, 大专, 50, 初创型, 移动互联网 · 电子商务
网络安全工程师, 22, 1, 技术, 后端开发, 汇购网, 北京, 本科, 50, 成长型, 电子商务
网络安全工程师, 6, 不, 技术, 运维, 河北天翼, 石家庄, 学历不限, 50, 成长型, 移动互联网 · 数据服务
网络安全测试工程师, 20, 1, 技术, 测试, 滴滴出行（小桔科技）, 北京, 本科, 2000, 成熟型, 移动互联网 · 电子商务
网络安全工程师, 30, 3, 技术, 运维, 北京时时贷网络, 北京, 本科, 50, 成长型, 金融 · 移动互联网
网络安全工程师, 14, 3, 技术, 运维, 珠宝贷, 深圳, 本科, 50, 成长型, 金融
网络安全架构师, 22, 5, 技术, 高端技术职位, 南方银谷, 上海, 本科, 150, 成熟型, 移动互联网 · 数据服务
网络安全安防, 10, 3, 技术, 运维, 吃喝玩乐, 天津, 大专, 150, 初创型, 电子商务 · O2O
网络安全工程师, 11, 3, 技术, 运维, 七乐康, 广州, 大专, 500, 成长型, 电子商务 · 医疗健康
网络安全-数据中心, 13, 3, 技术, 运维, 能信安, 深圳, 本科, 150, 成长型, 移动互联网 · 信息安全
高级网络安全工程师, 12, 3, 技术, 高端技术职位, 筑客网络, 上海, 大专, 15, 初创型, 企业服务
网络安全管理, 5, 1, 技术, 运维, 壹零客, 深圳, 本科, 50, 成长型, 电子商务
网络安全工程师, 12, 3, 技术, 运维, 车易拍, 北京, 本科, 500, 成熟型, 电子商务
高级网络安全工程师, 15, 3, 技术, 运维, 斯凯, 杭州, 本科, 500, 上市公, 移动互联网 · 游戏
网络安全工程师, 27, 3, 技术, 高端技术职位, 艺龙, 北京, 本科, 150, 上市公, 移动互联网 · 旅游
系统安全/网络安全工程师, 14, 1, 技术, 运维, 泰金所, 上海, 本科, 50, 成长型, 移动互联网 · 金融
网络安全工程师, 27, 5, 技术, 运维, SKT, 深圳, 大专, 50, 初创型, 企业服务 · 其他
网络安全工程师, 27, 3, 技术, 运维, 艺龙, 北京, 本科, 150, 上市公, 移动互联网 · 旅游
网络安全管理员, 17, 3, 技术, 运维, 往来无限, 北京, 本科, 15, 初创型, 移动互联网 · 电子商务
网络安全 项目经理, 25, 5, 技术, 运维, Nesun, 深圳, 本科, 150, 成长型, 电子商务 · 信息安全
网络安全产品运营, 15, 3, 运营, 运营, 中盈优创, 南京, 本科, 150, 成长型, 数据服务 · 招聘
高级网络安全工程师, 17, 5, 技术, 运维, 世衡, 上海, 本科, 50, 初创型, 移动互联网
高级网络安全工程师, 15, 1, 技术, 运维, 网易, 杭州, 本科, 2000, 上市公, 移动互联网 · 游戏
网络安全工程师, 20, 3, 技术, 运维, 农金圈, 深圳, 本科, 50, 成长型, 金融
网络安全产品销售, 9, 不限, , 客户代表, 中软远景, 北京, 学历不限, 15, 初创型, 企业服务 · 数据服务
网络安全专家, 30, 3, 技术, 运维, 恒生芸泰, 杭州, 本科, 150, 成长型, 移动互联网 · 医疗健康
网络安全工程师—安全维护, 6, 不, 技术, 运维, 久游, 上海, 学历不限, 150, 成熟型, 移动互联网 · 游戏
网络安全管理员, 5, 应届毕业, 技术, 运维, 保安公司, 上海, 本科, 2000, 成熟型, 其他
网络安全技术支持工程师, 18, 3, 技术, 运维, 苏小研, 苏州, 本科, 500, 成熟型, 移动互联网
高级网络安全工程师, 12, 1, 技术, 运维, 网易, 杭州, 本科, 2000, 上市公, 移动互联网 · 游戏
网络安全经理, 12, 5, 技术, 高端技术职位, 诺亚（中国）控股有限公司, 上海, 大专, 500, 上市公, 金融
网络安全架构师, 22, 5, 技术, 高端技术职位, 花生科技有限公司, 上海, 本科, 50, 成熟型, 移动互联网
IT专员（网络安全）, 6, 1, 技术, 运维, USTBJ, 北京, 学历不限, 150, 初创型, 企业服务 · 硬件
网络安全主管, 22, 3, 技术, 运维, 北京时时贷网络, 北京, 大专, 50, 成长型, 金融 · 移动互联网
安全专家--网络安全工程师, 22, 3, 技术, 高端技术职位, 1号车网, 北京, 本科, 2000, 上市公, 电子商务 · O2O
网络安全咨询资深专家, 40, 5, 市场与销售, 高端市场职位, 深信服科技, 北京, 本科, 2000, 成长型, 企业服务
网络安全工程师-北京-01980, 12, 3, 技术, 运维, 优信集团, 北京, 本科, 2000, 成熟型, 电子商务
网络安全研究工程师（逆向、攻防）, 12, 1, 技术, 运维, 南京烽火星空, 南京, 学历不限, 500, 上市公, 移动互联网 · 信息安全
网络安全攻城师, 22, 3, 技术, 运维, 悟空租车, 北京, 本科, 50, 成长型, 移动互联网
中级网络安全工程师, 15, 3, 技术, 运维, 大众点评网, 上海, 本科, 2000, 成熟型, 电子商务 · O2O
网络安全审核员, 7, 1, 运营, 运营, 立方网, 深圳, 大专, 150, 成长型, 移动互联网 · 硬件
网络安全主管, 22, 5, 技术, 运维, PPTV聚力, 上海, 本科, 500, 成熟型, 文化娱乐
网络安全主管, 18, 5, 技术, 运维, PPTV聚力, 上海, 本科, 500, 成熟型, 文化娱乐
高级网络安全测试工程师, 22, 3, 技术, 测试, 北京天融信公司, 北京, 学历不限, 2000, 上市公, 信息安全
高级网络安全规划专员, 10, 5, 设计, 用户研究, 中科院网络中心, 北京, 硕士, 500, 初创型, 移动互联网
CST0703网络安全研发工程师, 7, 1, 技术, 运维, 中科院网络中心, 北京, 本科, 500, 初创型, 移动互联网
高级网络安全工程师, 11, 1, 技术, 运维, 金元证券, 深圳, 本科, 500, 初创型, 金融
网络安全/运维开发工程师, 10, 3, 技术, 运维, 云端信联, 深圳, 本科, 50, 成长型, 移动互联网 · 电子商务
高级系统工程师-网络安全向, 30, 3, 技术, 运维, 今日头条, 北京, 本科, 500, 成熟型, 移动互联网 · 数据服务
网络安全核心研发人员, 12, 3, 技术, 高端技术职位, 智为, 长沙, 本科, 15, 初创型, 信息安全
网络安全攻防工程师-支付产品技术部, 22, 3, 技术, 高端技术职位, 京东金融, 北京, 本科, 2000, 上市公, 金融
Web前端开发工程师（网络安全研究院）, 22, 3, 技术, 前端开发, 艾华集团, 北京, 大专, 2000, 成熟型, 金融 · 移动互联网
销售经理（网络安全相关）, 7, 3, 市场与销售, 销售, 东软, 合肥, 大专, 2000, 上市公, 医疗健康 · 数据服务
云计算支持工程师(网络安全方向), 30, 不, 技术, 运维, AWS, 北京, 本科, 2000, 上市公, 移动互联网
高级网络安全工程师-互联网电商, 12, 不, 技术, 运维, 敦煌网, 北京, 大专, 500, 成熟型, 电子商务
Senior Cyber Security Analyst 网络安全高级工程师, 15, 5, 技术, 高端技术职位, 路坦信息, 珠海, 本科, 2000, 上市公, 企业服务 · 生活服务
网络安全产品研发工程师, 12, 3, 技术, 高端技术职位, 金安卓创, 成都, 本科, 15, 成长型, 硬件 · 信息安全
IOS安全研究工程师（网络安全研究院）, 18, 1, 技术, 移动开发, 艾华集团, 北京, 大专, 2000, 成熟型, 金融 · 移动互联网
网络安全产品技术支持工程师, 6, 3, 技术, 项目管理, 先安科技, 上海, 大专, 15, 初创型, 信息安全
