Java开发工程师, 16, 3, 技术, 后端开发, 卡木科技, 上海, 本科, 50, 成长型, 移动互联网 · 企业服务
初级Java开发工程师, 5, 1年以, 技术, 后端开发, 时光流影, 合肥, 本科, 500, 上市公, 社交网络
Java开发工程师, 10, 不, 技术, 后端开发, 沃奇, 杭州, 大专, 150, 初创型, 电子商务 · 医疗健康
Java研发工程师（驻地：抚顺）, 15, 1, 技术, 后端开发, 高达软件, 杭州, 大专, 150, 上市公, 移动互联网 · 电子商务
web开发工程师, 12, 3, 技术, 前端开发, 嘉琪科技, 北京, 本科, 50, 成长型, 移动互联网 · 电子商务
PHP开发工程师, 10, 1, 技术, 后端开发, 快抢车, 杭州, 大专, 50, 成长型, 移动互联网
PHP开发工程师, 9, 不, 技术, 后端开发, 海云兴, 深圳, 大专, 15, 初创型, 移动互联网 · 信息安全
Android开发工程师, 22, 3, 技术, 移动开发, 爸妈旅游, 珠海, 本科, 500, 成长型, 旅游
Java 开发工程师, 9, 不, 技术, 后端开发, CoolCTO, 上海, 本科, 15, 初创型, 移动互联网 · 企业服务
Java开发工程师, 22, 1, 技术, 后端开发, 百联全渠道电商, 上海, 大专, 500, 成熟型, 电子商务 · O2O
Java开发工程师, 12, 1, 技术, 后端开发, 卡木科技, 上海, 大专, 50, 成长型, 移动互联网 · 企业服务
.NET 软件工程师, 9, 1, 技术, 后端开发, 长荣健豪云印刷, 天津, 学历不限, 50, 上市公, 电子商务
Java工程师, 18, 3, 技术, 后端开发, 美的集团总部流程IT, 佛山, 本科, 2000, 上市公, 硬件
大数据研发工程师, 14, 不, 技术, 后端开发, 聚美优品, 北京, 本科, 2000, 上市公, 电子商务
Android程序员, 12, 3, 技术, 后端开发, 撼树科技, 北京, 学历不限, 15, 初创型, 移动互联网
软件工程师, 12, 不, 技术, 后端开发, 东软集团（北京）有限公司, 北京, 硕士, 2000, 上市公, 移动互联网
JAVA开发工程师, 13, 1, 技术, 前端开发, 永洪科技, 北京, 本科, 150, 成长型, 移动互联网
PHP软件工程师, 22, 3, 技术, 后端开发, 三季时空, 北京, 大专, 50, 成长型, 电子商务 · 金融
Android高级软件工程师, 26, 5, 技术, 移动开发, 达闼科技, 北京, 本科, 50, 成长型, 移动互联网
Python高级研发工程师, 20, 1, 技术, 后端开发, 平行国, 北京, 本科, 15, 初创型, 移动互联网
Java高级软件工程师, 12, 3, 技术, 后端开发, 华金所, 北京, 本科, 2000, 初创型, 移动互联网 · 金融
PHP 研发工程师, 30, 1, 技术, 后端开发, 北京新美互通科技有限公司, 北京, 本科, 150, 成长型, 移动互联网
Java软件工程师, 7, 1, 技术, 后端开发, 数鹏通科技, 广州, 本科, 50, 初创型, 移动互联网
高级PHP开发工程师, 21, 3, 技术, 后端开发, 新东方在线, 北京, 本科, 500, 成熟型, 移动互联网 · 教育
Java开发工程师－后台, 15, 3, 技术, 后端开发, 魔线科技公司, 深圳, 大专, 150, 上市公, O2O
嵌入式软件工程师, 12, 3, 技术, 硬件开发, 海凌科, 深圳, 本科, 15, 初创型, 信息安全 · 硬件
大数据hadoop开发工程师, 17, 3, 技术, 后端开发, 北风网, 上海, 大专, 50, 成长型, 教育 · 数据服务
C++软件工程师, 11, 不, 技术, 后端开发, 蓝鸽集团, 苏州, 本科, 500, 成熟型, 移动互联网 · 企业服务
软件开发工程师, 5, 1, 技术, 前端开发, 烁林软件, 北京, 本科, 50, 初创型, 金融
Java软件工程师, 20, 3, 技术, 后端开发, R2saas, 上海, 本科, 15, 初创型, 企业服务 · 数据服务
C++后台开发工程师, 11, 1, 技术, 后端开发, 爱豆子, 深圳, 大专, 50, 成长型, 移动互联网 · 电子商务
高级Java开发工程师, 27, 3, 技术, 后端开发, 和创科技, 北京, 本科, 2000, 上市公, 移动互联网
Android软件工程师, 22, 3, 技术, 移动开发, QQ炫舞, 北京, 本科, 150, 成长型, 游戏
高级Java开发工程师, 12, 3, 技术, 后端开发, 设计院, 上海, 大专, 2000, 上市公, 移动互联网 · 金融
PHP开发工程师, 7, 1, 技术, 后端开发, 东方网升, 杭州, 大专, 150, 初创型, 企业服务 · 招聘
Java开发工程师, 18, 1, 技术, 后端开发, 卡木科技, 上海, 大专, 50, 成长型, 移动互联网 · 企业服务
WEB开发工程师, 15, 不, 技术, 前端开发, 动动, 北京, 本科, 15, 成长型, 移动互联网 · 医疗健康
搜索引擎C++开发工程师, 12, 1, 技术, 后端开发, 妙计旅行, 北京, 本科, 50, 成长型, 旅游
C++资深开发工程师, 10, 1, 技术, 后端开发, 运力科技, 成都, 本科, 500, 成长型, 移动互联网 · 电子商务
PHP高级开发工程师, 20, 5, 技术, 后端开发, 阿里巴巴移动事业群, 广州, 本科, 2000, 上市公, 移动互联网
Android开发工程师, 11, 1, 技术, 移动开发, 沃朴物联, 杭州, 本科, 15, 成长型, 移动互联网
Android 开发工程师, 15, 1, 技术, 移动开发, 聚鹏, 上海, 本科, 15, 初创型, 移动互联网
PHP程序员, 12, 1, 技术, 后端开发, 急修猿, 深圳, 学历不限, 15, 初创型, O2O
Android开发工程师, 22, 3, 技术, 移动开发, 新移传媒, 杭州, 本科, 50, 成长型, 移动互联网
Android工程师, 11, 1, 技术, 移动开发, 掌维科技, 杭州, 本科, 15, 初创型, 移动互联网 · 文化娱乐
Java开发工程师, 18, 1, 技术, 后端开发, 绿漫科技, 杭州, 本科, 15, 初创型, 移动互联网
Linux C++/全栈架构师, 21, 3, 技术, 后端开发, 可米酷漫画, 深圳, 学历不限, 15, 成长型, 移动互联网 · 文化娱乐
Java资深软件工程师, 15, 3, 技术, 后端开发, 杭州艾瑟, 杭州, 本科, 15, 初创型, 移动互联网 · O2O
OCR算法研发工程师, 27, 不, 技术, 后端开发, Video++, 上海, 本科, 50, 成长型, 数据服务 · 文化娱乐
Java高级研发工程师（技术总监）, 25, 5, 技术, 后端开发, 奥鹏教育, 北京, 大专, 500, 成熟型, 移动互联网 · 教育
系统架构师/高级软件工程师, 15, 3, 技术, 高端技术职位, 赛酷比, 广州, 大专, 150, 成长型, 移动互联网
中级Java开发工程师, 13, 不, 技术, 后端开发, 学而科技, 济南, 学历不限, 15, 初创型, 移动互联网 · 其他
图像/视频软件研发工程师, 10, 1, 技术, 后端开发, 武汉政通, 武汉, 本科, 500, 上市公, 移动互联网
C#高级软件工程师（架构师）, 16, 3, 技术, 高端技术职位, 万盈财富, 深圳, 本科, 150, 成长型, 移动互联网 · 金融
java资深软件工程师, 25, 5, 技术, 后端开发, 神工, 北京, 本科, 150, 成长型, 移动互联网 · 电子商务
Java软件工程师, 20, 3, 技术, 后端开发, 贤达网络, 北京, 大专, 50, 成长型, 移动互联网 · 企业服务
云加速-高级Java开发工程师, 22, 3, 技术, 后端开发, 迅雷, 深圳, 本科, 500, 上市公, 移动互联网
PHP开发工程师, 8, 3, 技术, 后端开发, 爱尚窝--舒适家居服务平台, 厦门, 大专, 150, 成长型, 移动互联网 · O2O
云计算研发工程师, 10, 1, 技术, 后端开发, 武汉中天慧购电商服务有限公司, 武汉, 大专, 15, 初创型, 电子商务 · O2O
PHP高级研发工程师, 22, 3, 技术, 后端开发, 美丽说, 北京, 学历不限, 500, 成熟型, 电子商务 · 移动互联网
Android开发工程师, 20, 不, 技术, 移动开发, 萤石, 杭州, 本科, 150, 成长型, 移动互联网
存储软件工程师, 12, 1, 技术, 后端开发, 星辰天合, 北京, 学历不限, 15, 初创型, 企业服务
PHP研发工程师, 15, 1, 技术, 后端开发, 新浪乐居, 北京, 大专, 2000, 上市公, 电子商务  · 文化娱乐
Java 解析研发工程师, 20, 1, 技术, 后端开发, 航班管家, 北京, 本科, 150, 成熟型, 移动互联网
Ruby开发工程师, 9, 1, 技术, 后端开发, 折800网, 成都, 本科, 500, 成熟型, 移动互联网 · 电子商务
视觉软件工程师, 27, 3, 技术, 高端技术职位, 智能机器人 3D扫描, 深圳, 本科, 500, 成熟型, 数据服务 · 硬件
初级Java工程师, 5, 1年以, 技术, 后端开发, 中大凯旋, 广州, 大专, 50, 成长型, 电子商务
PHP研发工程师, 24, 3, 技术, 后端开发, 滴滴打车, 北京, 本科, 500, 成熟型, 移动互联网
Android开发工程师, 15, 1, 技术, 移动开发, 狂喜科技, 杭州, 大专, 15, 初创型, 移动互联网 · 电子商务
中级Java研发工程师, 10, 1, 技术, 后端开发, 金智教育, 上海, 学历不限, 500, 上市公, 移动互联网
Java开发工程师, 22, 3, 技术, 后端开发, 友金所, 深圳, 本科, 50, 成长型, 金融
高级软件工程师, 22, 3, 技术, 后端开发, 同程旅游, 上海, 大专, 2000, 成熟型, 移动互联网 · 旅游
C++程序员, 11, 1, 技术, 后端开发, 一花科技, 深圳, 本科, 15, 初创型, 游戏
Android开发工程师, 13, 3, 技术, 移动开发, 新致软件, 杭州, 大专, 2000, 成熟型, 移动互联网 · 数据服务
软件工程师, 11, 1, 技术, 后端开发, 越洋普华, 北京, 学历不限, 15, 初创型, 移动互联网
C/C++高级程序员, 11, 不, 技术, 后端开发, 世纪鼎点, 北京, 本科, 50, 成长型, 文化娱乐
资深Android软件工程师, 20, 3, 技术, 移动开发, 爸妈旅游, 泉州, 本科, 500, 成长型, 旅游
软件开发工程师, 21, 3, 技术, 后端开发, 金山WPS, 广州, 大专, 500, 上市公, 移动互联网
JAVA开发工程师-深圳, 12, 1, 技术, 后端开发, 亚信, 深圳, 本科, 2000, 上市公, 移动互联网 · 数据服务
.NET软件开发工程师, 17, 3, 技术, 后端开发, 资味网, 杭州, 本科, 50, 成长型, 移动互联网 · 电子商务
Java高级软件工程师, 12, 3, 技术, 后端开发, 昊合数据, 北京, 大专, 150, 成长型, 医疗健康 · 数据服务
高级Android开发工程师-BJ21001, 20, 3, 技术, 移动开发, 点融网, 北京, 学历不限, 500, 成熟型, 金融
.NET(c#)开发工程师, 30, 1, 技术, 后端开发, 学乐, 杭州, 大专, 150, 成熟型, 教育
高级Java研发工程师（云方向）, 20, 3, 技术, 后端开发, 云嘉, 杭州, 本科, 50, 成长型, 移动互联网 · 数据服务
Node.js软件工程师, 7, 1, 技术, 后端开发, 极客软件, 西安, 大专, 15, 成熟型, 移动互联网
cocos2d-x(lua脚本)开发工程师, 15, 1, 技术, 移动开发, 奥多科技, 上海, 大专, 50, 成长型, 游戏
高级Java开发工程师, 22, 不, 技术, 后端开发, 学而科技, 济南, 学历不限, 15, 初创型, 移动互联网 · 其他
C#软件工程师, 10, 1, 技术, 后端开发, 北京红云融通技术有限公司, 北京, 本科, 150, 初创型, 移动互联网 · 文化娱乐
Python开发工程师, 10, 1, 技术, 后端开发, 万医, 杭州, 学历不限, 15, 初创型, 移动互联网 · 医疗健康
Web前端研发工程师/架构师, 30, 3, 技术, 前端开发, 滴滴打车, 北京, 本科, 500, 成熟型, 移动互联网
iOS开发工程师, 20, 3, 技术, 移动开发, 万科物业, 深圳, 本科, 2000, 成熟型, O2O · 生活服务
C#开发工程师, 9, 1, 技术, 后端开发, 戴尔, 珠海, 本科, 2000, 成熟型, 企业服务 · 数据服务
Android中级开发工程师, 15, 1, 技术, 移动开发, 百会, 北京, 本科, 150, 初创型, 移动互联网 · 企业服务
Erlang研发工程师, 11, 1, 技术, 后端开发, 大数点, 深圳, 本科, 15, 初创型, 移动互联网
Java开发工程师（武汉）, 8, 1, 技术, 后端开发, 广东亿迅, 武汉, 本科, 2000, 成熟型, 其他
iOS开发工程师, 12, 3, 技术, 移动开发, 广电猫猫, 南京, 大专, 150, 成长型, 移动互联网 · 电子商务
Java开发工程师, 7, 1, 技术, 后端开发, 野大豆, 广州, 学历不限, 15, 初创型, 移动互联网 · O2O
Java高级开发工程师, 22, 3, 技术, 后端开发, 我来贷WeLab, 深圳, 本科, 150, 成长型, 金融
Java程序员, 12, 1, 技术, 后端开发, 松果互联网金融, 深圳, 学历不限, 15, 初创型, 金融 · 广告营销
互联网软件工程师, 14, 3, 技术, 前端开发, 中成科信, 北京, 大专, 50, 初创型, 电子商务 · O2O
PHP开发工程师, 15, 1, 技术, 后端开发, 聚板网络, 上海, 大专, 15, 初创型, 金融
高级服务器研发工程师（JAVA）, 16, 1, 技术, 后端开发, 趣互联, 北京, 本科, 15, 初创型, 移动互联网 · 社交网络
PHP开发工程师, 9, 1, 技术, 后端开发, 北风网, 上海, 大专, 50, 成长型, 教育 · 数据服务
PHP研发工程师, 15, 1, 技术, 后端开发, 哔哩哔哩, 上海, 大专, 150, 初创型, 移动互联网 · 文化娱乐
ios开发工程师, 15, 3, 技术, 移动开发, 9贝壳, 杭州, 学历不限, 50, 成长型, O2O · 生活服务
JAVA工程师, 27, 3, 技术, 后端开发, 贝米钱包, 上海, 本科, 15, 成长型, 金融
PHP研发工程师, 15, 1, 技术, 后端开发, 活琪王, 北京, 本科, 15, 初创型, 移动互联网 · 金融
PHP研发工程师, 27, 3, 技术, 后端开发, 滴滴打车, 北京, 本科, 500, 成熟型, 移动互联网
Android程序员, 15, 3, 技术, 移动开发, 明朝万达, 北京, 大专, 150, 成熟型, 企业服务 · 信息安全
VC/C++ 开发工程师, 7, 1, 技术, 后端开发, 释码大华, 北京, 本科, 50, 成熟型, 移动互联网
Java 研发工程师, 15, 3, 技术, 后端开发, 印孚瑟斯, 上海, 本科, 2000, 上市公, 移动互联网
nginx lua 开发工程师, 12, 1, 技术, 后端开发, 唯一网络, 广州, 学历不限, 150, 成长型, 移动互联网 · 数据服务
PHP软件工程师, 9, 1, 技术, 后端开发, 泰学天地, 北京, 本科, 50, 初创型, 电子商务
Java 软件工程师, 12, 不, 技术, 后端开发, 华邦房地产, 杭州, 大专, 2000, 成熟型, 生活服务 · 其他
数据仓库研发工程师, 12, 3, 技术, 后端开发, 华住酒店集团, 上海, 大专, 2000, 上市公, 旅游 · 生活服务
高级Java软件工程师(丰台科技园), 21, 3, 技术, 后端开发, 海鑫科金Hisign, 北京, 本科, 500, 上市公, 移动互联网 · 信息安全
PHP软件工程师, 10, 1, 技术, 后端开发, 光明网, 北京, 本科, 150, 成长型, 电子商务 · 文化娱乐
C#软件工程师（急）, 6, 不, 技术, 后端开发, 宏信科技, 广州, 大专, 50, 成长型, 移动互联网
高级C#开发工程师, 22, 3, 技术, 后端开发, 海鑫科金Hisign, 北京, 本科, 500, 上市公, 移动互联网 · 信息安全
Java高级软件工程师, 20, 1, 技术, 后端开发, 透云科技, 上海, 大专, 150, 成长型, 移动互联网 · 数据服务
C++软件工程师, 8, 1, 技术, 前端开发, Aunbox, 苏州, 学历不限, 15, 初创型, 移动互联网
JAVA高级软件工程师, 25, 5, 技术, 后端开发, 神工, 北京, 本科, 150, 成长型, 移动互联网 · 电子商务
资深JAVA开发工程师, 27, 5, 技术, 高端技术职位, 威富通科技, 深圳, 大专, 50, 成长型, 移动互联网 · 电子商务
Python 开发工程师, 15, 1, 技术, 后端开发, 有康爱帮, 北京, 本科, 15, 成长型, 移动互联网
Java开发工程师, 14, 3, 技术, 后端开发, 卡木科技, 上海, 本科, 50, 成长型, 移动互联网 · 企业服务
Java开发工程师, 18, 3, 技术, 后端开发, 卡木科技, 上海, 本科, 50, 成长型, 移动互联网 · 企业服务
流媒体研发工程师, 21, 3, 技术, 后端开发, 美图公司, 北京, 本科, 500, 成熟型, 移动互联网 · 硬件
.NET软件工程师, 12, 5, 技术, 后端开发, 上海移品信息技术有限公司, 上海, 本科, 50, 成长型, 移动互联网 · 企业服务
iOS开发工程师, 20, 3, 技术, 移动开发, 平安行, 厦门, 本科, 500, 成熟型, 移动互联网 · 电子商务
gis研发工程师, 8, 1, 技术, 前端开发, 新图软件, 北京, 本科, 150, 成长型, 移动互联网 · 企业服务
Java开发工程师, 12, 1, 技术, 后端开发, 正义网络, 深圳, 本科, 150, 成长型, 电子商务
Java工程师, 15, 3, 技术, 后端开发, 上海圆昶金融信息服务有限公司, 上海, 大专, 50, 成长型, 金融
前端研发工程师, 11, 3, 技术, 前端开发, 果仁科技, 苏州, 本科, 15, 初创型, 电子商务 · 数据服务
Unity3D程序员, 10, 1, 技术, 前端开发, 亚丁互动, 成都, 大专, 15, 初创型, 游戏
Android程序员, 8, 1, 技术, 移动开发, 云越网络, 济南, 大专, 150, 初创型, 移动互联网 · 电子商务
Java开发工程师, 15, 3, 技术, 后端开发, 美丽猫, 深圳, 大专, 50, 初创型, 移动互联网 · 电子商务
Java高级软件工程师, 17, 1, 技术, 后端开发, 二维火, 杭州, 本科, 150, 成长型, 移动互联网  · O2O
Java高级研发工程师, 18, 3, 技术, 后端开发, 东方明珠新媒体, 上海, 本科, 500, 上市公, 移动互联网 · 游戏
高级Java软件工程师, 20, 3, 技术, 后端开发, R2saas, 上海, 本科, 15, 初创型, 企业服务 · 数据服务
Java高级研发工程师, 22, 3, 技术, 后端开发, 58赶集集团, 北京, 本科, 2000, 上市公, 移动互联网
虚拟网络研发工程师, 18, 3, 技术, 后端开发, 苏小研, 苏州, 本科, 500, 成熟型, 移动互联网
iOS app开发工程师, 18, 3, 技术, 移动开发, 玛酷机器人, 深圳, 本科, 150, 成长型, 教育
数据仓库研发工程师, 30, 3, 技术, 后端开发, 美团网, 北京, 本科, 2000, 成熟型, 移动互联网 · O2O
Android高级软件工程师, 12, 3, 技术, 移动开发, 苏州魅游网络, 苏州, 本科, 15, 初创型, 移动互联网 · 游戏
高级C#.NET.软件工程师, 14, 1, 技术, 前端开发, 中成科信, 北京, 大专, 50, 初创型, 电子商务 · O2O
高级软件工程师-支付网关-SH12203, 22, 3, 技术, 后端开发, 点融网, 上海, 本科, 500, 成熟型, 金融
嵌入式C开发工程师, 19, 1, 技术, 后端开发, 思必驰科技, 深圳, 本科, 150, 成长型, 企业服务
Android高级研发工程师, 17, 5, 技术, 移动开发, 小沃科技, 上海, 本科, 150, 初创型, 移动互联网 · 游戏
配送系统研发工程师, 15, 3, 技术, 后端开发, 多点Dmall, 成都, 本科, 500, 初创型, 电子商务 · O2O
云加速-运维开发工程师, 20, 3, 技术, 运维, 迅雷, 深圳, 本科, 500, 上市公, 移动互联网
嵌入式软件工程师, 11, 3, 技术, 硬件开发, 科沃斯, 苏州, 本科, 2000, 初创型, 硬件
Java高级开发工程师, 30, 3, 技术, 后端开发, 美团网, 北京, 本科, 2000, 成熟型, 移动互联网 · O2O
iOS开发工程师, 11, 3, 技术, 移动开发, WiFi 伴侣, 厦门, 本科, 15, 成长型, 移动互联网
PHP开发工程师, 12, 1, 技术, 后端开发, 一点创新, 深圳, 大专, 150, 成长型, 移动互联网 · 生活服务
web前端程序员, 4, 1, 技术, 前端开发, 纬润, 广州, 大专, 50, 初创型, 广告营销 · 文化娱乐
JAVA 开发工程师, 15, 3, 技术, 后端开发, 用友, 北京, 本科, 2000, 上市公, 企业服务 · 数据服务
Web开发工程师, 10, 1, 技术, 前端开发, Maxent, 成都, 大专, 15, 成长型, 移动互联网 · 数据服务
PHP开发程序员, 6, 不限, , java, 商迅在线, 济南, 学历不限, 15, 初创型, 移动互联网 · 电子商务
Java开发工程师, 14, 3, 技术, 后端开发, 卡木科技, 上海, 大专, 50, 成长型, 移动互联网 · 企业服务
【滴滴出行】前端研发工程师/架构师, 30, 1, 技术, 前端开发, 滴滴打车, 北京, 本科, 500, 成熟型, 移动互联网
PHP工程师, 12, 1, 技术, 后端开发, 米订, 杭州, 大专, 50, 成长型, 移动互联网 · O2O
【滴滴招聘】PHP研发工程师, 30, 3, 技术, 后端开发, 滴滴打车, 北京, 本科, 500, 成熟型, 移动互联网
PHP工程师, 15, 3, 技术, 后端开发, 煜隆集团, 深圳, 本科, 150, 成长型, O2O · 金融
PHP开发工程师, 15, 1, 技术, 后端开发, 55海淘, 上海, 本科, 150, 成长型, 电子商务
Java开发工程师, 15, 1, 技术, 后端开发, 云印技术, 深圳, 本科, 50, 成长型, O2O
Java开发工程师, 10, 1, 技术, 后端开发, 美的集团总部流程IT, 佛山, 本科, 2000, 上市公, 硬件
Python开发工程师, 11, 1, 技术, 后端开发, 五谷磨房食品集团有限公司, 深圳, 大专, 2000, 成熟型, 移动互联网 · O2O
Python程序员, 7, 应届毕业, 技术, 后端开发, 奥狮数位, 上海, 本科, 50, 成长型, 移动互联网 · 广告营销
PHP程序猿, 20, 3, 技术, 后端开发, 好利58, 北京, 本科, 50, 成长型, 金融
急聘Java开发工程师, 7, 1, 技术, 后端开发, 维创盈通, 郑州, 大专, 50, 初创型, 移动互联网 · 电子商务
C++高级软件工程师, 16, 3, 技术, 后端开发, 爱加密, 深圳, 本科, 150, 成长型, 移动互联网
JAVA软件工程师, 20, 3, 技术, 后端开发, 优先科技, 北京, 本科, 15, 初创型, 移动互联网 · 硬件
糖猫-测试开发工程师, 16, 3, 技术, 测试, 搜狗, 北京, 本科, 2000, 成熟型, 移动互联网 · 数据服务
Android开发工程师(创新工场项目）, 12, 1, 技术, 移动开发, 要出发, 广州, 本科, 500, 成熟型, 电子商务 · 生活服务
Android高级研发工程师, 27, 3, 技术, 移动开发, 北京智能管家科技有限公司, 北京, 本科, 150, 成长型, 硬件
WMS开发工程师-Java方向, 15, 1, 技术, 后端开发, 美的集团总部流程IT, 深圳, 本科, 2000, 上市公, 硬件
WPF/.NET/C#高级开发工程师, 20, 5, 技术, 后端开发, hooray, 上海, 本科, 15, 成长型, 移动互联网 · 教育
软件工程师（JAVA), 11, 3, 技术, 后端开发, 联友科技, 广州, 本科, 500, 成熟型, 移动互联网 · 数据服务
WMS JAVA开发工程师, 15, 3, 技术, 前端开发, 一加手机, 深圳, 本科, 500, 初创型, 电子商务
移动云-C++Windows开发工程师, 22, 3, 技术, 后端开发, 迅雷, 深圳, 本科, 500, 上市公, 移动互联网
as400研发工程师, 5, 1年以, 技术, 后端开发, 高伟达, 北京, 大专, 2000, 上市公, 移动互联网
PHP高级研发工程师（（急，1个工作日内反馈）, 20, 5, 技术, 后端开发, 唯品会, 广州, 本科, 2000, 上市公, 电子商务
Java开发工程师, 13, 1, 技术, 后端开发, 卡木科技, 上海, 大专, 50, 成长型, 移动互联网 · 企业服务
Java开发工程师, 17, 3, 技术, 后端开发, 卡木科技, 上海, 本科, 50, 成长型, 移动互联网 · 企业服务
unity3D客户端高级程序员, 22, 3, 技术, 前端开发, 小白工作室, 杭州, 本科, 15, 初创型, 游戏
PHP开发工程师, 4, 1, 技术, 后端开发, 有爱, 南京, 大专, 50, 初创型, 医疗健康
Android开发工程师, 22, 3, 技术, 移动开发, 威阔（Trustlook）, 杭州, 本科, 15, 初创型, 移动互联网
PHP开发工程师, 20, 1, 技术, 后端开发, 拉维斯, 广州, 本科, 50, 成长型, 移动互联网 · 文化娱乐
HTML5开发工程师, 7, 1, 技术, 前端开发, 天源迪科(成都研发中心), 成都, 大专, 2000, 上市公, 移动互联网 · 数据服务
Java开发工程师（机票）, 12, 1, 技术, 后端开发, 途牛旅游网, 南京, 本科, 2000, 上市公, 电子商务 · 旅游
C++客户端程序员, 8, 1, 技术, 前端开发, UTGAME, 上海, 本科, 50, 上市公, 移动互联网 · 游戏
PHP研发工程师, 5, 1, 技术, 后端开发, 中鑫通信, 郑州, 大专, 500, 成熟型, 电子商务
PHP开发工程师, 17, 3, 技术, 后端开发, 速报酱, 上海, 本科, 15, 初创型, 移动互联网 · 电子商务
Java工程师, 15, 3, 技术, 后端开发, 煜隆集团, 深圳, 本科, 150, 成长型, O2O · 金融
Java高级程序员, 22, 3, 技术, 后端开发, SKG集团 — 广州分公司, 广州, 大专, 150, 初创型, 电子商务
unity3D客户端程序员, 15, 1, 技术, 前端开发, 小白工作室, 杭州, 本科, 15, 初创型, 游戏
嵌入式软件工程师, 11, 1, 技术, 后端开发, 唯创知音, 深圳, 大专, 50, 初创型, 移动互联网 · 其他
PHP开发工程师, 12, 1, 技术, 后端开发, 彩视, 北京, 本科, 15, 成长型, 移动互联网
大数据平台研发工程师, 37, 5, 技术, 后端开发, 蘑菇街, 杭州, 本科, 500, 成熟型, 电子商务
java开发工程师, 15, 1, 技术, 前端开发, 美的厨房电器事业部, 佛山, 大专, 2000, 上市公, 硬件
C++开发工程师, 10, 1, 技术, 后端开发, 金坤科创, 北京, 本科, 50, 成长型, 移动互联网
Go语言开发程序员, 22, 应届毕业, 技术, 后端开发, 英佩游戏, 上海, 本科, 150, 成熟型, 游戏
Java工程师/高级java开发工程师, 15, 3, 技术, 后端开发, 酷腾科技, 广州, 大专, 15, 初创型, 电子商务 · 社交网络
Java web 开发工程师, 13, 不, 技术, 后端开发, 杭州知彼科技有限公司, 杭州, 学历不限, 50, 成长型, 数据服务
PHP软件工程师, 12, 1, 技术, 后端开发, 泰联科技, 杭州, 大专, 50, 成长型, 移动互联网 · 数据服务
高薪诚聘PHP开发工程师, 18, 3, 技术, 后端开发, 白马, 广州, 本科, 50, 成长型, 移动互联网 · 电子商务
Java高级软件工程师（西安）, 8, 3, 技术, 后端开发, 数云, 西安, 本科, 150, 成长型, 企业服务 · 数据服务
校招职位：语音研发工程师——苏州, 9, 应届毕业, 技术, 后端开发, 思必驰科技, 苏州, 本科, 150, 成长型, 企业服务
HTML5软件工程师, 7, 1, 技术, 移动开发, 正和天下, 北京, 本科, 15, 成长型, 电子商务 · 金融
高级iOS研发工程师, 22, 3, 技术, 移动开发, PP助手, 广州, 本科, 150, 成熟型, 移动互联网
软件开发工程师, 8, 3, 技术, 运维, 成都博盛邦, 成都, 本科, 15, 初创型, 金融
中级PHP研发工程师, 22, 3, 技术, 后端开发, 一起装修网, 北京, 大专, 150, 成长型, 电子商务 · O2O
