GIS开发工程师, 7, 1, 技术, 后端开发, 贵仁科技, 杭州, 本科, 150, 初创型, 其他
软件开发工程师 (Python), 15, 1, 技术, 后端开发, 谷露软件, 上海, 学历不限, 15, 成长型, 数据服务 · 招聘
运维开发工程师, 12, 3, 技术, 运维, 创优天下, 北京, 大专, 15, 初创型, 教育 · 游戏
Swift工程师, 9, 1, 技术, 移动开发, 沃虎网络, 西安, 学历不限, 15, 成长型, 移动互联网 · 电子商务
通信软件工程师, 20, 3, 技术, 前端开发, 一加手机, 深圳, 本科, 500, 初创型, 电子商务
H5工程师, 12, 1, 技术, 前端开发, 正邦创意, 北京, 大专, 500, 成熟型, 移动互联网 · 广告营销
初级PHP程序员, 8, 1年以, 技术, 后端开发, 微小店, 厦门, 大专, 150, 初创型, 移动互联网 · 电子商务
售前工程师, 11, 不, 技术, 企业软件, 科码先锋, 北京, 学历不限, 150, 成长型, 电子商务
硬件开发工程师, 11, 1, 技术, 硬件开发, 不亦乐乎, 深圳, 本科, 15, 初创型, 移动互联网
PHP程序员（急招）, 8, 1, 技术, 后端开发, 都玩, 武汉, 大专, 15, 初创型, 电子商务
PHP开发工程师, 10, 3, 技术, 后端开发, Dreamtimes, 合肥, 大专, 15, 初创型, 电子商务
搜索软件工程师, 20, 3, 技术, 后端开发, 拉手网, 北京, 大专, 2000, 成熟型, 移动互联网 · 电子商务
软件工程师, 7, 1, 技术, 后端开发, 望果科技, 深圳, 大专, 15, 初创型, 移动互联网 · 企业服务
Python开发工程师, 12, 1, 技术, 后端开发, 齐家网, 上海, 学历不限, 2000, 成熟型, O2O  · 生活服务
运维开发工程师, 15, 3, 技术, 运维, 卷皮, 深圳, 本科, 500, 成长型, 电子商务
高级软件工程师, 9, 3, 技术, 企业软件, 点点帮, 成都, 本科, 50, 成长型, O2O
研发工程师, 22, 不, 技术, 后端开发, 神策网络科技, 北京, 学历不限, 15, 初创型, 数据服务
Wi-Fi 工程师, 11, 不, 技术, 硬件开发, TP-LINK, 深圳, 本科, 2000, 成熟型, 硬件
ETL高级开发工程师, 10, 3, 技术, 后端开发, 南京点尚, 南京, 本科, 150, 成长型, 移动互联网 · 电子商务
Android资深开发工程师, 17, 1, 技术, 移动开发, 温尔, 上海, 本科, 50, 成长型, 移动互联网
PHP程序员, 10, 1, 技术, 后端开发, 深圳市红石科技有限公司, 深圳, 大专, 50, 初创型, 移动互联网
高级Drupal 开发工程师, 17, 3, 技术, 后端开发, DefyMedia, 上海, 大专, 15, 初创型, 移动互联网 · 电子商务
初级软件开发工程师, 4, 不, 技术, 后端开发, Voyageone, 上海, 本科, 150, 成长型, 电子商务
Python 开发工程师, 20, 1, 技术, 后端开发, 好巧, 北京, 本科, 50, 成长型, 数据服务
Ceph研发工程师, 22, 1, 技术, 后端开发, UnitedStack, 北京, 本科, 50, 成长型, 数据服务
Java高级开发工程师, 15, 5, 技术, 后端开发, Voyageone, 上海, 本科, 150, 成长型, 电子商务
Android逆向开发工程师, 20, 1, 技术, 移动开发, 恺英网络, 上海, 大专, 500, 上市公, 移动互联网 · 游戏
信息安全工程师, 11, 1, 技术, 运维, 全程电子商务, 上海, 本科, 150, 成长型, 企业服务 · O2O
高级Java软件工程师, 14, 3, 技术, 后端开发, 招商信诺人寿保险有限公司, 深圳, 本科, 2000, 成熟型, 金融
高级Java软件工程师, 14, 3, 技术, 后端开发, 招商信诺人寿保险有限公司, 深圳, 大专, 2000, 成熟型, 金融
运维开发工程师, 20, 3, 技术, 运维, 我来贷WeLab, 深圳, 本科, 150, 成长型, 金融
BI工程师, 15, 3, 技术, 企业软件, 开新汽车, 上海, 大专, 500, 成长型, 移动互联网
广告研发工程师, 32, 3, 技术, 后端开发, 微店, 北京, 本科, 500, 成熟型, 移动互联网  · 电子商务
软件测试工程师, 12, 1, 技术, 测试, DefyMedia, 上海, 本科, 15, 初创型, 移动互联网 · 电子商务
Unity3D客户端程序员, 12, 3, 技术, 前端开发, 宏智力, 深圳, 学历不限, 15, 成长型, 移动互联网 · 电子商务
高级研发工程师（商家自动补贴）, 30, 不, 技术, 后端开发, 美团网, 北京, 本科, 2000, 成熟型, 移动互联网 · O2O
软件工程师, 8, 1, 技术, 后端开发, 满堂红集团, 广州, 本科, 2000, 成熟型, O2O · 生活服务
.NET研发工程师, 7, 1, 技术, 后端开发, 数文科技, 武汉, 本科, 50, 初创型, 移动互联网
高级软件工程师, 30, 5, 技术, 高端技术职位, SMARTX, 北京, 本科, 15, 成长型, 数据服务
资深Python工程师, 27, 5, 技术, 后端开发, 诚信贷, 北京, 大专, 15, 初创型, 移动互联网 · 金融
高级Python工程师, 20, 5, 技术, 后端开发, 诚信贷, 北京, 大专, 15, 初创型, 移动互联网 · 金融
Spark软件工程师, 15, 1, 技术, 后端开发, 盛世全景, 北京, 本科, 15, 初创型, 金融 · 数据服务
软件工程师, 5, 不, 技术, 后端开发, 南京天时中信息技术有限公司, 南京, 本科, 15, 初创型, 移动互联网 · 企业服务
PHP高级程序员, 25, 3, 技术, 后端开发, 北京翼百, 北京, 本科, 15, 初创型, 移动互联网 · 电子商务
大数据研发工程师, 15, 1, 技术, 后端开发, 拍拍贷, 上海, 本科, 2000, 成熟型, 金融
手机游戏服务器/后端 研发 程序员, 8, 1, 技术, 后端开发, 零度工坊, 武汉, 大专, 150, 成长型, 游戏
PHP程序员, 12, 1, 技术, 后端开发, 专注人才行业的互联网应用, 上海, 学历不限, 15, 初创型, 移动互联网 · 教育
中级Java开发工程师, 15, 1, 技术, 后端开发, 51信用卡管家, 杭州, 本科, 150, 成长型, 金融 · 数据服务
java服务器程序员, 17, 3, 技术, 后端开发, 鼎新软件, 北京, 大专, 150, 成熟型, 移动互联网 · 游戏
运维开发工程师, 15, 不, 技术, 运维, 塔布数据Datatub, 广州, 本科, 15, 成长型, 数据服务
算法工程师, 15, 1, 技术, 后端开发, 图灵机器人, 北京, 本科, 15, 成长型, 移动互联网
初级软件工程师(成都), 5, 1, 技术, 后端开发, 东软集团西南大区, 成都, 本科, 2000, 上市公, 移动互联网
PHP程序员, 14, 1, 技术, 后端开发, 云材网, 北京, 本科, 15, 初创型, 移动互联网
PHP程序员, 12, 1, 技术, 后端开发, 云材网, 北京, 本科, 15, 初创型, 移动互联网
APP软件工程师, 5, 1, 技术, 移动开发, 乐商软件, 广州, 大专, 50, 初创型, 移动互联网 · 电子商务
PHP程序员, 7, 1, 技术, 后端开发, 当天海鲜, 上海, 本科, 15, 初创型, 电子商务 · 移动互联网
大数据研发工程师, 30, 3, 技术, 高端技术职位, 一起作业网, 北京, 本科, 150, 成熟型, 移动互联网 · 教育
.NET开发工程师, 12, 3, 技术, 后端开发, 教百科技, 上海, 本科, 15, 成长型, 移动互联网 · 教育
后端研发工程师（2016应届生）, 8, 应届毕业, 技术, 后端开发, 有米科技, 广州, 本科, 150, 上市公, 移动互联网 · 广告营销
软件工程师（ONU）, 11, 1, 技术, 后端开发, 创维数字, 深圳, 本科, 2000, 上市公, 硬件 · 其他
.NET研发工程师, 7, 不, 技术, 后端开发, 南湖国旅, 广州, 大专, 2000, 成熟型, 旅游
高级java工程师(支撑系统..., 20, 3, 技术, 后端开发, 拉勾网, 北京, 本科, 150, 成长型, 企业服务 · 招聘
软件工程师, 13, 3, 技术, 后端开发, 瑞数安全, 成都, 本科, 15, 成长型, 信息安全
.NET开发工程师(移动端), 13, 3, 技术, 后端开发, 加减信息, 广州, 本科, 50, 成长型, 移动互联网
运维开发工程师, 15, 不, 技术, 运维, 地方头条, 深圳, 学历不限, 15, 初创型, 移动互联网 · 社交网络
.NET软件工程师, 9, 1, 技术, 后端开发, PWA, 上海, 大专, 50, 成长型, 广告营销
PHP高级开发工程师（急聘）, 20, 3, 技术, 后端开发, 深圳魔饭科技有限公司, 深圳, 大专, 15, 初创型, 移动互联网
Java软件工程师, 17, 5, 技术, 后端开发, 姚记悠彩, 北京, 本科, 150, 成长型, 移动互联网
高级软件工程师(java), 11, 3, 技术, 后端开发, 金域检验, 广州, 大专, 500, 成熟型, 医疗健康
高级软件工程师, 14, 3, 技术, 后端开发, 99无限, 上海, 大专, 150, 上市公, 移动互联网 · 企业服务
C#程序员, 9, 1, 技术, 后端开发, 任网行, 北京, 大专, 50, 成长型, 电子商务 · 金融
高级软件工程师, 15, 5, 技术, 后端开发, 尚德机构, 北京, 大专, 2000, 成长型, 电子商务 · 教育
高级硬件开发工程师, 20, 3, 技术, 硬件开发, BodyPlus, 深圳, 本科, 50, 初创型, 移动互联网 · 医疗健康
PHP程序员, 11, 1, 技术, 后端开发, 五分旅游网, 北京, 大专, 50, 初创型, 移动互联网
.Net资深研发工程师, 20, 5, 技术, 后端开发, 易果生鲜, 上海, 大专, 500, 成长型, 电子商务
Hadoop开发工程师, 25, 3, 技术, 后端开发, 恺英网络, 上海, 本科, 500, 上市公, 移动互联网 · 游戏
软件工程师, 15, 不, 技术, 高端技术职位, 有巢智能, 深圳, 学历不限, 15, 初创型, 硬件
大数据开发工程师, 20, 1, 技术, 后端开发, 启明星, 深圳, 大专, 150, 成长型, 电子商务
PHP程序员, 12, 1, 技术, 后端开发, 小树技术创投, 北京, 本科, 50, 成长型, 移动互联网
软件工程师, 6, 不, 技术, 后端开发, 细叶, 杭州, 学历不限, 15, 初创型, 移动互联网 · 电子商务
Java中级程序员, 9, 3, 技术, 后端开发, 普正教育, 广州, 大专, 50, 初创型, 移动互联网 · 教育
WIFI模块软件工程师, 11, 1, 技术, 硬件开发, 领耀东方, 深圳, 本科, 150, 上市公, 硬件
Android高级开发工程师, 12, 3, 技术, 移动开发, 恒信汽车电商, 武汉, 学历不限, 2000, 成熟型, 电子商务
Java高级研发工程师, 20, 3, 技术, 后端开发, 百会, 北京, 本科, 150, 初创型, 移动互联网 · 企业服务
资深搜索引擎研发工程师, 22, 3, 技术, 后端开发, 阿里巴巴移动事业群, 杭州, 本科, 2000, 上市公, 移动互联网
系统开发工程师, 20, 3, 技术, 后端开发, 滴滴打车, 北京, 学历不限, 500, 成熟型, 移动互联网
后端API接口高级开发工程师, 27, 3, 技术, 后端开发, 滴滴打车, 北京, 本科, 500, 成熟型, 移动互联网
运维开发工程师, 12, 3, 技术, 运维, ThoughtWorks, 西安, 学历不限, 150, 成长型, 企业服务
测试开发工程师, 22, 3, 技术, 测试, 我来贷WeLab, 深圳, 本科, 150, 成长型, 金融
微信开发工程师, 6, 1, 技术, 移动开发, 南湖国旅, 广州, 学历不限, 2000, 成熟型, 旅游
高级研发工程师（广告平台）, 15, 1, 技术, 高端技术职位, 舜飞科技, 广州, 本科, 50, 成长型, 移动互联网
滴滴打车 后端开发工程师, 30, 3, 技术, 后端开发, 滴滴打车, 北京, 本科, 500, 成熟型, 移动互联网
数据库工程师, 12, 3, 技术, dba, 中铁物流集团, 北京, 本科, 2000, 成熟型, 分类信息
大数据开发工程师, 20, 1, 技术, 后端开发, 立达方胜, 北京, 本科, 50, 成长型, 移动互联网
高级iOS开发工程师, 20, 3, 技术, 移动开发, 明源云客, 深圳, 本科, 2000, 上市公, 移动互联网 · 企业服务
PHP程序员, 8, 1, 技术, 后端开发, 博视壹号, 深圳, 大专, 15, 初创型, 移动互联网
Windows客户端软件高级研发工程师, 13, 3, 技术, 后端开发, 淘汽档口, 杭州, 学历不限, 500, 成长型, 电子商务
Java高级程序员, 15, 3, 技术, 后端开发, 房筹, 广州, 大专, 15, 成长型, 金融
C++核心程序员, 10, 1, 技术, 后端开发, 温金中心, 杭州, 学历不限, 50, 成长型, 金融
.NET软件工程师, 9, 1, 技术, 后端开发, 云来科技, 广州, 大专, 50, 成长型, 移动互联网 · 数据服务
PB研发工程师, 9, 1, 技术, 企业软件, 迪联科技, 杭州, 学历不限, 15, 初创型, 移动互联网 · 旅游
视觉算法工程师, 15, 1, 技术, 硬件开发, solocares, 深圳, 本科, 15, 初创型, 移动互联网 · O2O
java后台开发工程师, 17, 3, 技术, 后端开发, 石豆, 深圳, 本科, 50, 成长型, 移动互联网
模型系统研发工程师(熟悉C++), 12, 3, 技术, 后端开发, 晶赞科技Zamplus, 上海, 本科, 150, 成熟型, 数据服务 · 文化娱乐
存储研发工程师, 23, 5, 技术, dba, 保千里, 深圳, 本科, 2000, 上市公, 硬件
.NET软件工程师, 7, 1, 技术, 后端开发, 三颗毛豆, 常州, 大专, 15, 初创型, 电子商务 · O2O
运维开发工程师, 11, 3, 运营, 运营, 千山药机, 长沙, 本科, 2000, 上市公, 医疗健康
高级软件工程师（.net）, 11, 1, 技术, 后端开发, 金域检验, 广州, 大专, 500, 成熟型, 医疗健康
爬虫工程师, 12, 不, 技术, 后端开发, SmartData, 上海, 学历不限, 50, 初创型, 移动互联网 · 数据服务
PCB工程师, 15, 1, 技术, 硬件开发, 一加手机, 深圳, 本科, 500, 初创型, 电子商务
IDC工程师, 12, 3, 技术, 运维, 汽车之家, 北京, 学历不限, 2000, 上市公, 移动互联网 · 文化娱乐
C#程序员, 9, 1, 技术, 后端开发, 任网行, 北京, 学历不限, 50, 成长型, 电子商务 · 金融
软件工程师, 5, 1, 技术, 前端开发, 友明, 青岛, 本科, 15, 成长型, 医疗健康
项目管理工程师, 13, 3, 技术, 项目管理, 对酒当歌, 深圳, 大专, 150, 成长型, 电子商务 · O2O
PHP程序员, 12, 1, 技术, 后端开发, 艾特互动, 广州, 大专, 15, 成长型, 移动互联网 · 广告营销
PHP程序员, 10, 1, 技术, 后端开发, 速贸天下, 广州, 大专, 15, 初创型, 移动互联网 · 电子商务
IOS开发工程师, 27, 3, 技术, 移动开发, 恺英网络, 上海, 本科, 500, 上市公, 移动互联网 · 游戏
PHP程序员, 3, 不, 技术, 后端开发, 裁软, 成都, 大专, 15, 初创型, 移动互联网
C++程序员, 7, 1, 技术, 后端开发, 相约, 上海, 大专, 50, 成长型, 移动互联网 · 生活服务
软件工程师, 12, 应届毕业, 技术, 后端开发, 安信基金, 上海, 本科, 150, 成长型, 电子商务 · 金融
高级Java开发工程师, 9, 不, 技术, 后端开发, 北龙中网, 郑州, 大专, 500, 成熟型, 移动互联网 · 企业服务
物流TMS高级开发工程师, 22, 3, 技术, 后端开发, 美的集团总部流程IT, 佛山, 本科, 2000, 上市公, 硬件
.NET软件工程师, 5, 1, 技术, 后端开发, 江苏瑞创永立科技, 无锡, 大专, 15, 初创型, 其他
资深3D引擎研发工程师, 22, 不, 技术, 移动开发, 幻世网络, 厦门, 本科, 50, 成长型, 移动互联网
高级Java开发工程师, 20, 1, 技术, 后端开发, 爱客仕, 杭州, 学历不限, 150, 成长型, 移动互联网 · O2O
PHP程序员, 11, 1, 技术, 后端开发, 粉蓝医疗, 杭州, 大专, 15, 初创型, O2O · 医疗健康
（急招）测试开发工程师, 15, 1, 技术, 测试, CATCH, 杭州, 本科, 15, 成长型, 移动互联网
openstack开发工程师, 7, 1, 技术, 运维, 联想利泰, 北京, 大专, 500, 初创型, 移动互联网 · 招聘
高级Delphi开发工程师, 17, 5, 技术, 后端开发, 北大医信, 北京, 本科, 500, 成熟型, 医疗健康
NET软件工程师, 8, 1, 技术, 后端开发, 大族激光, 深圳, 本科, 2000, 上市公, 硬件
大数据软件工程师, 12, 1, 技术, 后端开发, 长江时代通信, 上海, 大专, 150, 成长型, 企业服务 · 数据服务
html5开发工程师, 25, 3, 技术, 前端开发, 云视科技, 上海, 本科, 150, 成长型, 数据服务
Java程序员, 22, 不, 技术, 后端开发, 联想集团, 北京, 学历不限, 2000, 上市公, 移动互联网 · 数据服务
.net开发工程师, 10, 1, 技术, 后端开发, 要出发, 广州, 本科, 500, 成熟型, 电子商务 · 生活服务
Java开发工程师/程序员, 12, 1, 技术, 后端开发, 懒爸懒妈, 北京, 学历不限, 15, 初创型, 移动互联网 · 电子商务
Android开发程序员, 7, 3, 技术, 移动开发, 百洋健康网, 青岛, 本科, 150, 初创型, 移动互联网 · 医疗健康
PHP高级程序员, 10, 1, 技术, 后端开发, 深圳云企信息技术有限公司, 深圳, 大专, 150, 成长型, 移动互联网 · 电子商务
C#高级程序员, 8, 不, 技术, 后端开发, 万牛, 广州, 学历不限, 15, 初创型, 移动互联网 · 其他
路由器底层研发工程师, 12, 1, 技术, 硬件开发, 银橙传媒, 上海, 本科, 150, 上市公, 移动互联网 · 数据服务
JavaScript 开发工程师, 22, 1, 技术, 前端开发, 壹财富, 上海, 学历不限, 150, 成长型, 金融
HTML5工程师, 11, 1, 技术, 移动开发, 仙境乐网, 北京, 本科, 50, 成长型, 移动互联网 · 游戏
高级软件工程师, 17, 3, 技术, 高端技术职位, 尚德机构, 北京, 本科, 2000, 成长型, 电子商务 · 教育
PHP程序员, 6, 1, 技术, 企业软件, 婚礼购, 苏州, 大专, 15, 初创型, 移动互联网 · 电子商务
资深Android开发工程师, 22, 3, 技术, 移动开发, 贝贝网, 杭州, 本科, 500, 成熟型, 电子商务
数据库开发工程师—ETL, 14, 1, 技术, 企业软件, 德邦, 上海, 学历不限, 2000, 成长型, 企业服务
服务器端研发工程师, 22, 1, 技术, 后端开发, 北京快乐学, 北京, 本科, 50, 成长型, 教育
运维开发工程师, 5, 1, 技术, 运维, 时光流影, 合肥, 本科, 500, 上市公, 社交网络
Java工程师/软件工程师, 5, 1, 技术, 后端开发, 广东绿联, 东莞, 大专, 15, 初创型, 移动互联网 · 电子商务
高级硬件工程师, 11, 3, 技术, 硬件开发, 玛酷机器人, 深圳, 本科, 150, 成长型, 教育
Ruby 开发工程师, 18, 3, 技术, 后端开发, 住百家, 北京, 本科, 150, 成熟型, O2O · 旅游
Java程序员, 9, 3, 技术, 后端开发, 蓝店, 厦门, 本科, 15, 初创型, 电子商务 · O2O
Java 程序员, 11, 3, 技术, 后端开发, 联程科技, 北京, 大专, 15, 初创型, 信息安全 · 企业服务
Flash开发工程师, 15, 1, 技术, 前端开发, 畅游, 北京, 本科, 2000, 上市公, 移动互联网 · 游戏
Java程序员, 8, 1, 技术, 后端开发, 捷创电商, 惠州, 大专, 15, 初创型, 移动互联网 · 电子商务
.NET开发工程师, 8, 1, 技术, 后端开发, 联合永道, 北京, 本科, 500, 成熟型, 移动互联网 · 企业服务
程序员激励师, 12, 3, 市场与销售, 市场/营销, 保千里, 深圳, 大专, 2000, 上市公, 硬件
Android软件工程师, 10, 1, 技术, 移动开发, 数赢云网络科技, 常州, 本科, 150, 成长型, 电子商务 · 广告营销
PHP程序员, 11, 1, 技术, 后端开发, 伊仁文化, 广州, 大专, 15, 初创型, 社交网络 · 文化娱乐
基带工程师, 18, 1, 技术, 硬件开发, 一加手机, 深圳, 本科, 500, 初创型, 电子商务
Android初级开发工程师, 6, 不, 技术, 移动开发, 恒信汽车电商, 武汉, 学历不限, 2000, 成熟型, 电子商务
系统研发工程师, 7, 不, 技术, 后端开发, 武汉安天, 武汉, 本科, 50, 成长型, 移动互联网
运维开发工程师, 17, 3, 技术, 运维, 学霸君, 上海, 本科, 150, 成长型, 移动互联网 · 教育
高级GIS开发工程师, 15, 5, 技术, 后端开发, 武汉光谷信息, 武汉, 大专, 500, 上市公, 企业服务
高级软件工程师, 11, 5, 技术, 后端开发, 湖北远成, 武汉, 大专, 500, 初创型, 电子商务 · 广告营销
高级Java开发工程师, 15, 5, 技术, 后端开发, 齐家网, 上海, 大专, 2000, 成熟型, O2O  · 生活服务
中级软件工程师, 7, 1, 技术, 后端开发, 宇诚网络, 石家庄, 本科, 500, 成熟型, 电子商务 · 金融
网页设计师, 5, 1, 技术, 前端开发, 盼游网, 珠海, 大专, 50, 初创型, 电子商务
网站编辑, 3, 不, 运营, 编辑, 骑士助手, 西安, 学历不限, 15, 初创型, 移动互联网 · 游戏
游戏数值策划, 20, 1, 设计, 用户研究, 梦启科技, 北京, 学历不限, 15, 成长型, 移动互联网 · 游戏
测试工程师, 7, 不, 技术, 测试, 咖啡猫, 上海, 学历不限, 15, 初创型, 移动互联网
区域经理, 5, 3, 市场与销售, 市场/营销, 义幻医疗, 成都, 大专, 15, 成长型, 移动互联网 · 医疗健康
金融移动产品经理, 30, 3, 产品, 产品经理, 酬信, 北京, 大专, 150, 成长型, 金融
市场顾问, 4, 应届毕业, 市场与销售, 市场/营销, 美联英语合肥, 合肥, 学历不限, 2000, 初创型, O2O · 教育
技术总监, 22, 3, 技术, 高端技术职位, 欢否, 北京, 本科, 15, 成长型, 移动互联网 · O2O
高级数据分析师, 20, 3, 设计, 用户研究, 拉勾网, 北京, 硕士, 150, 成长型, 企业服务 · 招聘
html5, 12, 1, 技术, 前端开发, 商联在线, 北京, 大专, 15, 成长型, 移动互联网 · 金融
UI设计师, 10, 1, 技术, 前端开发, 惠卡世纪有限公司, 深圳, 大专, 500, 上市公, 移动互联网 · 电子商务
理财顾问/理财经理, 9, 1, 金融, 投融资, 智慧蜂窝, 深圳, 大专, 50, 初创型, 移动互联网 · 金融
文案策划, 10, 3, 运营, 编辑, 村游网, 西安, 大专, 50, 成长型, 旅游
运维经理, 15, 不, 技术, 运维, 杭州知彼科技有限公司, 杭州, 学历不限, 50, 成长型, 数据服务
iOS工程师, 5, 1, 技术, 移动开发, 大云广众, 泉州, 大专, 15, 初创型, 移动互联网
资深Android开发工程师, 32, 3, 技术, 移动开发, 沪江, 上海, 本科, 500, 成熟型, 移动互联网 · 教育
高级Java后端开发工程师, 22, 3, 技术, 后端开发, 空空狐, 北京, 本科, 15, 成长型, 移动互联网
Java软件工程师, 10, 3, 技术, 后端开发, 广州航信, 广州, 本科, 150, 上市公, 移动互联网 · 旅游
高级嵌入式软件工程师, 22, 5, 技术, 移动开发, 北京智能管家科技有限公司, 深圳, 本科, 150, 成长型, 硬件
中级JAVA开发工程师, 15, 5, 技术, 后端开发, 联通支付有限公司, 北京, 本科, 150, 成长型, 移动互联网
PHP开发工程师, 12, 1, 技术, 后端开发, 途牛旅游网, 南京, 本科, 2000, 上市公, 电子商务 · 旅游
资深PHP开发工程师, 20, 3, 技术, 后端开发, 盛阳咨询, 上海, 大专, 500, 上市公, 移动互联网 · 金融
Java开发工程师, 14, 1, 技术, 后端开发, 卡木科技, 上海, 大专, 50, 成长型, 移动互联网 · 企业服务
iOS开发工程师（报销面试车费）, 17, 3, 技术, 移动开发, 么么直播, 上海, 大专, 50, 成长型, 移动互联网 · 社交网络
iOS开发工程师, 20, 3, 技术, 移动开发, 汽车之家, 北京, 学历不限, 2000, 上市公, 移动互联网 · 文化娱乐
嵌入式软件工程师, 15, 1, 技术, 硬件开发, 自在科技, 北京, 本科, 50, 成长型, 移动互联网 · 硬件
PHP研发工程师（社招、校招）, 22, 不, 技术, 后端开发, 真融宝, 北京, 本科, 50, 成长型, 金融
.net开发工程师, 10, 1, 技术, 前端开发, 搜房网, 北京, 本科, 2000, 上市公, 生活服务
资深JAVA开发工程师, 11, 1, 技术, 后端开发, 中筹网金, 上海, 学历不限, 50, 成长型, 金融
PHP 开发工程师, 6, 1, 技术, 后端开发, 蓝格网络, 芜湖, 本科, 15, 初创型, 移动互联网 · O2O
测试开发工程师, 22, 3, 技术, 测试, 凤凰金融, 北京, 本科, 150, 成长型, 金融
游戏测试工程师, 12, 1, 技术, 测试, Zenjoy, 北京, 大专, 50, 成长型, 移动互联网 · 游戏
软件工程师, 5, 1年以, 技术, 后端开发, 深圳易思博软件, 武汉, 本科, 2000, 上市公, 移动互联网 · 金融
高级PHP开发工程师（软件工程师）, 16, 3, 技术, 后端开发, 途娱ABC, 上海, 大专, 15, 初创型, 电子商务 · 金融
.NET高级研发工程师, 15, 3, 技术, 后端开发, Haoservice, 北京, 本科, 15, 初创型, 移动互联网 · 生活服务
Java高级程序员/软件工程师, 10, 3, 技术, 高端技术职位, 中领车邦, 成都, 本科, 50, 初创型, O2O
数据工程师, 15, 1, 技术, 后端开发, 华尔街见闻, 上海, 本科, 50, 成长型, 金融 · 移动互联网
软件工程师, 4, 1, 技术, 后端开发, 富统, 上海, 大专, 50, 初创型, 移动互联网 · 电子商务
iOS开发工程师, 15, 3, 技术, 移动开发, 恺英网络, 上海, 大专, 500, 上市公, 移动互联网 · 游戏
sharepoint开发工程师, 12, 不, 技术, 前端开发, 微创, 上海, 本科, 2000, 初创型, 移动互联网 · 数据服务
sharepoint开发工程师, 13, 不, 技术, 后端开发, 微创, 上海, 本科, 2000, 初创型, 移动互联网 · 数据服务
VC++研发工程师, 25, 3, 技术, 后端开发, 屛芯科技, 北京, 大专, 150, 成长型, 移动互联网 · 电子商务
.NET研发工程师, 8, 1, 技术, 后端开发, 我爱买房网, 上海, 大专, 150, 初创型, O2O · 其他
MianFrame软件工程师, 9, 不, 技术, 企业软件, 汇信, 广州, 本科, 150, 成长型, 企业服务 · 其他
虚幻3程序员, 11, 1, 技术, 前端开发, 东莞黑洞科技, 上海, 本科, 150, 初创型, 游戏
虚幻3程序员, 11, 1, 技术, 前端开发, 东莞黑洞科技, 上海, 本科, 150, 初创型, 游戏
资深Java开发工程师, 20, 3, 技术, 后端开发, 杏仁医生, 上海, 大专, 500, 成长型, 移动互联网 · O2O
自助软件工程师, 7, 不限, 技术, 后端开发, 健培, 杭州, 大专, 50, 初创型, 移动互联网 · 医疗健康
服务器研发工程师, 21, 不, 技术, 后端开发, 阜坤信息, 杭州, 本科, 150, 初创型, 移动互联网
运维开发工程师, 12, 1, 技术, 运维, 神州佳教, 北京, 本科, 50, 成长型, 移动互联网 · 教育
.NET高级软件工程师, 12, 不, 技术, 后端开发, 5173.com中国网络游戏服务网, 上海, 学历不限, 2000, 上市公, 移动互联网 · 电子商务
