职位, 工资, 经验要求, 职位一级分类, 职位二级分类, 公司名称, 城市, 学历, 公司规模, 公司阶段, 公司业务领域
全栈工程师, 10, 不, 技术, 后端开发, 拉勾网, 北京, 学历不限, 150, 成长型, 企业服务 · 招聘
全栈工程师, 15, 3, 技术, 后端开发, 电视淘宝, 杭州, 本科, 50, 成长型, 电子商务
全栈工程师, 15, 不, 技术, 后端开发, 墨齐, 深圳, 本科, 15, 成长型, 移动互联网 · 教育
全栈工程师, 6, 1, 技术, 后端开发, 第一风景, 北京, 大专, 15, 初创型, 电子商务 · 文化娱乐
全栈工程师, 35, 3, 技术, 后端开发, 玖柏图, 北京, 本科, 15, 初创型, 移动互联网 · 硬件
全栈工程师, 22, 不, 技术, 后端开发, 谷露软件, 上海, 学历不限, 15, 成长型, 数据服务 · 招聘
全栈工程师, 24, 1, 技术, 后端开发, 拍藏科技CAMART, 北京, 本科, 15, 初创型, 移动互联网 · 文化娱乐
全栈软件工程师, 18, 不, 技术, 高端技术职位, yunba.io云巴, 深圳, 本科, 15, 成长型, 移动互联网
全栈工程师, 3, 不, 技术, 后端开发, 塔布数据Datatub, 广州, 学历不限, 15, 成长型, 数据服务
全栈工程师, 11, 5, 技术, 后端开发, PostApp, 天津, 学历不限, 15, 初创型, 移动互联网 · 教育
全栈工程师, 22, 不, 技术, 后端开发, Glow, 上海, 本科, 15, 成长型, 移动互联网 · 医疗健康
全栈工程师, 14, 1, 技术, 后端开发, 海聊, 上海, 本科, 15, 初创型, 社交网络 · 金融
全栈开发工程师, 25, 3, 技术, 前端开发, 壹财富, 上海, 本科, 150, 成长型, 金融
全栈工程师, 22, 不, 技术, 移动开发, 贡嘎, 北京, 本科, 15, 初创型, 移动互联网 · 广告营销
全栈工程师, 9, 1, 技术, 后端开发, Wisdom Garden, 西安, 学历不限, 50, 成长型, 教育
全栈开发工程师, 12, 1, 技术, 后端开发, 沙塔, 上海, 本科, 50, 成长型, 移动互联网 · 数据服务
全栈工程师, 15, 不, 技术, 后端开发, Payssion, 上海, 学历不限, 50, 成长型, 移动互联网 · 金融
全栈工程师., 22, 5, 技术, 后端开发, 雷猴软件开发有限公司, 广州, 大专, 50, 成长型, 移动互联网
全栈工程师, 12, 不, 技术, 后端开发, 路享Roadshr, 深圳, 学历不限, 15, 初创型, 企业服务
全栈工程师, 7, 1, 技术, 后端开发, 中武科技, 武汉, 本科, 15, 初创型, 移动互联网 · O2O
全栈工程师, 20, 5, 技术, 后端开发, Maxent, 上海, 本科, 15, 成长型, 移动互联网 · 数据服务
全栈工程师, 7, 3, 技术, 后端开发, 蜗太太健身社区, 杭州, 学历不限, 15, 初创型, 社交网络 · 医疗健康
全栈工程师, 16, 1, 技术, 后端开发, 华兴资本, 深圳, 本科, 50, 初创型, 金融
全栈工程师, 15, 不, 技术, 移动开发, 箭扣科技, 北京, 学历不限, 15, 初创型, 移动互联网
全栈工程师, 22, 不, 技术, 后端开发, 拱石科技, 深圳, 学历不限, 15, 初创型, 金融 · 企业服务
全栈工程师 (工程效率), 20, 不, 技术, 后端开发, 微策略软件, 杭州, 本科, 500, 上市公, 数据服务
高级全栈工程师, 25, 不, 技术, 高端技术职位, yunba.io云巴, 上海, 本科, 15, 成长型, 移动互联网
全栈开发工程师, 27, 3, 技术, 前端开发, 北京智慧图, 北京, 学历不限, 150, 成长型, 移动互联网 · 数据服务
全栈工程师, 11, 不, 技术, 后端开发, 思诺环能, 北京, 学历不限, 15, 初创型, 数据服务 · 企业服务
高级全栈工程师, 25, 3, 技术, 高端技术职位, yunba.io云巴, 深圳, 本科, 15, 成长型, 移动互联网
全栈工程师, 20, 3, 技术, 后端开发, 动脉网, 重庆, 本科, 15, 初创型, 移动互联网 · 医疗健康
全栈工程师, 30, 不, 技术, 高端技术职位, 英语流利说, 上海, 学历不限, 50, 成长型, 移动互联网 · 教育
全栈工程师, 22, 不, 技术, 移动开发, 贡嘎, 北京, 学历不限, 15, 初创型, 移动互联网 · 广告营销
全栈工程师, 10, 1, 技术, 后端开发, 拾盐, 苏州, 大专, 15, 初创型, 移动互联网 · 社交网络
全栈工程师, 6, 应届毕业, 技术, 后端开发, 西安礼飨, 西安, 本科, 15, 初创型, 电子商务 · O2O
全栈工程师, 11, 3, 技术, 后端开发, 云庐数据, 武汉, 学历不限, 50, 成长型, 移动互联网 · 数据服务
全栈工程师, 27, 3, 技术, 后端开发, PuffDog, 上海, 本科, 15, 初创型, 移动互联网
全栈工程师, 27, 3, 技术, 后端开发, 同花顺, 杭州, 硕士, 2000, 上市公, 金融
全栈工程师, 17, 3, 技术, 后端开发, 趣住啊, 上海, 本科, 15, 初创型, 移动互联网 · 旅游
全栈工程师, 12, 3, 技术, 后端开发, 运动元, 上海, 本科, 15, 初创型, 移动互联网 · 文化娱乐
高级全栈工程师, 22, 1, 技术, 后端开发, MOGE, 北京, 本科, 15, 初创型, 移动互联网 · 教育
全栈工程师, 15, 1, 技术, 后端开发, Coding, 深圳, 本科, 15, 成长型, 数据服务
全栈工程师, 22, 3, 技术, 后端开发, 动动, 北京, 本科, 15, 成长型, 移动互联网 · 医疗健康
全栈开发工程师, 35, 5, 技术, 后端开发, FreeWheel, 北京, 本科, 150, 上市公, 企业服务 · 数据服务
全栈工程师（偏后端）, 20, 1, 技术, 后端开发, 厚步, 上海, 学历不限, 15, 成长型, 移动互联网 · 电子商务
高级全栈工程师, 25, 不, 技术, 高端技术职位, yunba.io云巴, 北京, 本科, 15, 成长型, 移动互联网
全栈工程师, 22, 3, 技术, 后端开发, 买衣爽, 上海, 本科, 50, 成长型, 电子商务 · O2O
全栈工程师, 12, 1, 技术, 后端开发, 游密, 深圳, 本科, 15, 成长型, 移动互联网 · 社交网络
全栈工程师, 4, 不, 技术, 后端开发, 金博士, 石家庄, 本科, 150, 成长型, 移动互联网 · 广告营销
全栈工程师, 21, 3, 技术, 后端开发, 联明投资, 上海, 学历不限, 500, 成熟型, 其他
全栈工程师, 25, 3, 技术, 后端开发, 宜信公司, 北京, 硕士, 2000, 成熟型, 移动互联网 · 金融
全栈开发工程师, 18, 不, 技术, 前端开发, 云居科技, 北京, 本科, 15, 初创型, 生活服务 · 硬件
全栈工程师, 22, 3, 技术, 后端开发, 聚源金融, 杭州, 本科, 15, 初创型, 金融 · 数据服务
全栈工程师, 17, 1, 技术, 后端开发, 希悦, 北京, 学历不限, 15, 初创型, 移动互联网  · 教育
全栈工程师, 24, 不, 技术, 后端开发, 汇米汇, 北京, 学历不限, 15, 初创型, 企业服务 · 金融
全栈工程师, 18, 不, 技术, 后端开发, 苏格, 上海, 学历不限, 15, 成长型, 移动互联网 · 电子商务
全栈工程师, 12, 3, 技术, 后端开发, 青岛礼遇文化传媒有限公司, 青岛, 本科, 15, 初创型, 文化娱乐 · 电子商务
全栈工程师, 22, 不, 技术, 后端开发, 云校, 北京, 本科, 150, 成长型, 教育 · 数据服务
全栈工程师, 19, 3, 技术, 后端开发, 买衣爽, 上海, 本科, 50, 成长型, 电子商务 · O2O
全栈工程师, 10, 1, 技术, 后端开发, 四川店家, 成都, 本科, 50, 成长型, 移动互联网 · 电子商务
全栈工程师, 25, 3, 技术, 后端开发, 咔嚓兄弟, 上海, 本科, 15, 初创型, 移动互联网
全栈工程师, 30, 3, 技术, 后端开发, 说说日历, 上海, 本科, 15, 初创型, 移动互联网 · 数据服务
全栈工程师, 15, 3, 技术, 后端开发, 蜜友, 北京, 大专, 15, 初创型, 移动互联网 · 医疗健康
全栈工程师, 30, 3, 技术, 高端技术职位, OneAPM 蓝海讯通, 北京, 本科, 150, 成熟型, 企业服务 · 数据服务
全栈工程师, 19, 3, 技术, 后端开发, 你有药, 上海, 本科, 15, 成长型, 移动互联网 · 医疗健康
全栈工程师, 15, 不, 技术, 后端开发, 合生基因, 北京, 本科, 15, 初创型, 医疗健康 · 其他
全栈工程师, 10, 不, 技术, 后端开发, 那么社区, 南京, 本科, 50, 初创型, 移动互联网 · 社交网络
全栈工程师（实习）, 2, 不, 技术, 后端开发, 中武科技, 武汉, 本科, 15, 初创型, 移动互联网 · O2O
全栈工程师, 25, 不, 技术, 后端开发, 能量库, 深圳, 学历不限, 15, 成长型, 企业服务 · 其他
全栈工程师, 27, 5, 技术, 移动开发, 达闼科技, 北京, 本科, 50, 成长型, 移动互联网
全栈工程师, 22, 3, 技术, 后端开发, 财未来, 北京, 本科, 15, 成长型, 移动互联网 · 金融
全栈工程师, 20, 1, 技术, 后端开发, 掌门1对1在线教育, 上海, 学历不限, 50, 成长型, 移动互联网 · 教育
全栈工程师, 10, 1, 技术, 后端开发, 领展科技, 广州, 本科, 15, 初创型, 生活服务 · 广告营销
全栈工程师, 20, 3, 技术, 后端开发, 深圳市达摩电子商务有限公司, 深圳, 本科, 50, 初创型, 电子商务
全栈工程师, 27, 3, 技术, 后端开发, 慧影医疗, 北京, 本科, 15, 初创型, 移动互联网 · 医疗健康
全栈工程师, 12, 不, 技术, 后端开发, 孢子社区, 南京, 本科, 15, 初创型, 社交网络
全栈工程师, 35, 3, 技术, 后端开发, 全民贷, 上海, 本科, 15, 成长型, 移动互联网 · 金融
全栈工程师, 16, 1, 技术, 后端开发, 探谋, 上海, 学历不限, 15, 初创型, 移动互联网 · 电子商务
全栈工程师, 20, 1, 技术, 后端开发, 掌门1对1在线教育, 上海, 学历不限, 150, 成长型, 移动互联网 · 教育
全栈工程师, 22, 3, 技术, 后端开发, YellFun, 上海, 本科, 15, 初创型, 移动互联网 · O2O
全栈工程师, 22, 3, 技术, 后端开发, 传世未来, 北京, 本科, 15, 成长型, 移动互联网
全栈工程师, 15, 1, 技术, 后端开发, 爆款易, 杭州, 本科, 15, 初创型, 企业服务 · 数据服务
全栈工程师, 22, 1, 技术, 后端开发, 因途科技, 上海, 学历不限, 15, 初创型, 信息安全 · 硬件
全栈工程师, 15, 3, 技术, 后端开发, 元心科技, 北京, 本科, 150, 成长型, 移动互联网 · 信息安全
全栈工程师, 30, 3, 技术, 后端开发, 麻辣老师, 北京, 本科, 15, 初创型, O2O · 教育
全栈工程师, 17, 不, 技术, 后端开发, 铭育科技, 深圳, 硕士, 15, 初创型, 教育
全栈工程师, 15, 不, 技术, 后端开发, 小桃酱, 上海, 学历不限, 15, 初创型, 移动互联网 · 电子商务
全栈工程师, 8, 不, 技术, 后端开发, 上海千樱信息, 上海, 大专, 15, 初创型, 移动互联网
全栈工程师, 24, 3, 技术, 移动开发, 新东方在线, 北京, 本科, 500, 成熟型, 移动互联网 · 教育
全栈工程师, 22, 1, 技术, 后端开发, 百姓网, 上海, 本科, 50, 成熟型, 移动互联网
全栈工程师, 12, 5, 技术, 后端开发, 艾润物联, 西安, 本科, 50, 初创型, 移动互联网 · 生活服务
全栈工程师, 40, 3, 技术, 高端技术职位, Camelia山茶花, 北京, 学历不限, 15, 初创型, 移动互联网 · 电子商务
全栈工程师, 18, 1, 技术, 后端开发, Ping++, 上海, 本科, 15, 成长型, 企业服务 · 金融
全栈工程师, 30, 3, 技术, 后端开发, 智充, 北京, 学历不限, 15, 初创型, 移动互联网 · O2O
全栈开发工程师, 27, 3, 技术, 前端开发, 北京智慧图, 北京, 学历不限, 150, 成长型, 移动互联网 · 数据服务
全栈工程师, 4, 不, 技术, 后端开发, 传太医, 北京, 本科, 50, 成长型, O2O · 医疗健康
全栈工程师, 8, 3, 技术, 后端开发, 妥妥在线, 厦门, 大专, 15, 初创型, 金融
全栈工程师, 22, 不, 技术, 后端开发, 科技寺, 北京, 学历不限, 50, 成长型, 移动互联网 · 企业服务
全栈工程师, 27, 3, 技术, 后端开发, 面包旅行, 北京, 本科, 50, 成熟型, 移动互联网 · 旅游
全栈工程师, 6, 3, 技术, 后端开发, 映真艺术, 武汉, 本科, 15, 初创型, 电子商务 · O2O
高级全栈工程师, 22, 3, 技术, 移动开发, 帮5买, 上海, 本科, 500, 成熟型, 移动互联网 · 电子商务
全栈工程师, 20, 3, 技术, 高端技术职位, 兰亭集智, 北京, 本科, 15, 初创型, 移动互联网 · 企业服务
全栈工程师, 17, 3, 技术, 企业软件, 量子云, 北京, 本科, 15, 成长型, 移动互联网
全栈工程师, 22, 3, 技术, 后端开发, 上市邦, 深圳, 本科, 15, 成长型, 移动互联网 · 金融
全栈工程师, 18, 1, 技术, 后端开发, 黑格科技, 北京, 本科, 50, 成长型, 企业服务
全栈工程师, 10, 不, 技术, 后端开发, Paires, 北京, 学历不限, 15, 初创型, 移动互联网 · 生活服务
全栈工程师, 15, 3, 技术, 后端开发, 天方恒锐, 北京, 本科, 50, 成长型, 移动互联网 · 企业服务
全栈工程师, 11, 3, 技术, 后端开发, 映真艺术, 上海, 学历不限, 15, 初创型, 电子商务 · O2O
全栈工程师, 20, 3, 技术, 后端开发, 新赛点体育, 北京, 学历不限, 150, 成长型, 文化娱乐
全栈工程师, 9, 不, 技术, 后端开发, Halo, 上海, 学历不限, 15, 初创型, 移动互联网 · 硬件
（高级）全栈工程师, 27, 1, 技术, 前端开发, 美团网, 北京, 本科, 2000, 成熟型, 移动互联网 · O2O
全栈工程师, 4, 不, 技术, 后端开发, 优图优印, 上海, 大专, 15, 初创型, 移动互联网
全栈工程师, 11, 1, 技术, 高端技术职位, 杏林苑, 重庆, 学历不限, 15, 初创型, 移动互联网 · 电子商务
高级软件工程师（全栈）, 22, 3, 技术, 后端开发, OneAPM 蓝海讯通, 北京, 本科, 150, 成熟型, 企业服务 · 数据服务
全栈工程师, 15, 1, 技术, 后端开发, 融通金湾, 北京, 大专, 50, 成长型, 移动互联网 · O2O
全栈工程师, 20, 3, 技术, 后端开发, 宣猿派, 北京, 本科, 15, 初创型, 移动互联网 · 企业服务
全栈工程师（网站团队）, 22, 1, 技术, 后端开发, 百姓网, 上海, 本科, 50, 成熟型, 移动互联网
全栈工程师, 22, 1, 技术, 后端开发, 云集, 北京, 学历不限, 15, 初创型, 企业服务 · 数据服务
全栈工程师, 15, 1, 技术, 后端开发, 校园巴士, 北京, 学历不限, 15, 初创型, 广告营销
全栈工程师, 25, 3, 技术, 后端开发, Acon, 上海, 学历不限, 15, 初创型, 移动互联网 · 企业服务
全栈工程师（偏后台）, 9, 1, 技术, 后端开发, 火火健身, 上海, 学历不限, 15, 初创型, 移动互联网 · 医疗健康
全栈工程师, 15, 3, 技术, 后端开发, Shop123, 杭州, 大专, 15, 初创型, 电子商务
全栈工程师, 22, 3, 技术, 后端开发, 麻辣老师, 北京, 本科, 15, 初创型, O2O · 教育
全栈工程师, 15, 1, 技术, 后端开发, 拍拍贷, 上海, 学历不限, 2000, 成熟型, 金融
全栈工程师, 26, 1, 技术, 后端开发, 零用钱, 北京, 本科, 15, 初创型, 移动互联网 · 广告营销
全栈工程师, 22, 1, 技术, 前端开发, 傲游浏览器, 北京, 学历不限, 150, 成长型, 移动互联网 · 数据服务
全栈工程师, 15, 1, 技术, 后端开发, 施嘉, 上海, 本科, 15, 初创型, 移动互联网 · 电子商务
全栈工程师, 16, 3, 技术, 前端开发, 麦同学, 北京, 本科, 15, 成长型, 电子商务 · 金融
openstack (全栈开发工程师), 20, 5, 技术, 后端开发, 新致软件, 上海, 本科, 2000, 成熟型, 移动互联网 · 数据服务
全栈工程师, 16, 不, 技术, 后端开发, 华兴资本, 北京, 学历不限, 50, 初创型, 金融
全栈工程师, 22, 3, 技术, 后端开发, UNCLE TANG, 上海, 本科, 15, 成长型, 移动互联网 · 电子商务
全栈工程师, 9, 1, 技术, 后端开发, 智络软件成都公司, 成都, 大专, 50, 初创型, 移动互联网 · 电子商务
全栈工程师, 13, 3, 技术, 后端开发, 威威, 广州, 本科, 15, 初创型, 移动互联网 · 硬件
全栈工程师, 7, 1, 技术, 后端开发, 运动说, 东莞, 大专, 15, 初创型, 移动互联网 · 电子商务
全栈工程师, 22, 3, 技术, 后端开发, 宜信公司, 北京, 本科, 2000, 成熟型, 移动互联网 · 金融
全栈工程师, 18, 3, 技术, 后端开发, ITbegin云编程, 杭州, 本科, 15, 初创型, 移动互联网 · 教育
全栈工程师, 9, 不, 技术, 后端开发, 苏州嘉禄讯汇智能科技有限公司, 苏州, 本科, 15, 初创型, 企业服务 · 硬件
全栈工程师, 15, 1, 技术, 后端开发, 爱奇艺, 北京, 本科, 2000, 成熟型, 广告营销 · 文化娱乐
全栈工程师, 8, 1, 技术, 后端开发, 微旋基因, 北京, 本科, 15, 成长型, 医疗健康
全栈工程师, 30, 3, 技术, 前端开发, 阿里巴巴, 北京, 本科, 2000, 上市公, 移动互联网
全栈工程师, 22, 1, 技术, 后端开发, 广州易觅网络科技有限公司, 北京, 学历不限, 15, 初创型, 移动互联网 · O2O
全栈工程师, 15, 不, 技术, 后端开发, 布卡漫画, 广州, 学历不限, 15, 成长型, 其他
大数据全栈工程师（含实习）, 22, 不, 技术, 后端开发, 塔布数据Datatub, 广州, 本科, 15, 成长型, 数据服务
全栈研发工程师, 16, 1, 技术, 前端开发, 奇酷工场, 北京, 本科, 15, 初创型, 游戏
全栈工程师, 15, 3, 技术, 后端开发, Shop123, 杭州, 大专, 15, 初创型, 电子商务
全栈工程师, 11, 3, 技术, 后端开发, 映真艺术, 北京, 学历不限, 15, 初创型, 电子商务 · O2O
全栈工程师, 27, 3, 技术, 后端开发, 绿野网, 北京, 学历不限, 50, 成长型, 旅游
全栈工程师, 11, 1, 技术, 后端开发, 珞布利, 西安, 本科, 15, 初创型, 移动互联网
openstack (全栈开发工程师), 20, 5, 技术, 后端开发, 新致软件, 上海, 本科, 2000, 成熟型, 移动互联网 · 数据服务
全栈工程师, 22, 3, 技术, 后端开发, GA游戏教育, 上海, 本科, 15, 初创型, 教育 · 游戏
全栈工程师, 19, 3, 技术, 后端开发, 融汇天程, 北京, 学历不限, 15, 初创型, 移动互联网 · 企业服务
全栈工程师（偏移动端Web）, 20, 3, 技术, 前端开发, 红火电商, 深圳, 本科, 50, 成长型, 电子商务 · O2O
全栈工程师, 15, 3, 技术, 后端开发, 食客, 上海, 本科, 15, 初创型, 移动互联网
高级全栈工程师, 22, 1, 技术, 高端技术职位, MOGE, 北京, 本科, 15, 初创型, 移动互联网 · 教育
全栈工程师, 9, 1, 技术, 后端开发, 知数科技, 成都, 本科, 15, 初创型, 移动互联网 · 电子商务
全栈工程师, 15, 1, 技术, 后端开发, 中交公规院, 北京, 本科, 500, 上市公, 数据服务
全栈工程师, 7, 1, 技术, 后端开发, TVtalk.cn, 北京, 大专, 15, 初创型, 文化娱乐
全栈工程师, 12, 1, 技术, 后端开发, 宏图创展, 北京, 大专, 15, 初创型, 移动互联网 · O2O
全栈工程师, 22, 3, 技术, 后端开发, Noad, 北京, 本科, 15, 初创型, 移动互联网
全栈工程师, 22, 3, 技术, 后端开发, 盈富斯, 深圳, 学历不限, 15, 成长型, 电子商务
全栈工程师, 17, 1, 技术, 高端技术职位, Ape Crafts, 北京, 本科, 15, 初创型, 移动互联网 · 硬件
全栈工程师, 17, 3, 技术, 后端开发, 东方嘉禾, 北京, 本科, 50, 成长型, 移动互联网 · 文化娱乐
全栈工程师(商城版块）, 27, 1, 技术, 后端开发, 美菜网, 北京, 本科, 2000, 成熟型, 电子商务 · O2O
全栈工程师, 9, 1, 技术, 后端开发, 信果科技, 深圳, 本科, 15, 初创型, 移动互联网 · 电子商务
全栈工程师, 7, 1, 技术, 后端开发, TVtalk.cn, 北京, 学历不限, 15, 初创型, 文化娱乐
全栈工程师, 17, 1, 技术, 后端开发, 问师兄, 北京, 本科, 15, 初创型, 企业服务 · O2O
全栈工程师, 11, 1, 技术, 后端开发, 宏图创展, 北京, 大专, 15, 初创型, 移动互联网 · O2O
Python&amp;全栈工程师, 15, 1, 技术, 后端开发, 中睿天下, 北京, 本科, 50, 成长型, 信息安全 · 其他
全栈工程师, 18, 不, 技术, 后端开发, 爱豌豆生物电商平台, 深圳, 学历不限, 15, 初创型, 医疗健康 · 电子商务
全栈, 22, 不, 技术, 后端开发, 麻辣老师, 北京, 本科, 15, 初创型, O2O · 教育
全栈工程师, 19, 3, 技术, 后端开发, 追追漫画, 北京, 大专, 15, 成长型, 移动互联网 · 社交网络
Web开发全栈工程师, 17, 3, 技术, 后端开发, 盟智软件, 上海, 大专, 50, 初创型, 金融
全栈工程师, 8, 应届毕业, 技术, 前端开发, 金蝶中间件, 深圳, 本科, 2000, 成熟型, 移动互联网 · 企业服务
初级全栈工程师, 15, 不, 技术, 后端开发, 绿野网, 北京, 学历不限, 50, 成长型, 旅游
全栈工程师(.NET MVC Code first或MEAN), 18, 不, 技术, 高端技术职位, 期盛, 上海, 学历不限, 50, 成长型, 移动互联网 · 金融
全栈工程师（node.js工程师）, 17, 3, 技术, 后端开发, 车音网, 北京, 本科, 150, 成熟型, 移动互联网
全栈PHP开发工程师（OA方向）, 12, 1, 技术, 后端开发, 恺英网络, 上海, 大专, 500, 上市公, 移动互联网 · 游戏
高级全栈工程师, 25, 3, 技术, 后端开发, 美团网, 北京, 本科, 2000, 成熟型, 移动互联网 · O2O
全栈实习, 4, 不, 技术, 前端开发, 洋葱数学, 北京, 学历不限, 50, 成长型, 移动互联网 · 教育
大数据全栈工程师, 22, 不, 技术, 后端开发, DataStory, 广州, 本科, 15, 成长型, 数据服务
全栈工程师, 22, 5, 技术, 后端开发, 时尚饰品电商+设计师创业平台, 杭州, 本科, 15, 初创型, 电子商务 · 其他
全栈架构工程师, 30, 5, 技术, 后端开发, 智慧眼, 北京, 学历不限, 150, 成长型, 移动互联网 · 金融
高级全栈开发, 25, 3, 技术, 后端开发, 洋葱数学, 北京, 学历不限, 50, 成长型, 移动互联网 · 教育
广告行业全栈工程师, 15, 不, 技术, 后端开发, ideaology, 北京, 学历不限, 15, 初创型, 企业服务 · 广告营销
核心全栈工程师, 30, 1, 技术, 后端开发, 传太医, 北京, 本科, 50, 成长型, O2O · 医疗健康
全栈开发工程师, 16, 3, 技术, 后端开发, 红象金融, 广州, 学历不限, 15, 初创型, 金融
全栈工程师, 15, 1, 技术, 后端开发, Regan Tech, 杭州, 本科, 15, 初创型, 数据服务 · 金融
Node.js全栈工程师, 22, 3, 技术, 后端开发, 店达信息, 上海, 学历不限, 150, 成长型, 电子商务 · O2O
全栈, 30, 3, 技术, 高端技术职位, 传太医, 北京, 本科, 50, 成长型, O2O · 医疗健康
全栈工程师, 22, 3, 技术, 后端开发, 乐其网络, 杭州, 本科, 500, 成长型, 电子商务
全栈工程师（实习）, 5, 应届毕业, 技术, 移动开发, 云适配, 北京, 本科, 50, 成长型, 移动互联网 · 电子商务
工具团队全栈工程师, 27, 3, 技术, 高端技术职位, 京东商城, 北京, 学历不限, 2000, 上市公, 电子商务
Web全栈开发工程师, 15, 3, 技术, 后端开发, Shop123, 杭州, 大专, 15, 初创型, 电子商务
全栈工程师, 6, 不, 技术, 高端技术职位, 后安, 广州, 学历不限, 15, 初创型, 移动互联网 · O2O
Go开发工程师（全栈工程师）, 22, 1, 技术, 后端开发, 美餐网, 北京, 本科, 500, 成熟型, 电子商务
Java全栈工程师, 15, 3, 技术, 后端开发, 品高软件, 广州, 大专, 500, 成熟型, 移动互联网 · 企业服务
Web全栈工程师, 10, 1, 技术, 移动开发, 博广传媒, 上海, 本科, 15, 成长型, 文化娱乐 · 其他
APP全栈工程师, 7, 1, 技术, 移动开发, 新开普电子, 郑州, 本科, 500, 上市公, 移动互联网
全栈工程师-应届, 9, 应届毕业, 技术, 后端开发, 传太医, 北京, 本科, 50, 成长型, O2O · 医疗健康
.NET全栈, 12, 不, 技术, 后端开发, 一米好地 房产众筹, 上海, 本科, 15, 初创型, 金融
Node全栈工程师, 18, 3, 技术, 后端开发, 车音网, 北京, 本科, 150, 成熟型, 移动互联网
React全栈工程师, 32, 1, 技术, 前端开发, 传太医, 北京, 本科, 50, 成长型, O2O · 医疗健康
Web全栈开发工程师, 15, 3, 技术, 后端开发, Shop123, 杭州, 大专, 15, 初创型, 电子商务
.NET全栈, 12, 3, 技术, 后端开发, 一米好地 房产众筹, 上海, 本科, 15, 初创型, 金融
html5/全栈开发工程师, 15, 3, 技术, 前端开发, 网龙网络有限公司, 厦门, 本科, 2000, 上市公, 移动互联网 · 教育
前端全栈工程师, 16, 1, 技术, 移动开发, 彩云天气, 北京, 本科, 15, 初创型, 移动互联网 · 生活服务
全栈工程师 Node.js, 16, 1, 技术, 后端开发, 多拓世纪, 北京, 本科, 15, 初创型, 移动互联网
Web开发工程师（全栈工程师）, 22, 不, 技术, 前端开发, 美餐网, 北京, 本科, 500, 成熟型, 电子商务
Web 全栈工程师, 22, 5, 技术, 后端开发, IvyMobi, 北京, 本科, 50, 成长型, 移动互联网 · 企业服务
Java全栈工程师, 8, 不, 技术, 后端开发, 起名通, 北京, 本科, 15, 初创型, 文化娱乐
Web全栈开发工程师, 15, 3, 技术, 前端开发, Funplus Game 趣加游戏, 北京, 本科, 150, 成长型, 游戏
Java研发工程师（全栈）, 11, 1, 技术, 后端开发, 点读科技, 杭州, 本科, 50, 成长型, 移动互联网 · 电子商务
全栈攻城狮（系统架构师）, 30, 5, 技术, 后端开发, 飞驰镁物, 北京, 本科, 50, 成长型, 移动互联网 · 数据服务
全干工程师, 15, 1, 技术, 后端开发, 美 ONE, 上海, 本科, 15, 初创型, 移动互联网 · 文化娱乐
前端全栈工程师, 7, 1, 技术, 前端开发, 广州扬名信息科技有限公司, 广州, 大专, 15, 初创型, O2O · 生活服务
资深Node.js／全栈工程师, 24, 3, 技术, 后端开发, Video++, 上海, 本科, 50, 成长型, 数据服务 · 文化娱乐
海外全栈开发工程师, 22, 3, 技术, 前端开发, ptmind, 北京, 本科, 50, 成长型, 移动互联网 · 数据服务
