职位, 工资, 经验要求, 职位一级分类, 职位二级分类, 公司名称, 城市, 学历, 公司规模, 公司阶段, 公司业务领域
无线产品设计师, 27, 3, 产品, 产品设计师, 和创科技, 杭州, 本科, 2000, 上市公, 移动互联网
无线产品设计师（报销面试车费）, 12, 1, 产品, 产品设计师, 么么直播, 上海, 大专, 50, 成长型, 移动互联网 · 社交网络
无线产品设计师, 12, 1, 产品, 产品设计师, 纵横天下, 福州, 本科, 50, 成长型, 移动互联网 · 电子商务
无线产品设计师, 12, 1, 产品, 产品设计师, 周百通科技, 广州, 本科, 15, 成长型, 移动互联网 · O2O
无线产品设计师, 6, 1, 产品, 产品设计师, 吃喝惠州, 惠州, 学历不限, 15, 初创型, 移动互联网
无线产品设计师, 21, 3, 产品, 产品设计师, 买衣爽, 上海, 本科, 50, 成长型, 电子商务 · O2O
无线产品设计师, 9, 1, 产品, 产品设计师, 讯点三维, 杭州, 本科, 15, 初创型, 数据服务 · 硬件
无线产品设计师, 22, 1, 产品, 产品设计师, 脆饼旅行, 杭州, 本科, 15, 成长型, 移动互联网 · 旅游
无线产品设计师, 27, 3, 产品, 产品设计师, 和创科技, 北京, 本科, 2000, 上市公, 移动互联网
无线产品设计师, 12, 3, 产品, 产品设计师, 中彩在线, 北京, 本科, 150, 成长型, 电子商务 · 金融
无线产品设计师, 11, 1, 产品, 产品设计师, 毛遂网, 上海, 学历不限, 15, 初创型, 招聘
无线产品设计师, 13, 1, 产品, 产品设计师, 龙席, 杭州, 学历不限, 150, 成长型, 电子商务
无线产品设计师, 5, 1, 产品, 产品设计师, 爱加公司, 南宁, 大专, 50, 初创型, O2O
无线产品设计师, 7, 1, 产品, 产品设计师, 漫联, 北京, 大专, 15, 成长型, 游戏 · 文化娱乐
无线产品设计师, 11, 3, 产品, 产品设计师, 奇象理财, 北京, 大专, 15, 初创型, 移动互联网 · 金融
无线产品设计师, 10, 1, 产品, 产品设计师, 麦豆科技, 北京, 大专, 50, 成长型, 移动互联网
无线产品设计师, 17, 3, 产品, 产品设计师, 凯斯美, 北京, 学历不限, 15, 初创型, 移动互联网 · O2O
无线产品设计师, 11, 1, 产品, 产品设计师, 见达网络, 上海, 学历不限, 15, 成长型, 移动互联网 · 电子商务
无线产品设计师, 10, 1, 产品, 产品设计师, 巴乐兔, 上海, 大专, 50, 初创型, 移动互联网
无线产品设计师, 20, 不, 产品, 产品设计师, 融360, 北京, 本科, 500, 成熟型, 移动互联网 · 金融
无线产品设计师, 12, 1, 产品, 产品设计师, 织天网络, 杭州, 学历不限, 15, 初创型, 移动互联网 · O2O
无线产品设计师, 12, 1, 产品, 产品设计师, 北京画画的人科技有限公司, 北京, 学历不限, 15, 初创型, 移动互联网 · 社交网络
无线产品设计师, 7, 1, 产品, 产品设计师, 上海鲁朗网络科技有限公司, 上海, 学历不限, 150, 初创型, 移动互联网 · 游戏
无线产品设计师, 7, 不, 产品, 产品设计师, 妈妈外卖, 厦门, 学历不限, 15, 初创型, O2O
无线产品设计师, 6, 1, 产品, 产品设计师, 优蓓教育, 郑州, 本科, 50, 成长型, 移动互联网 · 教育
无线产品设计师, 9, 1, 产品, 产品设计师, 京瑞, 成都, 大专, 15, 初创型, 移动互联网 · 电子商务
无线产品设计师, 12, 1, 产品, 产品设计师, 鸡窝网, 北京, 本科, 15, 初创型, 移动互联网 · 电子商务
无线产品设计师, 10, 不, 产品, 产品设计师, 宣牛网络, 杭州, 大专, 15, 初创型, 移动互联网 · 电子商务
无线产品设计师, 11, 3, 产品, 产品设计师, 植华品牌设计公司, 深圳, 大专, 15, 初创型, 电子商务 · 其他
无线产品设计师, 8, 3, 产品, 产品设计师, 油联石化, 北京, 本科, 50, 初创型, 移动互联网
无线产品设计师, 10, 1, 产品, 产品设计师, 知网, 北京, 本科, 2000, 上市公, 移动互联网 · 电子商务
无线产品设计师, 10, 不, 产品, 产品设计师, 魔方盒子, 北京, 学历不限, 15, 初创型, 移动互联网 · 电子商务
无线产品设计师, 22, 3, 产品, 产品设计师, 今聿科技, 北京, 本科, 15, 初创型, 电子商务 · 移动互联网
无线产品设计师, 22, 3, 产品, 产品设计师, 安邦保险集团 邦融汇, 北京, 本科, 2000, 成熟型, 金融
无线产品设计师, 17, 1, 产品, 产品设计师, 139ME, 北京, 学历不限, 15, 初创型, 移动互联网
无线产品设计师, 9, 1, 产品, 产品设计师, 轩然教育科技, 北京, 大专, 15, 初创型, 移动互联网 · 教育
无线产品设计师（康桥e家）, 9, 1, 产品, 产品设计师, 康桥网络, 深圳, 本科, 15, 初创型, 移动互联网 · 医疗健康
无线产品设计师, 7, 1, 产品, 产品设计师, 云狐时代, 北京, 本科, 150, 成长型, 移动互联网
无线产品设计师, 12, 1年以, 产品, 产品设计师, 嘉芸汇, 北京, 学历不限, 15, 初创型, 企业服务
无线产品设计师, 15, 3, 产品, 产品设计师, 北京九龙蓝海科技有限公司, 北京, 大专, 150, 成长型, 移动互联网
无线产品设计师, 9, 1年以, 产品, 产品设计师, 北京首映时光科技有限公司, 北京, 本科, 15, 成长型, 移动互联网
设计, 15, 5, 设计, 交互设计, 智慧芽, 苏州, 本科, 150, 成长型, 移动互联网
空间设计师, 15, 3, 设计, 视觉设计, OPPO, 深圳, 本科, 2000, 成熟型, 移动互联网
高级设计师, 10, 1, 设计, 高端设计职位, 挖豆app, 厦门, 本科, 15, 成长型, 移动互联网
设计Leader, 22, 3, 设计, 高端设计职位, 创新谷, 深圳, 学历不限, 150, 初创型, 移动互联网
设计师, 15, 1, 设计, 视觉设计, 房多多, 上海, 本科, 2000, 成熟型, 移动互联网  · 电子商务
产品包装设计, 11, 1, 设计, 视觉设计, 猛联科技, 广州, 本科, 15, 初创型, 移动互联网
高级设计师, 22, 3, 设计, 视觉设计, 房多多, 上海, 本科, 2000, 成熟型, 移动互联网  · 电子商务
产品包装设计, 6, 5, 设计, 视觉设计, 宠宠熊, 上海, 大专, 150, 成长型, 电子商务
安防规划设计师, 17, 5, 设计, 高端设计职位, 大横琴科技, 珠海, 本科, 50, 成长型, 企业服务 · 数据服务
人像设计师, 5, 不, 设计, 视觉设计, 落地创意, 武汉, 大专, 150, 成长型, 电子商务 · 数据服务
产品包装设计, 6, 3, 设计, 视觉设计, 宠宠熊, 上海, 本科, 150, 成长型, 电子商务
设计师, 4, 不, 设计, 高端设计职位, 物联传感, 深圳, 大专, 500, 成长型, 电子商务 · 硬件
资深设计师（电商）, 7, 3, 设计, 视觉设计, 易积电器, 广州, 大专, 150, 成熟型, 移动互联网 · 电子商务
高级设计师, 6, 3, 设计, 高端设计职位, 西安际宇星, 西安, 学历不限, 15, 初创型, 移动互联网
高级设计师, 20, 3, 设计, 高端设计职位, 一号货车, 上海, 大专, 500, 成长型, 移动互联网 · O2O
食品包装设计师, 11, 3, 设计, 视觉设计, 两鲜, 上海, 大专, 150, 成长型, 电子商务
设计产品专员, 9, 1, 运营, 运营, 特赞|Tezign, 上海, 本科, 15, 初创型, 移动互联网
高级设计师, 10, 1, 设计, 视觉设计, 心宝一百, 北京, 大专, 50, 成长型, 电子商务
主设计师, 15, 3, 设计, 视觉设计, Voyageone, 上海, 本科, 150, 成长型, 电子商务
设计师, 6, 3, 设计, 视觉设计, 233网校, 长沙, 大专, 150, 初创型, 移动互联网 · 教育
AE设计师, 11, 1, 设计, 视觉设计, 泛微, 上海, 大专, 500, 成熟型, 移动互联网 · 企业服务
高级设计师, 14, 5, 设计, 视觉设计, 维拓利亚, 深圳, 本科, 15, 初创型, 数据服务 · 其他
设计师助理（动画）, 2, 应届毕业, 设计, 视觉设计, 墨齐, 深圳, 本科, 15, 成长型, 移动互联网 · 教育
旅行设计师（欧洲）, 12, 不, 运营, 编辑, 指南猫, 上海, 学历不限, 15, 成长型, 移动互联网 · 旅游
资深设计师, 7, 3, 设计, 视觉设计, 星爵互动, 合肥, 本科, 15, 初创型, 移动互联网
旅行设计师（北美）, 11, 不, 运营, 编辑, 指南猫, 上海, 学历不限, 15, 成长型, 移动互联网 · 旅游
主设计师（平面设计师）, 15, 3, 产品, 高端产品职位, Voyageone, 上海, 本科, 150, 成长型, 电子商务
包装设计师, 6, 5, 设计, 视觉设计, 宠宠熊, 上海, 大专, 150, 成长型, 电子商务
习题设计师, 11, 3, 运营, 编辑, 洋葱数学, 北京, 本科, 50, 成长型, 移动互联网 · 教育
资深网站设计师, 11, 1, 产品, 产品设计师, 两鲜, 上海, 大专, 150, 成长型, 电子商务
设计师, 7, 3, 设计, 视觉设计, 大骏文化, 上海, 大专, 50, 上市公, 文化娱乐
运营设计师, 30, 3, 设计, 视觉设计, 房多多, 上海, 本科, 2000, 成熟型, 移动互联网 · O2O
无线产品, 7, 不, 产品, 产品设计师, 威势空天, 成都, 本科, 15, 初创型, 信息安全 · 硬件
美术编辑设计师（AI）, 7, 1, 设计, 视觉设计, POP时尚网络机构, 上海, 大专, 500, 成长型, 移动互联网 · 电子商务
旅行设计师（日本）, 12, 不, 运营, 编辑, 指南猫, 上海, 学历不限, 15, 成长型, 移动互联网 · 旅游
旅行设计师（东南亚）, 12, 不, 运营, 编辑, 指南猫, 上海, 学历不限, 15, 成长型, 移动互联网 · 旅游
图文编辑设计师, 6, 1, 运营, 编辑, 蓝月亮, 广州, 大专, 2000, 成熟型, 生活服务
三维设计师, 5, 1, 设计, 视觉设计, 易家纺, 杭州, 大专, 15, 初创型, 电子商务
特效设计师, 9, 1, 设计, 视觉设计, 多拍科技, 深圳, 学历不限, 15, 初创型, 移动互联网 · 社交网络
高级设计师, 12, 1, 设计, 视觉设计, 师徒部落, 广州, 大专, 50, 初创型, 移动互联网 · 社交网络
动态设计师, 15, 1, 设计, 视觉设计, 妙计旅行, 北京, 本科, 50, 成长型, 旅游
助理设计师, 9, 3, 产品, 产品设计师, 招商自贸商城, 深圳, 本科, 2000, 成熟型, 电子商务 · O2O
资深设计师, 8, 3, 设计, 视觉设计, 引导美, 深圳, 大专, 150, 初创型, 移动互联网 · 电子商务
高级设计师, 11, 1, 设计, 高端设计职位, 招商自贸商城, 深圳, 本科, 2000, 成熟型, 电子商务 · O2O
高级设计师, 19, 3, 设计, 视觉设计, 威阔（Trustlook）, 杭州, 本科, 15, 初创型, 移动互联网
眼镜设计师, 14, 1, 设计, 视觉设计, 明月眼镜, 上海, 本科, 500, 成长型, O2O · 医疗健康
淘宝天猫设计师, 11, 3, 设计, 视觉设计, 正邦创意, 上海, 大专, 500, 成熟型, 移动互联网 · 广告营销
包装设计师, 12, 不, 设计, 视觉设计, 吃饭儿, 北京, 本科, 150, 成长型, 电子商务 · 企业服务
设计师, 6, 1, 设计, 视觉设计, 御泥坊, 长沙, 大专, 500, 成长型, 电子商务
资深设计师, 11, 3, 设计, 视觉设计, 星密码集团, 成都, 本科, 150, 成长型, 移动互联网 · 电子商务
时尚设计师, 17, 3, 设计, 高端设计职位, Tapole, 深圳, 学历不限, 15, 初创型, 电子商务 · O2O
空间设计师, 5, 不, 设计, 视觉设计, 课外喵, 广州, 大专, 50, 成长型, O2O · 教育
设计师, 12, 3, 设计, 高端设计职位, 亿瞻健康, 上海, 本科, 15, 初创型, 移动互联网 · 医疗健康
资深运营设计师, 22, 3, 设计, 视觉设计, 房多多, 上海, 本科, 2000, 成熟型, 移动互联网 · O2O
设计师, 4, 不, 设计, 视觉设计, AltaMob, 郑州, 学历不限, 15, 初创型, 移动互联网
视频设计师, 12, 不, 设计, 视觉设计, TP-LINK, 深圳, 本科, 2000, 成熟型, 硬件
插画设计师, 8, 1, 设计, 视觉设计, 善金科技, 合肥, 大专, 150, 初创型, 移动互联网 · O2O
外包装设计师, 7, 1, 设计, 视觉设计, 十月妈咪, 上海, 本科, 500, 成长型, 电子商务
插画设计师（动画/道具）, 11, 不, 设计, 视觉设计, MiLook, 上海, 学历不限, 15, 初创型, 移动互联网 · 文化娱乐
空间设计师, 7, 1, 设计, 视觉设计, TT快车, 深圳, 大专, 150, 成长型, 移动互联网 · O2O
资深设计师, 12, 3, 设计, 视觉设计, 金时堂科技, 深圳, 大专, 50, 成长型, 电子商务 · 社交网络
门店设计师, 5, 1, 设计, 视觉设计, 广东三维家信息科技有限公司, 梅州, 大专, 150, 成长型, 移动互联网 · 硬件
UX设计师, 13, 5, 设计, 视觉设计, 旺旺集团火热招聘, 上海, 大专, 2000, 成熟型, 电子商务 · 社交网络
资深互动设计师, 7, 1, 设计, 视觉设计, 扬悦博众, 广州, 本科, 50, 初创型, 移动互联网 · 企业服务
GUI设计师, 6, 1, 设计, 视觉设计, 启云软件, 合肥, 大专, 50, 初创型, 移动互联网
UE设计师, 22, 3, 设计, 交互设计, 云鸟科技, 北京, 本科, 150, 成长型, 移动互联网 · O2O
资深电商设计师, 20, 5, 设计, 视觉设计, 正邦创意, 上海, 大专, 500, 成熟型, 移动互联网 · 广告营销
UI 设计师, 15, 1, 设计, 视觉设计, Dingtone, 杭州, 本科, 50, 成熟型, 移动互联网 · 社交网络
资深设计师（互动／平面）, 6, 3, 设计, 视觉设计, 华扬联众数字技术股份有限公司, 长沙, 大专, 2000, 成熟型, 移动互联网 · 广告营销
资深空间设计师, 7, 1, 设计, 视觉设计, 申众茂林, 上海, 本科, 150, 初创型, 企业服务 · 广告营销
游戏动作设计师, 12, 3, 设计, 视觉设计, 七月科技, 杭州, 大专, 15, 初创型, 游戏
高级设计师, 6, 1年以, 设计, 视觉设计, 威阔（Trustlook）, 杭州, 本科, 15, 初创型, 移动互联网
资深UE设计师, 17, 3, 设计, 用户研究, 华邦股份, 深圳, 本科, 150, 初创型, 移动互联网 · 数据服务
视觉效果设计师, 12, 3, 设计, 视觉设计, 胡杨风, 北京, 大专, 50, 初创型, 移动互联网 · 广告营销
可视化设计师, 10, 1, 设计, 视觉设计, 新华网, 北京, 本科, 500, 成熟型, 移动互联网 · 文化娱乐
资深特效设计师, 17, 5, 设计, 视觉设计, 37游戏, 广州, 本科, 500, 上市公, 游戏
视觉传达设计师, 7, 1, 设计, 视觉设计, 天谷, 杭州, 大专, 50, 成长型, 移动互联网 · 信息安全
高级设计师, 15, 3, 设计, 视觉设计, 云财经, 深圳, 本科, 15, 成长型, 金融 · 数据服务
总设计师, 22, 3, 设计, 视觉设计, 威阔（Trustlook）, 杭州, 本科, 15, 初创型, 移动互联网
产品规划设计师, 22, 3, 产品, 产品设计师, 新智, 北京, 学历不限, 500, 上市公, 移动互联网
空间设计师, 7, 1, 设计, 视觉设计, 申众茂林, 上海, 本科, 150, 初创型, 企业服务 · 广告营销
设计师, 3, 应届毕业, 设计, 视觉设计, M2MIND, 上海, 学历不限, 15, 初创型, 移动互联网
周边设计师, 3, 不, 设计, 视觉设计, 次元仓, 广州, 本科, 50, 成长型, 电子商务
包装设计师, 7, 3, 产品, 产品设计师, 斯越科技, 广州, 大专, 50, 初创型, 移动互联网 · 电子商务
空间设计师, 11, 1, 设计, 视觉设计, 天宴SHOW, 上海, 大专, 50, 成长型, 文化娱乐 · 移动互联网
GUI设计师, 15, 3, 设计, 视觉设计, 兔展RabbitPre, 深圳, 本科, 50, 成长型, 移动互联网
设计师, 6, 不, 设计, 高端设计职位, 中联网仓科技有限公司杭州分公司, 杭州, 本科, 500, 成长型, 电子商务 · 企业服务
培训设计师, 7, 3, 职能, 人力资源, ZTO-express, 上海, 大专, 2000, 成长型, 电子商务
眼镜设计师, 13, 3, 产品, 产品设计师, 必要商城, 上海, 本科, 50, 成长型, 电子商务
资深 App 设计师, 22, 1, 设计, 高端设计职位, 火球科技, 杭州, 学历不限, 15, 初创型, 移动互联网 · 电子商务
设计师, 7, 应届毕业, 设计, 视觉设计, 什么值得买, 北京, 大专, 150, 成长型, 电子商务 · 文化娱乐
UE设计师, 15, 3, 设计, 交互设计, 云鸟科技, 北京, 本科, 150, 成长型, 移动互联网 · O2O
设计师, 6, 不, 设计, 视觉设计, 太平洋网络科技有限公司, 北京, 大专, 500, 上市公, 电子商务 · 生活服务
漫画原画设计师, 6, 1, 设计, 视觉设计, 广州邢帅教育科技有限公司, 广州, 大专, 500, 成长型, 电子商务 · 教育
设计师, 10, 1, 设计, 视觉设计, 隐食家, 上海, 学历不限, 15, 成长型, 移动互联网
新媒体设计师, 5, 不, 产品, 产品设计师, 夏浪科技, 珠海, 大专, 15, 初创型, 移动互联网 · 电子商务
ID设计师, 15, 3, 产品, 产品设计师, MaxMax, 北京, 本科, 15, 成长型, 移动互联网 · 硬件
设计师（市场）, 8, 1, 设计, 视觉设计, 波罗蜜, 上海, 大专, 50, 成长型, 电子商务
设计师, 15, 不, 设计, 视觉设计, 搜狐媒体, 北京, 本科, 2000, 上市公, 移动互联网 · 广告营销
动漫设计师, 9, 1, 设计, 视觉设计, 融贯资讯, 武汉, 大专, 150, 成长型, 电子商务 · 医疗健康
交互 设计师, 7, 1, 设计, 交互设计, 鼎师科技, 武汉, 大专, 50, 成熟型, 移动互联网 · 分类信息
包装设计师（番禺）, 15, 不, 设计, 视觉设计, 伊的家, 广州, 本科, 150, 初创型, 电子商务
电商设计师, 20, 3, 设计, 视觉设计, 正邦创意, 上海, 大专, 500, 成熟型, 移动互联网 · 广告营销
高级设计师, 20, 3, 设计, 高端设计职位, 云财经, 深圳, 本科, 15, 成长型, 金融 · 数据服务
手绘设计师, 4, 不, 设计, 视觉设计, 育儿网, 南京, 本科, 150, 上市公, 医疗健康 · 生活服务
资深设计师, 7, 1, 设计, 视觉设计, 夏唐科技, 北京, 本科, 150, 成长型, 社交网络 · 广告营销
高级设计师, 18, 5, 设计, 视觉设计, 云财经, 深圳, 大专, 15, 成长型, 移动互联网 · 金融
手绘设计师, 11, 1, 设计, 视觉设计, 甭纠结, 上海, 本科, 15, 成长型, 移动互联网 · 社交网络
（笔头网） 交互 设计师, 7, 1, 设计, 交互设计, 鼎师科技, 武汉, 大专, 50, 成熟型, 移动互联网 · 分类信息
动漫设计师, 9, 1, 设计, 视觉设计, 广东酷乐, 东莞, 大专, 50, 初创型, 游戏 · 文化娱乐
资深设计师, 7, 1, 设计, 视觉设计, 智在创熠, 广州, 学历不限, 15, 初创型, 广告营销
设计师（市场部）, 4, 1年以, 设计, 视觉设计, Codrim, 广州, 本科, 15, 初创型, 移动互联网 · 广告营销
设计师, 11, 3, 设计, 视觉设计, 深圳八零赞电子商务有限公司, 深圳, 本科, 15, 成长型, 移动互联网 · 电子商务
高级设计师, 25, 3, 设计, 视觉设计, 搜狐媒体, 北京, 本科, 2000, 上市公, 移动互联网 · 广告营销
空间设计师, 9, 3, 设计, 视觉设计, 凡拓, 深圳, 大专, 500, 上市公, 文化娱乐
电商设计师（天河北）, 7, 1, 设计, 视觉设计, 有宠科技, 广州, 本科, 500, 成熟型, 移动互联网 · 社交网络
总设计师, 22, 3, 设计, 交互设计, 威阔（Trustlook）, 杭州, 本科, 15, 初创型, 移动互联网
角色设计师, 2, 不, 设计, 视觉设计, 江苏矽岸, 南京, 本科, 50, 初创型, 游戏
设计师（实习/储备）, 1, 应届毕业, 设计, 视觉设计, 太平洋网络科技有限公司, 广州, 大专, 500, 上市公, 电子商务 · 生活服务
UI 设计师, 9, 3, 设计, 视觉设计, 甜派, 上海, 本科, 50, 成长型, 移动互联网 · O2O
互动设计师, 9, 1, 设计, 交互设计, 文创立合, 上海, 本科, 15, 初创型, 电子商务 · 广告营销
需求设计师, 11, 1, 产品, 产品设计师, 云创, 深圳, 本科, 15, 成长型, 移动互联网
包装设计师, 14, 不, 设计, 视觉设计, 吃饭儿, 北京, 本科, 150, 成长型, 电子商务 · 企业服务
设计师, 12, 1, 设计, 视觉设计, 云财经, 深圳, 大专, 15, 成长型, 金融 · 数据服务
运营设计师, 15, 1, 设计, 视觉设计, 房多多, 上海, 本科, 2000, 成熟型, 移动互联网 · O2O
设计师, 10, 1, 设计, 视觉设计, 汉驭文化, 杭州, 大专, 15, 初创型, 移动互联网 · 电子商务
原画设计师, 8, 1, 设计, 视觉设计, 热岛科技, 重庆, 大专, 50, 成长型, 移动互联网 · 游戏
互动设计师, 9, 1, 设计, 视觉设计, 电鳗互动传媒, 上海, 本科, 15, 初创型, 移动互联网 · 广告营销
设计师, 5, 3, 设计, 视觉设计, 江小白, 重庆, 大专, 150, 成长型, 电子商务
APPUI/UX设计师, 15, 1, 设计, 视觉设计, 英坦网络, 杭州, 本科, 50, 成长型, 移动互联网
视频设计师（2D/3D）, 15, 1, 设计, 视觉设计, 美刻, 北京, 大专, 15, 成长型, 文化娱乐 · 移动互联网
设计师, 7, 1, 设计, 视觉设计, M2MIND, 上海, 学历不限, 15, 初创型, 移动互联网
交互 设计师, 19, 1, 设计, 交互设计, 买买提互联网金融, 深圳, 大专, 50, 成长型, 金融
高级无线产品设计师, 20, 3, 产品, 产品设计师, 融360, 北京, 本科, 500, 成熟型, 移动互联网 · 金融
动效设计师, 12, 1, 设计, 视觉设计, 艾艺设计, 上海, 大专, 50, 初创型, 移动互联网
PPT设计师, 5, 1, 设计, 视觉设计, 游酷科技, 合肥, 大专, 15, 初创型, 移动互联网
设计师, 10, 1, 设计, 视觉设计, 微星火科技, 深圳, 学历不限, 15, 成长型, 移动互联网
美编设计师（2D/3D）, 6, 1, 设计, 视觉设计, 达新 | 探宝 | 智检, 广州, 学历不限, 150, 成长型, 移动互联网
UE设计师, 10, 不, 设计, 视觉设计, 西安际宇星, 西安, 学历不限, 15, 初创型, 移动互联网
资深设计师, 9, 3, 设计, 视觉设计, 和智传信, 北京, 本科, 50, 初创型, 移动互联网 · 广告营销
高级运维设计师, 15, 3, 技术, 运维, 怡亚通, 深圳, 学历不限, 2000, 上市公, 电子商务 · O2O
概念设计师, 6, 不, 设计, 视觉设计, 中国邮电器材, 北京, 本科, 2000, 成熟型, 移动互联网 · 电子商务
GUI设计师, 14, 3, 设计, 视觉设计, 呀苹果, 北京, 大专, 50, 成长型, 电子商务
资深设计师, 8, 3, 设计, 视觉设计, 和智传信, 北京, 本科, 50, 初创型, 移动互联网 · 广告营销
电商设计师（青岛，可实习）, 5, 不, 设计, 视觉设计, 正邦创意, 青岛, 大专, 500, 成熟型, 移动互联网 · 广告营销
高级设计师, 12, 不, 设计, 视觉设计, 搜狐媒体, 北京, 本科, 2000, 上市公, 移动互联网 · 广告营销
包装结构、编辑设计师, 8, 不, 设计, 视觉设计, TP-LINK, 深圳, 本科, 2000, 成熟型, 硬件
APP特效设计师, 12, 1, 设计, 视觉设计, 多拍科技, 深圳, 大专, 15, 初创型, 移动互联网 · 社交网络
资深动画/动作设计师, 22, 3, 设计, 视觉设计, 网易游戏, 广州, 学历不限, 2000, 上市公, 游戏
电商设计师, 12, 1, 设计, 视觉设计, 正邦创意, 北京, 大专, 500, 成熟型, 移动互联网 · 广告营销
UX设计师, 13, 1, 设计, 视觉设计, 震野科技, 杭州, 学历不限, 150, 上市公, 移动互联网 · 企业服务
3D设计师, 11, 3, 技术, 项目管理, 马良行, 上海, 大专, 50, 成长型, 移动互联网 · 电子商务
用户体验设计师, 14, 1, 设计, 用户研究, CVTE, 广州, 本科, 500, 成熟型, 数据服务 · 硬件
高级UE设计师, 11, 3, 设计, 交互设计, 明源软件, 武汉, 大专, 500, 上市公, 移动互联网 · 企业服务
设计师, 6, 不, 设计, 视觉设计, 谊游, 广州, 大专, 150, 成长型, 游戏
资深运营设计师, 22, 3, 设计, 视觉设计, 房多多, 上海, 本科, 2000, 成熟型, 移动互联网 · O2O
电商设计师, 10, 1, 设计, 视觉设计, 正邦创意, 北京, 大专, 500, 成熟型, 移动互联网 · 广告营销
互动设计师, 5, 1, 设计, 视觉设计, Moonbasa梦芭莎, 广州, 本科, 500, 成熟型, 移动互联网 · 电子商务
中级设计师, 8, 1, 设计, 视觉设计, 万丈网络, 广州, 本科, 50, 初创型, 移动互联网 · 电子商务
3D设计师, 4, 1, 设计, 视觉设计, 广州市怡大广告设计有限公司, 广州, 大专, 500, 成熟型, 生活服务 · 移动互联网
产品包装设计师, 7, 不, 设计, 视觉设计, Let's 新城记, 北京, 本科, 15, 初创型, 广告营销 · 文化娱乐
游戏视频设计师, 15, 3, 设计, 视觉设计, 智明星通, 北京, 学历不限, 500, 上市公, 移动互联网 · 游戏
电商设计师, 12, 1, 设计, 视觉设计, 正邦创意, 北京, 大专, 500, 成熟型, 移动互联网 · 广告营销
设计师, 9, 1, 设计, 视觉设计, 若水医生, 成都, 本科, 15, 成长型, 移动互联网 · 医疗健康
用户体验设计师(UI&amp;UX设计师), 30, 1, 设计, 用户研究, 房多多, 上海, 本科, 2000, 成熟型, 移动互联网 · O2O
分析设计师, 11, 3, 技术, 高端技术职位, 同望科技, 珠海, 本科, 150, 上市公, 移动互联网 · 数据服务
花型设计师, 7, 1, 设计, 视觉设计, 搜芽, 广州, 学历不限, 50, 初创型, 移动互联网 · O2O
2D角色高级设计师, 15, 不, 设计, 视觉设计, 网龙网络有限公司, 福州, 学历不限, 2000, 上市公, 移动互联网 · 教育
交互体验设计师, 7, 1, 设计, 交互设计, iyooyoo, 上海, 大专, 15, 初创型, 移动互联网 · 旅游
图像编辑/设计师, 5, 不, 设计, 视觉设计, 琪柯玛, 苏州, 学历不限, 50, 上市公, 电子商务
设计师（重构）, 13, 3, 设计, 高端设计职位, FORMAX金融圈, 深圳, 本科, 500, 成长型, 移动互联网 · 金融
设计师, 4, 不, 设计, 视觉设计, 三维聚源, 北京, 大专, 15, 初创型, 企业服务 · 数据服务
手机游戏特效设计师, 6, 不, 设计, 视觉设计, 七月科技, 杭州, 学历不限, 15, 初创型, 游戏
