o2o运营总监, 24, 5, 运营, 高端运营职位, 近邻宝, 北京, 本科, 150, 成长型, 移动互联网 · 电子商务
产品运营总监, 10, 3, 运营, 运营, 湖南易车通科技服务开发有限公司, 长沙, 大专, 15, 初创型, 移动互联网 · O2O
线上运营总监, 22, 1, 技术, 后端开发, 云丛科技, 深圳, 学历不限, 15, 成长型, 移动互联网
线上运营总监, 22, 3, 运营, 高端运营职位, 摩柚生活技术有限公司, 深圳, 学历不限, 50, 成长型, 移动互联网 · 电子商务
网络运营总监, 25, 5, 运营, 运营, 夏拉杜, 深圳, 本科, 15, 初创型, 电子商务 · 旅游
电商平台运营总监, 35, 5, 运营, 高端运营职位, 快好味, 北京, 本科, 15, 成长型, 移动互联网 · O2O
线上运营总监, 22, 3, 运营, 高端运营职位, 劲马奥通, 深圳, 大专, 15, 成长型, 移动互联网 · 电子商务
APP运营总监, 20, 3, 运营, 运营, 快约, 北京, 大专, 15, 成长型, 移动互联网
app运营总监, 32, 5, 运营, 高端运营职位, 趣医网, 上海, 本科, 500, 成长型, 移动互联网 · 医疗健康
线上运营总监, 30, 1, 运营, 运营, 云丛科技, 深圳, 学历不限, 15, 成长型, 移动互联网
品牌运营总监, 12, 5, 市场与销售, 公关, 重庆鸿巨网络科技有限公司, 重庆, 本科, 50, 初创型, 移动互联网 · 电子商务
线上运营总监, 22, 3, 运营, 高端运营职位, 劲马奥通, 深圳, 学历不限, 15, 成长型, 移动互联网 · 电子商务
线下运营总监, 30, 1, 运营, 运营, 云丛科技, 深圳, 学历不限, 15, 成长型, 移动互联网
电商平台运营总监, 19, 3, 运营, 高端运营职位, 么么嗖, 深圳, 本科, 150, 成长型, 移动互联网 · 电子商务
广告运营总监, 34, 5, 运营, 高端运营职位, 美团网, 北京, 本科, 2000, 成熟型, 移动互联网 · O2O
项目运营总监（NGO）, 22, 不, 运营, 高端运营职位, 浙大网新科技股份有限公司, 北京, 本科, 2000, 上市公, 企业服务  · 数据服务
高级运营总监（广告方向）, 33, 5, 运营, 运营, 美团网, 北京, 本科, 2000, 成熟型, 移动互联网 · O2O
产品运营总监, 17, 3, 运营, 运营, 波普汉语网, 北京, 硕士, 50, 成长型, 移动互联网 · 电子商务
移动互联网运营总监, 3, 1, 运营, 高端运营职位, 倍亚得, 上海, 本科, 50, 上市公, 移动互联网
产品运营总监（少儿教育）, 10, 3, 产品, 高端产品职位, 高提士, 广州, 本科, 15, 初创型, 移动互联网 · O2O
商城运营总监, 40, 3, 运营, 运营, 城商行, 上海, 本科, 50, 初创型, 金融
电商平台运营总监/经理, 19, 5, 运营, 运营, 么么嗖, 深圳, 本科, 150, 成长型, 移动互联网 · 电子商务
互联网运营总监, 30, 5, 技术, 高端技术职位, 中国品尚网, 广州, 本科, 50, 成长型, 电子商务 · 企业服务
微信运营总监, 20, 3, 运营, 高端运营职位, 广东正品信息科技有限公司, 广州, 学历不限, 50, 初创型, 移动互联网
线上运营总监, 22, 3, 运营, 高端运营职位, 云丛科技, 深圳, 学历不限, 15, 成长型, 移动互联网
汽车产品运营总监, 22, 3, 运营, 运营, 财路通, 北京, 本科, 500, 初创型, 金融
社群用户运营总监, 21, 5, 运营, 高端运营职位, 牛社【蓝色光标】, 北京, 本科, 15, 上市公, 移动互联网 · 电子商务
网站运营总监, 22, 5, 运营, 运营, 惊浪, 上海, 本科, 150, 成熟型, 电子商务
微信运营总监, 12, 3, 运营, 高端运营职位, 深圳市保利物业管理集团有限公司, 深圳, 本科, 2000, 成熟型, 电子商务 · 生活服务
商家运营总监, 30, 3, 运营, 运营, 爱街, 北京, 本科, 50, 成长型, 移动互联网 · O2O
移动互联网运营总监, 12, 1, 运营, 高端运营职位, 倍亚得, 杭州, 本科, 50, 上市公, 移动互联网
线上运营总监, 22, 1, 运营, 运营, 劲马奥通, 深圳, 学历不限, 15, 成长型, 移动互联网 · 电子商务
互联网运营总监/经理, 11, 1, 运营, 运营, 创联互通, 成都, 大专, 15, 初创型, 移动互联网 · 电子商务
线下运营总监, 22, 1, 运营, 运营, 云丛科技, 深圳, 大专, 15, 成长型, 移动互联网
网站运营总监, 15, 1, 运营, 运营, 同筹网, 上海, 本科, 50, 初创型, 金融
社区运营总监, 20, 3, 运营, 运营, 上汽阿里, 上海, 本科, 150, 成长型, 移动互联网 · 生活服务
线上运营总监, 22, 1, 技术, 后端开发, 劲马奥通, 深圳, 学历不限, 15, 成长型, 移动互联网 · 电子商务
招商运营总监, 7, 不, 市场与销售, 市场/营销, 人人投, 深圳, 学历不限, 150, 成长型, 移动互联网 · 金融
亚马逊运营总监, 21, 3, 运营, 高端运营职位, Mylord, 深圳, 本科, 15, 初创型, 招聘
网络运营总监, 20, 5, 运营, 运营, 中安德信（北京）, 北京, 本科, 50, 成长型, 移动互联网 · 企业服务
线上运营总监, 30, 1, 运营, 运营, 劲马奥通, 深圳, 学历不限, 15, 成长型, 移动互联网 · 电子商务
电商运营总监, 22, 3, 运营, 高端运营职位, 创新谷, 深圳, 本科, 150, 初创型, 移动互联网
网店运营总监, 9, 3, 运营, 运营, 球衣之家, 广州, 大专, 15, 初创型, 电子商务 · 文化娱乐
线上运营总监, 22, 1, 运营, 运营, 摩柚生活技术有限公司, 深圳, 大专, 50, 成长型, 移动互联网 · 电子商务
电商平台运营总监, 3, 1, 运营, 运营, 环球软件, 潍坊, 大专, 50, 成熟型, 电子商务
线上运营总监, 20, 5, 运营, 运营, 童时科技, 广州, 本科, 15, 初创型, 电子商务 · O2O
广告运营总监, 34, 5, 运营, 高端运营职位, 美团网, 北京, 本科, 2000, 成熟型, 移动互联网 · O2O
线下运营总监, 22, 1, 运营, 运营, 深圳大爆炸, 深圳, 学历不限, 150, 成长型, 移动互联网
互联网运营总监, 11, 5, 运营, 运营, 太豪, 上海, 本科, 15, 初创型, 电子商务 · O2O
用户运营总监, 37, 5, 运营, 运营, 怡美假日, 北京, 本科, 150, 成长型, 移动互联网 · 电子商务
网站运营总监/经理, 22, 3, 运营, 高端运营职位, 人脉宝, 北京, 本科, 15, 初创型, 移动互联网 · 社交网络
网站运营总监, 22, 5, 运营, 运营, 浙优民间资本理财服务有限公司, 杭州, 大专, 50, 成长型, 移动互联网 · 企业服务
线上运营总监, 22, 1, 技术, 后端开发, 深圳大爆炸, 深圳, 学历不限, 150, 成长型, 移动互联网
网站运营总监, 12, 5, 运营, 高端运营职位, 联瑞集团, 广州, 本科, 500, 成长型, O2O
电商平台运营总监/经理, 22, 3, 运营, 高端运营职位, 么么嗖, 深圳, 本科, 150, 成长型, 移动互联网 · 电子商务
新媒体运营总监, 22, 3, 运营, 运营, 减约, 北京, 本科, 15, 成长型, 移动互联网 · 医疗健康
网贷运营总监, 8, 3, 运营, 运营, 微E贷, 佛山, 本科, 15, 初创型, 电子商务 · 金融
网店运营总监, 10, 1, 运营, 运营, 罗盘科技, 常州, 大专, 15, 初创型, 电子商务 · 移动互联网
线上运营总监, 30, 3, 运营, 高端运营职位, 深圳大爆炸, 深圳, 大专, 150, 成长型, 移动互联网
线上运营总监, 22, 1, 运营, 运营, 深圳大爆炸, 深圳, 学历不限, 150, 成长型, 移动互联网
无线运营总监, 75, 3, 运营, 高端运营职位, 奥克斯--电子商务科技有限公司, 宁波, 本科, 2000, 上市公, 电子商务 · 硬件
微商城运营总监, 6, 3, 产品, 产品经理, 云智库, 杭州, 学历不限, 15, 初创型, 电子商务 · 教育
众筹项目运营总监, 30, 5, 运营, 运营, 浙江天搜科技股份有限公司, 杭州, 大专, 500, 上市公, 移动互联网
用户运营总监, 25, 5, 运营, 运营, 果敢时代, 北京, 本科, 50, 成长型, 移动互联网 · 电子商务
亚马逊运营总监, 15, 1, 运营, 高端运营职位, Mylord, 深圳, 学历不限, 15, 初创型, 招聘
商家代运营总监, 15, 3, 运营, 运营, 零号线, 上海, 本科, 500, 成长型, 电子商务 · O2O
网络运营总监, 25, 3, 运营, 运营, 塞上网络, 上海, 大专, 15, 初创型, 移动互联网
APP运营总监, 7, 不, 运营, 运营, 点智科技, 武汉, 学历不限, 15, 初创型, 移动互联网
海外运营总监, 22, 3, 运营, 运营, HelloTalk, 深圳, 本科, 15, 成长型, 移动互联网 · 教育
网站运营总监, 9, 3, 技术, 运维, 唯达, 北京, 大专, 15, 成长型, 金融
O2O运营总监, 8, 3, 运营, 运营, 维尔科技, 杭州, 大专, 500, 成熟型, 硬件
手游运营总监, 15, 5, 运营, 高端运营职位, kick9 手游平台, 上海, 本科, 15, 成长型, 移动互联网 · 游戏
用户运营总监, 19, 3, 运营, 运营, 发镖网, 北京, 大专, 150, 成熟型, 移动互联网 · O2O
商家代运营总监, 17, 3, 运营, 运营, 零号线, 上海, 本科, 500, 成长型, 电子商务 · O2O
用户运营总监, 20, 3, 运营, 运营, 梦想旅行, 北京, 学历不限, 15, 成长型, 移动互联网
线上运营总监, 9, 3, 运营, 运营, 海马商城, 大连, 本科, 15, 成长型, 电子商务
P2P运营总监, 4, 3, 运营, 高端运营职位, 众易贷, 郑州, 大专, 15, 初创型, 金融
B2C平台运营总监, 15, 5, 运营, 高端运营职位, 农丰网, 北京, 本科, 500, 上市公, 电子商务 · O2O
用户运营总监, 15, 1, 运营, 运营, 欢否, 北京, 学历不限, 15, 成长型, 社交网络 · O2O
互联网运营总监, 25, 1, 运营, 高端运营职位, 一枚硬币, 北京, 本科, 15, 成长型, 移动互联网 · 金融
平台运营总监, 17, 5, 运营, 运营, 深圳润民, 深圳, 本科, 150, 上市公, 招聘 · 其他
电商平台运营总监, 60, 5, 运营, 运营, 弗尔斯特, 深圳, 大专, 50, 成长型, 电子商务 · 金融
海外运营总监, 32, 5, 运营, 运营, 思行合远, 北京, 本科, 15, 初创型, 移动互联网
线上运营总监, 22, 1, 技术, 后端开发, 摩柚生活技术有限公司, 深圳, 大专, 50, 成长型, 移动互联网 · 电子商务
产品运营总监, 25, 5, 运营, 运营, 美团网, 北京, 本科, 2000, 成熟型, 移动互联网 · O2O
G站运营总监, 27, 3, 运营, 高端运营职位, 上海晨之科, 上海, 本科, 50, 成长型, 移动互联网 · 游戏
互联网运营总监, 22, 5, 运营, 运营, 智相健康, 北京, 本科, 15, 初创型, 医疗健康 · 移动互联网
品牌运营总监, 7, 不, 运营, 运营, 途拓国际, 北京, 学历不限, 15, 成长型, 电子商务
新媒体运营总监, 20, 1, 运营, 高端运营职位, 妮趣, 广州, 本科, 15, 成长型, 电子商务 · 其他
用户运营总监, 8, 1, 运营, 运营, 微在 Wezeit.com, 北京, 本科, 50, 成长型, 移动互联网 · 文化娱乐
活动运营总监, 25, 3, 运营, 运营, 未来教育集团, 北京, 本科, 150, 上市公, O2O · 教育
产品运营总监, 15, 5, 运营, 运营, 蜻蜓互动, 深圳, 大专, 50, 成长型, 移动互联网
销售运营总监, 19, 5, 运营, 运营, Gridsum 国双, 北京, 本科, 500, 成熟型, 数据服务
网站运营总监, 12, 3, 运营, 运营, 索贝学院, 成都, 本科, 15, 初创型, 教育 · 文化娱乐
产品运营/运营经理/运营总监, 11, 1, 运营, 运营, 乐心微动, 广州, 本科, 500, 成熟型, 移动互联网 · 硬件
医学业务运营总监, 15, 3, 运营, 高端运营职位, 睿仁医疗, 北京, 本科, 15, 成长型, 移动互联网 · 医疗健康
新媒体运营总监, 15, 3, 运营, 高端运营职位, 舜米科技, 昆山, 本科, 50, 初创型, 电子商务 · 硬件
COO/运营总监, 37, 5, 运营, 高端运营职位, 美丽猫, 深圳, 本科, 50, 初创型, 移动互联网 · 电子商务
APP运营总监, 20, 3, 运营, 高端运营职位, 优达, 重庆, 大专, 15, 初创型, 招聘
大数据运营总监, 22, 5, 技术, 高端技术职位, 信码互通, 北京, 本科, 150, 初创型, O2O · 数据服务
产品运营总监, 12, 5, 运营, 运营, 首华物业, 北京, 本科, 2000, 初创型, 生活服务
内容运营总监, 20, 3, 运营, 运营, 云来网络, 深圳, 本科, 150, 成长型, 移动互联网
健康管理运营总监, 30, 5, 运营, 运营, 大安健康, 北京, 大专, 50, 初创型, 移动互联网 · 医疗健康
线上运营总监, 15, 5, 运营, 运营, 运通行, 北京, 大专, 15, 初创型, 生活服务 · 其他
电商运营总监, 12, 5, 运营, 运营, 3W Coffee, 深圳, 本科, 15, 成长型, 移动互联网 · 招聘
APP运营总监, 15, 3, 运营, 运营, 杭州酒圈, 杭州, 大专, 15, 初创型, 移动互联网 · O2O
APP产品运营总监, 30, 5, 运营, 高端运营职位, 安全家, 深圳, 学历不限, 50, 初创型, 移动互联网 · 硬件
线上运营总监, 15, 5, 运营, 高端运营职位, 知投（股权众筹家）, 北京, 本科, 50, 成长型, 移动互联网 · 金融
市场运营总监, 22, 5, 运营, 高端运营职位, 上海斗斗星信息科技有限公司, 北京, 本科, 50, 成长型, 移动互联网
B2B运营总监, 40, 3, 运营, 运营, 玻璃器皿网, 南京, 本科, 15, 成长型, 移动互联网 · 电子商务
APP运营总监, 14, 3, 运营, 运营, STARK, 上海, 学历不限, 15, 成长型, 移动互联网 · 文化娱乐
连锁店运营总监, 25, 5, 运营, 运营, 也买酒, 上海, 学历不限, 150, 成熟型, 电子商务
用户运营总监, 40, 5, 运营, 高端运营职位, 风奇科技, 北京, 本科, 15, 初创型, 移动互联网
微商运营总监, 40, 3, 运营, 运营, SKG, 广州, 大专, 150, 成长型, 电子商务 · O2O
手游直播运营总监, 27, 3, 运营, 运营, 阿里巴巴移动事业群, 广州, 大专, 2000, 上市公, 移动互联网
线上运营总监, 30, 1, 技术, 后端开发, 深圳大爆炸, 深圳, 大专, 150, 成长型, 移动互联网
市场运营总监（俱乐部）, 15, 不, 市场与销售, 市场/营销, 深圳成为智能交通, 深圳, 本科, 150, 成长型, 移动互联网 · 硬件
微信运营总监, 15, 3, 运营, 编辑, 前瞻资讯, 深圳, 本科, 150, 初创型, 企业服务
APP运营总监, 6, 3, 运营, 高端运营职位, 点指传媒, 武汉, 学历不限, 50, 初创型, 移动互联网
APP运营总监, 15, 3, 运营, 运营, 漫酒店, 苏州, 本科, 15, 初创型, 移动互联网 · O2O
网站运营总监, 40, 5, 运营, 高端运营职位, THE BEAST 野兽派, 上海, 本科, 150, 初创型, O2O
互联网运营总监, 15, 3, 运营, 运营, 上层传媒股份, 武汉, 本科, 15, 上市公, 移动互联网 · 广告营销
产品运营总监, 32, 3, 运营, 运营, 华为慧通, 深圳, 本科, 500, 初创型, 企业服务 · 旅游
销售运营总监, 25, 不, 运营, 运营, Gridsum 国双, 北京, 本科, 500, 成熟型, 数据服务
市场运营总监, 21, 3, 市场与销售, 市场/营销, 仁畫科技, 上海, 本科, 15, 成长型, 移动互联网 · O2O
移动产品运营总监, 20, 3, 运营, 高端运营职位, 粉粉日记, 上海, 本科, 15, 初创型, 移动互联网
市场营销/运营总监, 15, 3, 市场与销售, 市场/营销, 每每度情商网, 北京, 大专, 150, 成长型, 电子商务 · 硬件
互联网运营总监, 25, 5, 运营, 运营, 大北农集团, 北京, 本科, 2000, 上市公, 金融 · 移动互联网
互联网运营总监, 22, 不, 运营, 运营, 大眼睛旅行, 深圳, 本科, 15, 初创型, 旅游
产品运营总监, 9, 3, 产品, 产品经理, 极限网络传媒, 西安, 大专, 50, 成熟型, 电子商务 · 招聘
互联网运营总监, 25, 5, 运营, 运营, 上海能登, 上海, 本科, 50, 初创型, 电子商务 · O2O
数据中心运营总监, 15, 5, 技术, 高端技术职位, 彩立方, 昆明, 本科, 15, 成长型, 移动互联网
海外运营总监, 25, 3, 运营, 高端运营职位, 亚协网络, 上海, 本科, 15, 初创型, 移动互联网 · 其他
APP运营总监, 15, 5, 运营, 高端运营职位, 沈阳新维集团, 沈阳, 本科, 500, 上市公, 电子商务 · O2O
电商运营总监, 15, 5, 运营, 运营, 店达信息, 上海, 本科, 150, 成长型, 电子商务 · O2O
运营总监，年薪30万, 22, 3, 运营, 运营, 成都杰尼威尼电子商务有限公司, 成都, 本科, 500, 成长型, 电子商务
APP运营总监, 14, 3, 运营, 运营, 微岸传媒, 上海, 学历不限, 15, 成长型, 移动互联网 · 文化娱乐
广告运营总监, 30, 5, 运营, 运营, 乐蛙, 上海, 本科, 150, 成长型, 移动互联网
市场运营总监, 11, 5, 市场与销售, 高端市场职位, 诗诺软件, 武汉, 本科, 50, 成长型, 电子商务 · 企业服务
社区运营总监, 35, 3, 运营, 运营, 有邻, 北京, 大专, 50, 初创型, 社交网络 · O2O
电子商务网站运营总监, 15, 5, 运营, 运营, 家讯港湾, 上海, 大专, 15, 初创型, 移动互联网 · 其他
线上运营总监, 22, 1, 运营, 运营, 深圳大爆炸, 深圳, 大专, 150, 成长型, 移动互联网
心潮的运营总监, 15, 3, 运营, 高端运营职位, 心潮, 广州, 学历不限, 15, 初创型, 移动互联网 · 医疗健康
新媒体运营总监（微信、微博）, 12, 3, 运营, 运营, 六行君通, 北京, 学历不限, 50, 上市公, 移动互联网 · 金融
P2P运营总监, 20, 5, 运营, 高端运营职位, 拉拉财富, 深圳, 本科, 15, 初创型, 金融
营销运营总监(进口跨境电商), 37, 5, 运营, 高端运营职位, 信利康供应链, 深圳, 本科, 500, 成熟型, 电子商务 · 金融
运营总监-无线, 30, 5, 运营, 高端运营职位, 广联达, 北京, 本科, 2000, 上市公, 数据服务
互联网运营总监, 22, 5, 市场与销售, 高端市场职位, 索特来酒店集团, 广州, 本科, 150, 上市公, 生活服务
新媒体运营总监/专员, 17, 3, 运营, 运营, 环球汇尚, 深圳, 大专, 150, 成长型, 移动互联网 · 电子商务
类目运营总监, 55, 5, 运营, 高端运营职位, 快法务, 北京, 学历不限, 50, 成长型, 电子商务 · 企业服务
线上运营总监, 27, 5, 运营, 运营, 也买酒, 上海, 大专, 150, 成熟型, 电子商务
互联网运营总监, 20, 不, 运营, 运营, 沣涞财富, 上海, 学历不限, 150, 初创型, 金融
互联网运营总监, 12, 3, 运营, 运营, 颐而康, 长沙, 大专, 2000, 成熟型, 医疗健康
金融网站运营总监, 10, 1, 技术, 高端技术职位, 牛钱金融, 合肥, 本科, 50, 初创型, 金融
社群运营总监, 11, 1, 运营, 高端运营职位, 陶朱部落, 上海, 大专, 15, 初创型, 移动互联网 · 教育
网站运营总监, 25, 5, 运营, 运营, 未来教育集团, 北京, 本科, 150, 上市公, O2O · 教育
新媒体运营总监, 20, 3, 运营, 运营, 意念电子, 深圳, 大专, 15, 初创型, 社交网络
社区运营总监, 22, 3, 运营, 运营, 猎豹移动, 深圳, 本科, 500, 成熟型, 移动互联网  · 电子商务
商家代运营总监, 16, 3, 运营, 运营, 零号线, 上海, 本科, 500, 成长型, 电子商务 · O2O
渠道运营总监, 17, 5, 运营, 运营, 味库, 北京, 本科, 50, 成长型, 生活服务
运营总监 急, 22, 10年以, 运营, 高端运营职位, 盛世奇缘, 深圳, 学历不限, 50, 初创型, 移动互联网 · 电子商务
推广运营总监, 25, 5, 运营, 运营, 康华网, 深圳, 本科, 50, 初创型, 移动互联网 · 医疗健康
金融网站运营总监, 10, 1, 运营, 运营, 牛钱金融, 合肥, 本科, 50, 初创型, 金融
线上运营总监, 15, 3, 运营, 运营, 鸿名浚达（燕好网）, 北京, 本科, 15, 初创型, O2O
用户运营总监/经理, 22, 5, 运营, 运营, 浙江悠无限网络科技有限公司, 杭州, 本科, 150, 成长型, 移动互联网 · O2O
内容运营总监, 22, 5, 运营, 运营, 哗哗, 北京, 本科, 50, 成长型, 移动互联网 · 数据服务
内容运营总监, 25, 3, 运营, 高端运营职位, 新知百略, 北京, 本科, 50, 初创型, 移动互联网 · 社交网络
品牌运营总监., 30, 3, 运营, 高端运营职位, 石头理财, 杭州, 大专, 50, 成长型, 金融
社区运营总监, 20, 3, 运营, 运营, 玲珑沙龙, 北京, 本科, 15, 成长型, 移动互联网 · 社交网络
APP运营总监, 15, 1, 运营, 运营, 快乐妈咪, 北京, 本科, 15, 成长型, 移动互联网 · 医疗健康
B2C运营总监/经理, 22, 3, 运营, 运营, 鼎骏, 广州, 大专, 150, 初创型, 电子商务
市场运营总监, 20, 3, , 运营经理, 董秘, 北京, 学历不限, 15, 初创型, 移动互联网 · 生活服务
互联网运营总监, 22, 3, 运营, 高端运营职位, 诺亚正行, 上海, 本科, 2000, 上市公, 移动互联网 · 金融
销售运营总监（北京-知春里）, 20, 5, 运营, 运营, Gridsum 国双, 北京, 本科, 500, 成熟型, 数据服务
淘宝天猫运营总监, 6, 1, 运营, 运营, 嘉诚优品, 合肥, 大专, 50, 初创型, 移动互联网 · 电子商务
线上运营总监, 40, 5, 运营, 高端运营职位, THE BEAST 野兽派, 上海, 大专, 150, 初创型, O2O
互联网金融网站运营总监, 8, 1, 运营, 高端运营职位, 牛钱金融, 合肥, 本科, 50, 初创型, 金融
市场运营总监, 22, 5, 市场与销售, 市场/营销, 豆芽金服, 上海, 本科, 15, 初创型, 移动互联网 · 金融
APP运营总监, 25, 3, 运营, 高端运营职位, 广东车联网, 广州, 本科, 150, 初创型, 移动互联网 · O2O
APP运营总监, 6, 不, 运营, 运营, 大嘴鱼, 武汉, 学历不限, 15, 初创型, 电子商务 · O2O
电商产品运营总监, 22, 5, 运营, 高端运营职位, 美月网络（大姨吗子公司）, 北京, 本科, 150, 成熟型, 移动互联网
海外运营总监, 15, 1, 运营, 运营, 波普汉语网, 北京, 硕士, 50, 成长型, 移动互联网 · 电子商务
O2O运营总监, 35, 5, 运营, 运营, 土星教育, 北京, 本科, 50, 成长型, 移动互联网
内容运营总监, 30, 5, 运营, 运营, 美图公司, 北京, 本科, 500, 成熟型, 移动互联网 · 硬件
运营总监、校务院长, 8, 不限, , 总助, 弈智投资（东湖棋院）, 广州, 大专, 50, 上市公, 教育
策划/运营总监（房地产电商方向）, 27, 5, 运营, 高端运营职位, 汇联金融, 深圳, 本科, 150, 上市公, 金融
P2P运营总监, 30, 3, 运营, 高端运营职位, 赵涌在线, 上海, 硕士, 150, 成长型, 电子商务
APP运营总监, 17, 3, 运营, 运营, 智芯, 深圳, 本科, 15, 成长型, 其他
新媒体运营总监, 32, 5, 运营, 运营, 乐学在线, 北京, 本科, 50, 成长型, 教育
微商平台运营总监, 22, 5, 运营, 运营, 收客易, 广州, 本科, 15, 初创型, 移动互联网 · 旅游
网站运营总监/coo, 25, 3, 运营, 运营, 河南智业科技发展有限公司, 郑州, 本科, 50, 初创型, 企业服务 · 金融
互联网运营总监（偏用户和内容运营）, 25, 5, 运营, 运营, 锐捷网络, 北京, 本科, 2000, 上市公, 硬件
深圳 线上运营总监, 30, 3, 运营, 高端运营职位, 摩柚生活技术有限公司, 深圳, 学历不限, 50, 成长型, 移动互联网 · 电子商务
产品运营总监O2O, 12, 1, 运营, 运营, 趣运动, 上海, 大专, 150, 成长型, 移动互联网  · O2O
app运营总监, 12, 5, 运营, 运营, 天育, 上海, 大专, 15, 成长型, 移动互联网 · 医疗健康
高级运营经理 / 运营总监, 11, 3, 运营, 运营, ARTAND, 北京, 本科, 15, 初创型, 社交网络 · 文化娱乐
电商运营总监, 10, 5, 市场与销售, 高端市场职位, 青山老农, 广州, 本科, 50, 成长型, 电子商务 · 社交网络
用户运营总监, 45, 5, 运营, 运营, CF, 上海, 本科, 150, 成长型, 移动互联网 · 招聘
市场运营总监, 30, 3, 市场与销售, 高端市场职位, 北京福易电子商务有限公司, 北京, 本科, 50, 初创型, 移动互联网
【创新工场】-野兽骑行-运营总监, 22, 5, 运营, 高端运营职位, 创新工场, 北京, 本科, 500, 成熟型, 移动互联网
电商平台项目运营总监, 15, 3, 运营, 运营, 金龙, 深圳, 本科, 50, 成长型, 文化娱乐 · 其他
UC浏览器国际版运营总监/高级经理, 37, 5, 运营, 高端运营职位, 阿里巴巴移动事业群, 广州, 学历不限, 2000, 上市公, 移动互联网
互联网金融运营总监, 35, 5, 运营, 高端运营职位, 生菜金融, 北京, 本科, 15, 成长型, 移动互联网 · 金融
APP运营总监, 30, 5, 运营, 高端运营职位, 京颐科技, 上海, 本科, 500, 成长型, 移动互联网 · 医疗健康
新媒体运营总监, 40, 5, 运营, 运营, 超级蜂巢, 北京, 本科, 2000, 上市公, 移动互联网 · 企业服务
天猫运营总监, 9, 1, 运营, 运营, ZZZ家居, 上海, 本科, 15, 初创型, 电子商务
APP运营总监(智电未来）, 15, 3, 运营, 高端运营职位, 一度用车, 北京, 大专, 50, 成长型, 移动互联网
社区运营总监（内容运营）, 37, 5, 运营, 运营, 怡美假日, 北京, 本科, 50, 成长型, 移动互联网 · 电子商务
线下运营总监, 20, 5, 运营, 运营, 掌上通, 北京, 本科, 150, 上市公, 移动互联网
App运营总监, 12, 3, 运营, 运营, 易融天天, 北京, 本科, 50, 初创型, 移动互联网 · 金融
市场运营总监, 25, 3, 运营, 高端运营职位, 捞月狗, 上海, 学历不限, 15, 成长型, 移动互联网
线下运营总监, 12, 5, 运营, 运营, 猪熊科技, 成都, 大专, 15, 初创型, 移动互联网  · O2O
营销运营总监, 30, 10年以, 运营, 运营, 优定制, 北京, 本科, 15, 成长型, 电子商务
市场运营总监, 22, 5, 运营, 高端运营职位, NewChama, 上海, 本科, 15, 成长型, 金融
运营总监-无线, 37, 5, 运营, 高端运营职位, 广联达, 北京, 学历不限, 2000, 上市公, 数据服务
运营总监(电商）, 16, 3, 运营, 运营, 掌上快销, 广州, 本科, 15, 初创型, 移动互联网 · 企业服务
