运营总监, 24, 5, 运营, 高端运营职位, 明源云采购, 深圳, 本科, 2000, 上市公, 移动互联网 · 电子商务
运营总监, 42, 5, 运营, 运营, 云熵网络, 上海, 本科, 15, 成长型, 数据服务
运营总监, 22, 3, 运营, 高端运营职位, 贝塔分期, 北京, 大专, 15, 初创型, 金融
运营总监, 12, 5, 运营, 高端运营职位, 华熙动博, 北京, 大专, 15, 初创型, 移动互联网 · 其他
运营总监, 12, 3, 运营, 高端运营职位, 专注农村电商平台“上街了”, 武汉, 大专, 150, 成长型, 电子商务 · O2O
运营总监, 15, 5, 运营, 运营, 28云, 深圳, 大专, 15, 成长型, 电子商务 · O2O
运营总监, 20, 3, 运营, 运营, 网创科技, 杭州, 本科, 50, 初创型, 移动互联网 · 社交网络
运营总监, 20, 5, 运营, 高端运营职位, 秀水街电商, 北京, 本科, 15, 初创型, 电子商务
运营总监, 22, 5, 运营, 高端运营职位, 乐居生活, 北京, 大专, 150, 成长型, O2O · 生活服务
运营总监, 12, 1, 运营, 运营, 泛美家装, 西安, 大专, 50, 初创型, 电子商务 · O2O
运营总监, 25, 3, 运营, 高端运营职位, 蝙蝠数据, 深圳, 大专, 15, 初创型, 移动互联网 · 数据服务
运营总监, 15, 5, 运营, 高端运营职位, 小伞科技, 广州, 本科, 50, 成长型, 移动互联网 · 电子商务
运营总监, 45, 3, 运营, 运营, 协创, 上海, 学历不限, 15, 上市公, 企业服务
运营总监, 27, 5, 运营, 运营, 益友会科技, 北京, 本科, 50, 成长型, 电子商务 · O2O
运营总监, 30, 3, 运营, 高端运营职位, 返享移动电商, 上海, 本科, 50, 初创型, 移动互联网 · 社交网络
运营总监, 20, 3, 运营, 高端运营职位, 众源网聚, 北京, 本科, 15, 初创型, 移动互联网
运营总监, 22, 5, 运营, 高端运营职位, 房总管, 北京, 本科, 15, 成长型, O2O
运营总监, 25, 5, 运营, 运营, 亿动电商, 北京, 本科, 50, 成长型, 电子商务 · 医疗健康
运营总监, 15, 不, 运营, 高端运营职位, 钰融, 杭州, 学历不限, 50, 初创型, 移动互联网 · 金融
运营总监, 22, 1, 运营, 高端运营职位, 衣+, 北京, 本科, 15, 成长型, 移动互联网
运营总监, 14, 不, 运营, 高端运营职位, 编程猫, 深圳, 学历不限, 15, 初创型, 移动互联网 · 教育
运营总监, 11, 1, 运营, 运营, 邦宁电商, 深圳, 大专, 15, 初创型, 电子商务 · 企业服务
运营总监, 12, 3, 运营, 运营, 51金服, 深圳, 本科, 15, 初创型, 金融
运营总监, 5, 3, 运营, 高端运营职位, 特产网, 成都, 大专, 50, 初创型, 电子商务
运营总监, 25, 3, 运营, 高端运营职位, 途游, 北京, 本科, 150, 成长型, 移动互联网 · 游戏
运营总监, 30, 3, 运营, 运营, 美味不用等, 上海, 本科, 500, 成熟型, 移动互联网 · O2O
运营总监, 20, 不, 运营, 高端运营职位, 陌游, 北京, 学历不限, 15, 成长型, 移动互联网 · 游戏
运营总监, 30, 不, 运营, 高端运营职位, 车生活, 深圳, 学历不限, 50, 成长型, O2O · 分类信息
运营总监, 40, 不, 运营, 高端运营职位, 金雅福珠宝, 深圳, 大专, 500, 成熟型, O2O · 其他
运营总监/创业型, 9, 5, 运营, 运营, 锦锐科技, 郑州, 大专, 15, 初创型, 移动互联网 · 电子商务
运营总监, 30, 5, 运营, 高端运营职位, 汇中财富, 北京, 本科, 2000, 成熟型, 金融
运营总监, 22, 5, 运营, 运营, 汽车电商, 北京, 本科, 15, 初创型, 电子商务 · O2O
运营总监, 22, 3, 运营, 高端运营职位, 火箭金融, 北京, 本科, 15, 初创型, 移动互联网 · 金融
运营总监, 30, 5, 运营, 高端运营职位, 沱沱工社, 北京, 本科, 150, 初创型, 电子商务
运营总监, 22, 3, 运营, 高端运营职位, 雨林木风, 北京, 本科, 50, 上市公, 移动互联网 · 电子商务
运营总监, 12, 5, 运营, 高端运营职位, 敢为科技, 西安, 学历不限, 15, 初创型, 电子商务 · 广告营销
运营总监, 25, 1, 运营, 高端运营职位, 营富信息科技, 深圳, 本科, 50, 上市公, 电子商务 · 移动互联网
运营总监, 22, 3, 运营, 高端运营职位, SoulGame, 深圳, 本科, 50, 成长型, 游戏
运营总监, 30, 5, 运营, 运营, 倍智咨询, 杭州, 大专, 150, 上市公, 电子商务 · 医疗健康
运营总监, 45, 5, 运营, 高端运营职位, 旭森国际集团, 上海, 本科, 50, 上市公, 金融 · 其他
运营总监, 20, 5, 运营, 高端运营职位, 知豆智信, 北京, 本科, 2000, 成熟型, 电子商务 · 其他
运营总监, 40, 5, 运营, 运营, 京东商城, 北京, 本科, 2000, 上市公, 电子商务
运营总监, 22, 3, 运营, 运营, 恒聚点, 北京, 学历不限, 15, 成长型, 移动互联网
运营总监/经理, 22, 3, 运营, 运营, 志晟信息, 北京, 本科, 150, 上市公, 企业服务
运营总监, 32, 3, 运营, 运营, 辣妈帮, 深圳, 本科, 500, 成熟型, 移动互联网
产品运营总监, 30, 5, 运营, 运营, 爱屋吉屋, 上海, 本科, 2000, 成熟型, 移动互联网
运营总监, 15, 3, 运营, 运营, 北京志诚嘉恒商贸有限责任公司, 北京, 本科, 15, 初创型, 电子商务
运营总监, 30, 3, 运营, 高端运营职位, 云马物流, 上海, 本科, 500, 成长型, 移动互联网 · O2O
运营总监, 24, 5, 运营, 高端运营职位, 乐租, 北京, 本科, 15, 初创型, 移动互联网 · O2O
运营总监, 20, 3, 运营, 高端运营职位, 亿顺特, 北京, 大专, 150, 初创型, 电子商务 · 数据服务
运营总监（合伙人）, 22, 3, 运营, 高端运营职位, 巢搭配, 深圳, 本科, 15, 初创型, O2O
运营总监, 22, 5, 运营, 高端运营职位, 诺米宝, 北京, 本科, 15, 初创型, 电子商务 · 金融
运营总监, 30, 5, 运营, 高端运营职位, 满艺网, 北京, 本科, 50, 成长型, 电子商务 · 文化娱乐
运营总监, 37, 5, 运营, 运营, 量化派, 北京, 本科, 50, 成长型, 金融 · 数据服务
运营总监, 30, 5, 运营, 高端运营职位, 星河互联集团, 北京, 本科, 500, 成熟型, 移动互联网
运营总监, 22, 1, 运营, 高端运营职位, 酷浪运动, 深圳, 本科, 15, 成长型, 移动互联网 · 文化娱乐
运营总监, 22, 5, 运营, 运营, 晶点科技, 北京, 本科, 15, 初创型, 移动互联网
运营总监, 25, 5, 运营, 高端运营职位, 芭田集团, 深圳, 本科, 2000, 上市公, 企业服务
运营总监, 17, 3, 运营, 高端运营职位, 乐播科技, 深圳, 本科, 15, 初创型, 移动互联网
运营总监, 24, 3, 运营, 高端运营职位, 鑫燕网络, 广州, 本科, 50, 成长型, 电子商务 · O2O
运营总监, 25, 5, 运营, 高端运营职位, 云赢网络科技有限公司, 北京, 大专, 2000, 成熟型, 电子商务
运营总监, 12, 3, 运营, 高端运营职位, 兴中浪, 成都, 本科, 15, 初创型, 移动互联网 · 其他
运营总监, 25, 3, 运营, 运营, Sportsdata, 北京, 本科, 15, 初创型, 移动互联网 · 文化娱乐
运营总监（合伙人级别）, 25, 3, 运营, 运营, 青石证券, 深圳, 本科, 15, 初创型, 移动互联网 · 金融
运营总监, 30, 5, 运营, 高端运营职位, 畅聊天下(派派交友）, 北京, 大专, 50, 成长型, 移动互联网
运营总监（3C类目）, 25, 5, 运营, 高端运营职位, 顺丰海淘, 上海, 大专, 50, 成长型, 移动互联网
运营总监, 37, 5, 运营, 高端运营职位, 融帮金融, 上海, 大专, 15, 初创型, 金融
运营总监, 8, 5, 运营, 运营, 好实再（深圳）商贸有限公司, 深圳, 本科, 500, 成长型, 电子商务 · O2O
运营总监, 18, 5, 运营, 高端运营职位, 百纳信息, 武汉, 本科, 150, 成长型, 移动互联网
运营总监, 15, 3, 运营, 高端运营职位, MIS, 深圳, 本科, 15, 初创型, 移动互联网 · 医疗健康
运营总监, 25, 5, 运营, 高端运营职位, 和云筹, 北京, 本科, 50, 初创型, 移动互联网 · 金融
运营总监（有招聘网站运营经验）, 22, 3, 运营, 运营, 光子科技, 厦门, 本科, 15, 初创型, 移动互联网 · 电子商务
运营总监/副总裁, 17, 5, 运营, 高端运营职位, YES！时尚社交购物应用, 北京, 大专, 50, 成长型, 电子商务
运营总监, 20, 5, 运营, 高端运营职位, 泰迪智慧, 武汉, 本科, 15, 初创型, 数据服务
运营总监, 11, 3, 运营, 运营, 尚度元, 西安, 学历不限, 15, 初创型, O2O · 移动互联网
运营总监, 15, 1, 运营, 运营, 进化时代, 北京, 本科, 15, 初创型, 移动互联网 · 医疗健康
运营总监, 22, 3, 运营, 高端运营职位, 汽车人, 北京, 大专, 50, 成长型, 电子商务 · O2O
运营总监, 32, 3, 运营, 运营, 每日优鲜, 北京, 大专, 150, 成长型, 移动互联网 · 电子商务
运营总监, 22, 5, 运营, 运营, 北京云漾, 北京, 本科, 15, 初创型, 移动互联网 · 社交网络
运营总监, 9, 5, 运营, 高端运营职位, 特产网, 成都, 本科, 50, 初创型, 电子商务
运营总监(o2o), 21, 3, 运营, 高端运营职位, 近邻宝, 北京, 本科, 150, 成长型, 移动互联网 · 电子商务
运营总监, 27, 3, 运营, 运营, 卡说, 上海, 本科, 50, 成长型, 移动互联网 · O2O
运营总监, 22, 5, 运营, 高端运营职位, 天下财富（天涯社区子公司）, 深圳, 大专, 500, 上市公, 移动互联网 · 金融
运营总监, 22, 3, 运营, 高端运营职位, 艾硕科, 北京, 学历不限, 15, 初创型, 移动互联网 · 电子商务
运营总监, 15, 5, 运营, 高端运营职位, 陕西苹果电子, 西安, 大专, 50, 成长型, 移动互联网 · 电子商务
运营总监, 30, 3, 运营, 高端运营职位, 上海人鱼线科技有限公司, 上海, 本科, 15, 成长型, 移动互联网 · 社交网络
运营总监, 37, 5, 运营, 高端运营职位, 洋码头, 上海, 本科, 150, 成长型, 移动互联网 · 电子商务
运营总监（COO）, 30, 5, 运营, 运营, 九牛网, 上海, 本科, 50, 成长型, 移动互联网 · 金融
运营总监, 25, 5, 运营, 运营, 会计城, 广州, 本科, 50, 初创型, 移动互联网
运营总监, 12, 5, 运营, 高端运营职位, 实习网, 北京, 本科, 15, 初创型, 移动互联网 · 教育
运营总监, 15, 5, , 电商产品经理, 筑龙网, 北京, 本科, 50, 成长型, 移动互联网 · 企业服务
运营总监, 21, 5, 运营, 高端运营职位, 利海纳, 深圳, 本科, 150, 成熟型, 移动互联网 · 金融
运营总监, 22, 3, 运营, 高端运营职位, 驾遇, 北京, 学历不限, 50, 初创型, 移动互联网
运营总监, 50, 5, 运营, 高端运营职位, 雅昌艺术网, 北京, 本科, 2000, 上市公, 移动互联网 · 电子商务
运营总监, 30, 5, 运营, 高端运营职位, 壹文财富, 北京, 本科, 50, 成长型, 金融
运营总监, 37, 5, 运营, 高端运营职位, 点滴理财, 北京, 本科, 50, 成长型, 移动互联网 · 金融
运营总监, 60, 5, 运营, 高端运营职位, 香送, 北京, 本科, 50, 初创型, 电子商务 · O2O
运营总监, 15, 3, 运营, 高端运营职位, 开心印, 南京, 本科, 150, 成长型, 电子商务 · O2O
运营总监, 40, 5, 运营, 运营, 迎晨, 上海, 本科, 50, 成长型, 生活服务
运营总监/COO, 25, 3, 运营, 高端运营职位, 易康移动医疗, 北京, 本科, 15, 初创型, 移动互联网 · 医疗健康
运营总监, 17, 3, 运营, 高端运营职位, 普锐提思, 武汉, 大专, 15, 初创型, 移动互联网 · 教育
运营总监, 42, 3, 运营, 高端运营职位, 北京智慧图, 北京, 本科, 150, 成长型, 移动互联网 · 数据服务
运营总监, 42, 5, 运营, 运营, 创维, 北京, 本科, 50, 初创型, 移动互联网 · 电子商务
运营总监, 22, 5, 运营, 运营, 云上视界, 北京, 本科, 50, 初创型, 移动互联网
运营总监, 27, 5, 运营, 高端运营职位, 节操精选, 北京, 学历不限, 15, 成长型, 移动互联网
运营总监, 27, 5, 运营, 运营, 节操精选, 北京, 本科, 15, 成长型, 移动互联网
运营总监, 12, 3, 运营, 运营, 宽途汽车服务有限公司, 上海, 本科, 150, 成长型, 电子商务 · O2O
运营总监, 22, 3, 运营, 运营, 直订网, 北京, 大专, 50, 初创型, 移动互联网 · 生活服务
运营总监, 27, 5, 运营, 运营, 中酒饮科技发展有限公司, 北京, 本科, 150, 成长型, 电子商务
运营总监, 30, 10年以, 运营, 高端运营职位, 齐家科技, 深圳, 本科, 50, 成长型, 移动互联网
运营总监, 20, 5, 运营, 高端运营职位, 首创置业-乐惠家社区O2O, 北京, 本科, 50, 成长型, 移动互联网 · O2O
运营总监, 22, 5, 运营, 运营, 好乐买okbuy, 北京, 本科, 500, 成熟型, 电子商务
运营总监, 9, 3, 运营, 高端运营职位, 政府采购信息网, 北京, 本科, 50, 成长型, 文化娱乐
运营总监, 35, 3, 运营, 运营, 易点租, 北京, 本科, 150, 成长型, 电子商务
运营总监, 32, 3, 运营, 高端运营职位, 热钱网, 北京, 本科, 15, 初创型, 移动互联网 · 金融
运营总监, 22, 5, 运营, 高端运营职位, （中国新闻社）中新唐印, 北京, 学历不限, 150, 成长型, 文化娱乐
运营总监, 8, 不, 运营, 高端运营职位, 林频仪器, 上海, 学历不限, 150, 初创型, 其他
运营总监, 40, 10年以, 运营, 高端运营职位, 宝账, 深圳, 本科, 50, 初创型, 金融
运营总监, 37, 5, 运营, 高端运营职位, 点滴身边, 北京, 本科, 150, 初创型, 金融
运营总监, 25, 3, 运营, 高端运营职位, 洛奇临床检验所, 北京, 本科, 50, 初创型, 移动互联网 · 医疗健康
运营总监, 75, 5, 运营, 运营, 超凡网, 成都, 本科, 500, 上市公, 电子商务
运营总监, 22, 5, 运营, 高端运营职位, 星亿东方, 北京, 本科, 150, 成长型, 移动互联网 · 金融
运营总监, 16, 5, 运营, 高端运营职位, 异口良食, 北京, 大专, 50, 初创型, 移动互联网 · O2O
运营总监, 7, 5, 运营, 运营, 启蒙听听, 武汉, 本科, 15, 初创型, 移动互联网 · 硬件
运营总监, 22, 5, 运营, 运营, 北京家装云网络科技有限公司, 北京, 本科, 150, 成长型, 电子商务
运营总监, 15, 3, 运营, 运营, 云信天诚, 深圳, 大专, 15, 初创型, 移动互联网 · O2O
运营总监, 15, 3, 运营, 运营, 元汇天下, 北京, 本科, 50, 初创型, 金融
运营总监, 30, 5, 运营, 运营, 游啊游, 北京, 本科, 50, 成长型, 电子商务
运营总监, 22, 5, 运营, 高端运营职位, 通网集团, 深圳, 本科, 150, 上市公, O2O
运营总监, 11, 3, 运营, 高端运营职位, 瑞安云, 成都, 学历不限, 50, 成长型, 移动互联网
运营总监, 60, 5, 运营, 运营, SKG, 广州, 大专, 150, 成长型, 电子商务 · O2O
运营总监, 45, 5, 运营, 高端运营职位, 宝账, 广州, 本科, 50, 初创型, 金融
运营总监, 7, 3, 运营, 运营, 数次方, 成都, 大专, 15, 初创型, 移动互联网 · 金融
运营总监, 40, 3, 运营, 高端运营职位, Catch, 北京, 本科, 15, 成长型, 移动互联网 · 其他
运营总监（软硬结合的互联网产品）, 16, 3, 运营, 高端运营职位, 拉酷, 北京, 本科, 15, 初创型, 硬件
运营总监, 8, 3, 运营, 高端运营职位, 成都步速者, 成都, 本科, 15, 初创型, 移动互联网 · 电子商务
运营总监, 25, 5, 运营, 高端运营职位, 希正信息, 北京, 本科, 15, 初创型, O2O
运营总监(偏线下), 19, 1, 运营, 高端运营职位, 动吧体育, 北京, 本科, 15, 成长型, 移动互联网 · 文化娱乐
运营总监, 35, 3, 运营, 高端运营职位, 用友优普, 北京, 学历不限, 2000, 上市公, 移动互联网 · 企业服务
客户运营总监, 25, 5, 运营, 高端运营职位, 返利网, 上海, 本科, 500, 成熟型, 电子商务
运营总监, 25, 5, 运营, 高端运营职位, 顺顺留学（北京）, 北京, 本科, 150, 成长型, 移动互联网 · O2O
运营总监, 11, 3, 运营, 运营, 赶酒会, 成都, 大专, 50, 成长型, 移动互联网 · 电子商务
运营总监, 27, 5, 运营, 高端运营职位, 途远, 杭州, 本科, 15, 初创型, 移动互联网 · 企业服务
运营总监, 30, 5, 运营, 运营, 正和岛, 北京, 本科, 150, 成长型, 移动互联网 · 社交网络
运营总监, 9, 3, 运营, 运营, 惠众天下电子商务, 广州, 大专, 15, 初创型, 电子商务 · 移动互联网
运营总监, 30, 3, 运营, 运营, 三岛中融, 北京, 本科, 150, 成长型, 金融
推广运营总监, 27, 5, 运营, 高端运营职位, 阅读星 - 掌上个性化阅读必备, 杭州, 大专, 50, 成长型, 移动互联网 · 教育
运营总监, 12, 5, 运营, 运营, 中棋惟业, 北京, 本科, 50, 成长型, 教育
网站运营总监, 24, 5, 运营, 高端运营职位, 煜隆集团, 深圳, 本科, 150, 成长型, O2O · 金融
运营总监, 30, 5, 运营, 高端运营职位, 近邻宝, 北京, 本科, 150, 成长型, 移动互联网 · 电子商务
运营总监, 22, 5, 运营, 运营, 优必选, 深圳, 本科, 150, 成长型, 游戏 · 文化娱乐
运营总监, 17, 3, 运营, 运营, 礼舍网, 深圳, 本科, 15, 初创型, 移动互联网 · 电子商务
运营总监, 32, 5, 运营, 高端运营职位, 摩威尔科技, 北京, 本科, 15, 成长型, 移动互联网 · 文化娱乐
产品运营总监, 20, 3, 运营, 运营, 动动, 北京, 本科, 15, 成长型, 移动互联网 · 医疗健康
运营总监（电商、旅游方向）, 10, 3, 运营, 运营, 辛巴达旅行网, 广州, 本科, 50, 成长型, 旅游
运营总监（互联网）, 15, 3, 运营, 运营, 天使街众筹平台, 北京, 本科, 15, 成长型, 电子商务 · 金融
运营总监, 15, 5, 市场与销售, 高端市场职位, 回购网, 深圳, 学历不限, 50, 成长型, 电子商务 · O2O
运营总监/经理, 30, 3, 运营, 运营, 中青宝, 深圳, 本科, 500, 上市公, 移动互联网 · 游戏
运营总监（COO）, 14, 3, 运营, 高端运营职位, 奢品管家, 广州, 本科, 15, 初创型, 移动互联网 · 电子商务
运营总监（社交）, 40, 5, 运营, 高端运营职位, 思源科技, 北京, 大专, 500, 初创型, 移动互联网 · O2O
运营总监（国际事业部）, 42, 3, 运营, 高端运营职位, 上海微盟, 上海, 大专, 500, 成熟型, 移动互联网 · 电子商务
运营总监（合伙人级别）, 22, 3, 运营, 运营, 问答帮, 深圳, 本科, 15, 初创型, 移动互联网 · 电子商务
运营总监, 25, 3, 运营, 运营, 伟基控股发展集团, 杭州, 本科, 150, 成长型, 企业服务 · O2O
运营总监, 20, 3, 运营, 高端运营职位, 一起玩耍, 北京, 本科, 15, 初创型, 游戏 · 文化娱乐
运营总监, 20, 不, 运营, 高端运营职位, 辛巴达旅行网, 广州, 学历不限, 50, 成长型, 旅游
运营总监（互联网教育）, 9, 3, 运营, 运营, 筑梦教育, 广州, 本科, 15, 初创型, O2O · 教育
运营总监, 60, 5, 运营, 高端运营职位, 全华, 上海, 本科, 500, 成熟型, 移动互联网
运营总监, 30, 10年以, 运营, 高端运营职位, 太德置地, 北京, 本科, 50, 初创型, 金融 · 其他
运营总监, 10, 3, 运营, 运营, 大作电子商务, 成都, 本科, 15, 初创型, 电子商务
运营总监, 30, 5, 运营, 运营, 筑龙网, 北京, 本科, 50, 成长型, 移动互联网 · 企业服务
运营总监/高级经理, 30, 5, 运营, 运营, 立方网, 深圳, 本科, 150, 成长型, 移动互联网 · 硬件
运营总监, 22, 3, 运营, 高端运营职位, 一樽阁酒到家, 北京, 本科, 15, 初创型, O2O
运营总监（电商）, 30, 5, 运营, 高端运营职位, 神威药业, 北京, 本科, 2000, 上市公, 电子商务
运营总监（事业部负责人）, 8, 3, 运营, 高端运营职位, 之维安, 成都, 大专, 50, 上市公, 移动互联网 · 数据服务
运营总监, 30, 5, 运营, 高端运营职位, 卓睿投资, 上海, 本科, 150, 初创型, 移动互联网 · 金融
运营总监(汽车类移动端社区), 30, 3, 运营, 高端运营职位, 易积分, 北京, 大专, 15, 初创型, 移动互联网 · O2O
运营总监, 12, 5, 运营, 运营, 英雄互娱, 成都, 大专, 150, 成熟型, 移动互联网 · 游戏
运营总监, 17, 3, 运营, 高端运营职位, 腾码网络, 广州, 本科, 50, 初创型, 移动互联网 · 数据服务
运营总监, 20, 3, 运营, 运营, 007BU广州中大网上轻纺城, 广州, 本科, 15, 初创型, 电子商务
运营总监, 22, 3, 运营, 运营, 乐铺, 北京, 本科, 50, 成长型, 移动互联网 · 电子商务
运营总监, 10, 3, 运营, 高端运营职位, 霸道总裁餐饮, 成都, 大专, 15, 初创型, 招聘
运营总监, 20, 5, 运营, 高端运营职位, 擦鞋仔, 深圳, 大专, 15, 初创型, 移动互联网
技术运营总监, 27, 5, 技术, 高端技术职位, 芒果网, 深圳, 本科, 500, 成长型, 旅游
运营总监, 25, 3, 运营, 高端运营职位, 宠物派, 北京, 本科, 15, 初创型, 移动互联网 · O2O
运营总监, 30, 5, 运营, 运营, 鸡窝网, 北京, 本科, 15, 初创型, 移动互联网 · 电子商务
内容运营总监, 12, 3, 运营, 运营, POCO.CN, 广州, 大专, 150, 成长型, 移动互联网 · 文化娱乐
产品运营总监, 15, 5, 产品, 高端产品职位, 亮点商务, 杭州, 本科, 50, 成长型, 移动互联网 · 电子商务
运营总监, 35, 5, 运营, 高端运营职位, 澳际教育, 北京, 本科, 500, 初创型, 生活服务
运营总监, 20, 3, 运营, 高端运营职位, 货源甲, 深圳, 本科, 50, 成长型, 移动互联网 · 电子商务
运营总监, 52, 5, 运营, 高端运营职位, 云熵网络, 上海, 大专, 15, 成长型, 数据服务
产品运营总监, 18, 3, 运营, 运营, 梧桐创客, 深圳, 本科, 15, 初创型, 企业服务 · 金融
运营总监（推广运营中心）, 15, 3, 运营, 运营, 晶晶亮, 北京, 本科, 50, 成长型, 移动互联网 · 电子商务
运营总监, 17, 3, 运营, 运营, 棒小店, 武汉, 大专, 50, 初创型, 电子商务 · 移动互联网
运营总监, 30, 5, 运营, 高端运营职位, 巧手特特, 北京, 大专, 50, 初创型, 移动互联网 · O2O
运营总监, 30, 5, 运营, 高端运营职位, 海航通信, 北京, 本科, 150, 成长型, 移动互联网 · 生活服务
运营总监, 25, 5, 运营, 运营, 风景网, 深圳, 本科, 50, 初创型, 移动互联网
运营总监, 30, 5, 运营, 运营, 九盈GLBPay, 上海, 本科, 50, 初创型, 金融
运营总监, 20, 5, 运营, 高端运营职位, 天岳科技, 杭州, 本科, 15, 初创型, 移动互联网
运营总监, 32, 5, 运营, 高端运营职位, 迎晨, 北京, 本科, 50, 成长型, 生活服务
运营总监, 40, 5, 运营, 运营, 迎晨, 北京, 本科, 50, 成长型, 生活服务
运营总监, 11, 3, 运营, 高端运营职位, 中视游科技, 成都, 本科, 50, 成长型, 电子商务 · O2O
产品运营总监, 27, 5, 运营, 运营, 返利网, 上海, 本科, 500, 成熟型, 电子商务
产品运营总监, 15, 3, 产品, 高端产品职位, YHOUSE, 上海, 本科, 150, 成长型, 移动互联网
运营总监助理, 4, 1, 运营, 运营, Artka, 杭州, 大专, 500, 初创型, 电子商务
运营总监, 20, 5, 运营, 高端运营职位, 牛玩, 深圳, 本科, 15, 初创型, 移动互联网
售后运营总监, 8, 3, 运营, 高端运营职位, 美业邦, 杭州, 大专, 50, 成长型, 移动互联网
城市运营总监, 30, 3, 运营, 运营, 房多多, 上海, 本科, 2000, 成熟型, 移动互联网 · O2O
运营总监（急聘）, 15, 不, 运营, 高端运营职位, 贝贝壳, 北京, 学历不限, 15, 初创型, O2O · 医疗健康
运营总监, 15, 5, 运营, 运营, 智慈科技, 成都, 本科, 15, 初创型, 移动互联网
运营总监, 30, 3, 运营, 运营, 红舞联盟, 北京, 大专, 50, 初创型, 移动互联网
运营总监, 75, 不, 运营, 高端运营职位, 马特车品, 上海, 大专, 15, 初创型, 电子商务
运营总监, 32, 5, 运营, 高端运营职位, 新金服, 北京, 学历不限, 50, 成长型, 金融 · 数据服务
运营总监, 40, 5, 运营, 高端运营职位, 合众金融, 北京, 本科, 50, 成长型, 移动互联网 · 金融
售后运营总监, 8, 3, 运营, 高端运营职位, 美业邦, 上海, 大专, 50, 成长型, 移动互联网
运营总监（上海）, 40, 5, 运营, 运营, 房上房科技, 上海, 本科, 15, 成长型, 移动互联网 · 电子商务
运营总监（电商）, 30, 5, 运营, 高端运营职位, e飞蚁, 北京, 本科, 150, 初创型, 电子商务 · O2O
互联网运营总监, 6, 不, 运营, 运营, 微通, 东莞, 学历不限, 15, 初创型, 移动互联网 · 电子商务
运营总监助理, 10, 3, 运营, 运营, 信和电信, 广州, 本科, 50, 初创型, 移动互联网 · 数据服务
售后运营总监, 8, 3, 运营, 高端运营职位, 美业邦, 广州, 大专, 50, 成长型, 移动互联网
运营总监/经理, 20, 5, 运营, 运营, 近邻宝, 北京, 本科, 150, 成长型, 移动互联网 · 电子商务
（线上）运营总监, 12, 3, 运营, 高端运营职位, 58月嫂, 北京, 本科, 15, 成长型, 生活服务
运营总监, 32, 5, 运营, 高端运营职位, 非礼物, 北京, 本科, 15, 初创型, 移动互联网 · 电子商务
运营总监, 37, 5, 运营, 运营, 深圳市菲森科技有限公司, 深圳, 本科, 50, 成长型, 移动互联网
售后运营总监, 8, 3, 运营, 高端运营职位, 美业邦, 深圳, 大专, 50, 成长型, 移动互联网
运营总监（coo）, 27, 5, 运营, 高端运营职位, 轻码云, 深圳, 本科, 15, 初创型, 移动互联网
运营总监, 26, 3, 运营, 运营, 花生快跑, 深圳, 本科, 15, 初创型, 移动互联网 · 社交网络
