JavaScript工程师, 8, 1, 技术, 前端开发, 志鸿科技, 北京, 大专, 150, 成长型, 其他
JavaScript 开发工程师, 22, 1, 技术, 前端开发, 壹财富, 上海, 学历不限, 150, 成长型, 金融
JavaScript, 20, 3, 技术, 前端开发, 去哪儿网, 北京, 本科, 2000, 上市公, 移动互联网
JavaScript工程师, 6, 不, 技术, 前端开发, 三六五网络, 南京, 本科, 500, 上市公, 电子商务
JavaScript, 12, 1, 技术, 前端开发, 图派, 深圳, 本科, 15, 初创型, 社交网络 · 文化娱乐
JavaScript, 7, 1, 技术, 前端开发, 中意北分, 北京, 大专, 150, 成长型, 金融
JavaScript, 17, 3, 技术, 前端开发, 聚合富, 北京, 本科, 15, 初创型, 移动互联网 · 金融
JavaScript/前端, 30, 5, 技术, 前端开发, 我卖我拍, 北京, 大专, 2000, 成熟型, 移动互联网 · 电子商务
JavaScript, 8, 1, 技术, 前端开发, 百分点, 北京, 大专, 500, 成熟型, 数据服务
JavaScript, 20, 3, 技术, 前端开发, 携程旅行网旅游板块, 上海, 本科, 2000, 上市公, 旅游
JavaScript, 7, 1, 技术, 前端开发, 房微爱, 天津, 本科, 150, 初创型, 电子商务 · O2O
JavaScript, 18, 3, 技术, 前端开发, Accenture, 上海, 本科, 2000, 上市公, 企业服务
JavaScript（JS）工程师, 10, 不, 技术, 移动开发, 苏州啰嗦科技信息有限公司, 苏州, 学历不限, 150, 成长型, 移动互联网
JavaScript工程师, 18, 3, 技术, 前端开发, 比特兄弟, 北京, 本科, 15, 初创型, 企业服务 · 数据服务
JavaScript, 11, 3, 技术, 前端开发, 全满贯, 北京, 学历不限, 15, 成长型, 移动互联网
JavaScript, 18, 5, 技术, 前端开发, 小小网络, 杭州, 大专, 150, 成长型, 移动互联网
JavaScript, 5, 1, 技术, 前端开发, 8673h, 台州, 大专, 50, 初创型, 移动互联网 · O2O
JavaScript, 15, 3, 技术, 前端开发, 时时康, 北京, 学历不限, 50, 初创型, 电子商务 · O2O
JavaScript, 15, 1, 技术, 前端开发, 新言教育, 杭州, 本科, 15, 初创型, 移动互联网 · 教育
JavaScript开发工程师, 10, 不, 技术, 前端开发, 北风网, 上海, 学历不限, 50, 成长型, 教育 · 数据服务
JavaScript, 15, 3, 技术, 前端开发, 美房网, 北京, 本科, 50, 成长型, 移动互联网 · O2O
JavaScript工程师, 20, 不, 技术, 前端开发, 赶集网, 北京, 大专, 2000, 成熟型, 电子商务 · 分类信息
JavaScript, 12, 1, 技术, 前端开发, 途牛旅游网, 南京, 本科, 2000, 上市公, 电子商务 · 旅游
JavaScript, 12, 3, 技术, 前端开发, 中斗科技, 北京, 本科, 50, 成长型, 移动互联网 · 电子商务
JavaScript, 9, 1, 技术, 前端开发, 拓诊信息, 重庆, 大专, 15, 初创型, 移动互联网 · 数据服务
JavaScript, 15, 1, 技术, 前端开发, 络客, 北京, 本科, 15, 初创型, 移动互联网 · O2O
JavaScript, 9, 1, 技术, 前端开发, VASTO, 广州, 学历不限, 150, 成长型, 其他
JavaScript开发工程师, 19, 3, 技术, 前端开发, 极光推送, 深圳, 本科, 50, 成长型, 移动互联网 · 金融
JavaScript, 17, 3, 技术, 前端开发, 中融民信, 北京, 本科, 2000, 成熟型, 移动互联网 · 金融
JavaScript, 11, 1, 技术, 前端开发, 掌中世纪, 北京, 本科, 15, 初创型, 移动互联网 · 游戏
JavaScript, 7, 不, 技术, 前端开发, 百途网络, 杭州, 本科, 15, 初创型, 电子商务 · O2O
JavaScript, 8, 不, 技术, 前端开发, 玩聚北京, 北京, 本科, 15, 成长型, 移动互联网 · O2O
JavaScript, 8, 3, 技术, 前端开发, 诚智天扬, 杭州, 本科, 50, 初创型, 移动互联网
JavaScript, 11, 不, 技术, 前端开发, 诚智天扬, 杭州, 本科, 50, 初创型, 移动互联网
JavaScript, 11, 3, 技术, 前端开发, 米阳科技, 杭州, 大专, 15, 初创型, 移动互联网 · 电子商务
JavaScript, 16, 3, 技术, 前端开发, 冠群驰骋, 北京, 本科, 2000, 成熟型, 移动互联网 · 金融
JavaScript, 12, 1, 技术, 前端开发, 象文科技, 杭州, 本科, 50, 成长型, 移动互联网
JavaScript, 13, 不, 技术, 前端开发, 天耀宏图, 北京, 本科, 50, 成长型, 数据服务
JavaScript, 22, 3, 技术, 前端开发, 优云软件, 杭州, 大专, 150, 成长型, 移动互联网 · 数据服务
JavaScript, 6, 不, 技术, 前端开发, 华软国际, 北京, 学历不限, 150, 成长型, 移动互联网
JavaScript, 17, 3, 技术, 前端开发, 携程, 上海, 大专, 2000, 上市公, 移动互联网 · 旅游
JavaScript, 22, 不, 技术, 前端开发, 我卖我拍, 北京, 学历不限, 2000, 成熟型, 移动互联网 · 电子商务
JavaScript工程师, 20, 1, 技术, 前端开发, 鑫合汇, 上海, 大专, 50, 初创型, 金融
JavaScript, 14, 3, 技术, 前端开发, 上海善林金融信息服务有限公司, 上海, 大专, 2000, 初创型, 金融
JavaScript开发, 15, 1, 技术, 前端开发, 略懂科技, 杭州, 本科, 15, 初创型, 企业服务 · O2O
JavaScript, 11, 1, 技术, 前端开发, 时代银通, 杭州, 学历不限, 150, 成长型, 金融
JavaScript, 9, 1, 技术, 前端开发, 洋洲荟, 深圳, 大专, 15, 初创型, 移动互联网 · 电子商务
JavaScript前端开发工程师, 20, 3, 技术, 前端开发, 轻易贷, 北京, 大专, 2000, 上市公, 金融
JavaScript前端工程师, 20, 3, 技术, 前端开发, 轻易贷, 北京, 大专, 2000, 上市公, 金融
JavaScript, 15, 1, 技术, 前端开发, 远尚互联网金融服务, 深圳, 本科, 50, 成长型, 移动互联网 · 金融
JavaScript, 7, 1, 技术, 前端开发, 东软睿道, 北京, 大专, 2000, 初创型, 移动互联网 · 教育
JavaScript, 15, 1, 技术, 前端开发, 宝库在线, 北京, 大专, 50, 成长型, 移动互联网 · 电子商务
JavaScript, 13, 1, 技术, 前端开发, 上海品米信息科技有限公司, 上海, 本科, 15, 初创型, 移动互联网 · O2O
JavaScript, 20, 1, 技术, 前端开发, 和管天下（北京）咨询有限公司, 北京, 本科, 15, 初创型, 企业服务
JavaScript, 5, 1, 技术, 前端开发, 瑞骐金融, 成都, 大专, 150, 初创型, 移动互联网 · 金融
JavaScript, 12, 不, 技术, 前端开发, 国药健康, 北京, 大专, 500, 初创型, 移动互联网 · 电子商务
JavaScript, 15, 1, 技术, 前端开发, 微在 Wezeit.com, 北京, 本科, 50, 成长型, 移动互联网 · 文化娱乐
JavaScript, 12, 3, 技术, 前端开发, 奇葩游戏, 杭州, 大专, 50, 成长型, 移动互联网 · 游戏
JavaScript, 10, 3, 技术, 前端开发, 北京世纪联合网络技术有限公司, 北京, 大专, 2000, 成熟型, 移动互联网 · 分类信息
JavaScript, 13, 1, 技术, 前端开发, 井通北京, 北京, 大专, 50, 初创型, 移动互联网
JavaScript, 17, 3, 技术, 前端开发, 微星星, 深圳, 本科, 15, 初创型, 移动互联网
javascript工程师, 12, 1, 技术, 前端开发, 知网, 北京, 本科, 2000, 上市公, 移动互联网 · 电子商务
JavaScript前端开发工程师, 22, 1, 技术, 前端开发, 滴滴打车, 北京, 本科, 500, 成熟型, 移动互联网
JavaScript, 22, 1, 技术, 前端开发, 楚楚街, 北京, 大专, 150, 成熟型, 移动互联网 · 电子商务
JavaScript开发（金台夕照）, 9, 1, 技术, 前端开发, 联想利泰, 北京, 大专, 500, 初创型, 移动互联网 · 招聘
JavaScript, 22, 3, 技术, 前端开发, 赶集网, 北京, 本科, 500, 成熟型, 移动互联网 · 分类信息
JavaScript, 12, 1, 技术, 前端开发, 爱饰家网络, 深圳, 本科, 150, 成长型, 电子商务 · O2O
JavaScript, 22, 1, 技术, 前端开发, 皇包车, 北京, 本科, 50, 成长型, 移动互联网 · O2O
JavaScript, 10, 1, 技术, 前端开发, 会想科技, 杭州, 学历不限, 15, 初创型, 移动互联网 · 金融
JavaScript, 9, 1, 技术, 前端开发, 欧典智能, 长沙, 学历不限, 15, 初创型, 移动互联网 · 其他
JavaScript, 19, 1, 技术, 前端开发, 途家网, 上海, 学历不限, 2000, 成熟型, 移动互联网 · O2O
JavaScript前端开发, 15, 1, 技术, 前端开发, 小马科技, 北京, 大专, 500, 成长型, 移动互联网 · 教育
JavaScript, 25, 3, 技术, 前端开发, 今聿科技, 北京, 本科, 15, 初创型, 电子商务 · 移动互联网
JavaScript, 7, 1, 技术, 前端开发, 中软国际, 武汉, 本科, 2000, 上市公, 移动互联网
JavaScript, 15, 1, 技术, 前端开发, 优信, 深圳, 本科, 15, 初创型, 企业服务 · 数据服务
JavaScript, 11, 1, 技术, 前端开发, 优鲜科技, 杭州, 本科, 15, 初创型, 移动互联网 · O2O
JavaScript, 7, 1, 技术, 前端开发, 鸿蒙科技, 广州, 本科, 15, 初创型, 移动互联网 · 电子商务
JavaScript, 15, 3, 技术, 前端开发, QUAUQ Tech, 北京, 本科, 50, 成长型, 电子商务 · 旅游
JavaScript, 4, 1, 技术, 前端开发, 嘉兴春秋信息, 嘉兴, 大专, 15, 初创型, 移动互联网
JavaScript, 6, 1, 技术, 前端开发, 安徽机器猫, 合肥, 学历不限, 150, 初创型, 移动互联网 · O2O
JavaScript, 8, 1, 技术, 前端开发, 中农数据, 深圳, 本科, 50, 成长型, 移动互联网 · 数据服务
JavaScript, 9, 1, 技术, 前端开发, 问我, 深圳, 大专, 50, 成长型, 移动互联网 · 社交网络
JavaScript, 19, 3, 技术, 前端开发, 买买提互联网金融, 深圳, 本科, 50, 成长型, 金融
JavaScript, 12, 不, 技术, 前端开发, 中公网校, 北京, 学历不限, 2000, 成熟型, 电子商务 · 教育
JavaScript, 16, 3, 技术, 前端开发, 斗鱼TV, 北京, 本科, 150, 成长型, 移动互联网
JavaScript, 10, 1, 技术, 前端开发, 和鸿盈科, 北京, 大专, 150, 初创型, 其他
JavaScript, 7, 不, 技术, 前端开发, 魅课科技, 合肥, 本科, 15, 初创型, 企业服务 · 教育
JavaScript, 23, 5, 技术, 前端开发, 亿达信息, 深圳, 本科, 2000, 上市公, 移动互联网 · 招聘
JAVASCRIPT开发工程师, 5, 1, 技术, 移动开发, 赛驰科技, 郑州, 大专, 50, 成长型, 数据服务 · 文化娱乐
高级JavaScript（前端开发）, 30, 3, 技术, 前端开发, 宜创, 北京, 大专, 15, 初创型, 移动互联网 · 企业服务
JavaScript, 7, 1, 技术, 前端开发, 云投汇, 北京, 大专, 15, 初创型, 金融
JavaScript, 9, 1, 技术, 前端开发, 广东麦斯卡体育用品有限公司, 广州, 大专, 500, 成熟型, 电子商务
JavaScript, 7, 3, 技术, 前端开发, 武汉九方, 武汉, 大专, 150, 初创型, 企业服务
JavaScript, 19, 1, 技术, 前端开发, 明略数据, 北京, 本科, 150, 成长型, 数据服务
JavaScript/Web前端开发工程师, 15, 3, 技术, 前端开发, 上海移品信息技术有限公司, 上海, 本科, 50, 成长型, 移动互联网 · 企业服务
JavaScript, 12, 不, 技术, 前端开发, 田觅觅, 深圳, 学历不限, 50, 成长型, 移动互联网 · O2O
JavaScript, 15, 1, 技术, 前端开发, 中儒泰纳, 北京, 本科, 15, 成长型, 移动互联网 · 社交网络
JavaScript, 10, 1, 技术, 前端开发, 维尔盛, 深圳, 大专, 150, 初创型, 移动互联网 · 电子商务
JavaScript（游戏前端）, 12, 3, 技术, 前端开发, 云中万维（北京）科技有限公司, 广州, 大专, 15, 成长型, 游戏
JavaScript前端工程师, 15, 1, 技术, 前端开发, 酷趣, 上海, 大专, 150, 初创型, 移动互联网
JavaScript研发工程师, 15, 不, 技术, 前端开发, AdMaster, 上海, 大专, 150, 成熟型, 数据服务
JavaScript, 5, 1, 技术, 前端开发, 物产中拓, 长沙, 大专, 500, 上市公, 电子商务
JavaScript, 11, 不, 技术, 前端开发, 广州碧软信息科技有限公司, 深圳, 学历不限, 50, 初创型, 企业服务 · 金融
JavaScript, 16, 3, 技术, 前端开发, 龙源美生, 成都, 大专, 15, 成长型, 移动互联网 · 医疗健康
JavaScript前端开发, 15, 1, 技术, 前端开发, 跨境易, 深圳, 大专, 150, 成长型, 移动互联网 · 电子商务
JavaScript, 6, 1, 技术, 前端开发, 医路, 广州, 本科, 15, 初创型, 移动互联网 · 分类信息
JavaScript, 15, 3, 技术, 前端开发, 92网络, 广州, 大专, 15, 初创型, 移动互联网
JavaScript, 12, 1, 技术, 前端开发, 蛙鸣, 广州, 学历不限, 15, 初创型, 移动互联网
JavaScript, 15, 3, 技术, 前端开发, 易如付, 北京, 本科, 500, 成熟型, 移动互联网 · 金融
JavaScript, 22, 3, 技术, 前端开发, 北京弟傲思, 北京, 本科, 15, 初创型, 教育 · 金融
JavaScript, 15, 3, 技术, 前端开发, 联创兄弟, 北京, 大专, 150, 初创型, 移动互联网 · 医疗健康
JavaScript, 9, 3, 技术, 前端开发, 快悦信息, 广州, 大专, 50, 初创型, 移动互联网 · 金融
JavaScript, 5, 不, 技术, 前端开发, 南京中软, 南京, 大专, 2000, 上市公, 移动互联网 · 企业服务
JavaScript/DIV+CSS/JS, 5, 不, 技术, 前端开发, 担路网, 上海, 大专, 15, 初创型, 移动互联网 · 企业服务
JavaScript开发工程师, 13, 3, 技术, 前端开发, 北迈网, 北京, 本科, 150, 成长型, 电子商务
中级JavaScript（前端开发）, 15, 1, 技术, 前端开发, 宜创, 北京, 学历不限, 15, 初创型, 移动互联网 · 企业服务
JavaScript, 30, 3, 技术, 前端开发, 南电科技, 北京, 大专, 2000, 成熟型, 电子商务 · 数据服务
JavaScript, 15, 3, 技术, 前端开发, 互动大师iH5.cn, 广州, 本科, 15, 成长型, 数据服务
JavaScript, 9, 不, 技术, 前端开发, 一起驾, 广州, 学历不限, 15, 初创型, 移动互联网 · 旅游
javascript, 12, 3, 技术, 前端开发, 筷子科技, 广州, 大专, 15, 初创型, 数据服务 · 广告营销
JavaScript, 12, 3, 技术, 前端开发, 美国道富, 杭州, 本科, 2000, 上市公, 金融
JavaScript, 11, 1, 技术, 前端开发, 云天星光, 深圳, 本科, 15, 成长型, 移动互联网 · 其他
JavaScript, 15, 1, 技术, 前端开发, Quantex, 深圳, 学历不限, 15, 初创型, 移动互联网 · 金融
JavaScript, 11, 1, 技术, 前端开发, 深圳市闻讯数码科技有限公司, 深圳, 大专, 15, 成长型, 企业服务 · 数据服务
Javascript, 12, 1, 技术, 前端开发, 意派科技(epub360), 上海, 大专, 15, 初创型, 移动互联网 · 企业服务
javascript开发，JS开发, 18, 3, 技术, 前端开发, 必要商城, 北京, 大专, 50, 成长型, 电子商务
JavaScript工程师, 19, 3, 技术, 前端开发, 阿里巴巴, 杭州, 学历不限, 2000, 上市公, 移动互联网
JavaScript, 9, 3, 技术, 前端开发, MCI, 成都, 本科, 15, 初创型, 移动互联网
JavaScript/js, 11, 1年以, 技术, 前端开发, 多益网络, 广州, 本科, 500, 成熟型, 移动互联网
JavaScript前端开发工程师, 4, 不, 技术, 前端开发, 埃米信息 ANGINFO, 青岛, 学历不限, 15, 初创型, 移动互联网 · 硬件
JavaScript, 10, 不, 技术, 前端开发, 欧法信, 深圳, 学历不限, 15, 初创型, 移动互联网
JavaScript, 30, 3, 技术, 前端开发, 南电科技, 北京, 大专, 2000, 成熟型, 电子商务 · 数据服务
JavaScript, 11, 1, 技术, 前端开发, 天道新创, 深圳, 大专, 15, 初创型, 移动互联网 · O2O
JavaScript, 4, 1, 技术, 前端开发, 优木乐视, 济南, 学历不限, 15, 初创型, 教育 · 文化娱乐
JavaScript, 20, 3, 技术, 前端开发, 深圳市彩讯科技有限公司, 深圳, 本科, 500, 成熟型, 移动互联网 · O2O
JavaScript工程师, 14, 1, 技术, 前端开发, 米乐灵, 广州, 大专, 15, 初创型, 移动互联网 · 社交网络
JavaScript, 10, 3, 技术, 前端开发, WaveFax, 广州, 本科, 15, 初创型, 企业服务
JavaScript, 6, 不, 技术, 前端开发, 金瑞帆科技, 北京, 本科, 50, 初创型, 移动互联网 · 金融
JavaScript 002, 11, 1, 技术, 前端开发, 上海金程教育培训有限公司, 上海, 大专, 150, 成长型, 教育
JavaScript, 10, 3, 技术, 前端开发, 永凯软件, 上海, 大专, 50, 初创型, 信息安全 · 硬件
JavaScript, 21, 3, 技术, 前端开发, 广田智能, 深圳, 本科, 50, 上市公, 硬件
JavaScript开发工程师, 15, 3, 技术, 前端开发, 英飞拓, 深圳, 本科, 500, 上市公, 硬件
JavaScript工程师, 15, 3, 技术, 前端开发, 比特兄弟, 南京, 本科, 15, 初创型, 企业服务 · 数据服务
JavaScript, 12, 3, 技术, 前端开发, 柯莱特, 北京, 本科, 2000, 成熟型, 企业服务 · 金融
JavaScript, 4, 1, 技术, 前端开发, 云锡集团, 徐州, 本科, 500, 上市公, 金融 · 分类信息
JavaScript, 20, 3, 技术, 前端开发, 上海钱酷网络科技有限公司, 上海, 大专, 15, 初创型, 移动互联网 · O2O
JavaScript 开发工程师, 7, 1, 技术, 前端开发, 川陀大匠, 南京, 本科, 15, 初创型, 移动互联网
JavaScript前端开发, 13, 不, 技术, 前端开发, 趣运动, 广州, 学历不限, 150, 成长型, 移动互联网  · O2O
JavaScript, 7, 1, 技术, 前端开发, 杭州巨星科技, 杭州, 大专, 2000, 上市公, 移动互联网 · 电子商务
JavaScript, 9, 不, 技术, 前端开发, 北京天融信公司, 北京, 本科, 2000, 上市公, 信息安全
JavaScript, 14, 1, 技术, 前端开发, 金证股份, 成都, 本科, 2000, 上市公, 金融
JavaScript, 6, 1, 技术, 前端开发, 广州佳游, 广州, 大专, 15, 初创型, 游戏
JavaScript 开发工程师, 10, 1, 技术, 前端开发, 广州齐昌, 广州, 本科, 15, 初创型, 企业服务
javascript开发工程师（游戏前端）, 12, 3, 技术, 前端开发, 弘先网络科技, 广州, 大专, 50, 成长型, 移动互联网 · 游戏
JavaScript, 13, 3, 技术, 前端开发, 艾普智城, 北京, 本科, 50, 初创型, 移动互联网 · 数据服务
JavaScript, 11, 1, 技术, 前端开发, 拼拼科技, 西安, 本科, 15, 初创型, 移动互联网 · 生活服务
JavaScript, 6, 1, 技术, 前端开发, 城市纵横传媒机构, 深圳, 本科, 150, 成长型, 文化娱乐
高级Javascript开发工程师, 20, 3, 技术, 前端开发, 外卖超人, 上海, 学历不限, 150, 成长型, 电子商务
JavaScript开发工程师, 10, 1, 技术, 前端开发, 新图软件, 北京, 本科, 150, 成长型, 移动互联网 · 企业服务
JavaScript, 5, 1, 技术, 前端开发, 易途客(北京总部), 武汉, 大专, 50, 成长型, 移动互联网
JavaScript, 11, 3, 技术, 前端开发, 快问中医, 深圳, 本科, 15, 初创型, 移动互联网 · 医疗健康
JavaScript前端开发工程师, 15, 3, 技术, 前端开发, 英飞拓, 深圳, 本科, 500, 上市公, 硬件
JavaScript/H5开发工程师, 20, 3, 技术, 前端开发, 携程, 上海, 大专, 2000, 上市公, 移动互联网 · 旅游
JavaScript前端开发工程师, 21, 1, 技术, 前端开发, 创新学堂, 北京, 本科, 15, 初创型, 移动互联网 · O2O
JavaScript, 10, 1, 技术, 前端开发, 北斗院, 深圳, 本科, 50, 初创型, 移动互联网 · 数据服务
JavaScript工程师/交互脚本工程师, 4, 1, 技术, 后端开发, 律信律师, 成都, 大专, 150, 成长型, 电子商务
JavaScript, 13, 3, 技术, 前端开发, 云端信联, 深圳, 本科, 50, 成长型, 移动互联网 · 电子商务
JavaScript高级开发工程师, 22, 3, 技术, 前端开发, 杏树林, 北京, 本科, 150, 成长型, 移动互联网 · 医疗健康
JavaScript开发工程师, 10, 1, 技术, 前端开发, 丁香园, 杭州, 学历不限, 500, 成熟型, 移动互联网 · 电子商务
JavaScript, 11, 1, 技术, 前端开发, 天泽众合, 北京, 学历不限, 50, 成长型, 移动互联网 · 电子商务
JavaScript, 12, 3, 技术, 前端开发, 中国亿教亿学网, 杭州, 大专, 50, 初创型, 教育
JavaScript, 12, 1, 技术, 前端开发, 大华股份, 杭州, 本科, 2000, 上市公, 信息安全
JavaScript, 11, 1, 技术, 前端开发, 淘宝天下, 杭州, 大专, 150, 初创型, 移动互联网 · 文化娱乐
JavaScript, 10, 1, 技术, 前端开发, 智享科技（超级讲师）, 北京, 本科, 15, 初创型, 移动互联网 · 教育
JavaScript开发工程师, 16, 1, 技术, 前端开发, 数美时代, 北京, 本科, 15, 成长型, 企业服务 · 数据服务
Javascript 工程师, 15, 1, 技术, 后端开发, 集货优运, 广州, 大专, 50, 成长型, 移动互联网 · 电子商务
JavaScript前端开发工程师, 22, 3, 技术, 前端开发, 精灵网, 上海, 大专, 50, 成长型, 移动互联网 · 电子商务
JavaScript Developer, 22, 1, 技术, 前端开发, XMind, 深圳, 本科, 15, 初创型, 移动互联网
JavaScript前端开发工程师, 22, 3, 技术, 前端开发, 精灵网, 上海, 大专, 50, 成长型, 移动互联网 · 电子商务
前端开发（JavaScript）, 15, 1, 技术, 前端开发, 多彩人生, 深圳, 本科, 15, 初创型, 移动互联网
高级JavaScript工程师, 22, 1, 技术, 前端开发, 诸葛云游, 北京, 本科, 15, 初创型, 企业服务 · 数据服务
JavaScript, 20, 1, 技术, 前端开发, 欢动, 北京, 本科, 50, 成长型, 移动互联网 · 游戏
JavaScript, 9, 1, 技术, 前端开发, 捷云易商, 北京, 学历不限, 15, 初创型, 电子商务 · 金融
Javascript研发工程师（互联网）, 8, 1, 技术, 前端开发, 畅途网, 南京, 本科, 150, 成熟型, 电子商务
高级开发工程师-JavaScript, 30, 3, 技术, 前端开发, FreeWheel, 北京, 本科, 150, 上市公, 企业服务 · 数据服务
JavaScript资深工程师/技术经理, 24, 3, 技术, 前端开发, Udesk－企业级智能客服平台, 北京, 本科, 50, 成长型, 移动互联网 · 数据服务
JavaScript, 22, 1, 技术, 前端开发, 优米网, 北京, 大专, 150, 初创型, 移动互联网 · 教育
JavaScript前端开发, 22, 3, 技术, 前端开发, 我卖我拍, 北京, 本科, 2000, 成熟型, 移动互联网 · 电子商务
前端开发工程师（JavaScript）, 15, 1, 技术, 前端开发, 中顺易, 深圳, 大专, 150, 成长型, 移动互联网 · 金融
JavaScript, 15, 1, 技术, 前端开发, 汇金宝科技, 北京, 大专, 150, 成熟型, 金融
JavaScript前端开发工程师, 30, 5, 技术, 前端开发, 我卖我拍, 北京, 大专, 2000, 成熟型, 移动互联网 · 电子商务
高级JavaScript开发工程师, 20, 5, 技术, 前端开发, 翼龙贷网, 北京, 本科, 150, 成长型, 金融
前端开发（JavaScript）, 19, 3, 技术, 前端开发, 中顺易, 深圳, 大专, 150, 成长型, 移动互联网 · 金融
JavaScript, 10, 不, 技术, 前端开发, 南昌技术, 南昌, 学历不限, 15, 初创型, 移动互联网 · 社交网络
高级JavaScript开发, 20, 5, 技术, 前端开发, 商为电商, 上海, 本科, 150, 成长型, 电子商务
JavaScript, 17, 3, 技术, 前端开发, 招商壹零壹, 广州, 大专, 500, 初创型, 移动互联网 · 电子商务
JavaScript, 15, 1, 技术, 前端开发, 投融长富, 杭州, 本科, 500, 初创型, 移动互联网 · 金融
JavaScript, 45, 5, 技术, 前端开发, 中国屹丰集团, 北京, 大专, 500, 初创型, 分类信息 · 其他
JavaScript前端开发工程师, 20, 3, 技术, 前端开发, 百分点, 北京, 大专, 500, 成熟型, 数据服务
中级JavaScript工程师, 13, 1, 技术, 前端开发, 品而 Pier, 上海, 本科, 15, 成长型, 移动互联网 · 金融
前端工程师（JavaScript）, 22, 不, 技术, 前端开发, XMind, 深圳, 本科, 15, 初创型, 移动互联网
JavaScript, 4, 1, 技术, 前端开发, 顶享传美, 成都, 学历不限, 15, 初创型, 广告营销
JavaScript, 10, 应届毕业, 技术, 前端开发, 上海品米信息科技有限公司, 上海, 本科, 15, 初创型, 移动互联网 · O2O
JAVASCRIPT技术开发, 12, 1, 技术, 前端开发, 万邦华唐, 北京, 学历不限, 50, 成长型, 移动互联网 · 教育
JavaScript开发工程师, 10, 不, 技术, 移动开发, 美颜家, 广州, 大专, 50, 成长型, O2O
JavaScript, 6, 不, 技术, 前端开发, 凡客科技, 深圳, 学历不限, 15, 初创型, 移动互联网
JavaScript, 15, 1, 技术, 前端开发, 小荷特卖, 深圳, 本科, 150, 成长型, 电子商务
JavaScript, 6, 不, 技术, 前端开发, 金铠甲科技, 成都, 本科, 50, 成长型, 移动互联网
JavaScript开发, 15, 1, 技术, 前端开发, 网易, 杭州, 本科, 2000, 上市公, 移动互联网 · 游戏
JavaScript（实习）, 3, 不, 技术, 前端开发, 掌阅科技, 北京, 本科, 150, 初创型, 移动互联网
JavaScript, 9, 1, 技术, 前端开发, 软通动力, 西安, 本科, 2000, 上市公, 移动互联网 · 企业服务
JavaScript, 7, 1年以, 技术, 后端开发, 柯莱特, 北京, 学历不限, 2000, 成熟型, 企业服务 · 金融
JavaScript高级工程师, 8, 1, 技术, 前端开发, 比一比, 深圳, 本科, 15, 成长型, 电子商务 · 数据服务
JavaScript 开发工程师, 20, 3, 技术, 前端开发, 1号车网, 北京, 大专, 2000, 上市公, 电子商务 · O2O
JavaScript 前端开发, 22, 5, 技术, 前端开发, 我卖我拍, 北京, 大专, 2000, 成熟型, 移动互联网 · 电子商务
前端开发工程师JavaScript, 25, 5, 技术, 前端开发, 和美科技, 北京, 大专, 50, 成长型, 移动互联网 · 数据服务
JavaScript前端开发工程师, 20, 3, 技术, 前端开发, 1号车网, 北京, 大专, 2000, 上市公, 电子商务 · O2O
JavaScript, 7, 1年以, 技术, 前端开发, 泰德网聚, 北京, 大专, 50, 成长型, 移动互联网
JavaScript工程师, 12, 3, 技术, 前端开发, 捷云易商, 成都, 学历不限, 15, 初创型, 电子商务 · 金融
前端开发 JavaScript, 9, 3, 技术, 前端开发, 亿达信息, 大连, 本科, 2000, 上市公, 移动互联网 · 招聘
JavaScript, 25, 3, 技术, 前端开发, EPAM, 深圳, 本科, 2000, 成熟型, 金融 · 其他
前端开发 JavaScript, 9, 3, 技术, 前端开发, 亿达信息, 大连, 本科, 2000, 上市公, 移动互联网 · 招聘
JavaScript开发工程师, 11, 3, 技术, 前端开发, 无线天利, 上海, 大专, 150, 上市公, 移动互联网
