Python（需熟悉JavaScript）, 7, 1年以, 技术, 后端开发, 波恩网络科技, 上海, 本科, 15, 初创型, 移动互联网
高级前端/Javascript/H5 开发工程师--战略发展部, 22, 3, 技术, 前端开发, 大麦网, 北京, 大专, 500, 成熟型, 移动互联网 · 电子商务
web前端工程师(html5/Javascript), 7, 1, 技术, 前端开发, 启云软件, 合肥, 大专, 50, 初创型, 移动互联网
CSS/JavaScript/HTML 前端, 13, 1, 技术, 前端开发, TheMindList, 上海, 本科, 15, 初创型, 移动互联网
HTML/CSS/JavaScript前端工程师［拒绝码农］, 12, 1, 技术, 前端开发, 易商迅达, 北京, 本科, 15, 初创型, 企业服务 · 数据服务
高级Web前端开发工程师（HTML CSS javascript）PC端, 12, 3, 技术, 前端开发, 要出发, 广州, 本科, 500, 成熟型, 电子商务 · 生活服务
JavaScript Nodejs Meteor Html5, 11, 不, 技术, 前端开发, 财录, 上海, 本科, 15, 成长型, 移动互联网 · 金融
Web 前端工程師 (Javascript), 17, 1, 技术, 前端开发, 好住科技, 深圳, 大专, 15, 初创型, 教育 · 生活服务
JavaScript(Bootstrap、AngularJS、ionic优先考虑）, 25, 5, 技术, 前端开发, 中微信用, 北京, 学历不限, 150, 成长型, 移动互联网 · 金融
高级前端工程师 （Javascript HTML5开发）, 19, 3, 技术, 前端开发, 携程, 上海, 本科, 2000, 上市公, 移动互联网 · 旅游
HTML5 web前端 JavaScript, 22, 3, 技术, 移动开发, 我卖我拍, 北京, 大专, 2000, 成熟型, 移动互联网 · 电子商务
JavaScript/前端开发/web前端开发, 10, 1, 技术, 前端开发, 艾瓦特, 长沙, 大专, 50, 成长型, 移动互联网 · 电子商务
游戏服务端工程师/C++工程师/Javascript开发/游戏后端, 8, 1, 技术, 后端开发, 三生石, 郑州, 大专, 50, 成长型, 移动互联网 · 游戏
web前端/html/javascript, 11, 3, 技术, 前端开发, 鑫合汇, 杭州, 大专, 50, 初创型, 金融
前端javascript开发技术员, 9, 1, 技术, 前端开发, 广州市友盈软件科技有限公司, 广州, 学历不限, 15, 初创型, 移动互联网 · 游戏
web前端 JavaScript HTML5, 22, 5, 技术, 前端开发, 我卖我拍, 北京, 大专, 2000, 成熟型, 移动互联网 · 电子商务
前端开发讲师/工程师【JavaScript方向】-平西府, 14, 1, 技术, 前端开发, 智能社, 北京, 学历不限, 15, 初创型, 企业服务 · 教育
JavaScript 移动开发 ios/android, 10, 1, 技术, 前端开发, Chat Neighbors, 深圳, 学历不限, 15, 初创型, 移动互联网 · 文化娱乐
Web前端（JavaScript）, 12, 3, 技术, 前端开发, 同和科技, 深圳, 学历不限, 150, 成长型, 移动互联网 · 金融
Web售前开发工程师 JavaScript, 9, 1, 技术, 前端开发, 数盾科技, 北京, 学历不限, 50, 初创型, 信息安全 · 数据服务
JavaScript web富客户端开发, 20, 5, 技术, 前端开发, 京东, 北京, 学历不限, 2000, 上市公, 电子商务
javascript开发/javascript研发/html/css, 12, 不, 技术, 后端开发, 捷敏信软件科技, 南京, 学历不限, 15, 初创型, 其他
H5 JavaScript 前端高级工程师, 17, 1, 技术, 前端开发, 趣饮吧, 深圳, 本科, 15, 初创型, O2O
前端研发工程师（JavaScript/Html/CSS）, 22, 3, 技术, 前端开发, 盈泰财富云, 北京, 本科, 50, 成长型, 移动互联网 · 金融
html5/css/javascript 前端, 13, 1, 技术, 前端开发, TheMindList, 上海, 本科, 15, 初创型, 移动互联网
Web 前端高級工程師 (Javascript), 27, 3, 技术, 前端开发, 好住科技, 深圳, 大专, 15, 初创型, 教育 · 生活服务
Html5游戏（javascript）实习生, 4, 不, 技术, 移动开发, 编程猫, 深圳, 学历不限, 15, 初创型, 移动互联网 · 教育
初级Python（需熟悉JavaScript/欢迎应届生）, 7, 1年以, 技术, 后端开发, 波恩网络科技, 上海, 本科, 15, 初创型, 移动互联网
web前端开发（HTML CSS javascript）, 8, 1, 技术, 前端开发, 鼎曦网络, 广州, 大专, 50, 初创型, 移动互联网 · O2O
技术产品中心-JavaScript开发工程师-北京, 20, 1, 技术, 前端开发, 爱奇艺, 北京, 本科, 2000, 成熟型, 广告营销 · 文化娱乐
JavaScript，js, web前端，网页前端，html5, 10, 1, 技术, 前端开发, 奇智网络, 南京, 大专, 15, 初创型, 移动互联网 · 教育
HTML5+JavaScript研发工程师, 13, 不, 技术, 移动开发, 北京首映时光科技有限公司, 北京, 本科, 15, 成长型, 移动互联网
web前端技术/前端开发工程师（JavaScript）, 6, 1年以, 技术, 前端开发, 惠到店, 深圳, 学历不限, 15, 初创型, 移动互联网 · O2O
前端/javascript开发架构师/资深开发工程师, 40, 5, 技术, 前端开发, 上马石网络科技, 上海, 本科, 15, 成长型, 移动互联网 · 企业服务
手机游戏研发工程师（HTML5/Javascript/Cocos2D-JS/Egret方向）, 4, 不, 技术, 移动开发, 络想, 厦门, 学历不限, 15, 初创型, 移动互联网 · 广告营销
web前端（Javascript研发）1名, 7, 1, 技术, 前端开发, 海外旅业, 成都, 大专, 500, 成长型, 旅游
java工程师/java开发/java软件工程师/java程序员/javascript, 11, 不, 技术, 后端开发, 三生石, 郑州, 学历不限, 50, 成长型, 移动互联网 · 游戏
高级软件工程师 （前端网页、JavaScript、 Http通讯、Spring), 12, 3, 技术, 前端开发, 东软集团, 大连, 本科, 2000, 上市公, 金融
JavaScript/网页切图/网页特效设计, 6, 1, 技术, 前端开发, 担路网, 上海, 本科, 15, 初创型, 移动互联网 · 企业服务
手机游戏研发实习生（HTML5/Javascript/Cocos2D-JS方向）, 3, 不, 技术, 移动开发, 络想, 厦门, 学历不限, 15, 初创型, 移动互联网 · 广告营销
react、react native、angularjs、nodejs、javascript 实习生, 3, 应届毕业, 技术, 前端开发, 红马云, 深圳, 大专, 50, 成长型, 金融 · 其他
web前端（Javascript研发）, 7, 1, 技术, 前端开发, 海外旅业, 重庆, 本科, 500, 成长型, 旅游
高级软件工程师 （前端网页、JavaScript、 Http通讯、SpringMVC), 12, 3, 技术, 前端开发, 东软集团, 沈阳, 本科, 2000, 上市公, 金融
web前端/javascript/html5, 9, 1, 技术, 前端开发, 旺年科技, 北京, 大专, 15, 初创型, 移动互联网
Css /Html /Css3 /Html5 /Javascript /Jquery, 7, 不, 技术, 前端开发, IVY's TV, 北京, 学历不限, 15, 初创型, 数据服务 · 文化娱乐
高级开发工程师（Java、Node.js/JavaScript、Scala、C++）, 35, 5, 技术, 后端开发, 广发证券, 深圳, 本科, 2000, 上市公, 金融
Web前端CSS/javascript 开发工程师(非外包，公司自主研发), 6, 1年以, 技术, 前端开发, 博科, 上海, 大专, 150, 初创型, 移动互联网 · 企业服务
C#/QT/Javascript/HTML5前端应用开发工程师_成都, 7, 1, 技术, 前端开发, 臻识科技, 成都, 本科, 15, 成长型, 移动互联网
HTML5/CSS/JavaScript前端［欢迎有创意的工程师，拒绝码农］, 4, 不, 技术, 前端开发, 易商迅达, 北京, 本科, 15, 初创型, 企业服务 · 数据服务
