职位, 工资, 经验要求, 职位一级分类, 职位二级分类, 公司名称, 城市, 学历, 公司规模, 公司阶段, 公司业务领域
JavaScript, 20, 3, 技术, 前端开发, 超客网络, 北京, 大专, 500, 成熟型, 社交网络
JavaScript, 15, 1, 技术, 后端开发, 名传, 上海, 本科, 50, 成长型, 电子商务 · 数据服务
JavaScript, 22, 3, 技术, 前端开发, 广通软件, 杭州, 大专, 150, 上市公, 移动互联网 · 信息安全
JavaScript, 22, 1, 技术, 前端开发, 金扳手, 上海, 本科, 50, 成长型, 移动互联网 · O2O
JavaScript, 15, 不, 技术, 前端开发, 谷露软件, 上海, 学历不限, 15, 成长型, 数据服务 · 招聘
JavaScript, 15, 1, 技术, 前端开发, 上海钢联电子商务股份有限公司, 上海, 本科, 500, 上市公, 移动互联网 · 电子商务
JavaScript, 13, 3, 技术, 前端开发, 聚贸, 杭州, 大专, 150, 成长型, 金融 · 电子商务
JavaScript, 12, 3, 技术, 前端开发, 用友, 北京, 本科, 2000, 上市公, 企业服务 · 数据服务
JavaScript, 12, 1, 技术, 前端开发, 聚居网, 长沙, 本科, 15, 成长型, 移动互联网 · 硬件
JavaScript, 15, 3, 技术, 前端开发, 诸葛理财, 北京, 大专, 50, 成长型, 金融
JavaScript, 12, 1, 技术, 前端开发, 上海莫凡, 上海, 本科, 15, 初创型, 电子商务 · 企业服务
JavaScript工程师, 20, 3, 技术, 前端开发, 新浪乐居, 北京, 大专, 2000, 上市公, 电子商务  · 文化娱乐
JavaScript, 18, 1, 技术, 前端开发, 长亭科技, 北京, 本科, 15, 初创型, 企业服务 · 信息安全
JavaScript, 7, 1, 技术, 前端开发, 冰吉网络, 广州, 大专, 15, 初创型, 移动互联网 · 电子商务
JavaScript, 22, 1, 技术, 前端开发, eengoo, 上海, 本科, 15, 初创型, 移动互联网 · 数据服务
JavaScript, 15, 3, 技术, 前端开发, 银创科技, 北京, 大专, 150, 初创型, 金融
JavaScript, 30, 3, 技术, 前端开发, 易跃移动, 上海, 本科, 150, 成长型, 移动互联网 · 游戏
JavaScript, 15, 1, 技术, 前端开发, 多彩人生, 深圳, 本科, 15, 初创型, 移动互联网
JavaScript, 15, 1, 技术, 前端开发, 通优科技, 上海, 大专, 15, 初创型, 移动互联网 · 教育
JavaScript, 9, 1, 技术, 前端开发, 银橙传媒, 上海, 大专, 150, 上市公, 移动互联网 · 数据服务
Javascript/JS工程师, 12, 1, 技术, 前端开发, 金扳手, 上海, 本科, 50, 成长型, 移动互联网 · O2O
JavaScript, 9, 不, 技术, 前端开发, 旺亨, 南京, 学历不限, 50, 成长型, 移动互联网 · 金融
JavaScript, 11, 不, 技术, 前端开发, 深圳成为智能交通, 西安, 本科, 150, 成长型, 移动互联网 · 硬件
JavaScript, 9, 3, 技术, 前端开发, 多立恒, 武汉, 学历不限, 15, 初创型, 移动互联网 · 数据服务
JavaScript, 22, 3, 技术, 前端开发, 一猫汽车网, 北京, 大专, 150, 成长型, 电子商务 · O2O
JavaScript, 12, 1, 技术, 前端开发, 蓝鸽集团, 广州, 本科, 500, 成熟型, 移动互联网 · 企业服务
JavaScript, 8, 3, 技术, 前端开发, 维创盈通, 郑州, 大专, 50, 初创型, 移动互联网 · 电子商务
JavaScript, 16, 1, 技术, 前端开发, autophone, 南京, 大专, 15, 成长型, 生活服务
JavaScript, 9, 1, 技术, 前端开发, 什么值得买, 青岛, 大专, 150, 成长型, 电子商务 · 文化娱乐
JavaScript, 7, 1, 技术, 前端开发, 万贸科技, 天津, 本科, 50, 成长型, 企业服务 · 文化娱乐
JavaScript, 12, 1, 技术, 前端开发, 优酷土豆, 北京, 本科, 2000, 上市公, 数据服务 · 文化娱乐
JavaScript, 15, 3, 技术, 前端开发, 美的, 佛山, 本科, 2000, 上市公, 移动互联网 · 其他
JavaScript, 11, 不, 技术, 前端开发, YAOPAI, 郑州, 学历不限, 15, 初创型, O2O · 生活服务
JavaScript, 11, 1, 技术, 前端开发, 上海金程教育培训有限公司, 上海, 大专, 150, 成长型, 教育
JavaScript, 17, 1, 技术, 前端开发, 思埠网络, 广州, 大专, 150, 成长型, 移动互联网
Javascript工程师, 11, 1, 技术, 前端开发, 指南猫, 上海, 大专, 15, 成长型, 移动互联网 · 旅游
JavaScript, 20, 3, 技术, 前端开发, 珠海筑巢, 珠海, 本科, 15, 初创型, 移动互联网 · 电子商务
JavaScript, 23, 3, 技术, 前端开发, 优酷土豆, 北京, 本科, 2000, 上市公, 数据服务 · 文化娱乐
JavaScript工程师, 20, 3, 技术, 前端开发, 外卖超人, 上海, 大专, 150, 成长型, 电子商务
JavaScript, 20, 3, 技术, 前端开发, 容易网, 上海, 大专, 150, 成长型, 电子商务 · O2O
JavaScript, 13, 1, 技术, 前端开发, 车联天下, 北京, 大专, 150, 成长型, 移动互联网 · 金融
JavaScript, 19, 3, 技术, 前端开发, 买衣爽, 上海, 本科, 50, 成长型, 电子商务 · O2O
JavaScript, 9, 不, 技术, 前端开发, 青春科技, 南京, 本科, 50, 初创型, 移动互联网
JavaScript, 7, 1, 技术, 前端开发, 人人车险, 重庆, 大专, 15, 初创型, 移动互联网 · 生活服务
JavaScript, 22, 3, 技术, 前端开发, 智明星通, 北京, 学历不限, 500, 上市公, 移动互联网 · 游戏
JavaScript, 13, 3, 技术, 前端开发, 斑斓信息科技（上海）有限公司, 上海, 大专, 50, 成长型, 电子商务
JavaScript, 8, 不, 技术, 前端开发, 深圳成为智能交通, 深圳, 本科, 150, 成长型, 移动互联网 · 硬件
JavaScript, 12, 1, 技术, 前端开发, 埃姆艺, 上海, 大专, 15, 成长型, 移动互联网 · 数据服务
JavaScript, 9, 1, 技术, 前端开发, 易讯通, 西安, 本科, 150, 成长型, 数据服务 · 其他
JavaScript, 8, 1, 技术, 前端开发, 漫聚信息, 上海, 大专, 15, 初创型, 移动互联网 · 游戏
JavaScript, 4, 1, 技术, 前端开发, 爱熊猫公社, 雅安, 本科, 15, 初创型, 电子商务 · 数据服务
JavaScript, 15, 3, 技术, 前端开发, 纵横天下, 福州, 本科, 50, 成长型, 移动互联网 · 电子商务
JavaScript, 13, 3, 技术, 前端开发, 上海海实信息科技有限公司, 上海, 学历不限, 150, 成长型, 金融
JavaScript, 14, 不, 技术, 前端开发, 达观科技, 上海, 学历不限, 15, 初创型, 移动互联网
JavaScript, 31, 3, 技术, 前端开发, FreeWheel, 北京, 本科, 150, 上市公, 企业服务 · 数据服务
JavaScript, 20, 3, 技术, 前端开发, 沃特财团, 上海, 学历不限, 15, 初创型, 教育
JavaScript, 6, 不, 技术, 前端开发, 枫煌中乾, 南京, 学历不限, 50, 初创型, 电子商务
JavaScript, 12, 3, 技术, 前端开发, 稍息科技, 上海, 大专, 15, 初创型, 电子商务 · 移动互联网
JavaScript, 11, 3, 技术, 前端开发, 太平共享, 上海, 本科, 500, 成熟型, 金融
JavaScript, 20, 1, 技术, 前端开发, 掌门1对1在线教育, 上海, 学历不限, 50, 成长型, 移动互联网 · 教育
JavaScript, 20, 1, 技术, 前端开发, 掌门1对1在线教育, 上海, 学历不限, 150, 成长型, 移动互联网 · 教育
JavaScript工程师, 10, 1, 技术, 前端开发, ihefe, 上海, 大专, 50, 初创型, 移动互联网
JavaScript（前端开发）, 11, 1, 技术, 前端开发, 上海金程教育培训有限公司, 上海, 大专, 150, 成长型, 教育
Javascript, 12, 3, 技术, 前端开发, 数库(上海)科技有限公司, 上海, 大专, 150, 成长型, 金融
JavaScript, 15, 3, 技术, 前端开发, 易至连, 上海, 大专, 50, 成长型, 移动互联网 · 数据服务
JavaScript, 21, 3, 技术, 前端开发, 爱上旅游, 上海, 本科, 50, 成长型, 移动互联网 · 旅游
JavaScript, 14, 3, 技术, 前端开发, 易跃移动, 上海, 本科, 150, 成长型, 移动互联网 · 游戏
JavaScript, 22, 1, 技术, 前端开发, QQ炫舞, 北京, 本科, 150, 成长型, 游戏
JavaScript, 15, 不, 技术, 前端开发, FORK, 北京, 本科, 15, 成长型, 移动互联网 · 社交网络
JavaScript, 16, 3, 技术, 前端开发, 盈黎, 上海, 学历不限, 50, 初创型, 电子商务 · 其他
JavaScript, 12, 1, 技术, 前端开发, 能龙, 上海, 本科, 500, 成熟型, 移动互联网
JavaScript, 20, 3, 技术, 前端开发, 百会, 北京, 大专, 150, 初创型, 移动互联网 · 企业服务
JavaScript, 15, 3, 技术, 前端开发, 帜讯信息, 上海, 本科, 150, 初创型, 移动互联网 · 其他
JavaScript, 15, 3, 技术, 前端开发, 轰隆隆, 上海, 学历不限, 50, 成长型, 移动互联网
JavaScript, 13, 1, 技术, 前端开发, 漫道科技, 上海, 大专, 500, 上市公, 移动互联网
JavaScript, 20, 1, 技术, 前端开发, 倍业科技, 上海, 本科, 15, 初创型, 移动互联网 · 广告营销
JavaScript, 17, 1, 技术, 前端开发, 龙默升科技, 上海, 大专, 15, 成长型, 移动互联网 · 数据服务
JavaScript, 11, 1, 技术, 前端开发, 上海钢联, 上海, 本科, 500, 上市公, 电子商务
JavaScript, 15, 1, 技术, 前端开发, 初创型公司从事互联网+旅游媒体, 苏州, 学历不限, 15, 初创型, 旅游 · 广告营销
JavaScript, 11, 3, 技术, 前端开发, 元宝铺, 杭州, 大专, 150, 成长型, 金融
JavaScript, 17, 3, 技术, 前端开发, 天星资本, 北京, 本科, 150, 成长型, 移动互联网 · 金融
JavaScript, 10, 1, 技术, 前端开发, 软通动力信息技术有限公司, 杭州, 大专, 2000, 上市公, 企业服务
JAVAScript工程师, 5, 1, 技术, 后端开发, 智久（厦门）机器人, 厦门, 本科, 50, 成长型, 其他
JavaScript工程师（后端方向）, 15, 3, 技术, 后端开发, It Consultis, 上海, 学历不限, 15, 初创型, 移动互联网 · 电子商务
JavaScript, 9, 不, 技术, 前端开发, 文思海辉, 上海, 学历不限, 2000, 成熟型, 移动互联网 · 企业服务
JavaScript, 11, 3, 技术, 前端开发, 九洲网上药店, 杭州, 本科, 50, 上市公, 移动互联网 · 电子商务
JavaScript, 12, 1, 技术, 前端开发, 光汇石油, 深圳, 本科, 500, 上市公, 其他
JavaScript, 15, 1, 技术, 前端开发, 爱奇艺, 上海, 本科, 2000, 成熟型, 广告营销 · 文化娱乐
JavaScript, 8, 不, 技术, 前端开发, 中科方德软件有限公司, 北京, 本科, 500, 成熟型, 移动互联网 · 企业服务
JavaScript, 12, 1, 技术, 前端开发, 车哪修, 上海, 大专, 15, 初创型, 电子商务
JavaScript, 10, 1, 技术, 前端开发, 青岛赢信慧通, 青岛, 大专, 50, 成长型, 教育 · 移动互联网
JavaScript, 11, 3, 技术, 前端开发, 中科曙光, 南京, 本科, 500, 上市公, 硬件
JavaScript, 12, 1, 技术, 前端开发, 觊氪, 上海, 学历不限, 15, 初创型, 移动互联网 · 社交网络
JavaScript, 15, 不, 技术, 前端开发, 奇鸟互联网金融信息服务有限公司, 上海, 学历不限, 15, 初创型, 移动互联网
JavaScript, 9, 1, 技术, 前端开发, 文思海辉, 上海, 学历不限, 2000, 成熟型, 移动互联网 · 企业服务
JavaScript, 15, 1, 技术, 前端开发, 中创三优, 北京, 本科, 50, 初创型, 移动互联网 · 数据服务
JavaScript, 22, 3, 技术, 前端开发, 云帐房, 南京, 本科, 50, 成长型, 移动互联网 · 企业服务
JavaScript工程师（前端方向）, 15, 3, 技术, 前端开发, It Consultis, 上海, 学历不限, 15, 初创型, 移动互联网 · 电子商务
JavaScript, 7, 1, 技术, 前端开发, 卓宝计算机, 上海, 大专, 50, 成长型, 移动互联网 · 文化娱乐
JavaScript, 6, 不, 技术, 前端开发, 31TEN, 上海, 学历不限, 15, 初创型, 移动互联网 · 社交网络
JavaScript, 11, 3, 技术, 前端开发, 高伟达, 武汉, 本科, 2000, 上市公, 移动互联网
JavaScript, 7, 1, 技术, 前端开发, 软通动力信息技术有限公司, 杭州, 大专, 2000, 上市公, 企业服务
JavaScript, 7, 3, 技术, 前端开发, 看书网, 武汉, 大专, 50, 成长型, 文化娱乐
JavaScript, 15, 3, 技术, 前端开发, 国信创新, 北京, 大专, 150, 成长型, 移动互联网
JavaScript, 15, 1, 技术, 前端开发, 澳客网, 北京, 本科, 50, 成长型, 移动互联网 · 电子商务
JavaScript, 7, 1, 技术, 前端开发, 中软, 西安, 本科, 2000, 上市公, 移动互联网 · 招聘
JavaScript, 7, 1, 技术, 前端开发, C2fun, 苏州, 大专, 50, 成长型, 移动互联网 · 游戏
JavaScript, 15, 1, 技术, 前端开发, 纵横天下, 福州, 本科, 50, 成长型, 移动互联网 · 电子商务
JavaScript, 24, 1, 技术, 前端开发, QQ炫舞, 北京, 本科, 150, 成长型, 游戏
JavaScript, 18, 3, 技术, 前端开发, 寅君, 上海, 大专, 15, 初创型, 移动互联网 · 电子商务
JavaScript, 4, 1, 技术, 前端开发, 西软, 天津, 大专, 50, 初创型, 医疗健康 · 移动互联网
JavaScript, 7, 1年以, 技术, 前端开发, 云林信息, 昆明, 学历不限, 50, 成长型, 移动互联网 · 电子商务
JavaScript, 7, 1, 技术, 前端开发, 软通动力, 南京, 大专, 2000, 上市公, 移动互联网 · 数据服务
JavaScript开发, 15, 3, 技术, 前端开发, 银创科技, 北京, 大专, 150, 初创型, 金融
JavaScript, 16, 1, 技术, 前端开发, 保险竞标网, 上海, 本科, 15, 初创型, 金融
JavaScript, 8, 1, 技术, 前端开发, WaveFax, 广州, 本科, 15, 初创型, 企业服务
JavaScript, 18, 3, 技术, 前端开发, 富春控股, 上海, 学历不限, 2000, 成熟型, 电子商务
JavaScript, 24, 3, 技术, 前端开发, e代驾, 北京, 本科, 500, 成熟型, 移动互联网 · O2O
JavaScript, 12, 1, 技术, 前端开发, RECO, 上海, 大专, 15, 初创型, 企业服务 · 其他
JavaScript, 5, 3, 技术, 前端开发, 看书网, 武汉, 本科, 50, 成长型, 文化娱乐
JavaScript, 22, 3, 技术, 前端开发, YeahMobi, 上海, 本科, 50, 成长型, 移动互联网 · 广告营销
JavaScript, 10, 3, 技术, 前端开发, 锐达信创, 北京, 本科, 15, 初创型, 移动互联网
JavaScript, 6, 不, 技术, 前端开发, 讯点三维, 杭州, 本科, 15, 初创型, 数据服务 · 硬件
JavaScript, 12, 3, 技术, 前端开发, 锐达信创, 北京, 本科, 15, 初创型, 移动互联网
JavaScript, 6, 1, 技术, 前端开发, 力鼎创软, 济南, 大专, 150, 初创型, 数据服务
JavaScript, 11, 3, 技术, 前端开发, 阿思拓, 杭州, 大专, 150, 成长型, 移动互联网 · 电子商务
JavaScript, 14, 3, 技术, 前端开发, 国广东方网络（北京）有限公司, 北京, 大专, 150, 成长型, 移动互联网 · 文化娱乐
JavaScript, 6, 1, 技术, 前端开发, 天讯瑞达, 广州, 本科, 500, 成熟型, 移动互联网
JavaScript, 12, 1, 技术, 前端开发, 开普互联, 北京, 本科, 150, 初创型, 企业服务 · 数据服务
JavaScript, 11, 1, 技术, 前端开发, 御邦医通, 深圳, 本科, 50, 成长型, 移动互联网 · 医疗健康
JavaScript, 15, 3, 技术, 前端开发, Sandbox3 创合社区, 上海, 大专, 15, 初创型, 移动互联网 · 社交网络
JavaScript, 15, 3, 技术, 后端开发, 国信创新, 北京, 大专, 150, 成长型, 移动互联网
JavaScript, 30, 3, 技术, 前端开发, 金利恒, 北京, 本科, 500, 初创型, 其他
JavaScript, 12, 1, 技术, 前端开发, 小马科技, 北京, 大专, 500, 成长型, 移动互联网 · 教育
JavaScript, 11, 1, 技术, 前端开发, 江苏润和软件股份有限公司, 上海, 本科, 2000, 上市公, 金融
JavaScript, 12, 3, 技术, 前端开发, 锐达信创, 北京, 大专, 15, 初创型, 移动互联网
JavaScript, 10, 不, 技术, 前端开发, 赛瓦软件(上海)有限公司, 上海, 硕士, 15, 初创型, 企业服务
JavaScript, 10, 1, 技术, 前端开发, 亚信, 长沙, 大专, 2000, 上市公, 移动互联网 · 数据服务
JavaScript, 15, 3, 技术, 前端开发, 蓝莓盈动, 北京, 大专, 50, 初创型, 移动互联网
JavaScript, 15, 3, 技术, 前端开发, 广州风寻科技, 广州, 本科, 50, 初创型, 移动互联网 · 信息安全
JavaScript, 32, 5, 技术, 前端开发, 用友, 北京, 大专, 2000, 上市公, 企业服务 · 数据服务
JavaScript, 15, 1, 技术, 前端开发, 多盟, 北京, 本科, 150, 成长型, 移动互联网 · 广告营销
JavaScript/Node.js开发, 10, 1, 技术, 后端开发, 微鲜, 福州, 大专, 15, 初创型, 移动互联网 · 电子商务
JavaScript, 15, 不, 技术, 前端开发, 集货优运, 广州, 学历不限, 50, 成长型, 移动互联网 · 电子商务
JavaScript, 15, 1, 技术, 前端开发, 星辰天合, 北京, 本科, 15, 初创型, 企业服务
JavaScript, 15, 不, 技术, 前端开发, 浙江德发网络科技有限公司, 杭州, 大专, 15, 初创型, 移动互联网 · 电子商务
JavaScript, 11, 1, 技术, 前端开发, 比领网络, 上海, 学历不限, 50, 初创型, 移动互联网 · 信息安全
JavaScript, 8, 1, 技术, 前端开发, 大嘴棋牌_聚洲, 上海, 本科, 15, 初创型, 游戏
JavaScript, 7, 1, 技术, 前端开发, 轻松管科技, 北京, 本科, 15, 初创型, 移动互联网 · O2O
JavaScript, 20, 1, 技术, 前端开发, 直投网, 北京, 大专, 500, 成熟型, 金融
JavaScript, 10, 1, 技术, 前端开发, 智强信息, 上海, 大专, 150, 成长型, 数据服务 · 文化娱乐
JavaScript工程师, 9, 1, 技术, 前端开发, 传化科技, 杭州, 大专, 15, 初创型, 移动互联网 · 电子商务
JavaScript, 27, 5, 技术, 前端开发, 亿达信息技术, 深圳, 本科, 2000, 上市公, 移动互联网 · 招聘
JavaScript, 12, 不, 技术, 前端开发, 掌上快销, 广州, 学历不限, 15, 初创型, 移动互联网 · 企业服务
JavaScript, 15, 3, 技术, 前端开发, 浦嘉资产, 上海, 大专, 150, 成长型, 金融
JavaScript, 9, 1, 技术, 前端开发, 新图软件, 北京, 本科, 150, 成长型, 移动互联网 · 企业服务
JavaScript, 22, 1, 技术, 前端开发, 朝夕, 北京, 本科, 15, 初创型, 移动互联网 · 社交网络
JavaScript, 18, 3, 技术, 前端开发, 品友互动, 北京, 本科, 150, 成熟型, 数据服务 · 广告营销
JavaScript, 22, 1, 技术, 前端开发, 积分互联, 北京, 大专, 50, 成长型, 移动互联网 · 企业服务
JavaScript, 16, 1, 技术, 前端开发, 百分点, 北京, 本科, 500, 成熟型, 数据服务
JavaScript, 12, 1, 技术, 前端开发, 开源力量, 上海, 本科, 50, 初创型, 教育
JavaScript, 12, 1, 技术, 前端开发, 书中网络, 北京, 学历不限, 15, 初创型, 移动互联网 · 其他
JavaScript, 22, 1, 技术, 前端开发, 芝麻到家, 北京, 本科, 150, 成长型, 移动互联网 · O2O
JavaScript, 13, 3, 技术, 前端开发, 鹏无线, 北京, 本科, 2000, 上市公, 数据服务 · 硬件
JavaScript, 12, 3, 技术, 前端开发, 蓝星教育, 北京, 本科, 150, 初创型, 教育
JavaScript, 15, 1, 技术, 前端开发, 清源大数据, 上海, 本科, 15, 初创型, 数据服务
JavaScript, 7, 不, 技术, 前端开发, 福惠软件, 青岛, 学历不限, 50, 成长型, 电子商务 · O2O
JavaScript工程师, 25, 3, 技术, 前端开发, 野狗科技, 北京, 本科, 15, 初创型, 数据服务
JavaScript, 15, 1, 技术, 前端开发, 爱奇艺, 上海, 本科, 2000, 成熟型, 广告营销 · 文化娱乐
JavaScript, 9, 1, 技术, 前端开发, 大数点, 深圳, 本科, 15, 初创型, 移动互联网
JavaScript, 7, 不, 技术, 前端开发, 生活日历, 北京, 本科, 15, 初创型, 移动互联网 · 生活服务
JavaScript, 25, 3, 技术, 前端开发, 南电科技, 北京, 大专, 2000, 成熟型, 电子商务 · 数据服务
JavaScript, 16, 3, 技术, 前端开发, 博彦科技, 上海, 大专, 500, 上市公, 企业服务 · 招聘
JavaScript, 12, 1, 技术, 前端开发, 北京信柏信息科技有限公司, 上海, 大专, 150, 成长型, 电子商务
JavaScript, 11, 3, 技术, 前端开发, 联想利泰, 北京, 学历不限, 500, 初创型, 移动互联网 · 招聘
JavaScript, 6, 1, 技术, 前端开发, 杭州岩泽网络科技有限公司, 杭州, 学历不限, 15, 初创型, 移动互联网
JavaScript, 13, 1, 技术, 前端开发, 集智数据, 深圳, 学历不限, 15, 初创型, 企业服务 · 数据服务
JavaScript, 9, 1, 技术, 前端开发, 合发房银, 上海, 本科, 50, 初创型, 移动互联网 · 金融
JavaScript, 7, 1, 技术, 前端开发, 智享科技（超级讲师）, 福州, 本科, 15, 初创型, 移动互联网 · 教育
JavaScript, 22, 3, 技术, 前端开发, 链尚国际, 上海, 本科, 50, 成长型, 电子商务 · O2O
JavaScript, 8, 1, 技术, 前端开发, 海联讯, 广州, 大专, 150, 初创型, 移动互联网
JavaScript前端开发工程师, 15, 1, 技术, 前端开发, 轻易贷, 北京, 大专, 2000, 上市公, 金融
JavaScript, 6, 1, 技术, 前端开发, 向阳兼职, 厦门, 学历不限, 15, 初创型, 移动互联网 · O2O
JavaScript, 15, 3, 技术, 前端开发, 七乐康, 北京, 学历不限, 500, 成长型, 电子商务 · 医疗健康
JavaScript, 9, 1, 技术, 前端开发, 新图软件, 北京, 学历不限, 150, 成长型, 移动互联网 · 企业服务
JavaScript, 25, 3, 技术, 前端开发, 同方鼎欣, 北京, 本科, 500, 上市公, 移动互联网
javascript前端工程师, 11, 1, 技术, 前端开发, 盛果网络, 成都, 学历不限, 15, 初创型, 移动互联网 · 电子商务
Javascript工程师, 22, 3, 技术, 前端开发, 慧影医疗, 北京, 本科, 15, 初创型, 移动互联网 · 医疗健康
JavaScript, 16, 1, 技术, 前端开发, 1号车网, 北京, 大专, 2000, 上市公, 电子商务 · O2O
JavaScript/web前端, 30, 5, 技术, 前端开发, 我卖我拍, 北京, 大专, 2000, 成熟型, 移动互联网 · 电子商务
JavaScript开发, 11, 1, 技术, 前端开发, 上海易教信息科技, 上海, 本科, 50, 初创型, 移动互联网 · 数据服务
JavaScript, 9, 不, 技术, 前端开发, 爱车阵, 北京, 学历不限, 15, 初创型, 移动互联网
JavaScript, 9, 1, 技术, 前端开发, 和君软件, 北京, 本科, 15, 初创型, 移动互联网  · O2O
JavaScript, 15, 1, 技术, 前端开发, 百分点, 北京, 本科, 500, 成熟型, 数据服务
JavaScript, 22, 1, 技术, 前端开发, 百分点, 北京, 本科, 500, 成熟型, 数据服务
JavaScript, 14, 3, 技术, 后端开发, 酷壹科技, 上海, 大专, 150, 上市公, 移动互联网 · 电子商务
JavaScript, 4, 不, 技术, 前端开发, 蜂图网络, 烟台, 学历不限, 50, 初创型, 企业服务
JavaScript, 11, 1, 技术, 前端开发, 团贷网, 东莞, 大专, 500, 成长型, 金融
JavaScript, 22, 3, 技术, 前端开发, 亿达信息, 深圳, 大专, 2000, 上市公, 移动互联网 · 招聘
JavaScript, 20, 1, 技术, 前端开发, 百分点, 北京, 本科, 500, 成熟型, 数据服务
JavaScript, 12, 3, 技术, 前端开发, 品众互动, 北京, 本科, 2000, 上市公, 数据服务
JavaScript, 7, 不, 技术, 前端开发, 无锡汇跑科技有限公司, 无锡, 学历不限, 50, 成长型, 移动互联网 · 文化娱乐
JavaScript, 11, 1, 技术, 前端开发, 第一设施, 北京, 本科, 150, 上市公, 移动互联网 · 硬件
JavaScript, 17, 1, 技术, 前端开发, 龙默升科技, 合肥, 大专, 15, 成长型, 移动互联网 · 数据服务
JavaScript, 4, 1, 技术, 前端开发, 美创, 盐城, 大专, 15, 初创型, 电子商务
JavaScript, 10, 1, 技术, 前端开发, 盈捷万通, 北京, 本科, 15, 初创型, 移动互联网 · 医疗健康
JavaScript, 7, 1, 技术, 前端开发, 致远速联, 北京, 本科, 50, 初创型, 企业服务 · 金融
JavaScript, 11, 3, 技术, 前端开发, 和易达, 北京, 大专, 150, 成长型, 移动互联网 · 企业服务
JavaScript, 7, 1, 技术, 前端开发, 四方伟业, 成都, 本科, 150, 成长型, 移动互联网
JavaScript, 10, 不, 技术, 前端开发, 喜马拉雅FM, 上海, 大专, 150, 成长型, 移动互联网 · 文化娱乐
JavaScript, 20, 3, 技术, 前端开发, TCL北研中心, 北京, 大专, 2000, 上市公, 电子商务
JavaScript, 13, 1, 技术, 前端开发, 长春吉原生物, 深圳, 大专, 50, 成长型, 医疗健康
JavaScript, 13, 1, 技术, 前端开发, Owhat, 北京, 本科, 15, 成长型, 移动互联网 · O2O
JavaScript, 15, 3, 技术, 前端开发, 智慧农村, 北京, 大专, 150, 成长型, 电子商务
JavaScript前端开发工程师, 27, 3, 技术, 前端开发, 酷传, 北京, 本科, 15, 成长型, 移动互联网
JavaScript, 20, 3, 技术, 前端开发, 环球磁卡, 北京, 本科, 50, 上市公, 移动互联网 · O2O
JavaScript, 8, 1, 技术, 前端开发, 杨桃科技, 北京, 本科, 15, 初创型, 移动互联网 · 广告营销
JavaScript, 8, 1, 技术, 前端开发, 壕鑫互联, 北京, 大专, 50, 成长型, 移动互联网
JavaScript, 15, 1, 技术, 前端开发, 蓝星教育, 北京, 本科, 150, 初创型, 教育
JavaScript, 6, 1, 技术, 前端开发, 奥特科技, 郑州, 大专, 50, 初创型, 移动互联网
JavaScript, 9, 1, 技术, 前端开发, 柯莱特, 上海, 学历不限, 2000, 成熟型, 企业服务 · 金融
JavaScript, 11, 1, 技术, 前端开发, 英迪信息, 北京, 本科, 50, 初创型, 移动互联网
JavaScript, 12, 1, 技术, 前端开发, 思瑜科技, 北京, 本科, 50, 初创型, 移动互联网
JavaScript/前端开发工程师, 19, 不, 技术, 前端开发, 上马石网络科技, 上海, 本科, 15, 成长型, 移动互联网 · 企业服务
JavaScript, 10, 1, 技术, 前端开发, 智享科技, 北京, 大专, 15, 初创型, 移动互联网
JavaScript, 17, 1, 技术, 前端开发, 法米FAMI, 北京, 学历不限, 15, 初创型, 移动互联网
JavaScript, 7, 1, 技术, 前端开发, 房微爱, 天津, 大专, 150, 初创型, 电子商务 · O2O
JavaScript, 12, 1, 技术, 前端开发, 思瑜科技, 北京, 本科, 50, 初创型, 移动互联网
JavaScript, 6, 3, 技术, 前端开发, 北京奥维奥科技, 北京, 大专, 150, 成长型, 企业服务
