职位, 工资, 经验要求, 职位一级分类, 职位二级分类, 公司名称, 城市, 学历, 公司规模, 公司阶段, 公司业务领域
游戏动作, 11, 不, 设计, 视觉设计, 四楼无限, 深圳, 大专, 15, 成长型, 移动互联网 · 游戏
游戏动作, 12, 1年以, 设计, 视觉设计, 第七天堂, 深圳, 大专, 15, 成长型, 移动互联网 · 游戏
游戏动作, 9, 1, 设计, 视觉设计, 仙境乐网, 北京, 大专, 50, 成长型, 移动互联网 · 游戏
游戏动作, 9, 1, 设计, 视觉设计, 句多网络, 上海, 大专, 15, 初创型, 游戏
游戏动作, 4, 1, 设计, 视觉设计, 北京其卡通动画公司, 北京, 大专, 50, 成长型, 文化娱乐
游戏动作, 15, 不, 设计, 视觉设计, 深圳比麟科技, 深圳, 大专, 15, 成长型, 移动互联网 · 游戏
游戏动作, 6, 不, 设计, 视觉设计, 七月科技, 杭州, 学历不限, 15, 初创型, 游戏
游戏动作, 12, 1, 设计, 视觉设计, 上海敬游软件, 上海, 大专, 50, 成长型, 游戏
游戏动作, 12, 1, 设计, 视觉设计, 趣上科技, 深圳, 大专, 15, 初创型, 移动互联网 · 游戏
游戏动作, 12, 不, 设计, 视觉设计, 众游, 北京, 学历不限, 15, 初创型, 移动互联网 · 游戏
游戏动作, 7, 1, 设计, 视觉设计, 合肥乐堂动漫, 合肥, 大专, 150, 初创型, 游戏
游戏动作, 6, 不, 设计, 视觉设计, C2fun, 苏州, 学历不限, 50, 成长型, 移动互联网 · 游戏
游戏动作, 11, 1, 设计, 视觉设计, 大家游戏, 北京, 大专, 50, 成长型, 游戏
游戏动作, 5, 1, 设计, 视觉设计, 合肥乐堂动漫, 合肥, 大专, 150, 初创型, 游戏
游戏动作, 6, 1, 设计, 视觉设计, icon, 广州, 本科, 15, 初创型, 移动互联网 · 游戏
游戏动作, 4, 不, 设计, 视觉设计, 秀宝软件, 武汉, 大专, 50, 初创型, 移动互联网 · 电子商务
游戏动作, 7, 1, 设计, 视觉设计, 零境网络, 上海, 学历不限, 50, 成长型, 游戏
游戏动作, 4, 1, 设计, 视觉设计, 江西大麦互娱, 南昌, 大专, 150, 上市公, 移动互联网 · 游戏
游戏动作, 9, 1, 设计, 视觉设计, 编程猫, 深圳, 学历不限, 15, 初创型, 移动互联网 · 教育
游戏动作, 6, 1, 设计, 视觉设计, 武汉大地兄弟科技有限公司, 武汉, 学历不限, 15, 初创型, 游戏 · 移动互联网
游戏动作, 9, 3, 设计, 视觉设计, 麒翼, 杭州, 学历不限, 15, 成长型, 移动互联网 · 游戏
游戏动作, 9, 1, 设计, 视觉设计, 觉醒, 深圳, 学历不限, 50, 成长型, 游戏
游戏动作, 10, 1, 设计, 视觉设计, 觉醒, 深圳, 大专, 50, 成长型, 游戏
游戏动作, 5, 1, 设计, 视觉设计, 漫乐科技有限公司, 成都, 大专, 15, 初创型, 游戏
游戏动作, 6, 1, 设计, 视觉设计, 爆米花网络, 福州, 大专, 15, 初创型, 移动互联网 · 游戏
游戏动作, 6, 不, 设计, 视觉设计, 飞鱼科技, 厦门, 学历不限, 150, 上市公, 游戏
游戏动作, 4, 不, 设计, 视觉设计, G lab, 上海, 学历不限, 15, 成长型, 移动互联网 · 硬件
游戏动作, 8, 不, 设计, 视觉设计, G lab, 上海, 学历不限, 15, 成长型, 移动互联网 · 硬件
游戏动作, 6, 1, 设计, 视觉设计, 酷软软件, 成都, 本科, 15, 初创型, 移动互联网
游戏动作, 4, 不, 设计, 视觉设计, 南京小西网络, 南京, 学历不限, 15, 成长型, 游戏
游戏动作, 4, 1, 设计, 视觉设计, 苏州随身玩, 苏州, 大专, 15, 成长型, 移动互联网 · 游戏
游戏动作, 10, 1, 设计, 视觉设计, 盖娅互娱, 北京, 大专, 150, 初创型, 移动互联网 · 游戏
游戏动作, 6, 1, 设计, 视觉设计, 山东动量影视技术有限公司, 济南, 学历不限, 15, 初创型, 移动互联网 · 游戏
游戏动作, 13, 1, 设计, 视觉设计, 无忧互通, 北京, 本科, 50, 成长型, 游戏
游戏动作, 9, 不, 设计, 视觉设计, 酷橙游戏, 上海, 学历不限, 15, 成长型, 游戏
游戏动作, 9, 1, 设计, 视觉设计, 乐卓, 上海, 学历不限, 50, 成长型, 游戏
游戏动作, 11, 3, 设计, 视觉设计, 骏梦游戏, 上海, 学历不限, 150, 上市公, 游戏
游戏动作, 11, 3, 设计, 视觉设计, 苏州3A游戏, 苏州, 学历不限, 15, 初创型, 游戏
游戏动作, 15, 1, 设计, 视觉设计, 北京魂世界信息技术有限公司, 北京, 本科, 15, 成长型, 游戏
游戏动作, 11, 1, 设计, 视觉设计, 格游网络, 北京, 大专, 15, 初创型, 游戏
游戏动作, 4, 应届毕业, 设计, 视觉设计, 无限时空, 北京, 学历不限, 50, 成熟型, 游戏
游戏动作, 10, 不, 设计, 视觉设计, 逍遥天地, 北京, 学历不限, 15, 成长型, 游戏
游戏动作, 20, 5, 设计, 视觉设计, 网易公司, 广州, 本科, 2000, 上市公, 移动互联网 · 文化娱乐
游戏动作, 12, 1, 设计, 视觉设计, 蜂芒游戏, 北京, 学历不限, 15, 初创型, 游戏
游戏动作, 10, 3, 设计, 视觉设计, 颗豆互动, 北京, 学历不限, 50, 成长型, 移动互联网 · 游戏
游戏动作, 8, 1, 设计, 视觉设计, 身临其境, 北京, 学历不限, 50, 上市公, 移动互联网 · 游戏
游戏动作, 10, 3, 设计, 视觉设计, 开心网, 北京, 大专, 150, 成熟型, 移动互联网 · 游戏
游戏动作, 7, 1, 设计, 视觉设计, 多元互动公司, 成都, 学历不限, 15, 初创型, 游戏 · 文化娱乐
游戏动作, 6, 1, 设计, 视觉设计, 微光创意技术, 深圳, 大专, 15, 初创型, 文化娱乐 · 其他
游戏动作, 7, 1, 设计, 视觉设计, 聚萌, 上海, 学历不限, 15, 初创型, 游戏 · 文化娱乐
游戏动作, 9, 不, 设计, 视觉设计, 上海望乘, 上海, 学历不限, 15, 初创型, 电子商务 · 其他
游戏动作, 9, 1年以, 设计, 视觉设计, 明朝互动, 广州, 大专, 150, 初创型, 游戏
游戏动作（动画）, 7, 1, 设计, 视觉设计, 上海掌将, 上海, 大专, 15, 成长型, 游戏
游戏动作, 6, 不, 设计, 视觉设计, 深圳科诗特软件有限责任公司, 深圳, 学历不限, 150, 上市公, 移动互联网
游戏动作, 4, 不, 设计, 视觉设计, 北京其卡通动画公司, 北京, 学历不限, 50, 成长型, 文化娱乐
游戏动作, 7, 1, 设计, 视觉设计, 天易创魂, 深圳, 大专, 15, 初创型, 移动互联网 · 游戏
游戏动作, 7, 1, 设计, 视觉设计, 西行, 上海, 学历不限, 15, 成长型, 游戏
游戏动作, 15, 不, 设计, 视觉设计, 风林互动, 北京, 大专, 15, 初创型, 移动互联网 · 游戏
3D游戏动作, 8, 不, 设计, 视觉设计, LuciolaGames, 广州, 学历不限, 15, 初创型, 游戏 · 移动互联网
游戏动作特效师, 15, 1, 设计, 视觉设计, 格林巫德, 深圳, 大专, 15, 初创型, 移动互联网 · 游戏
3D游戏动作, 9, 1, 设计, 视觉设计, 浙江冰峰, 杭州, 大专, 50, 初创型, 游戏
3D游戏动作, 4, 1, 设计, 视觉设计, 森蓝手游, 福州, 学历不限, 15, 初创型, 游戏 · 移动互联网
3D游戏动作, 12, 1, 设计, 视觉设计, 广州游爱, 广州, 学历不限, 500, 初创型, 移动互联网
游戏动作师, 10, 1, 设计, 视觉设计, 任游光年, 北京, 学历不限, 15, 成长型, 移动互联网 · 游戏
游戏动作设计 - 智能机器人, 11, 1, 设计, 视觉设计, 阿西莫夫, 深圳, 本科, 15, 初创型, 移动互联网 · 硬件
游戏动作设计, 4, 1, 设计, 视觉设计, 掌派游戏, 杭州, 本科, 15, 初创型, 移动互联网 · 游戏
3D游戏动作师, 5, 1, 设计, 视觉设计, 帝美, 上海, 学历不限, 50, 成长型, 文化娱乐
2D游戏动作, 8, 1, 设计, 视觉设计, 深圳掌娱天下科技有限公司, 成都, 大专, 50, 初创型, 旅游  · 金融
游戏动作设计师, 12, 3, 设计, 视觉设计, 七月科技, 杭州, 大专, 15, 初创型, 游戏
资深3D游戏动作师, 8, 3, 设计, 视觉设计, 帝美, 上海, 学历不限, 50, 成长型, 文化娱乐
高级游戏动作师, 15, 1, 设计, 视觉设计, 明朝互动, 广州, 大专, 150, 初创型, 游戏
游戏动作设计师, 5, 不, 设计, 视觉设计, 极光网络, 上海, 学历不限, 50, 成长型, 游戏
游戏动作设计师, 11, 1, 设计, 视觉设计, QQ炫舞, 北京, 学历不限, 150, 成长型, 游戏
游戏动作特效设计, 6, 1, 设计, 视觉设计, icon, 广州, 大专, 15, 初创型, 移动互联网 · 游戏
游戏动作设计师, 7, 3, 设计, 视觉设计, 百度游戏DeNA, 福州, 本科, 150, 成长型, 游戏
游戏动作设计, 10, 1, 设计, 视觉设计, 英雄互娱, 上海, 学历不限, 150, 上市公, 游戏
游戏动作设计师, 7, 1, 设计, 视觉设计, 羲和网络, 郑州, 大专, 50, 初创型, 游戏  · 文化娱乐
游戏动作特效设计师, 11, 3, 设计, 视觉设计, 壕鑫互联, 北京, 本科, 50, 成长型, 移动互联网
资深游戏动作设计师, 22, 5, 设计, 视觉设计, 金山西山居, 北京, 大专, 500, 上市公, 移动互联网
3D动作、高级3D游戏动作-sns, 15, 3, 设计, 视觉设计, 路通网络, 深圳, 本科, 150, 成熟型, 移动互联网 · 游戏
3D游戏动作设计师, 9, 1, 设计, 视觉设计, 梵天游科技, 深圳, 大专, 50, 成长型, 游戏
游戏动作设计师, 7, 不, 设计, 视觉设计, 上海艺游, 上海, 学历不限, 15, 成长型, O2O · 游戏
高级游戏动作特效师, 22, 3, 设计, 视觉设计, 皮匠, 杭州, 学历不限, 50, 初创型, 游戏
游戏动作设计师, 12, 1, 设计, 视觉设计, 晶合思动, 北京, 本科, 150, 初创型, 游戏
3D游戏动作师, 12, 1, 设计, 视觉设计, 尚游网络, 广州, 大专, 15, 初创型, 移动互联网 · 游戏
游戏动作设计师, 12, 3, 设计, 视觉设计, 水果堂, 北京, 大专, 50, 初创型, 移动互联网 · 游戏
游戏动作 原画师, 25, 不, 设计, 视觉设计, 麦洛, 北京, 学历不限, 50, 初创型, 硬件 · 其他
3d游戏动作设计师, 9, 不, 设计, 视觉设计, 上海艺游, 上海, 学历不限, 15, 成长型, O2O · 游戏
游戏动作设计师、游戏动画师（急聘！1!）, 7, 1, 设计, 视觉设计, 魔腾网络, 上海, 大专, 15, 成长型, 移动互联网 · 游戏
游戏动作设计师-广州-02715, 10, 1, 设计, 视觉设计, 完美世界, 广州, 大专, 2000, 上市公, 移动互联网 · 游戏
