职位, 工资, 经验要求, 职位一级分类, 职位二级分类, 公司名称, 城市, 学历, 公司规模, 公司阶段, 公司业务领域
清算, 7, 3, 金融, 审计税务, 网金控股, 广州, 大专, 150, 成长型, 移动互联网 · 金融
清算, 3, 1, 金融, 审计税务, 创客金融, 杭州, 大专, 50, 成长型, 移动互联网 · 金融
结算, 4, 1, 职能, 财务, 浙江保融, 杭州, 大专, 150, 成长型, 金融
结算, 4, 不, 职能, 财务, 汇潮, 上海, 大专, 150, 成长型, 电子商务 · 金融
清算, 3, 1, 金融, 审计税务, 邮付通, 长沙, 大专, 50, 成长型, 移动互联网
清算, 17, 3, 金融, 审计税务, 上海煜钱, 上海, 大专, 15, 初创型, 移动互联网
结算, 6, 1, 职能, 财务, 米庄理财, 杭州, 本科, 50, 成长型, 金融
清算, 5, 1年以, 金融, 审计税务, 微财富, 上海, 本科, 150, 成长型, 金融
清算, 6, 1, 职能, 财务, 佐助金服, 杭州, 学历不限, 50, 初创型, 移动互联网 · 金融
清算, 6, 不, 金融, 审计税务, 微财富, 上海, 学历不限, 150, 成长型, 金融
结算专员, 3, 不, 职能, 财务, 掌视亿通, 北京, 大专, 50, 成长型, 移动互联网 · 文化娱乐
结算, 8, 3, 职能, 财务, 美哒网络（空格）, 杭州, 本科, 150, 成长型, 移动互联网 · 生活服务
清算, 5, 1, 金融, 审计税务, 北京震泰投资有限公司, 北京, 大专, 500, 成熟型, 金融
结算专员, 7, 1, 职能, 财务, 面包旅行, 北京, 本科, 50, 成熟型, 移动互联网 · 旅游
清算结算专员, 8, 1, 职能, 财务, 白骨精（北京）网络科技有限公司, 北京, 本科, 15, 成长型, 社交网络 · 金融
清算, 7, 1, 金融, 审计税务, 金房汇, 北京, 大专, 15, 初创型, 移动互联网 · 金融
结算, 4, 不, 职能, 财务, 释诺财富, 上海, 本科, 15, 初创型, 金融 · 移动互联网
结算, 4, 不, 职能, 财务, 百川信, 厦门, 本科, 15, 初创型, 电子商务
结算, 9, 1, 职能, 财务, 寻牛, 北京, 本科, 15, 成长型, 金融
结算专员, 4, 1, 职能, 财务, 广州百倍科技, 广州, 大专, 50, 成长型, 游戏 · 金融
结算, 7, 1, 职能, 财务, 银狐科技, 杭州, 本科, 15, 初创型, 金融
结算专员, 5, 1, 职能, 财务, 建亿通（都都宝）, 北京, 大专, 150, 成长型, 移动互联网
结算, 4, 1, 职能, 财务, 时刻送, 上海, 大专, 150, 成长型, 移动互联网 · O2O
清算专员, 4, 不, 运营, 运营, 网钱, 上海, 大专, 50, 成长型, 金融
清算专员, 5, 1, 职能, 财务, 聚财猫, 上海, 本科, 50, 成长型, 金融
结算, 5, 1, 职能, 财务, 赛荣电器, 上海, 大专, 50, 初创型, 电子商务 · 生活服务
清算专员（2015年毕业生）, 3, 1年以, 职能, 财务, 钱宝, 深圳, 大专, 150, 初创型, 电子商务 · 金融
结算, 4, 1, 职能, 财务, 采伴, 上海, 大专, 50, 初创型, 移动互联网 · 电子商务
清算专员, 7, 不, 金融, 审计税务, 微财富, 上海, 学历不限, 150, 成长型, 金融
清算, 5, 1, 金融, 审计税务, 北京震泰投资有限公司, 北京, 大专, 500, 成熟型, 金融
结算专员, 4, 1, 职能, 财务, LAN-TEAM, 上海, 本科, 150, 成长型, 文化娱乐 · 其他
结算, 4, 不, 职能, 财务, 百度外卖, 上海, 大专, 500, 初创型, 移动互联网 · O2O
结算, 6, 1, 职能, 财务, 微指科技, 北京, 大专, 150, 成长型, 电子商务 · O2O
结算专员, 6, 1, 职能, 财务, e路同心, 深圳, 本科, 150, 成长型, 金融
结算专员, 5, 1, 职能, 财务, 北京海科融通支付服务股份有限公司, 北京, 大专, 500, 成长型, 移动互联网
结算专员, 3, 不, 职能, 财务, 珂兰钻石, 深圳, 大专, 500, 成长型, 电子商务
结算, 8, 3, 职能, 财务, 58同城, 北京, 本科, 2000, 上市公, 分类信息
清算专员, 3, 1, 金融, 审计税务, 艾米支付, 武汉, 大专, 150, 成长型, 移动互联网 · 数据服务
结算, 4, 1, 职能, 财务, 深圳市东盛创新科技有限公司, 深圳, 大专, 15, 初创型, 电子商务 · 其他
清算专员, 5, 1, 金融, 审计税务, 即富, 上海, 本科, 150, 成长型, 电子商务 · 金融
结算会计, 7, 3, 职能, 财务, 一号货车, 上海, 大专, 500, 成长型, 移动互联网 · O2O
清结算（第三方支付）, 16, 1, 金融, 审计税务, 人人行, 北京, 本科, 500, 成熟型, 移动互联网 · 金融
供应商结算/客户结算, 5, 1, 职能, 财务, 九曳供应链, 上海, 大专, 15, 成长型, 电子商务 · 数据服务
结算, 5, 不, 职能, 财务, 达飞集团, 北京, 大专, 2000, 上市公, 移动互联网 · 金融
结算, 7, 1, 职能, 财务, eCommClouds, 北京, 大专, 150, 成长型, 电子商务
结算专员, 6, 1, 职能, 财务, 小马金融, 北京, 大专, 150, 初创型, 金融
清算专员, 5, 1, 职能, 财务, 聚财猫, 上海, 本科, 50, 成长型, 金融
结算, 6, 不, 职能, 财务, 起源财富, 北京, 本科, 50, 成长型, 移动互联网 · 金融
结算, 3, 1, 职能, 财务, 众人投, 北京, 大专, 50, 初创型, 金融
结算会计, 6, 1, 职能, 财务, 找塑料网, 上海, 大专, 150, 成长型, 电子商务
结算, 7, 1, 职能, 财务, 中合利成, 北京, 大专, 150, 初创型, 电子商务
结算, 6, 1, 职能, 财务, 杰立互联, 北京, 大专, 15, 初创型, 金融
结算专员/主管, 7, 1, 运营, 运营, 米袋集团, 上海, 本科, 150, 初创型, 金融
结算, 4, 1, 职能, 财务, 滴士分期, 北京, 大专, 150, 成长型, 移动互联网
结算, 5, 1, 职能, 财务, 朋友说, 北京, 本科, 15, 初创型, 移动互联网 · 电子商务
结算专员, 5, 1年以, 职能, 财务, 端鹏金融, 上海, 大专, 15, 初创型, 金融
结算专员, 5, 不, 运营, 运营, 钜真金融, 上海, 大专, 15, 成长型, O2O · 金融
结算专员/出纳, 3, 不, 职能, 财务, 华邦房地产, 杭州, 大专, 2000, 成熟型, 生活服务 · 其他
资金清算专员, 11, 不, 金融, 审计税务, 泰金所, 上海, 本科, 50, 成长型, 移动互联网 · 金融
资金结算专员, 5, 1, 职能, 财务, 建亿通（都都宝）, 北京, 学历不限, 150, 成长型, 移动互联网
结算会计, 2, 1, 职能, 财务, 掌游科技, 武汉, 大专, 50, 初创型, 移动互联网 · 游戏
资金结算, 6, 1, 职能, 财务, 北京丁丁优房科技信息有限公司, 北京, 本科, 2000, 成熟型, 移动互联网
清算结算专员, 7, 1, 运营, 运营, 白骨精（北京）网络科技有限公司, 北京, 本科, 15, 成长型, 社交网络 · 金融
结算专员, 3, 1, 职能, 财务, 微信电影票, 北京, 大专, 500, 成熟型, 移动互联网 · 广告营销
结算会计, 6, 1, 职能, 财务, 北京加双筷子科技有限公司, 北京, 本科, 150, 成长型, 移动互联网 · O2O
结算专员, 12, 1, 职能, 财务, 量化全球, 北京, 本科, 15, 初创型, 移动互联网 · 金融
清算会计专员, 6, 不, 金融, 审计税务, 广度金融, 上海, 大专, 15, 初创型, 移动互联网 · 金融
结算会计, 5, 1, 职能, 财务, 找塑料网, 广州, 大专, 150, 成长型, 电子商务
资金结算, 7, 不, 职能, 财务, 北京丁丁优房科技信息有限公司, 北京, 本科, 2000, 成熟型, 移动互联网
结算专员, 7, 1, 职能, 财务, 好贷网, 北京, 大专, 150, 成长型, O2O · 金融
结算 财务, 10, 5, 职能, 财务, 合盘金融, 上海, 本科, 150, 成长型, 移动互联网 · 金融
结算专员/会计助理, 3, 1年以, 职能, 财务, 华邦房地产, 杭州, 大专, 2000, 成熟型, 生活服务 · 其他
结算专员, 4, 不, 职能, 财务, 日日金, 北京, 大专, 15, 初创型, 金融
结算专员, 5, 不, 职能, 财务, 财客网, 北京, 学历不限, 50, 成长型, 移动互联网 · 金融
诚聘清算专员, 6, 不, 金融, 审计税务, 微财富, 上海, 学历不限, 150, 成长型, 金融
清算主管, 7, 3, 金融, 审计税务, 中融金, 北京, 大专, 150, 上市公, 金融
支付，结算, 20, 1, 产品, 产品经理, 美团网, 北京, 本科, 2000, 成熟型, 移动互联网 · O2O
结算专员, 4, 1, 职能, 财务, 元宝网, 杭州, 大专, 15, 初创型, 电子商务
结算负责人, 20, 5, 职能, 财务, 360, 北京, 本科, 2000, 上市公, 移动互联网 · 游戏
资金结算专员, 7, 1, 职能, 财务, 北京丁丁优房科技信息有限公司, 北京, 本科, 2000, 成熟型, 移动互联网
结算专员, 9, 1, 运营, 运营, 世纪佳缘, 北京, 大专, 500, 上市公, 移动互联网
结算专员, 5, 不, 职能, 财务, 北京寰玥国际投资管理有限公司, 北京, 本科, 2000, 上市公, 金融
清结算（第三方支付）, 7, 1, 职能, 财务, 指尖城市, 深圳, 大专, 50, 成长型, 移动互联网
结算专员, 6, 1, 职能, 财务, 红领巾校园O2O, 北京, 本科, 50, 初创型, 移动互联网 · O2O
资金结算专员, 7, 1, 职能, 财务, 北京丁丁优房科技信息有限公司, 北京, 本科, 2000, 成熟型, 移动互联网
结算会计, 6, 1, 金融, 审计税务, 光音网络, 北京, 大专, 150, 成长型, 广告营销 · 数据服务
结算会计, 6, 1, 职能, 财务, 秀美甲, 北京, 大专, 500, 成长型, 移动互联网 · O2O
结算会计, 4, 1, 职能, 财务, 超级腕, 杭州, 大专, 150, 成长型, O2O
结算专员, 5, 应届毕业, 职能, 财务, 鑫茂荣信, 北京, 大专, 500, 成熟型, 移动互联网 · 金融
结算会计, 3, 不, 职能, 财务, 融金所集团, 深圳, 大专, 500, 成熟型, 金融
结算会计, 5, 1, 职能, 财务, 蓝地集团, 北京, 大专, 2000, 成熟型, O2O · 其他
聘清算专员, 6, 不, 金融, 审计税务, 微财富, 上海, 学历不限, 150, 成长型, 金融
结算专员, 5, 1, 职能, 财务, 首成, 北京, 大专, 150, 成长型, 金融
清算运营, 6, 1, 运营, 运营, 招商银行信用卡中心, 上海, 大专, 2000, 上市公, 移动互联网
收银结算, 5, 1年以, 职能, 财务, 业之峰装饰, 北京, 大专, 2000, 成熟型, 其他
结算会计, 5, 不, 职能, 财务, 微信电影票, 北京, 大专, 500, 成熟型, 移动互联网 · 广告营销
结算员/文员, 4, 1, 职能, 财务, 博易创为, 北京, 大专, 15, 成长型, 移动互联网
支付结算专员, 3, 1, 职能, 财务, 易极付, 重庆, 本科, 500, 初创型, 移动互联网 · 金融
结算员, 4, 1, 职能, 财务, 中投融, 上海, 大专, 500, 成熟型, 金融
结算人员, 6, 1, 职能, 财务, 多点Dmall, 北京, 本科, 500, 初创型, 电子商务 · O2O
结算员, 4, 1, 金融, 审计税务, 十方投资, 珠海, 大专, 50, 成长型, 金融
清算主管, 8, 1, 职能, 财务, 聚财猫, 上海, 本科, 50, 成长型, 金融
基金清算会计, 12, 3, 职能, 财务, 公牛炒股, 北京, 本科, 50, 成长型, 移动互联网 · 金融
基金清算会计, 12, 3, 职能, 财务, 北京公牛财富科技有限公司, 北京, 本科, 50, 成长型, 金融
登记结算（应届生）, 7, 应届毕业, 金融, 审计税务, 东方财富, 上海, 本科, 500, 上市公, 金融
结算主管, 7, 1, 职能, 财务, 蓝色行星, 上海, 大专, 15, 成长型, 旅游 · 移动互联网
审计/清算, 5, 1, 职能, 财务, 上海米刷, 上海, 大专, 50, 初创型, 移动互联网 · 金融
结算会计（第三方支付）, 7, 1, 职能, 财务, 指尖城市, 深圳, 大专, 50, 成长型, 移动互联网
高级支付结算, 9, 不, 金融, 审计税务, 米庄理财, 杭州, 本科, 50, 成长型, 金融
结算会计, 6, 1, 职能, 财务, 恒拓开源, 北京, 大专, 500, 成长型, 移动互联网 · 企业服务
基金清算会计, 12, 3, 职能, 财务, 公牛炒股, 北京, 本科, 50, 成长型, 移动互联网 · 金融
结算会计, 4, 1, 职能, 财务, 大道惠众, 北京, 大专, 50, 成长型, 电子商务 · 社交网络
结算主管, 8, 3, 职能, 财务, 返利网, 上海, 本科, 150, 成熟型, 电子商务
数据结算专员, 6, 不, 运营, 运营, PP助手, 广州, 本科, 150, 成熟型, 移动互联网
财务结算副总, 22, 5, 职能, 财务, 溢美金融, 北京, 本科, 500, 成熟型, 企业服务 · 金融
结算会计, 7, 3, 职能, 财务, 北京吉芬时装设计股份有限公司, 北京, 大专, 500, 上市公, 电子商务 · 生活服务
结算会计, 8, 1, 职能, 财务, 北汽产投互联网金融部, 北京, 本科, 15, 初创型, 移动互联网 · 金融
结算会计, 6, 1, 职能, 财务, 那边旅游, 北京, 大专, 50, 初创型, 移动互联网 · 旅游
结算员, 7, 1, 职能, 财务, 海航会信息科技, 北京, 本科, 50, 初创型, 移动互联网 · 电子商务
结算会计, 5, 1, 职能, 财务, 蜜芽, 北京, 本科, 500, 成熟型, 电子商务
清结算流程规划, 12, 3, 金融, 审计税务, 中顺易, 深圳, 本科, 150, 成长型, 移动互联网 · 金融
结算经理, 9, 1, 职能, 财务, 抱财网, 北京, 本科, 50, 成长型, 移动互联网
结算主管, 5, 3, 职能, 财务, 广州百倍科技, 广州, 大专, 50, 成长型, 游戏 · 金融
测试工程师（支付结算）, 10, 3, 技术, 测试, 地利控股成都研发中心, 成都, 大专, 150, 上市公, 电子商务
结算经理, 15, 3, 职能, 财务, 小马金融, 北京, 本科, 150, 初创型, 金融
清结算专员, 6, 1, 金融, 审计税务, 叮当钱包, 北京, 本科, 2000, 成长型, 移动互联网 · 金融
结算出纳, 6, 1, 职能, 财务, 联拓金融, 北京, 大专, 150, 成长型, 金融
清算经理, 15, 3, 金融, 审计税务, 裕福控股集团, 北京, 本科, 150, 成长型, 移动互联网 · 金融
第三方支付清结算, 8, 不, 运营, 运营, 指尖城市, 深圳, 大专, 50, 成长型, 移动互联网
结算实习生, 1, 不, 职能, 财务, 美团网, 北京, 本科, 2000, 成熟型, 移动互联网 · O2O
会计结算, 6, 3, 职能, 财务, 智慈科技, 成都, 大专, 15, 初创型, 移动互联网
产品经理-结算, 20, 1, 产品, 产品经理, 美团网, 北京, 本科, 2000, 成熟型, 移动互联网 · O2O
资金结算专员, 4, 不, 职能, 财务, 蜀信易, 成都, 学历不限, 50, 成长型, 电子商务 · O2O
清算主管, 8, 1, 职能, 财务, 聚财猫, 上海, 本科, 50, 成长型, 金融
结算平台开发工程师, 22, 1, 技术, 后端开发, 美团网, 北京, 本科, 2000, 成熟型, 移动互联网 · O2O
结算经理, 13, 3, 职能, 财务, 海航通信, 北京, 本科, 150, 成长型, 移动互联网 · 生活服务
结算主管, 9, 1, 职能, 财务, 海航通信, 北京, 本科, 150, 成长型, 移动互联网 · 生活服务
资金清结算岗, 10, 3, 职能, 财务, 联通支付有限公司, 北京, 本科, 150, 成长型, 移动互联网
清算系统-产品经理, 14, 3, 产品, 产品经理, 亿车科技, 深圳, 本科, 50, 成长型, 移动互联网 · 数据服务
清算运营专员, 14, 3, 运营, 运营, 雨点金服, 上海, 本科, 15, 成长型, 金融
结算 计费 统计, 2, 1年以, 职能, 财务, 北京信通, 西安, 大专, 50, 成熟型, 企业服务
结算会计, 4, 不, 职能, 财务, 费舍尔, 杭州, 大专, 15, 初创型, 电子商务
资深清结算专员, 8, 1, 职能, 财务, 到喜啦, 上海, 大专, 500, 成长型, 移动互联网 · 电子商务
电商结算审核专员, 5, 1, 职能, 财务, 路路由, 上海, 大专, 150, 成长型, 移动互联网 · O2O
结算主管, 9, 5, 职能, 财务, 大彩网 dacai.com, 杭州, 大专, 50, 成长型, 移动互联网 · 电子商务
产品经理-结算, 22, 1, 产品, 产品经理, 美团网, 北京, 本科, 2000, 成熟型, 移动互联网 · O2O
清结算专员（考虑实习生留用）, 5, 不, 职能, 财务, 融帮金融, 上海, 本科, 15, 初创型, 金融
结算平台高级研发工程师, 30, 3, 技术, 后端开发, 美团网, 北京, 本科, 2000, 成熟型, 移动互联网 · O2O
结算专员/核算统计岗, 4, 1, 金融, 审计税务, 赣元投资, 上海, 大专, 15, 初创型, 移动互联网
高级产品经理 （支付结算）, 30, 5, 产品, 高端产品职位, 鹏海运, 深圳, 本科, 150, 成长型, 企业服务 · 数据服务
产品经理-支付，结算, 22, 1, 产品, 产品经理, 美团网, 北京, 本科, 2000, 成熟型, 移动互联网 · O2O
财务结算主管, 11, 3, 职能, 财务, UCloud, 上海, 本科, 500, 成熟型, 数据服务
急聘！结算专员（入职即五险一金）, 6, 1年以, 职能, 财务, 融宝支付, 北京, 大专, 50, 成长型, 金融
资产管理员（项目结算）, 7, 1, 金融, 投融资, 永达融资墓葬林, 上海, 大专, 50, 上市公, 金融
结算主管, 15, 3, 职能, 财务, 海航通信, 海口, 本科, 150, 成长型, 移动互联网 · 生活服务
结算经理, 15, 3, 职能, 财务, 海航通信, 海口, 本科, 150, 成长型, 移动互联网 · 生活服务
支付结算总监, 22, 5, 金融, 审计税务, 米庄理财, 杭州, 本科, 50, 成长型, 金融
结算经理, 12, 3, 职能, 财务, 同方-智能家庭, 北京, 本科, 2000, 上市公, 移动互联网 · O2O
财务专员-应收结算, 6, 1, 金融, 审计税务, 大朴网, 北京, 本科, 50, 成熟型, 电子商务 · O2O
清算主管, 9, 1, 职能, 财务, 联拓金融, 北京, 大专, 150, 成长型, 金融
产品经理-支付，结算, 20, 1, 产品, 产品经理, 美团网, 北京, 本科, 2000, 成熟型, 移动互联网 · O2O
项目结算主管（顺义）, 8, 不, 金融, 审计税务, 稳盛投资, 北京, 学历不限, 50, 上市公, 移动互联网 · 金融
清结算岗, 22, 不, 运营, 运营, 翼支付, 上海, 本科, 500, 上市公, 电子商务 · 金融
清结算岗位, 7, 1, 职能, 财务, 东软（广州）, 广州, 本科, 2000, 上市公, 移动互联网 · 教育
清结算专员, 5, 1, 职能, 财务, 丰瑞祥, 北京, 本科, 50, 成长型, 金融
清结算总监, 30, 3, 金融, 审计税务, 易如付, 北京, 本科, 500, 成熟型, 移动互联网 · 金融
结算产品经理, 16, 3, 产品, 产品经理, 小花金服, 深圳, 本科, 50, 成长型, 移动互联网 · 金融
清结算经理, 22, 3, 金融, 审计税务, 易如付, 北京, 本科, 500, 成熟型, 移动互联网 · 金融
财务专员-应付结算, 6, 1, 金融, 审计税务, 大朴网, 北京, 本科, 50, 成熟型, 电子商务 · O2O
结算系统产品经理, 27, 3, 产品, 产品经理, 中融科, 深圳, 本科, 150, 初创型, 移动互联网 · 金融
物流结算专员, 5, 不, 职能, 财务, 敦煌网, 北京, 本科, 500, 成熟型, 电子商务
商务结算专员, 7, 不, 市场与销售, 市场/营销, 芒果互娱, 长沙, 本科, 50, 成长型, 移动互联网 · 游戏
破产清算师, 1, 应届毕业, 金融, 审计税务, 四吉移动, 北京, 大专, 500, 成熟型, 移动互联网
工程造价师/预结算, 5, 1, 技术, 项目管理, 安泰科技, 邢台, 大专, 500, 上市公, 企业服务 · 生活服务
清算渠道管理岗, 22, 3, 金融, 投融资, 微众银行, 深圳, 本科, 500, 初创型, 金融
产品经理（企业结算）, 25, 3, 产品, 产品经理, 宜信公司, 北京, 本科, 2000, 成熟型, 移动互联网 · 金融
机票-产品经理-结算, 22, 1, 产品, 产品经理, 美团网, 北京, 本科, 2000, 成熟型, 移动互联网 · O2O
机票事业部--产品经理-结算, 22, 1, 产品, 产品经理, 美团网, 北京, 本科, 2000, 成熟型, 移动互联网 · O2O
资深产品经理-支付&amp;结算, 27, 3, 产品, 产品经理, 领投鸟理财, 上海, 本科, 150, 成长型, 移动互联网 · 金融
产品经理-支付与结算, 20, 1, 产品, 产品经理, 美团网, 北京, 本科, 2000, 成熟型, 移动互联网 · O2O
清结算总监, 35, 3, 职能, 财务, 易如付, 北京, 本科, 500, 成熟型, 移动互联网 · 金融
清结算专员, 5, 1, 金融, 审计税务, 美丽说, 北京, 本科, 500, 成熟型, 电子商务 · 移动互联网
结算会计主管, 9, 5, 职能, 财务, 恒拓开源, 北京, 大专, 500, 成长型, 移动互联网 · 企业服务
清结算主管, 18, 3, 职能, 财务, 易如付, 北京, 本科, 500, 成熟型, 移动互联网 · 金融
账务清结算研发工程师, 30, 3, 技术, 后端开发, 蘑菇街, 杭州, 学历不限, 500, 成熟型, 电子商务
工程造价师/预结算, 4, 1, 技术, 项目管理, 安泰科技, 徐州, 大专, 500, 上市公, 企业服务 · 生活服务
对账员（结算专员）, 3, 1, 运营, 客服, 微信电影票, 北京, 大专, 500, 成熟型, 移动互联网 · 广告营销
支付结算技术负责人, 22, 5, 技术, 后端开发, 宜信公司, 北京, 本科, 2000, 成熟型, 移动互联网 · 金融
第三方支付账务清结算会计, 8, 不, 职能, 财务, 指尖城市, 深圳, 大专, 50, 成长型, 移动互联网
机票事业部-产品经理-结算, 22, 1, 产品, 产品经理, 美团网, 北京, 本科, 2000, 成熟型, 移动互联网 · O2O
架构师（支付结算), 22, 5, 技术, 高端技术职位, 宜信公司, 北京, 本科, 2000, 成熟型, 移动互联网 · 金融
产品经理（财务结算）, 18, 1, 产品, 产品经理, 飞常U惠, 深圳, 本科, 150, 初创型, 移动互联网 · 生活服务
机票-产品经理-支付，结算, 22, 1, 产品, 产品经理, 美团网, 北京, 本科, 2000, 成熟型, 移动互联网 · O2O
工程造价师/预结算, 5, 1, 技术, 项目管理, 安泰科技, 石家庄, 大专, 500, 上市公, 企业服务 · 生活服务
资金清算经理, 6, 1, 运营, 运营, 智付数据, 广州, 大专, 50, 初创型, 金融
机票事业部-产品经理-支付，结算, 22, 1, 产品, 产品经理, 美团网, 北京, 本科, 2000, 成熟型, 移动互联网 · O2O
运营经理（支付结算产品运营）, 15, 3, 运营, 运营, 宜信公司, 北京, 本科, 2000, 成熟型, 移动互联网 · 金融
中国航空结算中心高级Java工程师, 19, 3, 技术, 后端开发, 软通动力, 北京, 本科, 2000, 上市公, 移动互联网 · 企业服务
结算处高级经理, 40, 5, 职能, 财务, 车易拍, 北京, 本科, 2000, 成熟型, 电子商务
财务结算员, 5, 不, 职能, 财务, 银湖网, 北京, 本科, 2000, 上市公, 金融
产品经理（财务结算）, 18, 1, 产品, 产品经理, 飞常U惠, 深圳, 本科, 150, 初创型, 移动互联网 · 生活服务
产品经理 （财务结算）, 22, 1, 产品, 产品经理, 云丛科技, 深圳, 学历不限, 15, 成长型, 移动互联网
结算主管-互联网电商, 9, 3, 职能, 财务, 敦煌网, 北京, 本科, 500, 成熟型, 电子商务
机票事业部--产品经理-支付，结算, 22, 1, 产品, 产品经理, 美团网, 北京, 本科, 2000, 成熟型, 移动互联网 · O2O
高级产品经理-结算方向, 16, 3, 产品, 产品经理, 美团网, 北京, 本科, 2000, 成熟型, 移动互联网 · O2O
高级测试工程师（支付结算平台）, 20, 3, 技术, 测试, 宜信公司, 北京, 本科, 2000, 成熟型, 移动互联网 · 金融
支付渠道结算专员(互联网电商), 5, 不, 职能, 财务, 敦煌网, 北京, 大专, 500, 成熟型, 电子商务
产品经理（财务结算）, 22, 1, 产品, 产品经理, 劲马奥通, 深圳, 学历不限, 15, 成长型, 移动互联网 · 电子商务
结算产品经理, 18, 3, 产品, 产品经理, 中腾信, 深圳, 本科, 2000, 初创型, 移动互联网 · 金融
产品经理 （财务结算）, 22, 1, 产品, 产品经理, 深圳大爆炸, 深圳, 学历不限, 150, 成长型, 移动互联网
产品经理（支付结算）, 25, 3, 产品, 产品经理, 宜信公司, 北京, 本科, 2000, 成熟型, 移动互联网 · 金融
产品助理（支付结算）, 8, 1, 产品, 产品经理, 宜信公司, 北京, 本科, 2000, 成熟型, 移动互联网 · 金融
高级产品经理-结算方向, 22, 1, 产品, 产品经理, 美团网, 北京, 本科, 2000, 成熟型, 移动互联网 · O2O
产品经理 （财务结算）, 22, 1, 产品, 产品经理, 摩柚生活技术有限公司, 深圳, 学历不限, 50, 成长型, 移动互联网 · 电子商务
支付结算数据分析师, 15, 1, 运营, 运营, 京东金融, 北京, 本科, 2000, 上市公, 金融
产品经理(结算方向）, 22, 3, 产品, 产品经理, 万达电商, 北京, 本科, 2000, 成长型, 电子商务
结算/经费/商家/活动/CRM/客服/物料方向, 15, 3, 产品, 产品经理, 美团网, 北京, 本科, 2000, 成熟型, 移动互联网 · O2O
支付平台 - 账户清结算Java研发工程师, 22, 3, 技术, 后端开发, 美团网, 北京, 本科, 2000, 成熟型, 移动互联网 · O2O
高级java开发工程师（账务清算方向）, 15, 3, 技术, 后端开发, 宝付网络科技（上海）有限公司, 上海, 本科, 150, 成熟型, 移动互联网 · 金融
市场运营-市场营销部-结算管理方向, 10, 1, 市场与销售, 市场/营销, 京东金融, 北京, 本科, 2000, 上市公, 金融
JAVA高级工程师（清算支付方向）, 17, 1, 技术, 后端开发, 卡得万利, 上海, 学历不限, 150, 成长型, 金融
机票--产品经理-支付，结算, 22, 1, 产品, 产品经理, 美团网, 北京, 本科, 2000, 成熟型, 移动互联网 · O2O
支付渠道结算专员-互联网电商, 5, 不, 职能, 财务, 敦煌网, 北京, 大专, 500, 成熟型, 电子商务
商家结算产品经理, 20, 5, 产品, 产品经理, 大众点评网, 上海, 本科, 2000, 成熟型, 电子商务 · O2O
资金清结算主管、经理, 15, 5, 运营, 运营, 国美金控, 北京, 本科, 50, 初创型, 金融
高级架构师（支付结算平台）, 20, 5, 技术, 高端技术职位, 宜信公司, 北京, 大专, 2000, 成熟型, 移动互联网 · 金融
资深安全架构师（支付结算）, 20, 3, 技术, 高端技术职位, 宜信公司, 北京, 大专, 2000, 成熟型, 移动互联网 · 金融
物流结算专员——互联网电商, 7, 1, 职能, 财务, 敦煌网, 北京, 本科, 500, 成熟型, 电子商务
