职位, 工资, 经验要求, 职位一级分类, 职位二级分类, 公司名称, 城市, 学历, 公司规模, 公司阶段, 公司业务领域
Go(Golang), 30, 3, 技术, 后端开发, 探探, 北京, 本科, 150, 成长型, 移动互联网 · 文化娱乐
Go, 15, 不, 技术, 后端开发, twinkle, 上海, 本科, 15, 初创型, 移动互联网 · 社交网络
Go, 15, 1, 技术, 后端开发, EZbuy, 上海, 本科, 150, 成长型, 电子商务 · 生活服务
Go, 30, 3, 技术, 后端开发, eengoo, 上海, 本科, 15, 初创型, 移动互联网 · 数据服务
Go, 37, 3, 技术, 后端开发, 滴滴打车, 北京, 本科, 500, 成熟型, 移动互联网
Go, 15, 不, 技术, 后端开发, NGS, 南京, 学历不限, 15, 初创型, 移动互联网 · 社交网络
Go, 16, 1, 技术, 后端开发, 商询科技, 朝阳, 本科, 15, 初创型, 企业服务 · 数据服务
Go, 14, 3, 技术, 后端开发, 青稞麦, 深圳, 大专, 15, 初创型, 移动互联网
Go, 15, 3, 技术, 后端开发, 九车网, 深圳, 大专, 15, 初创型, 移动互联网 · O2O
Go, 16, 3, 技术, 后端开发, 买衣爽, 上海, 本科, 50, 成长型, 电子商务 · O2O
Go, 9, 1, 技术, 后端开发, 软通动力信息技术有限公司, 杭州, 本科, 2000, 上市公, 企业服务
Go, 11, 1, 技术, 后端开发, 深圳中软国际, 深圳, 本科, 2000, 上市公, 移动互联网 · 企业服务
Go, 19, 3, 技术, 后端开发, 有赞, 杭州, 本科, 150, 成长型, 移动互联网 · 电子商务
Go, 19, 3, 技术, 后端开发, 有赞, 杭州, 本科, 150, 成长型, 移动互联网 · 电子商务
Go, 15, 1, 技术, 后端开发, 洋葱, 北京, 大专, 15, 初创型, 移动互联网 · 数据服务
Go, 23, 不, 技术, 后端开发, 星辰天合, 北京, 学历不限, 15, 初创型, 企业服务
Go, 15, 1, 技术, 后端开发, 智云众, 上海, 本科, 50, 成长型, 企业服务 · 文化娱乐
Go, 22, 3, 技术, 后端开发, EMC, 北京, 本科, 2000, 上市公, 企业服务 · 数据服务
Go, 8, 1, 技术, 后端开发, 巨途, 广州, 本科, 15, 初创型, 移动互联网 · 广告营销
Go, 12, 1, 技术, 后端开发, 移石创想, 北京, 本科, 15, 初创型, 移动互联网
Go, 22, 3, 技术, 后端开发, 国美在线, 北京, 学历不限, 2000, 上市公, 电子商务
Go, 30, 3, 技术, 后端开发, 毕威拓, 北京, 硕士, 500, 成熟型, 数据服务
Go, 14, 3, 技术, 后端开发, 日日金, 北京, 本科, 15, 初创型, 金融
Go, 3, 不, 技术, 后端开发, 企云科技, 北京, 硕士, 15, 初创型, 移动互联网 · 数据服务
Go, 22, 1, 技术, 后端开发, 企云科技, 北京, 硕士, 15, 初创型, 移动互联网 · 数据服务
Go, 22, 不, 技术, 后端开发, 红点, 北京, 本科, 15, 成长型, 移动互联网
Go实习, 4, 不, 技术, 后端开发, twinkle, 上海, 学历不限, 15, 初创型, 移动互联网 · 社交网络
Go开发, 15, 不, 技术, 后端开发, 爱可生, 上海, 本科, 50, 成长型, 数据服务
Go开发工程师, 22, 1, 技术, 后端开发, 华尔街见闻, 上海, 本科, 50, 成长型, 金融 · 移动互联网
Go研发工程师, 11, 3, 技术, 后端开发, 锦玉山河, 重庆, 学历不限, 15, 初创型, 移动互联网 · 游戏
Go工程师, 6, 不, 技术, 后端开发, 梵响互动, 西安, 本科, 15, 初创型, 移动互联网 · 企业服务
Go开发工程师, 11, 不, 技术, 后端开发, 金蝶软件（中国）有限公司, 深圳, 本科, 2000, 上市公, 移动互联网 · 电子商务
Go语言（交通事业部）, 15, 1, 技术, 后端开发, 同程旅游, 苏州, 大专, 2000, 成熟型, 移动互联网 · 旅游
GO语言开发工程师, 40, 5, 技术, 后端开发, 滴滴打车, 北京, 本科, 500, 成熟型, 移动互联网
go开发工程师, 10, 1年以, 技术, 前端开发, 华阅数码科技, 广州, 大专, 50, 成熟型, 电子商务 · 医疗健康
Go研发工程师, 13, 1, 技术, 后端开发, 汉联互动, 成都, 大专, 15, 初创型, 移动互联网 · 教育
GO语言高级开发工程师, 30, 3, 技术, 后端开发, 滴滴打车, 北京, 本科, 500, 成熟型, 移动互联网
go语言开发工程师, 10, 不, 技术, 后端开发, Shop123, 杭州, 学历不限, 15, 初创型, 电子商务
go后端研发工程师, 22, 1, 技术, 后端开发, 有米科技, 广州, 本科, 150, 上市公, 移动互联网 · 广告营销
Go语言开发, 15, 3, 技术, 后端开发, 深圳中软国际, 深圳, 本科, 2000, 上市公, 移动互联网 · 企业服务
Go语言开发工程师/架构师, 30, 1, 技术, 后端开发, 沪江, 上海, 本科, 500, 成熟型, 移动互联网 · 教育
初级Go工程师, 12, 1年以, 技术, 后端开发, 持创, 西安, 学历不限, 50, 成长型, 移动互联网 · 电子商务
Go开发工程师（全栈工程师）, 22, 1, 技术, 后端开发, 美餐网, 北京, 本科, 500, 成熟型, 电子商务
Go(云帆加速）, 15, 1, 技术, 后端开发, 云帆世纪, 深圳, 本科, 50, 成长型, 数据服务
Go开发工程师, 12, 1, 技术, 后端开发, 魔诺克思, 北京, 本科, 15, 初创型, 教育
GO语言高级开发工程师, 31, 5, 技术, 后端开发, 滴滴打车, 北京, 本科, 500, 成熟型, 移动互联网
Go语言高级开发工程师, 30, 3, 技术, 后端开发, 滴滴打车, 北京, 本科, 500, 成熟型, 移动互联网
Go开发工程师, 12, 1, 技术, 后端开发, 第一视频, 北京, 本科, 500, 上市公, 文化娱乐
Go语言开发, 6, 不, 技术, 后端开发, 元代码, 重庆, 学历不限, 15, 初创型, 移动互联网 · 社交网络
Go语言程序开发, 8, 1, 技术, 后端开发, 成都大海怪科技有限公司, 成都, 本科, 15, 初创型, 移动互联网 · 游戏
高级Go工程师, 27, 3, 技术, 后端开发, 持创, 广州, 学历不限, 50, 成长型, 移动互联网 · 电子商务
中级Go工程师, 20, 1, 技术, 后端开发, 持创, 广州, 学历不限, 50, 成长型, 移动互联网 · 电子商务
Go研发工程师, 12, 1, 技术, 后端开发, 恒麟信息, 北京, 大专, 15, 成长型, 数据服务
Go开发工程师, 22, 1, 技术, 后端开发, 京东商城, 北京, 本科, 2000, 上市公, 电子商务
Go高级开发工程师, 27, 3, 技术, 后端开发, 持创, 无锡, 学历不限, 50, 成长型, 移动互联网
Go语言开发工程师, 15, 3, 技术, 后端开发, 极派客, 北京, 本科, 15, 成长型, 金融
Go语言开发工程师, 20, 1, 技术, 后端开发, 先看网络院线, 北京, 本科, 150, 成长型, 文化娱乐
初级Go开发工程师, 12, 1年以, 技术, 后端开发, 持创, 重庆, 学历不限, 50, 成长型, 移动互联网
Go/Golang开发工程师, 9, 1, 技术, 后端开发, 嘉简科技, 济南, 本科, 15, 初创型, 移动互联网 · 企业服务
Go后台攻城狮, 10, 3, 技术, 后端开发, 艾润物联, 西安, 本科, 50, 初创型, 移动互联网 · 生活服务
Go语言开发工程师, 30, 3, 技术, 后端开发, 滴滴打车, 北京, 本科, 500, 成熟型, 移动互联网
【滴滴打车】go语言开发工程师, 30, 3, 技术, 后端开发, 滴滴打车, 北京, 本科, 500, 成熟型, 移动互联网
中级Go开发工程师, 17, 1, 技术, 后端开发, 持创, 上海, 学历不限, 50, 成长型, 移动互联网 · 电子商务
高级Go工程师, 27, 3, 技术, 后端开发, 持创, 上海, 学历不限, 50, 成长型, 移动互联网 · 电子商务
中级Go开发工程师, 20, 1, 技术, 后端开发, 持创, 西安, 学历不限, 50, 成长型, 移动互联网
中级Go开发工程师, 20, 1, 技术, 后端开发, 持创, 南京, 学历不限, 50, 成长型, 移动互联网
Go高级工程师, 20, 1, 技术, 后端开发, 日日金, 北京, 本科, 15, 初创型, 金融
Go开发工程师, 15, 1, 技术, 后端开发, 环馨网络, 上海, 大专, 15, 初创型, 移动互联网 · 社交网络
Go研发工程师, 11, 不, 技术, 后端开发, 费睿网络, 上海, 学历不限, 15, 初创型, 广告营销
Go语言研发工程师, 11, 1, 技术, 后端开发, 热璞科技, 上海, 学历不限, 15, 初创型, 企业服务 · 数据服务
PHP 工程师（GO语言优先）, 16, 3, 技术, 后端开发, 乐士网络, 深圳, 大专, 50, 成长型, 电子商务 · 社交网络
高级Go系统研发工程师, 22, 3, 技术, 后端开发, 美图公司, 北京, 本科, 500, 成熟型, 移动互联网 · 硬件
服务端开发工程师（Go语言优先）, 6, 1, 技术, 后端开发, 飞鱼科技, 厦门, 大专, 150, 上市公, 游戏
Go服务器开发工程师——Trident Studio, 9, 1, 技术, 后端开发, Tap4Fun, 成都, 本科, 150, 初创型, 移动互联网 · 游戏
高级Go系统研发工程师-深圳, 22, 3, 技术, 后端开发, 美图公司, 深圳, 本科, 500, 成熟型, 移动互联网 · 硬件
go语言开发工程师/架构师, 30, 3, 技术, 后端开发, 滴滴打车, 北京, 本科, 500, 成熟型, 移动互联网
GO语言开发工程师, 30, 3, 技术, 后端开发, 滴滴打车, 北京, 本科, 500, 成熟型, 移动互联网
初级Go工程师, 12, 1年以, 技术, 后端开发, 持创, 上海, 学历不限, 50, 成长型, 移动互联网 · 电子商务
Go高级开发工程师, 27, 1年以, 技术, 后端开发, 持创, 成都, 学历不限, 50, 成长型, 移动互联网
初级Go开发工程师, 12, 1年以, 技术, 后端开发, 持创, 北京, 学历不限, 50, 成长型, 移动互联网
PHP工程师(懂GO语言), 19, 3, 技术, 后端开发, 乐士网络, 深圳, 大专, 50, 成长型, 电子商务 · 社交网络
服务器端开发（GO LANG或C语言）, 9, 1, 技术, 后端开发, DNS.COM, 厦门, 大专, 15, 成长型, 移动互联网 · 企业服务
C转go语言, 11, 1, 技术, 后端开发, 深圳中软国际, 深圳, 本科, 2000, 上市公, 移动互联网 · 企业服务
系统开发工程师（C＋＋／Go）, 17, 1, 技术, 前端开发, 饿了么, 上海, 本科, 2000, 成熟型, 移动互联网
Go语言开发程序员, 22, 应届毕业, 技术, 后端开发, 英佩游戏, 上海, 本科, 150, 成熟型, 游戏
Go/golang/Go语言, 17, 1, 技术, 后端开发, 逍遥天地, 北京, 大专, 15, 成长型, 游戏
Server(Go语言)高级工程师, 20, 1, 技术, 后端开发, 超级生活, 北京, 学历不限, 15, 初创型, O2O
后端开发(Node.js Ruby Go), 25, 3, 技术, 后端开发, 华兴资本, 深圳, 本科, 50, 初创型, 金融
Go服务器开发工程师——技术中心, 11, 1, 技术, 后端开发, Tap4Fun, 成都, 本科, 150, 初创型, 移动互联网 · 游戏
Go lang 服务端主程, 30, 5, 技术, 后端开发, 娱梦网络, 深圳, 本科, 15, 成长型, 移动互联网 · 游戏
后台研发工程师（go 语言）, 30, 3, 技术, 后端开发, 滴滴打车, 北京, 本科, 500, 成熟型, 移动互联网
滴滴后端开发工程师Go, 24, 3, 技术, 后端开发, 滴滴打车, 北京, 本科, 500, 成熟型, 移动互联网
Go高级开发工程师, 27, 3, 技术, 后端开发, 持创, 北京, 学历不限, 50, 成长型, 移动互联网
Go服务器开发工程师——Journey Studio, 10, 1, 技术, 后端开发, Tap4Fun, 成都, 本科, 150, 初创型, 移动互联网 · 游戏
初级服务器端工程师Go语言 C++/Java也可, 15, 1, 技术, 后端开发, 火翼游戏, 北京, 本科, 15, 成长型, 游戏
PHP C++ GO, 30, 3, 技术, 后端开发, 腾讯, 上海, 本科, 2000, 上市公, 移动互联网
Go语言工程师或实习生, 14, 不, 技术, 后端开发, 米博, 北京, 学历不限, 15, 初创型, 移动互联网
c++/go 后台开发工程师, 11, 1, 技术, 后端开发, 因特利, 广州, 本科, 50, 初创型, 移动互联网 · 广告营销
Go语言手游服务器端高级工程师 Java/C++也可以, 22, 3, 技术, 后端开发, 火翼游戏, 北京, 本科, 15, 成长型, 游戏
C/C++/Go, 6, 1, 技术, 后端开发, 英莱合创, 合肥, 本科, 15, 成长型, 硬件 · 数据服务
Go(Golang)游戏服务器端主程, 20, 1, 技术, 后端开发, 第一视频, 北京, 大专, 500, 上市公, 文化娱乐
php / ruby / python / nodejs / go 软件工程师, 9, 1, 技术, 后端开发, 宜云健康, 上海, 大专, 15, 初创型, 移动互联网 · 医疗健康
阿里百川-资深Java/Go工程师, 30, 3, 技术, 后端开发, 阿里巴巴, 杭州, 学历不限, 2000, 上市公, 移动互联网
后端开发工程师（PHP、C++、go）, 22, 1, 技术, 后端开发, 极致车网, 北京, 本科, 50, 成长型, 电子商务 · O2O
PHP/.net/io.js/go/python, 18, 3, 技术, 后端开发, 代言宝, 北京, 大专, 15, 初创型, 企业服务 · 文化娱乐
后端开发工程师（GO/PHP）, 30, 3, 技术, 后端开发, 滴滴打车, 北京, 本科, 500, 成熟型, 移动互联网
【滴滴打车】后端开发工程师(Go 语言开发）, 30, 3, 技术, 后端开发, 滴滴打车, 北京, 本科, 500, 成熟型, 移动互联网
Go /Golang 工程师（后台开发）/架构师, 30, 3, 技术, 后端开发, 滴滴打车, 北京, 本科, 500, 成熟型, 移动互联网
【创新工场】secken-GO工程师, 12, 1, 技术, 后端开发, 创新工场, 北京, 学历不限, 500, 成熟型, 移动互联网
Go，C，C++，Java, 22, 1, 技术, 后端开发, 58同城, 北京, 本科, 2000, 上市公, 生活服务 · 分类信息
后端工程师(Ruby/PHP/Python/Go), 15, 1, 技术, 后端开发, 无二之旅, 北京, 学历不限, 50, 成长型, 旅游
基础平台开发工程师C/Go/Python/Java, 22, 1, 技术, 后端开发, 阿里云, 北京, 本科, 2000, 上市公, 电子商务 · 企业服务
