数据挖掘, 12, 1, 技术, 后端开发, 康爱多, 广州, 本科, 500, 上市公, 移动互联网 · 电子商务
数据挖掘高级工程师, 4, 1, 技术, 后端开发, 赛驰科技, 郑州, 大专, 50, 成长型, 数据服务 · 文化娱乐
数据挖掘人员, 15, 1, 技术, 后端开发, 墨加科技, 北京, 本科, 15, 初创型, 移动互联网 · 教育
助理数据挖掘工程师, 8, 1, 技术, 后端开发, 智子云, 上海, 本科, 50, 成长型, 移动互联网 · 数据服务
数据挖掘工程师, 15, 不, 技术, 后端开发, 上海高欣计算机系统有限公司, 上海, 本科, 150, 成长型, 移动互联网 · 电子商务
数据挖掘助理工程师, 9, 1, 技术, 后端开发, 智子云, 上海, 本科, 50, 成长型, 移动互联网 · 数据服务
数据挖掘工程师, 18, 应届毕业, 技术, 后端开发, 妙计旅行, 北京, 本科, 50, 成长型, 旅游
数据挖掘工程师, 15, 3, 技术, 后端开发, 上海高欣计算机系统有限公司, 上海, 本科, 150, 成长型, 移动互联网 · 电子商务
数据挖掘, 27, 1, 技术, 后端开发, 百度, 北京, 本科, 2000, 上市公, 移动互联网
数据挖掘, 37, 1, 技术, 后端开发, 百度, 北京, 本科, 2000, 上市公, 移动互联网
数据挖掘开发工程师, 27, 1, 技术, 后端开发, 艾漫数据, 北京, 本科, 50, 成长型, 移动互联网 · 数据服务
数据挖掘工程师, 24, 不, 技术, dba, 普林科技, 上海, 硕士, 50, 成长型, 数据服务
数据挖掘开发工程师（spark）, 15, 1, 技术, 后端开发, 盛世全景, 北京, 本科, 15, 初创型, 金融 · 数据服务
数据挖掘, 25, 3, 技术, 后端开发, 就医160, 深圳, 本科, 500, 成熟型, 移动互联网
数据挖掘工程师, 12, 3, 技术, 后端开发, 么么嗖, 深圳, 本科, 150, 成长型, 移动互联网 · 电子商务
数据挖掘, 22, 不, 技术, 后端开发, 新开始, 杭州, 学历不限, 50, 初创型, O2O
数据挖掘工程师, 15, 3, 技术, dba, 团贷网, 东莞, 大专, 500, 成长型, 金融
数据挖掘研发工程师（实习）, 4, 应届毕业, 技术, 后端开发, 学霸君, 上海, 本科, 150, 成长型, 移动互联网 · 教育
高级数据挖掘工程师（文本方向）, 30, 1, 技术, 后端开发, DMCC, 北京, 本科, 50, 成长型, 数据服务
数据挖掘工程师, 8, 1, 技术, 后端开发, 乐商云集, 厦门, 本科, 50, 初创型, 电子商务 · O2O
数据挖掘工程师, 20, 1, 技术, 后端开发, 舜飞科技, 广州, 本科, 50, 成长型, 移动互联网
数据挖掘工程师 初级, 9, 不, 技术, 后端开发, 银谷, 北京, 本科, 2000, 初创型, 移动互联网 · 金融
数据挖掘工程师（急聘）, 17, 3, 技术, dba, 腾讯, 深圳, 本科, 2000, 上市公, 移动互联网  · 游戏
数据挖掘, 17, 3, 技术, 后端开发, 上海翼勋互联网金融信息服务有限公司, 上海, 本科, 150, 成长型, 金融
数据挖掘, 12, 3, 技术, 后端开发, 文思海辉, 广州, 大专, 2000, 上市公, 电子商务 · 金融
数据挖掘工程师, 22, 3, 技术, 后端开发, 三一重能, 北京, 本科, 500, 成熟型, 其他
数据挖掘工程师, 20, 3, 技术, 后端开发, 58赶集集团, 北京, 本科, 2000, 上市公, 移动互联网
数据挖掘, 22, 3, 技术, 后端开发, 信贤诚, 广州, 硕士, 150, 成长型, 移动互联网 · 电子商务
数据挖掘工程师, 12, 1, 技术, 后端开发, 那么社区, 南京, 本科, 50, 初创型, 移动互联网 · 社交网络
高级数据挖掘工程师, 22, 3, 技术, dba, 返利网, 上海, 本科, 500, 成熟型, 电子商务
数据挖掘工程师（MRDC）, 20, 1, 技术, 后端开发, 竞技世界, 北京, 本科, 500, 成熟型, 移动互联网 · 游戏
数据挖掘工程师, 9, 1, 技术, 后端开发, 大公信软, 北京, 硕士, 150, 成长型, 移动互联网 · 金融
数据挖掘（大数据）, 15, 3, 技术, 后端开发, 百度移动游戏, 北京, 本科, 2000, 上市公, 移动互联网
数据挖掘工程师, 20, 1, 技术, 后端开发, 小恩爱, 深圳, 本科, 50, 成长型, 社交网络
数据挖掘, 12, 3, 技术, 后端开发, MicroNature, 深圳, 本科, 500, 初创型, 移动互联网 · 数据服务
数据挖掘助理工程师, 7, 1年以, 技术, 后端开发, 智子云, 上海, 本科, 50, 成长型, 移动互联网 · 数据服务
数据挖掘工程师, 15, 1, 技术, 后端开发, 资邦, 上海, 大专, 2000, 成熟型, 金融
数据挖掘, 15, 不, 技术, 后端开发, 优亿科技, 广州, 本科, 50, 初创型, 移动互联网
数据挖掘, 35, 1, 技术, 后端开发, 宁波甬城, 杭州, 本科, 50, 成长型, 电子商务
数据挖掘, 12, 1, 技术, 后端开发, 中电海康, 杭州, 本科, 2000, 上市公, 移动互联网 · 企业服务
数据挖掘工程师, 17, 不, 技术, 后端开发, A1, 深圳, 硕士, 15, 初创型, 移动互联网 · 数据服务
数据挖掘, 12, 1, 技术, 后端开发, 北京苹果知科技有限公司, 成都, 大专, 15, 初创型, 移动互联网 · 硬件
数据挖掘工程师, 20, 1, 技术, 后端开发, TCL北研中心, 北京, 本科, 2000, 上市公, 电子商务
高级数据挖掘工程师, 22, 3, 技术, 后端开发, 58同城, 北京, 硕士, 2000, 上市公, O2O · 分类信息
数据挖掘（信用风险方向）, 30, 3, 技术, 后端开发, 京东金融, 北京, 本科, 2000, 上市公, 金融
数据挖掘, 27, 1, 技术, 后端开发, 百度, 北京, 本科, 2000, 上市公, 移动互联网 · 数据服务
数据挖掘, 11, 不, 技术, 后端开发, 知网, 北京, 硕士, 2000, 上市公, 移动互联网 · 电子商务
数据挖掘, 22, 3, 技术, 后端开发, 闪电购, 杭州, 本科, 500, 成长型, 移动互联网 · O2O
数据挖掘工程师, 27, 1, 技术, 后端开发, 美团网, 北京, 本科, 2000, 成熟型, 移动互联网 · O2O
数据挖掘工程师, 27, 3, 技术, 后端开发, 58同城, 北京, 本科, 2000, 上市公, 生活服务 · 分类信息
数据挖掘工程师（日志分析方向）, 25, 3, 技术, 后端开发, 美团网, 北京, 本科, 2000, 成熟型, 移动互联网 · O2O
数据挖掘, 20, 1, 技术, 后端开发, 电信恒联, 上海, 本科, 2000, 上市公, 数据服务 · 企业服务
数据挖掘工程师, 16, 3, 技术, 后端开发, 上海高欣计算机系统有限公司, 上海, 本科, 150, 成长型, 移动互联网 · 电子商务
数据挖掘高级工程师, 15, 1, 技术, 后端开发, 响巢看看, 深圳, 本科, 150, 成长型, 移动互联网 · 文化娱乐
高级数据挖掘工程师, 22, 1, 技术, 后端开发, 多准大数据, 杭州, 本科, 15, 初创型, 数据服务 · 广告营销
高级数据挖掘工程师, 22, 3, 技术, 后端开发, 阅文集团, 北京, 本科, 500, 成熟型, 移动互联网
高级数据挖掘工程师, 20, 3, 技术, 后端开发, Maxent, 上海, 本科, 15, 成长型, 移动互联网 · 数据服务
数据挖掘工程师, 17, 3, 技术, 后端开发, 欢网科技, 北京, 大专, 150, 成长型, 硬件
高级数据挖掘工程师, 30, 3, 技术, 后端开发, 阿里巴巴移动事业群, 北京, 本科, 2000, 上市公, 移动互联网
数据挖掘工程师, 17, 5, 技术, 后端开发, 中国惠普-企业服务事业部 HP-ES, 深圳, 本科, 2000, 上市公, 企业服务 · 数据服务
数据挖掘研发工程师, 12, 3, 技术, 后端开发, Misfit, 深圳, 本科, 50, 成熟型, 移动互联网 · 医疗健康
数据挖掘工程师, 22, 不, 技术, 后端开发, APUS Group, 北京, 学历不限, 50, 成长型, 移动互联网
数据挖掘工程师, 20, 1, 技术, dba, 饿了么, 上海, 本科, 2000, 成熟型, 移动互联网 · 招聘
数据挖掘, 17, 不, 技术, 后端开发, 陌陌, 北京, 本科, 150, 上市公, 社交网络
数据挖掘工程师, 12, 1, 技术, 后端开发, 央视网（中国网络电视台）, 北京, 本科, 500, 成熟型, 移动互联网 · 文化娱乐
数据挖掘, 9, 1, 技术, 后端开发, 马蹄数据, 南京, 学历不限, 15, 初创型, 金融
数据挖掘工程师, 20, 3, 技术, 后端开发, 邻动（北京）技术有限公司, 北京, 本科, 50, 成长型, 移动互联网
数据挖掘工程师, 20, 1, 技术, 后端开发, 味库, 北京, 本科, 50, 成长型, 生活服务
高级数据挖掘工程师, 12, 3, 技术, 后端开发, 要出发, 广州, 本科, 500, 成熟型, 电子商务 · 生活服务
数据挖掘工程师, 12, 不, 技术, dba, 孢子社区, 南京, 本科, 15, 初创型, 社交网络
数据挖掘高级工程师, 22, 3, 技术, 后端开发, 随手科技, 深圳, 本科, 150, 成长型, 移动互联网 · 金融
高级数据挖掘工程师, 14, 1, 技术, 后端开发, 什么值得买, 北京, 本科, 150, 成长型, 电子商务 · 文化娱乐
数据挖掘师, 4, 1, 技术, 后端开发, 武汉三岱, 武汉, 本科, 50, 初创型, 移动互联网
数据挖掘工程师, 22, 1, 技术, 后端开发, 魔秀桌面, 北京, 本科, 50, 成长型, 移动互联网
数据挖掘工程师, 20, 3, 技术, 后端开发, 北京信柏信息科技有限公司, 北京, 本科, 150, 成长型, 电子商务
数据挖掘工程师, 20, 3, 技术, 后端开发, 喂车车, 深圳, 本科, 50, 成长型, 移动互联网 · O2O
数据挖掘, 3, 不, 技术, 后端开发, 文思海辉, 杭州, 硕士, 2000, 上市公, 移动互联网 · 金融
数据挖掘（实习生）, 3, 不, 技术, 后端开发, 百度, 北京, 本科, 2000, 上市公, 移动互联网 · 数据服务
数据挖掘工程师, 20, 3, 技术, 后端开发, 美月网络（大姨吗子公司）, 北京, 大专, 150, 成熟型, 移动互联网
数据挖掘, 11, 1, 技术, 后端开发, 中奥科技, 杭州, 本科, 150, 成长型, 企业服务 · 数据服务
数据挖掘, 12, 不, 技术, 后端开发, 东软集团, 深圳, 本科, 2000, 上市公, 金融
数据挖掘工程师（模式识别）, 18, 不, 技术, 后端开发, 悦优博迈, 北京, 本科, 15, 成长型, 移动互联网 · 医疗健康
数据挖掘工程师, 22, 3, 技术, 后端开发, 每日优鲜, 北京, 本科, 150, 成长型, 移动互联网 · 电子商务
数据挖掘工程师, 15, 1, 运营, 运营, 喜马拉雅FM, 上海, 本科, 150, 成长型, 移动互联网 · 文化娱乐
数据挖掘工程师, 7, 不, 技术, 后端开发, 申迪计算机, 广州, 硕士, 150, 成长型, 企业服务 · 信息安全
数据挖掘, 22, 3, 技术, 后端开发, 嘉游国际, 上海, 本科, 500, 成熟型, 移动互联网 · 电子商务
高级数据挖掘工程师, 22, 1, 技术, 后端开发, 云图征信, 北京, 本科, 50, 成长型, 移动互联网 · 金融
数据挖掘工程师, 23, 3, 技术, 后端开发, 中大网视, 北京, 大专, 50, 成长型, 移动互联网
数据挖掘, 10, 1, 技术, 后端开发, 北斗院, 深圳, 本科, 50, 初创型, 移动互联网 · 数据服务
数据挖掘助理工程师, 8, 1, 技术, 后端开发, 众标网络科技, 上海, 本科, 50, 初创型, 电子商务 · 企业服务
数据挖掘工程师, 15, 1, 技术, 后端开发, 沈阳大数据运营有限公司, 沈阳, 本科, 150, 初创型, 数据服务
数据挖掘工程师, 20, 1, 技术, 后端开发, 舜飞科技, 广州, 本科, 50, 成长型, 移动互联网
高级数据挖掘工程师, 21, 3, 技术, 后端开发, 北京无双科技, 北京, 本科, 150, 成长型, 数据服务
数据挖掘工程师, 15, 1, 技术, 后端开发, ABD爱梦娱乐, 北京, 本科, 15, 成长型, 数据服务
数据挖掘, 19, 3, 技术, 后端开发, 百度, 上海, 本科, 2000, 上市公, 移动互联网 · 数据服务
数据挖掘工程师, 15, 3, 技术, 后端开发, 海尔商城, 北京, 大专, 150, 上市公, 移动互联网 · 电子商务
数据挖掘工程师 （算法）, 20, 3, 技术, 后端开发, 艾德思奇adSage, 北京, 本科, 500, 成长型, 移动互联网 · 广告营销
数据分析/数据挖掘, 20, 1, 技术, 后端开发, 商询科技, 朝阳, 本科, 15, 初创型, 企业服务 · 数据服务
数据挖掘（实习生）, 3, 不, 技术, 后端开发, 百度作业帮, 北京, 本科, 150, 成长型, 移动互联网 · 教育
数据挖掘专家, 25, 3, 技术, dba, 知名软件公司, 天津, 硕士, 50, 初创型, 企业服务
数据挖掘工程师, 18, 3, 技术, 后端开发, 绿盟科技, 北京, 本科, 500, 上市公, 信息安全
数据挖掘工程师, 19, 1, 技术, 后端开发, 悦优博迈, 北京, 本科, 15, 成长型, 移动互联网 · 医疗健康
(急聘)数据挖掘(中高级), 12, 不, 技术, 后端开发, 1号店, 武汉, 本科, 2000, 成熟型, 移动互联网 · 电子商务
数据挖掘, 20, 3, 技术, 后端开发, 携程网, 北京, 本科, 2000, 上市公, 移动互联网 · 旅游
数据挖掘分析师, 9, 1, 技术, 后端开发, 智子云, 上海, 本科, 50, 成长型, 移动互联网 · 数据服务
数据挖掘师, 8, 3, 运营, 运营, 麦优, 广州, 本科, 150, 成长型, 电子商务 · 医疗健康
数据挖掘工程师[上海], 22, 3, 技术, 后端开发, 阿里巴巴, 上海, 本科, 2000, 上市公, 移动互联网
数据挖掘, 15, 3, 技术, 后端开发, 一手活, 深圳, 大专, 50, 初创型, 移动互联网 · O2O
数据挖掘专家, 30, 3, 技术, 后端开发, 美团网, 北京, 本科, 2000, 成熟型, 移动互联网 · O2O
数据挖掘工程师, 9, 3, 技术, 后端开发, 泰迪智慧, 武汉, 本科, 15, 初创型, 数据服务
数据挖掘工程师, 22, 1, 技术, 后端开发, 知名互联网金融公司, 北京, 本科, 500, 成熟型, 移动互联网
数据挖掘, 22, 5, 技术, 后端开发, 华为技术有限公司, 深圳, 本科, 2000, 成熟型, 移动互联网 · 企业服务
数据挖掘BI, 11, 3, 技术, 后端开发, 柯莱特, 上海, 大专, 2000, 成熟型, 企业服务 · 金融
数据挖掘工程师, 12, 3, 技术, dba, TCL通讯科技控股有限公司, 深圳, 本科, 2000, 上市公, 移动互联网  · 硬件
数据挖掘师, 22, 3, 技术, 后端开发, 凭安信用, 上海, 学历不限, 50, 成长型, 金融
数据分析、数据挖掘, 37, 3, 技术, dba, 天火科技, 北京, 本科, 15, 初创型, 移动互联网 · 游戏
CTO（数据挖掘/SaaS), 37, 5, 技术, 高端技术职位, 明源云客, 深圳, 本科, 2000, 上市公, 移动互联网 · 企业服务
数据挖掘工程师, 17, 1, 技术, 后端开发, 魔方格, 北京, 本科, 50, 成长型, 移动互联网
数据挖掘研究员, 24, 1, 技术, 后端开发, 联想集团, 北京, 硕士, 2000, 上市公, 移动互联网 · 数据服务
ASO数据挖掘, 6, 1, 技术, 后端开发, 艾卓科技, 成都, 大专, 50, 初创型, 移动互联网 · 游戏
高级数据挖掘工程师, 20, 3, 技术, 后端开发, Gridsum 国双, 深圳, 本科, 500, 成熟型, 数据服务
数据挖掘开发, 30, 3, 技术, 后端开发, 美团网, 北京, 本科, 2000, 成熟型, 移动互联网 · O2O
数据挖掘工程师, 20, 3, 技术, 后端开发, 网易, 北京, 本科, 2000, 上市公, 数据服务 · 文化娱乐
数据挖掘, 22, 不, 技术, 后端开发, 碳云智能, 深圳, 学历不限, 15, 初创型, 医疗健康
数据挖掘工程师, 22, 不, 技术, 后端开发, 知乎, 北京, 学历不限, 150, 成熟型, 移动互联网 · 社交网络
【美团网-酒店-数据组】数据挖掘工程师, 30, 3, 技术, 后端开发, 美团网, 北京, 本科, 2000, 成熟型, 移动互联网 · O2O
数据挖掘工程师, 21, 3, 技术, 后端开发, 人脉通, 上海, 大专, 50, 成长型, 移动互联网
高级数据挖掘工程师, 22, 1, 技术, 后端开发, 36氪, 北京, 本科, 150, 成熟型, 移动互联网 · 电子商务
数据挖掘, 37, 3, 技术, 后端开发, 百度, 北京, 本科, 2000, 上市公, 移动互联网 · 数据服务
数据挖掘, 12, 不, 技术, 后端开发, 天翼阅读文化传播有限公司, 杭州, 学历不限, 150, 成长型, 移动互联网 · 文化娱乐
数据挖掘工程师, 22, 3, 技术, 后端开发, 乐视, 北京, 本科, 2000, 上市公, 移动互联网 · 文化娱乐
数据挖掘工程师, 15, 1, 技术, 后端开发, 牡丹集团, 北京, 本科, 150, 成长型, 企业服务 · 数据服务
数据挖掘工程师, 17, 3, 技术, 后端开发, 梆梆安全, 北京, 本科, 50, 成熟型, 信息安全
资深数据挖掘工程师, 22, 3, 技术, 后端开发, 品友互动, 北京, 本科, 150, 成熟型, 数据服务 · 广告营销
高级数据挖掘工程师, 17, 3, 技术, dba, 腾讯, 深圳, 本科, 2000, 上市公, 移动互联网  · 游戏
数据挖掘实习生, 6, 不, 技术, 后端开发, 上海高欣计算机系统有限公司, 上海, 硕士, 150, 成长型, 移动互联网 · 电子商务
数据挖掘研发工程师, 22, 3, 技术, 后端开发, iPIN.com, 深圳, 硕士, 50, 成长型, 数据服务
数据挖掘 实习, 6, 不, 技术, 后端开发, 多盟, 北京, 本科, 150, 成长型, 移动互联网 · 广告营销
数据挖掘工程师, 12, 1, 技术, 后端开发, 上海语镜汽车, 上海, 大专, 50, 成长型, 移动互联网 · 数据服务
数据挖掘, 12, 3, 技术, 后端开发, 青橄榄信息成立于2006年7月, 深圳, 本科, 150, 成长型, 移动互联网 · 数据服务
数据挖掘, 7, 1, 技术, 后端开发, 迈特望, 杭州, 大专, 150, 成长型, 移动互联网 · 数据服务
数据挖掘工程师, 11, 3, 技术, 后端开发, 亿达信息, 深圳, 大专, 2000, 上市公, 移动互联网 · 招聘
数据挖掘, 12, 3, 技术, 后端开发, 众镐网联, 深圳, 本科, 15, 初创型, 移动互联网
资深 数据挖掘工程师, 27, 不, 技术, dba, nonda 能塔智能, 上海, 本科, 15, 初创型, 移动互联网 · 硬件
数据挖掘工程师, 30, 3, 技术, 后端开发, 口袋购物&amp;微店, 杭州, 学历不限, 500, 成熟型, 移动互联网 · 电子商务
数据挖掘高级工程师（排序学习方向）, 30, 3, 技术, 后端开发, 美团网, 北京, 本科, 2000, 成熟型, 移动互联网 · O2O
数据挖掘专家, 65, 5, 技术, 高端技术职位, 360, 北京, 硕士, 2000, 上市公, 移动互联网 · 游戏
数据挖掘工程师, 40, 1, 技术, 后端开发, 安智, 北京, 本科, 150, 初创型, 移动互联网
数据挖掘工程师, 17, 3, 技术, 后端开发, 亿美软通, 北京, 本科, 150, 上市公, 移动互联网
数据挖掘工程师, 10, 3, 技术, dba, 易互通科技（武汉）有限公司, 武汉, 大专, 50, 成长型, 数据服务
数据挖掘工程师, 11, 3, 技术, dba, 深圳快易典, 深圳, 本科, 150, 初创型, 教育 · 硬件
数据挖掘, 2, 不, 技术, 后端开发, 百度, 北京, 硕士, 2000, 上市公, 移动互联网
数据挖掘架构师, 30, 3, 技术, 后端开发, 银橙传媒, 上海, 本科, 150, 上市公, 移动互联网 · 数据服务
数据挖掘工程师, 15, 1, 技术, dba, 易选股, 广州, 本科, 15, 初创型, 移动互联网 · 金融
高级数据挖掘工程师, 17, 3, 技术, dba, 腾讯, 深圳, 硕士, 2000, 上市公, 移动互联网  · 游戏
数据挖掘工程师, 20, 1, 技术, 后端开发, 新浪秒车, 北京, 本科, 15, 上市公, 移动互联网 · 电子商务
数据挖掘工程师, 11, 3, 技术, 后端开发, 睿智互动, 广州, 大专, 15, 成长型, 移动互联网 · 电子商务
数据挖掘工程师, 12, 不, 技术, 后端开发, 四维图新, 北京, 本科, 2000, 上市公, 移动互联网 · 生活服务
高级数据挖掘工程师, 15, 3, 技术, 后端开发, 么么嗖, 深圳, 本科, 150, 成长型, 移动互联网 · 电子商务
数据挖掘主管, 12, 3, 技术, 高端技术职位, 什么值得买, 北京, 本科, 150, 成长型, 电子商务 · 文化娱乐
数据挖掘分析师（数据中心）, 15, 1, 设计, 用户研究, Gridsum 国双, 北京, 本科, 500, 成熟型, 数据服务
数据挖掘工程师, 22, 3, 技术, 后端开发, 百度, 北京, 本科, 2000, 上市公, 移动互联网 · 数据服务
数据挖掘工程师（含实习）, 22, 不, 技术, 后端开发, DataStory, 广州, 本科, 15, 成长型, 数据服务
数据挖掘工程师, 13, 3, 技术, 后端开发, 卷皮, 武汉, 本科, 500, 成长型, 电子商务
数据挖掘工程师, 22, 不, 技术, 后端开发, 腾讯, 深圳, 本科, 2000, 上市公, 移动互联网  · 游戏
数据挖掘工程师, 22, 3, 技术, 后端开发, 有赞, 杭州, 本科, 150, 成长型, 移动互联网 · 电子商务
数据挖掘工程师（排序学习方向）, 40, 3, 技术, 后端开发, 侃家, 北京, 本科, 50, 成长型, O2O
高级数据挖掘工程师, 16, 1, 技术, 后端开发, 银汉, 广州, 本科, 500, 成长型, 移动互联网 · 游戏
数据挖掘算法工程师, 20, 不, 技术, 后端开发, 55海淘, 上海, 本科, 150, 成长型, 电子商务
数据挖掘工程师, 15, 1, 技术, 后端开发, 穿衣助手, 上海, 本科, 50, 成长型, 移动互联网 · 电子商务
数据挖掘工程师, 12, 1, 技术, 后端开发, 惠每时代, 北京, 本科, 50, 成长型, 医疗健康
数据挖掘高级工程师, 30, 3, 技术, 后端开发, 美团网, 北京, 本科, 2000, 成熟型, 移动互联网 · O2O
数据挖掘工程师, 20, 3, 技术, 后端开发, 网易, 北京, 本科, 2000, 上市公, 数据服务 · 文化娱乐
数据挖掘, 12, 1, 技术, 后端开发, 维农网络科技, 深圳, 本科, 15, 成长型, 移动互联网 · 电子商务
数据挖掘, 5, 不, 技术, 后端开发, 智能投, 北京, 本科, 15, 初创型, 金融
数据挖掘, 18, 3, 技术, 后端开发, 京东, 北京, 本科, 2000, 上市公, 移动互联网 · 电子商务
数据挖掘工程师, 22, 不, 技术, 后端开发, 成都信必优, 成都, 本科, 150, 初创型, 电子商务
数据挖掘, 9, 1, 技术, 后端开发, 悦跑圈, 广州, 本科, 50, 成长型, 移动互联网 · 社交网络
高级数据挖掘工程师, 17, 1, 技术, 后端开发, IYOHOO, 北京, 本科, 15, 初创型, 移动互联网
数据挖掘工程师, 11, 3, 技术, 后端开发, 爱游戏(中国电信游戏基地), 南京, 本科, 150, 成长型, 移动互联网 · 游戏
数据挖掘工程师, 20, 3, 技术, 后端开发, 深圳市彩讯科技有限公司, 深圳, 本科, 500, 成熟型, 移动互联网 · O2O
数据挖掘, 7, 1, 技术, 后端开发, RET睿意德, 成都, 大专, 500, 初创型, 移动互联网 · 企业服务
产品技术部-数据挖掘工程师, 30, 3, 技术, dba, 滴滴打车, 北京, 本科, 500, 成熟型, 移动互联网
数据挖掘工程师, 17, 1, 技术, 后端开发, 尔创科技, 北京, 硕士, 50, 初创型, 移动互联网
数据挖掘, 5, 应届毕业, 技术, 后端开发, InnoTREE, 北京, 硕士, 15, 成长型, 金融
数据挖掘专家, 15, 3, 技术, 高端技术职位, 中至科技集团, 南昌, 大专, 150, 初创型, 移动互联网 · 游戏
高级数据挖掘工程师, 32, 3, 技术, 后端开发, 京东商城, 北京, 本科, 2000, 上市公, 电子商务
数据挖掘工程师, 12, 1, 技术, 后端开发, 有数金服, 杭州, 大专, 15, 初创型, 金融 · 数据服务
高级数据挖掘工程师, 28, 3, 技术, 后端开发, 菱歌科技, 北京, 本科, 15, 成长型, 企业服务 · 广告营销
广告数据挖掘工程师, 19, 不, 技术, 后端开发, 58同城, 北京, 本科, 2000, 上市公, 生活服务 · 分类信息
数据挖掘 主管, 21, 3, 技术, 后端开发, 什么值得买, 北京, 本科, 150, 成长型, 电子商务 · 文化娱乐
数据挖掘工程师, 22, 1, 技术, 后端开发, 下厨房, 北京, 本科, 50, 成长型, 移动互联网
数据挖掘工程师, 7, 1, 技术, 运维, 来投吧, 上海, 本科, 15, 初创型, 企业服务 · 金融
数据挖掘, 15, 应届毕业, 技术, 后端开发, 新浪网, 北京, 本科, 2000, 上市公, 移动互联网
数据挖掘高级工程师/技术专家, 30, 3, 技术, 后端开发, 美团网, 北京, 本科, 2000, 成熟型, 移动互联网 · O2O
数据挖掘架构师, 40, 5, 技术, 后端开发, 淡蓝网Blued, 北京, 本科, 50, 成长型, 移动互联网 · 社交网络
数据挖掘 高级工程师, 27, 1, 技术, 后端开发, 美团网, 北京, 本科, 2000, 成熟型, 移动互联网 · O2O
高级数据挖掘工程师, 14, 3, 技术, 后端开发, 鹏元征信有限公司, 深圳, 本科, 150, 成长型, 金融 · 数据服务
数据挖掘师, 11, 不, 技术, 后端开发, 捷贷, 重庆, 硕士, 50, 成长型, 移动互联网 · 金融
数据挖掘工程师, 8, 1, 技术, 后端开发, 埃文科技, 郑州, 本科, 15, 初创型, 移动互联网 · 数据服务
高级数据挖掘工程师, 17, 不, 技术, 后端开发, 北京贝虎物联技术有限公司, 北京, 学历不限, 15, 成长型, 硬件
数据挖掘, 3, 不, 技术, 后端开发, 汇声市场调研, 广州, 本科, 15, 初创型, 其他
数据挖掘高级工程师, 26, 1, 技术, 后端开发, 美团网, 北京, 本科, 2000, 成熟型, 移动互联网 · O2O
算法工程师（数据挖掘）, 15, 1, 技术, 后端开发, 顺网科技, 杭州, 本科, 500, 上市公, 游戏 · 移动互联网
数据挖掘工程师, 25, 3, 技术, 后端开发, 恒大健康, 深圳, 硕士, 500, 上市公, 移动互联网 · 医疗健康
高级数据挖掘工程师, 30, 3, 技术, 后端开发, 小麦公社, 北京, 本科, 500, 成长型, 移动互联网 · 电子商务
数据挖掘师, 22, 3, 技术, 后端开发, 索信达, 深圳, 本科, 150, 成长型, 金融 · 数据服务
数据挖掘工程师, 22, 1, 技术, 后端开发, 腾讯, 深圳, 本科, 2000, 上市公, 移动互联网  · 游戏
【2016校招】数据挖掘, 12, 应届毕业, 技术, 后端开发, 竞技世界, 北京, 硕士, 500, 成熟型, 移动互联网 · 游戏
数据挖掘工程师, 12, 1, 技术, dba, 车易拍, 北京, 本科, 500, 成熟型, 电子商务
数据挖掘（机器学习 自然语言处理方向）, 15, 不, 技术, 后端开发, 悦优博迈, 北京, 本科, 15, 成长型, 移动互联网 · 医疗健康
