新媒体运营经理/主管, 11, 1, 运营, 运营, 炳恒集团, 上海, 大专, 2000, 成熟型, 金融
产品研究员, 7, 3, 产品, 产品经理, 赣元投资, 上海, 本科, 15, 初创型, 移动互联网
阿里百川众创空间运营经理, 6, 1, 运营, 运营, 爱特加速器, 厦门, 大专, 50, 成长型, 移动互联网 · O2O
投资顾问, 9, 不, 市场与销售, 投资, 德通汇富, 北京, 学历不限, 150, 成长型, 金融
全栈工程师, 12, 不, 技术, 后端开发, 路享Roadshr, 深圳, 学历不限, 15, 初创型, 企业服务
产品经理(进口跨境电商), 22, 5, 产品, 产品经理, 信利康供应链, 深圳, 本科, 500, 初创型, 电子商务 · 金融
商务拓展经理, 15, 1, 市场与销售, 市场/营销, 麦子金服, 上海, 本科, 150, 成长型, 移动互联网 · 金融
金融产品经理, 25, 3, 产品, 产品经理, 麦子金服, 上海, 本科, 150, 成长型, 移动互联网 · 金融
.NET, 11, 1, 技术, 后端开发, 拾财贷, 北京, 本科, 150, 成长型, 移动互联网 · 金融
电话销售, 2, 不, 市场与销售, 销售, 永安信（忻州）基金, 忻州, 大专, 15, 初创型, 金融
客服经理, 2, 不, 运营, 客服, 永安信（忻州）基金, 忻州, 大专, 15, 初创型, 金融
客服经理, 2, 不, 运营, 客服, 永安信（忻州）基金, 忻州, 大专, 15, 初创型, 金融
高级测试工程师, 15, 3, 技术, 测试, 赤牛, 杭州, 学历不限, 15, 初创型, 移动互联网 · 金融
资深互动传播创意设计师, 15, 5, 市场与销售, 公关, 际恒公关, 上海, 本科, 150, 成长型, 广告营销
JAVA 高级工程师, 11, 1, 技术, 前端开发, 安信投, 北京, 大专, 50, 成长型, 金融
java高级工程师, 9, 1, 技术, 前端开发, 安信投, 北京, 大专, 50, 成长型, 金融
商场客服（前台咨询）, 2, 不, 运营, 客服, 上亿最家空间, 杭州, 学历不限, 2000, 成熟型, 硬件
母婴采销经理, 8, 1, 市场与销售, 采购, 蜂云网络（51订货网）, 南京, 大专, 500, 成长型, 电子商务 · O2O
金融理财顾问, 6, 1年以, 金融, 投融资, 钦联财富, 上海, 大专, 500, 成熟型, 金融 · 生活服务
理财顾问, 5, 1, 金融, 投融资, 钦联财富, 上海, 大专, 500, 成熟型, 金融 · 生活服务
渠道销售主管, 9, 不, 市场与销售, 销售, 安徒生基金&middot;信麟财富, 上海, 大专, 150, 成长型, 金融
市场顾问, 6, 不, 市场与销售, 市场/营销, 中资信和, 武汉, 大专, 500, 成熟型, 电子商务 · 金融
风险管理事业部经理, 10, 3, 金融, 风控, 兴邦资本, 北京, 本科, 15, 初创型, 金融
APP运营经理, 7, 1, 运营, 运营, 好车贷；长天资产, 合肥, 大专, 150, 成长型, 金融
中级理财顾问, 6, 1, 金融, 投融资, 安信普华, 北京, 本科, 2000, 成熟型, 金融
销售专员(无责底薪), 4, 不, 市场与销售, 销售, 中润通, 北京, 学历不限, 150, 成长型, 金融
架构师（技术合伙人）, 12, 5, 技术, 高端技术职位, 武汉达此网络科技有限公司, 武汉, 本科, 150, 成长型, 移动互联网 · O2O
店长助理, 4, 不, 市场与销售, 销售, 孵爱代, 深圳, 大专, 15, 初创型, O2O · 教育
商务BD, 7, 1, 市场与销售, 市场/营销, 君石控股, 北京, 大专, 150, 成长型, 金融
IT项目总监, 12, 3, 技术, 高端技术职位, 易煤网, 郑州, 本科, 150, 上市公, 电子商务
市场营销新媒体推广, 5, 应届毕业, 市场与销售, 市场/营销, 泥鸽靶, 上海, 大专, 15, 初创型, 移动互联网 · 金融
亿家网-营销推广合伙人, 22, 3, 市场与销售, 市场/营销, 亿家网, 北京, 本科, 50, 成长型, 移动互联网 · 电子商务
新媒体运营（微博/微信）, 11, 3, 运营, 运营, 亿家网, 北京, 大专, 50, 成长型, 移动互联网 · 电子商务
html5, 15, 不, 技术, 前端开发, 亿家网, 北京, 大专, 50, 成长型, 移动互联网 · 电子商务
移动产品经理, 15, 1, 产品, 产品经理, 米庄理财, 杭州, 大专, 50, 成长型, 金融
文案策划, 7, 1, 市场与销售, 公关, 和智传信, 北京, 学历不限, 50, 初创型, 移动互联网 · 广告营销
策划经理, 9, 3, 运营, 运营, 和智传信, 北京, 本科, 50, 初创型, 移动互联网 · 广告营销
.NET工程师(急聘), 9, 不, 技术, 后端开发, PPmoney互联网金融平台, 广州, 本科, 150, 成长型, 金融
理财顾问, 9, 不, 金融, 投融资, 康宏中国, 深圳, 本科, 500, 上市公, 金融
文秘, 6, 1, 职能, 行政, 草根天使会, 深圳, 大专, 15, 初创型, 企业服务 · 金融
招聘助理, 4, 不, 市场与销售, 市场/营销, 海润财富, 北京, 本科, 150, 成长型, 金融
java架构师, 25, 3, 技术, 高端技术职位, 蜂云网络（51订货网）, 南京, 本科, 500, 成长型, 电子商务 · O2O
投资经理-数字娱乐, 20, 3, 金融, 投融资, 星河互联集团, 北京, 本科, 500, 成熟型, 移动互联网
招聘主管, 10, 3, 职能, 人力资源, 恒昌利通, 上海, 本科, 2000, 成熟型, 金融
自动化测试, 20, 3, 技术, 测试, 蘑菇租房, 上海, 大专, 150, 成长型, 移动互联网 · 电子商务
市场BD部门总监（需要BD管理经验）, 22, 3, 市场与销售, 销售, 银谷, 北京, 本科, 2000, 初创型, 移动互联网 · 金融
媒介经理, 10, 1, 市场与销售, 公关, 财鱼管家, 北京, 大专, 15, 成长型, 移动互联网 · 金融
组织发展总监/经理, 25, 3, 职能, 人力资源, 麦子金服, 上海, 本科, 150, 成长型, 移动互联网 · 金融
电话销售, 5, 不, 市场与销售, 销售, 光环国际, 北京, 大专, 150, 成长型, 教育
总裁助理及行政财务岗, 4, 不, 职能, 行政, 中创资本, 北京, 学历不限, 15, 初创型, 企业服务 · 金融
招 聘, 5, 1, 职能, 人力资源, 安信投, 北京, 大专, 50, 成长型, 金融
销售顾问, 7, 不, 市场与销售, 销售, 品信众达信息科技有限公司, 北京, 大专, 2000, 成长型, 电子商务 · 金融
私人银行家, 75, 5, 市场与销售, 销售, 富高投资, 上海, 本科, 50, 成长型, 金融 · 其他
Java后台开发工程师（SOA）, 12, 5, 技术, 后端开发, VHS 好人生, 上海, 大专, 50, 成熟型, 医疗健康
市场专员, 4, 1, 市场与销售, 销售, 天使乐园, 湖州, 大专, 500, 成熟型, 旅游
销售经理, 11, 3, 市场与销售, 销售, 钦联财富, 上海, 本科, 500, 成熟型, 金融 · 生活服务
总裁助理及行政财务岗, 5, 1年以下, 职能, 行政, 中创资本, 北京, 大专, 15, 初创型, 企业服务 · 金融
网络推广, 3, 1, 运营, 运营, 贵州醉美庄园投资管理有限公司, 广州, 大专, 15, 初创型, 电子商务
文案策划, 3, 1, 运营, 编辑, 贵州醉美庄园投资管理有限公司, 广州, 大专, 15, 初创型, 电子商务
医生客服专员, 5, 不, 运营, 客服, V大夫, 北京, 学历不限, 50, 成长型, O2O
团队经理, 15, 3, 金融, 投融资, 普惠金融, 北京, 本科, 2000, 初创型, 金融
网络推广, 6, 不, 运营, 运营, 泥鸽靶, 上海, 学历不限, 15, 初创型, 移动互联网 · 金融
运营部经理, 25, 5, 运营, 运营, 北京紫马财行投资管理有限公司, 北京, 本科, 150, 成长型, 金融
PHP开发工程师, 12, 1, 技术, 后端开发, 银筑控股, 杭州, 大专, 50, 初创型, 移动互联网 · 金融
android开发工程师, 16, 3, 技术, 移动开发, 信和财富-科技公司, 北京, 本科, 2000, 成熟型, 金融
高级软件测试工程师, 12, 不, 技术, 测试, 上海香善, 上海, 大专, 15, 初创型, 移动互联网 · 生活服务
市场推广（地推专员）, 4, 不, 市场与销售, 市场/营销, 亿家网, 北京, 学历不限, 50, 成长型, 移动互联网 · 电子商务
系统工程师, 15, 5, 技术, 运维, 信和财富-科技公司, 北京, 本科, 2000, 成熟型, 金融
新媒体运营经理, 7, 3, 运营, 运营, 优品财富管理有限公司, 武汉, 本科, 500, 初创型, 金融
网络推广专员1, 6, 1, 运营, 运营, 泥鸽靶, 上海, 大专, 15, 初创型, 移动互联网 · 金融
文案策划, 6, 1, 运营, 编辑, 和智传信, 北京, 大专, 50, 初创型, 移动互联网 · 广告营销
文案策划, 7, 1, 运营, 编辑, 和智传信, 北京, 大专, 50, 初创型, 移动互联网 · 广告营销
美术设计师, 9, 3, 设计, 视觉设计, 和智传信, 北京, 本科, 50, 初创型, 移动互联网 · 广告营销
文案策划, 7, 3, 运营, 编辑, 和智传信, 北京, 本科, 50, 初创型, 移动互联网 · 广告营销
网络推广副经理, 15, 3, 运营, 运营, 东方银谷, 北京, 大专, 2000, 成熟型, 移动互联网 · 金融
金融产品经理, 15, 1, 产品, 产品经理, 赣元投资, 上海, 本科, 15, 初创型, 移动互联网
总经理助理, 5, 1, 运营, 运营, 国康, 深圳, 大专, 500, 初创型, 医疗健康 · 生活服务
BD总监, 25, 3, 市场与销售, 销售, 华游, 上海, 大专, 15, 初创型, 移动互联网 · 游戏
总助, 7, 1, 职能, 行政, 中铭智集团, 深圳, 大专, 500, 成熟型, 企业服务 · 教育
PHP开发工程师, 15, 1, 技术, 后端开发, 糖果金融, 北京, 大专, 150, 初创型, 金融
交易员, 11, 不, 金融, 投融资, 佰润明辉, 北京, 大专, 150, 成长型, 移动互联网 · 金融
网络营销经理/总监, 25, 3, 运营, 运营, 麦子金服, 上海, 本科, 150, 成长型, 移动互联网 · 金融
新媒体运营专员, 7, 1, 运营, 运营, 天天投, 北京, 大专, 15, 成长型, 移动互联网 · 金融
PHP开发工程师, 12, 1, 技术, 后端开发, 网贷之家, 上海, 学历不限, 150, 成长型, 金融
Java开发工程师, 18, 1, 技术, 后端开发, 网贷之家, 上海, 本科, 150, 成长型, 金融
销售经理, 5, 1年以, 市场与销售, 市场/营销, 大大集团, 定西, 学历不限, 2000, 成熟型, 金融
运维经理, 2, 不, 技术, 运维, 永安信（忻州）基金, 忻州, 大专, 15, 初创型, 金融
高级Web前端开发工程师, 22, 3, 技术, 前端开发, 赤牛, 杭州, 学历不限, 15, 初创型, 移动互联网 · 金融
高级WEB前端, 25, 3, 技术, 前端开发, 酬信, 北京, 大专, 150, 成长型, 金融
电话销售, 7, 不, 市场与销售, 销售, 品信众达信息科技有限公司, 北京, 大专, 2000, 成长型, 电子商务 · 金融
销售经理, 7, 不, 市场与销售, 销售, 品信众达信息科技有限公司, 北京, 大专, 2000, 成长型, 电子商务 · 金融
应用支持工程师, 20, 不, 技术, 运维, 富国基金, 上海, 学历不限, 150, 成长型, 金融
客服专员（心理学）, 4, 不, 运营, 客服, VHS 好人生, 上海, 大专, 50, 成熟型, 医疗健康
钰诚集团诚聘e租宝团队经理, 9, 1, 金融, 投融资, 安信普华, 北京, 大专, 2000, 成熟型, 金融
诚招平面设计师, 6, 1, 设计, 视觉设计, 牛芝家, 南京, 大专, 50, 初创型, 生活服务
测试工程师, 15, 1, 技术, 测试, 华赢集团, 北京, 本科, 15, 初创型, 移动互联网 · 金融
销售经理, 9, 1年以, 市场与销售, 销售, 中资信和, 武汉, 本科, 500, 成熟型, 电子商务 · 金融
网页设计师, 6, 1, 设计, 视觉设计, 泥鸽靶, 上海, 大专, 15, 初创型, 移动互联网 · 金融
销售经理, 9, 1年以, 市场与销售, 销售, 壹宏财富, 广州, 大专, 15, 成长型, 移动互联网 · 金融
web前端, 19, 1, 技术, 前端开发, 糖果金融, 北京, 本科, 150, 初创型, 金融
SEO, 5, 1, 市场与销售, 市场/营销, 银筑控股, 杭州, 大专, 50, 初创型, 移动互联网 · 金融
门店经理, 9, 1, 金融, 高端金融职位, 钦联财富, 上海, 大专, 500, 成熟型, 金融 · 生活服务
p2p理财顾问(高薪高提成), 12, 1, 市场与销售, 销售, 上海恒昌财富投资管理有限公司, 上海, 大专, 2000, 成长型, 金融
CMO首席营销官——营销推广合伙人, 40, 5, 市场与销售, 市场/营销, 亿家网, 北京, 本科, 50, 成长型, 移动互联网 · 电子商务
高级平面设计师, 10, 3, 设计, 视觉设计, 蓝海创投, 深圳, 大专, 15, 初创型, 金融 · 医疗健康
SEO/SEM搜索引擎优化, 15, 1, 市场与销售, 市场/营销, 米庄理财, 杭州, 大专, 50, 成长型, 金融
文案策划, 7, 1, 运营, 编辑, 和智传信, 北京, 本科, 50, 初创型, 移动互联网 · 广告营销
文案策划, 7, 1, 运营, 编辑, 和智传信, 北京, 本科, 50, 初创型, 移动互联网 · 广告营销
客户体验主管, 12, 1, 运营, 客服, PPmoney互联网金融平台, 广州, 本科, 150, 成长型, 金融
web前端开发工程师, 11, 1, 技术, 前端开发, 普伴中国, 北京, 本科, 500, 成熟型, 移动互联网 · 金融
运营经理Growth Hacker, 15, 3, 运营, 运营, 北京天使汇, 北京, 本科, 50, 成长型, 金融
Java开发工程师, 9, 不, 技术, 后端开发, 蜂云网络（51订货网）, 南京, 大专, 500, 成长型, 电子商务 · O2O
Java工程师, 10, 3, 技术, 后端开发, 蜂云网络（51订货网）, 南京, 大专, 500, 成长型, 电子商务 · O2O
Web前端, 16, 3, 技术, 前端开发, 恒昌利通, 上海, 本科, 2000, 成熟型, 金融
自如管家ZO, 10, 不, 市场与销售, 销售, 自如网, 北京, 本科, 2000, 成熟型, 移动互联网 · O2O
初级Java工程师, 5, 1年以, 技术, 后端开发, 大通资本, 厦门, 本科, 500, 成熟型, 金融
BI数据分析实习生（实习工资100元/天）, 2, 不, 设计, 用户研究, 蛋壳公寓, 北京, 本科, 50, 成长型, O2O
交易员操盘手, 13, 不, 金融, 投融资, 佰润明辉, 北京, 大专, 150, 成长型, 移动互联网 · 金融
投资副总裁, 100, 5, 职能, 高端职能职位, 麦子金服, 上海, 本科, 150, 成长型, 移动互联网 · 金融
品牌营销总监, 40, 5, 市场与销售, 高端市场职位, 麦子金服, 上海, 本科, 150, 成长型, 移动互联网 · 金融
Java（高级）, 20, 3, 技术, 后端开发, 中大咨询, 广州, 大专, 150, 成长型, 企业服务 · 其他
交易系统研发工程师, 9, 不, 技术, 后端开发, 金溢宝资本, 张家港, 本科, 15, 初创型, 金融 · 数据服务
初级开发工程师（java后端方向）, 5, 1, 技术, 后端开发, 亚馨信贷, 深圳, 本科, 50, 成长型, 金融
微信渠道拓展, 5, 1, 市场与销售, 市场/营销, 调果师, 北京, 大专, 50, 成长型, 电子商务 · O2O
项目经理/助理项目经理, 6, 无经验, , 项目助理, 优能联合, 北京, 本科, 15, 初创型, 企业服务 · 其他
运营经理, 9, 3, 运营, 运营, 仆家（上海）, 上海, 大专, 15, 初创型, 电子商务
网店运营, 2, 不, 运营, 运营, 永安信（忻州）基金, 忻州, 大专, 15, 初创型, 金融
文案策划, 11, 不, 运营, 运营, 淘金子, 杭州, 学历不限, 50, 初创型, 移动互联网 · 电子商务
美妆运营, 9, 3, 运营, 运营, 淘金子, 杭州, 大专, 50, 初创型, 移动互联网 · 电子商务
贷款端销售, 9, 1, 市场与销售, 市场/营销, 安信投, 北京, 大专, 50, 成长型, 金融
电话销售, 11, 1, 市场与销售, 销售, 上海大大浦东新区公司分公司, 上海, 大专, 2000, 上市公, 金融
ERP系统主管, 8, 1, 技术, 后端开发, 盘古餐饮, 上海, 大专, 2000, 成熟型, 生活服务
护士 护理人员, 6, 不, 技术, 高端技术职位, 康管家, 上海, 大专, 15, 初创型, O2O
运维工程师, 6, 1, 技术, 运维, 信和财富-科技公司, 合肥, 本科, 2000, 成熟型, 金融
测试工程师, 7, 1, 技术, 测试, 艾文凯迪, 中山, 大专, 50, 成长型, O2O · 数据服务
法务风控经理, 30, 3, 职能, 法务, 小牛, 北京, 本科, 2000, 成长型, 金融
电子商务APP运营经理 APP Operation Manager, 13, 3, 运营, 运营, 家乐福（中国）总部, 上海, 本科, 500, 上市公, 企业服务 · 生活服务
总裁办实习生 海淀苏州街, 3, 应届毕业, 市场与销售, 市场/营销, 海润财富, 北京, 本科, 150, 成长型, 金融
天宴-空间设计师, 11, 1, 设计, 视觉设计, 天宴SHOW, 上海, 大专, 50, 成长型, 文化娱乐 · 移动互联网
高级运维工程师, 12, 3, 技术, 运维, 自如网, 北京, 本科, 2000, 成熟型, 移动互联网 · O2O
网页设计师, 7, 1, 设计, 视觉设计, 泥鸽靶, 上海, 大专, 15, 初创型, 移动互联网 · 金融
HTML5前端工程师, 15, 3, 技术, 前端开发, 直投网, 北京, 大专, 500, 成熟型, 金融
(国企中投)急招金融理财顾问10名, 6, 1, 金融, 投融资, 中投华北基金, 北京, 大专, 150, 成长型, 企业服务 · 金融
理财顾问, 7, 3, 金融, 投融资, 钦联财富, 上海, 本科, 500, 成熟型, 金融 · 生活服务
高级文案, 11, 1, 运营, 编辑, 信和财富-科技公司, 北京, 本科, 2000, 成熟型, 金融
策划经理, 8, 3, 市场与销售, 市场/营销, 无界财富, 深圳, 大专, 50, 成长型, 金融
高级PHP研发工程师/架构师, 30, 3, 技术, 后端开发, 自如网, 北京, 本科, 2000, 成熟型, 移动互联网 · O2O
运营经理, 12, 3, 运营, 运营, 上海香善, 上海, 本科, 15, 初创型, 移动互联网 · 生活服务
网络推广专员, 12, 1, 市场与销售, 市场/营销, 亿家网, 北京, 大专, 50, 成长型, 移动互联网 · 电子商务
服务器工程师, 8, 1, 运营, 运营, 亿隆汇诚, 北京, 大专, 500, 成熟型, 金融
web前端, 8, 1, 技术, 前端开发, 上海装潢网, 上海, 大专, 15, 初创型, O2O · 生活服务
（金诚学院）市场策划, 10, 3, 市场与销售, 市场/营销, 金诚集团, 杭州, 本科, 500, 成熟型, 金融
高级支付结算, 9, 不, 金融, 审计税务, 米庄理财, 杭州, 本科, 50, 成长型, 金融
金融投资分析管理培训生, 9, 不, 金融, 投融资, 佰润明辉, 北京, 大专, 150, 成长型, 移动互联网 · 金融
SEO/SEM推广经理, 12, 1, 运营, 运营, 米庄理财, 杭州, 大专, 50, 成长型, 金融
文案策划, 6, 1, 运营, 运营, 和智传信, 北京, 本科, 50, 初创型, 移动互联网 · 广告营销
html5, 7, 1, 技术, 前端开发, 泥鸽靶, 上海, 大专, 15, 初创型, 移动互联网 · 金融
网络营销, 6, 1, 市场与销售, 市场/营销, 泥鸽靶, 上海, 大专, 15, 初创型, 移动互联网 · 金融
客户经理, 7, 1年以, 市场与销售, 销售, 壹宏财富, 广州, 大专, 15, 成长型, 移动互联网 · 金融
html5, 11, 1, 技术, 前端开发, 康管家, 上海, 本科, 15, 初创型, O2O
客服专员（急聘）, 4, 1, 运营, 客服, 壹宏财富, 广州, 大专, 15, 成长型, 移动互联网 · 金融
Java开发工程师, 14, 1, 技术, 后端开发, 上海安能物流有限公司, 上海, 大专, 2000, 成熟型, 其他
客服, 5, 1, 运营, 客服, 蛋壳公寓, 北京, 本科, 50, 成长型, O2O
人力资源总监, 40, 5, 职能, 人力资源, 麦子金服, 上海, 本科, 150, 成长型, 移动互联网 · 金融
高级理财顾问, 6, 1, 市场与销售, 销售, 安信卓越投资管理（北京）有限公司, 北京, 大专, 500, 成熟型, 电子商务 · 金融
高级Java工程师, 25, 3, 技术, 后端开发, 蘑菇租房, 上海, 本科, 150, 成长型, 移动互联网 · 电子商务
年薪20w聘分析师, 12, 1, 金融, 投融资, 德通汇富, 北京, 学历不限, 150, 成长型, 金融
java 开发工程师, 12, 3, 技术, 前端开发, 安信投, 北京, 大专, 50, 成长型, 金融
电话客服代表, 5, 1, 运营, 客服, 安信投, 北京, 大专, 50, 成长型, 金融
系统工程师, 5, 不, 技术, 运维, 盘古餐饮, 上海, 大专, 2000, 成熟型, 生活服务
抵押贷款专员, 5, 1, 金融, 风控, 亚馨信贷, 深圳, 大专, 50, 成长型, 金融
理财师团队, 11, 3, 市场与销售, 投资, 新湖财富, 北京, 大专, 500, 成熟型, 分类信息 · 其他
产品经理, 12, 3, 产品, 产品经理, 音卓网络, 杭州, 本科, 150, 初创型, 教育
创意平面设计师, 6, 1, 设计, 视觉设计, 牛芝家, 南京, 大专, 50, 初创型, 生活服务
首席内容官, 20, 5, 运营, 高端运营职位, 中微信用, 北京, 大专, 150, 成长型, 移动互联网 · 金融
O2O资深运营, 11, 1, 运营, 运营, 自如网, 北京, 本科, 2000, 成熟型, 移动互联网 · O2O
运维工程师, 12, 3, 技术, 运维, 卡行天下, 上海, 本科, 2000, 成熟型, 移动互联网
员工关系, 6, 1, 职能, 人力资源, 安徒生基金&middot;信麟财富, 上海, 本科, 150, 成长型, 金融
平面设计师, 6, 1, 设计, 视觉设计, 壹米滴答, 上海, 大专, 50, 成长型, 企业服务 · 其他
PHP, 20, 3, 技术, 后端开发, 资产加, 上海, 大专, 15, 初创型, 电子商务 · 金融
运营经理, 11, 3, 运营, 运营, 上海装潢网, 上海, 学历不限, 15, 初创型, O2O · 生活服务
文案助理, 6, 1, 运营, 编辑, 和智传信, 北京, 大专, 50, 初创型, 移动互联网 · 广告营销
.NET中级开发工程师, 11, 3, 技术, 后端开发, 东方银谷, 北京, 大专, 2000, 成熟型, 移动互联网 · 金融
CRM运营主管, 12, 1, 运营, 运营, PPmoney互联网金融平台, 广州, 本科, 150, 成长型, 金融
PHP开发, 9, 1, 技术, 后端开发, 蜂云网络（51订货网）, 南京, 大专, 500, 成长型, 电子商务 · O2O
.NET开发, 11, 不, 技术, 后端开发, 浙江鹰泊, 杭州, 大专, 50, 成熟型, 电子商务
人事专员（招聘）, 6, 1年以, 职能, 人力资源, 浙江鹰泊, 杭州, 大专, 50, 成熟型, 电子商务
Java, 15, 不, 技术, 后端开发, 好买基金网（联想腾讯注资企业）, 上海, 大专, 500, 成熟型, 电子商务 · 金融
PHP高级开发工程师, 17, 3, 技术, 后端开发, 上海早点到餐饮管理有限公司, 上海, 大专, 50, 成长型, O2O
理财经理, 8, 不, 市场与销售, 销售, 北京阶梯财富资产管理有限公司, 北京, 大专, 150, 初创型, 金融
前台, 3, 1, 职能, 行政, 直向投资, 上海, 大专, 150, 成熟型, 金融
高级Java工程师, 25, 5, 技术, 后端开发, 冠群驰骋, 北京, 本科, 2000, 成熟型, 移动互联网 · 金融
市场推广, 4, 1, 市场与销售, 市场/营销, 文韬, 北京, 大专, 15, 初创型, 移动互联网 · 文化娱乐
总裁室秘书（文案）, 6, 不, 职能, 行政, VHS 好人生, 上海, 本科, 50, 成熟型, 医疗健康
客户经理, 8, 不, 市场与销售, 销售, 人脉通, 北京, 大专, 50, 成长型, 移动互联网
高级Java工程师-前台, 21, 5, 技术, 高端技术职位, 恒昌利通, 北京, 大专, 2000, 成熟型, 金融
营销策划, 6, 不限, , 市场营销, 中创资本, 北京, 本科, 15, 初创型, 企业服务 · 金融
C#开发工程师, 9, 1, 技术, 后端开发, 艾文凯迪, 中山, 大专, 50, 成长型, O2O · 数据服务
咨询部-移民顾问, 7, 3, 市场与销售, 销售, 北京华岳移民, 北京, 大专, 50, 成长型, 企业服务
品牌平面设计师, 6, 1, 设计, 视觉设计, 牛芝家, 南京, 大专, 50, 初创型, 生活服务
私人银行中心理财经理, 15, 5, 金融, 投融资, 小牛, 北京, 大专, 2000, 成长型, 金融
高级客户主任, 4, 应届毕业, 市场与销售, 销售, 普惠金融, 北京, 大专, 2000, 初创型, 金融
政策研究主管, 6, 3, 职能, 高端职能职位, 杭州帮实投资管理有限公司, 杭州, 本科, 15, 成长型, 金融
前台, 5, 不, 职能, 行政, 自如网, 北京, 本科, 2000, 成熟型, 移动互联网 · O2O
web前端工程师(angularjs、bootstrap优先考虑), 25, 3, 技术, 前端开发, 中微信用, 北京, 学历不限, 150, 成长型, 移动互联网 · 金融
商务拓展主管, 9, 不, 市场与销售, 市场/营销, PPmoney互联网金融平台, 广州, 大专, 150, 成长型, 金融
域名投资顾问（域名经纪，女）, 4, 不, 市场与销售, 投资, 111域名，专注数字资产服务, 武汉, 大专, 15, 初创型, 移动互联网 · 数据服务
产品经理, 18, 5, 产品, 产品经理, 华赢贷, 杭州, 本科, 50, 初创型, 金融
理财顾问, 3, 不, 金融, 投融资, 信和财富, 广州, 大专, 2000, 成熟型, 金融
在线客服, 5, 1, 运营, 客服, 亿家网, 北京, 大专, 50, 成长型, 移动互联网 · 电子商务
资产管理专员, 5, 不, 市场与销售, 销售, 亿家网, 北京, 大专, 50, 成长型, 移动互联网 · 电子商务
综合管理部助理, 5, 1, 职能, 行政, 深圳恒业元朔, 深圳, 本科, 15, 初创型, 金融
咨询主管, 11, 3, 运营, 客服, 蓝海创投, 深圳, 大专, 15, 初创型, 金融 · 医疗健康
创业公司型 市场总监, 25, 3, 市场与销售, 高端市场职位, 财鱼管家, 北京, 本科, 15, 成长型, 移动互联网 · 金融
Android高级开发工程师, 15, 1, 技术, 移动开发, 米庄理财, 杭州, 大专, 50, 成长型, 金融
支付结算总监, 22, 5, 金融, 审计税务, 米庄理财, 杭州, 本科, 50, 成长型, 金融
产品经理（股权基金类产品）, 12, 不, 产品, 产品经理, 海子资产, 北京, 本科, 15, 初创型, 移动互联网 · 金融
董秘, 22, 1, 金融, 投融资, 艾亿新融, 北京, 本科, 50, 成长型, 金融
深圳 高级JAVA工程师/hadoop方向, 15, 不, 技术, 后端开发, 劲马奥通, 深圳, 学历不限, 15, 成长型, 移动互联网 · 电子商务
运营高级经理, 13, 3, 运营, 运营, 上海早点到餐饮管理有限公司, 上海, 学历不限, 50, 成长型, O2O
外电编辑, 4, 不, 运营, 编辑, 北京天使汇, 北京, 学历不限, 50, 成长型, 金融
Java开发工程师, 8, 1, 技术, 后端开发, 蜂云网络（51订货网）, 南京, 大专, 500, 成长型, 电子商务 · O2O
股权众筹平台总监, 60, 5, 金融, 投融资, 星河互联集团, 北京, 本科, 500, 成熟型, 移动互联网
web前端, 7, 1, 技术, 前端开发, 优邦投资, 武汉, 大专, 15, 初创型, 教育
