PHP工程师10, 10, 1, 技术, 后端开发, 呓茗资产, 上海, 大专, 15, 初创型, 移动互联网 · 金融
PHP工程师12, 10, 1, 技术, 后端开发, 呓茗资产, 上海, 大专, 15, 初创型, 移动互联网 · 金融
PHP工程师13, 10, 1, 技术, 后端开发, 呓茗资产, 上海, 大专, 15, 初创型, 移动互联网 · 金融
PHP工程师14, 10, 1, 技术, 后端开发, 呓茗资产, 上海, 大专, 15, 初创型, 移动互联网 · 金融
php12, 10, 1, 技术, 后端开发, 呓茗资产, 上海, 大专, 15, 初创型, 移动互联网 · 金融
php13, 10, 1, 技术, 后端开发, 呓茗资产, 上海, 大专, 15, 初创型, 移动互联网 · 金融
php15, 13, 1, 技术, 后端开发, 呓茗资产, 上海, 大专, 15, 初创型, 移动互联网 · 金融
php14, 10, 1, 技术, 后端开发, 呓茗资产, 上海, 大专, 15, 初创型, 移动互联网 · 金融
PHP工程师（前端）, 12, 1, 技术, 前端开发, 呓茗资产, 上海, 学历不限, 15, 初创型, 移动互联网 · 金融
PHP开发工程师（前端）, 12, 1, 技术, 前端开发, 呓茗资产, 上海, 学历不限, 15, 初创型, 移动互联网 · 金融
PHP软件开发, 10, 1, 技术, 后端开发, 呓茗资产, 上海, 大专, 15, 初创型, 移动互联网 · 金融
PHP软件开发, 10, 1, 技术, 前端开发, 呓茗资产, 上海, 大专, 15, 初创型, 移动互联网 · 金融
PHP工程师5, 10, 1, 技术, 前端开发, 呓茗资产, 上海, 大专, 15, 初创型, 移动互联网 · 金融
PHP工程师6, 11, 1, 技术, 后端开发, 呓茗资产, 上海, 大专, 15, 初创型, 移动互联网 · 金融
php工程师, 11, 1, 技术, 后端开发, 呓茗资产, 上海, 大专, 15, 初创型, 移动互联网 · 金融
web前端10, 10, 1, 技术, 前端开发, 呓茗资产, 上海, 学历不限, 15, 初创型, 移动互联网 · 金融
PHP工程师2, 10, 1, 技术, 后端开发, 呓茗资产, 上海, 大专, 15, 初创型, 移动互联网 · 金融
web前端1, 10, 1, 技术, 前端开发, 呓茗资产, 上海, 大专, 15, 初创型, 移动互联网 · 金融
web前端2, 10, 1, 技术, 前端开发, 呓茗资产, 上海, 学历不限, 15, 初创型, 移动互联网 · 金融
web前端3, 10, 1, 技术, 前端开发, 呓茗资产, 上海, 学历不限, 15, 初创型, 移动互联网 · 金融
PHP工程师3, 10, 1, 技术, 后端开发, 呓茗资产, 上海, 大专, 15, 初创型, 移动互联网 · 金融
PHP1, 10, 1, 技术, 后端开发, 呓茗资产, 上海, 大专, 15, 初创型, 移动互联网 · 金融
PHP2, 10, 3, 技术, 后端开发, 呓茗资产, 上海, 大专, 15, 初创型, 移动互联网 · 金融
PHP3, 10, 1, 技术, 后端开发, 呓茗资产, 上海, 大专, 15, 初创型, 移动互联网 · 金融
PHP5, 10, 1, 技术, 后端开发, 呓茗资产, 上海, 本科, 15, 初创型, 移动互联网 · 金融
客服专员, 4, 1, 市场与销售, 销售, 呓茗资产, 上海, 大专, 15, 初创型, 移动互联网 · 金融
java高级研发工程师, 17, 5, 技术, 后端开发, 资产百分百, 北京, 本科, 50, 初创型, O2O · 金融
Java开发工程师, 25, 3, 技术, 后端开发, 恒实汇通财富投资管理有限公司, 北京, 大专, 15, 初创型, 金融
金融投资销售 [无责底薪10000], 12, 1, 市场与销售, 销售, 北京博炎管理咨询有限公司, 北京, 大专, 50, 成长型, 移动互联网 · 电子商务
金融渠道销售, 15, 1, 市场与销售, 销售, 诺远资产, 上海, 大专, 500, 初创型, 金融
销售经理, 30, 3, 市场与销售, 销售, 诺远资产, 上海, 大专, 500, 初创型, 金融
行政助理/前台, 4, 不, 职能, 行政, 一禾资产, 北京, 大专, 150, 成长型, 其他
PHP 22, 10, 1, 技术, 后端开发, 呓茗资产, 上海, 大专, 15, 初创型, 移动互联网 · 金融
互联网金融平台客服, 3, 1, 运营, 客服, 前海永沃, 深圳, 大专, 50, 初创型, 金融
Android开发工程师(月薪15k-25K), 20, 3, 技术, 移动开发, 五项管理效率集团, 上海, 本科, 150, 成熟型, 教育
理财经理, 9, 1, 市场与销售, 销售, 财富恒瑞集团, 广州, 大专, 150, 初创型, 金融
前台, 4, 1, 职能, 行政, 红岭资本管理（北京）有限公司, 北京, 大专, 50, 成长型, 移动互联网 · 金融
培训主管, 11, 5, 职能, 人力资源, 值乾资产, 上海, 大专, 150, 初创型, 金融
财务部副总经理/助理（急聘）, 15, 5, 职能, 财务, 亚租所, 深圳, 硕士, 50, 上市公, 移动互联网 · 金融
技术部实习生, 2, 不, 技术, 后端开发, 个金所, 杭州, 本科, 15, 初创型, 金融
测试经理, 20, 5, 技术, 测试, 橙天嘉禾影城, 北京, 本科, 500, 上市公, 生活服务 · 文化娱乐
前端开发工程师, 15, 1, 技术, 前端开发, 深圳妈妈资本, 深圳, 本科, 50, 成长型, 金融
UI设计师, 12, 1, 设计, 视觉设计, 银筑控股, 杭州, 本科, 50, 初创型, 移动互联网 · 金融
产品经理（外部平台合作）, 20, 1, 产品, 产品经理, 高毅资产, 深圳, 本科, 50, 成长型, 金融 · 其他
急招UI设计师, 6, 不, 设计, 视觉设计, 上海香善, 上海, 大专, 15, 初创型, 移动互联网 · 生活服务
运营总监（金融理财类）, 22, 3, 运营, 高端运营职位, 华赢集团, 北京, 本科, 15, 初创型, 移动互联网 · 金融
LINUXC C++, 32, 3, 技术, 后端开发, 金利恒, 北京, 本科, 500, 初创型, 其他
运营专员, 5, 1, 运营, 运营, 爱特加速器, 厦门, 本科, 50, 成长型, 移动互联网 · O2O
产品总监, 22, 5, 产品, 高端产品职位, 青苔债管家, 北京, 本科, 15, 成长型, 移动互联网 · 金融
web前端开发, 22, 3, 技术, 前端开发, 财富自由投资管理有限公司, 北京, 本科, 500, 初创型, 电子商务 · 金融
2016年“绿地志方”校园招聘, 5, 不, 市场与销售, 销售, 绿地志方, 上海, 本科, 150, 初创型, 其他
理财顾问, 6, 不, 市场与销售, 销售, 鼎盛财富投资管理有限公司公司, 烟台, 大专, 2000, 初创型, 金融
PHP 28, 10, 1, 技术, 后端开发, 呓茗资产, 上海, 大专, 15, 初创型, 移动互联网 · 金融
招商副总监, 7, 不, 市场与销售, 高端市场职位, 通融财富, 东莞, 学历不限, 15, 初创型, 金融
市场发展部专员, 10, 不, 市场与销售, 市场/营销, GEO, 广州, 大专, 500, 上市公, 金融
售后客服, 3, 不, 运营, 客服, 安徽福运和资产管理有限公司, 合肥, 大专, 50, 成长型, 电子商务 · 金融
网页产品设计师, 5, 1, 产品, 产品设计师, 安徽福运和资产管理有限公司, 合肥, 大专, 50, 成长型, 电子商务 · 金融
带店督导, 4, 不, 运营, 运营, 上海典梵品牌管理有限公司, 上海, 大专, 50, 初创型, 其他
投资顾问 5K+奖金+提成+旅游, 7, 不, 金融, 投融资, 德鑫资产, 深圳, 大专, 150, 成长型, 电子商务 · 金融
投资顾问, 7, 不, 市场与销售, 市场/营销, 上海财横, 上海, 学历不限, 50, 成长型, 移动互联网 · 金融
运营专员, 12, 不, 运营, 运营, 华赢贷, 杭州, 学历不限, 50, 初创型, 金融
市场企划主管, 12, 5, 市场与销售, 公关, 蓝海创投, 深圳, 大专, 15, 初创型, 金融 · 医疗健康
品牌经理, 12, 3, 市场与销售, 公关, 天天投, 北京, 本科, 15, 成长型, 移动互联网 · 金融
新媒体运营, 9, 1, 运营, 运营, 财鱼管家, 北京, 大专, 15, 成长型, 移动互联网 · 金融
新媒体运营, 10, 1, 运营, 运营, 天天投, 北京, 本科, 15, 成长型, 移动互联网 · 金融
分析师, 10, 1, 金融, 投融资, 天天投, 北京, 本科, 15, 成长型, 移动互联网 · 金融
产品经理助理/储备产品经理, 3, 应届毕业, 产品, 产品经理, 优邦投资, 武汉, 大专, 15, 初创型, 教育
Java, 22, 3, 技术, 后端开发, 天天投, 北京, 本科, 15, 成长型, 移动互联网 · 金融
APP渠道专员, 8, 1, 市场与销售, 市场/营销, 财鱼管家, 北京, 大专, 15, 成长型, 移动互联网 · 金融
投资经理, 10, 不, 金融, 投融资, 天天投, 北京, 本科, 15, 成长型, 移动互联网 · 金融
人事/HR, 6, 3, 职能, 人力资源, 小马青青财富管理, 北京, 本科, 15, 初创型, 移动互联网
新媒体（内容运营）, 10, 1, 运营, 运营, 天天投, 北京, 大专, 15, 成长型, 移动互联网 · 金融
Android, 7, 1, 技术, 移动开发, 优邦投资, 武汉, 本科, 15, 初创型, 教育
数据运营（实习）, 4, 应届毕业, 运营, 编辑, 天天投, 北京, 本科, 15, 成长型, 移动互联网 · 金融
UI设计师, 21, 3, 设计, 视觉设计, 小马青青财富管理, 北京, 本科, 15, 初创型, 移动互联网
iOS, 7, 1, 技术, 移动开发, 优邦投资, 武汉, 本科, 15, 初创型, 教育
H5前端工程师, 6, 1, 技术, 移动开发, 南京布维金广投资管理有限公司, 南京, 大专, 15, 初创型, 金融 · 旅游
高级系统分析师, 20, 3, 技术, 高端技术职位, 感知科技动产管理, 北京, 本科, 150, 成长型, 移动互联网
资深Java开发工程师/架构师, 20, 5, 技术, 后端开发, 感知科技动产管理, 北京, 本科, 150, 成长型, 移动互联网
销售顾问, 5, 不, 市场与销售, 销售, 富尔天华, 北京, 大专, 2000, 成熟型, 移动互联网 · 金融
PHP, 9, 1, 技术, 后端开发, 东方富通投资管理有限公司, 北京, 大专, 150, 成长型, 金融
资深Java工程师, 22, 3, 技术, 后端开发, 蘑菇租房, 上海, 大专, 150, 成长型, 移动互联网 · 电子商务
售前咨询, 4, 1, 运营, 客服, 帕拉丁资产管理公司, 佛山, 大专, 2000, 上市公, 金融
餐厅经理（浦东）, 5, 1, 运营, 运营, 上海棒约翰餐饮管理有限公司, 上海, 大专, 500, 成熟型, 生活服务
广告媒体策划, 7, 1, 市场与销售, 市场/营销, DeeStar树鱼品牌管理, 上海, 本科, 15, 初创型, 电子商务 · 广告营销
投融顾问, 6, 不, 金融, 投融资, 镭驰金控, 北京, 大专, 500, 成熟型, 金融
企划、企宣, 7, 3, 市场与销售, 市场/营销, 北京广泰资产, 北京, 大专, 50, 成长型, 移动互联网
电话销售主管, 10, 5, 市场与销售, 销售, 泉昕资产, 上海, 本科, 50, 初创型, 金融
Python平台开发主管（01LSHW2015100098）, 24, 3, 技术, 后端开发, 国联资产, 北京, 学历不限, 150, 成长型, 金融
视频后期制作（实习生）, 3, 应届毕业, 设计, 视觉设计, 通融财富, 东莞, 学历不限, 15, 初创型, 金融
安全工程师/渗透测试工程师, 30, 3, 技术, 运维, 国联资产, 北京, 学历不限, 150, 成长型, 金融
客服主管, 4, 不, 运营, 客服, 安徽福运和资产管理有限公司, 合肥, 大专, 50, 成长型, 电子商务 · 金融
商务专员, 6, 1, 运营, 运营, 中投融, 上海, 大专, 500, 成熟型, 金融
产品经理, 19, 3, 产品, 产品经理, 仁多, 上海, 本科, 500, 初创型, 金融 · 文化娱乐
客服专员, 4, 不, 运营, 客服, 博赢财富, 深圳, 大专, 50, 初创型, 金融
网站编辑, 6, 1, 运营, 编辑, 神灯财富, 武汉, 大专, 500, 成熟型, 移动互联网 · 金融
销售总监, 30, 5, 市场与销售, 销售, 深圳前海新富资本管理集团, 深圳, 本科, 150, 成长型, 移动互联网
高薪急聘新媒体运营, 5, 1年以, 运营, 运营, 多利宝, 北京, 大专, 15, 初创型, 移动互联网 · 金融
测试经理, 21, 5, 技术, 测试, 上海远行, 上海, 本科, 150, 成长型, 移动互联网 · 企业服务
营销经理, 15, 3, 市场与销售, 市场/营销, 华赢集团, 北京, 本科, 15, 初创型, 移动互联网 · 金融
高级UI设计师, 20, 3, 设计, 视觉设计, 直投网, 北京, 本科, 500, 成熟型, 金融
微信运营, 9, 1, 运营, 运营, 正安文化, 深圳, 本科, 150, 成长型, 移动互联网 · 文化娱乐
投资并购CEO, 40, 不, 运营, 高端运营职位, 星河互联集团, 北京, 学历不限, 500, 成熟型, 移动互联网
市场BD经理（专门BD部）, 15, 3, 市场与销售, 销售, 银谷, 北京, 大专, 2000, 初创型, 移动互联网 · 金融
web前端27, 10, 1, 技术, 前端开发, 呓茗资产, 上海, 大专, 15, 初创型, 移动互联网 · 金融
web前端28, 10, 1, 技术, 前端开发, 呓茗资产, 上海, 学历不限, 15, 初创型, 移动互联网 · 金融
web前端22, 10, 1, 技术, 前端开发, 呓茗资产, 上海, 学历不限, 15, 初创型, 移动互联网 · 金融
web前端23, 10, 1, 技术, 前端开发, 呓茗资产, 上海, 学历不限, 15, 初创型, 移动互联网 · 金融
web前端24, 10, 1, 技术, 前端开发, 呓茗资产, 上海, 学历不限, 15, 初创型, 移动互联网 · 金融
web前端25, 10, 1, 技术, 前端开发, 呓茗资产, 上海, 大专, 15, 初创型, 移动互联网 · 金融
web前端26, 10, 1, 技术, 前端开发, 呓茗资产, 上海, 大专, 15, 初创型, 移动互联网 · 金融
web前端14, 10, 1, 技术, 前端开发, 呓茗资产, 上海, 大专, 15, 初创型, 移动互联网 · 金融
web前端15, 10, 1, 技术, 前端开发, 呓茗资产, 上海, 学历不限, 15, 初创型, 移动互联网 · 金融
web前端16, 10, 1, 技术, 前端开发, 呓茗资产, 上海, 学历不限, 15, 初创型, 移动互联网 · 金融
web前端7, 10, 1, 技术, 前端开发, 呓茗资产, 上海, 学历不限, 15, 初创型, 移动互联网 · 金融
web前端8, 10, 1, 技术, 前端开发, 呓茗资产, 上海, 学历不限, 15, 初创型, 移动互联网 · 金融
web前端9, 10, 1, 技术, 前端开发, 呓茗资产, 上海, 学历不限, 15, 初创型, 移动互联网 · 金融
web前端6, 10, 1, 技术, 前端开发, 呓茗资产, 上海, 学历不限, 15, 初创型, 移动互联网 · 金融
web前端5, 10, 1, 技术, 前端开发, 呓茗资产, 上海, 学历不限, 15, 初创型, 移动互联网 · 金融
PHP（前端）, 12, 1, 技术, 前端开发, 呓茗资产, 上海, 学历不限, 15, 初创型, 移动互联网 · 金融
php开发2, 12, 1, 技术, 后端开发, 呓茗资产, 上海, 学历不限, 15, 初创型, 移动互联网 · 金融
php开发3, 12, 不, 技术, 后端开发, 呓茗资产, 上海, 学历不限, 15, 初创型, 移动互联网 · 金融
PHP工程师9, 10, 1, 技术, 后端开发, 呓茗资产, 上海, 本科, 15, 初创型, 移动互联网 · 金融
PHP工程师10, 10, 1, 技术, 后端开发, 呓茗资产, 上海, 本科, 15, 初创型, 移动互联网 · 金融
PHP4, 10, 3, 技术, 前端开发, 呓茗资产, 上海, 大专, 15, 初创型, 移动互联网 · 金融
PHP工程师1, 10, 1, 技术, 前端开发, 呓茗资产, 上海, 大专, 15, 初创型, 移动互联网 · 金融
需求分析师, 7, 不, 设计, 用户研究, 广东同天投资管理有限公司, 佛山, 学历不限, 50, 成长型, 企业服务
电话销售, 5, 不, 市场与销售, 销售, 安信卓越投资管理（北京）有限公司, 北京, 学历不限, 500, 成熟型, 电子商务 · 金融
投资顾问, 5, 不, 市场与销售, 销售, 武汉千诺信合资产管理有限公司, 武汉, 学历不限, 150, 初创型, 金融
web前端, 7, 1, 技术, 前端开发, 上海菜猫健康管理, 上海, 大专, 15, 初创型, 生活服务 · 文化娱乐
理财顾问, 6, 1, 金融, 投融资, 华领, 上海, 大专, 50, 成长型, 金融
HTML5, 10, 3, 技术, 移动开发, 优品财富管理有限公司, 武汉, 大专, 500, 初创型, 金融
研发工程师, 20, 1, 技术, 后端开发, 复华资产, 北京, 本科, 500, 成熟型, 金融
金融电话销售（6大类产品）, 15, 不, 市场与销售, 销售, 诺远资产, 上海, 大专, 500, 初创型, 金融
市场营销, 7, 1, 市场与销售, 供应链, 上海明六供应链管理有限公司, 上海, 学历不限, 50, 初创型, 其他
团队总监, 12, 1, 市场与销售, 销售, 财神宝, 北京, 大专, 50, 初创型, 金融
活动策划(AE), 7, 1, 运营, 运营, 智者品牌管理, 深圳, 本科, 150, 初创型, 电子商务 · 广告营销
融资总监, 15, 不, 金融, 高端金融职位, 北京领航财富基金管理有限公司, 北京, 学历不限, 15, 初创型, 金融
网络推广, 4, 不, 运营, 运营, 中投融, 上海, 大专, 500, 成熟型, 金融
销售助理, 7, 不, 金融, 投融资, 北京领航财富基金管理有限公司, 北京, 学历不限, 15, 初创型, 金融
UI设计师, 11, 1, 设计, 视觉设计, 找个办, 上海, 本科, 15, 初创型, O2O · 企业服务
中高级JAVA 开发工程师, 14, 3, 技术, 后端开发, 中国健康云, 北京, 大专, 50, 成长型, 电子商务 · 医疗健康
系统安全, 21, 3, 技术, 运维, 冠群驰骋, 北京, 本科, 2000, 成熟型, 移动互联网 · 金融
培训经理, 15, 1, 职能, 人力资源, 中海微银, 北京, 大专, 2000, 成熟型, 金融
SEM, 8, 3, 市场与销售, 市场/营销, E票宝, 广州, 本科, 15, 初创型, 金融
用户运营, 22, 1, 运营, 运营, 糖果金融, 北京, 本科, 150, 初创型, 金融
数据分析工程师, 11, 3, 设计, 用户研究, PPmoney互联网金融平台, 广州, 本科, 150, 成长型, 金融
活动运营经理, 15, 3, 运营, 运营, 九斗鱼, 北京, 大专, 150, 初创型, 金融
电话销售, 7, 不, 市场与销售, 销售, 葆德管理顾问公司, 北京, 大专, 50, 初创型, 医疗健康
网络营销, 8, 1, 市场与销售, 市场/营销, 财富自由投资管理有限公司, 北京, 大专, 500, 初创型, 电子商务 · 金融
服务器开发经理, 22, 3, 技术, 后端开发, 家有好车, 上海, 本科, 50, 成长型, O2O
平面设计师, 5, 不, 设计, 视觉设计, 秀呔投资管理有限公司, 杭州, 本科, 15, 初创型, 文化娱乐
项目经理, 19, 3, 技术, 项目管理, 国联资产, 北京, 大专, 150, 成长型, 金融
.NET, 10, 1, 技术, 后端开发, 东方银谷, 北京, 大专, 2000, 成熟型, 移动互联网 · 金融
集团品牌策划总监, 22, 5, 市场与销售, 公关, 深圳前海新富资本管理集团, 深圳, 本科, 150, 成长型, 移动互联网
招聘, 5, 1, 职能, 人力资源, 安信投, 北京, 大专, 50, 成长型, 金融
招聘, 5, 1, 职能, 人力资源, 安信投, 北京, 本科, 50, 成长型, 金融
Java, 15, 3, 技术, 后端开发, 信和财富-科技公司, 北京, 本科, 2000, 成熟型, 金融
产品经理, 15, 3, 产品, 产品经理, 优品财富管理有限公司, 武汉, 本科, 500, 初创型, 金融
产品运营专员, 7, 1, 运营, 运营, 金融工场, 北京, 大专, 150, 上市公, 金融
招聘, 5, 1, 职能, 人力资源, 蛋壳公寓, 北京, 本科, 50, 成长型, O2O
SEM, 7, 1, 市场与销售, 市场/营销, 蛋壳公寓, 北京, 本科, 50, 成长型, O2O
用户运营, 7, 1, 运营, 运营, 蛋壳公寓, 北京, 本科, 50, 成长型, O2O
高级iOS开发工程师, 20, 5, 技术, 移动开发, 感知科技动产管理, 北京, 本科, 150, 成长型, 移动互联网
业务经理, 10, 不, 金融, 投融资, 大大集团, 上海, 学历不限, 2000, 成熟型, 金融
产品经理, 22, 3, 产品, 产品经理, 绿地志方, 上海, 大专, 150, 初创型, 其他
媒介专员, 5, 1年以, 市场与销售, 公关, E票宝, 广州, 本科, 15, 初创型, 金融
培训专员, 5, 1, 职能, 人力资源, 值乾资产, 上海, 大专, 150, 初创型, 金融
Android开发工程师, 9, 1, 技术, 移动开发, 蜂云网络（51订货网）, 南京, 大专, 500, 成长型, 电子商务 · O2O
Java, 27, 5, 技术, 后端开发, 寰德咨询, 上海, 本科, 15, 初创型, 移动互联网 · 电子商务
投资顾问, 7, 不, 市场与销售, 投资, 虹祥资本, 广州, 学历不限, 50, 上市公, 移动互联网 · 金融
PMO高级经理, 25, 5, 技术, 项目管理, 信和财富-科技公司, 北京, 本科, 2000, 成熟型, 金融
商务拓展, 10, 不, 市场与销售, 市场/营销, 蘑菇租房, 上海, 大专, 150, 成长型, 移动互联网 · 电子商务
行政, 4, 1, 职能, 行政, 恒昌利通, 北京, 本科, 2000, 成熟型, 金融
产品经理, 14, 1, 产品, 产品经理, 糖果金融, 北京, 大专, 150, 初创型, 金融
财务, 11, 1, 职能, 财务, 恒昌利通, 北京, 本科, 2000, 成熟型, 金融
产品经理, 12, 1, 产品, 产品经理, 易佰, 北京, 本科, 50, 成熟型, 金融
web前端13, 10, 1, 技术, 前端开发, 呓茗资产, 上海, 本科, 15, 初创型, 移动互联网 · 金融
web前端, 10, 1, 技术, 前端开发, 呓茗资产, 上海, 大专, 15, 初创型, 移动互联网 · 金融
PHP（前端开发）, 12, 1, 技术, 前端开发, 呓茗资产, 上海, 学历不限, 15, 初创型, 移动互联网 · 金融
php开发1, 12, 1, 技术, 后端开发, 呓茗资产, 上海, 学历不限, 15, 初创型, 移动互联网 · 金融
php开发5, 12, 不, 技术, 后端开发, 呓茗资产, 上海, 学历不限, 15, 初创型, 移动互联网 · 金融
php11, 10, 1, 技术, 后端开发, 呓茗资产, 上海, 大专, 15, 初创型, 移动互联网 · 金融
PHP工程师6, 10, 不, 技术, 后端开发, 呓茗资产, 上海, 学历不限, 15, 初创型, 移动互联网 · 金融
PHP工程师, 10, 1, 技术, 前端开发, 呓茗资产, 上海, 大专, 15, 初创型, 移动互联网 · 金融
业务经理, 8, 1, 市场与销售, 销售, 大大集团, 南京, 大专, 2000, 成熟型, 金融
理财顾问, 11, 不, 金融, 投融资, 大大集团市属上海南京西路分公司, 上海, 学历不限, 2000, 初创型, 金融
网络营销策划, 5, 1, 运营, 运营, 财猫网, 郑州, 大专, 50, 成长型, 金融
市场主管, 7, 3, 市场与销售, 市场/营销, 前海永沃, 深圳, 大专, 50, 初创型, 金融
网络推广专员, 5, 1, 运营, 运营, 前海永沃, 深圳, 大专, 50, 初创型, 金融
法务专员, 6, 1, 职能, 法务, 中隆财富, 上海, 本科, 500, 成熟型, 金融
新媒体营销专员, 3, 1, 运营, 运营, E票宝, 广州, 大专, 15, 初创型, 金融
冠群广安门分公司诚聘客户投资顾问, 7, 1, 市场与销售, 投资, 冠群驰骋投资管理, 北京, 大专, 2000, 上市公, 金融
中级APP测试工程师, 7, 1, 技术, 测试, 中投融, 上海, 本科, 500, 成熟型, 金融
会计, 3, 1, 职能, 财务, 维初管理, 北京, 大专, 15, 初创型, 移动互联网 · 企业服务
PHP, 15, 1, 技术, 后端开发, 险峰华兴, 北京, 大专, 15, 初创型, 移动互联网 · 电子商务
出纳, 4, 不, 职能, 财务, 险峰华兴, 北京, 大专, 15, 初创型, 移动互联网 · 电子商务
成都研发总监　　　, 30, 3, 技术, 高端技术职位, 劲马奥通, 成都, 学历不限, 15, 成长型, 移动互联网 · 电子商务
活动运营, 6, 3, 运营, 运营, 比如世界, 北京, 本科, 150, 成长型, 教育 · 文化娱乐
平面设计师, 10, 3, 设计, 视觉设计, 和智传信, 北京, 本科, 50, 初创型, 移动互联网 · 广告营销
文案策划, 15, 3, 运营, 编辑, 豆联健康管理, 北京, 学历不限, 15, 初创型, 移动互联网 · 医疗健康
融资, 75, 不, 金融, 投融资, 豆联健康管理, 北京, 学历不限, 15, 初创型, 移动互联网 · 医疗健康
UI设计师, 15, 3, 设计, 视觉设计, 瀚亚资本, 北京, 大专, 2000, 成熟型, 移动互联网 · 金融
微商渠道拓展主管, 6, 1, 运营, 运营, 深圳市三宏资本管理有限公司, 深圳, 大专, 150, 成长型, 金融
客户代表, 5, 不, 市场与销售, 销售, 武汉千诺信合资产管理有限公司, 武汉, 学历不限, 150, 初创型, 金融
销售专员, 9, 1, 市场与销售, 销售, 诺远资产, 上海, 大专, 500, 初创型, 金融
诚招行政客服（售后方向）/不加班, 4, 1年以, 运营, 客服, 恒镔资产, 杭州, 大专, 50, 初创型, 金融
销售代表, 6, 不限, , 客户代表, 北京领航财富基金管理有限公司, 北京, 学历不限, 15, 初创型, 金融
PHP, 10, 1, 技术, 后端开发, 呓茗资产, 上海, 大专, 15, 初创型, 移动互联网 · 金融
团队经理, 12, 1, 市场与销售, 销售, 诺远资产管理有限公司杭州分公司, 杭州, 大专, 2000, 初创型, 金融
党群办公室主任, 10, 1, 职能, 行政, 大大集团市属上海南京西路分公司, 上海, 大专, 2000, 初创型, 金融
车贷主管, 9, 3, 市场与销售, 销售, 中隆财富, 上海, 大专, 500, 成熟型, 金融
销售总监, 12, 3, 市场与销售, 高端市场职位, 大连国信基金, 大连, 大专, 150, 成长型, 金融
PHP工程师, 12, 1, 技术, 后端开发, 红岭资本管理（北京）有限公司, 北京, 本科, 50, 成长型, 移动互联网 · 金融
用户运营经理, 12, 3, 运营, 运营, 蘑菇租房, 上海, 本科, 150, 成长型, 移动互联网 · 电子商务
培训师, 8, 3, 市场与销售, 投资, 中投融, 上海, 大专, 500, 成熟型, 金融
白盒测试工程师, 10, 1, 技术, 测试, 中投融, 上海, 大专, 500, 成熟型, 金融
APP 运营推广, 12, 1, 市场与销售, 市场/营销, 亿家网, 北京, 大专, 50, 成长型, 移动互联网 · 电子商务
Android开发工程师, 15, 3, 技术, 移动开发, PPmoney互联网金融平台, 广州, 大专, 150, 成长型, 金融
法务经理, 20, 1, 职能, 法务, 北京天使汇, 北京, 本科, 50, 成长型, 金融
营销讲师, 7, 1, 市场与销售, 市场/营销, 睦昊金融, 上海, 大专, 50, 初创型, 金融
理财顾问, 6, 不, 金融, 投融资, 鼎盛财富投资管理有限公司公司, 烟台, 大专, 2000, 初创型, 金融
网站运营 网络运营, 6, 1, 运营, 运营, 复旦投资管理有限公司, 杭州, 大专, 150, 成长型, 移动互联网 · 医疗健康
总经理助理, 6, 1, 市场与销售, 供应链, 上海明六供应链管理有限公司, 上海, 大专, 50, 初创型, 其他
Java高级工程师, 19, 1, 技术, 后端开发, 红岭资本管理（北京）有限公司, 北京, 本科, 50, 成长型, 移动互联网 · 金融
