督导, 3, 不, 市场与销售, 销售, 中投融, 上海, 学历不限, 500, 成熟型, 金融
运维工程师, 10, 1, 技术, 移动开发, 庸恳资产, 上海, 大专, 15, 初创型, 金融
众创空间管理部工作人员, 6, 1, 运营, 运营, 贵州铜仁高新区管理委员会, 贵阳, 本科, 500, 成熟型, 招聘
大团队经理高薪福利好, 8, 不, 金融, 投融资, 首山财富, 南京, 大专, 500, 成熟型, 金融
总裁办秘书, 6, 1, 职能, 行政, 鑫茂荣信, 北京, 本科, 500, 成熟型, 移动互联网 · 金融
客户经理, 7, 1, 市场与销售, 公关, 华瑞成业管理顾问有限公司, 北京, 大专, 150, 上市公, 广告营销
社区运营, 10, 1, 运营, 运营, 投壶网, 深圳, 本科, 15, 成长型, 金融
资深课程销售顾问, 12, 1, 市场与销售, 销售, AIA英国国际会计师公会代表处/美都教育, 上海, 大专, 150, 初创型, 教育
客户关系经理（无责任底薪+高提成）, 8, 1, 市场与销售, 销售, 亚租所, 深圳, 学历不限, 50, 上市公, 移动互联网 · 金融
P2P投资经理（黄浦办公）, 16, 1, 金融, 投融资, 上海粤通, 上海, 大专, 50, 成长型, 金融
新媒体总监, 8, 不, 运营, 高端运营职位, 多利宝, 北京, 本科, 15, 初创型, 移动互联网 · 金融
Java后台开发工程师, 18, 1, 技术, 后端开发, 华赢集团, 北京, 本科, 15, 初创型, 移动互联网 · 金融
web前端, 22, 1, 技术, 前端开发, 酬信, 北京, 大专, 150, 成长型, 金融
品牌宣传, 6, 1, 市场与销售, 市场/营销, 中投全球, 北京, 大专, 500, 成熟型, 金融
产品经理, 15, 1, 产品, 产品经理, 上海远行, 上海, 本科, 150, 成长型, 移动互联网 · 企业服务
测试工程师, 13, 3, 技术, 测试, 卡行天下, 上海, 大专, 2000, 成熟型, 移动互联网
高级Java工程师, 11, 3, 技术, 后端开发, 111域名，专注数字资产服务, 武汉, 本科, 15, 初创型, 移动互联网 · 数据服务
平面设计师, 5, 1, 设计, 视觉设计, 漫咖啡, 南京, 本科, 150, 成长型, 生活服务
系统架构工程师, 25, 5, 技术, 高端技术职位, 华赢集团, 北京, 硕士, 15, 初创型, 移动互联网 · 金融
平面设计, 4, 1, 设计, 视觉设计, 武汉达此网络科技有限公司, 武汉, 大专, 150, 成长型, 移动互联网 · O2O
产品经理, 20, 3, 产品, 产品经理, 德维投资, 北京, 本科, 15, 初创型, 移动互联网
市场营销总监, 20, 5, 市场与销售, 市场/营销, 君石控股, 北京, 大专, 150, 成长型, 金融
活动策划, 8, 1, 市场与销售, 市场/营销, 比如世界, 北京, 大专, 150, 成长型, 教育 · 文化娱乐
推广经理, 12, 1, 市场与销售, 市场/营销, 亿家网, 北京, 本科, 50, 成长型, 移动互联网 · 电子商务
品牌活动经理, 12, 3, 市场与销售, 公关, 汇中财富, 北京, 学历不限, 2000, 成熟型, 金融
企划总监, 22, 10年以, 市场与销售, 公关, 蓝海创投, 深圳, 本科, 15, 初创型, 金融 · 医疗健康
交互设计师, 22, 1, 设计, 交互设计, 米庄理财, 杭州, 大专, 50, 成长型, 金融
客服主管, 12, 3, 运营, 客服, 北京天使汇, 北京, 本科, 50, 成长型, 金融
投资并购CEO, 75, 5, 金融, 高端金融职位, 星河互联集团, 北京, 本科, 500, 成熟型, 移动互联网
市场推广, 11, 3, 市场与销售, 市场/营销, 中关村领创金融, 北京, 本科, 50, 成长型, 金融
人力资源副总监, 20, 3, 职能, 人力资源, 易煤网, 上海, 本科, 150, 上市公, 电子商务
电话销售, 4, 1年以, 市场与销售, 销售, 当天财富, 广州, 学历不限, 2000, 成熟型, 金融
渠道经理, 4, 1, 市场与销售, 销售, E票宝, 广州, 本科, 15, 初创型, 金融
产品经理, 16, 3, 产品, 产品经理, 上海早点到餐饮管理有限公司, 上海, 本科, 50, 成长型, O2O
市场策划, 4, 1, 市场与销售, 市场/营销, 湖北盈达信通资产管理有限公司, 武汉, 大专, 50, 初创型, 金融
绩效考核经理, 9, 3, 职能, 人力资源, 直投网, 北京, 本科, 500, 成熟型, 金融
PHP工程师（不低于业内薪资+期权）, 15, 1, 技术, 后端开发, 险峰华兴, 北京, 大专, 15, 初创型, 移动互联网 · 电子商务
交互设计师, 15, 3, 设计, 交互设计, 招财猫, 深圳, 大专, 50, 成长型, 金融
量化分析师, 9, 不, 金融, 投融资, 金溢宝资本, 张家港, 本科, 15, 初创型, 金融 · 数据服务
产品运营（联合创始人）, 11, 3, 运营, 运营, 长风泉水餐饮, 北京, 本科, 150, 成长型, O2O · 移动互联网
微贝-运营推广, 5, 不, 运营, 运营, 启创资本, 宁波, 大专, 15, 初创型, 移动互联网 · 企业服务
研发专员(营养学), 6, 不, 技术, 项目管理, VHS 好人生, 上海, 学历不限, 50, 成熟型, 医疗健康
项目经理, 8, 1, 技术, 项目管理, PPmoney互联网金融平台, 广州, 本科, 150, 成长型, 金融
网络推广经理, 17, 3, 市场与销售, 市场/营销, 热钱网, 北京, 学历不限, 15, 初创型, 移动互联网 · 金融
原画师, 6, 1, 设计, 视觉设计, 艾文凯迪, 中山, 大专, 50, 成长型, O2O · 数据服务
新媒体及财经网站运营, 6, 不, 运营, 运营, 神灯财富, 武汉, 本科, 500, 成熟型, 移动互联网 · 金融
数据挖掘, 15, 3, 技术, 后端开发, 中融民信, 北京, 本科, 2000, 成熟型, 移动互联网 · 金融
互联网运营, 12, 3, 运营, 运营, 深圳妈妈资本, 深圳, 本科, 50, 成长型, 金融
产品运营经理, 9, 3, 运营, 运营, 优品财富管理有限公司, 武汉, 本科, 500, 初创型, 金融
html5, 11, 1, 技术, 前端开发, 千合医疗, 北京, 本科, 15, 初创型, 医疗健康
总经理助理/秘书, 12, 1, 职能, 行政, 航天丝路, 北京, 本科, 50, 成长型, 电子商务 · 金融
销售代表, 9, 应届毕业, 市场与销售, 销售, 自如网, 北京, 本科, 2000, 成熟型, 移动互联网 · O2O
Android, 9, 3, 技术, 移动开发, 开宜投资, 长沙, 本科, 50, 成长型, 移动互联网 · 电子商务
培训讲师, 10, 1, 职能, 人力资源, 中投全球, 北京, 本科, 500, 成熟型, 金融
市场推广, 15, 3, 市场与销售, 市场/营销, 青苔债管家, 北京, 本科, 15, 成长型, 移动互联网 · 金融
高级web前端工程师, 30, 3, 技术, 前端开发, 酬信, 北京, 大专, 150, 成长型, 金融
电话客服, 6, 不, 运营, 客服, 亿荣财富, 南京, 大专, 150, 初创型, 金融
金融管培生（宝山）, 6, 不, 金融, 投融资, 值乾资产, 上海, 大专, 150, 初创型, 金融
大数据产业发展部副经理, 4, 3, 产品, 产品经理, 贵州铜仁高新区管理委员会, 贵阳, 本科, 500, 成熟型, 招聘
理财顾问, 7, 1, 金融, 投融资, 上海财横, 上海, 大专, 50, 成长型, 移动互联网 · 金融
运营经理, 9, 3, 运营, 运营, 投壶网, 深圳, 本科, 15, 成长型, 金融
销售专员, 6, 1, 市场与销售, 销售, 股中融资产管理, 北京, 学历不限, 50, 成长型, 金融
金融产品专员, 5, 1, 产品, 产品经理, 蜂云网络（51订货网）, 南京, 大专, 500, 成长型, 电子商务 · O2O
销售专员, 3, 1, 市场与销售, 销售, 个金所, 杭州, 大专, 15, 初创型, 金融
网页设计师, 8, 3, 设计, 视觉设计, 好车贷；长天资产, 合肥, 大专, 150, 成长型, 金融
文案策划, 5, 1, 运营, 编辑, 金诚资产, 广州, 学历不限, 50, 成长型, 金融
文案策划, 5, 1, 运营, 编辑, 金诚资产, 广州, 大专, 50, 成长型, 金融
研发专员(运动医学), 6, 不, 技术, 项目管理, VHS 好人生, 上海, 学历不限, 50, 成熟型, 医疗健康
Nodejs工程师, 9, 1, 技术, 后端开发, E票宝, 广州, 本科, 15, 初创型, 金融
风控经理（法务方向）, 22, 3, 金融, 风控, 华夏家润资产管理, 北京, 本科, 15, 初创型, 移动互联网 · 金融
风控经理, 11, 5, 金融, 风控, 深圳妈妈资本, 深圳, 本科, 50, 成长型, 金融
6k五险双休聘培训助理, 6, 不, 金融, 投融资, 德通汇富, 北京, 大专, 150, 成长型, 金融
CMO首席营销官—营销合伙人, 40, 3, 运营, 运营, 亿家网, 北京, 本科, 50, 成长型, 移动互联网 · 电子商务
APP设计师, 6, 1, 设计, 视觉设计, 安企金融, 合肥, 大专, 15, 初创型, 金融
市场推广, 13, 5, 市场与销售, 市场/营销, 中关村领创金融, 北京, 本科, 50, 成长型, 金融
销售代表, 8, 不, 市场与销售, 销售, 上海众敏供应链管理有限公司, 上海, 大专, 150, 初创型, 电子商务
综合部行政专员, 6, 1, 职能, 行政, 贵州铜仁高新区管理委员会, 贵阳, 本科, 500, 成熟型, 招聘
底薪3千理财顾问双休, 4, 1, 金融, 投融资, 首山财富, 南京, 大专, 500, 成熟型, 金融
企划, 6, 1, 市场与销售, 市场/营销, 鑫茂荣信, 北京, 大专, 500, 成熟型, 移动互联网 · 金融
档案管理专员, 5, 1, 职能, 行政, 鑫茂荣信, 北京, 大专, 500, 成熟型, 移动互联网 · 金融
财务经理, 11, 3, 职能, 财务, 上海早点到餐饮管理有限公司, 上海, 大专, 50, 成长型, O2O
前端开发其它, 16, 1, 技术, 前端开发, 上海早点到餐饮管理有限公司, 上海, 大专, 50, 成长型, O2O
运维工程师, 15, 3, 技术, 运维, 直投网, 北京, 本科, 500, 成熟型, 金融
P2P投资经理(徐汇办公), 16, 3, 金融, 投融资, 上海粤通, 上海, 大专, 50, 成长型, 金融
理财经理, 22, 1, 金融, 投融资, 深圳前海新富资本管理集团, 深圳, 本科, 150, 成长型, 移动互联网
媒体公关经理, 15, 3, 市场与销售, 公关, 亿舟财富, 上海, 本科, 50, 成长型, 移动互联网 · 金融
理财顾问, 7, 1年以, 金融, 投融资, 多利宝, 郑州, 大专, 15, 初创型, 移动互联网 · 金融
APP开发工程师, 12, 1, 技术, 移动开发, 万盈财富, 深圳, 本科, 150, 成长型, 移动互联网 · 金融
海外资产管理员, 6, 1, 职能, 财务, Upsky酒店管理集团, 北京, 本科, 500, 成熟型, 其他
医学编辑（临床医学）, 6, 不, 运营, 编辑, VHS 好人生, 上海, 学历不限, 50, 成熟型, 医疗健康
商务渠道, 6, 5, 市场与销售, 市场/营销, VHS 好人生, 上海, 大专, 50, 成熟型, 医疗健康
产品经理, 13, 3, 产品, 产品经理, VHS 好人生, 上海, 大专, 50, 成熟型, 医疗健康
系统安全, 18, 3, 技术, 运维, 卡行天下, 上海, 本科, 2000, 成熟型, 移动互联网
android技术经理, 40, 5, 技术, 高端技术职位, 金利恒, 北京, 大专, 500, 初创型, 其他
Java, 15, 1, 技术, 后端开发, 音卓网络, 杭州, 学历不限, 150, 初创型, 教育
测试经理, 15, 5, 技术, 测试, 信和财富-科技公司, 北京, 本科, 2000, 成熟型, 金融
高级技术经理, 17, 5, 技术, 高端技术职位, 深圳妈妈资本, 深圳, 本科, 50, 成长型, 金融
市场策划, 5, 1, 市场与销售, 市场/营销, 杭州苏河汇, 杭州, 大专, 50, 上市公, 其他
C++服务端研发（游戏）, 20, 3, 技术, 后端开发, 易佰, 北京, 大专, 50, 成熟型, 金融
网页产品经理, 15, 3, 产品, 产品经理, 直投网, 北京, 大专, 500, 成熟型, 金融
女装时尚编辑, 5, 1, 运营, 编辑, 零时尚低奢饰品连锁买手店, 北京, 大专, 15, 初创型, O2O · 生活服务
.NET, 9, 3, 技术, 后端开发, 111域名，专注数字资产服务, 武汉, 本科, 15, 初创型, 移动互联网 · 数据服务
游戏策划经理, 8, 3, 产品, 产品经理, 比如世界, 北京, 本科, 150, 成长型, 教育 · 文化娱乐
活动策划, 6, 3, 运营, 运营, 比如世界, 北京, 大专, 150, 成长型, 教育 · 文化娱乐
网络推广, 7, 1, 运营, 运营, 上海装潢网, 上海, 大专, 15, 初创型, O2O · 生活服务
产品运营总监, 25, 3, 运营, 运营, 米庄理财, 杭州, 大专, 50, 成长型, 金融
运营总监, 22, 5, 运营, 运营, 米庄理财, 杭州, 本科, 50, 成长型, 金融
网页产品设计师, 8, 3, 产品, 产品设计师, 和智传信, 北京, 本科, 50, 初创型, 移动互联网 · 广告营销
微信产品经理, 17, 3, 产品, 产品经理, 东方银谷, 北京, 大专, 2000, 成熟型, 移动互联网 · 金融
.NET, 10, 1, 技术, 后端开发, 康管家, 上海, 本科, 15, 初创型, O2O
市场策划, 18, 3, 市场与销售, 市场/营销, 青苔债管家, 北京, 本科, 15, 成长型, 移动互联网 · 金融
6千起内部下单员, 9, 不, 产品, 高端产品职位, 弈业国际投资管理有限公司, 北京, 学历不限, 50, 成熟型, 教育 · 金融
运营经理, 13, 3, 运营, 运营, 紫晨管理咨询有限公司, 深圳, 本科, 15, 初创型, 企业服务
理财顾问, 7, 不, 金融, 投融资, 冠群驰骋投资管理, 北京, 大专, 2000, 上市公, 金融
高级NET软件开发工程师, 11, 1, 技术, 后端开发, 江苏金易达供应链管理有限公司, 昆山, 本科, 15, 初创型, 企业服务 · 金融
大数据产业发展部工作人员, 4, 1, 产品, 产品经理, 贵州铜仁高新区管理委员会, 贵阳, 本科, 500, 成熟型, 招聘
客服, 4, 1, 运营, 客服, 仁多, 上海, 大专, 500, 初创型, 金融 · 文化娱乐
内容运营经理, 15, 3, 运营, 运营, 利得金融服务集团, 上海, 本科, 500, 成熟型, 移动互联网 · 金融
金融内容编辑, 7, 1, 运营, 编辑, 国丞财富, 上海, 大专, 150, 成长型, 金融
招聘专员, 4, 1, 职能, 人力资源, 国联资产, 北京, 大专, 150, 成长型, 金融
基金运营专员, 6, 不, 运营, 运营, 国联资产, 北京, 大专, 150, 成长型, 金融
文案策划, 7, 1, 运营, 编辑, 帝纯, 上海, 大专, 150, 成长型, 移动互联网 · 金融
用户运营, 6, 3, 运营, 运营, 神灯财富, 武汉, 大专, 500, 成熟型, 移动互联网 · 金融
理财顾问, 3, 1, 金融, 投融资, 投融谱华, 北京, 大专, 150, 成长型, 金融
运维工程师, 12, 3, 技术, 运维, 住友酒店集团（布丁酒店连锁）, 杭州, 本科, 2000, 成熟型, 移动互联网 · 旅游
架构师, 25, 5, 技术, 高端技术职位, 蜂云网络（51订货网）, 南京, 大专, 500, 成长型, 电子商务 · O2O
理财顾问, 4, 不, 金融, 投融资, 安信卓越投资管理（北京）有限公司, 北京, 大专, 500, 成熟型, 电子商务 · 金融
用户运营主管, 9, 1, 运营, 运营, 乐居生活, 北京, 大专, 150, 成长型, O2O · 生活服务
投资助理-媒体运营方向/记者采编, 7, 1, 金融, 投融资, 启创资本, 杭州, 大专, 15, 初创型, 移动互联网 · 企业服务
产品经理, 14, 3, 产品, 产品经理, 华赢集团, 北京, 大专, 15, 初创型, 移动互联网 · 金融
平面设计师, 10, 3, 设计, 视觉设计, 景湶财富, 上海, 大专, 50, 成长型, 金融
市场推广经理/总监., 12, 3, 市场与销售, 高端市场职位, 杭州帮实投资管理有限公司, 杭州, 大专, 15, 成长型, 金融
移动开发工程师（HTML5）, 12, 3, 技术, 移动开发, VHS 好人生, 上海, 大专, 50, 成熟型, 医疗健康
团队经理, 9, 1, 市场与销售, 销售, 安信卓越投资管理（北京）有限公司, 北京, 大专, 500, 成熟型, 电子商务 · 金融
高级Java工程师, 25, 3, 技术, 后端开发, V大夫, 北京, 大专, 50, 成长型, O2O
Java开发经理, 25, 5, 技术, 后端开发, 红岭资本, 深圳, 本科, 50, 成长型, 移动互联网 · 金融
风控专员（车贷业务家访）, 6, 1年以, 金融, 风控, PPmoney互联网金融平台, 广州, 大专, 150, 成长型, 金融
市场策划/商品企划专员, 6, 1, 市场与销售, 市场/营销, 零时尚低奢饰品连锁买手店, 北京, 学历不限, 15, 初创型, O2O · 生活服务
网络编辑, 6, 1, 运营, 编辑, 医小护, 北京, 大专, 50, 成长型, 移动互联网 · O2O
市场营销, 7, 1, 市场与销售, 市场/营销, 泥鸽靶, 上海, 大专, 15, 初创型, 移动互联网 · 金融
C++高级开发工程师, 22, 3, 技术, 后端开发, 艾亿新融, 北京, 本科, 50, 成长型, 金融
编导, 6, 不, 运营, 编辑, 嘚瑟咖, 深圳, 大专, 15, 初创型, 金融 · 文化娱乐
前端开发工程师, 11, 1, 技术, 前端开发, 腾信堂, 杭州, 本科, 150, 成长型, 金融
产品经理（移动端/互联网金融）, 15, 3, 产品, 产品经理, 信和大金融, 北京, 本科, 2000, 成熟型, 移动互联网 · 金融
UI交互设计师, 11, 3, 设计, 交互设计, 大通资本, 厦门, 本科, 500, 成熟型, 金融
金融产品专员, 6, 1, 产品, 产品经理, 中关村领创金融, 北京, 本科, 50, 成长型, 金融
投资助理, 6, 不, 金融, 投融资, 佰润明辉, 北京, 学历不限, 150, 成长型, 移动互联网 · 金融
高级人事专员, 4, 1, 职能, 人力资源, 海润财富, 北京, 本科, 150, 成长型, 金融
投资副总裁（VP）, 50, 5, 金融, 高端金融职位, 光源资本, 上海, 本科, 15, 成长型, 企业服务 · 金融
IT支持实习生, 1, 不, 技术, 运维, 中大咨询, 广州, 大专, 150, 成长型, 企业服务 · 其他
运营专员（内容）, 9, 1, 运营, 运营, 网贷之家, 上海, 学历不限, 150, 成长型, 金融
6千起内部交易经理, 9, 不, 产品, 高端产品职位, 弈业国际投资管理有限公司, 北京, 学历不限, 50, 成熟型, 教育 · 金融
系统架构师, 10, 3, 技术, 后端开发, 中投融, 上海, 大专, 500, 成熟型, 金融
福利宝项目商务专员/KA专员, 3, 1, 市场与销售, 销售, 中投融, 上海, 大专, 500, 成熟型, 金融
客服VIP专员, 4, 不, 运营, 客服, 中投融, 上海, 大专, 500, 成熟型, 金融
培训师, 8, 3, 市场与销售, 市场/营销, 中投融, 上海, 大专, 500, 成熟型, 金融
项目招商部副经理, 6, 3, 职能, 高端职能职位, 贵州铜仁高新区管理委员会, 贵阳, 本科, 500, 成熟型, 招聘
运营总监, 9, 3, 运营, 高端运营职位, 蜂云网络（51订货网）, 南京, 本科, 500, 成长型, 电子商务 · O2O
内容运营, 2, 1, 运营, 运营, 杭州帮实投资管理有限公司, 杭州, 本科, 15, 成长型, 金融
招聘, 12, 不, 职能, 人力资源, 青桐资本, 上海, 本科, 15, 初创型, 金融
运维工程师, 8, 1, 运营, 运营, 亿舟财富, 上海, 本科, 50, 成长型, 移动互联网 · 金融
北京Linux工程师(反汇编), 30, 1, 技术, 后端开发, 劲马奥通, 北京, 学历不限, 15, 成长型, 移动互联网 · 电子商务
招聘专员, 4, 1年以, 职能, 人力资源, 中海微银, 北京, 本科, 2000, 成熟型, 金融
PHP工程师, 10, 1, 技术, 后端开发, 东方富通, 北京, 大专, 150, 初创型, 金融
项目经理/助理, 10, 5, 金融, 高端金融职位, 兴邦资本, 北京, 本科, 15, 初创型, 金融
app测试工程师, 12, 1, 技术, 测试, 深圳妈妈资本, 深圳, 本科, 50, 成长型, 金融
web前端, 12, 不, 技术, 前端开发, 三板富, 深圳, 学历不限, 15, 成长型, 金融
运营经理, 8, 3, 运营, 运营, 比如世界, 北京, 本科, 150, 成长型, 教育 · 文化娱乐
活动策划, 11, 1, 运营, 运营, 鑫茂荣信, 北京, 本科, 500, 成熟型, 移动互联网 · 金融
技术经理, 17, 5, 技术, 高端技术职位, 汇融通盛, 天津, 本科, 15, 初创型, 移动互联网 · 金融
销售专员, 4, 应届毕业, 市场与销售, 销售, 亿家网, 北京, 大专, 50, 成长型, 移动互联网 · 电子商务
项目经理（女）, 15, 1, 技术, 项目管理, 华赢集团, 北京, 本科, 15, 初创型, 移动互联网 · 金融
前端工程师（数据可视化方向）, 20, 3, 技术, 前端开发, 艾亿新融, 北京, 本科, 50, 成长型, 金融
web前端, 8, 1, 技术, 前端开发, 安企金融, 合肥, 大专, 15, 初创型, 金融
市场策划, 15, 5, 市场与销售, 市场/营销, 泰金所, 上海, 本科, 50, 成长型, 移动互联网 · 金融
6千起内部交易经理, 9, 不, 设计, 高端设计职位, 弈业国际投资管理有限公司, 北京, 学历不限, 50, 成熟型, 教育 · 金融
PHP开发工程师, 21, 1, 技术, 后端开发, 屹石资产, 北京, 大专, 50, 成长型, 金融
综合部信息专员, 6, 1, 职能, 行政, 贵州铜仁高新区管理委员会, 贵阳, 本科, 500, 成熟型, 招聘
高级理财顾问, 7, 1, 金融, 投融资, 首山财富, 南京, 大专, 500, 成熟型, 金融
综合前台, 5, 1年以, 职能, 行政, 鑫茂荣信, 深圳, 大专, 500, 成熟型, 移动互联网 · 金融
市场顾问, 8, 不, 市场与销售, 市场/营销, 上海财横, 上海, 学历不限, 50, 成长型, 移动互联网 · 金融
DBA工程师, 15, 5, 技术, dba, 住友酒店集团（布丁酒店连锁）, 杭州, 本科, 2000, 成熟型, 移动互联网 · 旅游
高级UI设计师, 22, 3, 设计, 视觉设计, 酬信, 北京, 本科, 150, 成长型, 金融
无责底薪五险双休交易助理, 8, 不, 金融, 投融资, 德通汇富, 北京, 大专, 150, 成长型, 金融
客服专员, 4, 1, 运营, 客服, E票宝, 广州, 大专, 15, 初创型, 金融
web前端工程师, 15, 1, 技术, 前端开发, 中天嘉华集团, 北京, 本科, 500, 成熟型, 移动互联网 · 金融
视觉总监, 20, 3, 设计, 视觉设计, 华赢集团, 北京, 大专, 15, 初创型, 移动互联网 · 金融
投资经理, 10, 1, 金融, 投融资, 钦联财富, 上海, 大专, 500, 成熟型, 金融 · 生活服务
城市总经理, 10, 1, 市场与销售, 销售, V大夫, 深圳, 大专, 50, 成长型, O2O
电脑美术专业设计师, 3, 不, 设计, 视觉设计, 深耕资本, 上海, 学历不限, 50, 成长型, 金融
运营专员（全职、实习、兼职均可）, 4, 不, 运营, 运营, 宜云健康, 上海, 大专, 15, 初创型, 移动互联网 · 医疗健康
平面设计师, 5, 1, 设计, 视觉设计, 汇融通盛, 天津, 大专, 15, 初创型, 移动互联网 · 金融
BD经理, 12, 1, 市场与销售, 市场/营销, 亿家网, 北京, 本科, 50, 成长型, 移动互联网 · 电子商务
内容编辑1, 7, 1, 运营, 编辑, 和智传信, 北京, 本科, 50, 初创型, 移动互联网 · 广告营销
运营经理, 13, 3, 运营, 运营, 普伴中国, 北京, 本科, 500, 成熟型, 移动互联网 · 金融
项目专员, 4, 1, 金融, 投融资, 富邦教育, 深圳, 大专, 15, 成长型, 教育 · 生活服务
前台, 6, 1, 职能, 行政, 大大集团深圳市公司, 深圳, 大专, 2000, 成熟型, 金融
6千起内部经理, 9, 不, 产品, 高端产品职位, 弈业国际投资管理有限公司, 北京, 学历不限, 50, 成熟型, 教育 · 金融
8千起内部交易经理, 12, 不, 市场与销售, 高端市场职位, 弈业国际投资管理有限公司, 北京, 学历不限, 50, 成熟型, 教育 · 金融
拓展专员, 10, 不, 市场与销售, 市场/营销, 蘑菇租房, 深圳, 本科, 150, 成长型, 移动互联网 · 电子商务
冠群诚聘有基金从业资格证顾问（五险一金+福利+双休）, 7, 1, 金融, 投融资, 冠群驰骋投资管理, 北京, 大专, 2000, 上市公, 金融
资深招生老师/储备主管, 14, 3, 市场与销售, 销售, AIA英国国际会计师公会代表处/美都教育, 上海, 大专, 150, 初创型, 教育
功能测试, 7, 1, 技术, 测试, 多多理财, 杭州, 本科, 50, 初创型, 移动互联网 · 金融
培训主管, 9, 3, 职能, 人力资源, 信和财富, 北京, 本科, 2000, 成熟型, 金融
Java工程师, 8, 3, 技术, 后端开发, VHS 好人生, 上海, 大专, 50, 成熟型, 医疗健康
医学编辑（心理）, 6, 不, 运营, 编辑, VHS 好人生, 上海, 学历不限, 50, 成熟型, 医疗健康
英语健康专员, 4, 不, 运营, 客服, VHS 好人生, 上海, 大专, 50, 成熟型, 医疗健康
运营经理/主管, 6, 1, 运营, 运营, 和租吧, 南京, 大专, 50, 成长型, O2O
投资经理, 6, 1, 金融, 投融资, 钦联财富, 上海, 大专, 500, 成熟型, 金融 · 生活服务
五险双休培训助理, 6, 不, 金融, 投融资, 德通汇富, 北京, 大专, 150, 成长型, 金融
PHP, 15, 3, 技术, 后端开发, 千合医疗, 北京, 本科, 15, 初创型, 医疗健康
产品经理, 19, 3, 产品, 产品经理, 糖果金融, 北京, 本科, 150, 初创型, 金融
IOS开发工程师, 15, 3, 技术, 移动开发, 信和财富-科技公司, 北京, 本科, 2000, 成熟型, 金融
培训讲师, 15, 3, 职能, 人力资源, 鑫茂荣信, 北京, 本科, 500, 成熟型, 移动互联网 · 金融
（急聘）市场总监, 20, 5, 职能, 高端职能职位, 直向投资, 上海, 本科, 150, 成熟型, 金融
拓展专员, 10, 不, 市场与销售, 销售, 蘑菇租房, 上海, 本科, 150, 成长型, 移动互联网 · 电子商务
安卓开发工程师, 16, 1, 技术, 移动开发, 浙江鹰泊, 杭州, 大专, 50, 成熟型, 电子商务
测试工程师, 15, 5, 技术, 测试, 厚生资产, 深圳, 本科, 150, 成长型, 金融
出纳, 5, 1, 职能, 财务, 泥鸽靶, 上海, 大专, 15, 初创型, 移动互联网 · 金融
Java, 15, 不, 技术, 后端开发, 超级猩猩健身, 深圳, 本科, 15, 初创型, 移动互联网
Java开发, 16, 3, 技术, 后端开发, 恒昌利通, 上海, 本科, 2000, 成熟型, 金融
新媒体运营, 7, 1, 运营, 运营, 蚂蚁白领, 北京, 本科, 15, 成长型, 移动互联网 · 金融
COO, 17, 3, 运营, 高端运营职位, OUTMAN淘汰郎, 北京, 学历不限, 50, 初创型, 移动互联网 · O2O
Android开发高级工程师, 18, 1, 技术, 移动开发, 天衡医疗, 北京, 学历不限, 150, 成长型, O2O · 医疗健康
Java, 18, 不, 技术, 后端开发, 天衡医疗, 北京, 学历不限, 150, 成长型, O2O · 医疗健康
Android, 18, 不, 技术, 移动开发, 天衡医疗, 北京, 学历不限, 150, 成长型, O2O · 医疗健康
客服经理, 8, 5, 运营, 客服, 东融, 上海, 大专, 500, 成熟型, 金融
