职位, 工资, 经验要求, 职位一级分类, 职位二级分类, 公司名称, 城市, 学历, 公司规模, 公司阶段, 公司业务领域
数据仓库, 17, 5, 技术, dba, 北京捷越联合, 北京, 大专, 2000, 成熟型, 金融
数据仓库, 30, 1, 技术, dba, 滴滴打车, 北京, 本科, 500, 成熟型, 移动互联网
数据仓库, 10, 1, 技术, dba, 网金控股, 广州, 大专, 150, 成长型, 移动互联网 · 金融
数据仓库, 10, 1, 技术, dba, 网金控股, 广州, 大专, 150, 成长型, 移动互联网 · 金融
数据仓库, 7, 3, 技术, dba, 思特奇Si-tech, 长春, 本科, 2000, 成熟型, 数据服务
数据仓库, 12, 1, 技术, dba, 开新汽车, 上海, 本科, 500, 成长型, 移动互联网
数据仓库, 20, 1, 技术, dba, 兔博士, 上海, 大专, 15, 成长型, 移动互联网 · 生活服务
数据仓库, 22, 1, 技术, dba, 宜信公司, 北京, 本科, 2000, 成熟型, 移动互联网 · 金融
数据仓库, 22, 5, 技术, dba, 买单侠, 上海, 本科, 150, 成长型, 金融
数据仓库, 22, 3, 技术, dba, 宜信公司, 北京, 本科, 2000, 成熟型, 移动互联网 · 金融
数据仓库, 21, 3, 技术, dba, 什么值得买, 北京, 本科, 150, 成长型, 电子商务 · 文化娱乐
数据仓库, 4, 1, 技术, dba, 广缘, 秦皇岛, 大专, 2000, 成熟型, 生活服务 · 其他
数据仓库, 6, 1, 技术, dba, 长亮科技, 烟台, 大专, 500, 上市公, 企业服务
数据仓库, 15, 5, 技术, dba, 雅购, 宁波, 本科, 50, 成长型, 其他
数据仓库, 10, 3, 技术, dba, 中融民信, 北京, 本科, 2000, 成熟型, 移动互联网 · 金融
数据仓库, 16, 1, 技术, dba, 付融宝, 南京, 大专, 150, 上市公, 移动互联网 · 金融
数据仓库, 8, 1, 技术, dba, 奇立智云, 广州, 大专, 15, 初创型, 移动互联网 · 电子商务
数据仓库, 22, 1, 技术, dba, YeahMobi, 上海, 本科, 50, 成长型, 移动互联网 · 广告营销
数据仓库, 12, 1, 技术, dba, 网易, 杭州, 本科, 2000, 上市公, 移动互联网 · 游戏
数据仓库工程师, 17, 5, 技术, 后端开发, 北京捷越联合, 北京, 大专, 2000, 成熟型, 金融
数据仓库, 11, 1, 技术, dba, 团贷网, 东莞, 大专, 500, 成长型, 金融
数据仓库, 15, 3, 技术, dba, Pactera, 广州, 大专, 2000, 上市公, 金融
数据仓库, 16, 1, 技术, dba, 中地控股, 南京, 大专, 150, 成长型, 移动互联网 · 金融
数据仓库, 12, 1, 技术, dba, 中彩在线, 北京, 本科, 150, 成长型, 电子商务 · 金融
数据仓库, 19, 1, 技术, dba, 人人车, 北京, 本科, 500, 成熟型, O2O
数据仓库, 26, 1, 技术, dba, 人人车, 北京, 本科, 500, 成熟型, O2O
数据仓库, 22, 1, 技术, dba, 通远科技, 北京, 本科, 150, 成长型, 移动互联网 · 硬件
数据仓库, 10, 3, 技术, dba, 武汉中天慧购电商服务有限公司, 武汉, 大专, 15, 初创型, 电子商务 · O2O
数据仓库, 9, 3, 技术, dba, 文思海辉, 台州, 大专, 2000, 上市公, 移动互联网
数据仓库, 11, 3, 技术, dba, 卓荻, 上海, 学历不限, 150, 成长型, 移动互联网 · 企业服务
数据仓库, 15, 3, 技术, dba, 金慧融智数据有限公司, 成都, 大专, 500, 上市公, 移动互联网 · 数据服务
数据仓库, 10, 3, 技术, dba, 叮当钱包, 北京, 学历不限, 2000, 成长型, 移动互联网 · 金融
数据仓库, 20, 不, 技术, dba, 艾德思奇adSage, 北京, 本科, 500, 成长型, 移动互联网 · 广告营销
数据仓库, 15, 不, 技术, dba, 长城证券, 深圳, 本科, 2000, 初创型, 金融
数据仓库, 25, 3, 技术, dba, 国金证券, 上海, 本科, 2000, 上市公, 金融
数据仓库, 22, 1, 技术, dba, 人人车, 北京, 本科, 500, 成熟型, O2O
数据仓库工程师, 22, 5, 技术, 后端开发, 美的厨房电器事业部, 佛山, 本科, 2000, 上市公, 硬件
数据仓库, 9, 1, 技术, dba, 银嘉金融, 上海, 大专, 150, 初创型, 电子商务
数据仓库, 7, 3, 技术, dba, 银信财富, 北京, 学历不限, 2000, 成熟型, 金融
数据仓库, 12, 1, 技术, dba, 厚本金融, 上海, 本科, 500, 成长型, 金融
数据仓库, 9, 不, 技术, dba, 博彦科技, 杭州, 本科, 2000, 上市公, 移动互联网 · 企业服务
数据仓库, 11, 3, 技术, dba, 银信财富, 北京, 本科, 2000, 成熟型, 金融
数据仓库, 15, 1, 技术, dba, 网易, 杭州, 本科, 2000, 上市公, 移动互联网 · 游戏
[和讯大数据-实习生]数据仓库(BIDW), 3, 不, 技术, dba, 和讯网, 上海, 硕士, 150, 成长型, 移动互联网
数据仓库, 15, 5, 技术, dba, 浙江核新同花顺网络信息股份有限公司, 杭州, 大专, 500, 上市公, 金融
数据仓库, 25, 3, 技术, dba, e代驾, 北京, 本科, 500, 成熟型, 移动互联网 · O2O
数据仓库, 12, 1, 技术, dba, 中安信业, 深圳, 本科, 2000, 成熟型, 金融
数据仓库（BI方向）, 22, 3, 技术, dba, 人人车, 北京, 本科, 500, 成熟型, O2O
数据仓库, 11, 1, 技术, dba, 青岛特来电新能源有限公司, 青岛, 本科, 50, 成长型, 分类信息 · 其他
数据仓库, 15, 1, 技术, dba, 和堂科技, 北京, 本科, 50, 成长型, 移动互联网 · 金融
数据仓库（BI方向）, 22, 3, 技术, dba, 人人车, 北京, 本科, 500, 成熟型, O2O
数据仓库工程师, 12, 1, 技术, dba, ihefe, 上海, 本科, 50, 初创型, 移动互联网
数据仓库工程师, 20, 5, 运营, 运营, 汽车超人, 杭州, 本科, 500, 成熟型, 电子商务 · 其他
数据仓库, 15, 3, 技术, dba, 金融界网站（互联网证券）, 北京, 本科, 500, 上市公, 金融 · 文化娱乐
数据仓库工程师, 11, 1, 技术, 后端开发, 铂涛会, 广州, 本科, 500, 初创型, 移动互联网 · 旅游
数据仓库工程师, 11, 1, 技术, dba, 铂涛会, 广州, 本科, 500, 初创型, 移动互联网 · 旅游
数据仓库, 10, 不, 技术, dba, 科莱特, 南京, 大专, 150, 成长型, 企业服务 · 数据服务
数据仓库, 11, 不, 技术, dba, FSW, 北京, 本科, 150, 成长型, 信息安全 · 数据服务
数据仓库（Hive）, 16, 1, 技术, dba, 达达, 上海, 本科, 500, 成熟型, O2O
数据仓库, 30, 5, 技术, dba, 蘑菇街, 杭州, 本科, 500, 成熟型, 电子商务
数据仓库, 17, 3, 技术, dba, 网易, 北京, 本科, 2000, 上市公, 数据服务 · 文化娱乐
数据仓库工程师, 12, 1, 技术, dba, 河狸家, 北京, 本科, 500, 成熟型, 移动互联网
数据仓库, 5, 1, 技术, dba, 北京热度文化传媒有限公司, 北京, 大专, 15, 初创型, 文化娱乐
数据仓库, 12, 3, 技术, dba, 中融民信, 北京, 本科, 2000, 成熟型, 移动互联网 · 金融
数据仓库, 9, 不, 技术, dba, 文思海辉, 上海, 学历不限, 2000, 成熟型, 移动互联网 · 企业服务
数据仓库, 50, 5, 技术, dba, 车置宝, 南京, 大专, 500, 成熟型, 移动互联网 · 电子商务
数据仓库, 25, 5, 技术, dba, 宅米, 上海, 大专, 500, 成长型, O2O
数据仓库, 11, 1, 技术, dba, 百分点, 北京, 本科, 500, 成熟型, 数据服务
数据仓库, 15, 不, 技术, dba, 速云互动, 上海, 本科, 15, 初创型, 移动互联网
数据仓库, 3, 应届毕业, 技术, dba, 上海博辕信息, 上海, 大专, 500, 上市公, 移动互联网 · 硬件
数据仓库, 17, 1, 技术, dba, 律金金融, 上海, 本科, 150, 成长型, 移动互联网 · 金融
数据仓库, 17, 3, 技术, dba, 软通动力, 上海, 大专, 2000, 上市公, 数据服务
数据仓库, 4, 不, 技术, dba, 遇见X, 上海, 学历不限, 50, 成长型, 移动互联网 · 电子商务
数据仓库, 12, 不, 技术, dba, 坤虎科技, 杭州, 学历不限, 15, 初创型, 医疗健康
数据仓库, 7, 1, 技术, dba, 迈特望, 上海, 大专, 150, 成长型, 移动互联网 · 数据服务
数据仓库, 15, 1, 技术, dba, 穿衣助手, 上海, 学历不限, 50, 成长型, 移动互联网 · 电子商务
数据仓库, 11, 3, 技术, dba, 卓荻, 上海, 学历不限, 150, 成长型, 移动互联网 · 企业服务
数据仓库工程师, 11, 3, 技术, dba, 汇力凯途, 北京, 本科, 50, 初创型, 移动互联网
数据仓库, 20, 3, 技术, dba, 大连佰诚, 大连, 本科, 15, 初创型, 电子商务
数据仓库工程师, 4, 1, 技术, 前端开发, 烁林软件, 成都, 本科, 50, 初创型, 金融
数据仓库, 22, 3, 技术, dba, 中融民信, 北京, 本科, 2000, 成熟型, 移动互联网 · 金融
数据仓库, 15, 3, 技术, dba, 梧桐理财, 上海, 大专, 15, 成长型, 金融
数据仓库工程师, 9, 3, 技术, 后端开发, 华院数据, 上海, 本科, 500, 成熟型, 企业服务 · 数据服务
数据仓库, 3, 不, 技术, dba, 广州致恒, 广州, 大专, 15, 初创型, 企业服务 · 金融
数据仓库, 11, 1, 技术, dba, 文思海辉, 上海, 本科, 2000, 上市公, 电子商务 · 金融
数据仓库, 17, 3, 技术, dba, 正南文化, 北京, 本科, 15, 初创型, 电子商务
数据仓库, 10, 1, 技术, dba, 关爱通, 上海, 本科, 150, 初创型, 电子商务 · 企业服务
数据仓库, 12, 1, 技术, dba, 睿安一家, 北京, 大专, 50, 初创型, 金融
数据仓库, 12, 1, 技术, dba, 北京宝信科技有限公司, 北京, 学历不限, 15, 初创型, 移动互联网 · 数据服务
数据仓库工程师, 8, 3, 技术, dba, 汉拓, 青岛, 本科, 15, 初创型, 移动互联网 · O2O
数据仓库工程师, 1, 不, 技术, dba, 广州思迈特, 广州, 学历不限, 50, 初创型, 企业服务 · 数据服务
数据仓库工程师, 16, 1, 技术, dba, 宜信公司, 北京, 本科, 2000, 成熟型, 移动互联网 · 金融
数据仓库, 22, 5, 技术, dba, 中融民信, 北京, 本科, 2000, 成熟型, 移动互联网 · 金融
数据仓库, 30, 5, 技术, dba, 乐视, 北京, 本科, 2000, 上市公, 移动互联网 · 文化娱乐
数据仓库工程师/ETL工程师, 11, 1, 技术, dba, 要出发, 广州, 本科, 500, 成熟型, 电子商务 · 生活服务
数据仓库开发工程师（偏实时计算）, 20, 3, 技术, 后端开发, 汽车超人, 杭州, 学历不限, 500, 成熟型, 电子商务 · 其他
数据仓库开发工程师（总部）, 30, 3, 技术, 后端开发, 美菜网, 北京, 本科, 2000, 成熟型, 电子商务 · O2O
数据仓库工程师, 4, 1, 技术, 前端开发, 成都博盛邦, 成都, 本科, 15, 初创型, 金融
数据仓库开发工程师, 20, 1, 技术, dba, 车来了, 北京, 本科, 150, 成长型, 移动互联网 · 数据服务
数据仓库开发工程师, 16, 3, 技术, 后端开发, 环球易购, 深圳, 大专, 500, 上市公, 电子商务
数据仓库, 15, 1, 技术, dba, 同城时代, 杭州, 本科, 50, 成长型, 移动互联网 · 企业服务
【急聘】数据仓库工程师, 16, 1, 技术, 后端开发, 家家顺房产网, 深圳, 大专, 50, 初创型, 移动互联网 · 生活服务
数据仓库工程师, 20, 1, 技术, 后端开发, 数美时代, 北京, 硕士, 15, 成长型, 企业服务 · 数据服务
数据仓库高级工程师, 17, 5, 技术, dba, 北京捷越联合, 北京, 大专, 2000, 成熟型, 金融
数据仓库高级工程师, 17, 不, 技术, dba, 北京捷越联合, 北京, 学历不限, 2000, 成熟型, 金融
数据仓库高级工程师, 16, 3, 技术, dba, 北京捷越联合, 北京, 本科, 2000, 成熟型, 金融
高级数据仓库开发工程师, 17, 3, 技术, 后端开发, 两鲜, 上海, 大专, 150, 成长型, 电子商务
数据仓库开发工程师, 22, 3, 技术, 后端开发, 金色家园科技, 北京, 本科, 500, 成熟型, O2O
数据仓库, 4, 不, 技术, dba, 飞鹰畅游, 深圳, 学历不限, 15, 初创型, 移动互联网 · 电子商务
数据仓库工程师, 23, 3, 技术, 后端开发, 美团网, 北京, 本科, 2000, 成熟型, 移动互联网 · O2O
高级数据仓库工程师, 15, 3, 技术, dba, 什么值得买, 北京, 本科, 150, 成长型, 电子商务 · 文化娱乐
数据仓库工程师, 15, 3, 技术, dba, 吉贝克, 上海, 大专, 500, 成熟型, 金融 · 数据服务
高级开发工程师（数据仓库）, 15, 3, 技术, dba, 五谷磨房食品集团有限公司, 深圳, 本科, 2000, 成熟型, 移动互联网 · O2O
数据仓库工程师, 14, 1, 技术, dba, 尚妆网, 杭州, 大专, 50, 成长型, 电子商务
数据仓库工程师, 20, 5, 运营, 运营, 汽车超人, 杭州, 本科, 500, 成熟型, 移动互联网 · O2O
数据仓库（Oracle）, 15, 1, 技术, dba, 慧瑞通, 北京, 本科, 15, 初创型, 移动互联网 · O2O
数据仓库开发工程师, 13, 3, 技术, dba, 泰玄网络, 杭州, 本科, 150, 成长型, 金融
数据仓库开发, 17, 3, 技术, dba, 软通动力, 上海, 大专, 2000, 上市公, 数据服务
数据仓库工程师(AWS Redshift), 15, 3, 技术, dba, 爱乐奇, 上海, 本科, 50, 成熟型, 移动互联网 · 教育
数据仓库开发, 30, 5, 技术, 后端开发, 美团网, 北京, 本科, 2000, 成熟型, 移动互联网 · O2O
高级数据仓库工程师, 32, 3, 技术, 后端开发, 37degree, 北京, 本科, 15, 成长型, 数据服务
数据仓库工程师, 15, 1, 技术, 运维, 京东金融, 北京, 本科, 2000, 上市公, 金融
大数据开发（数据仓库）, 12, 1, 技术, dba, 爱客仕, 杭州, 大专, 150, 成长型, 移动互联网 · O2O
数据仓库开发工程师, 22, 3, 技术, 后端开发, 有赞, 杭州, 学历不限, 150, 成长型, 移动互联网 · 电子商务
数据仓库高级工程师, 22, 3, 技术, dba, 马上金融, 北京, 本科, 150, 成长型, 金融
（2016校招）数据仓库, 12, 应届毕业, 技术, 后端开发, 好未来（原学而思）, 北京, 本科, 2000, 上市公, 移动互联网 · 教育
数据仓库研发工程师, 19, 1, 技术, 后端开发, 数美时代, 北京, 本科, 15, 成长型, 企业服务 · 数据服务
数据仓库研发工程师, 12, 3, 技术, 后端开发, 华住酒店集团, 上海, 大专, 2000, 上市公, 旅游 · 生活服务
数据仓库研发工程师, 30, 3, 技术, 后端开发, 美团网, 北京, 本科, 2000, 成熟型, 移动互联网 · O2O
数据仓库建模, 22, 3, 技术, dba, 联想集团, 北京, 本科, 2000, 上市公, 移动互联网 · 数据服务
数据仓库工程师, 15, 不, 技术, dba, 宋小菜, 杭州, 学历不限, 150, 成长型, 电子商务
数据仓库实习生, 4, 应届毕业, 技术, dba, 易博创云, 苏州, 大专, 15, 初创型, 数据服务
数据仓库开发工程师, 15, 3, 技术, 后端开发, 订餐小秘书, 上海, 本科, 500, 成熟型, O2O
数据仓库工程师, 7, 1, 技术, 硬件开发, 无极慧通, 北京, 本科, 15, 成长型, 医疗健康 · 数据服务
数据仓库开发工程师, 30, 3, 技术, 后端开发, 宜人贷, 北京, 本科, 500, 成熟型, 移动互联网 · 金融
数据仓库开发, 9, 3, 技术, 后端开发, 车置宝, 南京, 本科, 500, 成熟型, 移动互联网 · 电子商务
数据仓库（DW研发类实习生，非DBA）, 5, 应届毕业, 技术, dba, 比孚, 上海, 本科, 150, 初创型, 移动互联网 · 数据服务
数据仓库项目经理, 15, 3, 技术, 项目管理, 科瑞明软件, 北京, 本科, 50, 初创型, 企业服务 · 分类信息
数据仓库工程师, 12, 3, 技术, dba, 中电科安, 武汉, 本科, 50, 初创型, 信息安全 · 数据服务
数据仓库工程师, 15, 3, 技术, 后端开发, 乐视, 北京, 本科, 2000, 上市公, 移动互联网 · 文化娱乐
中高级数据仓库开发, 12, 3, 技术, dba, 博彦科技, 杭州, 本科, 2000, 上市公, 企业服务 · 数据服务
数据仓库架构师, 23, 5, 技术, 高端技术职位, 普惠金融, 北京, 本科, 2000, 成长型, 金融
数据仓库专家, 30, 5, 技术, 后端开发, 美团网, 北京, 本科, 2000, 成熟型, 移动互联网 · O2O
数据仓库开发工程师, 14, 3, 技术, 后端开发, 安个家, 上海, 本科, 50, 初创型, 移动互联网
数据仓库工程师, 20, 3, 技术, dba, 北京信柏信息科技有限公司, 北京, 大专, 150, 成长型, 电子商务
数据仓库ETL, 22, 3, 技术, 后端开发, 58赶集集团, 北京, 本科, 2000, 上市公, 移动互联网
高级数据仓库工程师, 20, 1, 技术, dba, 饿了么, 上海, 本科, 2000, 成熟型, 移动互联网 · 招聘
高级数据仓库开发工程师, 30, 1, 技术, dba, 美团网, 北京, 本科, 2000, 成熟型, 移动互联网 · O2O
数据仓库-BI, 22, 3, 技术, 后端开发, 58赶集集团, 北京, 本科, 2000, 上市公, 移动互联网
数据仓库开发工程师, 22, 3, 技术, 后端开发, 58同城, 北京, 本科, 2000, 上市公, 生活服务 · 分类信息
中级数据仓库开发工程师, 8, 1, 技术, 企业软件, 成都博盛邦, 成都, 本科, 15, 初创型, 金融
数据仓库开发工程师, 17, 3, 技术, dba, 软通动力, 上海, 大专, 2000, 上市公, 数据服务
数据仓库专家, 60, 10年以, 技术, 高端技术职位, 知趣, 北京, 本科, 500, 成熟型, 移动互联网 · 电子商务
高级数据仓库开发工程师, 30, 1, 技术, 后端开发, 美团网, 北京, 本科, 2000, 成熟型, 移动互联网 · O2O
数据仓库开发工程师, 20, 3, 技术, 后端开发, 招联金融, 深圳, 本科, 150, 初创型, 金融
数据仓库设计（建模）, 20, 5, 技术, dba, 达达, 上海, 大专, 500, 成熟型, O2O
数据仓库开发工程师, 18, 1, 技术, 后端开发, 爱学贷, 杭州, 大专, 500, 成长型, 金融
JZDSJB——数据仓库工程师, 22, 3, 技术, dba, 易车公司, 北京, 本科, 2000, 上市公, 移动互联网 · 电子商务
高级数据仓库开发工程师, 30, 1, 技术, 后端开发, 美团网, 北京, 学历不限, 2000, 成熟型, 移动互联网 · O2O
数据仓库开发工程师, 10, 3, 技术, dba, 博彦科技, 深圳, 本科, 2000, 上市公, 移动互联网 · 电子商务
数据仓库研发工程师, 22, 1, 技术, 后端开发, 美团网, 北京, 本科, 2000, 成熟型, 移动互联网 · O2O
数据仓库开发工程师, 12, 3, 技术, dba, 康爱多, 广州, 学历不限, 500, 上市公, 移动互联网 · 电子商务
数据仓库工程师, 20, 1, 技术, 后端开发, 陌陌, 北京, 本科, 150, 上市公, 社交网络
数据仓库高级工程师, 22, 5, 技术, 后端开发, 微众银行, 深圳, 本科, 500, 初创型, 金融
数据仓库开发工程师, 27, 1, 技术, dba, 美团网, 北京, 本科, 2000, 成熟型, 移动互联网 · O2O
高级数据仓库开发工程师, 30, 1, 技术, 后端开发, 美团网, 北京, 本科, 2000, 成熟型, 移动互联网 · O2O
数据仓库岗(个金), 22, 3, 技术, 后端开发, 微众银行, 深圳, 本科, 500, 初创型, 金融
数据仓库架构师, 25, 3, 技术, 高端技术职位, 58同城, 北京, 本科, 2000, 上市公, 生活服务 · 分类信息
数据仓库工程师, 20, 3, 技术, dba, 乐视影业, 北京, 本科, 500, 成熟型, O2O · 文化娱乐
数据仓库（ETL）工程师, 9, 3, 技术, dba, 昊合数据, 济南, 大专, 150, 成长型, 医疗健康 · 数据服务
数据仓库高级开发工程师, 25, 1, 技术, 后端开发, 美团网, 北京, 本科, 2000, 成熟型, 移动互联网 · O2O
数据仓库技术顾问, 24, 5, 技术, dba, 日立咨询中国研发中心, 深圳, 本科, 150, 成长型, 移动互联网 · 企业服务
数据仓库实习工程师, 1, 不, 技术, dba, 广州思迈特, 广州, 学历不限, 50, 初创型, 企业服务 · 数据服务
Oracle/数据仓库, 17, 3, 技术, dba, 浙江网仓科技有限公司, 杭州, 大专, 50, 初创型, 电子商务
数据仓库工程师, 15, 3, 技术, 后端开发, 中科九峰, 上海, 本科, 15, 初创型, 移动互联网 · 医疗健康
数据仓库工程师, 20, 3, 技术, dba, 乐视影业, 北京, 本科, 500, 成熟型, O2O · 文化娱乐
中级数据仓库应用工程师, 12, 1, 技术, dba, 什么值得买, 北京, 本科, 150, 成长型, 电子商务 · 文化娱乐
数据仓库开发工程师(ETL), 7, 不, 技术, dba, 上海凡响网络科技有限公司, 上海, 学历不限, 15, 成长型, 移动互联网 · 数据服务
数据仓库开发工程师, 22, 3, 技术, 后端开发, 微信电影票, 北京, 大专, 500, 成熟型, 移动互联网 · 广告营销
数据仓库建模工程师, 15, 3, 技术, dba, 联想集团, 北京, 本科, 2000, 上市公, 移动互联网 · 数据服务
数据仓库质量工程师/ETL工程师, 15, 3, 技术, 后端开发, 乐视, 北京, 本科, 2000, 上市公, 移动互联网 · 文化娱乐
数据仓库实习生, 5, 应届毕业, 技术, 后端开发, 无极慧通, 北京, 本科, 15, 成长型, 医疗健康 · 数据服务
数据仓库架构师, 15, 1, 技术, dba, 团贷网, 东莞, 大专, 500, 成长型, 金融
数据仓库建模经理, 25, 3, 技术, dba, 返利网, 上海, 本科, 500, 成熟型, 电子商务
数据仓库技术专家, 32, 1, 技术, 后端开发, 美团网, 北京, 硕士, 2000, 成熟型, 移动互联网 · O2O
高级数据仓库开发工程师, 17, 3, 技术, 后端开发, 珍爱网, 深圳, 本科, 2000, 初创型, 社交网络 · 生活服务
数据仓库开发岗, 22, 3, 技术, 后端开发, 微众银行, 深圳, 本科, 500, 初创型, 金融
数据仓库技术专家, 30, 5, 技术, 后端开发, 美团网, 北京, 本科, 2000, 成熟型, 移动互联网 · O2O
产品技术部- • 数据仓库工程师, 30, 3, 技术, 后端开发, 滴滴打车, 北京, 本科, 500, 成熟型, 移动互联网
数据仓库专家, 60, 10年以, 技术, 高端技术职位, 行方, 北京, 本科, 15, 初创型, 移动互联网 · 企业服务
数据仓库开发师, 12, 1, 技术, dba, 康爱多, 广州, 本科, 500, 上市公, 移动互联网 · 电子商务
大数据－数据仓库工程师, 12, 3, 技术, 高端技术职位, 挖财, 杭州, 本科, 500, 成长型, 移动互联网 · 金融
数据仓库质量工程师, 15, 1, 技术, 后端开发, 乐视, 北京, 本科, 2000, 上市公, 移动互联网 · 文化娱乐
数据仓库建模工程师, 12, 1, 技术, 后端开发, 安个家, 上海, 本科, 50, 初创型, 移动互联网
数据仓库研发工程师, 22, 1, 技术, 后端开发, 链家网, 北京, 本科, 150, 成长型, 移动互联网 · O2O
数据仓库技术专家, 35, 5, 技术, 后端开发, 美团网, 北京, 本科, 2000, 成熟型, 移动互联网 · O2O
高级数据仓库开发工程师, 26, 3, 技术, 后端开发, 美团网, 北京, 本科, 2000, 成熟型, 移动互联网 · O2O
海量数据仓库资深研发工程师, 20, 3, 技术, 后端开发, 天玑, 北京, 硕士, 50, 成长型, 数据服务
数据仓库架构师, 25, 3, 技术, dba, 饿了么, 上海, 本科, 2000, 成熟型, 移动互联网 · 招聘
ETL工程师/数据仓库工程师, 7, 1, 技术, dba, 要出发, 广州, 本科, 500, 成熟型, 电子商务 · 生活服务
数据仓库模型设计, 22, 5, 技术, dba, 佰钧成技术, 佛山, 学历不限, 2000, 成熟型, 企业服务 · 金融
数据仓库中/高级开发人员, 11, 1, 技术, dba, 壕鑫互联, 北京, 本科, 50, 成长型, 移动互联网
数据仓库建模经理, 22, 3, 技术, dba, 返利网, 上海, 本科, 500, 成熟型, 电子商务
(高级）数据仓库开发工程师, 28, 3, 技术, dba, 众安在线, 上海, 本科, 150, 成长型, 金融
数据仓库建模经理, 22, 3, 技术, dba, 返利网, 上海, 本科, 150, 成熟型, 电子商务
大数据—数据仓库工程师（实习生）, 3, 不, 技术, dba, 挖财, 杭州, 学历不限, 500, 成长型, 移动互联网 · 金融
数据仓库架构师, 22, 5, 技术, dba, 融360, 北京, 本科, 500, 成熟型, 移动互联网 · 金融
数据仓库(ETL)工程师, 11, 1, 技术, dba, 艺能科技, 北京, 本科, 15, 初创型, 移动互联网 · 数据服务
数据仓库架构师, 25, 5, 技术, 高端技术职位, 融360, 北京, 本科, 500, 成熟型, 移动互联网 · 金融
大数据（数据仓库）研发工程师, 15, 1, 技术, 后端开发, 安居客, 上海, 本科, 500, 上市公, 移动互联网
数据仓库模型专家/高级工程师, 22, 3, 技术, 后端开发, 美团网, 北京, 本科, 2000, 成熟型, 移动互联网 · O2O
资深数据仓库专家, 30, 3, 技术, 后端开发, 美团网, 北京, 本科, 2000, 成熟型, 移动互联网 · O2O
BI工程师-数据仓库, 20, 3, 技术, dba, 有爱互动, 北京, 本科, 150, 成长型, 游戏
数据仓库架构师, 12, 3, 技术, dba, 龙图信息, 大连, 本科, 50, 上市公, 电子商务 · 企业服务
实时数据仓库开发工程师, 15, 3, 技术, 后端开发, 乐视, 北京, 本科, 2000, 上市公, 移动互联网 · 文化娱乐
高级数据仓库开发工程师, 30, 1, 技术, dba, 美团网, 北京, 学历不限, 2000, 成熟型, 移动互联网 · O2O
数据仓库模型设计工程师, 22, 3, 技术, 后端开发, 汽车之家, 北京, 大专, 2000, 上市公, 移动互联网 · 文化娱乐
数据仓库管理中心文员, 3, 不, 技术, dba, 58快拍, 北京, 大专, 150, 成长型, 移动互联网 · 其他
数据仓库架构师/数据平台经理, 20, 5, 技术, 高端技术职位, 融360, 北京, 本科, 500, 成熟型, 移动互联网 · 金融
数据仓库架构师, 37, 5, 技术, 高端技术职位, 阿里巴巴, 北京, 本科, 2000, 上市公, 移动互联网
实时数据仓库开发工程师, 15, 1, 技术, 后端开发, 乐视, 北京, 本科, 2000, 上市公, 移动互联网 · 文化娱乐
BI工程师-数据仓库方向, 22, 3, 技术, 后端开发, 58赶集集团, 北京, 本科, 2000, 上市公, 移动互联网
中级数据仓库工程师（武汉）4000-8000/月薪, 6, 3, 技术, dba, 天喻通讯, 武汉, 本科, 500, 上市公, 移动互联网
ETL数据仓库开发工程师, 11, 1, 技术, dba, 康爱多, 广州, 大专, 500, 上市公, 移动互联网 · 电子商务
高级数据仓库工程师（武汉）8000-12000/月薪, 10, 5, 技术, dba, 天喻通讯, 武汉, 本科, 500, 上市公, 移动互联网
